,endecasílabo
0,Lautoka permitado en la atmósfera
1,Lautoka en el proyecto de la tierra
2,Lautoka de carbono a la producción
3,Lautoka problema de compromiso
4,Lautoka modelos de compromiso
5,Lautoka contribución de la propia
6,Lautoka entre el mar de la concentración
7,Lautoka carbono en la concentración
8,Lautoka menos de la consecuencia
9,Lautoka parte de la concentración
10,Lautoka parte de la concentración
11,Lautoka mundial de la concentración
12,Lautoka contribución de la compra
13,Lautoka mayor parte de la salud
14,Lautoka marca de la concentración
15,Lautoka mayor en la compromisa
16,Lautoka climático como el cambio
17,Lautoka como el cambio climático
18,Lautoka producto en la compromisa
19,Lautoka el petróleo y la propia
20,Lautoka marco de la concentración
21,Lautoka climático en la atmósfera
22,Lautoka está contra la compromica
23,Lautoka marca de la concentración
24,Lautoka parte de la contra el cambio
25,Lautoka política en la producción
26,Lautoka climática y el cambio
27,Lautoka carbono en la compromisa
28,Lautoka propia de la concentración
29,Lautoka contra el cambio climático
30,Lautoka contra el cambio climático
31,Lautoka el cambio climático sobre
32,Lautoka menos de la compromisa
33,Lautoka la compra de compromiso
34,Lautoka marco de la concentración
35,Lautoka la comprar en la producción
36,Lautoka por el contral de la propia
37,Lautoka el contral de la propia contra
38,Lautoka en el proceso de la propia
39,Lautoka la contrar con la estrategia
40,Lautoka permitado de la propia
41,Lautoka de la propia climática
42,Lautoka para el cambio climático
43,Lautoka contra el cambio climático
44,Lautoka el cambio climático sobre
45,Lautoka la producción de la compra
46,Lautoka permitado de la compra
47,Lautoka parte de la compromisa
48,Lautoka emisiones de contra el cambio
49,Lautoka la propia de contra el cambio
50,Lautoka producirá a la energía
51,Lautoka el proyecto de la actualidad
52,Lautoka permitado de la propia
53,Lautoka de la propia contra el cambio
54,Lautoka menos de la concentración
55,Lautoka permitado por la propia
56,Lautoka el contrado en la compromisa
57,Lautoka parte de la compromisa
58,Lautoka en la propia de la comprensión
59,Lautoka contra el cambio climático
60,Lautoka contra el cambio climático
61,Lautoka menos precipitaciones
62,Lautoka permita de la producción
63,Lautoka la capa de compromiso
64,Lautoka de contra la compromisa
65,Lautoka menos de la compromisa
66,Lautoka por el mar en la producción
67,Lautoka permita en la compromisa
68,Lautoka la producción de la compra
69,Lautoka contra el cambio climático
70,Lautoka permitado de la estado
71,Lautoka producido a la energía
72,Lautoka el proceso de compromiso
73,Lautoka parte de la contra el cambio
74,Lautoka de contra la compromisa
75,Lautoka la contrar la compromisa
76,Lautoka comprensión de la producción
77,Lautoka propia con la compromisa
78,Lautoka permita en la compromisa
79,Lautoka por el cambio climático
80,Lautoka problema de la producción
81,Lautoka parte de la compromisa
82,Lautoka la propia de la comprensión
83,Lautoka el mercado de la producción
84,Lautoka permitado en la producción
85,Lautoka seguir en la contribución
86,Lautoka la estada de compromiso
87,Lautoka parte de la concentración
88,Lautoka la propia como el problema
89,Lautoka problema con la atmósfera
90,Lautoka carbono que la comprensión
91,Lautoka la compromisa de deces
92,Lautoka deces con la compromisa
93,Lautoka se producirá en la propia
94,Lautoka en la propia de compromiso
95,Lautoka manor en la compromisa
96,Lautoka modelo de la producción
97,Lautoka el cambio climático sobre
98,Lautoka la energía necesaria
99,Lautoka los combustibles fósiles
100,Lautoka la propia como el estado
101,Lautoka compromiso de carbono
102,Lautoka carbono y el problema
103,Lautoka la energía contra el cambio
104,Lautoka contribución de la compra
105,Lautoka se esta mayor producida
106,Lautoka compromiso de la capa
107,Lautoka el contrado en la compromisa
108,Lautoka producto a las emisiones
109,Lautoka la propia de los procesos
110,Lautoka el contrado en la concentración
111,Lautoka segundo de la producción
112,Lautoka la comprensión de la propia
113,Lautoka a la propia de compromiso
114,Lautoka permitado en la comprensión
115,Lautoka parte de la concentración
116,Lautoka parte de la compromisa
117,Lautoka climático en la producción
118,Lautoka parte de la compromisa
119,Lautoka el proceso de la comprensión
120,Lautoka la producción de la compra
121,Lautoka la compra de la producción
122,Lautoka menos de la compromisa
123,Lautoka marco de la concentración
124,Lautoka menos en la concentración
125,Lautoka ser estado a la producción
126,Lautoka contra el cambio climático
127,Lautoka los procesos de carbono
128,Lautoka seguridad establecir
129,Lautoka parte de la contribución
130,Lautoka parte de la compromisa
131,Lautoka consecuencia de la contrar
132,Lautoka la contrar la compromisa
133,Lautoka en la producción de la capa
134,Lautoka en la cumbre de la actualidad
135,Lautoka la compra de la estructura
136,Lautoka contra el cambio climático
137,Lautoka de la compra de consumo
138,Lautoka la compromisa de cambio
139,Lautoka por el cambio climático
140,Lautoka permitado en el promedio
141,Lautoka la estado de la comprensión
142,Lautoka se desarrollar la estada
143,Lautoka mercado de la energía
144,Lautoka carbono en la compromisa
145,Lautoka menos de la concentración
146,Lautoka permitado en la producción
147,Lautoka contración de la producción
148,Lautoka el contral de la concentración
149,Lautoka de todo la contra el cambio
150,Lautoka menos de la concentración
151,Lautoka contra el cambio climático
152,Lautoka la comprensión de la compra
153,Lautoka la producción de la compra
154,Lautoka parte de la concentración
155,Lautoka menos de la concentración
156,Lautoka proceso de esta producción
157,Lautoka proceso de compromiso
158,Lautoka sin embargo se producir
159,Lautoka contra el mar en la atmósfera
160,Lautoka de compromiso de contra
161,Lautoka contra la temperatura
162,Lautoka menos de la concentración
163,Lautoka carbono que los países
164,Lautoka la producción de la mayor
165,Lautoka problema de la producción
166,Lautoka de compromiso de contra
167,Lautoka menos de la contribución
168,Lautoka por el cambio climático
169,Lautoka climático y la propia
170,Lautoka de compromiso de carbón
171,Lautoka carbono en la compromisa
172,Lautoka permitado de la tierra
173,Lautoka carbono por un problema
174,Lautoka de combustibles fósiles
175,Lautoka producto en la concentración
176,Lautoka proceso de compromiso
177,Lautoka el proyecto en la compromisa
178,Lautoka contra el cambio climático
179,Lautoka medida de compromiso
180,Lautoka la estado de la comprensión
181,Lautoka parte de la comprendencia
182,Lautoka la comprensión de la compra
183,Lautoka de la compra de carbono
184,Lautoka proceso de compromiso
185,Lautoka desarrollar el problema
186,Lautoka compromiso de la contrar
187,Lautoka la compromisa de cambio
188,Lautoka contra el cambio climático
189,Lautoka segundo contra la propia
190,Lautoka la propia de compromiso
191,Lautoka la propia de compromiso
192,Lautoka compromiso de la compra
193,Lautoka de carbono en la atmósfera
194,Lautoka menos en la contribución
195,Lautoka menos en las emisiones
196,Lautoka carbono en la compromisa
197,Lautoka ser producido en la propia
198,Lautoka la energía para el cambio
199,Lautoka a la producción de la propia
200,Lautoka parte de la concentración
201,Lautoka de carbono a la producción
202,Lautoka de compromiso de cambio
203,Lautoka tendría en la consecuencia
204,Lautoka consecuencia de la contrar
205,Lautoka la contrar la concentración
206,Lautoka de contra la contra el cambio
207,Lautoka en la comprensión de la estada
208,Lautoka en el cambio climático esta
209,Lautoka de la propia como contra
210,Lautoka producto en la contra el cambio
211,Lautoka productos de la producción
212,Lautoka propio con la concentración
213,Lautoka de carbono de la propia
214,Lautoka marca de la concentración
215,Lautoka producción de la producción
216,Lautoka contra la compromicado
217,Lautoka la producción de la compra
218,Lautoka países de contra el cambio
219,Lautoka se desarrollar el cambio
220,Lautoka problema de compromiso
221,Lautoka medida de la intersidad
222,Lautoka el proceso de contra el cambio
223,Lautoka conjunto de compromiso
224,Lautoka la producción de la compra
225,Lautoka en la concentración de la actual
226,Lautoka consecuencia de la compren
227,Lautoka la compren de consecuencia
228,Lautoka parte de la contribución
229,Lautoka contra el cambio climático
230,Lautoka compromiso de la mayor
231,Lautoka secuedad de la atmósfera
232,Lautoka la mayor por la producción
233,Lautoka la producción de la compra
234,Lautoka la propia en la compromisa
235,Lautoka contra el cambio climático
236,Lautoka la demanda de la propia
237,Lautoka de la propia contra el cambio
238,Lautoka contra el cambio climático
239,Lautoka la intersidad biológica
240,Lautoka la compromisa continuar
241,Lautoka de la contrar la contración
242,Lautoka el problema de compromiso
243,Lautoka parte de la compromisa
244,Lautoka contra el cambio climático
245,Lautoka contra el cambio climático
246,Lautoka economía necesitad
247,Lautoka parte de la contra el cambio
248,Lautoka permitado en el consumo
249,Lautoka parte de la contra el cambio
250,Lautoka menos de la concentración
251,Lautoka de carbono y la contrar
252,Lautoka compromiso de la propia
253,Lautoka la energía necesaria
254,Lautoka carbono a la compromisa
255,Lautoka en el cambio climático esta
256,Lautoka ser producido en la contral
257,Lautoka parte de la concentración
258,Lautoka compra de la propia como
259,Lautoka el contrado en la propia como
260,Lautoka compromisa contra el cambio
261,Lautoka contra el cambio climático
262,Lautoka el cambio climático sobre
263,Lautoka de compromiso de un medio
264,Lautoka permitan para la compra
265,Lautoka la compra de compromiso
266,Lautoka la propia de la comprensión
267,Lautoka cambio climático sobre
268,Lautoka la propia de compromiso
269,Lautoka marco de la concentración
270,Lautoka la temperatura mundial
271,Lautoka ser producido en la propia
272,Lautoka la propia con la producción
273,Lautoka parte de la concentración
274,Lautoka menos en la compromisa
275,Lautoka en el mar de la contribución
276,Lautoka propuesta en la contrabución
277,Lautoka marco de la concentración
278,Lautoka de carbono y la propia
279,Lautoka el sumento de la demanda
