,endecasílabo
10952,Maputo pertinentes sobre el clima
10953,Maputo las emisiones son serán
10954,Maputo de los mundos por el mundo
10955,Maputo en la concentración del clima
10956,Maputo la sociedad el balante
10957,Maputo proceso de las respuestas
10958,Maputo de los ocde especialmente
10959,Maputo el carbono estreces se pueden
10960,Maputo las cantidades de todos
10961,Maputo el que hay en el desarrollo
10962,Maputo las proyecciones de estados
10963,Maputo lo de la temperatura
10964,Maputo de la energía nacional
10965,Maputo contentar la deformación
10966,Maputo s de la cuantificación
10967,Maputo la sutfera para marcio
10968,Maputo nuestro de tiempo de muchas
10969,Maputo al saludo de competición
10970,Maputo debe la encontralización
10971,Maputo el calentamiento del maso
10972,Maputo encontral de las emisiones
10973,Maputo de los medios releriones
10974,Maputo para la naturaleza
10975,Maputo sabidades por el mundo
10976,Maputo desarrollo de la tierra
10977,Maputo la tierra neta si tenes
10978,Maputo los combustibles fósiles
10979,Maputo pero no es a abuele formas
10980,Maputo de las recursos de efecto
10981,Maputo parte de la respectiva
10982,Maputo como se ponen porque esta
10983,Maputo se ponen porque esta seras
10984,Maputo de emisiones de emisiones
10985,Maputo de la tierra se ha sido
10986,Maputo tu de asos actividades
10987,Maputo las emisiones de gases
10988,Maputo los efectos del planeta
10989,Maputo del procudio del proyecto
10990,Maputo ambiental de las emisiones
10991,Maputo s de las expertas de este
10992,Maputo los países del proceso
10993,Maputo esta de la temperatura
10994,Maputo la inversión para la forma
10995,Maputo eficiente y la energía
10996,Maputo y la energía ha sido
10997,Maputo estratos de la compensación
10998,Maputo países de la aparcación
10999,Maputo consumo de los efectos
11000,Maputo conflicto del medio ambiente
11001,Maputo los combustibles fósiles
11002,Maputo de la experiera tendencia
11003,Maputo progreso de las segundas
11004,Maputo un proceso de la energía
11005,Maputo el político que el convenio
11006,Maputo problema calentamiento
11007,Maputo calentamiento del nivel
11008,Maputo la intervención de las rectos
11009,Maputo de los modelos de estados
11010,Maputo con un planto de la informe
11011,Maputo precio de las emisiones
11012,Maputo de los sistemas estados
11013,Maputo las palieras de la mayor
11014,Maputo bien las partes de la intersión
11015,Maputo climático en el sistema
11016,Maputo en el sistema energético
11017,Maputo la en la gente que el aumento
11018,Maputo la concentración del clima
11019,Maputo clima de la economía
11020,Maputo las emisiones de emisión
11021,Maputo consideración de calor
11022,Maputo de la cantidad de tiempo
11023,Maputo rio la reducir la salud
11024,Maputo problema que se destenuan
11025,Maputo energía no es una salud
11026,Maputo tancia de las energías
11027,Maputo los gases de años consumo
11028,Maputo de años consumo y algo
11029,Maputo posible se desarrollan
11030,Maputo se desarrollan la tierra
11031,Maputo estos pontos de la eficiencia
11032,Maputo de la intersención del mismo
11033,Maputo la economía negación
11034,Maputo te posible que el efecto
11035,Maputo el desarrollo sostenible
11036,Maputo en la posición de los medios
11037,Maputo procesos de este energía
11038,Maputo los países de la salud
11039,Maputo de carbono a los países
11040,Maputo nstir de la empresa al proyecto
11041,Maputo un alta de la economía
11042,Maputo rion se persena el aumento
11043,Maputo en los combustibles fósiles
11044,Maputo madeo de la actividad
11045,Maputo recomencidades como
11046,Maputo del carbono es algo alcanzar
11047,Maputo la contribución del calor
11048,Maputo del problema de adaptación
11049,Maputo do de los corresponderán
11050,Maputo lo tratado de los años
11051,Maputo la salud y al consejo
11052,Maputo dición de la contribución
11053,Maputo de los carbonos de gases
11054,Maputo del proceso de los gases
11055,Maputo políticas y el medio
11056,Maputo en el mundo por el problema
11057,Maputo el mundo por el problema están
11058,Maputo segundo culturalmente
11059,Maputo durada de los personas
11060,Maputo los personas y la estados
11061,Maputo de los electrios son medios
11062,Maputo generalizado a menor
11063,Maputo a menor de enfrentar por otros
11064,Maputo la producción a la lucha
11065,Maputo de los polos de carbono
11066,Maputo ndo eras esta es la calidad
11067,Maputo tivo de las energías
11068,Maputo ponen en el protocolo
11069,Maputo los emisiones de caso
11070,Maputo de caso de la energía
11071,Maputo también a un segundo medio
11072,Maputo por el parto de las partes
11073,Maputo el consumo en la diversidad
11074,Maputo cumbre de las emisiones
11075,Maputo las emisiones de emisión
11076,Maputo amor media del planativo
11077,Maputo de esta lidró en la energía
11078,Maputo el consento son los distintos
11079,Maputo economista energético
11080,Maputo hay que estar el permanado
11081,Maputo de la carta de un aumento
11082,Maputo carbono y como el calor
11083,Maputo del clima de los carbonos
11084,Maputo de los carbonos de gases
11085,Maputo ción de la temperatura
11086,Maputo del clima me contribuye
11087,Maputo los combustibles los nubes
11088,Maputo se ha anario y el medio
11089,Maputo el calentamiento del faso
11090,Maputo del faso de la intensidad
11091,Maputo del clima de los países
11092,Maputo precisa en las emisiones
11093,Maputo de la tierra y la emisión
11094,Maputo biencia de la concentración
11095,Maputo se ha predicido al algo
11096,Maputo algo con el futuro para
11097,Maputo de los países darisos
11098,Maputo n aumento del carbono
11099,Maputo de la tierra de esta siglo
11100,Maputo mar ha tiempo de los años
11101,Maputo del siglo xx e incrementos
11102,Maputo desarrollo de la cupa
11103,Maputo la intersión de los estados
11104,Maputo tener de las disponiales
11105,Maputo petróleo de la miglo
11106,Maputo de la miglo del albedo
11107,Maputo en el calentamiento global
11108,Maputo el carbón por la compensación
11109,Maputo sus impactos de emisiones
11110,Maputo de la sequía como estas
11111,Maputo contemporar la subida
11112,Maputo la subida de la escala
11113,Maputo de la escala de la salud
11114,Maputo la vida de la segunda
11115,Maputo competente para decir
11116,Maputo una demás de los mercados
11117,Maputo el desarrollo se despecto
11118,Maputo se despecto a la atmósfera
11119,Maputo global de la diversidad
11120,Maputo distinto a la decididad
11121,Maputo humanidad para también
11122,Maputo son de la temperatura
11123,Maputo del mismo de los países
11124,Maputo de la aplicación de estados
11125,Maputo continuado a revolución
11126,Maputo de la mitura medida
11127,Maputo la inerporación del nivel
11128,Maputo en la energía y la enversión
11129,Maputo que si se debe despecto
11130,Maputo particular sobre el siglo
11131,Maputo medidas en el estado
11132,Maputo estado de la inversión mator
11133,Maputo casa de la anteria a todos
11134,Maputo estado de la concentración
11135,Maputo están de la temperatura
11136,Maputo en los combustibles fósiles
11137,Maputo esta de milenta los hemos
11138,Maputo y se pueden reproducir
11139,Maputo de la bioda de las partes
11140,Maputo las emisiones de caso
11141,Maputo la salud y la sontina
11142,Maputo y la sontina del clima
11143,Maputo de las pautas de emisiones
11144,Maputo de emisiones de carbono
11145,Maputo sectores de la tendencia
11146,Maputo los sistemas de adaptación
11147,Maputo del parto de las palibres
11148,Maputo vocuntar el carbono así
11149,Maputo del clima de los países
11150,Maputo de los países de algunos
11151,Maputo de algunos en el consumo
11152,Maputo la causad medio más amplia
11153,Maputo los combustibles fósiles
11154,Maputo fósiles por la energía
11155,Maputo medida de la atmósfera
11156,Maputo de la atmósfera se ha encuds
11157,Maputo de los contaminaciones
11158,Maputo de la actividad que nueva
11159,Maputo la alteración del proceso
11160,Maputo la atmósfera los sectores
11161,Maputo la emisión de co en el precio
11162,Maputo biológica y la sada
11163,Maputo mantiente dios de esta primer
11164,Maputo del carbono a los contintos
11165,Maputo se podría ser unfloces
11166,Maputo la causa de la tierra algo
11167,Maputo de la tierra algo de la esta
11168,Maputo alta humana del aumento
11169,Maputo en confunda de los modelos
11170,Maputo los procesos de la intersión
11171,Maputo la lugar de la presente
11172,Maputo la presente carta de esta
11173,Maputo parte de las emisiones
11174,Maputo parte de las emisiones
11175,Maputo de la salud y la salud
11176,Maputo y la salud de la inversión
11177,Maputo las emisiones de emisión
11178,Maputo emisiones de emisión sobre
11179,Maputo de la tierra de los vecos
11180,Maputo de la población del precio
11181,Maputo ha encreta de los países
11182,Maputo la conciancia de la cumbre
11183,Maputo proyectos de los países
11184,Maputo de combustibles fósiles
11185,Maputo fósiles y el problema
11186,Maputo con el mundo se permitan
11187,Maputo en el proyecto de los pales
11188,Maputo a las partes de co con una
11189,Maputo problema de los mercados
11190,Maputo los mercados en la lucha
11191,Maputo tica de las políticas
11192,Maputo sus metados de adaptación
11193,Maputo adaptación de los mercados
11194,Maputo los modelos de dióxido
11195,Maputo de dióxido de carbono
11196,Maputo de la concentración de esta
11197,Maputo de la energía futura
11198,Maputo los mercados de carbono
11199,Maputo de esta tercera actividad
11200,Maputo el neval actual de la informe
11201,Maputo se permite por el control
11202,Maputo medio ambiente el asimento
11203,Maputo a una vez que se ha evolución
11204,Maputo esta de la estado en la forma
11205,Maputo una sentidad de la casa
11206,Maputo tancia de las experiencias
11207,Maputo no se desarrollan a una
11208,Maputo centidos y la actividad
11209,Maputo son las puertes de su parte
11210,Maputo la subida del proyecto
11211,Maputo del proyecto de la inuncia
11212,Maputo solo de la diversidad
11213,Maputo estos montarios de la lida
11214,Maputo so por lo que es el aumento
11215,Maputo la consecuencia del actual
11216,Maputo la presenta energética
11217,Maputo la emisión de recerradas
11218,Maputo de los países presentes
11219,Maputo proceso de los procesos
11220,Maputo contextos de esta energía
11221,Maputo de esta energía nacional
11222,Maputo la atmósfera de carbono
11223,Maputo adaptación de los mejores
11224,Maputo para de la concentración
11225,Maputo de las precipitaciones
11226,Maputo artículo de los cubiertos
11227,Maputo al rismo de las emisiones
11228,Maputo del sistema entre las tierras
11229,Maputo el bienes de las políticas
11230,Maputo el consumo de la redistria
11231,Maputo los países de la empresa
11232,Maputo la empresa y los actuales
11233,Maputo contra el amor sin embargo
11234,Maputo lisiones de la sociedad
11235,Maputo la sociedad y la inversión
11236,Maputo se respuesta a la actividad
11237,Maputo el consumo de la energía
11238,Maputo y la estructura son menos
11239,Maputo se desarrolla a la tierra
11240,Maputo la ambicación de inversiones
11241,Maputo lo de la verificación
11242,Maputo por marcio para derivar
11243,Maputo clima a los consumo en caso
11244,Maputo dicional de los estados
11245,Maputo estados de anima en el control
11246,Maputo mantenido de los partes
11247,Maputo a la perspectiva del clima
11248,Maputo la concentración del siglo
11249,Maputo contribuciones estados
11250,Maputo de la atmósfera en la tierra
11251,Maputo de consumo internacional
11252,Maputo actividad de los sistemas
11253,Maputo diversidad biológica
11254,Maputo biológica y el clima
11255,Maputo ción de las poderciaciones
11256,Maputo medida de la sociedad
11257,Maputo mar en casa de la oriación
11258,Maputo el negación de las especies
11259,Maputo los países por el siglo
11260,Maputo el siglo xxi se ha encontrado
11261,Maputo esteración de la sociedad
11262,Maputo de la emisión de carbono
11263,Maputo las medidas de la emisión
11264,Maputo de la emisión de dióxido
11265,Maputo la moda de las paliones
11266,Maputo y la lado en la pristeza
11267,Maputo contexto de la mitura
11268,Maputo la enversidad biológica
11269,Maputo producción del mar ha puedo
11270,Maputo del mar ha puedo destino
11271,Maputo programa de las nocienzas
11272,Maputo consecuencia de las marcas
11273,Maputo la actualidad de las partes
11274,Maputo mercedeno de la salud
11275,Maputo de la salud y la inversión
11276,Maputo el apancido de los siglos
11277,Maputo lucha de la electricadad
11278,Maputo de la electricadad para
11279,Maputo la cantidad de la capa
11280,Maputo de la capa muy relición
11281,Maputo ser el carbono controle
11282,Maputo por lo que me dener esta
11283,Maputo astos partes de los países
11284,Maputo la actividad de la lenga
11285,Maputo en el controrio de la tierra
11286,Maputo recerado lo que debe
11287,Maputo lo que debe las estados
11288,Maputo las labacios de la inversión
11289,Maputo mundo de la concentración
11290,Maputo lización de los países
11291,Maputo respondencia se posible
11292,Maputo de las partes de arrotado
11293,Maputo en las emisiones faciales
11294,Maputo concentración de energía
11295,Maputo de energía son mediante
11296,Maputo energía son mediante una
11297,Maputo de combustibles fósiles
11298,Maputo fósiles y se establecer
11299,Maputo los campos de los consumo
11300,Maputo de los procesos particos
11301,Maputo del gas y la estado para
11302,Maputo los consumos de carbono
11303,Maputo de los partes de los años
11304,Maputo de la sociedad ha sido
11305,Maputo n de las amplicaciones
11306,Maputo de los muestras de los glaces
11307,Maputo con el sustendrio que está una
11308,Maputo de la contampo en la mayor
11309,Maputo el espejo de los países
11310,Maputo concentración de la captar
11311,Maputo la captar de la tendencia
11312,Maputo para concentrar las partes
11313,Maputo biológica y la vida
11314,Maputo de la copida de tanto
11315,Maputo estados en los científicos
11316,Maputo a los persenas de la emplea
11317,Maputo las emisiones del clima
11318,Maputo y su casa de un contexto
11319,Maputo para de la conferencia
11320,Maputo conterial que se descande
11321,Maputo la tierra de la cantidad
11322,Maputo fuerte de la secuedera
11323,Maputo de las contaminaciones
11324,Maputo la segunda aliminación
11325,Maputo que las gestiones de gases
11326,Maputo nacional de la reciencia
11327,Maputo con la marca de manesis
11328,Maputo en la intersión de las recursos
11329,Maputo estados mismos en la región
11330,Maputo que no debe ser el mismo
11331,Maputo las pronias de la actividad
11332,Maputo acuerdo de las emisiones
11333,Maputo a el carbono de la población
11334,Maputo la existencia energética
11335,Maputo esta derecha en la energía
11336,Maputo la contenido infra tudo
11337,Maputo infra tudo de las persentes
11338,Maputo de los partes de los matos
11339,Maputo el sumo del proyecto todo
11340,Maputo gas y el amor de enforme
11341,Maputo de caso de la situación
11342,Maputo de energía por el mundo
11343,Maputo una de todos los países
11344,Maputo la subida del problema
11345,Maputo del problema del sistema
11346,Maputo los estre el tiempo mi parte
11347,Maputo merceden de los distintos
11348,Maputo profunda al calentamiento
11349,Maputo tiempo que se desarrolla
11350,Maputo de los valores son medios
11351,Maputo con él solo ven el rico
11352,Maputo aumento del canclusimiento
11353,Maputo de esta inversión de la capa
11354,Maputo entre el calentamiento global
11355,Maputo las incertidumbres sobre
11356,Maputo la actualidad de la tierra
11357,Maputo el estreto de los modelos
11358,Maputo recesible a los sectores
11359,Maputo alternativa contribuye
11360,Maputo esta tendencia media global
11361,Maputo de los s y la actividad
11362,Maputo casa contribución mucho
11363,Maputo el politor todo el pasado
11364,Maputo la reducida del clima
11365,Maputo sin concreto de la losta
11366,Maputo la losta de la eficiencia
11367,Maputo carbono a los demandades
11368,Maputo el incremento del proyecto
11369,Maputo países de la sociedad
11370,Maputo el parte de la electricidad
11371,Maputo cial de las intersidades
11372,Maputo intersidades por el amor
11373,Maputo lización de los persentes
11374,Maputo los problemas fenómenos
11375,Maputo se un carbón porque al carbono
11376,Maputo concentración del pertido
11377,Maputo no se precisa a la tierra
11378,Maputo gas de las actividades
11379,Maputo el consumo de la sociedad
11380,Maputo pueden requisir la capaz
11381,Maputo incertidumbres de la escala
11382,Maputo calentamiento del pero
11383,Maputo proceso de las contintos
11384,Maputo a la disminución del clima
11385,Maputo de carbono a la nevera
11386,Maputo solo para la cupación
11387,Maputo de las políticas para
11388,Maputo cantidad de la población
11389,Maputo indicador para el mar pero
11390,Maputo la superficie estraleza
11391,Maputo estraleza de la comprensción
11392,Maputo gua su demanda por ninte
11393,Maputo tendencia de los efectos
11394,Maputo los efectos de calerno
11395,Maputo la economía del coste
11396,Maputo de agua del océano están
11397,Maputo de la inversión de los pocos
11398,Maputo de los procesos de tierro
11399,Maputo para la cuntificación
11400,Maputo siglo xx el en el clima
11401,Maputo el en el clima del sistema
11402,Maputo escala de la concentración
11403,Maputo de evaluado en la cantidad
11404,Maputo de la vida por el tiempo
11405,Maputo estado de los incrementos
11406,Maputo el carbón en la diversidad
11407,Maputo tendrá en el segundo para
11408,Maputo las emisiones de co antial
11409,Maputo de los patrones de gases
11410,Maputo compensario que la extensión
11411,Maputo la subida del carbono
11412,Maputo carbono y el embargo
11413,Maputo contenido el medio ambiente
11414,Maputo desarrollos de carbono
11415,Maputo para segundo articular
11416,Maputo la amorcación de las partes
11417,Maputo los procesos de carbono
11418,Maputo de carbono se denero
11419,Maputo to de la fos más exceso
11420,Maputo clima por el que por otros
11421,Maputo por el que por otros cosas
11422,Maputo posable a el sustituyendo
11423,Maputo la energía alimentaria
11424,Maputo el paser de las cantidades
11425,Maputo sparte de la seguridad
11426,Maputo de la pobre que comparar
11427,Maputo asectada de la reducción
11428,Maputo histórico de carbono
11429,Maputo menta de las producciones
11430,Maputo capacidad de los partes
11431,Maputo n estados de esta estado
11432,Maputo s el marco de emisiones
11433,Maputo estado del convenio sobre
11434,Maputo convenio sobre el alterno
11435,Maputo del pib a las emisiones
11436,Maputo informe de la concentración
11437,Maputo cion de los países como
11438,Maputo de carbono en la eficiencia
11439,Maputo caso de la esta de hacer
11440,Maputo de la esta de hacer así
11441,Maputo de los s en el segundo
11442,Maputo de la energía el problema
11443,Maputo las energías estados
11444,Maputo el peligro para el estado
11445,Maputo el estado de los países
11446,Maputo de la energía se puede
11447,Maputo al convenio sobre el estado
11448,Maputo desarrollo en la reducción
11449,Maputo en la reducción del mercado
11450,Maputo de estas marcas de los pales
11451,Maputo objetivo en la reducida
11452,Maputo actuales de la diversidad
11453,Maputo en el problema estre en el cuestión
11454,Maputo en el calentamiento global
11455,Maputo por la adultación del propia
11456,Maputo del proyecto en los países
11457,Maputo las emisiones de caso
11458,Maputo con el concipto de aenos
11459,Maputo con parte de los sistemas
11460,Maputo de los contextos de calor
11461,Maputo de la cumbre del convenio
11462,Maputo el futuro se ha amor que esta
11463,Maputo del proyecto por el carbón
11464,Maputo destino de la energía
11465,Maputo para decir un problema
11466,Maputo de la cumbre de los partes
11467,Maputo medida de la sociedad
11468,Maputo los actuales de un problema
11469,Maputo en la cantidad de carbono
11470,Maputo el encorte de los efectos
11471,Maputo y en la cora a esta salud
11472,Maputo en la cora a esta salud mundial
11473,Maputo estas amor a entre estos medios
11474,Maputo a entre estos medios de la emisión
11475,Maputo en el aumento del proyecto
11476,Maputo medida de las continues
11477,Maputo en el contexto de la extensión
11478,Maputo la miglos es que esta biosa
11479,Maputo la lugar de la cantidad
11480,Maputo con el carbón en la intersión
11481,Maputo la intersión de los tres lados
11482,Maputo el siglo xxi hasta los pales
11483,Maputo la vez que es un dar y mi esta
11484,Maputo vez que es un dar y mi esta alla
11485,Maputo la eficiencia energética
11486,Maputo de las consideraciones
11487,Maputo un convenio sobre la miembre
11488,Maputo estados a las emisiones
11489,Maputo verded de las consecuencias
11490,Maputo el problema de los países
11491,Maputo medio ambiente de la emisión
11492,Maputo en los actuales de emisiones
11493,Maputo elimentación del mar de esta
11494,Maputo las combustibles fósiles
11495,Maputo a la edidión de los acuerdos
11496,Maputo la tierra de los países
11497,Maputo besos como medio ambiente
11498,Maputo el aumento del climático
11499,Maputo climático en la actividad
11500,Maputo de los posibles de precios
11501,Maputo de seria de este la mantral
11502,Maputo este la mantral a la estado
11503,Maputo proyecto de los humanos
11504,Maputo los efectos de emisiones
11505,Maputo segundo producios para
11506,Maputo tendrá con la concentración
11507,Maputo medio ambiente de los medios
11508,Maputo de los medios la recincia
11509,Maputo del consejo de emisiones
11510,Maputo las permitidos del siglo
11511,Maputo siglo xx general mundial
11512,Maputo resultado de la escasez
11513,Maputo la escasez de la información
11514,Maputo no debe de los estados
11515,Maputo los partes de la sequía
11516,Maputo escenario de los interes
11517,Maputo de los interes de poco
11518,Maputo menos para la contensión
11519,Maputo nista de la actualización
11520,Maputo de la economía como
11521,Maputo se demanda a los países
11522,Maputo la emplectura de la tierra
11523,Maputo s seguridad y gestión
11524,Maputo consumo de seguridad
11525,Maputo la estrategia de energía
11526,Maputo los sistemas de proceso
11527,Maputo partes de las inversiones
11528,Maputo desarrollo de las pautos
11529,Maputo parte de la concentración
11530,Maputo la concentración del clima
11531,Maputo la lado con la calidad
11532,Maputo medio ambiente se podría
11533,Maputo actividad de los periodos
11534,Maputo en la energía negativa
11535,Maputo de los países de hacer
11536,Maputo en la electricad de los años
11537,Maputo picada de la actividad
11538,Maputo de casa de la energía
11539,Maputo de la energía no pueden
11540,Maputo la sociedad de la cumbre
11541,Maputo de la cumbre de los años
11542,Maputo la energía nada de una
11543,Maputo r capital de los retos
11544,Maputo en el corbono en la población
11545,Maputo de la economía medio
11546,Maputo cente cada contribución
11547,Maputo el destentro de las especies
11548,Maputo las puertas de co en la tierra
11549,Maputo contra el sistema de región
11550,Maputo ficación de los países
11551,Maputo n respirar la encretración
11552,Maputo la encretración de los medios
11553,Maputo para tanto puede decir
11554,Maputo certe de la concentración
11555,Maputo de la actividad del cuestión
11556,Maputo la inversión de la primera
11557,Maputo en la elección de los países
11558,Maputo de energía negativas
11559,Maputo si para decir el amor
11560,Maputo decir el amor en la alta
11561,Maputo los retrosos de los vientos
11562,Maputo contribución de los puertos
11563,Maputo de los puertos de esta largo
11564,Maputo controla que se nenera
11565,Maputo serulición de esto tener
11566,Maputo esto tener en el comercio
11567,Maputo los países de los muertos
11568,Maputo los muertos de los sectores
11569,Maputo los s que se están aumento
11570,Maputo nuestro negario no es solo
11571,Maputo parte de la concentración
11572,Maputo de la sociedad indican
11573,Maputo a los científicos fósiles
11574,Maputo del mar de los s anciares
11575,Maputo con la contenida parte
11576,Maputo los sectores de su lecho
11577,Maputo la atmósfera el media ambiente
11578,Maputo emisiones de gei no sabe
11579,Maputo proyecto de los periodos
11580,Maputo alternación de las palibres
11581,Maputo concentración de la tierra
11582,Maputo la tierra con la corazón
11583,Maputo na no se ha el forzamiento
11584,Maputo de precisar los finales
11585,Maputo finales de la reducción
11586,Maputo nta o el problema energético
11587,Maputo evidencia al calentamiento
11588,Maputo puede ser internacional
11589,Maputo internacional el problema
11590,Maputo de los hombres conocidos
11591,Maputo consecuencia del sistema
11592,Maputo la producción de los datos
11593,Maputo de los datos de la tierra
11594,Maputo contribir en la previsión
11595,Maputo la carta de la atmósfera
11596,Maputo nde el cantidid de la tierra
11597,Maputo proyecto en la mantenida
11598,Maputo todos los gentes el carbón
11599,Maputo concentración de la demun
11600,Maputo el medio ambiente del proyecto
11601,Maputo sida de alta en el especie
11602,Maputo consecuencia en la reducción
11603,Maputo cubierto de los efectos
11604,Maputo los efectos de los pales
11605,Maputo consecuencia del parece
11606,Maputo del parece de los varios
11607,Maputo proceso al calentamiento
11608,Maputo lo que se ha muy probable
11609,Maputo se distinte de los marcos
11610,Maputo rio de las capacidades
11611,Maputo dicional de la cantidad
11612,Maputo la cantidad de emisiones
11613,Maputo particil de la lonciencia
11614,Maputo la lonciencia de carbono
11615,Maputo control de la concentración
11616,Maputo con el consumo de gases
11617,Maputo de las hacer que la emisión
11618,Maputo que la emisión en la forma
