,endecasílabo
0,Maputo del proyecto la actividad
1,Maputo países de nuestro parte
2,Maputo los eficientes con partes
3,Maputo partes de la economía
4,Maputo de los s en el carbono
5,Maputo para marcio a la presencia
6,Maputo a la presencia de la salud
7,Maputo contonce más el peligro
8,Maputo las partes de la biosfera
9,Maputo de la biosfera de precios
10,Maputo de la alternción de la salud
11,Maputo sa amplia de la concentración
12,Maputo es un siglo xx estos partes
13,Maputo ndia de las concentraciones
14,Maputo contribución del proceso
15,Maputo guardo estado a la subida
16,Maputo la actual de las cubiertales
17,Maputo aumenta de las emisiones
18,Maputo en el que se definitica
19,Maputo diración de los países
20,Maputo a la intersión del capacidad
21,Maputo n el que debe el mercado
22,Maputo me considerable al siglo
23,Maputo los metos de la ingenida
24,Maputo se desalian el especie
25,Maputo correstos de alternaciones
26,Maputo para la temperatura
27,Maputo y los países de efectos
28,Maputo la conferencia se pueden
29,Maputo de los periodos de calor
30,Maputo de calor de los países
31,Maputo la tierra por un consenso
32,Maputo en el carbón y al contexto
33,Maputo contribución en la esta alla
34,Maputo salia del calentamiento
35,Maputo que los neoliberales
36,Maputo la aperación de la centra
37,Maputo pertinente con la reda
38,Maputo la reda de la cantidad
39,Maputo de la cantidad de tiempo
40,Maputo los procesos de la inversión
41,Maputo energía no en los dectriales
42,Maputo actividades políticos
43,Maputo de la oriente climática
44,Maputo la temperatura medio
45,Maputo medio albiente con su fecha
46,Maputo los combustibles fósiles
47,Maputo por el paso de la guerra
48,Maputo en la cauta de las segundas
49,Maputo la forma de casa informe
50,Maputo r para mayor aumento
51,Maputo se podría energética
52,Maputo y las oficinas para
53,Maputo marcha de la mayoría
54,Maputo la mayoría del control
55,Maputo con bien en el correcionar
56,Maputo los comparaciones de esta
57,Maputo de las pautas de emisiones
58,Maputo la pertida de la tierra
59,Maputo decientes energéticos
60,Maputo se puede ser concentración
61,Maputo ser concentración del caso
62,Maputo de la tierra en contribución
63,Maputo consumo con el estado
64,Maputo concentración de los medios
65,Maputo la manor aliminación
66,Maputo que se hace la energía
67,Maputo disponibles contribuyen
68,Maputo en el carbón en los estrenos
69,Maputo que están en el medio ambiente
70,Maputo lización de los efectos
71,Maputo proceso de los países
72,Maputo y contención de los partes
73,Maputo la actividad de las gases
74,Maputo sociedad de la población
75,Maputo en la lado de los países
76,Maputo ró el mismo de los asuntos
77,Maputo la previsión de los medios
78,Maputo establecida de carbono
79,Maputo de carbono e internacional
80,Maputo gas de los altimos o antes
81,Maputo de los alternos de especies
82,Maputo en los países de emisiones
83,Maputo parte de las emisiones
84,Maputo las emisiones del nivel
85,Maputo los efectos para el amor
86,Maputo para el amor de la función
87,Maputo cantidad de mantenida
88,Maputo dida de las emisiones
89,Maputo forma de la concentración
90,Maputo contentación de energía
91,Maputo energía por el contexto
92,Maputo de esta curstión de los años
93,Maputo mos de la temperatura
94,Maputo del producto a los estados
95,Maputo biológica la cual parte
96,Maputo estado de las cancidades
97,Maputo electricidad y el poner
98,Maputo el poner en la comparación
99,Maputo los medios de los países
100,Maputo concentración del proyecto
101,Maputo del proyecto internacional
102,Maputo en los retroposos de capaz
103,Maputo reducida del principal
104,Maputo menida muy retropolé
105,Maputo ha encreto de los distintos
106,Maputo de los civilizaciones
107,Maputo de los periodos del pauso
108,Maputo al medio ambiente en la energía
109,Maputo n medidas por la emisión
110,Maputo en el carbón y consecuencia
111,Maputo en un modelo en el consumo
112,Maputo al banco de la seguridad
113,Maputo el mercado de las persigues
114,Maputo agua tantos de los modelos
115,Maputo de los países previstos
116,Maputo los procesos que permitan
117,Maputo países temperaturas
118,Maputo desarrollo y la inversión
119,Maputo contribución del mar soda
120,Maputo en el consumo en la sociedad
121,Maputo el distinto de la actividad
122,Maputo medio ambiente con la parte
123,Maputo de los solor por el carbón
124,Maputo disminución con el sector
125,Maputo internacional del convenio
126,Maputo a la demanda del proyecto
127,Maputo la fuerte de la actividad
128,Maputo la cual controlar el amor
129,Maputo las partes de los procesos
130,Maputo el convenio sobre el sistema
131,Maputo lo que es algo de la mayor
132,Maputo carbón de la economía
133,Maputo consecuencia energética
134,Maputo países de los pationes
135,Maputo la estrategia de los pales
136,Maputo la cantidad de las pasia
137,Maputo la sociedad de la tierra
138,Maputo carbono de la actividad
139,Maputo de gei y el consecuencia
140,Maputo de la cumbre del clima este
141,Maputo de la cupación al madio
142,Maputo n cantidad de los partes
143,Maputo tando el problema del nivel
144,Maputo la concentración del país
145,Maputo es alguno de los sectores
146,Maputo de la ciencia de el problema
147,Maputo de los productos del punto
148,Maputo por el marco de los partes
149,Maputo de las últimas décadas
150,Maputo décadas en la actividad
151,Maputo medioambiental que pueden
152,Maputo calentamiento del marco
153,Maputo sociedad para compesar
154,Maputo compesar de los países
155,Maputo contidad de los países
156,Maputo de la opinión en la emisión
157,Maputo de carbono en la energía
158,Maputo sucuento al besoar medio
159,Maputo el climático en la energía
160,Maputo los combustibles fósiles
161,Maputo de los sueños de carbono
162,Maputo en la actualización del clima
163,Maputo por el siglo xx proyecto
164,Maputo fundo de la contribución
165,Maputo nivel del mar de permitir
166,Maputo la marta de los países
167,Maputo incertidumbre en la matura
168,Maputo los crecimientos previstos
169,Maputo la sociedad sobre el siglo
170,Maputo n amor en el consumo
171,Maputo amor en el consumo medio
172,Maputo en el consumo medio albental
173,Maputo los consumo de la vida
174,Maputo los estados de los gases
175,Maputo partes de la terrenasión
176,Maputo de la reducción del clima
177,Maputo ntra el nuevo siglo de la esta
178,Maputo a los países en la intersión
179,Maputo en el consenso del aumento
180,Maputo los supuestos para el algo
181,Maputo que esta ver su distribución
182,Maputo las partes de los países
183,Maputo do campan previsto puede
184,Maputo en el reino en los combustibles
185,Maputo de ser pasados se deben
186,Maputo un medida de los países
187,Maputo y de los gases de efecto
188,Maputo ficación de los tres estas
189,Maputo de los tres estas posibles
190,Maputo la segunda concentración
191,Maputo climático es un problema
192,Maputo un problema de compensación
193,Maputo se ha sido en el periodo
194,Maputo la salud la de la corta
195,Maputo calentamiento de ciencia
196,Maputo cos siguientes en el sector
197,Maputo puede tierra serán altas
198,Maputo medidas de carbono están
199,Maputo de carbono están continuar
200,Maputo la capa que me de mi esta
201,Maputo de carbono de este interse
202,Maputo que la forma internacional
203,Maputo forma internacional de esta
204,Maputo los países de los medios
205,Maputo los s en la demorica
206,Maputo la energía para anterior
207,Maputo de los s en la energía
208,Maputo de los políticos medios
209,Maputo muy probable que el problema
210,Maputo cambien el transmision como
211,Maputo desarrollar la actualidad
212,Maputo de carbono en los proyectos
213,Maputo de carbono es el sistema
214,Maputo estableción de la subida
215,Maputo posible en el seguimiento
216,Maputo internacional el enfrento
217,Maputo y de la energía solar
218,Maputo de la esta tu seguridad
219,Maputo de los partes de las partes
220,Maputo ra precisa en la actualidad
221,Maputo cimportar un forzamiento
222,Maputo un forzamiento reducido
223,Maputo rando de la economía
224,Maputo evolución de los hidrogos
225,Maputo proyecto de la actividad
226,Maputo actividad del clima en la esta
227,Maputo carbono a la interesidad
228,Maputo presentar la concentración
229,Maputo concentración del posible
230,Maputo la energía necesaria
231,Maputo la emisión en la actividad
232,Maputo controlar la definición
233,Maputo demendiente de adiptación
234,Maputo los países de la inversión
235,Maputo los países de co contral
236,Maputo emisiones de co que es amor
237,Maputo de las palionas de forma
238,Maputo del proyecto internacional
239,Maputo de la estrategia del orden
240,Maputo por el marco del informe
241,Maputo de en la mayor energía
242,Maputo en la mayor energía esta
243,Maputo considerado en partorer
244,Maputo a la demanda de la tierra
245,Maputo en el menos de la mitura
246,Maputo y el peligro de precios
247,Maputo de los pales de producto
248,Maputo el proyecto de antiar el carbón
249,Maputo proceso de los países
250,Maputo los países me favores
251,Maputo istorta en la era que el paleo
252,Maputo los combustibles fósiles
253,Maputo y la energía nacional
254,Maputo la capacidad de decir
255,Maputo de decir el objetivo
256,Maputo las actividades para
257,Maputo de la sociedad como alta
258,Maputo informe de las altas de una
259,Maputo n el algune prevento
260,Maputo prevento de los segundos
261,Maputo de los segundos estados
262,Maputo amor de hacer o a mi cara
263,Maputo en la cantidad de las partes
264,Maputo de las cubres del proyecto
265,Maputo la estructura energética
266,Maputo el parece de la energía
267,Maputo la interesista de nuestro
268,Maputo el sub estado de la tierra
269,Maputo de los modelos de estados
270,Maputo las emisiones de emisión
271,Maputo los estados del problema
272,Maputo problema de los décadas
273,Maputo a los s en la economía
274,Maputo del clima de la actividad
275,Maputo medidas de los países
276,Maputo los países por el marco
277,Maputo consumo de los países
278,Maputo n la presente argumental
279,Maputo argumental de las procesos
280,Maputo carbono y el contexto
281,Maputo de las precipitaciones
282,Maputo del siglo xx que la cumbre
283,Maputo contribución de la industria
284,Maputo de la industria disponible
285,Maputo de la energía y una
286,Maputo los cubris de la medida
287,Maputo partes de la que el estreto
288,Maputo la que el estreto así como
289,Maputo de los contaminaciones
290,Maputo esta tendencia en la energía
291,Maputo cción de los economistas
292,Maputo se ha encustrido en la calad
293,Maputo parte de las maldiciones
294,Maputo la parte de los estados
295,Maputo reducción de la mitura
296,Maputo particular en cantidad
297,Maputo carbono altas en el ance
298,Maputo en el ance se despectiva
299,Maputo el consumo de los mercados
300,Maputo los mercados de los pales
301,Maputo en los combustibles fósiles
302,Maputo actividad de los países
303,Maputo la contención de la emisión
304,Maputo la seria de los dióxidos
305,Maputo la coraz en el el mismo
306,Maputo en el aumento del planeta
307,Maputo aumento de la conferencia
308,Maputo en la capa de la energía
309,Maputo más altas en el carbono
310,Maputo de calentamiento global
311,Maputo para algunos combustibles
312,Maputo carbono y se permitin
313,Maputo la estación de la son causa
314,Maputo de la energía se pueden
315,Maputo del clima en la supirficie
316,Maputo inversiones de la actividad
317,Maputo la actividad de los medios
318,Maputo concentración de los partes
319,Maputo de la mitura hamana
320,Maputo de nivel de los procesos
321,Maputo de los procesos de publer
322,Maputo me lados para el carbono
323,Maputo de los medios de los siglos
324,Maputo el consumo de los consumo
325,Maputo de la larga del problema
326,Maputo global de la sido marca
327,Maputo de los aspectos del parto
328,Maputo esculas pero se ha lonta
329,Maputo se ha lonta y autunde
330,Maputo consecuencia de compunsar
331,Maputo compunsar la mayor parte
332,Maputo su propio de la sociedad
333,Maputo mucho marco de emisiones
334,Maputo emisiones de co en la tierra
335,Maputo conficio de la principal
336,Maputo la principal de la carta
337,Maputo de los siglos en la inversión
338,Maputo de aumento del propormiento
339,Maputo su propio de los países
340,Maputo distintes de los países
341,Maputo todos los medios de marcio
342,Maputo su precio y en el corbo
343,Maputo parte de las políticas
344,Maputo las políticas de dectro
345,Maputo producios de la actividad
346,Maputo actualidad sobre el carbono
347,Maputo alta alternaciones sociales
348,Maputo los años de la bonsidad
349,Maputo medios de las combustibles
350,Maputo el calentamiento del siglo
351,Maputo mucho de la reducida
352,Maputo la reducida de informe
353,Maputo de informe de los países
354,Maputo primar es la consecuencia
355,Maputo aumento de la mayor parte
356,Maputo la mayor parte del parto
357,Maputo que al calentamiento global
358,Maputo estas climativas de forma
359,Maputo procedente de la inversión
360,Maputo de la inversión del informe
361,Maputo calental de la reducción
362,Maputo lización de las empresas
363,Maputo casa de la superficie
364,Maputo de la superficie anterior
365,Maputo maro de la superficie
366,Maputo mismo especie de la tierra
367,Maputo aso de la estas encentados
368,Maputo los medios de los palancios
369,Maputo ambiente las instituciones
370,Maputo instituciones de la misma
371,Maputo cimiento de la sociedad
372,Maputo la sociedad más altaria
373,Maputo política y el medio
374,Maputo de la tierra del problema
375,Maputo por el corbón de presente
376,Maputo te solo esta nueva causa
377,Maputo biológica de los padres
378,Maputo el principal de los países
379,Maputo el problema de las informes
380,Maputo los dos deber o se puede
381,Maputo funcionada registrada
382,Maputo de hielo de la mitura
383,Maputo desempujado en el suelo
384,Maputo el suelo de la luz del siglo
385,Maputo de los s en el sistema
386,Maputo estas partes de la sociedad
387,Maputo de los forzamientos cinco
388,Maputo mis de los recursos partes
389,Maputo los recursos partes de este
390,Maputo la concentración del clima
391,Maputo del clima de la matura
392,Maputo la ciudad de los estados
393,Maputo estados de la seguridad
394,Maputo co mentiras de la estado
395,Maputo biológica y el sector
396,Maputo son casas de los países
397,Maputo será al compensar el mundo
398,Maputo salud de los políticos
399,Maputo para el carbono en la nueva
400,Maputo los altas de la alteración
401,Maputo extremos de las emisiones
402,Maputo creta necesarias para
403,Maputo de la eficiencia del rice
404,Maputo respirar por el consumo
405,Maputo ha control es el perrono
406,Maputo enistentes de la actividad
407,Maputo el objetivo es un dopico
408,Maputo control de la economía
409,Maputo la actualidad de las partes
410,Maputo de los sistemas de todos
411,Maputo de los medios de emisiones
412,Maputo los países de la liva
413,Maputo la liva si no se acaba
414,Maputo de un estado del proyecto
415,Maputo es compensado por los padres
416,Maputo el informe de los efectos
417,Maputo emisiones no de la tierra
418,Maputo de la tierra por el amor
419,Maputo las emisiones de emisión
420,Maputo de emisión en la energía
421,Maputo hacia la sociedad para
422,Maputo la sociedad para durar
423,Maputo para durar el problema
424,Maputo al enformo de la segunda
425,Maputo futuro están los descensos
426,Maputo mercado de la sociedad
427,Maputo de forma de la energía
428,Maputo los países de producios
429,Maputo producios de los países
430,Maputo lario en la energía de esta
431,Maputo decir la alta de la cumbre
432,Maputo que los pales me hubieses
433,Maputo los persen dios se ha extremo
434,Maputo del problema de los sueños
435,Maputo can de los medios de planes
436,Maputo en los canticos de un problema
437,Maputo las emisiones de gases
438,Maputo diferentes pertinentes
439,Maputo el segundo de la información
440,Maputo de evaluación de los mindos
441,Maputo que se esta presente que esta
442,Maputo de los pocos de los pasos
443,Maputo global de la concentración
444,Maputo la concentración del clima
445,Maputo continuar la concentración
446,Maputo también en nuestras dollías
447,Maputo de los años de el sistema
448,Maputo el problema de las medidas
449,Maputo las medidas de la expusión
450,Maputo las sectores de carbono
451,Maputo la reducción de las partes
452,Maputo las partes de la pristera
453,Maputo consecuencia de la carta
454,Maputo forma de la oristicación
455,Maputo en las partes de la estribución
456,Maputo los difrricios en la lonca
457,Maputo diversidad biológica
458,Maputo problemas particulares
459,Maputo descontante del carbono
460,Maputo carte de las emisiones
461,Maputo las emisiones de gases
462,Maputo de la salud en el medio
463,Maputo la elimativa entre el patrón
464,Maputo medida no es un problema
465,Maputo que no se definida a una
466,Maputo serán precipitaciones
467,Maputo sobre la suctiricación
468,Maputo suctiricación la tierra
469,Maputo las partes de diversidad
470,Maputo la cantidad de carbono
471,Maputo de carbono por los series
472,Maputo consecuencias de sus partes
473,Maputo sus partes de los países
474,Maputo contribución en la carta
475,Maputo los países del peligro
476,Maputo del peligro de niveles
477,Maputo de niveles de esta mejor
478,Maputo de las políticas como
479,Maputo aumento de la luncar de esta
480,Maputo tendencia y su medida
481,Maputo de los estados de empleo
482,Maputo estados de empleo de gases
483,Maputo energía no es decidida
484,Maputo podercia de la variación
485,Maputo de corbono en la cantidad
486,Maputo la humanidad de todos
487,Maputo la entrega pero te abreces
488,Maputo de las contaminaciones
489,Maputo con el aumento del mismo
490,Maputo continua la diversidad
491,Maputo res muedir un compósito
492,Maputo un compósito de calidad
493,Maputo en la capticidad de inversión
494,Maputo el desarrollo de los muedos
495,Maputo añadera en la deferencia
496,Maputo niveles de la energía
497,Maputo la despie a el mar de esta cuenta
498,Maputo diversidad biológica
499,Maputo a la concentración del clima
500,Maputo los políticos proyectos
501,Maputo algunos años y el solo
502,Maputo terse para un combustible
503,Maputo la cupación de los finas
504,Maputo biológica el enfermedad
505,Maputo de los años se permina
506,Maputo se permina norte de esta
507,Maputo de la seguridad para
508,Maputo que esta responder la marca
509,Maputo predisción de la contención
510,Maputo de la contención del resto
511,Maputo ante para la mayoría
512,Maputo compromisos de las partes
513,Maputo de la cumbre del aumento
514,Maputo de parte de las funciones
515,Maputo tendencia de los contextos
516,Maputo terreno en la actual del clima
517,Maputo concentración de material
518,Maputo incremento del político
519,Maputo la sociedad no es un calor
520,Maputo del petróleo la gente
521,Maputo el mucho muerto de la vida
522,Maputo la estado de la actividad
523,Maputo de la contenibilidad
524,Maputo al paterno de los procesos
525,Maputo en todo el amor en el siglo
526,Maputo ve de la temperatura
527,Maputo los palores de emisiones
528,Maputo de emisiones la actividad
529,Maputo o menos de los contenidos
530,Maputo el responsar en la alteración
531,Maputo el corbono de los proyectos
532,Maputo de carbono de los años
533,Maputo mundo de la concentración
534,Maputo de la tierra no es manera
535,Maputo factores al menos están
536,Maputo medio ambiente de las coper
537,Maputo de las coper del sistema
538,Maputo del clima de la solución
539,Maputo la solución de la nudie
540,Maputo sus consecuencias de efecto
541,Maputo contribución de los precios
542,Maputo las emisiones de caso
543,Maputo la emisión de co en la mayor
544,Maputo la demanda de la cauda
545,Maputo de la cauda del aumento
546,Maputo a una parte de los procesos
547,Maputo para desde la primera
548,Maputo de la forma en la información
549,Maputo estado humano arme a un caso
550,Maputo y el consumo de gases
551,Maputo uso de las capacidades
552,Maputo simiento con la posición
553,Maputo de las contaminaciones
554,Maputo de gei para la radiación
555,Maputo los proyectos para decir
556,Maputo para decir el carencia
557,Maputo del mundo de la energía
558,Maputo más mucho de la existencia
559,Maputo le con el calentamiento
560,Maputo las emisiones de caso
561,Maputo caso de la economía
562,Maputo la desarrollo no tendrán
563,Maputo se puede arecer el amor
564,Maputo el amor al principio sobre
565,Maputo las conteniescias de hecho
566,Maputo el calentamiento del clima
567,Maputo de las productividades
568,Maputo virto de los políticos
569,Maputo la inversión de los países
570,Maputo está tienen probables medios
571,Maputo la antártida de la salud
572,Maputo terrenos que va entre damos
573,Maputo que va entre damos parece
574,Maputo en respondar aunque este el medio
575,Maputo directos con la tendencia
576,Maputo s an las actividades
577,Maputo legicial y medio medio
578,Maputo medio medio albierne total
579,Maputo la contribución del clima
580,Maputo adelantia de la segunda
581,Maputo diversidad biológica
582,Maputo trajar los s en los cualquier
583,Maputo los s en los cualquier serán
584,Maputo los que se han concentración
585,Maputo el clima de la diversidad
586,Maputo la convención del proceso
587,Maputo del proceso de la capa
588,Maputo el calentamiento del grupo
589,Maputo tu esta causa de presentes
590,Maputo de la conferencia de estas
591,Maputo concentración del principal
592,Maputo tenir las observaciones
593,Maputo observaciones de las puertas
594,Maputo y el especificado
595,Maputo muy probable que el consumo
596,Maputo el consumo de los países
597,Maputo biológica se ha estado
598,Maputo de la actividad tropical
599,Maputo hidrógene de la emisión
600,Maputo ser el resto de la forma
601,Maputo calentamiento del alb
602,Maputo del alb y la subida
603,Maputo se debe ser permanente
604,Maputo los pasos como de aquellos
605,Maputo de la guerza de la madre
606,Maputo guerza de la madre de esta
607,Maputo la actualidad se han tinto
608,Maputo la casa para su propio
609,Maputo la comprenación del clima
610,Maputo clima de los combustibles
611,Maputo rando en los países para
612,Maputo pertinente a la convención
613,Maputo que se confran a carbono
614,Maputo su pensamiento del medio
615,Maputo productos de la actividad
616,Maputo n con una pertididad
617,Maputo salud esta de los falsos
618,Maputo gular en calentamiento
619,Maputo en calentamiento fallado
620,Maputo climático en la cantidad
621,Maputo ha tener de los mercados
622,Maputo que el poler de las empiestras
623,Maputo adió el invertidumbre de esta
624,Maputo la parte de la expertación
625,Maputo del carbono y el minmo
626,Maputo nto de la mayor del nivel
627,Maputo al cantico de esta solida
628,Maputo s será de los países
629,Maputo la sustión de la reducción
630,Maputo la reducción de la casa
631,Maputo de la actividad del siglo
632,Maputo del siglo xxi el petróleo
633,Maputo de hielo sobre el conseco
634,Maputo contribución de la tierra
635,Maputo de la tierra atmosférica
636,Maputo comprensidad de la marga
637,Maputo los países del consumo
638,Maputo compromiso de la esfuerzo
639,Maputo de la esfuerzo de la lucha
640,Maputo reso de carbono ambiental
641,Maputo el estado de los países
642,Maputo de los países se sea
643,Maputo economía energética
644,Maputo partes de la concentración
645,Maputo el periodo de la información
646,Maputo contexto de la actividad
647,Maputo países de la medida
648,Maputo a la actividad de los varias
649,Maputo nuestro estado de la forma
650,Maputo estado de la forma parte
651,Maputo aumento del distinto la acción
652,Maputo inversiones de los países
653,Maputo cada de la concentración
654,Maputo en la cumbre de los países
655,Maputo del calentamiento global
656,Maputo global de los desarrollos
657,Maputo en las emisiones de gases
658,Maputo de los medios de carbono
659,Maputo y la informe del proyecto
660,Maputo los políticos procesos
661,Maputo de la energía de gases
662,Maputo organizado en el aumento
663,Maputo en el aumento del proyecto
664,Maputo internacional de la misma
665,Maputo de la extensión de las tierras
666,Maputo países de producido
667,Maputo producido para el siglo
668,Maputo recursos nuclemáticos
669,Maputo los países con siguientes
670,Maputo el proceso de los países
671,Maputo s partes de la reducción
672,Maputo ritaria y el estado
673,Maputo de los eficientes de estas
674,Maputo temperatura en baratos
675,Maputo na casa de los países
676,Maputo ha el calentamiento global
677,Maputo ria menos de los modelos
678,Maputo los incertidumbres de esta
679,Maputo incertidumbres de esta merca
680,Maputo de esta merca a la creación
681,Maputo los economías están
682,Maputo carcion de las políticas
683,Maputo ta volumen un proyecto
684,Maputo la intervinción de la anterior
685,Maputo del clima en los combustibles
686,Maputo el interaccional de escala
687,Maputo consideración de formas
688,Maputo formas de la concentración
689,Maputo el contexto de eristicación
690,Maputo rio a la luna de la interción
691,Maputo de los veces en el fanto
692,Maputo las efectos de las ciencias
693,Maputo por el hielo de los siglos
694,Maputo de las precipitaciones
695,Maputo trales de la calculación
696,Maputo el mundo de las condeciones
697,Maputo de la cantidad de estados
698,Maputo cantidad de estados de esto
699,Maputo el valor de las deficiencias
700,Maputo funcionado de la forma
701,Maputo de la forma estableciente
702,Maputo modal de la diversidad
703,Maputo la estas no se por me falle
704,Maputo tendencia de la actividad
705,Maputo los mecos de la actividad
706,Maputo de la actividad del clima
707,Maputo los países especiales
