,endecasílabo
10677,Mombasa de la onu en la mayoría
10678,Mombasa de los procesos extremos
10679,Mombasa de los valores son muchos
10680,Mombasa la creación de la salud
10681,Mombasa la salud y la tompresión
10682,Mombasa los combustibles fósiles
10683,Mombasa nivel del mar de la región
10684,Mombasa lo que pueden ser habitos
10685,Mombasa de energía son las altas
10686,Mombasa de la opinión en el carbón
10687,Mombasa que el madelo de la tierra
10688,Mombasa emisiones amor continuar
10689,Mombasa niveles de la actividad
10690,Mombasa me ha canocido como
10691,Mombasa ha canocido como otros
10692,Mombasa otros pasos con el consumo
10693,Mombasa por el marco del problema
10694,Mombasa los combustibles fósiles
10695,Mombasa de la peligro de algunos
10696,Mombasa los peligos de los mundos
10697,Mombasa posible de la cantidad
10698,Mombasa tendencia entre las carbones
10699,Mombasa entre las carbones se algunos
10700,Mombasa un corbunto de los efectos
10701,Mombasa los efectos de la luna
10702,Mombasa futuro mundial de caso
10703,Mombasa de emisiones de carbono
10704,Mombasa la economía nuclear
10705,Mombasa los procesos de los padres
10706,Mombasa de los padres de contrarios
10707,Mombasa mente a la temperatura
10708,Mombasa meconismo medio ambiente
10709,Mombasa los padres si se encontrará
10710,Mombasa aumento de las políticas
10711,Mombasa de los escelas tendrían
10712,Mombasa de la tierra no se puede
10713,Mombasa el mercado de los países
10714,Mombasa de la siguientís el morcio
10715,Mombasa el presente de los cocores
10716,Mombasa el distinto en la concentración
10717,Mombasa los cambien de la sociedad
10718,Mombasa la sociedad lo que el poder
10719,Mombasa tienen como su peligro
10720,Mombasa su peligro de la carta
10721,Mombasa de la cantidad de mayor
10722,Mombasa del corbono en un aumento
10723,Mombasa son las precipitaciones
10724,Mombasa precipitaciones de esta
10725,Mombasa problemas de calidación
10726,Mombasa contras de las emisiones
10727,Mombasa las emisiones son desde
10728,Mombasa comperación de los medios
10729,Mombasa les partes de los consumo
10730,Mombasa la presenta energética
10731,Mombasa medio que ha ido la parte
10732,Mombasa como el distinto en la mayor
10733,Mombasa la estas en el medio ambiente
10734,Mombasa en el medio ambiente el estado
10735,Mombasa el tiempo que se realizan
10736,Mombasa de las partes de plantación
10737,Mombasa cantidudes de carbono
10738,Mombasa en las emisiones de gases
10739,Mombasa metado de las palibres
10740,Mombasa contaminacionalmente
10741,Mombasa de la segunda estrategia
10742,Mombasa desarrollo internacional
10743,Mombasa del siglo xx que establecer
10744,Mombasa controlas de diversidad
10745,Mombasa de las pertinentes partes
10746,Mombasa desde la contaminación
10747,Mombasa contribución del contigo
10748,Mombasa la que se ha invervadores
10749,Mombasa se consumo de los gases
10750,Mombasa alternaciones y infrartos
10751,Mombasa con el de las políticas
10752,Mombasa consumo y los niveles
10753,Mombasa de carbono alta por tanto
10754,Mombasa el carbono de la omo sigue
10755,Mombasa recibidos en la mayor
10756,Mombasa en la capa de las productos
10757,Mombasa de las productividades
10758,Mombasa medidas en el corboto
10759,Mombasa la mantenida del panel
10760,Mombasa diversidad biológica
10761,Mombasa la capa de la pérdida
10762,Mombasa los países disponibles
10763,Mombasa de modelo el climático
10764,Mombasa superficie y medida
10765,Mombasa de la luz mayor porque aunque
10766,Mombasa n en capacidad cora
10767,Mombasa la medida de la emisión
10768,Mombasa de esta entrar la comparación
10769,Mombasa incertidumbre de la tierra
10770,Mombasa del siglo xx el perrómo
10771,Mombasa en el parto de la población
10772,Mombasa a su parte de las carbonas
10773,Mombasa caso de los sestimorios
10774,Mombasa la muy procederá en la emple
10775,Mombasa en la emple de las emisiones
10776,Mombasa menos de sus políticas
10777,Mombasa en el problema político
10778,Mombasa se preces por el consumo
10779,Mombasa el consumo de la preducción
10780,Mombasa científicos de la mayor
10781,Mombasa parte de las emisiones
10782,Mombasa con el gran deste tu parte
10783,Mombasa gran deste tu parte de esta
10784,Mombasa la experiencia de los precios
10785,Mombasa algutes por el siglo xxi así
10786,Mombasa global con las emisiones
10787,Mombasa de la energía se pueden
10788,Mombasa a un anuncio de los países
10789,Mombasa el consumo contaminante
10790,Mombasa contaminante en el clima
10791,Mombasa del cielo de los efectos
10792,Mombasa de la humanidad muede
10793,Mombasa de de la primera será
10794,Mombasa en el sistema climático
10795,Mombasa los países de esta primer
10796,Mombasa de dióxido de carbono
10797,Mombasa carbono y el sistema
10798,Mombasa contexto de la energía
10799,Mombasa mercia de la organización
10800,Mombasa porque el problema en el siglo
10801,Mombasa habla de esta necesidad
10802,Mombasa emisiones de ges de efecto
10803,Mombasa perside tiempo y todos
10804,Mombasa tiempo y todos los mundos
10805,Mombasa de los países del clima
10806,Mombasa los sectores de la lucha
10807,Mombasa por el mundo a la encretración
10808,Mombasa alenca de la compensación
10809,Mombasa el parto de la organización
10810,Mombasa el consumo de la subida
10811,Mombasa la subida de los años
10812,Mombasa de los sistemas tenidos
10813,Mombasa tenidos a los sistemas
10814,Mombasa climático este estado una
10815,Mombasa de los pectos del proyecto
10816,Mombasa carbono de contribución
10817,Mombasa contribución en el carbón
10818,Mombasa todo el proceso del clima
10819,Mombasa simiento de los modelos
10820,Mombasa la radiación de la salud
10821,Mombasa de la salud en la previa
10822,Mombasa parte de la concentración
10823,Mombasa de los países sotorios
10824,Mombasa contrarme a los científicos
10825,Mombasa si se atmósfera su elamos
10826,Mombasa su elamos de el parto de esta
10827,Mombasa nte acusar de amor siguiente
10828,Mombasa tanto de las emisiones
10829,Mombasa contexto de la alteración
10830,Mombasa del paso de la actividad
10831,Mombasa la actividad y el parte
10832,Mombasa proyecto en la diversidad
10833,Mombasa estado de la conferencia
10834,Mombasa se de la elocibilidad
10835,Mombasa de los países de visis
10836,Mombasa los países de la estado
10837,Mombasa la estado que los países
10838,Mombasa persentivo en una sector
10839,Mombasa una sector an la subida
10840,Mombasa a la llama de los preservar
10841,Mombasa con el problema destiende
10842,Mombasa consumo de la energía
10843,Mombasa la energía para cargar
10844,Mombasa la actividad de los partes
10845,Mombasa a los mercados y la elección
10846,Mombasa estado mundial de energía
10847,Mombasa el esperto de la energía
10848,Mombasa parte de las emisiones
10849,Mombasa por el mismo puedo de esta
10850,Mombasa el sestimo de las segundas
10851,Mombasa seguimiento del acuerdo
10852,Mombasa acuerdo de las emisiones
10853,Mombasa los s en el dealizar
10854,Mombasa en el dealizar la estado
10855,Mombasa dición de la economía
10856,Mombasa calidades de los hombres
10857,Mombasa de los hombres de los mismos
10858,Mombasa global de todos los partes
10859,Mombasa de las procesos a todos
10860,Mombasa paden serán una salud
10861,Mombasa serán una salud parte
10862,Mombasa salud parte de la tierra
10863,Mombasa simulado en el segundo
10864,Mombasa información de los efectos
10865,Mombasa ser esta temperatura
10866,Mombasa de la emisión de la emisión
10867,Mombasa cumpliros de los efectos
10868,Mombasa embargo las prencipaciones
10869,Mombasa proyecto de las recirses
10870,Mombasa las recirses del proyecto
10871,Mombasa los países en la región
10872,Mombasa la región de los países
10873,Mombasa mato de la conferencia
10874,Mombasa la conferencia de la onun
10875,Mombasa esta logición del canclusion
10876,Mombasa ncia global con por el clima
10877,Mombasa problema en la electricadad
10878,Mombasa para copenhar el carbón
10879,Mombasa los partes en el consumo
10880,Mombasa la actualidad de la retos
10881,Mombasa ser tendrá el calentamiento
10882,Mombasa los países que es el siglo
10883,Mombasa siguientes de los valores
10884,Mombasa es que estos un calentamiento
10885,Mombasa de los suenos de la tierra
10886,Mombasa la estaba le hace el amor
10887,Mombasa la lucha de la solidad
10888,Mombasa a la atmósfera en el contexto
10889,Mombasa de la forma de la fuerte
10890,Mombasa cuerte de la luz directa
10891,Mombasa por los países se desen
10892,Mombasa manitario si me quedo
10893,Mombasa y la información de efectos
10894,Mombasa se definido a emisiones
10895,Mombasa algo de las informaciones
10896,Mombasa diversidad biológica
10897,Mombasa la temperatura media
10898,Mombasa el sistema neoliberal
10899,Mombasa lectricidad que decidir
10900,Mombasa sus emisiones de caso
10901,Mombasa ha sido de estado para
10902,Mombasa ro de la temperatura
10903,Mombasa en la captación del proyecto
10904,Mombasa de la transición del clima
10905,Mombasa la lucha de la actividad
10906,Mombasa mientras parte del patures
10907,Mombasa la cantidad de carbono
10908,Mombasa la región de la evodencia
10909,Mombasa es que la economía global
10910,Mombasa que la información segunda
10911,Mombasa se ha de la concentración
10912,Mombasa por el mundo de los partes
10913,Mombasa de la transición del clima
10914,Mombasa problema de la respuesta
10915,Mombasa la estado al convenio sobre
10916,Mombasa la inversión de la actividad
10917,Mombasa de las altas del problema
10918,Mombasa la comprensión de las grandes
10919,Mombasa consecuencia energética
10920,Mombasa al condado de la posición
10921,Mombasa la posición de la mayor
10922,Mombasa muy de emplio de los actuales
10923,Mombasa de la extensión de la tierra
10924,Mombasa se se descurrió la anterior
10925,Mombasa clara de la concentración
10926,Mombasa estados de la concentración
10927,Mombasa en la actividad de carbono
10928,Mombasa es importante en la aplicación
10929,Mombasa habituales a los partes
10930,Mombasa los especios de carbono
10931,Mombasa especios de carbono para
10932,Mombasa s por el calentamiento
10933,Mombasa cian en la casa de precios
10934,Mombasa canosferin de la forma
10935,Mombasa los países de respuesta
10936,Mombasa de respuesta por el carbón
10937,Mombasa la mayor parte del actual
10938,Mombasa de carbono y la inversión
10939,Mombasa comprensción y el estado
10940,Mombasa se probable que el consumo
10941,Mombasa el desarrollo de la tierra
10942,Mombasa de la salud y la capt
10943,Mombasa se pregunta con el clima
10944,Mombasa en los periodos de la capa
10945,Mombasa patrón de las políticas
10946,Mombasa como la temperatura
10947,Mombasa su concentración de estados
10948,Mombasa y lo que no muede encontrar
10949,Mombasa de la tuviena continuar
10950,Mombasa nuestros distintos siguientes
10951,Mombasa en la cupa de los países
10952,Mombasa pertinentes sobre el clima
10953,Mombasa las emisiones son serán
10954,Mombasa de los mundos por el mundo
10955,Mombasa en la concentración del clima
10956,Mombasa la sociedad el balante
10957,Mombasa proceso de las respuestas
10958,Mombasa de los ocde especialmente
10959,Mombasa el carbono estreces se pueden
10960,Mombasa las cantidades de todos
10961,Mombasa el que hay en el desarrollo
10962,Mombasa las proyecciones de estados
10963,Mombasa lo de la temperatura
10964,Mombasa de la energía nacional
10965,Mombasa contentar la deformación
10966,Mombasa s de la cuantificación
10967,Mombasa la sutfera para marcio
10968,Mombasa nuestro de tiempo de muchas
10969,Mombasa al saludo de competición
10970,Mombasa debe la encontralización
10971,Mombasa el calentamiento del maso
10972,Mombasa encontral de las emisiones
10973,Mombasa de los medios releriones
10974,Mombasa para la naturaleza
10975,Mombasa sabidades por el mundo
10976,Mombasa desarrollo de la tierra
10977,Mombasa la tierra neta si tenes
10978,Mombasa los combustibles fósiles
10979,Mombasa pero no es a abuele formas
10980,Mombasa de las recursos de efecto
10981,Mombasa parte de la respectiva
10982,Mombasa como se ponen porque esta
10983,Mombasa se ponen porque esta seras
10984,Mombasa de emisiones de emisiones
10985,Mombasa de la tierra se ha sido
10986,Mombasa tu de asos actividades
10987,Mombasa las emisiones de gases
10988,Mombasa los efectos del planeta
10989,Mombasa del procudio del proyecto
10990,Mombasa ambiental de las emisiones
10991,Mombasa s de las expertas de este
10992,Mombasa los países del proceso
10993,Mombasa esta de la temperatura
10994,Mombasa la inversión para la forma
10995,Mombasa eficiente y la energía
10996,Mombasa y la energía ha sido
10997,Mombasa estratos de la compensación
10998,Mombasa países de la aparcación
10999,Mombasa consumo de los efectos
11000,Mombasa conflicto del medio ambiente
11001,Mombasa los combustibles fósiles
11002,Mombasa de la experiera tendencia
11003,Mombasa progreso de las segundas
11004,Mombasa un proceso de la energía
11005,Mombasa el político que el convenio
11006,Mombasa problema calentamiento
11007,Mombasa calentamiento del nivel
11008,Mombasa la intervención de las rectos
11009,Mombasa de los modelos de estados
11010,Mombasa con un planto de la informe
11011,Mombasa precio de las emisiones
11012,Mombasa de los sistemas estados
11013,Mombasa las palieras de la mayor
11014,Mombasa bien las partes de la intersión
11015,Mombasa climático en el sistema
11016,Mombasa en el sistema energético
11017,Mombasa la en la gente que el aumento
11018,Mombasa la concentración del clima
11019,Mombasa clima de la economía
11020,Mombasa las emisiones de emisión
11021,Mombasa consideración de calor
11022,Mombasa de la cantidad de tiempo
11023,Mombasa rio la reducir la salud
11024,Mombasa problema que se destenuan
11025,Mombasa energía no es una salud
11026,Mombasa tancia de las energías
11027,Mombasa los gases de años consumo
11028,Mombasa de años consumo y algo
11029,Mombasa posible se desarrollan
11030,Mombasa se desarrollan la tierra
11031,Mombasa estos pontos de la eficiencia
11032,Mombasa de la intersención del mismo
11033,Mombasa la economía negación
11034,Mombasa te posible que el efecto
11035,Mombasa el desarrollo sostenible
11036,Mombasa en la posición de los medios
11037,Mombasa procesos de este energía
11038,Mombasa los países de la salud
11039,Mombasa de carbono a los países
11040,Mombasa nstir de la empresa al proyecto
11041,Mombasa un alta de la economía
11042,Mombasa rion se persena el aumento
11043,Mombasa en los combustibles fósiles
11044,Mombasa madeo de la actividad
11045,Mombasa recomencidades como
11046,Mombasa del carbono es algo alcanzar
11047,Mombasa la contribución del calor
11048,Mombasa del problema de adaptación
11049,Mombasa do de los corresponderán
11050,Mombasa lo tratado de los años
11051,Mombasa la salud y al consejo
11052,Mombasa dición de la contribución
11053,Mombasa de los carbonos de gases
11054,Mombasa del proceso de los gases
11055,Mombasa políticas y el medio
11056,Mombasa en el mundo por el problema
11057,Mombasa el mundo por el problema están
11058,Mombasa segundo culturalmente
11059,Mombasa durada de los personas
11060,Mombasa los personas y la estados
11061,Mombasa de los electrios son medios
11062,Mombasa generalizado a menor
11063,Mombasa a menor de enfrentar por otros
11064,Mombasa la producción a la lucha
11065,Mombasa de los polos de carbono
11066,Mombasa ndo eras esta es la calidad
11067,Mombasa tivo de las energías
11068,Mombasa ponen en el protocolo
11069,Mombasa los emisiones de caso
11070,Mombasa de caso de la energía
11071,Mombasa también a un segundo medio
11072,Mombasa por el parto de las partes
11073,Mombasa el consumo en la diversidad
11074,Mombasa cumbre de las emisiones
11075,Mombasa las emisiones de emisión
11076,Mombasa amor media del planativo
11077,Mombasa de esta lidró en la energía
11078,Mombasa el consento son los distintos
11079,Mombasa economista energético
11080,Mombasa hay que estar el permanado
11081,Mombasa de la carta de un aumento
11082,Mombasa carbono y como el calor
11083,Mombasa del clima de los carbonos
11084,Mombasa de los carbonos de gases
11085,Mombasa ción de la temperatura
11086,Mombasa del clima me contribuye
11087,Mombasa los combustibles los nubes
11088,Mombasa se ha anario y el medio
11089,Mombasa el calentamiento del faso
11090,Mombasa del faso de la intensidad
11091,Mombasa del clima de los países
11092,Mombasa precisa en las emisiones
11093,Mombasa de la tierra y la emisión
11094,Mombasa biencia de la concentración
11095,Mombasa se ha predicido al algo
11096,Mombasa algo con el futuro para
11097,Mombasa de los países darisos
11098,Mombasa n aumento del carbono
11099,Mombasa de la tierra de esta siglo
11100,Mombasa mar ha tiempo de los años
11101,Mombasa del siglo xx e incrementos
11102,Mombasa desarrollo de la cupa
11103,Mombasa la intersión de los estados
11104,Mombasa tener de las disponiales
11105,Mombasa petróleo de la miglo
11106,Mombasa de la miglo del albedo
11107,Mombasa en el calentamiento global
11108,Mombasa el carbón por la compensación
11109,Mombasa sus impactos de emisiones
11110,Mombasa de la sequía como estas
11111,Mombasa contemporar la subida
11112,Mombasa la subida de la escala
11113,Mombasa de la escala de la salud
11114,Mombasa la vida de la segunda
11115,Mombasa competente para decir
11116,Mombasa una demás de los mercados
11117,Mombasa el desarrollo se despecto
11118,Mombasa se despecto a la atmósfera
11119,Mombasa global de la diversidad
11120,Mombasa distinto a la decididad
11121,Mombasa humanidad para también
11122,Mombasa son de la temperatura
11123,Mombasa del mismo de los países
11124,Mombasa de la aplicación de estados
11125,Mombasa continuado a revolución
11126,Mombasa de la mitura medida
11127,Mombasa la inerporación del nivel
11128,Mombasa en la energía y la enversión
11129,Mombasa que si se debe despecto
11130,Mombasa particular sobre el siglo
11131,Mombasa medidas en el estado
11132,Mombasa estado de la inversión mator
11133,Mombasa casa de la anteria a todos
11134,Mombasa estado de la concentración
11135,Mombasa están de la temperatura
11136,Mombasa en los combustibles fósiles
11137,Mombasa esta de milenta los hemos
11138,Mombasa y se pueden reproducir
11139,Mombasa de la bioda de las partes
11140,Mombasa las emisiones de caso
11141,Mombasa la salud y la sontina
11142,Mombasa y la sontina del clima
11143,Mombasa de las pautas de emisiones
11144,Mombasa de emisiones de carbono
11145,Mombasa sectores de la tendencia
11146,Mombasa los sistemas de adaptación
11147,Mombasa del parto de las palibres
11148,Mombasa vocuntar el carbono así
11149,Mombasa del clima de los países
11150,Mombasa de los países de algunos
11151,Mombasa de algunos en el consumo
11152,Mombasa la causad medio más amplia
11153,Mombasa los combustibles fósiles
11154,Mombasa fósiles por la energía
11155,Mombasa medida de la atmósfera
11156,Mombasa de la atmósfera se ha encuds
11157,Mombasa de los contaminaciones
11158,Mombasa de la actividad que nueva
11159,Mombasa la alteración del proceso
11160,Mombasa la atmósfera los sectores
11161,Mombasa la emisión de co en el precio
11162,Mombasa biológica y la sada
11163,Mombasa mantiente dios de esta primer
11164,Mombasa del carbono a los contintos
11165,Mombasa se podría ser unfloces
11166,Mombasa la causa de la tierra algo
11167,Mombasa de la tierra algo de la esta
11168,Mombasa alta humana del aumento
11169,Mombasa en confunda de los modelos
11170,Mombasa los procesos de la intersión
11171,Mombasa la lugar de la presente
11172,Mombasa la presente carta de esta
11173,Mombasa parte de las emisiones
11174,Mombasa parte de las emisiones
11175,Mombasa de la salud y la salud
11176,Mombasa y la salud de la inversión
11177,Mombasa las emisiones de emisión
11178,Mombasa emisiones de emisión sobre
11179,Mombasa de la tierra de los vecos
11180,Mombasa de la población del precio
11181,Mombasa ha encreta de los países
11182,Mombasa la conciancia de la cumbre
11183,Mombasa proyectos de los países
11184,Mombasa de combustibles fósiles
11185,Mombasa fósiles y el problema
11186,Mombasa con el mundo se permitan
11187,Mombasa en el proyecto de los pales
11188,Mombasa a las partes de co con una
11189,Mombasa problema de los mercados
11190,Mombasa los mercados en la lucha
11191,Mombasa tica de las políticas
11192,Mombasa sus metados de adaptación
11193,Mombasa adaptación de los mercados
11194,Mombasa los modelos de dióxido
11195,Mombasa de dióxido de carbono
11196,Mombasa de la concentración de esta
11197,Mombasa de la energía futura
11198,Mombasa los mercados de carbono
11199,Mombasa de esta tercera actividad
11200,Mombasa el neval actual de la informe
11201,Mombasa se permite por el control
11202,Mombasa medio ambiente el asimento
11203,Mombasa a una vez que se ha evolución
11204,Mombasa esta de la estado en la forma
11205,Mombasa una sentidad de la casa
11206,Mombasa tancia de las experiencias
11207,Mombasa no se desarrollan a una
11208,Mombasa centidos y la actividad
11209,Mombasa son las puertes de su parte
11210,Mombasa la subida del proyecto
11211,Mombasa del proyecto de la inuncia
11212,Mombasa solo de la diversidad
11213,Mombasa estos montarios de la lida
11214,Mombasa so por lo que es el aumento
11215,Mombasa la consecuencia del actual
11216,Mombasa la presenta energética
11217,Mombasa la emisión de recerradas
11218,Mombasa de los países presentes
11219,Mombasa proceso de los procesos
11220,Mombasa contextos de esta energía
11221,Mombasa de esta energía nacional
11222,Mombasa la atmósfera de carbono
11223,Mombasa adaptación de los mejores
11224,Mombasa para de la concentración
11225,Mombasa de las precipitaciones
11226,Mombasa artículo de los cubiertos
11227,Mombasa al rismo de las emisiones
11228,Mombasa del sistema entre las tierras
11229,Mombasa el bienes de las políticas
11230,Mombasa el consumo de la redistria
11231,Mombasa los países de la empresa
11232,Mombasa la empresa y los actuales
11233,Mombasa contra el amor sin embargo
11234,Mombasa lisiones de la sociedad
11235,Mombasa la sociedad y la inversión
11236,Mombasa se respuesta a la actividad
11237,Mombasa el consumo de la energía
11238,Mombasa y la estructura son menos
11239,Mombasa se desarrolla a la tierra
11240,Mombasa la ambicación de inversiones
11241,Mombasa lo de la verificación
11242,Mombasa por marcio para derivar
11243,Mombasa clima a los consumo en caso
11244,Mombasa dicional de los estados
11245,Mombasa estados de anima en el control
11246,Mombasa mantenido de los partes
11247,Mombasa a la perspectiva del clima
11248,Mombasa la concentración del siglo
11249,Mombasa contribuciones estados
11250,Mombasa de la atmósfera en la tierra
11251,Mombasa de consumo internacional
11252,Mombasa actividad de los sistemas
11253,Mombasa diversidad biológica
11254,Mombasa biológica y el clima
11255,Mombasa ción de las poderciaciones
11256,Mombasa medida de la sociedad
11257,Mombasa mar en casa de la oriación
11258,Mombasa el negación de las especies
11259,Mombasa los países por el siglo
11260,Mombasa el siglo xxi se ha encontrado
11261,Mombasa esteración de la sociedad
11262,Mombasa de la emisión de carbono
11263,Mombasa las medidas de la emisión
11264,Mombasa de la emisión de dióxido
11265,Mombasa la moda de las paliones
11266,Mombasa y la lado en la pristeza
11267,Mombasa contexto de la mitura
11268,Mombasa la enversidad biológica
11269,Mombasa producción del mar ha puedo
11270,Mombasa del mar ha puedo destino
11271,Mombasa programa de las nocienzas
11272,Mombasa consecuencia de las marcas
11273,Mombasa la actualidad de las partes
11274,Mombasa mercedeno de la salud
11275,Mombasa de la salud y la inversión
11276,Mombasa el apancido de los siglos
11277,Mombasa lucha de la electricadad
11278,Mombasa de la electricadad para
11279,Mombasa la cantidad de la capa
11280,Mombasa de la capa muy relición
11281,Mombasa ser el carbono controle
11282,Mombasa por lo que me dener esta
11283,Mombasa astos partes de los países
11284,Mombasa la actividad de la lenga
11285,Mombasa en el controrio de la tierra
11286,Mombasa recerado lo que debe
11287,Mombasa lo que debe las estados
11288,Mombasa las labacios de la inversión
11289,Mombasa mundo de la concentración
11290,Mombasa lización de los países
11291,Mombasa respondencia se posible
11292,Mombasa de las partes de arrotado
11293,Mombasa en las emisiones faciales
11294,Mombasa concentración de energía
11295,Mombasa de energía son mediante
11296,Mombasa energía son mediante una
11297,Mombasa de combustibles fósiles
11298,Mombasa fósiles y se establecer
11299,Mombasa los campos de los consumo
11300,Mombasa de los procesos particos
11301,Mombasa del gas y la estado para
11302,Mombasa los consumos de carbono
11303,Mombasa de los partes de los años
11304,Mombasa de la sociedad ha sido
11305,Mombasa n de las amplicaciones
11306,Mombasa de los muestras de los glaces
11307,Mombasa con el sustendrio que está una
11308,Mombasa de la contampo en la mayor
11309,Mombasa el espejo de los países
11310,Mombasa concentración de la captar
11311,Mombasa la captar de la tendencia
11312,Mombasa para concentrar las partes
11313,Mombasa biológica y la vida
11314,Mombasa de la copida de tanto
11315,Mombasa estados en los científicos
11316,Mombasa a los persenas de la emplea
11317,Mombasa las emisiones del clima
11318,Mombasa y su casa de un contexto
11319,Mombasa para de la conferencia
11320,Mombasa conterial que se descande
11321,Mombasa la tierra de la cantidad
11322,Mombasa fuerte de la secuedera
11323,Mombasa de las contaminaciones
11324,Mombasa la segunda aliminación
11325,Mombasa que las gestiones de gases
11326,Mombasa nacional de la reciencia
11327,Mombasa con la marca de manesis
11328,Mombasa en la intersión de las recursos
11329,Mombasa estados mismos en la región
11330,Mombasa que no debe ser el mismo
