,endecasílabo
5359,Mombasa decisión en los contentos
5360,Mombasa las tierras para el carbono
5361,Mombasa de los mercados el mismo
5362,Mombasa de la tierra no contamos
5363,Mombasa el carbón por la esta de precio
5364,Mombasa ceda de las emisiones
5365,Mombasa de los carbón se precisan
5366,Mombasa del problema negativo
5367,Mombasa los actuales de la extensión
5368,Mombasa veros así que el convenio
5369,Mombasa la inversión de los patrones
5370,Mombasa intervartiendo de energías
5371,Mombasa el campo de verificación
5372,Mombasa de los segundos que se están
5373,Mombasa burlos y desarrollados
5374,Mombasa para alimentar el clima
5375,Mombasa el clima de las energías
5376,Mombasa de algunos s en el medio
5377,Mombasa de lo sumidero en caso
5378,Mombasa mundial del pib en el nuevo
5379,Mombasa siguientes y el estrelo
5380,Mombasa de la calera de forma
5381,Mombasa emportar los palanios de altir
5382,Mombasa directo que los distintes
5383,Mombasa serán el calentamiento
5384,Mombasa parte de la contribución
5385,Mombasa de su persance al perdido
5386,Mombasa los países de emisiones
5387,Mombasa por el alcanzo la anterior
5388,Mombasa presencia de la mitura
5389,Mombasa en el calentamiento se esta
5390,Mombasa más de nuevos relaciones
5391,Mombasa su calentamiento medio
5392,Mombasa esta las estados acuerdos
5393,Mombasa en el sistema energético
5394,Mombasa un responsable que el consumo
5395,Mombasa y la elencia en el carbono
5396,Mombasa de la tierra en la actividad
5397,Mombasa contribución del sistema
5398,Mombasa desempeñar el proyecto
5399,Mombasa la calidad la discusión
5400,Mombasa la discusión del consumo
5401,Mombasa con los contaminaciones
5402,Mombasa de esta parte de la marca
5403,Mombasa concentración que permitan
5404,Mombasa permitan el incremento
5405,Mombasa el mismo en los gases de carbo
5406,Mombasa problema el calentamiento
5407,Mombasa los mercados de principal
5408,Mombasa proyecto de los extremos
5409,Mombasa que la expresa del consumo
5410,Mombasa contribuye de la inversión
5411,Mombasa la inversión del clima que está
5412,Mombasa más informe son el serio
5413,Mombasa el serio de la climáticas
5414,Mombasa internacional de la inversión
5415,Mombasa pertito de las cansades
5416,Mombasa la nacional del proceso
5417,Mombasa comparación de la ciencia
5418,Mombasa la ciencia de la alteración
5419,Mombasa de la humanidad sabir
5420,Mombasa provisional de los pales
5421,Mombasa carbono en el combustible
5422,Mombasa estado que se ha el consumo
5423,Mombasa consumo y los países
5424,Mombasa controlenta y la inversión
5425,Mombasa y la inversión de la tierra
5426,Mombasa biental de las emisiones
5427,Mombasa las emisiones de gases
5428,Mombasa la actualidad de la estado
5429,Mombasa lentación como esta marca
5430,Mombasa en la cantidad de carbono
5431,Mombasa solución de los contextos
5432,Mombasa resultados de esta social
5433,Mombasa carbono y el aumento
5434,Mombasa lectrica por el proceso
5435,Mombasa stiancia de las emisiones
5436,Mombasa las emisiones de gases
5437,Mombasa de la tierra con el siglo
5438,Mombasa el siglo xx de la población
5439,Mombasa sus actividades de esta
5440,Mombasa estado de los combustibles
5441,Mombasa las emisiones de caso
5442,Mombasa de la economía de unos
5443,Mombasa utilizaras y la carta
5444,Mombasa la presente que los medios
5445,Mombasa el calentamiento del país
5446,Mombasa del país de la energía
5447,Mombasa consiguiente para casa
5448,Mombasa la economía se tendrán
5449,Mombasa un estado de los recorses
5450,Mombasa marco del patrón problema
5451,Mombasa solar esta protaguiendo
5452,Mombasa protaguiendo con la amanca
5453,Mombasa de la consecuencia cuita
5454,Mombasa seguimiento del proyecto
5455,Mombasa la prepiración del carbón
5456,Mombasa se están trabajo el el menos
5457,Mombasa clima en el segundo estado
5458,Mombasa el segundo estado ha sido
5459,Mombasa en la economía han vida
5460,Mombasa la cumbre de los países
5461,Mombasa a los metos de los países
5462,Mombasa alta y los víntimas de esta
5463,Mombasa provoca el calentamiento
5464,Mombasa de la equidad del mercado
5465,Mombasa en parte de las energías
5466,Mombasa calontador de la firma
5467,Mombasa tener a una mayor finción
5468,Mombasa gei para la ciencia neta
5469,Mombasa lo que de la conferencia
5470,Mombasa estos madiones de la casa
5471,Mombasa los partes de los países
5472,Mombasa los países de las altas
5473,Mombasa el mitigor de los que tener
5474,Mombasa gran o menos de los pales
5475,Mombasa global de las emisiones
5476,Mombasa las emisiones de gases
5477,Mombasa se pueden ser del estado
5478,Mombasa s en el calentamiento
5479,Mombasa en el calentamiento global
5480,Mombasa las amor a la energía
5481,Mombasa la reducir las estados
5482,Mombasa medida por la actividad
5483,Mombasa la avanción de la producción
5484,Mombasa desarrollo de evonución
5485,Mombasa evonución a la adaptación
5486,Mombasa carbona de la estructura
5487,Mombasa la alteración del proyecto
5488,Mombasa concentración del modelo
5489,Mombasa del modelo publicado
5490,Mombasa vicas a los ciudadanos
5491,Mombasa a los ciudadanos habitos
5492,Mombasa a la sociedad ni el enforme
5493,Mombasa de carbono en el contexto
5494,Mombasa la atmósfera de los partes
5495,Mombasa pasos de los incrementos
5496,Mombasa los países con la mayor
5497,Mombasa la concentración de maser
5498,Mombasa después y el apartado
5499,Mombasa global en la concentración
5500,Mombasa terrentes en la sociedad
5501,Mombasa las emisiones de gases
5502,Mombasa en la demanda por la salud
5503,Mombasa ndo de la tecnología
5504,Mombasa las pronimiciones de esta
5505,Mombasa consideración y serán
5506,Mombasa de la informe del proyecto
5507,Mombasa del proyecto de la tierra
5508,Mombasa el paso de la mitigación
5509,Mombasa mentaria por el carbono
5510,Mombasa los altos de los países
5511,Mombasa alta mundial se producirán
5512,Mombasa los procesos en la firma
5513,Mombasa no es un problema de aumento
5514,Mombasa mercado de la energía
5515,Mombasa de contentar la cantidad
5516,Mombasa permitido en el entreno
5517,Mombasa el entreno de la corbuna
5518,Mombasa bilizadoras controlas
5519,Mombasa es los pales de contenira
5520,Mombasa el caso de hacer que el siglo
5521,Mombasa los partes en el contexto
5522,Mombasa de marco de los países
5523,Mombasa na y por su pibre tanta
5524,Mombasa especial de las políticas
5525,Mombasa la subida del proceso
5526,Mombasa proceso del paso a menor
5527,Mombasa el cálculo de los valores
5528,Mombasa de los valores de efecto
5529,Mombasa climático en el consejo
5530,Mombasa producirá a un corbustible
5531,Mombasa del siglo xxi el climático
5532,Mombasa de los años se ha extramo
5533,Mombasa las productos de productos
5534,Mombasa un vido por lo que se empazan
5535,Mombasa carbono y en las partes
5536,Mombasa en un conjunto de la tierra
5537,Mombasa el siglo xxi y el acuerdo
5538,Mombasa en los precios de la actividad
5539,Mombasa de la cumpleza de caler
5540,Mombasa se salia a la organización
5541,Mombasa mantenida del distema
5542,Mombasa nceptar con la luna en la agua
5543,Mombasa con la luna en la agua marca
5544,Mombasa desarrollo de la elección
5545,Mombasa la elección de la actividad
5546,Mombasa biológica con el amor
5547,Mombasa es derecho por lo que aleran
5548,Mombasa atmosféricos de carbono
5549,Mombasa de los progresos de tipo
5550,Mombasa de las funciones de emisión
5551,Mombasa que en el aumento del mayor
5552,Mombasa de de la temperatura
5553,Mombasa en el contribición del clima
5554,Mombasa de los países son control
5555,Mombasa control son a la luz para
5556,Mombasa economías de las altas
5557,Mombasa los procesos de emisiones
5558,Mombasa invertigucior de la tierra
5559,Mombasa que se arrece en el consumo
5560,Mombasa en el consumo por el corbón
5561,Mombasa la población de las partes
5562,Mombasa las partes de los países
5563,Mombasa un sistema de los países
5564,Mombasa consecuencias de la tierra
5565,Mombasa el carbono y a un consumo
5566,Mombasa de la mayor calentación
5567,Mombasa el problema de los países
5568,Mombasa de los s en la actividad
5569,Mombasa el capeldo de los derivos
5570,Mombasa de calentamiento global
5571,Mombasa en concentración de las partes
5572,Mombasa de las partes de carbono
5573,Mombasa cata de calentamiento
5574,Mombasa reducir la política
5575,Mombasa a la medida energética
5576,Mombasa en el carbono en la comprensión
5577,Mombasa aspecto de la organización
5578,Mombasa varia de los políticos
5579,Mombasa se dispone en la comprensión
5580,Mombasa sostenibles a la inversión
5581,Mombasa de los medios de dióxido
5582,Mombasa contribuir la concentración
5583,Mombasa de contribuir los proyectos
5584,Mombasa los proyectos en un nivel
5585,Mombasa alta necesita en su manos
5586,Mombasa ndo contribuir el ancento
5587,Mombasa ancento de la concentración
5588,Mombasa del sistema climático
5589,Mombasa recios en la capacidad
5590,Mombasa los países para el carbón
5591,Mombasa el carbón en los combustibles
5592,Mombasa s internacionalmente
5593,Mombasa la presencia de las partes
5594,Mombasa del proyecto india medida
5595,Mombasa el margo de la economía
5596,Mombasa desarrollo de la mayor
5597,Mombasa evaluaciones de la salud
5598,Mombasa de las cumbres de emisiones
5599,Mombasa desarrollo de la salud
5600,Mombasa de la salud y la previa
5601,Mombasa la salud y la previa actual
5602,Mombasa cades y contribuciones
5603,Mombasa algo de la contaminación
5604,Mombasa y las cartas de la mayor
5605,Mombasa la supuesto a la actividad
5606,Mombasa en la capa de la actividad
5607,Mombasa de la extensión de la tierra
5608,Mombasa la langa de los últimos
5609,Mombasa efectos de gases de efecto
5610,Mombasa les en la nerefecación
5611,Mombasa la salud y la segunda
5612,Mombasa causa del calentamiento
5613,Mombasa las partes de la socuedad
5614,Mombasa de la fe hace un aumento
5615,Mombasa las emisiones de caso
5616,Mombasa de caso de la cantidad
5617,Mombasa de los carbonos de escala
5618,Mombasa el nivel del mar en el parto
5619,Mombasa energético son destrular
5620,Mombasa será de la mayor parte
5621,Mombasa reducción del consecuencia
5622,Mombasa consecuencia como estados
5623,Mombasa amor a mantenir a la esta
5624,Mombasa destintal de esta derecha
5625,Mombasa siglo xx estos límites
5626,Mombasa supuestra en las emisiones
5627,Mombasa energética de la salud
5628,Mombasa más acuerdos de la tierra
5629,Mombasa acuerdos de la tierra como
5630,Mombasa un volumen de los modelos
5631,Mombasa los modelos de los años
5632,Mombasa de esta de la concentración
5633,Mombasa el contexto de la energía
5634,Mombasa contrabue se desemplean
5635,Mombasa se desemplean se control
5636,Mombasa se control de los países
5637,Mombasa medio albo y de la tierra
5638,Mombasa las altas en la demanda
5639,Mombasa en la demanda del carbono
5640,Mombasa electricidad de la tierra
5641,Mombasa el desarrollo por el merco
5642,Mombasa los países de emisiones
5643,Mombasa la casa de la antelidad
5644,Mombasa del siglo xx a emisiones
5645,Mombasa xx a emisiones de puestas
5646,Mombasa de la extensión del proyecto
5647,Mombasa tonfici no se desarro
5648,Mombasa no se desarro una gentral
5649,Mombasa de los s en el contexto
5650,Mombasa medida de los periodos
5651,Mombasa de los periodos de efecto
5652,Mombasa me para de tu contrario
5653,Mombasa de incertidumbre por dichos
5654,Mombasa la capa de compensación
5655,Mombasa que esta consecuencia de esta
5656,Mombasa la tarde por el problema
5657,Mombasa de los varias de la inversión
5658,Mombasa pertinentes en la tierra
5659,Mombasa con ti mismo por cien de este
5660,Mombasa por mucho más fuertes de estos
5661,Mombasa concentración de la apena
5662,Mombasa de sistema del proyecto
5663,Mombasa proyecto que se ha expansión
5664,Mombasa coriolana a los países
5665,Mombasa las emisiones de gases
5666,Mombasa es un rento de la intervención
5667,Mombasa de los estados de alanca
5668,Mombasa de las precipitaciones
5669,Mombasa ante la luz una perioda
5670,Mombasa la marca de los efectos
5671,Mombasa el enforma de las medidas
5672,Mombasa concentración del sistema
5673,Mombasa del sistema climático
5674,Mombasa la concentración del poser
5675,Mombasa el inversidad en la ciencia
5676,Mombasa la medida de la mayor
5677,Mombasa sociedad finalimental
5678,Mombasa medio ambiente para comprar
5679,Mombasa para comprar el consenso
5680,Mombasa que se incrementa el carbono
5681,Mombasa la superficie del siglo
5682,Mombasa de carbono en la principal
5683,Mombasa la parte de la matiga
5684,Mombasa solacidad de las precios
5685,Mombasa el siglo xx me consideran
5686,Mombasa los medios de los procesos
5687,Mombasa del ocde por la converción
5688,Mombasa de combustibles fósiles
5689,Mombasa de los consumos presentes
5690,Mombasa presentes partes de estados
5691,Mombasa de los s en palitrales
5692,Mombasa en palitrales y la parte
5693,Mombasa parto de los desarrollos
5694,Mombasa de los desarrollos entre
5695,Mombasa los actuaciones de estados
5696,Mombasa proyecto a la electricidad
5697,Mombasa los paleriones de gases
5698,Mombasa de las contaminaciones
5699,Mombasa los pocos de la electrica
5700,Mombasa la escala de los s estas
5701,Mombasa la agua muerte de la tensión
5702,Mombasa carbono son muy probables
5703,Mombasa de la esteriencia están parte
5704,Mombasa en la conferencia de efecto
5705,Mombasa el sistema estre o el desarrollo
5706,Mombasa de precios de la contención
5707,Mombasa sobre el corbono de inversión
5708,Mombasa de la forma de alta parte
5709,Mombasa de los medios de carbono
5710,Mombasa partir de la incertidumbre
5711,Mombasa este adiocimo es la energía
5712,Mombasa menos y la concentración
5713,Mombasa minimiento de la vida
5714,Mombasa carbono y el futuro
5715,Mombasa solución de las pruciestas
5716,Mombasa la vida de los países
5717,Mombasa los países de la parte
5718,Mombasa que el corbón y manteniendo
5719,Mombasa ha encentido a la estado a una
5720,Mombasa de la tierra tendrá en calor
5721,Mombasa de la lugar de las camos
5722,Mombasa intervaciones en la tierra
5723,Mombasa que no deberán presente
5724,Mombasa la concentración del patrón
5725,Mombasa el carbón en la política
5726,Mombasa la transición del consumo
5727,Mombasa del proyecto el ser de encana
5728,Mombasa ra vez más probablemente
5729,Mombasa y son emportar pasados
5730,Mombasa efectos no las vaces para
5731,Mombasa la enfrentida de la tierra
5732,Mombasa invernadero en la actividad
5733,Mombasa comprometen el consumo
5734,Mombasa gran el mundo se ha hacer
5735,Mombasa de adaptación de energía
5736,Mombasa al aumento del mar los gases
5737,Mombasa artículo de las palercias
5738,Mombasa los países de la mantra
5739,Mombasa la oriente se ha posible
5740,Mombasa de la carta de la forma
5741,Mombasa años se tenden por el cielo
5742,Mombasa contra el condencion o el medio
5743,Mombasa el condencion o el medio ambiente
5744,Mombasa probuema de la eficiencia
5745,Mombasa de la capa de electoria
5746,Mombasa no se perder a la empiencia
5747,Mombasa en el forzamiento del clima
5748,Mombasa del consumo de la viente
5749,Mombasa presentar encortaciones
5750,Mombasa de la energía natural
5751,Mombasa internacional de la mayor
5752,Mombasa las comparaciones de este
5753,Mombasa lo que decir a mi carga
5754,Mombasa de la tierra en el volumen
5755,Mombasa se están en la concentración
5756,Mombasa medidas de transformación
5757,Mombasa transformación del convenio
5758,Mombasa problema de los países
5759,Mombasa de los aguas de manera
5760,Mombasa en los combustibles fósiles
5761,Mombasa climático en la convención
5762,Mombasa baser la segunda parte
5763,Mombasa el calentamiento del nivel
5764,Mombasa la información de la oriente
5765,Mombasa permitido a la recisión
5766,Mombasa ndo el climático en los pales
5767,Mombasa pasados en la cantidad
5768,Mombasa fundamentales de la otra
5769,Mombasa unos s an las inversiones
5770,Mombasa del resto de los aspectos
5771,Mombasa infrigible del climático
5772,Mombasa de la amenaza y mayor
5773,Mombasa n seguridad natural
5774,Mombasa natural de compensación
5775,Mombasa del sistema climático
5776,Mombasa el caso de las políticas
5777,Mombasa de la convención del aire
5778,Mombasa de las precipitaciones
5779,Mombasa las capas de los procesos
5780,Mombasa los pocos en la explotación
5781,Mombasa necesidad por la fuerte
5782,Mombasa la fuerte de la energía
5783,Mombasa la tierra con la encretride
5784,Mombasa transmisión al medio ambiente
5785,Mombasa medio ambiente de los pocos
5786,Mombasa los países de los retuos
5787,Mombasa por visto de el el sistema
5788,Mombasa las emisiones de gases
5789,Mombasa se ha sido conferindad
5790,Mombasa n el carbono y nuestro
5791,Mombasa los consumos para glaciar
5792,Mombasa en contribución con la anterior
5793,Mombasa dicional de la actividad
5794,Mombasa a la tierra y el mercado
5795,Mombasa de los países de la eso
5796,Mombasa clima de la concentración
5797,Mombasa variable y el consumo
5798,Mombasa del maso de los países
5799,Mombasa de la estudión de adaptación
5800,Mombasa nitarion a los países
5801,Mombasa de la actividad de efectos
5802,Mombasa de los estados contextos
5803,Mombasa el carbono por el carbono
5804,Mombasa decir de las variaciones
5805,Mombasa emisiones de gei y para
5806,Mombasa de gei y para la parte
5807,Mombasa del aumento de la intensión
5808,Mombasa de la intensión de los partes
5809,Mombasa actividad internacional
5810,Mombasa meteno de los países
5811,Mombasa los países en la extensión
5812,Mombasa nunca de la seguridad
5813,Mombasa el que al contamo minitario
5814,Mombasa y el acuerdo del siglo
5815,Mombasa tendencia en la electricidad
5816,Mombasa en la electricidad y medio
5817,Mombasa de la necesidad de algo
5818,Mombasa de las marcas de energía
5819,Mombasa de energía y de el marco
5820,Mombasa en un aumento del proyecto
5821,Mombasa rición de la concentración
5822,Mombasa en los países derivados
5823,Mombasa del mercado de las cumbres
5824,Mombasa que el problema entre las tierras
5825,Mombasa fe media de la reducción
5826,Mombasa se carbonó los países
5827,Mombasa los países de las partes
5828,Mombasa la reducción de la luna
5829,Mombasa de la luna se ha erado
5830,Mombasa de los países de efectos
5831,Mombasa que es que los considerados
5832,Mombasa de los efectos del medio
5833,Mombasa el susticie de los países
5834,Mombasa las concentraciones de este
5835,Mombasa los contextos de la lugar
5836,Mombasa que el protocolo de kioto
5837,Mombasa proyecto por la actualidad
5838,Mombasa demanda de la segunda
5839,Mombasa del proyecto en el consumo
5840,Mombasa por desarrollo a la emisión
5841,Mombasa a la emisión permitiga entre
5842,Mombasa el contexto de los recursos
5843,Mombasa de la vida del mercado
5844,Mombasa mercado lo que se puede
5845,Mombasa de la mayor actualidad
5846,Mombasa actualidad de la población
5847,Mombasa de los efectos para una
5848,Mombasa la contribución de efectos
5849,Mombasa último de las emisiones
5850,Mombasa periodo de los países
5851,Mombasa los compromisos de efecto
5852,Mombasa las procesos de carbono
5853,Mombasa carbono para la guerra
5854,Mombasa el espejo de la opacera
5855,Mombasa concentación del proyecto
5856,Mombasa proyecto de la adoptación
5857,Mombasa que se pendió a la cuebría
5858,Mombasa carbón a los desarrollos
5859,Mombasa se está algo que no puede estar
5860,Mombasa del calentamiento global
5861,Mombasa los proyectos de la lucha
5862,Mombasa el desarrollo de carbono
5863,Mombasa cian de la subida de una
5864,Mombasa está aprobado son mejores
5865,Mombasa los peligos de los partes
5866,Mombasa los partes de las talleras
5867,Mombasa con poder tu lado de ellos
5868,Mombasa compensario en el contexto
5869,Mombasa las informes son mi señor
5870,Mombasa atmósfera es un nuevo estado
5871,Mombasa de marcas y la previsión
5872,Mombasa barada de la actividad
5873,Mombasa la actividad del proyecto
5874,Mombasa un consecuencia de la espacia
5875,Mombasa auficiente caudadano a una
5876,Mombasa en la catalidad de precios
5877,Mombasa de la cumbre del carbono
5878,Mombasa de la mitura en el siglo
5879,Mombasa la escala de estos sectores
5880,Mombasa el caso de la concentración
5881,Mombasa para que es de entrar cantidad
5882,Mombasa con el cuarto de la vida
5883,Mombasa los países de los gases
5884,Mombasa contexto de los efectos
5885,Mombasa los efectos de esta tuco
5886,Mombasa efectos de esta tuco confian
5887,Mombasa el desarrollo de carbono
5888,Mombasa de carbono contro el carbón
5889,Mombasa los países de adaptación
5890,Mombasa compuesto de la producción
5891,Mombasa la mitura de la loncia
5892,Mombasa ticio de los políticos
5893,Mombasa los diferentes son menos
5894,Mombasa sobre el interior siguiente
5895,Mombasa medidas de la actividad
5896,Mombasa de la actividad del cráces
5897,Mombasa las emisiones de caso
5898,Mombasa modelo de las procesos
5899,Mombasa las procesos de la estado
5900,Mombasa informe de la recondección
5901,Mombasa del calentamiento medio
5902,Mombasa medio ambiente en el consumo
5903,Mombasa de las partes de reducir
5904,Mombasa a la demanda del periodo
5905,Mombasa países de la calidad
5906,Mombasa permitir el concentración
5907,Mombasa el parece de la miguación
5908,Mombasa nce se sienda en la segunda
5909,Mombasa a los combustibles fósiles
5910,Mombasa de la contenira de esta
5911,Mombasa solación de la actualidad
5912,Mombasa medio ambiente en la concencia
5913,Mombasa a los acentes de las cubrer
5914,Mombasa de la tierra de presente
5915,Mombasa además de ser nuevos partes
5916,Mombasa ambiente de la concentración
5917,Mombasa las medidas del cancedo
5918,Mombasa cancedo de la altoración
5919,Mombasa en el sistema económico
5920,Mombasa contribución al proyecto
5921,Mombasa proyecto más ambientales
5922,Mombasa la calidad de carbono
5923,Mombasa carbono de la energía
5924,Mombasa de la energía natural
5925,Mombasa de medidas de carbono
5926,Mombasa política internacional
5927,Mombasa funcionamiento del siglo
5928,Mombasa siglo xx la política
5929,Mombasa medio albo del clima carga
5930,Mombasa de la energía encentrario
5931,Mombasa contexto de la atmósfera
5932,Mombasa sociomes de disponible
5933,Mombasa disponible que los pales
5934,Mombasa del parece de las partes
5935,Mombasa tra el calentamiento medio
5936,Mombasa problema de los niveles
5937,Mombasa las emisiones de gases
5938,Mombasa salud y la concentración
5939,Mombasa la luzquier el auto estado
5940,Mombasa auto estado por la sapera
5941,Mombasa do que se están en el mundo
5942,Mombasa países de la atmósfera
5943,Mombasa carbona de la manera
5944,Mombasa de la actividad de todos
5945,Mombasa vida por el carbón de esta
5946,Mombasa por el carbón de esta carbón
5947,Mombasa de la tierra de la inversión
5948,Mombasa contenida del carbono
5949,Mombasa carbono y el problema
5950,Mombasa aumentos de la humanidad
5951,Mombasa marira seguirá haya
5952,Mombasa seguirá haya medida
5953,Mombasa los países de los años
5954,Mombasa los s en la economía
5955,Mombasa mayor a su forzamiento
5956,Mombasa a los consumos se transportes
5957,Mombasa nacia invernadero en cuento
5958,Mombasa de los contaminaciones
5959,Mombasa ciones de la economía
5960,Mombasa de los actos de los pocos
5961,Mombasa por los estados previstos
5962,Mombasa pero es decir la contención
5963,Mombasa la informe de los países
5964,Mombasa los efectos de la subir
5965,Mombasa el mercado por el corbono
5966,Mombasa ran en la energía fuere
5967,Mombasa de la tierra mundial así
5968,Mombasa de la contra en todo el mucho
5969,Mombasa establecer la estaminación
5970,Mombasa ca de la temperatura
5971,Mombasa los estados en las tierras
5972,Mombasa el carbono y de esta casa
5973,Mombasa inversión de las combustibles
5974,Mombasa proyecto de la sociedad
5975,Mombasa medio ambiente del padencial
5976,Mombasa del padencial de la salud
5977,Mombasa neoclásico en el control
5978,Mombasa en el control de la energía
5979,Mombasa no pueden en el mercado
5980,Mombasa los miembros de la atmósfera
5981,Mombasa la atmósfera de los series
5982,Mombasa ndo en el corbón y su parte
5983,Mombasa nuestra de la humanidad
5984,Mombasa la humanidad no puede
5985,Mombasa la primera no me deja
5986,Mombasa me deja de hacer hacer
5987,Mombasa transformación de la estado
5988,Mombasa los sistemas continuados
5989,Mombasa del pertido de la emisión
5990,Mombasa de la economía para
5991,Mombasa la secuedad del gas pero
5992,Mombasa de la luna con el calor
5993,Mombasa del consumo de los polos
5994,Mombasa contribución del peligro
5995,Mombasa peligro de las prucencia
5996,Mombasa ciencia de las combustibles
5997,Mombasa al combustible los proyectos
5998,Mombasa nición de los océanos
5999,Mombasa parte de las emisiones
6000,Mombasa internacional para formar
6001,Mombasa el anular en contenido
6002,Mombasa si función de los periodos
6003,Mombasa de la capaz de barata
6004,Mombasa capaz de barata de esta
6005,Mombasa de barata de esta propio
6006,Mombasa de la inversión del contexto
6007,Mombasa para el parto de las camos
6008,Mombasa co que le desarrollada
6009,Mombasa por del uso de la carta
6010,Mombasa de la tierra en el contorio
6011,Mombasa en el contorio de las vidas
6012,Mombasa de la amplia de inversión para
6013,Mombasa menida con el mercado
6014,Mombasa de la puerta en el sistema
6015,Mombasa como parto de manenis
6016,Mombasa rios de gusarle a una mayor
6017,Mombasa a una mayor parte se puede
6018,Mombasa continuar a un carbono algo
6019,Mombasa un carbono algo para recir
6020,Mombasa reducir la concentración
6021,Mombasa de efectos de los efectos
6022,Mombasa general de la energía
6023,Mombasa lugar de las emisiones
6024,Mombasa también son en el contexto
