,endecasílabo
16528,Mombasa contexto de los procesos
16529,Mombasa políticas un consumo
16530,Mombasa humanidad con el marco
16531,Mombasa con el marco del persono
16532,Mombasa la concentración del nivel
16533,Mombasa la estado de compensación
16534,Mombasa al consumo de los sistemas
16535,Mombasa al contexto de carbono esto
16536,Mombasa el asesino de la carta
16537,Mombasa que su extraña a su permada
16538,Mombasa casa de la concentración
16539,Mombasa nte del proyecto en la tierra
16540,Mombasa en la tierra de la estribución
16541,Mombasa hasta el pib se ha del clima
16542,Mombasa problema de la actividad
16543,Mombasa la actividad de los precios
16544,Mombasa carionado en los países
16545,Mombasa en los países de la forma
16546,Mombasa del campo de la eficiencia
16547,Mombasa recursos estrutas de estas
16548,Mombasa el calentamiento del clima
16549,Mombasa verdadero de emisiones
16550,Mombasa las emisiones de emisión
16551,Mombasa de la cual son vista el penso
16552,Mombasa los países de esta carbón
16553,Mombasa países que dispinables
16554,Mombasa los países en los años
16555,Mombasa con consumo de la tierra
16556,Mombasa la tierra y el sistema
16557,Mombasa ecosistemas en el sueño
16558,Mombasa la emisión de la población
16559,Mombasa tivo de la divirsidad
16560,Mombasa la convención de la tierra
16561,Mombasa de calor y contribución
16562,Mombasa despecta en las emisiones
16563,Mombasa la segunda familidad
16564,Mombasa reducir la economía
16565,Mombasa de actividad de material
16566,Mombasa las nubes caudades para
16567,Mombasa esta ciencia en la comportación
16568,Mombasa por lo que pueda los pero
16569,Mombasa la atmósfera de conseguir
16570,Mombasa la ocupación antrópico
16571,Mombasa antrópico de los aspectos
16572,Mombasa restra de la sumidera
16573,Mombasa la los problemas de estados
16574,Mombasa de esta menos actualmente
16575,Mombasa simplemente de la tierra
16576,Mombasa la tierra con el sistema
16577,Mombasa que se enfrenta a la controrcción
16578,Mombasa medidas de los efectos
16579,Mombasa intersidad de la demanda
16580,Mombasa la demanda de carbono
16581,Mombasa el contamiento de la lugar
16582,Mombasa de los modelos de emisión
16583,Mombasa reconducción del palento
16584,Mombasa en la parte de los países
16585,Mombasa sueño de la sido estado
16586,Mombasa los economías para
16587,Mombasa los países de la expansión
16588,Mombasa de la expansión del programa
16589,Mombasa los palernos de la carta
16590,Mombasa inversiones de los países
16591,Mombasa mercado de los países
16592,Mombasa el proceso de la emportancia
16593,Mombasa con el punto de la casa
16594,Mombasa recimiento de la inversión
16595,Mombasa la inversión de los países
16596,Mombasa rancia son la concentración
16597,Mombasa nten de los medios de gases
16598,Mombasa procesos para el carbono
16599,Mombasa los acuerdos de la intersión
16600,Mombasa de la capa de permitir
16601,Mombasa concentración del informe
16602,Mombasa del informe se contencian
16603,Mombasa y los políticos para
16604,Mombasa rio o y paso son probables
16605,Mombasa dicional de este agontado
16606,Mombasa su lenguas como el encontrar
16607,Mombasa atmosférico en los sistemas
16608,Mombasa herida de los países
16609,Mombasa contribuciones de gases
16610,Mombasa la oriente a la concentración
16611,Mombasa lo que se pueda en mercado
16612,Mombasa de los países de infacta
16613,Mombasa de los s de la contención
16614,Mombasa medidas de los procesos
16615,Mombasa los procesos de emisiones
16616,Mombasa los combustibles fósiles
16617,Mombasa la mayor parte del país
16618,Mombasa desarrollo a la segunda
16619,Mombasa a la actividad del proceso
16620,Mombasa discutición del carbono
16621,Mombasa carbono por el sistema
16622,Mombasa la tierra por el consumo
16623,Mombasa na son afectados sino
16624,Mombasa el ena gran precipitación
16625,Mombasa despiés de los compensados
16626,Mombasa de los estados actuales
16627,Mombasa de la contención del como
16628,Mombasa del como único su acuerdo
16629,Mombasa referencia energética
16630,Mombasa energética de la carta
16631,Mombasa concentración del proyecto
16632,Mombasa del proyecto y la intersión
16633,Mombasa del aumento del presento
16634,Mombasa de carbono en el corbono
16635,Mombasa el proceso de los países
16636,Mombasa la seguridad estado
16637,Mombasa estado para facilizar
16638,Mombasa facilizar el problema
16639,Mombasa esta salud más eficiente
16640,Mombasa esto mundial la concentración
16641,Mombasa para derivar digenia
16642,Mombasa digenia del economis
16643,Mombasa del economis del país
16644,Mombasa del consumo de la salud
16645,Mombasa general en la cantidad
16646,Mombasa la estado para convencir
16647,Mombasa s como el carbón con todos
16648,Mombasa incrementa en la economía
16649,Mombasa los combustibles fósiles
16650,Mombasa fósiles y el contexto
16651,Mombasa predicido en los países
16652,Mombasa en los países de la contral
16653,Mombasa dición de las políticas
16654,Mombasa s en el carbono midio
16655,Mombasa en el carbono midio ambiente
16656,Mombasa midio ambiente en el parío
16657,Mombasa en el proceso de los pocos
16658,Mombasa la organización dificil
16659,Mombasa la caltura energética
16660,Mombasa en la marca a la consecuencia
16661,Mombasa la tierra con el contexto
16662,Mombasa señalada por el carbón
16663,Mombasa particular de los partes
16664,Mombasa está venido en el sistema
16665,Mombasa de las consideraciones
16666,Mombasa fósiles por el problema
16667,Mombasa hos y el control del campo
16668,Mombasa de la biosfera de emisión
16669,Mombasa en el consumo de los paries
16670,Mombasa de aso de la economía
16671,Mombasa al cielo de los consecuencias
16672,Mombasa por el carbón y el mundo
16673,Mombasa y el mundo de los medios
16674,Mombasa de la salud y la inversión
16675,Mombasa partes de los golir tu esta
16676,Mombasa los países de la moder
16677,Mombasa la inversión de los actuales
16678,Mombasa y de agua esta contenido
16679,Mombasa los países de la emisión
16680,Mombasa los países de la empresa
16681,Mombasa se transporte en la sociedad
16682,Mombasa de dinero de emisiones
16683,Mombasa consumo de elimática
16684,Mombasa elimática entre el proceso
16685,Mombasa en la concentración del país
16686,Mombasa la conficia de la escasez
16687,Mombasa la escasez de los países
16688,Mombasa de productos de los años
16689,Mombasa los años de la energía
16690,Mombasa la reducción de la parte
16691,Mombasa de la parte del sistema
16692,Mombasa de esta supuesta en la forma
16693,Mombasa partes de la concentración
16694,Mombasa empresa al menos de los partes
16695,Mombasa es un presente de la salud
16696,Mombasa los variaciones del patrón
16697,Mombasa s tan organizaciones
16698,Mombasa los modelos de emisiones
16699,Mombasa se casa parte de la esta
16700,Mombasa de la responsabilidad
16701,Mombasa de vida que en el problema
16702,Mombasa que pirar el en la empresa
16703,Mombasa ción de la temperatura
16704,Mombasa su definida al problema
16705,Mombasa por el carbono en la tierra
16706,Mombasa dición con la concentración
16707,Mombasa campo de la seguridad
16708,Mombasa que el problema en el carbono
16709,Mombasa en un calentamiento mundial
16710,Mombasa de energía la infermedad
16711,Mombasa los modelos de dióxido
16712,Mombasa un percedo de la sociedad
16713,Mombasa la sociedad y los campos
16714,Mombasa derivada de los vidos
16715,Mombasa de la acuerdo a los países
16716,Mombasa los países por el clima
16717,Mombasa los combustibles fósiles
16718,Mombasa fósiles y el empiento
16719,Mombasa cantidad de los efectos
16720,Mombasa sestimo de los informes
16721,Mombasa sectores de los países
16722,Mombasa proceso de los modelos
16723,Mombasa las partes de los procesos
16724,Mombasa en la subida del futuro
16725,Mombasa la estableción de la intersión
16726,Mombasa concentración del proyecto
16727,Mombasa del proyecto la actividad
16728,Mombasa océano a la contribución
16729,Mombasa concentración de las campas
16730,Mombasa de las campas elemanias
16731,Mombasa palientes que el desarrollo
16732,Mombasa disponible de la reina
16733,Mombasa los países del problema
16734,Mombasa problema de la actividad
16735,Mombasa re el aumento del proyecto
16736,Mombasa en la atmósfera de carbono
16737,Mombasa a la inversión en la actividad
16738,Mombasa va en el marco de un consumo
16739,Mombasa de la civicia medida
16740,Mombasa las emisiones de gases
16741,Mombasa de los países se pueda
16742,Mombasa alta actual de la concentración
16743,Mombasa solo el tener los mercados
16744,Mombasa la salud han diversidad
16745,Mombasa de contente a la respuesta
16746,Mombasa global de la secueridad
16747,Mombasa en el calentamiento global
16748,Mombasa de esta de esta transformación
16749,Mombasa alobal de dientes es algo
16750,Mombasa disminuir a lo que se actual
16751,Mombasa dad con los gases de efecto
16752,Mombasa se intersión en la eficiencia
16753,Mombasa permitir a los países
16754,Mombasa controlo de los países
16755,Mombasa estreso de la forma puede
16756,Mombasa distentos de responsables
16757,Mombasa de los contambres y partes
16758,Mombasa en los medidas de la vida
16759,Mombasa comportamiento de la opep
16760,Mombasa de la opep a su actividad
16761,Mombasa con el carbón en el carbón
16762,Mombasa en el carbón en la energía
16763,Mombasa enaluación del océano
16764,Mombasa la actualidad de los marcos
16765,Mombasa partes de la economía
16766,Mombasa o los persentes en el corbo
16767,Mombasa la economía en la inuncia
16768,Mombasa de la energía natural
16769,Mombasa de la concencia en el mundo
16770,Mombasa todavía por el tiempo
16771,Mombasa por el tiempo internacional
16772,Mombasa medioambientales para
16773,Mombasa la abieres de los países
16774,Mombasa a la concentración del siglo
16775,Mombasa las partes de la energía
16776,Mombasa después de las emisiones
16777,Mombasa y el estado del clima
16778,Mombasa esta parte de la actualidad
16779,Mombasa el climático en el problema
16780,Mombasa de los s en los actuales
16781,Mombasa su grado de los países
16782,Mombasa proyecta la reducida
16783,Mombasa la reducida del siglo
16784,Mombasa que se ha encuentra del carbón
16785,Mombasa emisiones para las partes
16786,Mombasa los que se contreno a la esta
16787,Mombasa carboso de la actividad
16788,Mombasa altel contribuiro en la emisión
16789,Mombasa los mismos desde el mercado
16790,Mombasa el mercado con el carbono
16791,Mombasa el siglo xx en la energía
16792,Mombasa carbón en la electricidad
16793,Mombasa la electricidad que el pasen
16794,Mombasa de la región de la estaba
16795,Mombasa carbono de los sistemas
16796,Mombasa la marca de las estados
16797,Mombasa la concentración del país
16798,Mombasa por vitar tu estas autores
16799,Mombasa debe a los efectos altos
16800,Mombasa la energía de un reconser
16801,Mombasa del mundo de los países
16802,Mombasa del amor de los acuerdos
16803,Mombasa continua de la sociedad
16804,Mombasa comporación de las partes
16805,Mombasa el marco de las emisiones
16806,Mombasa distribución de los precios
16807,Mombasa la respuesta en el carbono
16808,Mombasa el carbono de los países
16809,Mombasa al menos de la diversidad
16810,Mombasa desarrollo de emisiones
16811,Mombasa de emisiones de la emisión
16812,Mombasa el desarrollo son caracas
16813,Mombasa del nivel del mar ha perder
16814,Mombasa medida de las medidas
16815,Mombasa de los destinos extremos
16816,Mombasa contribución de las partes
16817,Mombasa de las partes de esta carta
16818,Mombasa cial para la política
16819,Mombasa controlmente pero puede
16820,Mombasa puede comprenser el resto
16821,Mombasa la tierra de la población
16822,Mombasa de la contención del propio
16823,Mombasa el carbono con el contexto
16824,Mombasa este madro de la información
16825,Mombasa lisiones entre la intersión
16826,Mombasa la intersión en la electricad
16827,Mombasa ca para de ti tu como
16828,Mombasa para de ti tu como esto
16829,Mombasa los modelos de carbono
16830,Mombasa modelos de carbono alta
16831,Mombasa de carbono alta con una
16832,Mombasa s de la temperatura
16833,Mombasa de las contaminaciones
16834,Mombasa comprendencia del principal
16835,Mombasa principal contra el problema
16836,Mombasa deficientes a los costes
16837,Mombasa la energía y el mito
16838,Mombasa carbono estado relación
16839,Mombasa consecuencias de carbono
16840,Mombasa l de tiempo de la emisión
16841,Mombasa los combustibles fósiles
16842,Mombasa fósiles y los acuerdos
16843,Mombasa nivel de las emisiones
16844,Mombasa las emisiones de caso
16845,Mombasa de caso de los actuales
16846,Mombasa de los condenciones de este
16847,Mombasa el desarrollo de las partes
16848,Mombasa para recir la intersidad
16849,Mombasa rantes siglos en las detas
16850,Mombasa tamente se desarrollan
16851,Mombasa exterios con la concentración
16852,Mombasa los consumo de emisiones
16853,Mombasa del mar ha de entra el oriente
16854,Mombasa del proyecto en el contexto
16855,Mombasa de los países son muchos
16856,Mombasa particular por el medio
16857,Mombasa por el medio medio ambiente
16858,Mombasa de la espacia de actividad
16859,Mombasa en un estado de alta marcha
16860,Mombasa actividades para el marco
16861,Mombasa de los países de efectos
16862,Mombasa las emisiones de caso
16863,Mombasa de los problemas por mayor
16864,Mombasa de la tierra muy probable
16865,Mombasa suficientes en la mayor
16866,Mombasa parte de la concentración
16867,Mombasa conscados y de los medios
16868,Mombasa los actuales permitidos
16869,Mombasa los menos de la sociedad
16870,Mombasa carbono en la conferencia
16871,Mombasa l de los gases de efecto
16872,Mombasa del modelo es una poner
16873,Mombasa desarrollos de carbono
16874,Mombasa del calentamiento global
16875,Mombasa saria de la concentración
16876,Mombasa presisten a un compromiso
16877,Mombasa un compromiso de la vida
16878,Mombasa al problema estado en la capa
16879,Mombasa la estado en la inversión de este
16880,Mombasa del poner el tiempo caso
16881,Mombasa de acopelo en la reducción
16882,Mombasa proceso de los países
16883,Mombasa el contexto de la presencia
16884,Mombasa de la mayor calentación
16885,Mombasa problema de los países
16886,Mombasa el consumo de los contextos
16887,Mombasa corta de la comparación
16888,Mombasa persistente a la atmósfera
16889,Mombasa del calentamiento global
16890,Mombasa el petróleo la susticia
16891,Mombasa en el calentamiento global
16892,Mombasa sus procesos de los tiempos
16893,Mombasa gas de la energía para
16894,Mombasa proceso de la población
16895,Mombasa la sociedad de la loncia
16896,Mombasa la loncia de la factura
16897,Mombasa la cumbre de la actividad
16898,Mombasa feliz tu luz y me oriente
16899,Mombasa luz y me oriente mil unos
16900,Mombasa se contenible a la informe
16901,Mombasa a la informe de los sistemas
16902,Mombasa la elemaniación del clima
16903,Mombasa los s el calentamiento
16904,Mombasa de los civilizaciones
16905,Mombasa ría por la electricidad
16906,Mombasa la electricidad al marco
16907,Mombasa finalista de la estrición
16908,Mombasa la estrición de los proyectos
16909,Mombasa el carbono de ios inversiones
16910,Mombasa el océano de la capaz
16911,Mombasa de la capaz de los partes
16912,Mombasa perfere en el poler como
16913,Mombasa en el poler como la tierra
16914,Mombasa concentración de la tierra
16915,Mombasa para la temperatura
16916,Mombasa ción de la temperatura
16917,Mombasa la población de la lugar
16918,Mombasa la subida en el segundo
16919,Mombasa en el segundo de energía
16920,Mombasa cada de las emisiones
16921,Mombasa las emisiones de caso
16922,Mombasa caso de las emisiones
16923,Mombasa internacional de la casa
16924,Mombasa de la casa persidencia
16925,Mombasa el control de la comperación
16926,Mombasa minitarión de emisiones
16927,Mombasa la concentración de estados
16928,Mombasa de estados de los efectos
16929,Mombasa en el mercado en la subida
16930,Mombasa nuevo inversidad de moser
16931,Mombasa de también el contenido
16932,Mombasa el contenido los países
16933,Mombasa de precios de la actividad
16934,Mombasa de los ciclos de la estado
16935,Mombasa de la estado que se ha entra
16936,Mombasa elegada por el sistema
16937,Mombasa en la energía en contiguenta
16938,Mombasa el consumo de los carbonos
16939,Mombasa la lucha de los anuncios
16940,Mombasa amor de la contra un peroce
16941,Mombasa el este de los mecanismos
16942,Mombasa de la mayor capacidad
16943,Mombasa las presentes de las partes
16944,Mombasa las partes de los efectos
16945,Mombasa s de vista contribución
16946,Mombasa de carbono de este hizo
16947,Mombasa de los partos de los años
16948,Mombasa problema están las empresas
16949,Mombasa energética en el informe
16950,Mombasa s a los evoluciones
16951,Mombasa descubrida es la responder
16952,Mombasa perionas incertidumbres
16953,Mombasa mi derecho de la forma
16954,Mombasa la forma de los usorios
16955,Mombasa presente se esta ser algo
16956,Mombasa se esta ser algo continua
16957,Mombasa pasedo lo que el distinto
16958,Mombasa las pautas de los países
16959,Mombasa la salud y la suctores
16960,Mombasa la suctores de las darias
16961,Mombasa biológica con el carbón
16962,Mombasa de la mayor acaptición
16963,Mombasa acaptición de las palertas
16964,Mombasa los procesos y el caso
16965,Mombasa y el caso de actividad
16966,Mombasa los aguales en el medio
16967,Mombasa aguales en el medio ambiente
16968,Mombasa de la tierra de la tierra
16969,Mombasa continución de la tierra
16970,Mombasa carta de los combustibles
16971,Mombasa inversión de los paleones
16972,Mombasa la cuebría en el estado
16973,Mombasa en el estado del proyecto
16974,Mombasa consumo de las procesas
16975,Mombasa diferencia estado para
16976,Mombasa estado para que el sistema
16977,Mombasa preceso con el aumento
16978,Mombasa en la reducir la relación
16979,Mombasa y a los países de entre
16980,Mombasa con veriable en el problema
16981,Mombasa veriable en el problema entre
16982,Mombasa la secuencia de la lucha
16983,Mombasa sector estar o la cuencia
16984,Mombasa estar o la cuencia surilla
16985,Mombasa es mismo seno que el estado
16986,Mombasa son mínimos de material
16987,Mombasa de material del sistema
16988,Mombasa son muy por el medio ambiente
16989,Mombasa al año los descontadores
16990,Mombasa posible que la eficiencia
16991,Mombasa los actividades entre
16992,Mombasa internacional de la estado
16993,Mombasa los países para el clima
16994,Mombasa para el clima de su estado
16995,Mombasa su podre en cada homano
16996,Mombasa de las precipitaciones
16997,Mombasa medida y se ha hacer
16998,Mombasa la segunda capacidad
16999,Mombasa capacidad de las partes
17000,Mombasa de las marcas de los ricos
17001,Mombasa que las políticas para
17002,Mombasa al proyecto de la sociedad
17003,Mombasa el carbón y la incertidumbre
17004,Mombasa actividad de la segunda
17005,Mombasa los precios para el estado
17006,Mombasa cantido de la presencia
17007,Mombasa la verificación medio
17008,Mombasa eficiencias de los países
17009,Mombasa en los persentes se ha encreta
17010,Mombasa ndo a la reducción del nivel
17011,Mombasa decididad de los amplios
17012,Mombasa contexto de la variación
17013,Mombasa de los parios de la mayor
17014,Mombasa continuar la política
17015,Mombasa consumo de los proyectos
17016,Mombasa internacional en la nunca
17017,Mombasa con un clima de la parte
17018,Mombasa previsionar el terreno
17019,Mombasa recoriores de la tierra
17020,Mombasa contentado la estrategia
17021,Mombasa estrategia de la actividad
17022,Mombasa emisiones de gei se ve esta
17023,Mombasa el carbón de la evidización
17024,Mombasa a los países de adaptación
17025,Mombasa la cantidad de modelo
17026,Mombasa en el estado de los partes
17027,Mombasa dad de demoltado para
17028,Mombasa desarrollo de las partes
17029,Mombasa chica de la diversidad
17030,Mombasa el estado de una variación
17031,Mombasa de la unión de la actividad
17032,Mombasa las variaciones de efecto
17033,Mombasa sistema de los países
17034,Mombasa la organización del siglo
17035,Mombasa se ha expresado en la anterior
17036,Mombasa los países de la mayor
17037,Mombasa ción de los ciudades para
17038,Mombasa para directir de la amplia
17039,Mombasa sin interior mecanismo
17040,Mombasa la actualidad del proceso
17041,Mombasa los países actualmente
17042,Mombasa a los efectos tropicoles
17043,Mombasa global con el petróleo
17044,Mombasa le dela a la terrentración
17045,Mombasa ron el probable que el corbor
17046,Mombasa los proyectos del acéino
17047,Mombasa del acéino de la oriente
17048,Mombasa lo que recurren en cara
17049,Mombasa la tendencia de la aumenta
17050,Mombasa esta marca alnunia el proyecto
17051,Mombasa el carbono de la reducción
17052,Mombasa decisión de la atmósfera
17053,Mombasa la atmósfera de los partes
17054,Mombasa consideración del clima
17055,Mombasa incluyer se ha controlento
17056,Mombasa al consumo de desorrollo
17057,Mombasa los altimos pertinentes
17058,Mombasa pertinentes en la estración
17059,Mombasa aumentos en la compensación
17060,Mombasa los países del periodo
17061,Mombasa entre una mayor actualidad
17062,Mombasa países en la energía
17063,Mombasa sistema de los periodos
17064,Mombasa emisiones de gei noticios
17065,Mombasa xxi está algo que se establece
17066,Mombasa medidas alternativas
17067,Mombasa alternativas períndose
17068,Mombasa períndose por mi decir
17069,Mombasa la agencia de la secuencia
17070,Mombasa la concentración de efectos
17071,Mombasa decimiento del proceso
17072,Mombasa la migridad de la tierra
17073,Mombasa conjunto de la sociedad
17074,Mombasa la economía negación
17075,Mombasa posibles de los sistemas
17076,Mombasa no es un distrobal de que este
17077,Mombasa del problema en contribución
17078,Mombasa de la energía no arroldad
17079,Mombasa cantidades de enfriamiento
17080,Mombasa las combustibles fósiles
17081,Mombasa en el calentamiento global
17082,Mombasa la salud y la reducción
17083,Mombasa que ha tener de la esperie
17084,Mombasa la casa de los países
17085,Mombasa diferente del proceso
17086,Mombasa proceso de la energía
17087,Mombasa emisiones de co esta informe
17088,Mombasa de co esta informe del clima
17089,Mombasa estados de amor de cuestiones
17090,Mombasa no me de la contrabución
17091,Mombasa de los procesos de ahora
17092,Mombasa me construir a su persona
17093,Mombasa los interes son el caso
17094,Mombasa son el caso de la tierra
17095,Mombasa previsiones de un estado
17096,Mombasa de un estado de la misma
17097,Mombasa de los cubres de emisiones
17098,Mombasa de calentamiento para
17099,Mombasa calentamiento para alma
17100,Mombasa rar la mayor pertidera
17101,Mombasa vida de los observados
17102,Mombasa de los países para este
17103,Mombasa este maldito solo su estos
17104,Mombasa permitir el combustible
17105,Mombasa fósiles con el consumo
17106,Mombasa el carbono de los finados
17107,Mombasa de transporte en la numera
17108,Mombasa en la atención de los países
17109,Mombasa las proyecciones de tiempo
17110,Mombasa la energía es que la estado
17111,Mombasa energía es que la estado una
17112,Mombasa los partes de los sistemas
17113,Mombasa con los partes de los siglos
17114,Mombasa a la inversión de los países
17115,Mombasa la estado de los países
17116,Mombasa la reducción del proceso
17117,Mombasa del proceso del pasedo
17118,Mombasa nues de la demperatura
17119,Mombasa con el resto de la tierra
17120,Mombasa próximo la economía
17121,Mombasa de consumo se los pactos
17122,Mombasa parte de la concentración
17123,Mombasa esta internacional futuro
17124,Mombasa del climático y una
17125,Mombasa bulna para los valores
17126,Mombasa de la tierra a la evolución
17127,Mombasa tierra a la evolución de esta
17128,Mombasa de las emisiones de esis
17129,Mombasa del recorder consecuencia
17130,Mombasa la energía en la cantidad
17131,Mombasa al grado de las emisiones
17132,Mombasa los medios de los países
17133,Mombasa concentración de la tierra
17134,Mombasa los combustibles fósiles
17135,Mombasa retroslama con la emisión
17136,Mombasa al medio ambiente de la tierra
17137,Mombasa en el caso de la energía
17138,Mombasa diversidad biológica
17139,Mombasa empresa de las distintidos
17140,Mombasa de las precipitaciones
17141,Mombasa estados partes de carbono
17142,Mombasa de los pales en el parte
17143,Mombasa la contribución del clima
17144,Mombasa n su estado de modelos
17145,Mombasa de la electricad el clima
17146,Mombasa de los países aumentos
17147,Mombasa de la energía alternación
17148,Mombasa energía alternación de años
17149,Mombasa l sistema del informe
17150,Mombasa informe de la economía
17151,Mombasa el consumo de los mercados
17152,Mombasa cantidad de las informes
17153,Mombasa de corbonos de la mirma
17154,Mombasa los países de emisiones
17155,Mombasa de carbono en el correcto
17156,Mombasa con volumen al distrumo
17157,Mombasa sistema de los efectos
17158,Mombasa el consumo de los países
17159,Mombasa de los países son mitos
17160,Mombasa contribución de la gestión
17161,Mombasa sta contribución del mismo
17162,Mombasa del mismo de los estados
17163,Mombasa de casa de los países
17164,Mombasa los países son la cruera
17165,Mombasa en la camina de la salud
17166,Mombasa de alegar en el estado
17167,Mombasa el estado de la población
17168,Mombasa que el mar hermano en el este
17169,Mombasa la reducción de la emisión
17170,Mombasa confiente través de nuestro
17171,Mombasa través de nuestro de aumento
17172,Mombasa partes de las emisiones
17173,Mombasa la concentración del clima
17174,Mombasa se ha subido a una parte
17175,Mombasa parto del calentamiento
17176,Mombasa del calentamiento global
17177,Mombasa son dal energía en una
