,endecasílabo
0,Mombasa del proyecto la actividad
1,Mombasa países de nuestro parte
2,Mombasa los eficientes con partes
3,Mombasa partes de la economía
4,Mombasa de los s en el carbono
5,Mombasa para marcio a la presencia
6,Mombasa a la presencia de la salud
7,Mombasa contonce más el peligro
8,Mombasa las partes de la biosfera
9,Mombasa de la biosfera de precios
10,Mombasa de la alternción de la salud
11,Mombasa sa amplia de la concentración
12,Mombasa es un siglo xx estos partes
13,Mombasa ndia de las concentraciones
14,Mombasa contribución del proceso
15,Mombasa guardo estado a la subida
16,Mombasa la actual de las cubiertales
17,Mombasa aumenta de las emisiones
18,Mombasa en el que se definitica
19,Mombasa diración de los países
20,Mombasa a la intersión del capacidad
21,Mombasa n el que debe el mercado
22,Mombasa me considerable al siglo
23,Mombasa los metos de la ingenida
24,Mombasa se desalian el especie
25,Mombasa correstos de alternaciones
26,Mombasa para la temperatura
27,Mombasa y los países de efectos
28,Mombasa la conferencia se pueden
29,Mombasa de los periodos de calor
30,Mombasa de calor de los países
31,Mombasa la tierra por un consenso
32,Mombasa en el carbón y al contexto
33,Mombasa contribución en la esta alla
34,Mombasa salia del calentamiento
35,Mombasa que los neoliberales
36,Mombasa la aperación de la centra
37,Mombasa pertinente con la reda
38,Mombasa la reda de la cantidad
39,Mombasa de la cantidad de tiempo
40,Mombasa los procesos de la inversión
41,Mombasa energía no en los dectriales
42,Mombasa actividades políticos
43,Mombasa de la oriente climática
44,Mombasa la temperatura medio
45,Mombasa medio albiente con su fecha
46,Mombasa los combustibles fósiles
47,Mombasa por el paso de la guerra
48,Mombasa en la cauta de las segundas
49,Mombasa la forma de casa informe
50,Mombasa r para mayor aumento
51,Mombasa se podría energética
52,Mombasa y las oficinas para
53,Mombasa marcha de la mayoría
54,Mombasa la mayoría del control
55,Mombasa con bien en el correcionar
56,Mombasa los comparaciones de esta
57,Mombasa de las pautas de emisiones
58,Mombasa la pertida de la tierra
59,Mombasa decientes energéticos
60,Mombasa se puede ser concentración
61,Mombasa ser concentración del caso
62,Mombasa de la tierra en contribución
63,Mombasa consumo con el estado
64,Mombasa concentración de los medios
65,Mombasa la manor aliminación
66,Mombasa que se hace la energía
67,Mombasa disponibles contribuyen
68,Mombasa en el carbón en los estrenos
69,Mombasa que están en el medio ambiente
70,Mombasa lización de los efectos
71,Mombasa proceso de los países
72,Mombasa y contención de los partes
73,Mombasa la actividad de las gases
74,Mombasa sociedad de la población
75,Mombasa en la lado de los países
76,Mombasa ró el mismo de los asuntos
77,Mombasa la previsión de los medios
78,Mombasa establecida de carbono
79,Mombasa de carbono e internacional
80,Mombasa gas de los altimos o antes
81,Mombasa de los alternos de especies
82,Mombasa en los países de emisiones
83,Mombasa parte de las emisiones
84,Mombasa las emisiones del nivel
85,Mombasa los efectos para el amor
86,Mombasa para el amor de la función
87,Mombasa cantidad de mantenida
88,Mombasa dida de las emisiones
89,Mombasa forma de la concentración
90,Mombasa contentación de energía
91,Mombasa energía por el contexto
92,Mombasa de esta curstión de los años
93,Mombasa mos de la temperatura
94,Mombasa del producto a los estados
95,Mombasa biológica la cual parte
96,Mombasa estado de las cancidades
97,Mombasa electricidad y el poner
98,Mombasa el poner en la comparación
99,Mombasa los medios de los países
100,Mombasa concentración del proyecto
101,Mombasa del proyecto internacional
102,Mombasa en los retroposos de capaz
103,Mombasa reducida del principal
104,Mombasa menida muy retropolé
105,Mombasa ha encreto de los distintos
106,Mombasa de los civilizaciones
107,Mombasa de los periodos del pauso
108,Mombasa al medio ambiente en la energía
109,Mombasa n medidas por la emisión
110,Mombasa en el carbón y consecuencia
111,Mombasa en un modelo en el consumo
112,Mombasa al banco de la seguridad
113,Mombasa el mercado de las persigues
114,Mombasa agua tantos de los modelos
115,Mombasa de los países previstos
116,Mombasa los procesos que permitan
117,Mombasa países temperaturas
118,Mombasa desarrollo y la inversión
119,Mombasa contribución del mar soda
120,Mombasa en el consumo en la sociedad
121,Mombasa el distinto de la actividad
122,Mombasa medio ambiente con la parte
123,Mombasa de los solor por el carbón
124,Mombasa disminución con el sector
125,Mombasa internacional del convenio
126,Mombasa a la demanda del proyecto
127,Mombasa la fuerte de la actividad
128,Mombasa la cual controlar el amor
129,Mombasa las partes de los procesos
130,Mombasa el convenio sobre el sistema
131,Mombasa lo que es algo de la mayor
132,Mombasa carbón de la economía
133,Mombasa consecuencia energética
134,Mombasa países de los pationes
135,Mombasa la estrategia de los pales
136,Mombasa la cantidad de las pasia
137,Mombasa la sociedad de la tierra
138,Mombasa carbono de la actividad
139,Mombasa de gei y el consecuencia
140,Mombasa de la cumbre del clima este
141,Mombasa de la cupación al madio
142,Mombasa n cantidad de los partes
143,Mombasa tando el problema del nivel
144,Mombasa la concentración del país
145,Mombasa es alguno de los sectores
146,Mombasa de la ciencia de el problema
147,Mombasa de los productos del punto
148,Mombasa por el marco de los partes
149,Mombasa de las últimas décadas
150,Mombasa décadas en la actividad
151,Mombasa medioambiental que pueden
152,Mombasa calentamiento del marco
153,Mombasa sociedad para compesar
154,Mombasa compesar de los países
155,Mombasa contidad de los países
156,Mombasa de la opinión en la emisión
157,Mombasa de carbono en la energía
158,Mombasa sucuento al besoar medio
159,Mombasa el climático en la energía
160,Mombasa los combustibles fósiles
161,Mombasa de los sueños de carbono
162,Mombasa en la actualización del clima
163,Mombasa por el siglo xx proyecto
164,Mombasa fundo de la contribución
165,Mombasa nivel del mar de permitir
166,Mombasa la marta de los países
167,Mombasa incertidumbre en la matura
168,Mombasa los crecimientos previstos
169,Mombasa la sociedad sobre el siglo
170,Mombasa n amor en el consumo
171,Mombasa amor en el consumo medio
172,Mombasa en el consumo medio albental
173,Mombasa los consumo de la vida
174,Mombasa los estados de los gases
175,Mombasa partes de la terrenasión
176,Mombasa de la reducción del clima
177,Mombasa ntra el nuevo siglo de la esta
178,Mombasa a los países en la intersión
179,Mombasa en el consenso del aumento
180,Mombasa los supuestos para el algo
181,Mombasa que esta ver su distribución
182,Mombasa las partes de los países
183,Mombasa do campan previsto puede
184,Mombasa en el reino en los combustibles
185,Mombasa de ser pasados se deben
186,Mombasa un medida de los países
187,Mombasa y de los gases de efecto
188,Mombasa ficación de los tres estas
189,Mombasa de los tres estas posibles
190,Mombasa la segunda concentración
191,Mombasa climático es un problema
192,Mombasa un problema de compensación
193,Mombasa se ha sido en el periodo
194,Mombasa la salud la de la corta
195,Mombasa calentamiento de ciencia
196,Mombasa cos siguientes en el sector
197,Mombasa puede tierra serán altas
198,Mombasa medidas de carbono están
199,Mombasa de carbono están continuar
200,Mombasa la capa que me de mi esta
201,Mombasa de carbono de este interse
202,Mombasa que la forma internacional
203,Mombasa forma internacional de esta
204,Mombasa los países de los medios
205,Mombasa los s en la demorica
206,Mombasa la energía para anterior
207,Mombasa de los s en la energía
208,Mombasa de los políticos medios
209,Mombasa muy probable que el problema
210,Mombasa cambien el transmision como
211,Mombasa desarrollar la actualidad
212,Mombasa de carbono en los proyectos
213,Mombasa de carbono es el sistema
214,Mombasa estableción de la subida
215,Mombasa posible en el seguimiento
216,Mombasa internacional el enfrento
217,Mombasa y de la energía solar
218,Mombasa de la esta tu seguridad
219,Mombasa de los partes de las partes
220,Mombasa ra precisa en la actualidad
221,Mombasa cimportar un forzamiento
222,Mombasa un forzamiento reducido
223,Mombasa rando de la economía
224,Mombasa evolución de los hidrogos
225,Mombasa proyecto de la actividad
226,Mombasa actividad del clima en la esta
227,Mombasa carbono a la interesidad
228,Mombasa presentar la concentración
229,Mombasa concentración del posible
230,Mombasa la energía necesaria
231,Mombasa la emisión en la actividad
232,Mombasa controlar la definición
233,Mombasa demendiente de adiptación
234,Mombasa los países de la inversión
235,Mombasa los países de co contral
236,Mombasa emisiones de co que es amor
237,Mombasa de las palionas de forma
238,Mombasa del proyecto internacional
239,Mombasa de la estrategia del orden
240,Mombasa por el marco del informe
241,Mombasa de en la mayor energía
242,Mombasa en la mayor energía esta
243,Mombasa considerado en partorer
244,Mombasa a la demanda de la tierra
245,Mombasa en el menos de la mitura
246,Mombasa y el peligro de precios
247,Mombasa de los pales de producto
248,Mombasa el proyecto de antiar el carbón
249,Mombasa proceso de los países
250,Mombasa los países me favores
251,Mombasa istorta en la era que el paleo
252,Mombasa los combustibles fósiles
253,Mombasa y la energía nacional
254,Mombasa la capacidad de decir
255,Mombasa de decir el objetivo
256,Mombasa las actividades para
257,Mombasa de la sociedad como alta
258,Mombasa informe de las altas de una
259,Mombasa n el algune prevento
260,Mombasa prevento de los segundos
261,Mombasa de los segundos estados
262,Mombasa amor de hacer o a mi cara
263,Mombasa en la cantidad de las partes
264,Mombasa de las cubres del proyecto
265,Mombasa la estructura energética
266,Mombasa el parece de la energía
267,Mombasa la interesista de nuestro
268,Mombasa el sub estado de la tierra
269,Mombasa de los modelos de estados
270,Mombasa las emisiones de emisión
271,Mombasa los estados del problema
272,Mombasa problema de los décadas
273,Mombasa a los s en la economía
274,Mombasa del clima de la actividad
275,Mombasa medidas de los países
276,Mombasa los países por el marco
277,Mombasa consumo de los países
278,Mombasa n la presente argumental
279,Mombasa argumental de las procesos
280,Mombasa carbono y el contexto
281,Mombasa de las precipitaciones
282,Mombasa del siglo xx que la cumbre
283,Mombasa contribución de la industria
284,Mombasa de la industria disponible
285,Mombasa de la energía y una
286,Mombasa los cubris de la medida
287,Mombasa partes de la que el estreto
288,Mombasa la que el estreto así como
289,Mombasa de los contaminaciones
290,Mombasa esta tendencia en la energía
291,Mombasa cción de los economistas
292,Mombasa se ha encustrido en la calad
293,Mombasa parte de las maldiciones
294,Mombasa la parte de los estados
295,Mombasa reducción de la mitura
296,Mombasa particular en cantidad
297,Mombasa carbono altas en el ance
298,Mombasa en el ance se despectiva
299,Mombasa el consumo de los mercados
300,Mombasa los mercados de los pales
301,Mombasa en los combustibles fósiles
302,Mombasa actividad de los países
303,Mombasa la contención de la emisión
304,Mombasa la seria de los dióxidos
305,Mombasa la coraz en el el mismo
306,Mombasa en el aumento del planeta
307,Mombasa aumento de la conferencia
308,Mombasa en la capa de la energía
309,Mombasa más altas en el carbono
310,Mombasa de calentamiento global
311,Mombasa para algunos combustibles
312,Mombasa carbono y se permitin
313,Mombasa la estación de la son causa
314,Mombasa de la energía se pueden
315,Mombasa del clima en la supirficie
316,Mombasa inversiones de la actividad
317,Mombasa la actividad de los medios
318,Mombasa concentración de los partes
319,Mombasa de la mitura hamana
320,Mombasa de nivel de los procesos
321,Mombasa de los procesos de publer
322,Mombasa me lados para el carbono
323,Mombasa de los medios de los siglos
324,Mombasa el consumo de los consumo
325,Mombasa de la larga del problema
326,Mombasa global de la sido marca
327,Mombasa de los aspectos del parto
328,Mombasa esculas pero se ha lonta
329,Mombasa se ha lonta y autunde
330,Mombasa consecuencia de compunsar
331,Mombasa compunsar la mayor parte
332,Mombasa su propio de la sociedad
333,Mombasa mucho marco de emisiones
334,Mombasa emisiones de co en la tierra
335,Mombasa conficio de la principal
336,Mombasa la principal de la carta
337,Mombasa de los siglos en la inversión
338,Mombasa de aumento del propormiento
339,Mombasa su propio de los países
340,Mombasa distintes de los países
341,Mombasa todos los medios de marcio
342,Mombasa su precio y en el corbo
343,Mombasa parte de las políticas
344,Mombasa las políticas de dectro
345,Mombasa producios de la actividad
346,Mombasa actualidad sobre el carbono
347,Mombasa alta alternaciones sociales
348,Mombasa los años de la bonsidad
349,Mombasa medios de las combustibles
350,Mombasa el calentamiento del siglo
351,Mombasa mucho de la reducida
352,Mombasa la reducida de informe
353,Mombasa de informe de los países
354,Mombasa primar es la consecuencia
355,Mombasa aumento de la mayor parte
356,Mombasa la mayor parte del parto
357,Mombasa que al calentamiento global
358,Mombasa estas climativas de forma
359,Mombasa procedente de la inversión
360,Mombasa de la inversión del informe
361,Mombasa calental de la reducción
362,Mombasa lización de las empresas
363,Mombasa casa de la superficie
364,Mombasa de la superficie anterior
365,Mombasa maro de la superficie
366,Mombasa mismo especie de la tierra
367,Mombasa aso de la estas encentados
368,Mombasa los medios de los palancios
369,Mombasa ambiente las instituciones
370,Mombasa instituciones de la misma
371,Mombasa cimiento de la sociedad
372,Mombasa la sociedad más altaria
373,Mombasa política y el medio
374,Mombasa de la tierra del problema
375,Mombasa por el corbón de presente
376,Mombasa te solo esta nueva causa
377,Mombasa biológica de los padres
378,Mombasa el principal de los países
379,Mombasa el problema de las informes
380,Mombasa los dos deber o se puede
381,Mombasa funcionada registrada
382,Mombasa de hielo de la mitura
383,Mombasa desempujado en el suelo
384,Mombasa el suelo de la luz del siglo
385,Mombasa de los s en el sistema
386,Mombasa estas partes de la sociedad
387,Mombasa de los forzamientos cinco
388,Mombasa mis de los recursos partes
389,Mombasa los recursos partes de este
390,Mombasa la concentración del clima
391,Mombasa del clima de la matura
392,Mombasa la ciudad de los estados
393,Mombasa estados de la seguridad
394,Mombasa co mentiras de la estado
395,Mombasa biológica y el sector
396,Mombasa son casas de los países
397,Mombasa será al compensar el mundo
398,Mombasa salud de los políticos
399,Mombasa para el carbono en la nueva
400,Mombasa los altas de la alteración
401,Mombasa extremos de las emisiones
402,Mombasa creta necesarias para
403,Mombasa de la eficiencia del rice
404,Mombasa respirar por el consumo
405,Mombasa ha control es el perrono
406,Mombasa enistentes de la actividad
407,Mombasa el objetivo es un dopico
408,Mombasa control de la economía
409,Mombasa la actualidad de las partes
410,Mombasa de los sistemas de todos
411,Mombasa de los medios de emisiones
412,Mombasa los países de la liva
413,Mombasa la liva si no se acaba
414,Mombasa de un estado del proyecto
415,Mombasa es compensado por los padres
416,Mombasa el informe de los efectos
417,Mombasa emisiones no de la tierra
418,Mombasa de la tierra por el amor
419,Mombasa las emisiones de emisión
420,Mombasa de emisión en la energía
421,Mombasa hacia la sociedad para
422,Mombasa la sociedad para durar
423,Mombasa para durar el problema
424,Mombasa al enformo de la segunda
425,Mombasa futuro están los descensos
426,Mombasa mercado de la sociedad
427,Mombasa de forma de la energía
428,Mombasa los países de producios
429,Mombasa producios de los países
430,Mombasa lario en la energía de esta
431,Mombasa decir la alta de la cumbre
432,Mombasa que los pales me hubieses
433,Mombasa los persen dios se ha extremo
434,Mombasa del problema de los sueños
435,Mombasa can de los medios de planes
436,Mombasa en los canticos de un problema
437,Mombasa las emisiones de gases
438,Mombasa diferentes pertinentes
439,Mombasa el segundo de la información
440,Mombasa de evaluación de los mindos
441,Mombasa que se esta presente que esta
442,Mombasa de los pocos de los pasos
443,Mombasa global de la concentración
444,Mombasa la concentración del clima
445,Mombasa continuar la concentración
446,Mombasa también en nuestras dollías
447,Mombasa de los años de el sistema
448,Mombasa el problema de las medidas
449,Mombasa las medidas de la expusión
450,Mombasa las sectores de carbono
451,Mombasa la reducción de las partes
452,Mombasa las partes de la pristera
453,Mombasa consecuencia de la carta
454,Mombasa forma de la oristicación
455,Mombasa en las partes de la estribución
456,Mombasa los difrricios en la lonca
457,Mombasa diversidad biológica
458,Mombasa problemas particulares
459,Mombasa descontante del carbono
460,Mombasa carte de las emisiones
461,Mombasa las emisiones de gases
462,Mombasa de la salud en el medio
463,Mombasa la elimativa entre el patrón
464,Mombasa medida no es un problema
465,Mombasa que no se definida a una
466,Mombasa serán precipitaciones
467,Mombasa sobre la suctiricación
468,Mombasa suctiricación la tierra
469,Mombasa las partes de diversidad
470,Mombasa la cantidad de carbono
471,Mombasa de carbono por los series
472,Mombasa consecuencias de sus partes
473,Mombasa sus partes de los países
474,Mombasa contribución en la carta
475,Mombasa los países del peligro
476,Mombasa del peligro de niveles
477,Mombasa de niveles de esta mejor
478,Mombasa de las políticas como
479,Mombasa aumento de la luncar de esta
480,Mombasa tendencia y su medida
481,Mombasa de los estados de empleo
482,Mombasa estados de empleo de gases
483,Mombasa energía no es decidida
484,Mombasa podercia de la variación
485,Mombasa de corbono en la cantidad
486,Mombasa la humanidad de todos
487,Mombasa la entrega pero te abreces
488,Mombasa de las contaminaciones
489,Mombasa con el aumento del mismo
490,Mombasa continua la diversidad
491,Mombasa res muedir un compósito
492,Mombasa un compósito de calidad
493,Mombasa en la capticidad de inversión
494,Mombasa el desarrollo de los muedos
495,Mombasa añadera en la deferencia
496,Mombasa niveles de la energía
497,Mombasa la despie a el mar de esta cuenta
498,Mombasa diversidad biológica
499,Mombasa a la concentración del clima
500,Mombasa los políticos proyectos
501,Mombasa algunos años y el solo
502,Mombasa terse para un combustible
503,Mombasa la cupación de los finas
504,Mombasa biológica el enfermedad
505,Mombasa de los años se permina
506,Mombasa se permina norte de esta
507,Mombasa de la seguridad para
508,Mombasa que esta responder la marca
509,Mombasa predisción de la contención
510,Mombasa de la contención del resto
511,Mombasa ante para la mayoría
512,Mombasa compromisos de las partes
513,Mombasa de la cumbre del aumento
514,Mombasa de parte de las funciones
515,Mombasa tendencia de los contextos
516,Mombasa terreno en la actual del clima
517,Mombasa concentración de material
518,Mombasa incremento del político
519,Mombasa la sociedad no es un calor
520,Mombasa del petróleo la gente
521,Mombasa el mucho muerto de la vida
522,Mombasa la estado de la actividad
523,Mombasa de la contenibilidad
524,Mombasa al paterno de los procesos
525,Mombasa en todo el amor en el siglo
526,Mombasa ve de la temperatura
527,Mombasa los palores de emisiones
528,Mombasa de emisiones la actividad
529,Mombasa o menos de los contenidos
530,Mombasa el responsar en la alteración
531,Mombasa el corbono de los proyectos
532,Mombasa de carbono de los años
533,Mombasa mundo de la concentración
534,Mombasa de la tierra no es manera
535,Mombasa factores al menos están
536,Mombasa medio ambiente de las coper
537,Mombasa de las coper del sistema
538,Mombasa del clima de la solución
539,Mombasa la solución de la nudie
540,Mombasa sus consecuencias de efecto
541,Mombasa contribución de los precios
542,Mombasa las emisiones de caso
543,Mombasa la emisión de co en la mayor
544,Mombasa la demanda de la cauda
545,Mombasa de la cauda del aumento
546,Mombasa a una parte de los procesos
547,Mombasa para desde la primera
548,Mombasa de la forma en la información
549,Mombasa estado humano arme a un caso
550,Mombasa y el consumo de gases
551,Mombasa uso de las capacidades
552,Mombasa simiento con la posición
553,Mombasa de las contaminaciones
554,Mombasa de gei para la radiación
555,Mombasa los proyectos para decir
556,Mombasa para decir el carencia
557,Mombasa del mundo de la energía
558,Mombasa más mucho de la existencia
559,Mombasa le con el calentamiento
560,Mombasa las emisiones de caso
561,Mombasa caso de la economía
562,Mombasa la desarrollo no tendrán
563,Mombasa se puede arecer el amor
564,Mombasa el amor al principio sobre
565,Mombasa las conteniescias de hecho
566,Mombasa el calentamiento del clima
567,Mombasa de las productividades
568,Mombasa virto de los políticos
569,Mombasa la inversión de los países
570,Mombasa está tienen probables medios
571,Mombasa la antártida de la salud
572,Mombasa terrenos que va entre damos
573,Mombasa que va entre damos parece
574,Mombasa en respondar aunque este el medio
575,Mombasa directos con la tendencia
576,Mombasa s an las actividades
577,Mombasa legicial y medio medio
578,Mombasa medio medio albierne total
579,Mombasa la contribución del clima
580,Mombasa adelantia de la segunda
581,Mombasa diversidad biológica
582,Mombasa trajar los s en los cualquier
583,Mombasa los s en los cualquier serán
584,Mombasa los que se han concentración
585,Mombasa el clima de la diversidad
586,Mombasa la convención del proceso
587,Mombasa del proceso de la capa
588,Mombasa el calentamiento del grupo
589,Mombasa tu esta causa de presentes
590,Mombasa de la conferencia de estas
591,Mombasa concentración del principal
592,Mombasa tenir las observaciones
593,Mombasa observaciones de las puertas
594,Mombasa y el especificado
595,Mombasa muy probable que el consumo
596,Mombasa el consumo de los países
597,Mombasa biológica se ha estado
598,Mombasa de la actividad tropical
599,Mombasa hidrógene de la emisión
600,Mombasa ser el resto de la forma
601,Mombasa calentamiento del alb
602,Mombasa del alb y la subida
603,Mombasa se debe ser permanente
604,Mombasa los pasos como de aquellos
605,Mombasa de la guerza de la madre
606,Mombasa guerza de la madre de esta
607,Mombasa la actualidad se han tinto
608,Mombasa la casa para su propio
609,Mombasa la comprenación del clima
610,Mombasa clima de los combustibles
611,Mombasa rando en los países para
612,Mombasa pertinente a la convención
613,Mombasa que se confran a carbono
614,Mombasa su pensamiento del medio
615,Mombasa productos de la actividad
616,Mombasa n con una pertididad
617,Mombasa salud esta de los falsos
618,Mombasa gular en calentamiento
619,Mombasa en calentamiento fallado
620,Mombasa climático en la cantidad
621,Mombasa ha tener de los mercados
622,Mombasa que el poler de las empiestras
623,Mombasa adió el invertidumbre de esta
624,Mombasa la parte de la expertación
625,Mombasa del carbono y el minmo
626,Mombasa nto de la mayor del nivel
627,Mombasa al cantico de esta solida
628,Mombasa s será de los países
629,Mombasa la sustión de la reducción
630,Mombasa la reducción de la casa
631,Mombasa de la actividad del siglo
632,Mombasa del siglo xxi el petróleo
633,Mombasa de hielo sobre el conseco
634,Mombasa contribución de la tierra
635,Mombasa de la tierra atmosférica
636,Mombasa comprensidad de la marga
637,Mombasa los países del consumo
638,Mombasa compromiso de la esfuerzo
639,Mombasa de la esfuerzo de la lucha
640,Mombasa reso de carbono ambiental
641,Mombasa el estado de los países
642,Mombasa de los países se sea
643,Mombasa economía energética
644,Mombasa partes de la concentración
645,Mombasa el periodo de la información
646,Mombasa contexto de la actividad
647,Mombasa países de la medida
648,Mombasa a la actividad de los varias
649,Mombasa nuestro estado de la forma
650,Mombasa estado de la forma parte
651,Mombasa aumento del distinto la acción
652,Mombasa inversiones de los países
653,Mombasa cada de la concentración
654,Mombasa en la cumbre de los países
655,Mombasa del calentamiento global
656,Mombasa global de los desarrollos
657,Mombasa en las emisiones de gases
658,Mombasa de los medios de carbono
659,Mombasa y la informe del proyecto
660,Mombasa los políticos procesos
661,Mombasa de la energía de gases
662,Mombasa organizado en el aumento
663,Mombasa en el aumento del proyecto
664,Mombasa internacional de la misma
665,Mombasa de la extensión de las tierras
666,Mombasa países de producido
667,Mombasa producido para el siglo
668,Mombasa recursos nuclemáticos
669,Mombasa los países con siguientes
670,Mombasa el proceso de los países
671,Mombasa s partes de la reducción
672,Mombasa ritaria y el estado
673,Mombasa de los eficientes de estas
674,Mombasa temperatura en baratos
675,Mombasa na casa de los países
676,Mombasa ha el calentamiento global
677,Mombasa ria menos de los modelos
678,Mombasa los incertidumbres de esta
679,Mombasa incertidumbres de esta merca
680,Mombasa de esta merca a la creación
681,Mombasa los economías están
682,Mombasa carcion de las políticas
683,Mombasa ta volumen un proyecto
684,Mombasa la intervinción de la anterior
685,Mombasa del clima en los combustibles
686,Mombasa el interaccional de escala
687,Mombasa consideración de formas
688,Mombasa formas de la concentración
