,endecasílabo
0,Chicago permitado en la atmósfera
1,Chicago en el proyecto de la tierra
2,Chicago de carbono a la producción
3,Chicago problema de compromiso
4,Chicago modelos de compromiso
5,Chicago contribución de la propia
6,Chicago entre el mar de la concentración
7,Chicago carbono en la concentración
8,Chicago menos de la consecuencia
9,Chicago parte de la concentración
10,Chicago parte de la concentración
11,Chicago mundial de la concentración
12,Chicago contribución de la compra
13,Chicago mayor parte de la salud
14,Chicago marca de la concentración
15,Chicago mayor en la compromisa
16,Chicago climático como el cambio
17,Chicago como el cambio climático
18,Chicago producto en la compromisa
19,Chicago el petróleo y la propia
20,Chicago marco de la concentración
21,Chicago climático en la atmósfera
22,Chicago está contra la compromica
23,Chicago marca de la concentración
24,Chicago parte de la contra el cambio
25,Chicago política en la producción
26,Chicago climática y el cambio
27,Chicago carbono en la compromisa
28,Chicago propia de la concentración
29,Chicago contra el cambio climático
30,Chicago contra el cambio climático
31,Chicago el cambio climático sobre
32,Chicago menos de la compromisa
33,Chicago la compra de compromiso
34,Chicago marco de la concentración
35,Chicago la comprar en la producción
36,Chicago por el contral de la propia
37,Chicago el contral de la propia contra
38,Chicago en el proceso de la propia
39,Chicago la contrar con la estrategia
40,Chicago permitado de la propia
41,Chicago de la propia climática
42,Chicago para el cambio climático
43,Chicago contra el cambio climático
44,Chicago el cambio climático sobre
45,Chicago la producción de la compra
46,Chicago permitado de la compra
47,Chicago parte de la compromisa
48,Chicago emisiones de contra el cambio
49,Chicago la propia de contra el cambio
50,Chicago producirá a la energía
51,Chicago el proyecto de la actualidad
52,Chicago permitado de la propia
53,Chicago de la propia contra el cambio
54,Chicago menos de la concentración
55,Chicago permitado por la propia
56,Chicago el contrado en la compromisa
57,Chicago parte de la compromisa
58,Chicago en la propia de la comprensión
59,Chicago contra el cambio climático
60,Chicago contra el cambio climático
61,Chicago menos precipitaciones
62,Chicago permita de la producción
63,Chicago la capa de compromiso
64,Chicago de contra la compromisa
65,Chicago menos de la compromisa
66,Chicago por el mar en la producción
67,Chicago permita en la compromisa
68,Chicago la producción de la compra
69,Chicago contra el cambio climático
70,Chicago permitado de la estado
71,Chicago producido a la energía
72,Chicago el proceso de compromiso
73,Chicago parte de la contra el cambio
74,Chicago de contra la compromisa
75,Chicago la contrar la compromisa
76,Chicago comprensión de la producción
77,Chicago propia con la compromisa
78,Chicago permita en la compromisa
79,Chicago por el cambio climático
80,Chicago problema de la producción
81,Chicago parte de la compromisa
82,Chicago la propia de la comprensión
83,Chicago el mercado de la producción
84,Chicago permitado en la producción
85,Chicago seguir en la contribución
86,Chicago la estada de compromiso
87,Chicago parte de la concentración
88,Chicago la propia como el problema
89,Chicago problema con la atmósfera
90,Chicago carbono que la comprensión
91,Chicago la compromisa de deces
92,Chicago deces con la compromisa
93,Chicago se producirá en la propia
94,Chicago en la propia de compromiso
95,Chicago manor en la compromisa
96,Chicago modelo de la producción
97,Chicago el cambio climático sobre
98,Chicago la energía necesaria
99,Chicago los combustibles fósiles
100,Chicago la propia como el estado
101,Chicago compromiso de carbono
102,Chicago carbono y el problema
103,Chicago la energía contra el cambio
104,Chicago contribución de la compra
105,Chicago se esta mayor producida
106,Chicago compromiso de la capa
107,Chicago el contrado en la compromisa
108,Chicago producto a las emisiones
109,Chicago la propia de los procesos
110,Chicago el contrado en la concentración
111,Chicago segundo de la producción
112,Chicago la comprensión de la propia
113,Chicago a la propia de compromiso
114,Chicago permitado en la comprensión
115,Chicago parte de la concentración
116,Chicago parte de la compromisa
117,Chicago climático en la producción
118,Chicago parte de la compromisa
119,Chicago el proceso de la comprensión
120,Chicago la producción de la compra
121,Chicago la compra de la producción
122,Chicago menos de la compromisa
123,Chicago marco de la concentración
124,Chicago menos en la concentración
125,Chicago ser estado a la producción
126,Chicago contra el cambio climático
127,Chicago los procesos de carbono
128,Chicago seguridad establecir
129,Chicago parte de la contribución
130,Chicago parte de la compromisa
131,Chicago consecuencia de la contrar
132,Chicago la contrar la compromisa
133,Chicago en la producción de la capa
134,Chicago en la cumbre de la actualidad
135,Chicago la compra de la estructura
136,Chicago contra el cambio climático
137,Chicago de la compra de consumo
138,Chicago la compromisa de cambio
139,Chicago por el cambio climático
140,Chicago permitado en el promedio
141,Chicago la estado de la comprensión
142,Chicago se desarrollar la estada
143,Chicago mercado de la energía
144,Chicago carbono en la compromisa
145,Chicago menos de la concentración
146,Chicago permitado en la producción
147,Chicago contración de la producción
148,Chicago el contral de la concentración
149,Chicago de todo la contra el cambio
150,Chicago menos de la concentración
151,Chicago contra el cambio climático
152,Chicago la comprensión de la compra
153,Chicago la producción de la compra
154,Chicago parte de la concentración
155,Chicago menos de la concentración
156,Chicago proceso de esta producción
157,Chicago proceso de compromiso
158,Chicago sin embargo se producir
159,Chicago contra el mar en la atmósfera
160,Chicago de compromiso de contra
161,Chicago contra la temperatura
162,Chicago menos de la concentración
163,Chicago carbono que los países
164,Chicago la producción de la mayor
165,Chicago problema de la producción
166,Chicago de compromiso de contra
167,Chicago menos de la contribución
168,Chicago por el cambio climático
169,Chicago climático y la propia
170,Chicago de compromiso de carbón
171,Chicago carbono en la compromisa
172,Chicago permitado de la tierra
173,Chicago carbono por un problema
174,Chicago de combustibles fósiles
175,Chicago producto en la concentración
176,Chicago proceso de compromiso
177,Chicago el proyecto en la compromisa
178,Chicago contra el cambio climático
179,Chicago medida de compromiso
180,Chicago la estado de la comprensión
181,Chicago parte de la comprendencia
182,Chicago la comprensión de la compra
183,Chicago de la compra de carbono
184,Chicago proceso de compromiso
185,Chicago desarrollar el problema
186,Chicago compromiso de la contrar
187,Chicago la compromisa de cambio
188,Chicago contra el cambio climático
189,Chicago segundo contra la propia
190,Chicago la propia de compromiso
191,Chicago la propia de compromiso
192,Chicago compromiso de la compra
193,Chicago de carbono en la atmósfera
194,Chicago menos en la contribución
195,Chicago menos en las emisiones
196,Chicago carbono en la compromisa
197,Chicago ser producido en la propia
198,Chicago la energía para el cambio
199,Chicago a la producción de la propia
200,Chicago parte de la concentración
201,Chicago de carbono a la producción
202,Chicago de compromiso de cambio
203,Chicago tendría en la consecuencia
204,Chicago consecuencia de la contrar
205,Chicago la contrar la concentración
206,Chicago de contra la contra el cambio
207,Chicago en la comprensión de la estada
208,Chicago en el cambio climático esta
209,Chicago de la propia como contra
210,Chicago producto en la contra el cambio
211,Chicago productos de la producción
212,Chicago propio con la concentración
213,Chicago de carbono de la propia
214,Chicago marca de la concentración
215,Chicago producción de la producción
216,Chicago contra la compromicado
217,Chicago la producción de la compra
218,Chicago países de contra el cambio
219,Chicago se desarrollar el cambio
220,Chicago problema de compromiso
221,Chicago medida de la intersidad
222,Chicago el proceso de contra el cambio
223,Chicago conjunto de compromiso
224,Chicago la producción de la compra
225,Chicago en la concentración de la actual
226,Chicago consecuencia de la compren
227,Chicago la compren de consecuencia
228,Chicago parte de la contribución
229,Chicago contra el cambio climático
230,Chicago compromiso de la mayor
231,Chicago secuedad de la atmósfera
232,Chicago la mayor por la producción
233,Chicago la producción de la compra
234,Chicago la propia en la compromisa
235,Chicago contra el cambio climático
236,Chicago la demanda de la propia
237,Chicago de la propia contra el cambio
238,Chicago contra el cambio climático
239,Chicago la intersidad biológica
240,Chicago la compromisa continuar
241,Chicago de la contrar la contración
242,Chicago el problema de compromiso
243,Chicago parte de la compromisa
244,Chicago contra el cambio climático
245,Chicago contra el cambio climático
246,Chicago economía necesitad
247,Chicago parte de la contra el cambio
248,Chicago permitado en el consumo
249,Chicago parte de la contra el cambio
250,Chicago menos de la concentración
251,Chicago de carbono y la contrar
252,Chicago compromiso de la propia
253,Chicago la energía necesaria
254,Chicago carbono a la compromisa
255,Chicago en el cambio climático esta
256,Chicago ser producido en la contral
257,Chicago parte de la concentración
258,Chicago compra de la propia como
259,Chicago el contrado en la propia como
260,Chicago compromisa contra el cambio
261,Chicago contra el cambio climático
262,Chicago el cambio climático sobre
263,Chicago de compromiso de un medio
264,Chicago permitan para la compra
265,Chicago la compra de compromiso
266,Chicago la propia de la comprensión
267,Chicago cambio climático sobre
268,Chicago la propia de compromiso
269,Chicago marco de la concentración
270,Chicago la temperatura mundial
271,Chicago ser producido en la propia
272,Chicago la propia con la producción
273,Chicago parte de la concentración
274,Chicago menos en la compromisa
275,Chicago en el mar de la contribución
276,Chicago propuesta en la contrabución
277,Chicago marco de la concentración
278,Chicago de carbono y la propia
279,Chicago el sumento de la demanda
