,endecasílabo
0,Mindelo permitado en la atmósfera
1,Mindelo en el proyecto de la tierra
2,Mindelo de carbono a la producción
3,Mindelo problema de compromiso
4,Mindelo modelos de compromiso
5,Mindelo contribución de la propia
6,Mindelo entre el mar de la concentración
7,Mindelo carbono en la concentración
8,Mindelo menos de la consecuencia
9,Mindelo parte de la concentración
10,Mindelo parte de la concentración
11,Mindelo mundial de la concentración
12,Mindelo contribución de la compra
13,Mindelo mayor parte de la salud
14,Mindelo marca de la concentración
15,Mindelo mayor en la compromisa
16,Mindelo climático como el cambio
17,Mindelo como el cambio climático
18,Mindelo producto en la compromisa
19,Mindelo el petróleo y la propia
20,Mindelo marco de la concentración
21,Mindelo climático en la atmósfera
22,Mindelo está contra la compromica
23,Mindelo marca de la concentración
24,Mindelo parte de la contra el cambio
25,Mindelo política en la producción
26,Mindelo climática y el cambio
27,Mindelo carbono en la compromisa
28,Mindelo propia de la concentración
29,Mindelo contra el cambio climático
30,Mindelo contra el cambio climático
31,Mindelo el cambio climático sobre
32,Mindelo menos de la compromisa
33,Mindelo la compra de compromiso
34,Mindelo marco de la concentración
35,Mindelo la comprar en la producción
36,Mindelo por el contral de la propia
37,Mindelo el contral de la propia contra
38,Mindelo en el proceso de la propia
39,Mindelo la contrar con la estrategia
40,Mindelo permitado de la propia
41,Mindelo de la propia climática
42,Mindelo para el cambio climático
43,Mindelo contra el cambio climático
44,Mindelo el cambio climático sobre
45,Mindelo la producción de la compra
46,Mindelo permitado de la compra
47,Mindelo parte de la compromisa
48,Mindelo emisiones de contra el cambio
49,Mindelo la propia de contra el cambio
50,Mindelo producirá a la energía
51,Mindelo el proyecto de la actualidad
52,Mindelo permitado de la propia
53,Mindelo de la propia contra el cambio
54,Mindelo menos de la concentración
55,Mindelo permitado por la propia
56,Mindelo el contrado en la compromisa
57,Mindelo parte de la compromisa
58,Mindelo en la propia de la comprensión
59,Mindelo contra el cambio climático
60,Mindelo contra el cambio climático
61,Mindelo menos precipitaciones
62,Mindelo permita de la producción
63,Mindelo la capa de compromiso
64,Mindelo de contra la compromisa
65,Mindelo menos de la compromisa
66,Mindelo por el mar en la producción
67,Mindelo permita en la compromisa
68,Mindelo la producción de la compra
69,Mindelo contra el cambio climático
70,Mindelo permitado de la estado
71,Mindelo producido a la energía
72,Mindelo el proceso de compromiso
73,Mindelo parte de la contra el cambio
74,Mindelo de contra la compromisa
75,Mindelo la contrar la compromisa
76,Mindelo comprensión de la producción
77,Mindelo propia con la compromisa
78,Mindelo permita en la compromisa
79,Mindelo por el cambio climático
80,Mindelo problema de la producción
81,Mindelo parte de la compromisa
82,Mindelo la propia de la comprensión
83,Mindelo el mercado de la producción
84,Mindelo permitado en la producción
85,Mindelo seguir en la contribución
86,Mindelo la estada de compromiso
87,Mindelo parte de la concentración
88,Mindelo la propia como el problema
89,Mindelo problema con la atmósfera
90,Mindelo carbono que la comprensión
91,Mindelo la compromisa de deces
92,Mindelo deces con la compromisa
93,Mindelo se producirá en la propia
94,Mindelo en la propia de compromiso
95,Mindelo manor en la compromisa
96,Mindelo modelo de la producción
97,Mindelo el cambio climático sobre
98,Mindelo la energía necesaria
99,Mindelo los combustibles fósiles
100,Mindelo la propia como el estado
101,Mindelo compromiso de carbono
102,Mindelo carbono y el problema
103,Mindelo la energía contra el cambio
104,Mindelo contribución de la compra
105,Mindelo se esta mayor producida
106,Mindelo compromiso de la capa
107,Mindelo el contrado en la compromisa
108,Mindelo producto a las emisiones
109,Mindelo la propia de los procesos
110,Mindelo el contrado en la concentración
111,Mindelo segundo de la producción
112,Mindelo la comprensión de la propia
113,Mindelo a la propia de compromiso
114,Mindelo permitado en la comprensión
115,Mindelo parte de la concentración
116,Mindelo parte de la compromisa
117,Mindelo climático en la producción
118,Mindelo parte de la compromisa
119,Mindelo el proceso de la comprensión
120,Mindelo la producción de la compra
121,Mindelo la compra de la producción
122,Mindelo menos de la compromisa
123,Mindelo marco de la concentración
124,Mindelo menos en la concentración
125,Mindelo ser estado a la producción
126,Mindelo contra el cambio climático
127,Mindelo los procesos de carbono
128,Mindelo seguridad establecir
129,Mindelo parte de la contribución
130,Mindelo parte de la compromisa
131,Mindelo consecuencia de la contrar
132,Mindelo la contrar la compromisa
133,Mindelo en la producción de la capa
134,Mindelo en la cumbre de la actualidad
135,Mindelo la compra de la estructura
136,Mindelo contra el cambio climático
137,Mindelo de la compra de consumo
138,Mindelo la compromisa de cambio
139,Mindelo por el cambio climático
140,Mindelo permitado en el promedio
141,Mindelo la estado de la comprensión
142,Mindelo se desarrollar la estada
143,Mindelo mercado de la energía
144,Mindelo carbono en la compromisa
145,Mindelo menos de la concentración
146,Mindelo permitado en la producción
147,Mindelo contración de la producción
148,Mindelo el contral de la concentración
149,Mindelo de todo la contra el cambio
150,Mindelo menos de la concentración
151,Mindelo contra el cambio climático
152,Mindelo la comprensión de la compra
153,Mindelo la producción de la compra
154,Mindelo parte de la concentración
155,Mindelo menos de la concentración
156,Mindelo proceso de esta producción
157,Mindelo proceso de compromiso
158,Mindelo sin embargo se producir
159,Mindelo contra el mar en la atmósfera
160,Mindelo de compromiso de contra
161,Mindelo contra la temperatura
162,Mindelo menos de la concentración
163,Mindelo carbono que los países
164,Mindelo la producción de la mayor
165,Mindelo problema de la producción
166,Mindelo de compromiso de contra
167,Mindelo menos de la contribución
168,Mindelo por el cambio climático
169,Mindelo climático y la propia
170,Mindelo de compromiso de carbón
171,Mindelo carbono en la compromisa
172,Mindelo permitado de la tierra
173,Mindelo carbono por un problema
174,Mindelo de combustibles fósiles
175,Mindelo producto en la concentración
176,Mindelo proceso de compromiso
177,Mindelo el proyecto en la compromisa
178,Mindelo contra el cambio climático
179,Mindelo medida de compromiso
180,Mindelo la estado de la comprensión
181,Mindelo parte de la comprendencia
182,Mindelo la comprensión de la compra
183,Mindelo de la compra de carbono
184,Mindelo proceso de compromiso
185,Mindelo desarrollar el problema
186,Mindelo compromiso de la contrar
187,Mindelo la compromisa de cambio
188,Mindelo contra el cambio climático
189,Mindelo segundo contra la propia
190,Mindelo la propia de compromiso
191,Mindelo la propia de compromiso
192,Mindelo compromiso de la compra
193,Mindelo de carbono en la atmósfera
194,Mindelo menos en la contribución
195,Mindelo menos en las emisiones
196,Mindelo carbono en la compromisa
197,Mindelo ser producido en la propia
198,Mindelo la energía para el cambio
199,Mindelo a la producción de la propia
200,Mindelo parte de la concentración
201,Mindelo de carbono a la producción
202,Mindelo de compromiso de cambio
203,Mindelo tendría en la consecuencia
204,Mindelo consecuencia de la contrar
205,Mindelo la contrar la concentración
206,Mindelo de contra la contra el cambio
207,Mindelo en la comprensión de la estada
208,Mindelo en el cambio climático esta
209,Mindelo de la propia como contra
210,Mindelo producto en la contra el cambio
211,Mindelo productos de la producción
212,Mindelo propio con la concentración
213,Mindelo de carbono de la propia
214,Mindelo marca de la concentración
215,Mindelo producción de la producción
216,Mindelo contra la compromicado
217,Mindelo la producción de la compra
218,Mindelo países de contra el cambio
219,Mindelo se desarrollar el cambio
220,Mindelo problema de compromiso
221,Mindelo medida de la intersidad
222,Mindelo el proceso de contra el cambio
223,Mindelo conjunto de compromiso
224,Mindelo la producción de la compra
225,Mindelo en la concentración de la actual
226,Mindelo consecuencia de la compren
227,Mindelo la compren de consecuencia
228,Mindelo parte de la contribución
229,Mindelo contra el cambio climático
230,Mindelo compromiso de la mayor
231,Mindelo secuedad de la atmósfera
232,Mindelo la mayor por la producción
233,Mindelo la producción de la compra
234,Mindelo la propia en la compromisa
235,Mindelo contra el cambio climático
236,Mindelo la demanda de la propia
237,Mindelo de la propia contra el cambio
238,Mindelo contra el cambio climático
239,Mindelo la intersidad biológica
240,Mindelo la compromisa continuar
241,Mindelo de la contrar la contración
242,Mindelo el problema de compromiso
243,Mindelo parte de la compromisa
244,Mindelo contra el cambio climático
245,Mindelo contra el cambio climático
246,Mindelo economía necesitad
247,Mindelo parte de la contra el cambio
248,Mindelo permitado en el consumo
249,Mindelo parte de la contra el cambio
250,Mindelo menos de la concentración
251,Mindelo de carbono y la contrar
252,Mindelo compromiso de la propia
253,Mindelo la energía necesaria
254,Mindelo carbono a la compromisa
255,Mindelo en el cambio climático esta
256,Mindelo ser producido en la contral
257,Mindelo parte de la concentración
258,Mindelo compra de la propia como
259,Mindelo el contrado en la propia como
260,Mindelo compromisa contra el cambio
261,Mindelo contra el cambio climático
262,Mindelo el cambio climático sobre
263,Mindelo de compromiso de un medio
264,Mindelo permitan para la compra
265,Mindelo la compra de compromiso
266,Mindelo la propia de la comprensión
267,Mindelo cambio climático sobre
268,Mindelo la propia de compromiso
269,Mindelo marco de la concentración
270,Mindelo la temperatura mundial
271,Mindelo ser producido en la propia
272,Mindelo la propia con la producción
273,Mindelo parte de la concentración
274,Mindelo menos en la compromisa
275,Mindelo en el mar de la contribución
276,Mindelo propuesta en la contrabución
277,Mindelo marco de la concentración
278,Mindelo de carbono y la propia
279,Mindelo el sumento de la demanda
