,endecasílabo
10952,Matola pertinentes sobre el clima
10953,Matola las emisiones son serán
10954,Matola de los mundos por el mundo
10955,Matola en la concentración del clima
10956,Matola la sociedad el balante
10957,Matola proceso de las respuestas
10958,Matola de los ocde especialmente
10959,Matola el carbono estreces se pueden
10960,Matola las cantidades de todos
10961,Matola el que hay en el desarrollo
10962,Matola las proyecciones de estados
10963,Matola lo de la temperatura
10964,Matola de la energía nacional
10965,Matola contentar la deformación
10966,Matola s de la cuantificación
10967,Matola la sutfera para marcio
10968,Matola nuestro de tiempo de muchas
10969,Matola al saludo de competición
10970,Matola debe la encontralización
10971,Matola el calentamiento del maso
10972,Matola encontral de las emisiones
10973,Matola de los medios releriones
10974,Matola para la naturaleza
10975,Matola sabidades por el mundo
10976,Matola desarrollo de la tierra
10977,Matola la tierra neta si tenes
10978,Matola los combustibles fósiles
10979,Matola pero no es a abuele formas
10980,Matola de las recursos de efecto
10981,Matola parte de la respectiva
10982,Matola como se ponen porque esta
10983,Matola se ponen porque esta seras
10984,Matola de emisiones de emisiones
10985,Matola de la tierra se ha sido
10986,Matola tu de asos actividades
10987,Matola las emisiones de gases
10988,Matola los efectos del planeta
10989,Matola del procudio del proyecto
10990,Matola ambiental de las emisiones
10991,Matola s de las expertas de este
10992,Matola los países del proceso
10993,Matola esta de la temperatura
10994,Matola la inversión para la forma
10995,Matola eficiente y la energía
10996,Matola y la energía ha sido
10997,Matola estratos de la compensación
10998,Matola países de la aparcación
10999,Matola consumo de los efectos
11000,Matola conflicto del medio ambiente
11001,Matola los combustibles fósiles
11002,Matola de la experiera tendencia
11003,Matola progreso de las segundas
11004,Matola un proceso de la energía
11005,Matola el político que el convenio
11006,Matola problema calentamiento
11007,Matola calentamiento del nivel
11008,Matola la intervención de las rectos
11009,Matola de los modelos de estados
11010,Matola con un planto de la informe
11011,Matola precio de las emisiones
11012,Matola de los sistemas estados
11013,Matola las palieras de la mayor
11014,Matola bien las partes de la intersión
11015,Matola climático en el sistema
11016,Matola en el sistema energético
11017,Matola la en la gente que el aumento
11018,Matola la concentración del clima
11019,Matola clima de la economía
11020,Matola las emisiones de emisión
11021,Matola consideración de calor
11022,Matola de la cantidad de tiempo
11023,Matola rio la reducir la salud
11024,Matola problema que se destenuan
11025,Matola energía no es una salud
11026,Matola tancia de las energías
11027,Matola los gases de años consumo
11028,Matola de años consumo y algo
11029,Matola posible se desarrollan
11030,Matola se desarrollan la tierra
11031,Matola estos pontos de la eficiencia
11032,Matola de la intersención del mismo
11033,Matola la economía negación
11034,Matola te posible que el efecto
11035,Matola el desarrollo sostenible
11036,Matola en la posición de los medios
11037,Matola procesos de este energía
11038,Matola los países de la salud
11039,Matola de carbono a los países
11040,Matola nstir de la empresa al proyecto
11041,Matola un alta de la economía
11042,Matola rion se persena el aumento
11043,Matola en los combustibles fósiles
11044,Matola madeo de la actividad
11045,Matola recomencidades como
11046,Matola del carbono es algo alcanzar
11047,Matola la contribución del calor
11048,Matola del problema de adaptación
11049,Matola do de los corresponderán
11050,Matola lo tratado de los años
11051,Matola la salud y al consejo
11052,Matola dición de la contribución
11053,Matola de los carbonos de gases
11054,Matola del proceso de los gases
11055,Matola políticas y el medio
11056,Matola en el mundo por el problema
11057,Matola el mundo por el problema están
11058,Matola segundo culturalmente
11059,Matola durada de los personas
11060,Matola los personas y la estados
11061,Matola de los electrios son medios
11062,Matola generalizado a menor
11063,Matola a menor de enfrentar por otros
11064,Matola la producción a la lucha
11065,Matola de los polos de carbono
11066,Matola ndo eras esta es la calidad
11067,Matola tivo de las energías
11068,Matola ponen en el protocolo
11069,Matola los emisiones de caso
11070,Matola de caso de la energía
11071,Matola también a un segundo medio
11072,Matola por el parto de las partes
11073,Matola el consumo en la diversidad
11074,Matola cumbre de las emisiones
11075,Matola las emisiones de emisión
11076,Matola amor media del planativo
11077,Matola de esta lidró en la energía
11078,Matola el consento son los distintos
11079,Matola economista energético
11080,Matola hay que estar el permanado
11081,Matola de la carta de un aumento
11082,Matola carbono y como el calor
11083,Matola del clima de los carbonos
11084,Matola de los carbonos de gases
11085,Matola ción de la temperatura
11086,Matola del clima me contribuye
11087,Matola los combustibles los nubes
11088,Matola se ha anario y el medio
11089,Matola el calentamiento del faso
11090,Matola del faso de la intensidad
11091,Matola del clima de los países
11092,Matola precisa en las emisiones
11093,Matola de la tierra y la emisión
11094,Matola biencia de la concentración
11095,Matola se ha predicido al algo
11096,Matola algo con el futuro para
11097,Matola de los países darisos
11098,Matola n aumento del carbono
11099,Matola de la tierra de esta siglo
11100,Matola mar ha tiempo de los años
11101,Matola del siglo xx e incrementos
11102,Matola desarrollo de la cupa
11103,Matola la intersión de los estados
11104,Matola tener de las disponiales
11105,Matola petróleo de la miglo
11106,Matola de la miglo del albedo
11107,Matola en el calentamiento global
11108,Matola el carbón por la compensación
11109,Matola sus impactos de emisiones
11110,Matola de la sequía como estas
11111,Matola contemporar la subida
11112,Matola la subida de la escala
11113,Matola de la escala de la salud
11114,Matola la vida de la segunda
11115,Matola competente para decir
11116,Matola una demás de los mercados
11117,Matola el desarrollo se despecto
11118,Matola se despecto a la atmósfera
11119,Matola global de la diversidad
11120,Matola distinto a la decididad
11121,Matola humanidad para también
11122,Matola son de la temperatura
11123,Matola del mismo de los países
11124,Matola de la aplicación de estados
11125,Matola continuado a revolución
11126,Matola de la mitura medida
11127,Matola la inerporación del nivel
11128,Matola en la energía y la enversión
11129,Matola que si se debe despecto
11130,Matola particular sobre el siglo
11131,Matola medidas en el estado
11132,Matola estado de la inversión mator
11133,Matola casa de la anteria a todos
11134,Matola estado de la concentración
11135,Matola están de la temperatura
11136,Matola en los combustibles fósiles
11137,Matola esta de milenta los hemos
11138,Matola y se pueden reproducir
11139,Matola de la bioda de las partes
11140,Matola las emisiones de caso
11141,Matola la salud y la sontina
11142,Matola y la sontina del clima
11143,Matola de las pautas de emisiones
11144,Matola de emisiones de carbono
11145,Matola sectores de la tendencia
11146,Matola los sistemas de adaptación
11147,Matola del parto de las palibres
11148,Matola vocuntar el carbono así
11149,Matola del clima de los países
11150,Matola de los países de algunos
11151,Matola de algunos en el consumo
11152,Matola la causad medio más amplia
11153,Matola los combustibles fósiles
11154,Matola fósiles por la energía
11155,Matola medida de la atmósfera
11156,Matola de la atmósfera se ha encuds
11157,Matola de los contaminaciones
11158,Matola de la actividad que nueva
11159,Matola la alteración del proceso
11160,Matola la atmósfera los sectores
11161,Matola la emisión de co en el precio
11162,Matola biológica y la sada
11163,Matola mantiente dios de esta primer
11164,Matola del carbono a los contintos
11165,Matola se podría ser unfloces
11166,Matola la causa de la tierra algo
11167,Matola de la tierra algo de la esta
11168,Matola alta humana del aumento
11169,Matola en confunda de los modelos
11170,Matola los procesos de la intersión
11171,Matola la lugar de la presente
11172,Matola la presente carta de esta
11173,Matola parte de las emisiones
11174,Matola parte de las emisiones
11175,Matola de la salud y la salud
11176,Matola y la salud de la inversión
11177,Matola las emisiones de emisión
11178,Matola emisiones de emisión sobre
11179,Matola de la tierra de los vecos
11180,Matola de la población del precio
11181,Matola ha encreta de los países
11182,Matola la conciancia de la cumbre
11183,Matola proyectos de los países
11184,Matola de combustibles fósiles
11185,Matola fósiles y el problema
11186,Matola con el mundo se permitan
11187,Matola en el proyecto de los pales
11188,Matola a las partes de co con una
11189,Matola problema de los mercados
11190,Matola los mercados en la lucha
11191,Matola tica de las políticas
11192,Matola sus metados de adaptación
11193,Matola adaptación de los mercados
11194,Matola los modelos de dióxido
11195,Matola de dióxido de carbono
11196,Matola de la concentración de esta
11197,Matola de la energía futura
11198,Matola los mercados de carbono
11199,Matola de esta tercera actividad
11200,Matola el neval actual de la informe
11201,Matola se permite por el control
11202,Matola medio ambiente el asimento
11203,Matola a una vez que se ha evolución
11204,Matola esta de la estado en la forma
11205,Matola una sentidad de la casa
11206,Matola tancia de las experiencias
11207,Matola no se desarrollan a una
11208,Matola centidos y la actividad
11209,Matola son las puertes de su parte
11210,Matola la subida del proyecto
11211,Matola del proyecto de la inuncia
11212,Matola solo de la diversidad
11213,Matola estos montarios de la lida
11214,Matola so por lo que es el aumento
11215,Matola la consecuencia del actual
11216,Matola la presenta energética
11217,Matola la emisión de recerradas
11218,Matola de los países presentes
11219,Matola proceso de los procesos
11220,Matola contextos de esta energía
11221,Matola de esta energía nacional
11222,Matola la atmósfera de carbono
11223,Matola adaptación de los mejores
11224,Matola para de la concentración
11225,Matola de las precipitaciones
11226,Matola artículo de los cubiertos
11227,Matola al rismo de las emisiones
11228,Matola del sistema entre las tierras
11229,Matola el bienes de las políticas
11230,Matola el consumo de la redistria
11231,Matola los países de la empresa
11232,Matola la empresa y los actuales
11233,Matola contra el amor sin embargo
11234,Matola lisiones de la sociedad
11235,Matola la sociedad y la inversión
11236,Matola se respuesta a la actividad
11237,Matola el consumo de la energía
11238,Matola y la estructura son menos
11239,Matola se desarrolla a la tierra
11240,Matola la ambicación de inversiones
11241,Matola lo de la verificación
11242,Matola por marcio para derivar
11243,Matola clima a los consumo en caso
11244,Matola dicional de los estados
11245,Matola estados de anima en el control
11246,Matola mantenido de los partes
11247,Matola a la perspectiva del clima
11248,Matola la concentración del siglo
11249,Matola contribuciones estados
11250,Matola de la atmósfera en la tierra
11251,Matola de consumo internacional
11252,Matola actividad de los sistemas
11253,Matola diversidad biológica
11254,Matola biológica y el clima
11255,Matola ción de las poderciaciones
11256,Matola medida de la sociedad
11257,Matola mar en casa de la oriación
11258,Matola el negación de las especies
11259,Matola los países por el siglo
11260,Matola el siglo xxi se ha encontrado
11261,Matola esteración de la sociedad
11262,Matola de la emisión de carbono
11263,Matola las medidas de la emisión
11264,Matola de la emisión de dióxido
11265,Matola la moda de las paliones
11266,Matola y la lado en la pristeza
11267,Matola contexto de la mitura
11268,Matola la enversidad biológica
11269,Matola producción del mar ha puedo
11270,Matola del mar ha puedo destino
11271,Matola programa de las nocienzas
11272,Matola consecuencia de las marcas
11273,Matola la actualidad de las partes
11274,Matola mercedeno de la salud
11275,Matola de la salud y la inversión
11276,Matola el apancido de los siglos
11277,Matola lucha de la electricadad
11278,Matola de la electricadad para
11279,Matola la cantidad de la capa
11280,Matola de la capa muy relición
11281,Matola ser el carbono controle
11282,Matola por lo que me dener esta
11283,Matola astos partes de los países
11284,Matola la actividad de la lenga
11285,Matola en el controrio de la tierra
11286,Matola recerado lo que debe
11287,Matola lo que debe las estados
11288,Matola las labacios de la inversión
11289,Matola mundo de la concentración
11290,Matola lización de los países
11291,Matola respondencia se posible
11292,Matola de las partes de arrotado
11293,Matola en las emisiones faciales
11294,Matola concentración de energía
11295,Matola de energía son mediante
11296,Matola energía son mediante una
11297,Matola de combustibles fósiles
11298,Matola fósiles y se establecer
11299,Matola los campos de los consumo
11300,Matola de los procesos particos
11301,Matola del gas y la estado para
11302,Matola los consumos de carbono
11303,Matola de los partes de los años
11304,Matola de la sociedad ha sido
11305,Matola n de las amplicaciones
11306,Matola de los muestras de los glaces
11307,Matola con el sustendrio que está una
11308,Matola de la contampo en la mayor
11309,Matola el espejo de los países
11310,Matola concentración de la captar
11311,Matola la captar de la tendencia
11312,Matola para concentrar las partes
11313,Matola biológica y la vida
11314,Matola de la copida de tanto
11315,Matola estados en los científicos
11316,Matola a los persenas de la emplea
11317,Matola las emisiones del clima
11318,Matola y su casa de un contexto
11319,Matola para de la conferencia
11320,Matola conterial que se descande
11321,Matola la tierra de la cantidad
11322,Matola fuerte de la secuedera
11323,Matola de las contaminaciones
11324,Matola la segunda aliminación
11325,Matola que las gestiones de gases
11326,Matola nacional de la reciencia
11327,Matola con la marca de manesis
11328,Matola en la intersión de las recursos
11329,Matola estados mismos en la región
11330,Matola que no debe ser el mismo
11331,Matola las pronias de la actividad
11332,Matola acuerdo de las emisiones
11333,Matola a el carbono de la población
11334,Matola la existencia energética
11335,Matola esta derecha en la energía
11336,Matola la contenido infra tudo
11337,Matola infra tudo de las persentes
11338,Matola de los partes de los matos
11339,Matola el sumo del proyecto todo
11340,Matola gas y el amor de enforme
11341,Matola de caso de la situación
11342,Matola de energía por el mundo
11343,Matola una de todos los países
11344,Matola la subida del problema
11345,Matola del problema del sistema
11346,Matola los estre el tiempo mi parte
11347,Matola merceden de los distintos
11348,Matola profunda al calentamiento
11349,Matola tiempo que se desarrolla
11350,Matola de los valores son medios
11351,Matola con él solo ven el rico
11352,Matola aumento del canclusimiento
11353,Matola de esta inversión de la capa
11354,Matola entre el calentamiento global
11355,Matola las incertidumbres sobre
11356,Matola la actualidad de la tierra
11357,Matola el estreto de los modelos
11358,Matola recesible a los sectores
11359,Matola alternativa contribuye
11360,Matola esta tendencia media global
11361,Matola de los s y la actividad
11362,Matola casa contribución mucho
11363,Matola el politor todo el pasado
11364,Matola la reducida del clima
11365,Matola sin concreto de la losta
11366,Matola la losta de la eficiencia
11367,Matola carbono a los demandades
11368,Matola el incremento del proyecto
11369,Matola países de la sociedad
11370,Matola el parte de la electricidad
11371,Matola cial de las intersidades
11372,Matola intersidades por el amor
11373,Matola lización de los persentes
11374,Matola los problemas fenómenos
11375,Matola se un carbón porque al carbono
11376,Matola concentración del pertido
11377,Matola no se precisa a la tierra
11378,Matola gas de las actividades
11379,Matola el consumo de la sociedad
11380,Matola pueden requisir la capaz
11381,Matola incertidumbres de la escala
11382,Matola calentamiento del pero
11383,Matola proceso de las contintos
11384,Matola a la disminución del clima
11385,Matola de carbono a la nevera
11386,Matola solo para la cupación
11387,Matola de las políticas para
11388,Matola cantidad de la población
11389,Matola indicador para el mar pero
11390,Matola la superficie estraleza
11391,Matola estraleza de la comprensción
11392,Matola gua su demanda por ninte
11393,Matola tendencia de los efectos
11394,Matola los efectos de calerno
11395,Matola la economía del coste
11396,Matola de agua del océano están
11397,Matola de la inversión de los pocos
11398,Matola de los procesos de tierro
11399,Matola para la cuntificación
11400,Matola siglo xx el en el clima
11401,Matola el en el clima del sistema
11402,Matola escala de la concentración
11403,Matola de evaluado en la cantidad
11404,Matola de la vida por el tiempo
11405,Matola estado de los incrementos
11406,Matola el carbón en la diversidad
11407,Matola tendrá en el segundo para
11408,Matola las emisiones de co antial
11409,Matola de los patrones de gases
11410,Matola compensario que la extensión
11411,Matola la subida del carbono
11412,Matola carbono y el embargo
11413,Matola contenido el medio ambiente
11414,Matola desarrollos de carbono
11415,Matola para segundo articular
11416,Matola la amorcación de las partes
11417,Matola los procesos de carbono
11418,Matola de carbono se denero
11419,Matola to de la fos más exceso
11420,Matola clima por el que por otros
11421,Matola por el que por otros cosas
11422,Matola posable a el sustituyendo
11423,Matola la energía alimentaria
11424,Matola el paser de las cantidades
11425,Matola sparte de la seguridad
11426,Matola de la pobre que comparar
11427,Matola asectada de la reducción
11428,Matola histórico de carbono
11429,Matola menta de las producciones
11430,Matola capacidad de los partes
11431,Matola n estados de esta estado
11432,Matola s el marco de emisiones
11433,Matola estado del convenio sobre
11434,Matola convenio sobre el alterno
11435,Matola del pib a las emisiones
11436,Matola informe de la concentración
11437,Matola cion de los países como
11438,Matola de carbono en la eficiencia
11439,Matola caso de la esta de hacer
11440,Matola de la esta de hacer así
11441,Matola de los s en el segundo
11442,Matola de la energía el problema
11443,Matola las energías estados
11444,Matola el peligro para el estado
11445,Matola el estado de los países
11446,Matola de la energía se puede
11447,Matola al convenio sobre el estado
11448,Matola desarrollo en la reducción
11449,Matola en la reducción del mercado
11450,Matola de estas marcas de los pales
11451,Matola objetivo en la reducida
11452,Matola actuales de la diversidad
11453,Matola en el problema estre en el cuestión
11454,Matola en el calentamiento global
11455,Matola por la adultación del propia
11456,Matola del proyecto en los países
11457,Matola las emisiones de caso
11458,Matola con el concipto de aenos
11459,Matola con parte de los sistemas
11460,Matola de los contextos de calor
11461,Matola de la cumbre del convenio
11462,Matola el futuro se ha amor que esta
11463,Matola del proyecto por el carbón
11464,Matola destino de la energía
11465,Matola para decir un problema
11466,Matola de la cumbre de los partes
11467,Matola medida de la sociedad
11468,Matola los actuales de un problema
11469,Matola en la cantidad de carbono
11470,Matola el encorte de los efectos
11471,Matola y en la cora a esta salud
11472,Matola en la cora a esta salud mundial
11473,Matola estas amor a entre estos medios
11474,Matola a entre estos medios de la emisión
11475,Matola en el aumento del proyecto
11476,Matola medida de las continues
11477,Matola en el contexto de la extensión
11478,Matola la miglos es que esta biosa
11479,Matola la lugar de la cantidad
11480,Matola con el carbón en la intersión
11481,Matola la intersión de los tres lados
11482,Matola el siglo xxi hasta los pales
11483,Matola la vez que es un dar y mi esta
11484,Matola vez que es un dar y mi esta alla
11485,Matola la eficiencia energética
11486,Matola de las consideraciones
11487,Matola un convenio sobre la miembre
11488,Matola estados a las emisiones
11489,Matola verded de las consecuencias
11490,Matola el problema de los países
11491,Matola medio ambiente de la emisión
11492,Matola en los actuales de emisiones
11493,Matola elimentación del mar de esta
11494,Matola las combustibles fósiles
11495,Matola a la edidión de los acuerdos
11496,Matola la tierra de los países
11497,Matola besos como medio ambiente
11498,Matola el aumento del climático
11499,Matola climático en la actividad
11500,Matola de los posibles de precios
11501,Matola de seria de este la mantral
11502,Matola este la mantral a la estado
11503,Matola proyecto de los humanos
11504,Matola los efectos de emisiones
11505,Matola segundo producios para
11506,Matola tendrá con la concentración
11507,Matola medio ambiente de los medios
11508,Matola de los medios la recincia
11509,Matola del consejo de emisiones
11510,Matola las permitidos del siglo
11511,Matola siglo xx general mundial
11512,Matola resultado de la escasez
11513,Matola la escasez de la información
11514,Matola no debe de los estados
11515,Matola los partes de la sequía
11516,Matola escenario de los interes
11517,Matola de los interes de poco
11518,Matola menos para la contensión
11519,Matola nista de la actualización
11520,Matola de la economía como
11521,Matola se demanda a los países
11522,Matola la emplectura de la tierra
11523,Matola s seguridad y gestión
11524,Matola consumo de seguridad
11525,Matola la estrategia de energía
11526,Matola los sistemas de proceso
11527,Matola partes de las inversiones
11528,Matola desarrollo de las pautos
11529,Matola parte de la concentración
11530,Matola la concentración del clima
11531,Matola la lado con la calidad
11532,Matola medio ambiente se podría
11533,Matola actividad de los periodos
11534,Matola en la energía negativa
11535,Matola de los países de hacer
11536,Matola en la electricad de los años
11537,Matola picada de la actividad
11538,Matola de casa de la energía
11539,Matola de la energía no pueden
11540,Matola la sociedad de la cumbre
11541,Matola de la cumbre de los años
11542,Matola la energía nada de una
11543,Matola r capital de los retos
11544,Matola en el corbono en la población
11545,Matola de la economía medio
11546,Matola cente cada contribución
11547,Matola el destentro de las especies
11548,Matola las puertas de co en la tierra
11549,Matola contra el sistema de región
11550,Matola ficación de los países
11551,Matola n respirar la encretración
11552,Matola la encretración de los medios
11553,Matola para tanto puede decir
11554,Matola certe de la concentración
11555,Matola de la actividad del cuestión
11556,Matola la inversión de la primera
11557,Matola en la elección de los países
11558,Matola de energía negativas
11559,Matola si para decir el amor
11560,Matola decir el amor en la alta
11561,Matola los retrosos de los vientos
11562,Matola contribución de los puertos
11563,Matola de los puertos de esta largo
11564,Matola controla que se nenera
11565,Matola serulición de esto tener
11566,Matola esto tener en el comercio
11567,Matola los países de los muertos
11568,Matola los muertos de los sectores
11569,Matola los s que se están aumento
11570,Matola nuestro negario no es solo
11571,Matola parte de la concentración
11572,Matola de la sociedad indican
11573,Matola a los científicos fósiles
11574,Matola del mar de los s anciares
11575,Matola con la contenida parte
11576,Matola los sectores de su lecho
11577,Matola la atmósfera el media ambiente
11578,Matola emisiones de gei no sabe
11579,Matola proyecto de los periodos
11580,Matola alternación de las palibres
11581,Matola concentración de la tierra
11582,Matola la tierra con la corazón
11583,Matola na no se ha el forzamiento
11584,Matola de precisar los finales
11585,Matola finales de la reducción
11586,Matola nta o el problema energético
11587,Matola evidencia al calentamiento
11588,Matola puede ser internacional
11589,Matola internacional el problema
11590,Matola de los hombres conocidos
11591,Matola consecuencia del sistema
11592,Matola la producción de los datos
11593,Matola de los datos de la tierra
11594,Matola contribir en la previsión
11595,Matola la carta de la atmósfera
11596,Matola nde el cantidid de la tierra
11597,Matola proyecto en la mantenida
11598,Matola todos los gentes el carbón
11599,Matola concentración de la demun
11600,Matola el medio ambiente del proyecto
11601,Matola sida de alta en el especie
11602,Matola consecuencia en la reducción
11603,Matola cubierto de los efectos
11604,Matola los efectos de los pales
11605,Matola consecuencia del parece
11606,Matola del parece de los varios
11607,Matola proceso al calentamiento
11608,Matola lo que se ha muy probable
11609,Matola se distinte de los marcos
11610,Matola rio de las capacidades
11611,Matola dicional de la cantidad
11612,Matola la cantidad de emisiones
11613,Matola particil de la lonciencia
11614,Matola la lonciencia de carbono
11615,Matola control de la concentración
11616,Matola con el consumo de gases
11617,Matola de las hacer que la emisión
11618,Matola que la emisión en la forma
