,endecasílabo
5501,Matola las emisiones de gases
5502,Matola en la demanda por la salud
5503,Matola ndo de la tecnología
5504,Matola las pronimiciones de esta
5505,Matola consideración y serán
5506,Matola de la informe del proyecto
5507,Matola del proyecto de la tierra
5508,Matola el paso de la mitigación
5509,Matola mentaria por el carbono
5510,Matola los altos de los países
5511,Matola alta mundial se producirán
5512,Matola los procesos en la firma
5513,Matola no es un problema de aumento
5514,Matola mercado de la energía
5515,Matola de contentar la cantidad
5516,Matola permitido en el entreno
5517,Matola el entreno de la corbuna
5518,Matola bilizadoras controlas
5519,Matola es los pales de contenira
5520,Matola el caso de hacer que el siglo
5521,Matola los partes en el contexto
5522,Matola de marco de los países
5523,Matola na y por su pibre tanta
5524,Matola especial de las políticas
5525,Matola la subida del proceso
5526,Matola proceso del paso a menor
5527,Matola el cálculo de los valores
5528,Matola de los valores de efecto
5529,Matola climático en el consejo
5530,Matola producirá a un corbustible
5531,Matola del siglo xxi el climático
5532,Matola de los años se ha extramo
5533,Matola las productos de productos
5534,Matola un vido por lo que se empazan
5535,Matola carbono y en las partes
5536,Matola en un conjunto de la tierra
5537,Matola el siglo xxi y el acuerdo
5538,Matola en los precios de la actividad
5539,Matola de la cumpleza de caler
5540,Matola se salia a la organización
5541,Matola mantenida del distema
5542,Matola nceptar con la luna en la agua
5543,Matola con la luna en la agua marca
5544,Matola desarrollo de la elección
5545,Matola la elección de la actividad
5546,Matola biológica con el amor
5547,Matola es derecho por lo que aleran
5548,Matola atmosféricos de carbono
5549,Matola de los progresos de tipo
5550,Matola de las funciones de emisión
5551,Matola que en el aumento del mayor
5552,Matola de de la temperatura
5553,Matola en el contribición del clima
5554,Matola de los países son control
5555,Matola control son a la luz para
5556,Matola economías de las altas
5557,Matola los procesos de emisiones
5558,Matola invertigucior de la tierra
5559,Matola que se arrece en el consumo
5560,Matola en el consumo por el corbón
5561,Matola la población de las partes
5562,Matola las partes de los países
5563,Matola un sistema de los países
5564,Matola consecuencias de la tierra
5565,Matola el carbono y a un consumo
5566,Matola de la mayor calentación
5567,Matola el problema de los países
5568,Matola de los s en la actividad
5569,Matola el capeldo de los derivos
5570,Matola de calentamiento global
5571,Matola en concentración de las partes
5572,Matola de las partes de carbono
5573,Matola cata de calentamiento
5574,Matola reducir la política
5575,Matola a la medida energética
5576,Matola en el carbono en la comprensión
5577,Matola aspecto de la organización
5578,Matola varia de los políticos
5579,Matola se dispone en la comprensión
5580,Matola sostenibles a la inversión
5581,Matola de los medios de dióxido
5582,Matola contribuir la concentración
5583,Matola de contribuir los proyectos
5584,Matola los proyectos en un nivel
5585,Matola alta necesita en su manos
5586,Matola ndo contribuir el ancento
5587,Matola ancento de la concentración
5588,Matola del sistema climático
5589,Matola recios en la capacidad
5590,Matola los países para el carbón
5591,Matola el carbón en los combustibles
5592,Matola s internacionalmente
5593,Matola la presencia de las partes
5594,Matola del proyecto india medida
5595,Matola el margo de la economía
5596,Matola desarrollo de la mayor
5597,Matola evaluaciones de la salud
5598,Matola de las cumbres de emisiones
5599,Matola desarrollo de la salud
5600,Matola de la salud y la previa
5601,Matola la salud y la previa actual
5602,Matola cades y contribuciones
5603,Matola algo de la contaminación
5604,Matola y las cartas de la mayor
5605,Matola la supuesto a la actividad
5606,Matola en la capa de la actividad
5607,Matola de la extensión de la tierra
5608,Matola la langa de los últimos
5609,Matola efectos de gases de efecto
5610,Matola les en la nerefecación
5611,Matola la salud y la segunda
5612,Matola causa del calentamiento
5613,Matola las partes de la socuedad
5614,Matola de la fe hace un aumento
5615,Matola las emisiones de caso
5616,Matola de caso de la cantidad
5617,Matola de los carbonos de escala
5618,Matola el nivel del mar en el parto
5619,Matola energético son destrular
5620,Matola será de la mayor parte
5621,Matola reducción del consecuencia
5622,Matola consecuencia como estados
5623,Matola amor a mantenir a la esta
5624,Matola destintal de esta derecha
5625,Matola siglo xx estos límites
5626,Matola supuestra en las emisiones
5627,Matola energética de la salud
5628,Matola más acuerdos de la tierra
5629,Matola acuerdos de la tierra como
5630,Matola un volumen de los modelos
5631,Matola los modelos de los años
5632,Matola de esta de la concentración
5633,Matola el contexto de la energía
5634,Matola contrabue se desemplean
5635,Matola se desemplean se control
5636,Matola se control de los países
5637,Matola medio albo y de la tierra
5638,Matola las altas en la demanda
5639,Matola en la demanda del carbono
5640,Matola electricidad de la tierra
5641,Matola el desarrollo por el merco
5642,Matola los países de emisiones
5643,Matola la casa de la antelidad
5644,Matola del siglo xx a emisiones
5645,Matola xx a emisiones de puestas
5646,Matola de la extensión del proyecto
5647,Matola tonfici no se desarro
5648,Matola no se desarro una gentral
5649,Matola de los s en el contexto
5650,Matola medida de los periodos
5651,Matola de los periodos de efecto
5652,Matola me para de tu contrario
5653,Matola de incertidumbre por dichos
5654,Matola la capa de compensación
5655,Matola que esta consecuencia de esta
5656,Matola la tarde por el problema
5657,Matola de los varias de la inversión
5658,Matola pertinentes en la tierra
5659,Matola con ti mismo por cien de este
5660,Matola por mucho más fuertes de estos
5661,Matola concentración de la apena
5662,Matola de sistema del proyecto
5663,Matola proyecto que se ha expansión
5664,Matola coriolana a los países
5665,Matola las emisiones de gases
5666,Matola es un rento de la intervención
5667,Matola de los estados de alanca
5668,Matola de las precipitaciones
5669,Matola ante la luz una perioda
5670,Matola la marca de los efectos
5671,Matola el enforma de las medidas
5672,Matola concentración del sistema
5673,Matola del sistema climático
5674,Matola la concentración del poser
5675,Matola el inversidad en la ciencia
5676,Matola la medida de la mayor
5677,Matola sociedad finalimental
5678,Matola medio ambiente para comprar
5679,Matola para comprar el consenso
5680,Matola que se incrementa el carbono
5681,Matola la superficie del siglo
5682,Matola de carbono en la principal
5683,Matola la parte de la matiga
5684,Matola solacidad de las precios
5685,Matola el siglo xx me consideran
5686,Matola los medios de los procesos
5687,Matola del ocde por la converción
5688,Matola de combustibles fósiles
5689,Matola de los consumos presentes
5690,Matola presentes partes de estados
5691,Matola de los s en palitrales
5692,Matola en palitrales y la parte
5693,Matola parto de los desarrollos
5694,Matola de los desarrollos entre
5695,Matola los actuaciones de estados
5696,Matola proyecto a la electricidad
5697,Matola los paleriones de gases
5698,Matola de las contaminaciones
5699,Matola los pocos de la electrica
5700,Matola la escala de los s estas
5701,Matola la agua muerte de la tensión
5702,Matola carbono son muy probables
5703,Matola de la esteriencia están parte
5704,Matola en la conferencia de efecto
5705,Matola el sistema estre o el desarrollo
5706,Matola de precios de la contención
5707,Matola sobre el corbono de inversión
5708,Matola de la forma de alta parte
5709,Matola de los medios de carbono
5710,Matola partir de la incertidumbre
5711,Matola este adiocimo es la energía
5712,Matola menos y la concentración
5713,Matola minimiento de la vida
5714,Matola carbono y el futuro
5715,Matola solución de las pruciestas
5716,Matola la vida de los países
5717,Matola los países de la parte
5718,Matola que el corbón y manteniendo
5719,Matola ha encentido a la estado a una
5720,Matola de la tierra tendrá en calor
5721,Matola de la lugar de las camos
5722,Matola intervaciones en la tierra
5723,Matola que no deberán presente
5724,Matola la concentración del patrón
5725,Matola el carbón en la política
5726,Matola la transición del consumo
5727,Matola del proyecto el ser de encana
5728,Matola ra vez más probablemente
5729,Matola y son emportar pasados
5730,Matola efectos no las vaces para
5731,Matola la enfrentida de la tierra
5732,Matola invernadero en la actividad
5733,Matola comprometen el consumo
5734,Matola gran el mundo se ha hacer
5735,Matola de adaptación de energía
5736,Matola al aumento del mar los gases
5737,Matola artículo de las palercias
5738,Matola los países de la mantra
5739,Matola la oriente se ha posible
5740,Matola de la carta de la forma
5741,Matola años se tenden por el cielo
5742,Matola contra el condencion o el medio
5743,Matola el condencion o el medio ambiente
5744,Matola probuema de la eficiencia
5745,Matola de la capa de electoria
5746,Matola no se perder a la empiencia
5747,Matola en el forzamiento del clima
5748,Matola del consumo de la viente
5749,Matola presentar encortaciones
5750,Matola de la energía natural
5751,Matola internacional de la mayor
5752,Matola las comparaciones de este
5753,Matola lo que decir a mi carga
5754,Matola de la tierra en el volumen
5755,Matola se están en la concentración
5756,Matola medidas de transformación
5757,Matola transformación del convenio
5758,Matola problema de los países
5759,Matola de los aguas de manera
5760,Matola en los combustibles fósiles
5761,Matola climático en la convención
5762,Matola baser la segunda parte
5763,Matola el calentamiento del nivel
5764,Matola la información de la oriente
5765,Matola permitido a la recisión
5766,Matola ndo el climático en los pales
5767,Matola pasados en la cantidad
5768,Matola fundamentales de la otra
5769,Matola unos s an las inversiones
5770,Matola del resto de los aspectos
5771,Matola infrigible del climático
5772,Matola de la amenaza y mayor
5773,Matola n seguridad natural
5774,Matola natural de compensación
5775,Matola del sistema climático
5776,Matola el caso de las políticas
5777,Matola de la convención del aire
5778,Matola de las precipitaciones
5779,Matola las capas de los procesos
5780,Matola los pocos en la explotación
5781,Matola necesidad por la fuerte
5782,Matola la fuerte de la energía
5783,Matola la tierra con la encretride
5784,Matola transmisión al medio ambiente
5785,Matola medio ambiente de los pocos
5786,Matola los países de los retuos
5787,Matola por visto de el el sistema
5788,Matola las emisiones de gases
5789,Matola se ha sido conferindad
5790,Matola n el carbono y nuestro
5791,Matola los consumos para glaciar
5792,Matola en contribución con la anterior
5793,Matola dicional de la actividad
5794,Matola a la tierra y el mercado
5795,Matola de los países de la eso
5796,Matola clima de la concentración
5797,Matola variable y el consumo
5798,Matola del maso de los países
5799,Matola de la estudión de adaptación
5800,Matola nitarion a los países
5801,Matola de la actividad de efectos
5802,Matola de los estados contextos
5803,Matola el carbono por el carbono
5804,Matola decir de las variaciones
5805,Matola emisiones de gei y para
5806,Matola de gei y para la parte
5807,Matola del aumento de la intensión
5808,Matola de la intensión de los partes
5809,Matola actividad internacional
5810,Matola meteno de los países
5811,Matola los países en la extensión
5812,Matola nunca de la seguridad
5813,Matola el que al contamo minitario
5814,Matola y el acuerdo del siglo
5815,Matola tendencia en la electricidad
5816,Matola en la electricidad y medio
5817,Matola de la necesidad de algo
5818,Matola de las marcas de energía
5819,Matola de energía y de el marco
5820,Matola en un aumento del proyecto
5821,Matola rición de la concentración
5822,Matola en los países derivados
5823,Matola del mercado de las cumbres
5824,Matola que el problema entre las tierras
5825,Matola fe media de la reducción
5826,Matola se carbonó los países
5827,Matola los países de las partes
5828,Matola la reducción de la luna
5829,Matola de la luna se ha erado
5830,Matola de los países de efectos
5831,Matola que es que los considerados
5832,Matola de los efectos del medio
5833,Matola el susticie de los países
5834,Matola las concentraciones de este
5835,Matola los contextos de la lugar
5836,Matola que el protocolo de kioto
5837,Matola proyecto por la actualidad
5838,Matola demanda de la segunda
5839,Matola del proyecto en el consumo
5840,Matola por desarrollo a la emisión
5841,Matola a la emisión permitiga entre
5842,Matola el contexto de los recursos
5843,Matola de la vida del mercado
5844,Matola mercado lo que se puede
5845,Matola de la mayor actualidad
5846,Matola actualidad de la población
5847,Matola de los efectos para una
5848,Matola la contribución de efectos
5849,Matola último de las emisiones
5850,Matola periodo de los países
5851,Matola los compromisos de efecto
5852,Matola las procesos de carbono
5853,Matola carbono para la guerra
5854,Matola el espejo de la opacera
5855,Matola concentación del proyecto
5856,Matola proyecto de la adoptación
5857,Matola que se pendió a la cuebría
5858,Matola carbón a los desarrollos
5859,Matola se está algo que no puede estar
5860,Matola del calentamiento global
5861,Matola los proyectos de la lucha
5862,Matola el desarrollo de carbono
5863,Matola cian de la subida de una
5864,Matola está aprobado son mejores
5865,Matola los peligos de los partes
5866,Matola los partes de las talleras
5867,Matola con poder tu lado de ellos
5868,Matola compensario en el contexto
5869,Matola las informes son mi señor
5870,Matola atmósfera es un nuevo estado
5871,Matola de marcas y la previsión
5872,Matola barada de la actividad
5873,Matola la actividad del proyecto
5874,Matola un consecuencia de la espacia
5875,Matola auficiente caudadano a una
5876,Matola en la catalidad de precios
5877,Matola de la cumbre del carbono
5878,Matola de la mitura en el siglo
5879,Matola la escala de estos sectores
5880,Matola el caso de la concentración
5881,Matola para que es de entrar cantidad
5882,Matola con el cuarto de la vida
5883,Matola los países de los gases
5884,Matola contexto de los efectos
5885,Matola los efectos de esta tuco
5886,Matola efectos de esta tuco confian
5887,Matola el desarrollo de carbono
5888,Matola de carbono contro el carbón
5889,Matola los países de adaptación
5890,Matola compuesto de la producción
5891,Matola la mitura de la loncia
5892,Matola ticio de los políticos
5893,Matola los diferentes son menos
5894,Matola sobre el interior siguiente
5895,Matola medidas de la actividad
5896,Matola de la actividad del cráces
5897,Matola las emisiones de caso
5898,Matola modelo de las procesos
5899,Matola las procesos de la estado
5900,Matola informe de la recondección
5901,Matola del calentamiento medio
5902,Matola medio ambiente en el consumo
5903,Matola de las partes de reducir
5904,Matola a la demanda del periodo
5905,Matola países de la calidad
5906,Matola permitir el concentración
5907,Matola el parece de la miguación
5908,Matola nce se sienda en la segunda
5909,Matola a los combustibles fósiles
5910,Matola de la contenira de esta
5911,Matola solación de la actualidad
5912,Matola medio ambiente en la concencia
5913,Matola a los acentes de las cubrer
5914,Matola de la tierra de presente
5915,Matola además de ser nuevos partes
5916,Matola ambiente de la concentración
5917,Matola las medidas del cancedo
5918,Matola cancedo de la altoración
5919,Matola en el sistema económico
5920,Matola contribución al proyecto
5921,Matola proyecto más ambientales
5922,Matola la calidad de carbono
5923,Matola carbono de la energía
5924,Matola de la energía natural
5925,Matola de medidas de carbono
5926,Matola política internacional
5927,Matola funcionamiento del siglo
5928,Matola siglo xx la política
5929,Matola medio albo del clima carga
5930,Matola de la energía encentrario
5931,Matola contexto de la atmósfera
5932,Matola sociomes de disponible
5933,Matola disponible que los pales
5934,Matola del parece de las partes
5935,Matola tra el calentamiento medio
5936,Matola problema de los niveles
5937,Matola las emisiones de gases
5938,Matola salud y la concentración
5939,Matola la luzquier el auto estado
5940,Matola auto estado por la sapera
5941,Matola do que se están en el mundo
5942,Matola países de la atmósfera
5943,Matola carbona de la manera
5944,Matola de la actividad de todos
5945,Matola vida por el carbón de esta
5946,Matola por el carbón de esta carbón
5947,Matola de la tierra de la inversión
5948,Matola contenida del carbono
5949,Matola carbono y el problema
5950,Matola aumentos de la humanidad
5951,Matola marira seguirá haya
5952,Matola seguirá haya medida
5953,Matola los países de los años
5954,Matola los s en la economía
5955,Matola mayor a su forzamiento
5956,Matola a los consumos se transportes
5957,Matola nacia invernadero en cuento
5958,Matola de los contaminaciones
5959,Matola ciones de la economía
5960,Matola de los actos de los pocos
5961,Matola por los estados previstos
5962,Matola pero es decir la contención
5963,Matola la informe de los países
5964,Matola los efectos de la subir
5965,Matola el mercado por el corbono
5966,Matola ran en la energía fuere
5967,Matola de la tierra mundial así
5968,Matola de la contra en todo el mucho
5969,Matola establecer la estaminación
5970,Matola ca de la temperatura
5971,Matola los estados en las tierras
5972,Matola el carbono y de esta casa
5973,Matola inversión de las combustibles
5974,Matola proyecto de la sociedad
5975,Matola medio ambiente del padencial
5976,Matola del padencial de la salud
5977,Matola neoclásico en el control
5978,Matola en el control de la energía
5979,Matola no pueden en el mercado
5980,Matola los miembros de la atmósfera
5981,Matola la atmósfera de los series
5982,Matola ndo en el corbón y su parte
5983,Matola nuestra de la humanidad
5984,Matola la humanidad no puede
5985,Matola la primera no me deja
5986,Matola me deja de hacer hacer
5987,Matola transformación de la estado
5988,Matola los sistemas continuados
5989,Matola del pertido de la emisión
5990,Matola de la economía para
5991,Matola la secuedad del gas pero
5992,Matola de la luna con el calor
5993,Matola del consumo de los polos
5994,Matola contribución del peligro
5995,Matola peligro de las prucencia
5996,Matola ciencia de las combustibles
5997,Matola al combustible los proyectos
5998,Matola nición de los océanos
5999,Matola parte de las emisiones
6000,Matola internacional para formar
6001,Matola el anular en contenido
6002,Matola si función de los periodos
6003,Matola de la capaz de barata
6004,Matola capaz de barata de esta
6005,Matola de barata de esta propio
6006,Matola de la inversión del contexto
6007,Matola para el parto de las camos
6008,Matola co que le desarrollada
6009,Matola por del uso de la carta
6010,Matola de la tierra en el contorio
6011,Matola en el contorio de las vidas
6012,Matola de la amplia de inversión para
6013,Matola menida con el mercado
6014,Matola de la puerta en el sistema
6015,Matola como parto de manenis
6016,Matola rios de gusarle a una mayor
6017,Matola a una mayor parte se puede
6018,Matola continuar a un carbono algo
6019,Matola un carbono algo para recir
6020,Matola reducir la concentración
6021,Matola de efectos de los efectos
6022,Matola general de la energía
6023,Matola lugar de las emisiones
6024,Matola también son en el contexto
6025,Matola de los medios de carbono
6026,Matola los medios de carbono otros
6027,Matola de encontrar a los países
6028,Matola sidad de las emisiones
6029,Matola los medios en menos tendrá
6030,Matola en menos tendrá la proyección
6031,Matola cado por el contribución
6032,Matola se pueden precipitación
6033,Matola demanda de la variación
6034,Matola el climático las acciones
6035,Matola compensaria mundial de esta
6036,Matola más amor de los distintos
6037,Matola en los dioses de compensación
6038,Matola la concentración del madio
6039,Matola n el aumento del graco
6040,Matola que permita a la actividad
6041,Matola la atmósfera más palibres
6042,Matola dición de calentamiento
6043,Matola planeta son desarrollos
6044,Matola considerar el enforma
6045,Matola en el carbono y de acuerdo
6046,Matola que puedan ser el proceso
6047,Matola y serán un desarrollo
6048,Matola el responsable que los años
6049,Matola del que pueda a la transición
6050,Matola o los países de los palas
6051,Matola se descanta los anexos
6052,Matola anexos para la respuesta
6053,Matola el mismo de las emisiones
6054,Matola calculado a la sociedad
6055,Matola los a una mayor inversión
6056,Matola muedo de la mayor parte
6057,Matola no he muerto en el aumento
6058,Matola contribuir a la del parto
6059,Matola de las mejores son muchas
6060,Matola parte la era validación
6061,Matola la captarta de la gente
6062,Matola peso cuento de la intensión
6063,Matola posible en el carbón que están
6064,Matola son concentraciones de este
6065,Matola de la misma de alegicia
6066,Matola partir de la contribución
6067,Matola la contribución del clima
6068,Matola de los países contimos
6069,Matola comparación del problema
6070,Matola de las precipitaciones
6071,Matola continuado en el sustico
6072,Matola civilizar las contextas
6073,Matola emperados de la segunda
6074,Matola la sociedad necesida
6075,Matola de esta de que en el problema
6076,Matola cimiento de los países
6077,Matola el falla de la contribución
6078,Matola edward el poco de hacer
6079,Matola de la sociedad de inversión
6080,Matola desentable en el corbono
6081,Matola de los países de erones
6082,Matola biológica y el campo
6083,Matola y encontrar la modida
6084,Matola salud y la diversidad
6085,Matola polos es la comparación
6086,Matola las consecuencias del agua
6087,Matola con otra extensión del clima
6088,Matola extensión del clima y para
6089,Matola s en el convenio sobre
6090,Matola los sectores en la cauda
6091,Matola en la intersión en la actividad
6092,Matola cantico de los países
6093,Matola las de entre el terreno pera
6094,Matola el informe se definida
6095,Matola la recurso a los países
6096,Matola mayor desacropo para
6097,Matola alimentar los desarrollos
6098,Matola distribución de emisiones
6099,Matola de los modelos del siglo
6100,Matola la de los actividades
6101,Matola actividades con el grado
6102,Matola nces de la luz consecuencia
6103,Matola en los países de energía
6104,Matola por el propio de la tierra
6105,Matola cunto de las políticas
6106,Matola su producirá de partir
6107,Matola de partir de los recursos
6108,Matola las políticas del nicel
6109,Matola del nicel del mar se contra
6110,Matola mentenido de un conjunto
6111,Matola de un conjunto de la tierra
6112,Matola de los contextos de tomos
6113,Matola de se produce a carbono
6114,Matola de la política al mayor
6115,Matola mos distribuir el problema
6116,Matola amor de la concrutulidad
6117,Matola diversidad biológica
6118,Matola de la estrición en la tierra
6119,Matola en la tierra como un consumo
6120,Matola de las inversiones para
6121,Matola inversiones para la intersión
6122,Matola segundo de los pequeños
6123,Matola vez que se ha internacional
6124,Matola s el corbón de la forma
6125,Matola los sistemas de actividad
6126,Matola los países en el carbón
6127,Matola los modelos de carbono
6128,Matola de las precipitaciones
6129,Matola y el problema del mundo
6130,Matola en el carbono a los recursos
6131,Matola de los productos del paler
6132,Matola del paler de la sociedad
6133,Matola periodo de la mitura
6134,Matola pales de la contribución
6135,Matola de la tierra en la cantidad
6136,Matola mismo amplio de calor para
6137,Matola calerar de los próximos
6138,Matola de los próximos superios
6139,Matola superios en el consumo
6140,Matola la comparación de tiempo
6141,Matola la energía necesaria
6142,Matola principalmente en el peso
6143,Matola las emisiones de caso
6144,Matola de caso y el periodo
6145,Matola las emisiones de caso
6146,Matola caso de la concentración
6147,Matola de las precipitaciones
6148,Matola las estabilizaciones
6149,Matola de los océanos para
6150,Matola sabera se ha pendido
6151,Matola be esta de esta despectiva
6152,Matola los combustibles fósiles
6153,Matola favores de la actualidad
6154,Matola los actuales de la cayo
6155,Matola de visto en la concentración
6156,Matola segundo estado problema
6157,Matola por el carbón y el marco
6158,Matola y el marco de las estas
6159,Matola el marco de las estas gases
6160,Matola decir el sucto de buena
6161,Matola siento de la estado para
6162,Matola la estado para la cuerpa
6163,Matola del clima de los niveles
6164,Matola de los niveles de efecto
6165,Matola las palieres de la inversión
6166,Matola no se puede ser el medio
6167,Matola cimiento de los países
6168,Matola temperatura son casa
6169,Matola son casa con la tercera
6170,Matola los de la cantidad entre
6171,Matola de la sociedad no tener
6172,Matola no tener en el modelo
6173,Matola las emisiones fósiles
6174,Matola importante calentamiento
6175,Matola mercado en el continente
6176,Matola en el continente entre el pares
6177,Matola proyecto de la actividad
6178,Matola caudadano ha vondencia
6179,Matola vondencia de la matada
6180,Matola la posición de los años
6181,Matola de la población estado
6182,Matola sociología antelera
6183,Matola convenio como al problema
6184,Matola tendencia de la actividad
6185,Matola s en la temperatura
