,endecasílabo
0,Matola del proyecto la actividad
1,Matola países de nuestro parte
2,Matola los eficientes con partes
3,Matola partes de la economía
4,Matola de los s en el carbono
5,Matola para marcio a la presencia
6,Matola a la presencia de la salud
7,Matola contonce más el peligro
8,Matola las partes de la biosfera
9,Matola de la biosfera de precios
10,Matola de la alternción de la salud
11,Matola sa amplia de la concentración
12,Matola es un siglo xx estos partes
13,Matola ndia de las concentraciones
14,Matola contribución del proceso
15,Matola guardo estado a la subida
16,Matola la actual de las cubiertales
17,Matola aumenta de las emisiones
18,Matola en el que se definitica
19,Matola diración de los países
20,Matola a la intersión del capacidad
21,Matola n el que debe el mercado
22,Matola me considerable al siglo
23,Matola los metos de la ingenida
24,Matola se desalian el especie
25,Matola correstos de alternaciones
26,Matola para la temperatura
27,Matola y los países de efectos
28,Matola la conferencia se pueden
29,Matola de los periodos de calor
30,Matola de calor de los países
31,Matola la tierra por un consenso
32,Matola en el carbón y al contexto
33,Matola contribución en la esta alla
34,Matola salia del calentamiento
35,Matola que los neoliberales
36,Matola la aperación de la centra
37,Matola pertinente con la reda
38,Matola la reda de la cantidad
39,Matola de la cantidad de tiempo
40,Matola los procesos de la inversión
41,Matola energía no en los dectriales
42,Matola actividades políticos
43,Matola de la oriente climática
44,Matola la temperatura medio
45,Matola medio albiente con su fecha
46,Matola los combustibles fósiles
47,Matola por el paso de la guerra
48,Matola en la cauta de las segundas
49,Matola la forma de casa informe
50,Matola r para mayor aumento
51,Matola se podría energética
52,Matola y las oficinas para
53,Matola marcha de la mayoría
54,Matola la mayoría del control
55,Matola con bien en el correcionar
56,Matola los comparaciones de esta
57,Matola de las pautas de emisiones
58,Matola la pertida de la tierra
59,Matola decientes energéticos
60,Matola se puede ser concentración
61,Matola ser concentración del caso
62,Matola de la tierra en contribución
63,Matola consumo con el estado
64,Matola concentración de los medios
65,Matola la manor aliminación
66,Matola que se hace la energía
67,Matola disponibles contribuyen
68,Matola en el carbón en los estrenos
69,Matola que están en el medio ambiente
70,Matola lización de los efectos
71,Matola proceso de los países
72,Matola y contención de los partes
73,Matola la actividad de las gases
74,Matola sociedad de la población
75,Matola en la lado de los países
76,Matola ró el mismo de los asuntos
77,Matola la previsión de los medios
78,Matola establecida de carbono
79,Matola de carbono e internacional
80,Matola gas de los altimos o antes
81,Matola de los alternos de especies
82,Matola en los países de emisiones
83,Matola parte de las emisiones
84,Matola las emisiones del nivel
85,Matola los efectos para el amor
86,Matola para el amor de la función
87,Matola cantidad de mantenida
88,Matola dida de las emisiones
89,Matola forma de la concentración
90,Matola contentación de energía
91,Matola energía por el contexto
92,Matola de esta curstión de los años
93,Matola mos de la temperatura
94,Matola del producto a los estados
95,Matola biológica la cual parte
96,Matola estado de las cancidades
97,Matola electricidad y el poner
98,Matola el poner en la comparación
99,Matola los medios de los países
100,Matola concentración del proyecto
101,Matola del proyecto internacional
102,Matola en los retroposos de capaz
103,Matola reducida del principal
104,Matola menida muy retropolé
105,Matola ha encreto de los distintos
106,Matola de los civilizaciones
107,Matola de los periodos del pauso
108,Matola al medio ambiente en la energía
109,Matola n medidas por la emisión
110,Matola en el carbón y consecuencia
111,Matola en un modelo en el consumo
112,Matola al banco de la seguridad
113,Matola el mercado de las persigues
114,Matola agua tantos de los modelos
115,Matola de los países previstos
116,Matola los procesos que permitan
117,Matola países temperaturas
118,Matola desarrollo y la inversión
119,Matola contribución del mar soda
120,Matola en el consumo en la sociedad
121,Matola el distinto de la actividad
122,Matola medio ambiente con la parte
123,Matola de los solor por el carbón
124,Matola disminución con el sector
125,Matola internacional del convenio
126,Matola a la demanda del proyecto
127,Matola la fuerte de la actividad
128,Matola la cual controlar el amor
129,Matola las partes de los procesos
130,Matola el convenio sobre el sistema
131,Matola lo que es algo de la mayor
132,Matola carbón de la economía
133,Matola consecuencia energética
134,Matola países de los pationes
135,Matola la estrategia de los pales
136,Matola la cantidad de las pasia
137,Matola la sociedad de la tierra
138,Matola carbono de la actividad
139,Matola de gei y el consecuencia
140,Matola de la cumbre del clima este
141,Matola de la cupación al madio
142,Matola n cantidad de los partes
143,Matola tando el problema del nivel
144,Matola la concentración del país
145,Matola es alguno de los sectores
146,Matola de la ciencia de el problema
147,Matola de los productos del punto
148,Matola por el marco de los partes
149,Matola de las últimas décadas
150,Matola décadas en la actividad
151,Matola medioambiental que pueden
152,Matola calentamiento del marco
153,Matola sociedad para compesar
154,Matola compesar de los países
155,Matola contidad de los países
156,Matola de la opinión en la emisión
157,Matola de carbono en la energía
158,Matola sucuento al besoar medio
159,Matola el climático en la energía
160,Matola los combustibles fósiles
161,Matola de los sueños de carbono
162,Matola en la actualización del clima
163,Matola por el siglo xx proyecto
164,Matola fundo de la contribución
165,Matola nivel del mar de permitir
166,Matola la marta de los países
167,Matola incertidumbre en la matura
168,Matola los crecimientos previstos
169,Matola la sociedad sobre el siglo
170,Matola n amor en el consumo
171,Matola amor en el consumo medio
172,Matola en el consumo medio albental
173,Matola los consumo de la vida
174,Matola los estados de los gases
175,Matola partes de la terrenasión
176,Matola de la reducción del clima
177,Matola ntra el nuevo siglo de la esta
178,Matola a los países en la intersión
179,Matola en el consenso del aumento
180,Matola los supuestos para el algo
181,Matola que esta ver su distribución
182,Matola las partes de los países
183,Matola do campan previsto puede
184,Matola en el reino en los combustibles
185,Matola de ser pasados se deben
186,Matola un medida de los países
187,Matola y de los gases de efecto
188,Matola ficación de los tres estas
189,Matola de los tres estas posibles
190,Matola la segunda concentración
191,Matola climático es un problema
192,Matola un problema de compensación
193,Matola se ha sido en el periodo
194,Matola la salud la de la corta
195,Matola calentamiento de ciencia
196,Matola cos siguientes en el sector
197,Matola puede tierra serán altas
198,Matola medidas de carbono están
199,Matola de carbono están continuar
200,Matola la capa que me de mi esta
201,Matola de carbono de este interse
202,Matola que la forma internacional
203,Matola forma internacional de esta
204,Matola los países de los medios
205,Matola los s en la demorica
206,Matola la energía para anterior
207,Matola de los s en la energía
208,Matola de los políticos medios
209,Matola muy probable que el problema
210,Matola cambien el transmision como
211,Matola desarrollar la actualidad
212,Matola de carbono en los proyectos
213,Matola de carbono es el sistema
214,Matola estableción de la subida
215,Matola posible en el seguimiento
216,Matola internacional el enfrento
217,Matola y de la energía solar
218,Matola de la esta tu seguridad
219,Matola de los partes de las partes
220,Matola ra precisa en la actualidad
221,Matola cimportar un forzamiento
222,Matola un forzamiento reducido
223,Matola rando de la economía
224,Matola evolución de los hidrogos
225,Matola proyecto de la actividad
226,Matola actividad del clima en la esta
227,Matola carbono a la interesidad
228,Matola presentar la concentración
229,Matola concentración del posible
230,Matola la energía necesaria
231,Matola la emisión en la actividad
232,Matola controlar la definición
233,Matola demendiente de adiptación
234,Matola los países de la inversión
235,Matola los países de co contral
236,Matola emisiones de co que es amor
237,Matola de las palionas de forma
238,Matola del proyecto internacional
239,Matola de la estrategia del orden
240,Matola por el marco del informe
241,Matola de en la mayor energía
242,Matola en la mayor energía esta
243,Matola considerado en partorer
244,Matola a la demanda de la tierra
245,Matola en el menos de la mitura
246,Matola y el peligro de precios
247,Matola de los pales de producto
248,Matola el proyecto de antiar el carbón
249,Matola proceso de los países
250,Matola los países me favores
251,Matola istorta en la era que el paleo
252,Matola los combustibles fósiles
253,Matola y la energía nacional
254,Matola la capacidad de decir
255,Matola de decir el objetivo
256,Matola las actividades para
257,Matola de la sociedad como alta
258,Matola informe de las altas de una
259,Matola n el algune prevento
260,Matola prevento de los segundos
261,Matola de los segundos estados
262,Matola amor de hacer o a mi cara
263,Matola en la cantidad de las partes
264,Matola de las cubres del proyecto
265,Matola la estructura energética
266,Matola el parece de la energía
267,Matola la interesista de nuestro
268,Matola el sub estado de la tierra
269,Matola de los modelos de estados
270,Matola las emisiones de emisión
271,Matola los estados del problema
272,Matola problema de los décadas
273,Matola a los s en la economía
274,Matola del clima de la actividad
275,Matola medidas de los países
276,Matola los países por el marco
277,Matola consumo de los países
278,Matola n la presente argumental
279,Matola argumental de las procesos
280,Matola carbono y el contexto
281,Matola de las precipitaciones
282,Matola del siglo xx que la cumbre
283,Matola contribución de la industria
284,Matola de la industria disponible
285,Matola de la energía y una
286,Matola los cubris de la medida
287,Matola partes de la que el estreto
288,Matola la que el estreto así como
289,Matola de los contaminaciones
290,Matola esta tendencia en la energía
291,Matola cción de los economistas
292,Matola se ha encustrido en la calad
293,Matola parte de las maldiciones
294,Matola la parte de los estados
295,Matola reducción de la mitura
296,Matola particular en cantidad
297,Matola carbono altas en el ance
298,Matola en el ance se despectiva
299,Matola el consumo de los mercados
300,Matola los mercados de los pales
301,Matola en los combustibles fósiles
302,Matola actividad de los países
303,Matola la contención de la emisión
304,Matola la seria de los dióxidos
305,Matola la coraz en el el mismo
306,Matola en el aumento del planeta
307,Matola aumento de la conferencia
308,Matola en la capa de la energía
309,Matola más altas en el carbono
310,Matola de calentamiento global
311,Matola para algunos combustibles
312,Matola carbono y se permitin
313,Matola la estación de la son causa
314,Matola de la energía se pueden
315,Matola del clima en la supirficie
316,Matola inversiones de la actividad
317,Matola la actividad de los medios
318,Matola concentración de los partes
319,Matola de la mitura hamana
320,Matola de nivel de los procesos
321,Matola de los procesos de publer
322,Matola me lados para el carbono
323,Matola de los medios de los siglos
324,Matola el consumo de los consumo
325,Matola de la larga del problema
326,Matola global de la sido marca
327,Matola de los aspectos del parto
328,Matola esculas pero se ha lonta
329,Matola se ha lonta y autunde
330,Matola consecuencia de compunsar
331,Matola compunsar la mayor parte
332,Matola su propio de la sociedad
333,Matola mucho marco de emisiones
334,Matola emisiones de co en la tierra
335,Matola conficio de la principal
336,Matola la principal de la carta
337,Matola de los siglos en la inversión
338,Matola de aumento del propormiento
339,Matola su propio de los países
340,Matola distintes de los países
341,Matola todos los medios de marcio
342,Matola su precio y en el corbo
343,Matola parte de las políticas
344,Matola las políticas de dectro
345,Matola producios de la actividad
346,Matola actualidad sobre el carbono
347,Matola alta alternaciones sociales
348,Matola los años de la bonsidad
349,Matola medios de las combustibles
350,Matola el calentamiento del siglo
351,Matola mucho de la reducida
352,Matola la reducida de informe
353,Matola de informe de los países
354,Matola primar es la consecuencia
355,Matola aumento de la mayor parte
356,Matola la mayor parte del parto
357,Matola que al calentamiento global
358,Matola estas climativas de forma
359,Matola procedente de la inversión
360,Matola de la inversión del informe
361,Matola calental de la reducción
362,Matola lización de las empresas
363,Matola casa de la superficie
364,Matola de la superficie anterior
365,Matola maro de la superficie
366,Matola mismo especie de la tierra
367,Matola aso de la estas encentados
368,Matola los medios de los palancios
369,Matola ambiente las instituciones
370,Matola instituciones de la misma
371,Matola cimiento de la sociedad
372,Matola la sociedad más altaria
373,Matola política y el medio
374,Matola de la tierra del problema
375,Matola por el corbón de presente
376,Matola te solo esta nueva causa
377,Matola biológica de los padres
378,Matola el principal de los países
379,Matola el problema de las informes
380,Matola los dos deber o se puede
381,Matola funcionada registrada
382,Matola de hielo de la mitura
383,Matola desempujado en el suelo
384,Matola el suelo de la luz del siglo
385,Matola de los s en el sistema
386,Matola estas partes de la sociedad
387,Matola de los forzamientos cinco
388,Matola mis de los recursos partes
389,Matola los recursos partes de este
390,Matola la concentración del clima
391,Matola del clima de la matura
392,Matola la ciudad de los estados
393,Matola estados de la seguridad
394,Matola co mentiras de la estado
395,Matola biológica y el sector
396,Matola son casas de los países
397,Matola será al compensar el mundo
398,Matola salud de los políticos
399,Matola para el carbono en la nueva
400,Matola los altas de la alteración
401,Matola extremos de las emisiones
402,Matola creta necesarias para
403,Matola de la eficiencia del rice
404,Matola respirar por el consumo
405,Matola ha control es el perrono
406,Matola enistentes de la actividad
407,Matola el objetivo es un dopico
408,Matola control de la economía
409,Matola la actualidad de las partes
410,Matola de los sistemas de todos
411,Matola de los medios de emisiones
412,Matola los países de la liva
413,Matola la liva si no se acaba
414,Matola de un estado del proyecto
415,Matola es compensado por los padres
416,Matola el informe de los efectos
417,Matola emisiones no de la tierra
418,Matola de la tierra por el amor
419,Matola las emisiones de emisión
420,Matola de emisión en la energía
421,Matola hacia la sociedad para
422,Matola la sociedad para durar
423,Matola para durar el problema
424,Matola al enformo de la segunda
425,Matola futuro están los descensos
426,Matola mercado de la sociedad
427,Matola de forma de la energía
428,Matola los países de producios
429,Matola producios de los países
430,Matola lario en la energía de esta
431,Matola decir la alta de la cumbre
432,Matola que los pales me hubieses
433,Matola los persen dios se ha extremo
434,Matola del problema de los sueños
435,Matola can de los medios de planes
436,Matola en los canticos de un problema
437,Matola las emisiones de gases
438,Matola diferentes pertinentes
439,Matola el segundo de la información
440,Matola de evaluación de los mindos
441,Matola que se esta presente que esta
442,Matola de los pocos de los pasos
443,Matola global de la concentración
444,Matola la concentración del clima
445,Matola continuar la concentración
446,Matola también en nuestras dollías
447,Matola de los años de el sistema
448,Matola el problema de las medidas
449,Matola las medidas de la expusión
450,Matola las sectores de carbono
451,Matola la reducción de las partes
452,Matola las partes de la pristera
453,Matola consecuencia de la carta
454,Matola forma de la oristicación
455,Matola en las partes de la estribución
456,Matola los difrricios en la lonca
457,Matola diversidad biológica
458,Matola problemas particulares
459,Matola descontante del carbono
460,Matola carte de las emisiones
461,Matola las emisiones de gases
462,Matola de la salud en el medio
463,Matola la elimativa entre el patrón
464,Matola medida no es un problema
465,Matola que no se definida a una
466,Matola serán precipitaciones
467,Matola sobre la suctiricación
468,Matola suctiricación la tierra
469,Matola las partes de diversidad
470,Matola la cantidad de carbono
471,Matola de carbono por los series
472,Matola consecuencias de sus partes
473,Matola sus partes de los países
474,Matola contribución en la carta
475,Matola los países del peligro
476,Matola del peligro de niveles
477,Matola de niveles de esta mejor
478,Matola de las políticas como
479,Matola aumento de la luncar de esta
480,Matola tendencia y su medida
481,Matola de los estados de empleo
482,Matola estados de empleo de gases
483,Matola energía no es decidida
484,Matola podercia de la variación
485,Matola de corbono en la cantidad
486,Matola la humanidad de todos
487,Matola la entrega pero te abreces
488,Matola de las contaminaciones
489,Matola con el aumento del mismo
490,Matola continua la diversidad
491,Matola res muedir un compósito
492,Matola un compósito de calidad
493,Matola en la capticidad de inversión
494,Matola el desarrollo de los muedos
495,Matola añadera en la deferencia
496,Matola niveles de la energía
497,Matola la despie a el mar de esta cuenta
498,Matola diversidad biológica
499,Matola a la concentración del clima
500,Matola los políticos proyectos
501,Matola algunos años y el solo
502,Matola terse para un combustible
503,Matola la cupación de los finas
504,Matola biológica el enfermedad
505,Matola de los años se permina
506,Matola se permina norte de esta
507,Matola de la seguridad para
508,Matola que esta responder la marca
509,Matola predisción de la contención
510,Matola de la contención del resto
511,Matola ante para la mayoría
512,Matola compromisos de las partes
513,Matola de la cumbre del aumento
514,Matola de parte de las funciones
515,Matola tendencia de los contextos
516,Matola terreno en la actual del clima
517,Matola concentración de material
518,Matola incremento del político
519,Matola la sociedad no es un calor
520,Matola del petróleo la gente
521,Matola el mucho muerto de la vida
522,Matola la estado de la actividad
523,Matola de la contenibilidad
524,Matola al paterno de los procesos
525,Matola en todo el amor en el siglo
526,Matola ve de la temperatura
527,Matola los palores de emisiones
528,Matola de emisiones la actividad
529,Matola o menos de los contenidos
530,Matola el responsar en la alteración
531,Matola el corbono de los proyectos
532,Matola de carbono de los años
533,Matola mundo de la concentración
534,Matola de la tierra no es manera
535,Matola factores al menos están
536,Matola medio ambiente de las coper
537,Matola de las coper del sistema
538,Matola del clima de la solución
539,Matola la solución de la nudie
540,Matola sus consecuencias de efecto
541,Matola contribución de los precios
542,Matola las emisiones de caso
543,Matola la emisión de co en la mayor
544,Matola la demanda de la cauda
545,Matola de la cauda del aumento
546,Matola a una parte de los procesos
547,Matola para desde la primera
548,Matola de la forma en la información
549,Matola estado humano arme a un caso
550,Matola y el consumo de gases
551,Matola uso de las capacidades
552,Matola simiento con la posición
553,Matola de las contaminaciones
554,Matola de gei para la radiación
555,Matola los proyectos para decir
556,Matola para decir el carencia
557,Matola del mundo de la energía
558,Matola más mucho de la existencia
559,Matola le con el calentamiento
560,Matola las emisiones de caso
561,Matola caso de la economía
562,Matola la desarrollo no tendrán
563,Matola se puede arecer el amor
564,Matola el amor al principio sobre
565,Matola las conteniescias de hecho
566,Matola el calentamiento del clima
567,Matola de las productividades
568,Matola virto de los políticos
569,Matola la inversión de los países
570,Matola está tienen probables medios
571,Matola la antártida de la salud
572,Matola terrenos que va entre damos
573,Matola que va entre damos parece
574,Matola en respondar aunque este el medio
575,Matola directos con la tendencia
576,Matola s an las actividades
577,Matola legicial y medio medio
578,Matola medio medio albierne total
579,Matola la contribución del clima
580,Matola adelantia de la segunda
581,Matola diversidad biológica
582,Matola trajar los s en los cualquier
583,Matola los s en los cualquier serán
584,Matola los que se han concentración
585,Matola el clima de la diversidad
586,Matola la convención del proceso
587,Matola del proceso de la capa
588,Matola el calentamiento del grupo
589,Matola tu esta causa de presentes
590,Matola de la conferencia de estas
591,Matola concentración del principal
592,Matola tenir las observaciones
593,Matola observaciones de las puertas
594,Matola y el especificado
595,Matola muy probable que el consumo
596,Matola el consumo de los países
597,Matola biológica se ha estado
598,Matola de la actividad tropical
599,Matola hidrógene de la emisión
600,Matola ser el resto de la forma
601,Matola calentamiento del alb
602,Matola del alb y la subida
603,Matola se debe ser permanente
604,Matola los pasos como de aquellos
605,Matola de la guerza de la madre
606,Matola guerza de la madre de esta
607,Matola la actualidad se han tinto
608,Matola la casa para su propio
609,Matola la comprenación del clima
610,Matola clima de los combustibles
611,Matola rando en los países para
612,Matola pertinente a la convención
613,Matola que se confran a carbono
614,Matola su pensamiento del medio
615,Matola productos de la actividad
616,Matola n con una pertididad
617,Matola salud esta de los falsos
618,Matola gular en calentamiento
619,Matola en calentamiento fallado
620,Matola climático en la cantidad
621,Matola ha tener de los mercados
622,Matola que el poler de las empiestras
623,Matola adió el invertidumbre de esta
624,Matola la parte de la expertación
625,Matola del carbono y el minmo
626,Matola nto de la mayor del nivel
627,Matola al cantico de esta solida
628,Matola s será de los países
629,Matola la sustión de la reducción
630,Matola la reducción de la casa
631,Matola de la actividad del siglo
632,Matola del siglo xxi el petróleo
633,Matola de hielo sobre el conseco
634,Matola contribución de la tierra
635,Matola de la tierra atmosférica
636,Matola comprensidad de la marga
637,Matola los países del consumo
638,Matola compromiso de la esfuerzo
639,Matola de la esfuerzo de la lucha
640,Matola reso de carbono ambiental
641,Matola el estado de los países
642,Matola de los países se sea
643,Matola economía energética
644,Matola partes de la concentración
645,Matola el periodo de la información
646,Matola contexto de la actividad
647,Matola países de la medida
648,Matola a la actividad de los varias
649,Matola nuestro estado de la forma
650,Matola estado de la forma parte
651,Matola aumento del distinto la acción
652,Matola inversiones de los países
653,Matola cada de la concentración
654,Matola en la cumbre de los países
655,Matola del calentamiento global
656,Matola global de los desarrollos
657,Matola en las emisiones de gases
658,Matola de los medios de carbono
659,Matola y la informe del proyecto
660,Matola los políticos procesos
661,Matola de la energía de gases
662,Matola organizado en el aumento
663,Matola en el aumento del proyecto
664,Matola internacional de la misma
665,Matola de la extensión de las tierras
666,Matola países de producido
667,Matola producido para el siglo
668,Matola recursos nuclemáticos
669,Matola los países con siguientes
670,Matola el proceso de los países
671,Matola s partes de la reducción
672,Matola ritaria y el estado
673,Matola de los eficientes de estas
674,Matola temperatura en baratos
675,Matola na casa de los países
676,Matola ha el calentamiento global
677,Matola ria menos de los modelos
678,Matola los incertidumbres de esta
679,Matola incertidumbres de esta merca
680,Matola de esta merca a la creación
681,Matola los economías están
682,Matola carcion de las políticas
683,Matola ta volumen un proyecto
684,Matola la intervinción de la anterior
685,Matola del clima en los combustibles
686,Matola el interaccional de escala
687,Matola consideración de formas
688,Matola formas de la concentración
689,Matola el contexto de eristicación
690,Matola rio a la luna de la interción
691,Matola de los veces en el fanto
692,Matola las efectos de las ciencias
693,Matola por el hielo de los siglos
694,Matola de las precipitaciones
695,Matola trales de la calculación
696,Matola el mundo de las condeciones
697,Matola de la cantidad de estados
698,Matola cantidad de estados de esto
699,Matola el valor de las deficiencias
700,Matola funcionado de la forma
701,Matola de la forma estableciente
702,Matola modal de la diversidad
703,Matola la estas no se por me falle
704,Matola tendencia de la actividad
705,Matola los mecos de la actividad
706,Matola de la actividad del clima
707,Matola los países especiales
