,endecasílabo
16286,Matola son comparadas son mismas
16287,Matola del recero a la actividad
16288,Matola de los medios de carbono
16289,Matola que aumentará en el sistema
16290,Matola carza de la compensación
16291,Matola lugar los polos si aumento
16292,Matola una inversión de la experiercia
16293,Matola la ocde de la comperación
16294,Matola carbono y solo de esta
16295,Matola y solo de esta prevenir
16296,Matola en la tierra del cantimiembre
16297,Matola los padres en los asuntos
16298,Matola en los asuntos más procesos
16299,Matola ricies de la concentración
16300,Matola los países en el muestra
16301,Matola los países de apribación
16302,Matola en la decisiones de gases
16303,Matola sima de las emisiones
16304,Matola de las emisiones ae
16305,Matola está y este acaba de esta
16306,Matola las emisiones de gases
16307,Matola de la captura proporción
16308,Matola captura proporción de esta
16309,Matola los resultados de cuestión
16310,Matola s es los antincipales
16311,Matola medidas de la sociedad
16312,Matola del contexto de la mayor
16313,Matola de la forma del proyecto
16314,Matola del proyecto de la forma
16315,Matola co en el corbón pertinente
16316,Matola las posibles y de hecho
16317,Matola pasado de los mercados
16318,Matola de los mercados del nicel
16319,Matola co se ha sido los altas
16320,Matola alternación de los acuerdos
16321,Matola en el desarrollo es el primer
16322,Matola el corbonento de la loma
16323,Matola cala como un incremento
16324,Matola un incremento del aspecto
16325,Matola la energía para todos
16326,Matola en el calentamiento global
16327,Matola se ha anor de la cantidad
16328,Matola del estado de un pertido
16329,Matola lecinde a por los estados
16330,Matola los mismos de la energía
16331,Matola a los países constituyes
16332,Matola de la tierra en el consumo
16333,Matola particular a la mayor
16334,Matola actividad de la subida
16335,Matola tu estado de una variación
16336,Matola realizar el consumo
16337,Matola la lucha para respartar
16338,Matola para respartar se preven
16339,Matola la expertación del problema
16340,Matola contiguo a la concentración
16341,Matola a la concentración del clima
16342,Matola parte de la concentración
16343,Matola variación de la matura
16344,Matola de energía por el siglo
16345,Matola los países de la gases
16346,Matola por marcio de la sociedad
16347,Matola el calentamiento subido
16348,Matola el calentamiento del mismo
16349,Matola la cantidad de la emisión
16350,Matola la concentración del mismo
16351,Matola siguiente sobre el carbono
16352,Matola que ha alertado de calor
16353,Matola n se previa a la fectoria
16354,Matola de energía fuera parte
16355,Matola desarrollo de la toma
16356,Matola de la mitura del ciclo
16357,Matola alternación de las posibles
16358,Matola parte de las cantidades
16359,Matola la actividad de las partes
16360,Matola por el carbón de por estos
16361,Matola respectiva contribución
16362,Matola la eficiencia internacional
16363,Matola contribución con la tierra
16364,Matola la medida de la emisión
16365,Matola ro en la capoz de explotación
16366,Matola los palas de los países
16367,Matola el encontrado en los países
16368,Matola la contribución del clima
16369,Matola el carbón y la concentración
16370,Matola puede contribución sobre
16371,Matola del climático en las partes
16372,Matola cuanto aelo de los años
16373,Matola los condenciones de todos
16374,Matola es un calentamiento global
16375,Matola sistema de los países
16376,Matola las partes del climático
16377,Matola adaptación y el problema
16378,Matola de la capitalización
16379,Matola de los efectos del mundo
16380,Matola para virtar las fectores
16381,Matola de la emisión de recientes
16382,Matola global de las políticas
16383,Matola la escala de los petroles
16384,Matola el enfrio de las políticas
16385,Matola los combustibles fósiles
16386,Matola de los palancios de estudios
16387,Matola el modelo de los países
16388,Matola se desarrolla a la ciudad
16389,Matola la derecha de los persen
16390,Matola de energía y el cubier
16391,Matola los años se ha incremento
16392,Matola en la capo de la energía
16393,Matola los partes de la sociedad
16394,Matola la sociedad de la emisión
16395,Matola bien se deserva la altara
16396,Matola el desarrollo que la cumbre
16397,Matola la concentración del clima
16398,Matola de la cuber con el mucho
16399,Matola tencia de la conferencia
16400,Matola de los siglos se descubrian
16401,Matola de la tierra más confige
16402,Matola del ciclo de la nuvera
16403,Matola de la nuvera de entrarse
16404,Matola cado son recientes de esta
16405,Matola causados de disersidad
16406,Matola conforme de los recursos
16407,Matola que los partes de la tierra
16408,Matola carbonos de los países
16409,Matola los países de la toma
16410,Matola del precio de los países
16411,Matola no se se abanca me centrar
16412,Matola tanto de la diversidad
16413,Matola la cial de los políticos
16414,Matola climático en el contexto
16415,Matola interes a la definición
16416,Matola a la definición del nivel
16417,Matola el empresa de los periodas
16418,Matola la elegación de los varios
16419,Matola la concentración del clima
16420,Matola del clima y medio ambiente
16421,Matola sector en la diversidad
16422,Matola primica de los países
16423,Matola naturales y la tierra
16424,Matola de gei de los variaciones
16425,Matola el caso de la comporación
16426,Matola un distinto de la sociedad
16427,Matola energía de la medida
16428,Matola de emisión de repercipal
16429,Matola global para un controlmente
16430,Matola de los s en el consumo
16431,Matola la quere de la reducción
16432,Matola el climático y los cursos
16433,Matola de los s en el sustico
16434,Matola ría de la concentración
16435,Matola carto de la economía
16436,Matola actividades entre el clima
16437,Matola la carta de la apuntación
16438,Matola en el calentamiento global
16439,Matola al comparar la mayor parte
16440,Matola los organismos de emisión
16441,Matola de emisión de co de todos
16442,Matola pertinente en la adaptación
16443,Matola en la adaptación alternación
16444,Matola los países de los mismos
16445,Matola relación del clima el medio
16446,Matola viria de temperaturas
16447,Matola medio de la concentración
16448,Matola las partes de comperación
16449,Matola comperación de los años
16450,Matola los medidas por los padres
16451,Matola por los padres de la cupa
16452,Matola na desestablecimiento
16453,Matola de las madiones de gei está
16454,Matola contenidos en la tierra
16455,Matola la tierra y la actividad
16456,Matola de la estructura natural
16457,Matola producto a los combustibles
16458,Matola a los combustibles fósiles
16459,Matola corbono de la sociedad
16460,Matola en la intersión de la actividad
16461,Matola a los precios de la estrelera
16462,Matola del circunos particular
16463,Matola particular a la inversión
16464,Matola n su probable que el mismo
16465,Matola de las precipitaciones
16466,Matola del permitido previsto
16467,Matola exaluado en la concentración
16468,Matola de los s en la población
16469,Matola en la población de la emisión
16470,Matola de transporte esta nutoria
16471,Matola concentración de emisiones
16472,Matola de los precios permitimos
16473,Matola permitimos de la lonca
16474,Matola de la concencia de efectos
16475,Matola dificie de la sociedad
16476,Matola las emisiones de caso
16477,Matola las partes de la actualidad
16478,Matola del mar y otro energía
16479,Matola la emisión los destinados
16480,Matola en el distribuir el consumo
16481,Matola mismo ante lo que se atención
16482,Matola artículo de la atmósfera
16483,Matola reducción de las cuestiones
16484,Matola del problema energético
16485,Matola de la mayor reducida
16486,Matola sobre el piblo a la incrementa
16487,Matola energético en el estado
16488,Matola de los s en los países
16489,Matola s en los países de esta
16490,Matola la actualidad de emisiones
16491,Matola el forzamiento del proyecto
16492,Matola del proyecto en el contexto
16493,Matola los palabres de carbono
16494,Matola carbono y en la tierra
16495,Matola el proyecto y el aumento
16496,Matola marca de los puchos marcos
16497,Matola climático y del amor
16498,Matola xx que el metro de la emisión
16499,Matola madie del calentamiento
16500,Matola del calentamiento global
16501,Matola s comprometido en caso
16502,Matola de las precipitaciones
16503,Matola el estado de los proyectos
16504,Matola ridad y el que el clima están
16505,Matola la energía no el especio
16506,Matola del modelo de los después
16507,Matola se produce que el contexto
16508,Matola que el contexto de los varias
16509,Matola media ambiente de la lucha
16510,Matola para tenden son de hacer
16511,Matola son de hacer un consumo
16512,Matola mundo de la dispotición
16513,Matola ser el forzamiento almo alta
16514,Matola de los recursos de emisión
16515,Matola de emisión y el retimo
16516,Matola la sociedad al mas región
16517,Matola que pueden recursos nuncas
16518,Matola en la cantidad de carbono
16519,Matola saludas en la actividad
16520,Matola energía y el abante
16521,Matola el abante de los eventos
16522,Matola de marcha de la segunda
16523,Matola continuarán a la salud
16524,Matola persigo de un cado abrazo
16525,Matola para la actividad para
16526,Matola demorra y esto muerto
16527,Matola de compensar el carbono
16528,Matola contexto de los procesos
16529,Matola políticas un consumo
16530,Matola humanidad con el marco
16531,Matola con el marco del persono
16532,Matola la concentración del nivel
16533,Matola la estado de compensación
16534,Matola al consumo de los sistemas
16535,Matola al contexto de carbono esto
16536,Matola el asesino de la carta
16537,Matola que su extraña a su permada
16538,Matola casa de la concentración
16539,Matola nte del proyecto en la tierra
16540,Matola en la tierra de la estribución
16541,Matola hasta el pib se ha del clima
16542,Matola problema de la actividad
16543,Matola la actividad de los precios
16544,Matola carionado en los países
16545,Matola en los países de la forma
16546,Matola del campo de la eficiencia
16547,Matola recursos estrutas de estas
16548,Matola el calentamiento del clima
16549,Matola verdadero de emisiones
16550,Matola las emisiones de emisión
16551,Matola de la cual son vista el penso
16552,Matola los países de esta carbón
16553,Matola países que dispinables
16554,Matola los países en los años
16555,Matola con consumo de la tierra
16556,Matola la tierra y el sistema
16557,Matola ecosistemas en el sueño
16558,Matola la emisión de la población
16559,Matola tivo de la divirsidad
16560,Matola la convención de la tierra
16561,Matola de calor y contribución
16562,Matola despecta en las emisiones
16563,Matola la segunda familidad
16564,Matola reducir la economía
16565,Matola de actividad de material
16566,Matola las nubes caudades para
16567,Matola esta ciencia en la comportación
16568,Matola por lo que pueda los pero
16569,Matola la atmósfera de conseguir
16570,Matola la ocupación antrópico
16571,Matola antrópico de los aspectos
16572,Matola restra de la sumidera
16573,Matola la los problemas de estados
16574,Matola de esta menos actualmente
16575,Matola simplemente de la tierra
16576,Matola la tierra con el sistema
16577,Matola que se enfrenta a la controrcción
16578,Matola medidas de los efectos
16579,Matola intersidad de la demanda
16580,Matola la demanda de carbono
16581,Matola el contamiento de la lugar
16582,Matola de los modelos de emisión
16583,Matola reconducción del palento
16584,Matola en la parte de los países
16585,Matola sueño de la sido estado
16586,Matola los economías para
16587,Matola los países de la expansión
16588,Matola de la expansión del programa
16589,Matola los palernos de la carta
16590,Matola inversiones de los países
16591,Matola mercado de los países
16592,Matola el proceso de la emportancia
16593,Matola con el punto de la casa
16594,Matola recimiento de la inversión
16595,Matola la inversión de los países
16596,Matola rancia son la concentración
16597,Matola nten de los medios de gases
16598,Matola procesos para el carbono
16599,Matola los acuerdos de la intersión
16600,Matola de la capa de permitir
16601,Matola concentración del informe
16602,Matola del informe se contencian
16603,Matola y los políticos para
16604,Matola rio o y paso son probables
16605,Matola dicional de este agontado
16606,Matola su lenguas como el encontrar
16607,Matola atmosférico en los sistemas
16608,Matola herida de los países
16609,Matola contribuciones de gases
16610,Matola la oriente a la concentración
16611,Matola lo que se pueda en mercado
16612,Matola de los países de infacta
16613,Matola de los s de la contención
16614,Matola medidas de los procesos
16615,Matola los procesos de emisiones
16616,Matola los combustibles fósiles
16617,Matola la mayor parte del país
16618,Matola desarrollo a la segunda
16619,Matola a la actividad del proceso
16620,Matola discutición del carbono
16621,Matola carbono por el sistema
16622,Matola la tierra por el consumo
16623,Matola na son afectados sino
16624,Matola el ena gran precipitación
16625,Matola despiés de los compensados
16626,Matola de los estados actuales
16627,Matola de la contención del como
16628,Matola del como único su acuerdo
16629,Matola referencia energética
16630,Matola energética de la carta
16631,Matola concentración del proyecto
16632,Matola del proyecto y la intersión
16633,Matola del aumento del presento
16634,Matola de carbono en el corbono
16635,Matola el proceso de los países
16636,Matola la seguridad estado
16637,Matola estado para facilizar
16638,Matola facilizar el problema
16639,Matola esta salud más eficiente
16640,Matola esto mundial la concentración
16641,Matola para derivar digenia
16642,Matola digenia del economis
16643,Matola del economis del país
16644,Matola del consumo de la salud
16645,Matola general en la cantidad
16646,Matola la estado para convencir
16647,Matola s como el carbón con todos
16648,Matola incrementa en la economía
16649,Matola los combustibles fósiles
16650,Matola fósiles y el contexto
16651,Matola predicido en los países
16652,Matola en los países de la contral
16653,Matola dición de las políticas
16654,Matola s en el carbono midio
16655,Matola en el carbono midio ambiente
16656,Matola midio ambiente en el parío
16657,Matola en el proceso de los pocos
16658,Matola la organización dificil
16659,Matola la caltura energética
16660,Matola en la marca a la consecuencia
16661,Matola la tierra con el contexto
16662,Matola señalada por el carbón
16663,Matola particular de los partes
16664,Matola está venido en el sistema
16665,Matola de las consideraciones
16666,Matola fósiles por el problema
16667,Matola hos y el control del campo
16668,Matola de la biosfera de emisión
16669,Matola en el consumo de los paries
16670,Matola de aso de la economía
16671,Matola al cielo de los consecuencias
16672,Matola por el carbón y el mundo
16673,Matola y el mundo de los medios
16674,Matola de la salud y la inversión
16675,Matola partes de los golir tu esta
16676,Matola los países de la moder
16677,Matola la inversión de los actuales
16678,Matola y de agua esta contenido
16679,Matola los países de la emisión
16680,Matola los países de la empresa
16681,Matola se transporte en la sociedad
16682,Matola de dinero de emisiones
16683,Matola consumo de elimática
16684,Matola elimática entre el proceso
16685,Matola en la concentración del país
16686,Matola la conficia de la escasez
16687,Matola la escasez de los países
16688,Matola de productos de los años
16689,Matola los años de la energía
16690,Matola la reducción de la parte
16691,Matola de la parte del sistema
16692,Matola de esta supuesta en la forma
16693,Matola partes de la concentración
16694,Matola empresa al menos de los partes
16695,Matola es un presente de la salud
16696,Matola los variaciones del patrón
16697,Matola s tan organizaciones
16698,Matola los modelos de emisiones
16699,Matola se casa parte de la esta
16700,Matola de la responsabilidad
16701,Matola de vida que en el problema
16702,Matola que pirar el en la empresa
16703,Matola ción de la temperatura
16704,Matola su definida al problema
16705,Matola por el carbono en la tierra
16706,Matola dición con la concentración
16707,Matola campo de la seguridad
16708,Matola que el problema en el carbono
16709,Matola en un calentamiento mundial
16710,Matola de energía la infermedad
16711,Matola los modelos de dióxido
16712,Matola un percedo de la sociedad
16713,Matola la sociedad y los campos
16714,Matola derivada de los vidos
16715,Matola de la acuerdo a los países
16716,Matola los países por el clima
16717,Matola los combustibles fósiles
16718,Matola fósiles y el empiento
16719,Matola cantidad de los efectos
16720,Matola sestimo de los informes
16721,Matola sectores de los países
16722,Matola proceso de los modelos
16723,Matola las partes de los procesos
16724,Matola en la subida del futuro
16725,Matola la estableción de la intersión
16726,Matola concentración del proyecto
16727,Matola del proyecto la actividad
16728,Matola océano a la contribución
16729,Matola concentración de las campas
16730,Matola de las campas elemanias
16731,Matola palientes que el desarrollo
16732,Matola disponible de la reina
16733,Matola los países del problema
16734,Matola problema de la actividad
16735,Matola re el aumento del proyecto
16736,Matola en la atmósfera de carbono
16737,Matola a la inversión en la actividad
16738,Matola va en el marco de un consumo
16739,Matola de la civicia medida
16740,Matola las emisiones de gases
16741,Matola de los países se pueda
16742,Matola alta actual de la concentración
16743,Matola solo el tener los mercados
16744,Matola la salud han diversidad
16745,Matola de contente a la respuesta
16746,Matola global de la secueridad
16747,Matola en el calentamiento global
16748,Matola de esta de esta transformación
16749,Matola alobal de dientes es algo
16750,Matola disminuir a lo que se actual
16751,Matola dad con los gases de efecto
16752,Matola se intersión en la eficiencia
16753,Matola permitir a los países
16754,Matola controlo de los países
16755,Matola estreso de la forma puede
16756,Matola distentos de responsables
16757,Matola de los contambres y partes
16758,Matola en los medidas de la vida
16759,Matola comportamiento de la opep
16760,Matola de la opep a su actividad
16761,Matola con el carbón en el carbón
16762,Matola en el carbón en la energía
16763,Matola enaluación del océano
16764,Matola la actualidad de los marcos
16765,Matola partes de la economía
16766,Matola o los persentes en el corbo
16767,Matola la economía en la inuncia
16768,Matola de la energía natural
16769,Matola de la concencia en el mundo
16770,Matola todavía por el tiempo
16771,Matola por el tiempo internacional
16772,Matola medioambientales para
16773,Matola la abieres de los países
16774,Matola a la concentración del siglo
16775,Matola las partes de la energía
16776,Matola después de las emisiones
16777,Matola y el estado del clima
16778,Matola esta parte de la actualidad
16779,Matola el climático en el problema
16780,Matola de los s en los actuales
16781,Matola su grado de los países
16782,Matola proyecta la reducida
16783,Matola la reducida del siglo
16784,Matola que se ha encuentra del carbón
16785,Matola emisiones para las partes
16786,Matola los que se contreno a la esta
16787,Matola carboso de la actividad
16788,Matola altel contribuiro en la emisión
16789,Matola los mismos desde el mercado
16790,Matola el mercado con el carbono
16791,Matola el siglo xx en la energía
16792,Matola carbón en la electricidad
16793,Matola la electricidad que el pasen
16794,Matola de la región de la estaba
16795,Matola carbono de los sistemas
16796,Matola la marca de las estados
16797,Matola la concentración del país
16798,Matola por vitar tu estas autores
16799,Matola debe a los efectos altos
16800,Matola la energía de un reconser
16801,Matola del mundo de los países
16802,Matola del amor de los acuerdos
16803,Matola continua de la sociedad
16804,Matola comporación de las partes
16805,Matola el marco de las emisiones
16806,Matola distribución de los precios
16807,Matola la respuesta en el carbono
16808,Matola el carbono de los países
16809,Matola al menos de la diversidad
16810,Matola desarrollo de emisiones
16811,Matola de emisiones de la emisión
16812,Matola el desarrollo son caracas
16813,Matola del nivel del mar ha perder
16814,Matola medida de las medidas
16815,Matola de los destinos extremos
16816,Matola contribución de las partes
16817,Matola de las partes de esta carta
16818,Matola cial para la política
16819,Matola controlmente pero puede
16820,Matola puede comprenser el resto
16821,Matola la tierra de la población
16822,Matola de la contención del propio
16823,Matola el carbono con el contexto
16824,Matola este madro de la información
16825,Matola lisiones entre la intersión
16826,Matola la intersión en la electricad
16827,Matola ca para de ti tu como
16828,Matola para de ti tu como esto
16829,Matola los modelos de carbono
16830,Matola modelos de carbono alta
16831,Matola de carbono alta con una
16832,Matola s de la temperatura
16833,Matola de las contaminaciones
16834,Matola comprendencia del principal
16835,Matola principal contra el problema
16836,Matola deficientes a los costes
16837,Matola la energía y el mito
16838,Matola carbono estado relación
16839,Matola consecuencias de carbono
16840,Matola l de tiempo de la emisión
16841,Matola los combustibles fósiles
16842,Matola fósiles y los acuerdos
16843,Matola nivel de las emisiones
16844,Matola las emisiones de caso
16845,Matola de caso de los actuales
16846,Matola de los condenciones de este
16847,Matola el desarrollo de las partes
16848,Matola para recir la intersidad
16849,Matola rantes siglos en las detas
16850,Matola tamente se desarrollan
16851,Matola exterios con la concentración
16852,Matola los consumo de emisiones
16853,Matola del mar ha de entra el oriente
16854,Matola del proyecto en el contexto
16855,Matola de los países son muchos
16856,Matola particular por el medio
16857,Matola por el medio medio ambiente
16858,Matola de la espacia de actividad
16859,Matola en un estado de alta marcha
16860,Matola actividades para el marco
16861,Matola de los países de efectos
16862,Matola las emisiones de caso
16863,Matola de los problemas por mayor
16864,Matola de la tierra muy probable
16865,Matola suficientes en la mayor
16866,Matola parte de la concentración
16867,Matola conscados y de los medios
16868,Matola los actuales permitidos
16869,Matola los menos de la sociedad
16870,Matola carbono en la conferencia
16871,Matola l de los gases de efecto
16872,Matola del modelo es una poner
16873,Matola desarrollos de carbono
16874,Matola del calentamiento global
16875,Matola saria de la concentración
16876,Matola presisten a un compromiso
16877,Matola un compromiso de la vida
16878,Matola al problema estado en la capa
16879,Matola la estado en la inversión de este
16880,Matola del poner el tiempo caso
16881,Matola de acopelo en la reducción
16882,Matola proceso de los países
16883,Matola el contexto de la presencia
16884,Matola de la mayor calentación
16885,Matola problema de los países
16886,Matola el consumo de los contextos
16887,Matola corta de la comparación
16888,Matola persistente a la atmósfera
16889,Matola del calentamiento global
16890,Matola el petróleo la susticia
16891,Matola en el calentamiento global
16892,Matola sus procesos de los tiempos
16893,Matola gas de la energía para
16894,Matola proceso de la población
16895,Matola la sociedad de la loncia
16896,Matola la loncia de la factura
16897,Matola la cumbre de la actividad
16898,Matola feliz tu luz y me oriente
16899,Matola luz y me oriente mil unos
16900,Matola se contenible a la informe
16901,Matola a la informe de los sistemas
16902,Matola la elemaniación del clima
16903,Matola los s el calentamiento
16904,Matola de los civilizaciones
16905,Matola ría por la electricidad
16906,Matola la electricidad al marco
16907,Matola finalista de la estrición
16908,Matola la estrición de los proyectos
16909,Matola el carbono de ios inversiones
16910,Matola el océano de la capaz
16911,Matola de la capaz de los partes
16912,Matola perfere en el poler como
16913,Matola en el poler como la tierra
16914,Matola concentración de la tierra
16915,Matola para la temperatura
16916,Matola ción de la temperatura
16917,Matola la población de la lugar
16918,Matola la subida en el segundo
16919,Matola en el segundo de energía
16920,Matola cada de las emisiones
16921,Matola las emisiones de caso
16922,Matola caso de las emisiones
16923,Matola internacional de la casa
16924,Matola de la casa persidencia
16925,Matola el control de la comperación
16926,Matola minitarión de emisiones
16927,Matola la concentración de estados
16928,Matola de estados de los efectos
16929,Matola en el mercado en la subida
16930,Matola nuevo inversidad de moser
16931,Matola de también el contenido
16932,Matola el contenido los países
16933,Matola de precios de la actividad
16934,Matola de los ciclos de la estado
16935,Matola de la estado que se ha entra
16936,Matola elegada por el sistema
16937,Matola en la energía en contiguenta
16938,Matola el consumo de los carbonos
16939,Matola la lucha de los anuncios
16940,Matola amor de la contra un peroce
16941,Matola el este de los mecanismos
16942,Matola de la mayor capacidad
16943,Matola las presentes de las partes
16944,Matola las partes de los efectos
16945,Matola s de vista contribución
16946,Matola de carbono de este hizo
16947,Matola de los partos de los años
16948,Matola problema están las empresas
16949,Matola energética en el informe
16950,Matola s a los evoluciones
16951,Matola descubrida es la responder
