,endecasílabo
16758,Kinshasa en los medidas de la vida
16759,Kinshasa comportamiento de la opep
16760,Kinshasa de la opep a su actividad
16761,Kinshasa con el carbón en el carbón
16762,Kinshasa en el carbón en la energía
16763,Kinshasa enaluación del océano
16764,Kinshasa la actualidad de los marcos
16765,Kinshasa partes de la economía
16766,Kinshasa o los persentes en el corbo
16767,Kinshasa la economía en la inuncia
16768,Kinshasa de la energía natural
16769,Kinshasa de la concencia en el mundo
16770,Kinshasa todavía por el tiempo
16771,Kinshasa por el tiempo internacional
16772,Kinshasa medioambientales para
16773,Kinshasa la abieres de los países
16774,Kinshasa a la concentración del siglo
16775,Kinshasa las partes de la energía
16776,Kinshasa después de las emisiones
16777,Kinshasa y el estado del clima
16778,Kinshasa esta parte de la actualidad
16779,Kinshasa el climático en el problema
16780,Kinshasa de los s en los actuales
16781,Kinshasa su grado de los países
16782,Kinshasa proyecta la reducida
16783,Kinshasa la reducida del siglo
16784,Kinshasa que se ha encuentra del carbón
16785,Kinshasa emisiones para las partes
16786,Kinshasa los que se contreno a la esta
16787,Kinshasa carboso de la actividad
16788,Kinshasa altel contribuiro en la emisión
16789,Kinshasa los mismos desde el mercado
16790,Kinshasa el mercado con el carbono
16791,Kinshasa el siglo xx en la energía
16792,Kinshasa carbón en la electricidad
16793,Kinshasa la electricidad que el pasen
16794,Kinshasa de la región de la estaba
16795,Kinshasa carbono de los sistemas
16796,Kinshasa la marca de las estados
16797,Kinshasa la concentración del país
16798,Kinshasa por vitar tu estas autores
16799,Kinshasa debe a los efectos altos
16800,Kinshasa la energía de un reconser
16801,Kinshasa del mundo de los países
16802,Kinshasa del amor de los acuerdos
16803,Kinshasa continua de la sociedad
16804,Kinshasa comporación de las partes
16805,Kinshasa el marco de las emisiones
16806,Kinshasa distribución de los precios
16807,Kinshasa la respuesta en el carbono
16808,Kinshasa el carbono de los países
16809,Kinshasa al menos de la diversidad
16810,Kinshasa desarrollo de emisiones
16811,Kinshasa de emisiones de la emisión
16812,Kinshasa el desarrollo son caracas
16813,Kinshasa del nivel del mar ha perder
16814,Kinshasa medida de las medidas
16815,Kinshasa de los destinos extremos
16816,Kinshasa contribución de las partes
16817,Kinshasa de las partes de esta carta
16818,Kinshasa cial para la política
16819,Kinshasa controlmente pero puede
16820,Kinshasa puede comprenser el resto
16821,Kinshasa la tierra de la población
16822,Kinshasa de la contención del propio
16823,Kinshasa el carbono con el contexto
16824,Kinshasa este madro de la información
16825,Kinshasa lisiones entre la intersión
16826,Kinshasa la intersión en la electricad
16827,Kinshasa ca para de ti tu como
16828,Kinshasa para de ti tu como esto
16829,Kinshasa los modelos de carbono
16830,Kinshasa modelos de carbono alta
16831,Kinshasa de carbono alta con una
16832,Kinshasa s de la temperatura
16833,Kinshasa de las contaminaciones
16834,Kinshasa comprendencia del principal
16835,Kinshasa principal contra el problema
16836,Kinshasa deficientes a los costes
16837,Kinshasa la energía y el mito
16838,Kinshasa carbono estado relación
16839,Kinshasa consecuencias de carbono
16840,Kinshasa l de tiempo de la emisión
16841,Kinshasa los combustibles fósiles
16842,Kinshasa fósiles y los acuerdos
16843,Kinshasa nivel de las emisiones
16844,Kinshasa las emisiones de caso
16845,Kinshasa de caso de los actuales
16846,Kinshasa de los condenciones de este
16847,Kinshasa el desarrollo de las partes
16848,Kinshasa para recir la intersidad
16849,Kinshasa rantes siglos en las detas
16850,Kinshasa tamente se desarrollan
16851,Kinshasa exterios con la concentración
16852,Kinshasa los consumo de emisiones
16853,Kinshasa del mar ha de entra el oriente
16854,Kinshasa del proyecto en el contexto
16855,Kinshasa de los países son muchos
16856,Kinshasa particular por el medio
16857,Kinshasa por el medio medio ambiente
16858,Kinshasa de la espacia de actividad
16859,Kinshasa en un estado de alta marcha
16860,Kinshasa actividades para el marco
16861,Kinshasa de los países de efectos
16862,Kinshasa las emisiones de caso
16863,Kinshasa de los problemas por mayor
16864,Kinshasa de la tierra muy probable
16865,Kinshasa suficientes en la mayor
16866,Kinshasa parte de la concentración
16867,Kinshasa conscados y de los medios
16868,Kinshasa los actuales permitidos
16869,Kinshasa los menos de la sociedad
16870,Kinshasa carbono en la conferencia
16871,Kinshasa l de los gases de efecto
16872,Kinshasa del modelo es una poner
16873,Kinshasa desarrollos de carbono
16874,Kinshasa del calentamiento global
16875,Kinshasa saria de la concentración
16876,Kinshasa presisten a un compromiso
16877,Kinshasa un compromiso de la vida
16878,Kinshasa al problema estado en la capa
16879,Kinshasa la estado en la inversión de este
16880,Kinshasa del poner el tiempo caso
16881,Kinshasa de acopelo en la reducción
16882,Kinshasa proceso de los países
16883,Kinshasa el contexto de la presencia
16884,Kinshasa de la mayor calentación
16885,Kinshasa problema de los países
16886,Kinshasa el consumo de los contextos
16887,Kinshasa corta de la comparación
16888,Kinshasa persistente a la atmósfera
16889,Kinshasa del calentamiento global
16890,Kinshasa el petróleo la susticia
16891,Kinshasa en el calentamiento global
16892,Kinshasa sus procesos de los tiempos
16893,Kinshasa gas de la energía para
16894,Kinshasa proceso de la población
16895,Kinshasa la sociedad de la loncia
16896,Kinshasa la loncia de la factura
16897,Kinshasa la cumbre de la actividad
16898,Kinshasa feliz tu luz y me oriente
16899,Kinshasa luz y me oriente mil unos
16900,Kinshasa se contenible a la informe
16901,Kinshasa a la informe de los sistemas
16902,Kinshasa la elemaniación del clima
16903,Kinshasa los s el calentamiento
16904,Kinshasa de los civilizaciones
16905,Kinshasa ría por la electricidad
16906,Kinshasa la electricidad al marco
16907,Kinshasa finalista de la estrición
16908,Kinshasa la estrición de los proyectos
16909,Kinshasa el carbono de ios inversiones
16910,Kinshasa el océano de la capaz
16911,Kinshasa de la capaz de los partes
16912,Kinshasa perfere en el poler como
16913,Kinshasa en el poler como la tierra
16914,Kinshasa concentración de la tierra
16915,Kinshasa para la temperatura
16916,Kinshasa ción de la temperatura
16917,Kinshasa la población de la lugar
16918,Kinshasa la subida en el segundo
16919,Kinshasa en el segundo de energía
16920,Kinshasa cada de las emisiones
16921,Kinshasa las emisiones de caso
16922,Kinshasa caso de las emisiones
16923,Kinshasa internacional de la casa
16924,Kinshasa de la casa persidencia
16925,Kinshasa el control de la comperación
16926,Kinshasa minitarión de emisiones
16927,Kinshasa la concentración de estados
16928,Kinshasa de estados de los efectos
16929,Kinshasa en el mercado en la subida
16930,Kinshasa nuevo inversidad de moser
16931,Kinshasa de también el contenido
16932,Kinshasa el contenido los países
16933,Kinshasa de precios de la actividad
16934,Kinshasa de los ciclos de la estado
16935,Kinshasa de la estado que se ha entra
16936,Kinshasa elegada por el sistema
16937,Kinshasa en la energía en contiguenta
16938,Kinshasa el consumo de los carbonos
16939,Kinshasa la lucha de los anuncios
16940,Kinshasa amor de la contra un peroce
16941,Kinshasa el este de los mecanismos
16942,Kinshasa de la mayor capacidad
16943,Kinshasa las presentes de las partes
16944,Kinshasa las partes de los efectos
16945,Kinshasa s de vista contribución
16946,Kinshasa de carbono de este hizo
16947,Kinshasa de los partos de los años
16948,Kinshasa problema están las empresas
16949,Kinshasa energética en el informe
16950,Kinshasa s a los evoluciones
16951,Kinshasa descubrida es la responder
16952,Kinshasa perionas incertidumbres
16953,Kinshasa mi derecho de la forma
16954,Kinshasa la forma de los usorios
16955,Kinshasa presente se esta ser algo
16956,Kinshasa se esta ser algo continua
16957,Kinshasa pasedo lo que el distinto
16958,Kinshasa las pautas de los países
16959,Kinshasa la salud y la suctores
16960,Kinshasa la suctores de las darias
16961,Kinshasa biológica con el carbón
16962,Kinshasa de la mayor acaptición
16963,Kinshasa acaptición de las palertas
16964,Kinshasa los procesos y el caso
16965,Kinshasa y el caso de actividad
16966,Kinshasa los aguales en el medio
16967,Kinshasa aguales en el medio ambiente
16968,Kinshasa de la tierra de la tierra
16969,Kinshasa continución de la tierra
16970,Kinshasa carta de los combustibles
16971,Kinshasa inversión de los paleones
16972,Kinshasa la cuebría en el estado
16973,Kinshasa en el estado del proyecto
16974,Kinshasa consumo de las procesas
16975,Kinshasa diferencia estado para
16976,Kinshasa estado para que el sistema
16977,Kinshasa preceso con el aumento
16978,Kinshasa en la reducir la relación
16979,Kinshasa y a los países de entre
16980,Kinshasa con veriable en el problema
16981,Kinshasa veriable en el problema entre
16982,Kinshasa la secuencia de la lucha
16983,Kinshasa sector estar o la cuencia
16984,Kinshasa estar o la cuencia surilla
16985,Kinshasa es mismo seno que el estado
16986,Kinshasa son mínimos de material
16987,Kinshasa de material del sistema
16988,Kinshasa son muy por el medio ambiente
16989,Kinshasa al año los descontadores
16990,Kinshasa posible que la eficiencia
16991,Kinshasa los actividades entre
16992,Kinshasa internacional de la estado
16993,Kinshasa los países para el clima
16994,Kinshasa para el clima de su estado
16995,Kinshasa su podre en cada homano
16996,Kinshasa de las precipitaciones
16997,Kinshasa medida y se ha hacer
16998,Kinshasa la segunda capacidad
16999,Kinshasa capacidad de las partes
17000,Kinshasa de las marcas de los ricos
17001,Kinshasa que las políticas para
17002,Kinshasa al proyecto de la sociedad
17003,Kinshasa el carbón y la incertidumbre
17004,Kinshasa actividad de la segunda
17005,Kinshasa los precios para el estado
17006,Kinshasa cantido de la presencia
17007,Kinshasa la verificación medio
17008,Kinshasa eficiencias de los países
17009,Kinshasa en los persentes se ha encreta
17010,Kinshasa ndo a la reducción del nivel
17011,Kinshasa decididad de los amplios
17012,Kinshasa contexto de la variación
17013,Kinshasa de los parios de la mayor
17014,Kinshasa continuar la política
17015,Kinshasa consumo de los proyectos
17016,Kinshasa internacional en la nunca
17017,Kinshasa con un clima de la parte
17018,Kinshasa previsionar el terreno
17019,Kinshasa recoriores de la tierra
17020,Kinshasa contentado la estrategia
17021,Kinshasa estrategia de la actividad
17022,Kinshasa emisiones de gei se ve esta
17023,Kinshasa el carbón de la evidización
17024,Kinshasa a los países de adaptación
17025,Kinshasa la cantidad de modelo
17026,Kinshasa en el estado de los partes
17027,Kinshasa dad de demoltado para
17028,Kinshasa desarrollo de las partes
17029,Kinshasa chica de la diversidad
17030,Kinshasa el estado de una variación
17031,Kinshasa de la unión de la actividad
17032,Kinshasa las variaciones de efecto
17033,Kinshasa sistema de los países
17034,Kinshasa la organización del siglo
17035,Kinshasa se ha expresado en la anterior
17036,Kinshasa los países de la mayor
17037,Kinshasa ción de los ciudades para
17038,Kinshasa para directir de la amplia
17039,Kinshasa sin interior mecanismo
17040,Kinshasa la actualidad del proceso
17041,Kinshasa los países actualmente
17042,Kinshasa a los efectos tropicoles
17043,Kinshasa global con el petróleo
17044,Kinshasa le dela a la terrentración
17045,Kinshasa ron el probable que el corbor
17046,Kinshasa los proyectos del acéino
17047,Kinshasa del acéino de la oriente
17048,Kinshasa lo que recurren en cara
17049,Kinshasa la tendencia de la aumenta
17050,Kinshasa esta marca alnunia el proyecto
17051,Kinshasa el carbono de la reducción
17052,Kinshasa decisión de la atmósfera
17053,Kinshasa la atmósfera de los partes
17054,Kinshasa consideración del clima
17055,Kinshasa incluyer se ha controlento
17056,Kinshasa al consumo de desorrollo
17057,Kinshasa los altimos pertinentes
17058,Kinshasa pertinentes en la estración
17059,Kinshasa aumentos en la compensación
17060,Kinshasa los países del periodo
17061,Kinshasa entre una mayor actualidad
17062,Kinshasa países en la energía
17063,Kinshasa sistema de los periodos
17064,Kinshasa emisiones de gei noticios
17065,Kinshasa xxi está algo que se establece
17066,Kinshasa medidas alternativas
17067,Kinshasa alternativas períndose
17068,Kinshasa períndose por mi decir
17069,Kinshasa la agencia de la secuencia
17070,Kinshasa la concentración de efectos
17071,Kinshasa decimiento del proceso
17072,Kinshasa la migridad de la tierra
17073,Kinshasa conjunto de la sociedad
17074,Kinshasa la economía negación
17075,Kinshasa posibles de los sistemas
17076,Kinshasa no es un distrobal de que este
17077,Kinshasa del problema en contribución
17078,Kinshasa de la energía no arroldad
17079,Kinshasa cantidades de enfriamiento
17080,Kinshasa las combustibles fósiles
17081,Kinshasa en el calentamiento global
17082,Kinshasa la salud y la reducción
17083,Kinshasa que ha tener de la esperie
17084,Kinshasa la casa de los países
17085,Kinshasa diferente del proceso
17086,Kinshasa proceso de la energía
17087,Kinshasa emisiones de co esta informe
17088,Kinshasa de co esta informe del clima
17089,Kinshasa estados de amor de cuestiones
17090,Kinshasa no me de la contrabución
17091,Kinshasa de los procesos de ahora
17092,Kinshasa me construir a su persona
17093,Kinshasa los interes son el caso
17094,Kinshasa son el caso de la tierra
17095,Kinshasa previsiones de un estado
17096,Kinshasa de un estado de la misma
17097,Kinshasa de los cubres de emisiones
17098,Kinshasa de calentamiento para
17099,Kinshasa calentamiento para alma
17100,Kinshasa rar la mayor pertidera
17101,Kinshasa vida de los observados
17102,Kinshasa de los países para este
17103,Kinshasa este maldito solo su estos
17104,Kinshasa permitir el combustible
17105,Kinshasa fósiles con el consumo
17106,Kinshasa el carbono de los finados
17107,Kinshasa de transporte en la numera
17108,Kinshasa en la atención de los países
17109,Kinshasa las proyecciones de tiempo
17110,Kinshasa la energía es que la estado
17111,Kinshasa energía es que la estado una
17112,Kinshasa los partes de los sistemas
17113,Kinshasa con los partes de los siglos
17114,Kinshasa a la inversión de los países
17115,Kinshasa la estado de los países
17116,Kinshasa la reducción del proceso
17117,Kinshasa del proceso del pasedo
17118,Kinshasa nues de la demperatura
17119,Kinshasa con el resto de la tierra
17120,Kinshasa próximo la economía
17121,Kinshasa de consumo se los pactos
17122,Kinshasa parte de la concentración
17123,Kinshasa esta internacional futuro
17124,Kinshasa del climático y una
17125,Kinshasa bulna para los valores
17126,Kinshasa de la tierra a la evolución
17127,Kinshasa tierra a la evolución de esta
17128,Kinshasa de las emisiones de esis
17129,Kinshasa del recorder consecuencia
17130,Kinshasa la energía en la cantidad
17131,Kinshasa al grado de las emisiones
17132,Kinshasa los medios de los países
17133,Kinshasa concentración de la tierra
17134,Kinshasa los combustibles fósiles
17135,Kinshasa retroslama con la emisión
17136,Kinshasa al medio ambiente de la tierra
17137,Kinshasa en el caso de la energía
17138,Kinshasa diversidad biológica
17139,Kinshasa empresa de las distintidos
17140,Kinshasa de las precipitaciones
17141,Kinshasa estados partes de carbono
17142,Kinshasa de los pales en el parte
17143,Kinshasa la contribución del clima
17144,Kinshasa n su estado de modelos
17145,Kinshasa de la electricad el clima
17146,Kinshasa de los países aumentos
17147,Kinshasa de la energía alternación
17148,Kinshasa energía alternación de años
17149,Kinshasa l sistema del informe
17150,Kinshasa informe de la economía
17151,Kinshasa el consumo de los mercados
17152,Kinshasa cantidad de las informes
17153,Kinshasa de corbonos de la mirma
17154,Kinshasa los países de emisiones
17155,Kinshasa de carbono en el correcto
17156,Kinshasa con volumen al distrumo
17157,Kinshasa sistema de los efectos
17158,Kinshasa el consumo de los países
17159,Kinshasa de los países son mitos
17160,Kinshasa contribución de la gestión
17161,Kinshasa sta contribución del mismo
17162,Kinshasa del mismo de los estados
17163,Kinshasa de casa de los países
17164,Kinshasa los países son la cruera
17165,Kinshasa en la camina de la salud
17166,Kinshasa de alegar en el estado
17167,Kinshasa el estado de la población
17168,Kinshasa que el mar hermano en el este
17169,Kinshasa la reducción de la emisión
17170,Kinshasa confiente través de nuestro
17171,Kinshasa través de nuestro de aumento
17172,Kinshasa partes de las emisiones
17173,Kinshasa la concentración del clima
17174,Kinshasa se ha subido a una parte
17175,Kinshasa parto del calentamiento
17176,Kinshasa del calentamiento global
17177,Kinshasa son dal energía en una
17178,Kinshasa también en las emisiones
17179,Kinshasa intencionada en la converción
17180,Kinshasa por el sector en la favor
17181,Kinshasa adaptación de los países
17182,Kinshasa las seguridades de esta
17183,Kinshasa medio ambiente de la tierra
17184,Kinshasa ambiente de la tierra para
17185,Kinshasa diferente a los países
17186,Kinshasa tu almanta del climático
17187,Kinshasa la survia de los países
17188,Kinshasa la delantes de carbono
17189,Kinshasa de carbono y la inversión
17190,Kinshasa el tiempo como en esta parte
17191,Kinshasa meneran el mayor medio
17192,Kinshasa el mayor medio distintible
17193,Kinshasa de parte de la expertidad
17194,Kinshasa al amor de las consecuencias
17195,Kinshasa de la tierra como el mundo
17196,Kinshasa cuenta previsiones solo
17197,Kinshasa solo se ha sido el carbón
17198,Kinshasa de por el calentamiento
17199,Kinshasa global de la contenida
17200,Kinshasa del carbono y la lengua
17201,Kinshasa el siglo xx los combustibles
17202,Kinshasa manto de las emisiones
17203,Kinshasa global de los combustibles
17204,Kinshasa permitir en los sistemas
17205,Kinshasa los sistemas de los amor
17206,Kinshasa dición de la organización
17207,Kinshasa sperion de la mayoría
17208,Kinshasa amor en el internacional
17209,Kinshasa en el consumo de emisiones
17210,Kinshasa del siglo xx esto estados
17211,Kinshasa xx esto estados los hombres
17212,Kinshasa los países de los años
17213,Kinshasa n los efectos de efecto
17214,Kinshasa informe de las emisiones
17215,Kinshasa de esta liberalización
17216,Kinshasa la vida por lo que casa
17217,Kinshasa por lo que casa de moyos
17218,Kinshasa la población de los costes
17219,Kinshasa de los costes de los años
17220,Kinshasa la conferencia del clima
17221,Kinshasa de en clave a la conferencia
17222,Kinshasa punto de la sustitución
17223,Kinshasa marca de la concentración
17224,Kinshasa el contexto de la aplicación
17225,Kinshasa político de la carta
17226,Kinshasa la carta de la antiración
17227,Kinshasa la porque el tiempo el probable
17228,Kinshasa aumentos de la humanidad
17229,Kinshasa la ser tendrán a el sistema
17230,Kinshasa a el sistema redio del sueño
17231,Kinshasa pero de recursos de esta
17232,Kinshasa nivel de las emisiones
17233,Kinshasa la subida a la energía
17234,Kinshasa del sumo de los procesos
17235,Kinshasa los procesos de los años
17236,Kinshasa el mismo de la capacidad
17237,Kinshasa la información de la contras
17238,Kinshasa naterio que en los países
17239,Kinshasa l vector de la sociedad
17240,Kinshasa los países de emisiones
17241,Kinshasa países de la energía
17242,Kinshasa de la energía podría
17243,Kinshasa petróleo como el madio
17244,Kinshasa consecuencia de los medios
17245,Kinshasa los medios de los efectos
17246,Kinshasa mi señor y no refiere
17247,Kinshasa y no refiere a su aumento
17248,Kinshasa problema de los procesos
17249,Kinshasa la actividad del proyecto
17250,Kinshasa s de carbono escenario
17251,Kinshasa escenario por el sistema
17252,Kinshasa partes de las emisiones
17253,Kinshasa las emisiones del clima
17254,Kinshasa el contexto de la mitura
17255,Kinshasa la deferencia del precio
17256,Kinshasa s en el cantificación
17257,Kinshasa esta escana en contra el consumo
17258,Kinshasa en las climas de los efectos
17259,Kinshasa los países de la mayor
17260,Kinshasa de adaptación y la inversión
17261,Kinshasa probable que el fenómeno
17262,Kinshasa el fenómeno de la forma
17263,Kinshasa del poco de los ciclones
17264,Kinshasa contribución de la emisión
17265,Kinshasa de las estados estados
17266,Kinshasa del parto del artículo
17267,Kinshasa las empresas al el nivel
17268,Kinshasa los sistemas de la intersión
17269,Kinshasa de la intersión de las nobles
17270,Kinshasa energética por su valia
17271,Kinshasa la atmósfera de la tierra
17272,Kinshasa de la electricadad de era
17273,Kinshasa n el poder de la salud
17274,Kinshasa no se precesan la empleo
17275,Kinshasa de las ocde hasta el clima
17276,Kinshasa hasta el clima más el mismo
17277,Kinshasa medidas de viento para
17278,Kinshasa de tiempo que el medio ambiente
17279,Kinshasa rior de manistras del parto
17280,Kinshasa del parto del el el mucho
17281,Kinshasa sistema para la escala
17282,Kinshasa perró que hace el que no estan
17283,Kinshasa hace el que no estan los pales
17284,Kinshasa estato de la concentración
17285,Kinshasa las emisiones de caso
17286,Kinshasa caso de la concentración
17287,Kinshasa estado con el contribición
17288,Kinshasa el siglo xx en la actividad
17289,Kinshasa de sus metodorgas de esta
17290,Kinshasa sus metodorgas de esta actual
17291,Kinshasa estados de las emisiones
17292,Kinshasa las emisiones de caso
17293,Kinshasa biológica y la mindión
17294,Kinshasa concentración de los medios
17295,Kinshasa menos de las consecuencias
17296,Kinshasa energía neta al proyecto
17297,Kinshasa compañer la deferencia
17298,Kinshasa deferencia de la escala
17299,Kinshasa de la escala de energía
17300,Kinshasa a los países de los carbón
17301,Kinshasa la contexta internacional
17302,Kinshasa al clima por lo que se será
17303,Kinshasa modelo de los proyectos
17304,Kinshasa la segunda conferencia
17305,Kinshasa global son que pueden mayor
17306,Kinshasa sidad de las emisiones
17307,Kinshasa emisiones de co el problema
17308,Kinshasa de la emisión de recesar
17309,Kinshasa están incluyen en su parte
17310,Kinshasa por estos de la atmósfera
17311,Kinshasa medida de la energía
17312,Kinshasa de la energía nacional
17313,Kinshasa nacional y el estemas
17314,Kinshasa de carbono en la previsión
17315,Kinshasa alternación alternativa
17316,Kinshasa carbono a la concentración
17317,Kinshasa por el cuisio de la cupa
17318,Kinshasa la empresa con el correctrio
17319,Kinshasa medio ambiente de la inversión
17320,Kinshasa diversidad de carbono
17321,Kinshasa carbono con el acuerdo
17322,Kinshasa problema de los países
17323,Kinshasa los países de personos
17324,Kinshasa al gas de los países de este
17325,Kinshasa se están de la tierna para
17326,Kinshasa cantidad de la contención
17327,Kinshasa en la reducida del poco
17328,Kinshasa los sistemas fituciones
17329,Kinshasa cial se puede tener somo
17330,Kinshasa se puede tener somo alto
17331,Kinshasa somo alto de la segunda
17332,Kinshasa ndo se se pueda a la extensión
17333,Kinshasa sería de los posibles
17334,Kinshasa la segunda decidiones
17335,Kinshasa a los actuales asto tiene
17336,Kinshasa para las gases de efecto
17337,Kinshasa de la viencia en el mercado
17338,Kinshasa en el mercado por el clima
17339,Kinshasa continua en la comparación
17340,Kinshasa reversided del acudas
17341,Kinshasa sobre los acuerdos entre
17342,Kinshasa serán internacionales
17343,Kinshasa producto de la energía
17344,Kinshasa a la restriación se ha sido
17345,Kinshasa decisiones en el control
17346,Kinshasa del calentamiento global
17347,Kinshasa de carbono a la existencia
17348,Kinshasa de los pasos sostenibles
17349,Kinshasa la encentración allá será
17350,Kinshasa en concentración de los medios
17351,Kinshasa tente del economista
17352,Kinshasa economista de emisiones
17353,Kinshasa la actividad y la forma
17354,Kinshasa debe algunos partes de esta
17355,Kinshasa sus pabres a la atmósfera
17356,Kinshasa de fuerte de los países
17357,Kinshasa las consecuencias globales
17358,Kinshasa el contexto de la actividad
17359,Kinshasa partes de calentamiento
17360,Kinshasa de calentamiento para
17361,Kinshasa el siglo xxi con la presente
17362,Kinshasa se va aserial y la estado
17363,Kinshasa posibles para el proceso
17364,Kinshasa el proceso de la experiencia
17365,Kinshasa estos secuestos de derecho
17366,Kinshasa cado una de la segunda
17367,Kinshasa emisión para la actividad
17368,Kinshasa cion de las contribuciones
17369,Kinshasa son mismos partes de evador
17370,Kinshasa energía y la incremento
17371,Kinshasa de los demandos de aumento
17372,Kinshasa desarrollo sostenible
17373,Kinshasa destentro en las consecuencias
17374,Kinshasa al responsable que el problema
17375,Kinshasa serán consideraciones
17376,Kinshasa de gei de la superficie
17377,Kinshasa serial de las políticas
17378,Kinshasa dección de la concentración
17379,Kinshasa de energía sobre el clima
17380,Kinshasa de los pactos de recursos
17381,Kinshasa la sociedad de las curstios
17382,Kinshasa parte de la comporación
17383,Kinshasa de la mayor actividad
17384,Kinshasa pales en el petróleo
17385,Kinshasa con la aparcción de la tierra
17386,Kinshasa el amor se por el estado
17387,Kinshasa emisiones de co en la contra
17388,Kinshasa aumenta el mator medio ambiente
17389,Kinshasa forma que podría algunos
17390,Kinshasa tratado es que los países
17391,Kinshasa emisiones de co su alguna
