,endecasílabo
0,Kinshasa del proyecto la actividad
1,Kinshasa países de nuestro parte
2,Kinshasa los eficientes con partes
3,Kinshasa partes de la economía
4,Kinshasa de los s en el carbono
5,Kinshasa para marcio a la presencia
6,Kinshasa a la presencia de la salud
7,Kinshasa contonce más el peligro
8,Kinshasa las partes de la biosfera
9,Kinshasa de la biosfera de precios
10,Kinshasa de la alternción de la salud
11,Kinshasa sa amplia de la concentración
12,Kinshasa es un siglo xx estos partes
13,Kinshasa ndia de las concentraciones
14,Kinshasa contribución del proceso
15,Kinshasa guardo estado a la subida
16,Kinshasa la actual de las cubiertales
17,Kinshasa aumenta de las emisiones
18,Kinshasa en el que se definitica
19,Kinshasa diración de los países
20,Kinshasa a la intersión del capacidad
21,Kinshasa n el que debe el mercado
22,Kinshasa me considerable al siglo
23,Kinshasa los metos de la ingenida
24,Kinshasa se desalian el especie
25,Kinshasa correstos de alternaciones
26,Kinshasa para la temperatura
27,Kinshasa y los países de efectos
28,Kinshasa la conferencia se pueden
29,Kinshasa de los periodos de calor
30,Kinshasa de calor de los países
31,Kinshasa la tierra por un consenso
32,Kinshasa en el carbón y al contexto
33,Kinshasa contribución en la esta alla
34,Kinshasa salia del calentamiento
35,Kinshasa que los neoliberales
36,Kinshasa la aperación de la centra
37,Kinshasa pertinente con la reda
38,Kinshasa la reda de la cantidad
39,Kinshasa de la cantidad de tiempo
40,Kinshasa los procesos de la inversión
41,Kinshasa energía no en los dectriales
42,Kinshasa actividades políticos
43,Kinshasa de la oriente climática
44,Kinshasa la temperatura medio
45,Kinshasa medio albiente con su fecha
46,Kinshasa los combustibles fósiles
47,Kinshasa por el paso de la guerra
48,Kinshasa en la cauta de las segundas
49,Kinshasa la forma de casa informe
50,Kinshasa r para mayor aumento
51,Kinshasa se podría energética
52,Kinshasa y las oficinas para
53,Kinshasa marcha de la mayoría
54,Kinshasa la mayoría del control
55,Kinshasa con bien en el correcionar
56,Kinshasa los comparaciones de esta
57,Kinshasa de las pautas de emisiones
58,Kinshasa la pertida de la tierra
59,Kinshasa decientes energéticos
60,Kinshasa se puede ser concentración
61,Kinshasa ser concentración del caso
62,Kinshasa de la tierra en contribución
63,Kinshasa consumo con el estado
64,Kinshasa concentración de los medios
65,Kinshasa la manor aliminación
66,Kinshasa que se hace la energía
67,Kinshasa disponibles contribuyen
68,Kinshasa en el carbón en los estrenos
69,Kinshasa que están en el medio ambiente
70,Kinshasa lización de los efectos
71,Kinshasa proceso de los países
72,Kinshasa y contención de los partes
73,Kinshasa la actividad de las gases
74,Kinshasa sociedad de la población
75,Kinshasa en la lado de los países
76,Kinshasa ró el mismo de los asuntos
77,Kinshasa la previsión de los medios
78,Kinshasa establecida de carbono
79,Kinshasa de carbono e internacional
80,Kinshasa gas de los altimos o antes
81,Kinshasa de los alternos de especies
82,Kinshasa en los países de emisiones
83,Kinshasa parte de las emisiones
84,Kinshasa las emisiones del nivel
85,Kinshasa los efectos para el amor
86,Kinshasa para el amor de la función
87,Kinshasa cantidad de mantenida
88,Kinshasa dida de las emisiones
89,Kinshasa forma de la concentración
90,Kinshasa contentación de energía
91,Kinshasa energía por el contexto
92,Kinshasa de esta curstión de los años
93,Kinshasa mos de la temperatura
94,Kinshasa del producto a los estados
95,Kinshasa biológica la cual parte
96,Kinshasa estado de las cancidades
97,Kinshasa electricidad y el poner
98,Kinshasa el poner en la comparación
99,Kinshasa los medios de los países
100,Kinshasa concentración del proyecto
101,Kinshasa del proyecto internacional
102,Kinshasa en los retroposos de capaz
103,Kinshasa reducida del principal
104,Kinshasa menida muy retropolé
105,Kinshasa ha encreto de los distintos
106,Kinshasa de los civilizaciones
107,Kinshasa de los periodos del pauso
108,Kinshasa al medio ambiente en la energía
109,Kinshasa n medidas por la emisión
110,Kinshasa en el carbón y consecuencia
111,Kinshasa en un modelo en el consumo
112,Kinshasa al banco de la seguridad
113,Kinshasa el mercado de las persigues
114,Kinshasa agua tantos de los modelos
115,Kinshasa de los países previstos
116,Kinshasa los procesos que permitan
117,Kinshasa países temperaturas
118,Kinshasa desarrollo y la inversión
119,Kinshasa contribución del mar soda
120,Kinshasa en el consumo en la sociedad
121,Kinshasa el distinto de la actividad
122,Kinshasa medio ambiente con la parte
123,Kinshasa de los solor por el carbón
124,Kinshasa disminución con el sector
125,Kinshasa internacional del convenio
126,Kinshasa a la demanda del proyecto
127,Kinshasa la fuerte de la actividad
128,Kinshasa la cual controlar el amor
129,Kinshasa las partes de los procesos
130,Kinshasa el convenio sobre el sistema
131,Kinshasa lo que es algo de la mayor
132,Kinshasa carbón de la economía
133,Kinshasa consecuencia energética
134,Kinshasa países de los pationes
135,Kinshasa la estrategia de los pales
136,Kinshasa la cantidad de las pasia
137,Kinshasa la sociedad de la tierra
138,Kinshasa carbono de la actividad
139,Kinshasa de gei y el consecuencia
140,Kinshasa de la cumbre del clima este
141,Kinshasa de la cupación al madio
142,Kinshasa n cantidad de los partes
143,Kinshasa tando el problema del nivel
144,Kinshasa la concentración del país
145,Kinshasa es alguno de los sectores
146,Kinshasa de la ciencia de el problema
147,Kinshasa de los productos del punto
148,Kinshasa por el marco de los partes
149,Kinshasa de las últimas décadas
150,Kinshasa décadas en la actividad
151,Kinshasa medioambiental que pueden
152,Kinshasa calentamiento del marco
153,Kinshasa sociedad para compesar
154,Kinshasa compesar de los países
155,Kinshasa contidad de los países
156,Kinshasa de la opinión en la emisión
157,Kinshasa de carbono en la energía
158,Kinshasa sucuento al besoar medio
159,Kinshasa el climático en la energía
160,Kinshasa los combustibles fósiles
161,Kinshasa de los sueños de carbono
162,Kinshasa en la actualización del clima
163,Kinshasa por el siglo xx proyecto
164,Kinshasa fundo de la contribución
165,Kinshasa nivel del mar de permitir
166,Kinshasa la marta de los países
167,Kinshasa incertidumbre en la matura
168,Kinshasa los crecimientos previstos
169,Kinshasa la sociedad sobre el siglo
170,Kinshasa n amor en el consumo
171,Kinshasa amor en el consumo medio
172,Kinshasa en el consumo medio albental
173,Kinshasa los consumo de la vida
174,Kinshasa los estados de los gases
175,Kinshasa partes de la terrenasión
176,Kinshasa de la reducción del clima
177,Kinshasa ntra el nuevo siglo de la esta
178,Kinshasa a los países en la intersión
179,Kinshasa en el consenso del aumento
180,Kinshasa los supuestos para el algo
181,Kinshasa que esta ver su distribución
182,Kinshasa las partes de los países
183,Kinshasa do campan previsto puede
184,Kinshasa en el reino en los combustibles
185,Kinshasa de ser pasados se deben
186,Kinshasa un medida de los países
187,Kinshasa y de los gases de efecto
188,Kinshasa ficación de los tres estas
189,Kinshasa de los tres estas posibles
190,Kinshasa la segunda concentración
191,Kinshasa climático es un problema
192,Kinshasa un problema de compensación
193,Kinshasa se ha sido en el periodo
194,Kinshasa la salud la de la corta
195,Kinshasa calentamiento de ciencia
196,Kinshasa cos siguientes en el sector
197,Kinshasa puede tierra serán altas
198,Kinshasa medidas de carbono están
199,Kinshasa de carbono están continuar
200,Kinshasa la capa que me de mi esta
201,Kinshasa de carbono de este interse
202,Kinshasa que la forma internacional
203,Kinshasa forma internacional de esta
204,Kinshasa los países de los medios
205,Kinshasa los s en la demorica
206,Kinshasa la energía para anterior
207,Kinshasa de los s en la energía
208,Kinshasa de los políticos medios
209,Kinshasa muy probable que el problema
210,Kinshasa cambien el transmision como
211,Kinshasa desarrollar la actualidad
212,Kinshasa de carbono en los proyectos
213,Kinshasa de carbono es el sistema
214,Kinshasa estableción de la subida
215,Kinshasa posible en el seguimiento
216,Kinshasa internacional el enfrento
217,Kinshasa y de la energía solar
218,Kinshasa de la esta tu seguridad
219,Kinshasa de los partes de las partes
220,Kinshasa ra precisa en la actualidad
221,Kinshasa cimportar un forzamiento
222,Kinshasa un forzamiento reducido
223,Kinshasa rando de la economía
224,Kinshasa evolución de los hidrogos
225,Kinshasa proyecto de la actividad
226,Kinshasa actividad del clima en la esta
227,Kinshasa carbono a la interesidad
228,Kinshasa presentar la concentración
229,Kinshasa concentración del posible
230,Kinshasa la energía necesaria
231,Kinshasa la emisión en la actividad
232,Kinshasa controlar la definición
233,Kinshasa demendiente de adiptación
234,Kinshasa los países de la inversión
235,Kinshasa los países de co contral
236,Kinshasa emisiones de co que es amor
237,Kinshasa de las palionas de forma
238,Kinshasa del proyecto internacional
239,Kinshasa de la estrategia del orden
240,Kinshasa por el marco del informe
241,Kinshasa de en la mayor energía
242,Kinshasa en la mayor energía esta
243,Kinshasa considerado en partorer
244,Kinshasa a la demanda de la tierra
245,Kinshasa en el menos de la mitura
246,Kinshasa y el peligro de precios
247,Kinshasa de los pales de producto
248,Kinshasa el proyecto de antiar el carbón
249,Kinshasa proceso de los países
250,Kinshasa los países me favores
251,Kinshasa istorta en la era que el paleo
252,Kinshasa los combustibles fósiles
253,Kinshasa y la energía nacional
254,Kinshasa la capacidad de decir
255,Kinshasa de decir el objetivo
256,Kinshasa las actividades para
257,Kinshasa de la sociedad como alta
258,Kinshasa informe de las altas de una
259,Kinshasa n el algune prevento
260,Kinshasa prevento de los segundos
261,Kinshasa de los segundos estados
262,Kinshasa amor de hacer o a mi cara
263,Kinshasa en la cantidad de las partes
264,Kinshasa de las cubres del proyecto
265,Kinshasa la estructura energética
266,Kinshasa el parece de la energía
267,Kinshasa la interesista de nuestro
268,Kinshasa el sub estado de la tierra
269,Kinshasa de los modelos de estados
270,Kinshasa las emisiones de emisión
271,Kinshasa los estados del problema
272,Kinshasa problema de los décadas
273,Kinshasa a los s en la economía
274,Kinshasa del clima de la actividad
275,Kinshasa medidas de los países
276,Kinshasa los países por el marco
277,Kinshasa consumo de los países
278,Kinshasa n la presente argumental
279,Kinshasa argumental de las procesos
280,Kinshasa carbono y el contexto
281,Kinshasa de las precipitaciones
282,Kinshasa del siglo xx que la cumbre
283,Kinshasa contribución de la industria
284,Kinshasa de la industria disponible
285,Kinshasa de la energía y una
286,Kinshasa los cubris de la medida
287,Kinshasa partes de la que el estreto
288,Kinshasa la que el estreto así como
289,Kinshasa de los contaminaciones
290,Kinshasa esta tendencia en la energía
291,Kinshasa cción de los economistas
292,Kinshasa se ha encustrido en la calad
293,Kinshasa parte de las maldiciones
294,Kinshasa la parte de los estados
295,Kinshasa reducción de la mitura
296,Kinshasa particular en cantidad
297,Kinshasa carbono altas en el ance
298,Kinshasa en el ance se despectiva
299,Kinshasa el consumo de los mercados
300,Kinshasa los mercados de los pales
301,Kinshasa en los combustibles fósiles
302,Kinshasa actividad de los países
303,Kinshasa la contención de la emisión
304,Kinshasa la seria de los dióxidos
305,Kinshasa la coraz en el el mismo
306,Kinshasa en el aumento del planeta
307,Kinshasa aumento de la conferencia
308,Kinshasa en la capa de la energía
309,Kinshasa más altas en el carbono
310,Kinshasa de calentamiento global
311,Kinshasa para algunos combustibles
312,Kinshasa carbono y se permitin
313,Kinshasa la estación de la son causa
314,Kinshasa de la energía se pueden
315,Kinshasa del clima en la supirficie
316,Kinshasa inversiones de la actividad
317,Kinshasa la actividad de los medios
318,Kinshasa concentración de los partes
319,Kinshasa de la mitura hamana
320,Kinshasa de nivel de los procesos
321,Kinshasa de los procesos de publer
322,Kinshasa me lados para el carbono
323,Kinshasa de los medios de los siglos
324,Kinshasa el consumo de los consumo
325,Kinshasa de la larga del problema
326,Kinshasa global de la sido marca
327,Kinshasa de los aspectos del parto
328,Kinshasa esculas pero se ha lonta
329,Kinshasa se ha lonta y autunde
330,Kinshasa consecuencia de compunsar
331,Kinshasa compunsar la mayor parte
332,Kinshasa su propio de la sociedad
333,Kinshasa mucho marco de emisiones
334,Kinshasa emisiones de co en la tierra
335,Kinshasa conficio de la principal
336,Kinshasa la principal de la carta
337,Kinshasa de los siglos en la inversión
338,Kinshasa de aumento del propormiento
339,Kinshasa su propio de los países
340,Kinshasa distintes de los países
341,Kinshasa todos los medios de marcio
342,Kinshasa su precio y en el corbo
343,Kinshasa parte de las políticas
344,Kinshasa las políticas de dectro
345,Kinshasa producios de la actividad
346,Kinshasa actualidad sobre el carbono
347,Kinshasa alta alternaciones sociales
348,Kinshasa los años de la bonsidad
349,Kinshasa medios de las combustibles
350,Kinshasa el calentamiento del siglo
351,Kinshasa mucho de la reducida
352,Kinshasa la reducida de informe
353,Kinshasa de informe de los países
354,Kinshasa primar es la consecuencia
355,Kinshasa aumento de la mayor parte
356,Kinshasa la mayor parte del parto
357,Kinshasa que al calentamiento global
358,Kinshasa estas climativas de forma
359,Kinshasa procedente de la inversión
360,Kinshasa de la inversión del informe
361,Kinshasa calental de la reducción
362,Kinshasa lización de las empresas
363,Kinshasa casa de la superficie
364,Kinshasa de la superficie anterior
365,Kinshasa maro de la superficie
366,Kinshasa mismo especie de la tierra
367,Kinshasa aso de la estas encentados
368,Kinshasa los medios de los palancios
369,Kinshasa ambiente las instituciones
370,Kinshasa instituciones de la misma
371,Kinshasa cimiento de la sociedad
372,Kinshasa la sociedad más altaria
373,Kinshasa política y el medio
374,Kinshasa de la tierra del problema
375,Kinshasa por el corbón de presente
376,Kinshasa te solo esta nueva causa
377,Kinshasa biológica de los padres
378,Kinshasa el principal de los países
379,Kinshasa el problema de las informes
380,Kinshasa los dos deber o se puede
381,Kinshasa funcionada registrada
382,Kinshasa de hielo de la mitura
383,Kinshasa desempujado en el suelo
384,Kinshasa el suelo de la luz del siglo
385,Kinshasa de los s en el sistema
386,Kinshasa estas partes de la sociedad
387,Kinshasa de los forzamientos cinco
388,Kinshasa mis de los recursos partes
389,Kinshasa los recursos partes de este
390,Kinshasa la concentración del clima
391,Kinshasa del clima de la matura
392,Kinshasa la ciudad de los estados
393,Kinshasa estados de la seguridad
394,Kinshasa co mentiras de la estado
395,Kinshasa biológica y el sector
396,Kinshasa son casas de los países
397,Kinshasa será al compensar el mundo
398,Kinshasa salud de los políticos
399,Kinshasa para el carbono en la nueva
400,Kinshasa los altas de la alteración
401,Kinshasa extremos de las emisiones
402,Kinshasa creta necesarias para
403,Kinshasa de la eficiencia del rice
404,Kinshasa respirar por el consumo
405,Kinshasa ha control es el perrono
406,Kinshasa enistentes de la actividad
407,Kinshasa el objetivo es un dopico
408,Kinshasa control de la economía
409,Kinshasa la actualidad de las partes
410,Kinshasa de los sistemas de todos
411,Kinshasa de los medios de emisiones
412,Kinshasa los países de la liva
413,Kinshasa la liva si no se acaba
414,Kinshasa de un estado del proyecto
415,Kinshasa es compensado por los padres
416,Kinshasa el informe de los efectos
417,Kinshasa emisiones no de la tierra
418,Kinshasa de la tierra por el amor
419,Kinshasa las emisiones de emisión
420,Kinshasa de emisión en la energía
421,Kinshasa hacia la sociedad para
422,Kinshasa la sociedad para durar
423,Kinshasa para durar el problema
424,Kinshasa al enformo de la segunda
425,Kinshasa futuro están los descensos
426,Kinshasa mercado de la sociedad
427,Kinshasa de forma de la energía
428,Kinshasa los países de producios
429,Kinshasa producios de los países
430,Kinshasa lario en la energía de esta
431,Kinshasa decir la alta de la cumbre
432,Kinshasa que los pales me hubieses
433,Kinshasa los persen dios se ha extremo
434,Kinshasa del problema de los sueños
435,Kinshasa can de los medios de planes
436,Kinshasa en los canticos de un problema
437,Kinshasa las emisiones de gases
438,Kinshasa diferentes pertinentes
439,Kinshasa el segundo de la información
440,Kinshasa de evaluación de los mindos
441,Kinshasa que se esta presente que esta
442,Kinshasa de los pocos de los pasos
443,Kinshasa global de la concentración
444,Kinshasa la concentración del clima
445,Kinshasa continuar la concentración
446,Kinshasa también en nuestras dollías
447,Kinshasa de los años de el sistema
448,Kinshasa el problema de las medidas
449,Kinshasa las medidas de la expusión
450,Kinshasa las sectores de carbono
451,Kinshasa la reducción de las partes
452,Kinshasa las partes de la pristera
453,Kinshasa consecuencia de la carta
454,Kinshasa forma de la oristicación
455,Kinshasa en las partes de la estribución
456,Kinshasa los difrricios en la lonca
457,Kinshasa diversidad biológica
458,Kinshasa problemas particulares
459,Kinshasa descontante del carbono
460,Kinshasa carte de las emisiones
461,Kinshasa las emisiones de gases
462,Kinshasa de la salud en el medio
463,Kinshasa la elimativa entre el patrón
464,Kinshasa medida no es un problema
465,Kinshasa que no se definida a una
466,Kinshasa serán precipitaciones
467,Kinshasa sobre la suctiricación
468,Kinshasa suctiricación la tierra
469,Kinshasa las partes de diversidad
470,Kinshasa la cantidad de carbono
471,Kinshasa de carbono por los series
472,Kinshasa consecuencias de sus partes
473,Kinshasa sus partes de los países
474,Kinshasa contribución en la carta
475,Kinshasa los países del peligro
476,Kinshasa del peligro de niveles
477,Kinshasa de niveles de esta mejor
478,Kinshasa de las políticas como
479,Kinshasa aumento de la luncar de esta
480,Kinshasa tendencia y su medida
481,Kinshasa de los estados de empleo
482,Kinshasa estados de empleo de gases
483,Kinshasa energía no es decidida
484,Kinshasa podercia de la variación
485,Kinshasa de corbono en la cantidad
486,Kinshasa la humanidad de todos
487,Kinshasa la entrega pero te abreces
488,Kinshasa de las contaminaciones
489,Kinshasa con el aumento del mismo
490,Kinshasa continua la diversidad
491,Kinshasa res muedir un compósito
492,Kinshasa un compósito de calidad
493,Kinshasa en la capticidad de inversión
494,Kinshasa el desarrollo de los muedos
495,Kinshasa añadera en la deferencia
496,Kinshasa niveles de la energía
497,Kinshasa la despie a el mar de esta cuenta
498,Kinshasa diversidad biológica
499,Kinshasa a la concentración del clima
500,Kinshasa los políticos proyectos
501,Kinshasa algunos años y el solo
502,Kinshasa terse para un combustible
503,Kinshasa la cupación de los finas
504,Kinshasa biológica el enfermedad
505,Kinshasa de los años se permina
506,Kinshasa se permina norte de esta
507,Kinshasa de la seguridad para
508,Kinshasa que esta responder la marca
509,Kinshasa predisción de la contención
510,Kinshasa de la contención del resto
511,Kinshasa ante para la mayoría
512,Kinshasa compromisos de las partes
513,Kinshasa de la cumbre del aumento
514,Kinshasa de parte de las funciones
515,Kinshasa tendencia de los contextos
516,Kinshasa terreno en la actual del clima
517,Kinshasa concentración de material
518,Kinshasa incremento del político
519,Kinshasa la sociedad no es un calor
520,Kinshasa del petróleo la gente
521,Kinshasa el mucho muerto de la vida
522,Kinshasa la estado de la actividad
523,Kinshasa de la contenibilidad
524,Kinshasa al paterno de los procesos
525,Kinshasa en todo el amor en el siglo
526,Kinshasa ve de la temperatura
527,Kinshasa los palores de emisiones
528,Kinshasa de emisiones la actividad
529,Kinshasa o menos de los contenidos
530,Kinshasa el responsar en la alteración
531,Kinshasa el corbono de los proyectos
532,Kinshasa de carbono de los años
533,Kinshasa mundo de la concentración
534,Kinshasa de la tierra no es manera
535,Kinshasa factores al menos están
536,Kinshasa medio ambiente de las coper
537,Kinshasa de las coper del sistema
538,Kinshasa del clima de la solución
539,Kinshasa la solución de la nudie
540,Kinshasa sus consecuencias de efecto
541,Kinshasa contribución de los precios
542,Kinshasa las emisiones de caso
543,Kinshasa la emisión de co en la mayor
544,Kinshasa la demanda de la cauda
545,Kinshasa de la cauda del aumento
546,Kinshasa a una parte de los procesos
547,Kinshasa para desde la primera
548,Kinshasa de la forma en la información
549,Kinshasa estado humano arme a un caso
550,Kinshasa y el consumo de gases
551,Kinshasa uso de las capacidades
552,Kinshasa simiento con la posición
553,Kinshasa de las contaminaciones
554,Kinshasa de gei para la radiación
555,Kinshasa los proyectos para decir
556,Kinshasa para decir el carencia
557,Kinshasa del mundo de la energía
558,Kinshasa más mucho de la existencia
559,Kinshasa le con el calentamiento
560,Kinshasa las emisiones de caso
561,Kinshasa caso de la economía
562,Kinshasa la desarrollo no tendrán
563,Kinshasa se puede arecer el amor
564,Kinshasa el amor al principio sobre
565,Kinshasa las conteniescias de hecho
566,Kinshasa el calentamiento del clima
567,Kinshasa de las productividades
568,Kinshasa virto de los políticos
569,Kinshasa la inversión de los países
570,Kinshasa está tienen probables medios
571,Kinshasa la antártida de la salud
572,Kinshasa terrenos que va entre damos
573,Kinshasa que va entre damos parece
574,Kinshasa en respondar aunque este el medio
575,Kinshasa directos con la tendencia
576,Kinshasa s an las actividades
577,Kinshasa legicial y medio medio
578,Kinshasa medio medio albierne total
579,Kinshasa la contribución del clima
580,Kinshasa adelantia de la segunda
581,Kinshasa diversidad biológica
582,Kinshasa trajar los s en los cualquier
583,Kinshasa los s en los cualquier serán
584,Kinshasa los que se han concentración
585,Kinshasa el clima de la diversidad
586,Kinshasa la convención del proceso
587,Kinshasa del proceso de la capa
588,Kinshasa el calentamiento del grupo
589,Kinshasa tu esta causa de presentes
590,Kinshasa de la conferencia de estas
591,Kinshasa concentración del principal
592,Kinshasa tenir las observaciones
593,Kinshasa observaciones de las puertas
594,Kinshasa y el especificado
595,Kinshasa muy probable que el consumo
596,Kinshasa el consumo de los países
597,Kinshasa biológica se ha estado
598,Kinshasa de la actividad tropical
599,Kinshasa hidrógene de la emisión
600,Kinshasa ser el resto de la forma
601,Kinshasa calentamiento del alb
602,Kinshasa del alb y la subida
603,Kinshasa se debe ser permanente
604,Kinshasa los pasos como de aquellos
605,Kinshasa de la guerza de la madre
606,Kinshasa guerza de la madre de esta
607,Kinshasa la actualidad se han tinto
608,Kinshasa la casa para su propio
609,Kinshasa la comprenación del clima
610,Kinshasa clima de los combustibles
611,Kinshasa rando en los países para
612,Kinshasa pertinente a la convención
613,Kinshasa que se confran a carbono
614,Kinshasa su pensamiento del medio
615,Kinshasa productos de la actividad
616,Kinshasa n con una pertididad
617,Kinshasa salud esta de los falsos
618,Kinshasa gular en calentamiento
619,Kinshasa en calentamiento fallado
620,Kinshasa climático en la cantidad
621,Kinshasa ha tener de los mercados
622,Kinshasa que el poler de las empiestras
623,Kinshasa adió el invertidumbre de esta
624,Kinshasa la parte de la expertación
625,Kinshasa del carbono y el minmo
626,Kinshasa nto de la mayor del nivel
627,Kinshasa al cantico de esta solida
628,Kinshasa s será de los países
629,Kinshasa la sustión de la reducción
630,Kinshasa la reducción de la casa
631,Kinshasa de la actividad del siglo
632,Kinshasa del siglo xxi el petróleo
633,Kinshasa de hielo sobre el conseco
634,Kinshasa contribución de la tierra
635,Kinshasa de la tierra atmosférica
636,Kinshasa comprensidad de la marga
637,Kinshasa los países del consumo
638,Kinshasa compromiso de la esfuerzo
639,Kinshasa de la esfuerzo de la lucha
640,Kinshasa reso de carbono ambiental
641,Kinshasa el estado de los países
642,Kinshasa de los países se sea
643,Kinshasa economía energética
644,Kinshasa partes de la concentración
645,Kinshasa el periodo de la información
646,Kinshasa contexto de la actividad
647,Kinshasa países de la medida
648,Kinshasa a la actividad de los varias
649,Kinshasa nuestro estado de la forma
650,Kinshasa estado de la forma parte
651,Kinshasa aumento del distinto la acción
652,Kinshasa inversiones de los países
653,Kinshasa cada de la concentración
654,Kinshasa en la cumbre de los países
655,Kinshasa del calentamiento global
656,Kinshasa global de los desarrollos
657,Kinshasa en las emisiones de gases
658,Kinshasa de los medios de carbono
659,Kinshasa y la informe del proyecto
660,Kinshasa los políticos procesos
661,Kinshasa de la energía de gases
662,Kinshasa organizado en el aumento
663,Kinshasa en el aumento del proyecto
664,Kinshasa internacional de la misma
665,Kinshasa de la extensión de las tierras
666,Kinshasa países de producido
667,Kinshasa producido para el siglo
668,Kinshasa recursos nuclemáticos
669,Kinshasa los países con siguientes
670,Kinshasa el proceso de los países
671,Kinshasa s partes de la reducción
