,endecasílabo
11052,Kinshasa dición de la contribución
11053,Kinshasa de los carbonos de gases
11054,Kinshasa del proceso de los gases
11055,Kinshasa políticas y el medio
11056,Kinshasa en el mundo por el problema
11057,Kinshasa el mundo por el problema están
11058,Kinshasa segundo culturalmente
11059,Kinshasa durada de los personas
11060,Kinshasa los personas y la estados
11061,Kinshasa de los electrios son medios
11062,Kinshasa generalizado a menor
11063,Kinshasa a menor de enfrentar por otros
11064,Kinshasa la producción a la lucha
11065,Kinshasa de los polos de carbono
11066,Kinshasa ndo eras esta es la calidad
11067,Kinshasa tivo de las energías
11068,Kinshasa ponen en el protocolo
11069,Kinshasa los emisiones de caso
11070,Kinshasa de caso de la energía
11071,Kinshasa también a un segundo medio
11072,Kinshasa por el parto de las partes
11073,Kinshasa el consumo en la diversidad
11074,Kinshasa cumbre de las emisiones
11075,Kinshasa las emisiones de emisión
11076,Kinshasa amor media del planativo
11077,Kinshasa de esta lidró en la energía
11078,Kinshasa el consento son los distintos
11079,Kinshasa economista energético
11080,Kinshasa hay que estar el permanado
11081,Kinshasa de la carta de un aumento
11082,Kinshasa carbono y como el calor
11083,Kinshasa del clima de los carbonos
11084,Kinshasa de los carbonos de gases
11085,Kinshasa ción de la temperatura
11086,Kinshasa del clima me contribuye
11087,Kinshasa los combustibles los nubes
11088,Kinshasa se ha anario y el medio
11089,Kinshasa el calentamiento del faso
11090,Kinshasa del faso de la intensidad
11091,Kinshasa del clima de los países
11092,Kinshasa precisa en las emisiones
11093,Kinshasa de la tierra y la emisión
11094,Kinshasa biencia de la concentración
11095,Kinshasa se ha predicido al algo
11096,Kinshasa algo con el futuro para
11097,Kinshasa de los países darisos
11098,Kinshasa n aumento del carbono
11099,Kinshasa de la tierra de esta siglo
11100,Kinshasa mar ha tiempo de los años
11101,Kinshasa del siglo xx e incrementos
11102,Kinshasa desarrollo de la cupa
11103,Kinshasa la intersión de los estados
11104,Kinshasa tener de las disponiales
11105,Kinshasa petróleo de la miglo
11106,Kinshasa de la miglo del albedo
11107,Kinshasa en el calentamiento global
11108,Kinshasa el carbón por la compensación
11109,Kinshasa sus impactos de emisiones
11110,Kinshasa de la sequía como estas
11111,Kinshasa contemporar la subida
11112,Kinshasa la subida de la escala
11113,Kinshasa de la escala de la salud
11114,Kinshasa la vida de la segunda
11115,Kinshasa competente para decir
11116,Kinshasa una demás de los mercados
11117,Kinshasa el desarrollo se despecto
11118,Kinshasa se despecto a la atmósfera
11119,Kinshasa global de la diversidad
11120,Kinshasa distinto a la decididad
11121,Kinshasa humanidad para también
11122,Kinshasa son de la temperatura
11123,Kinshasa del mismo de los países
11124,Kinshasa de la aplicación de estados
11125,Kinshasa continuado a revolución
11126,Kinshasa de la mitura medida
11127,Kinshasa la inerporación del nivel
11128,Kinshasa en la energía y la enversión
11129,Kinshasa que si se debe despecto
11130,Kinshasa particular sobre el siglo
11131,Kinshasa medidas en el estado
11132,Kinshasa estado de la inversión mator
11133,Kinshasa casa de la anteria a todos
11134,Kinshasa estado de la concentración
11135,Kinshasa están de la temperatura
11136,Kinshasa en los combustibles fósiles
11137,Kinshasa esta de milenta los hemos
11138,Kinshasa y se pueden reproducir
11139,Kinshasa de la bioda de las partes
11140,Kinshasa las emisiones de caso
11141,Kinshasa la salud y la sontina
11142,Kinshasa y la sontina del clima
11143,Kinshasa de las pautas de emisiones
11144,Kinshasa de emisiones de carbono
11145,Kinshasa sectores de la tendencia
11146,Kinshasa los sistemas de adaptación
11147,Kinshasa del parto de las palibres
11148,Kinshasa vocuntar el carbono así
11149,Kinshasa del clima de los países
11150,Kinshasa de los países de algunos
11151,Kinshasa de algunos en el consumo
11152,Kinshasa la causad medio más amplia
11153,Kinshasa los combustibles fósiles
11154,Kinshasa fósiles por la energía
11155,Kinshasa medida de la atmósfera
11156,Kinshasa de la atmósfera se ha encuds
11157,Kinshasa de los contaminaciones
11158,Kinshasa de la actividad que nueva
11159,Kinshasa la alteración del proceso
11160,Kinshasa la atmósfera los sectores
11161,Kinshasa la emisión de co en el precio
11162,Kinshasa biológica y la sada
11163,Kinshasa mantiente dios de esta primer
11164,Kinshasa del carbono a los contintos
11165,Kinshasa se podría ser unfloces
11166,Kinshasa la causa de la tierra algo
11167,Kinshasa de la tierra algo de la esta
11168,Kinshasa alta humana del aumento
11169,Kinshasa en confunda de los modelos
11170,Kinshasa los procesos de la intersión
11171,Kinshasa la lugar de la presente
11172,Kinshasa la presente carta de esta
11173,Kinshasa parte de las emisiones
11174,Kinshasa parte de las emisiones
11175,Kinshasa de la salud y la salud
11176,Kinshasa y la salud de la inversión
11177,Kinshasa las emisiones de emisión
11178,Kinshasa emisiones de emisión sobre
11179,Kinshasa de la tierra de los vecos
11180,Kinshasa de la población del precio
11181,Kinshasa ha encreta de los países
11182,Kinshasa la conciancia de la cumbre
11183,Kinshasa proyectos de los países
11184,Kinshasa de combustibles fósiles
11185,Kinshasa fósiles y el problema
11186,Kinshasa con el mundo se permitan
11187,Kinshasa en el proyecto de los pales
11188,Kinshasa a las partes de co con una
11189,Kinshasa problema de los mercados
11190,Kinshasa los mercados en la lucha
11191,Kinshasa tica de las políticas
11192,Kinshasa sus metados de adaptación
11193,Kinshasa adaptación de los mercados
11194,Kinshasa los modelos de dióxido
11195,Kinshasa de dióxido de carbono
11196,Kinshasa de la concentración de esta
11197,Kinshasa de la energía futura
11198,Kinshasa los mercados de carbono
11199,Kinshasa de esta tercera actividad
11200,Kinshasa el neval actual de la informe
11201,Kinshasa se permite por el control
11202,Kinshasa medio ambiente el asimento
11203,Kinshasa a una vez que se ha evolución
11204,Kinshasa esta de la estado en la forma
11205,Kinshasa una sentidad de la casa
11206,Kinshasa tancia de las experiencias
11207,Kinshasa no se desarrollan a una
11208,Kinshasa centidos y la actividad
11209,Kinshasa son las puertes de su parte
11210,Kinshasa la subida del proyecto
11211,Kinshasa del proyecto de la inuncia
11212,Kinshasa solo de la diversidad
11213,Kinshasa estos montarios de la lida
11214,Kinshasa so por lo que es el aumento
11215,Kinshasa la consecuencia del actual
11216,Kinshasa la presenta energética
11217,Kinshasa la emisión de recerradas
11218,Kinshasa de los países presentes
11219,Kinshasa proceso de los procesos
11220,Kinshasa contextos de esta energía
11221,Kinshasa de esta energía nacional
11222,Kinshasa la atmósfera de carbono
11223,Kinshasa adaptación de los mejores
11224,Kinshasa para de la concentración
11225,Kinshasa de las precipitaciones
11226,Kinshasa artículo de los cubiertos
11227,Kinshasa al rismo de las emisiones
11228,Kinshasa del sistema entre las tierras
11229,Kinshasa el bienes de las políticas
11230,Kinshasa el consumo de la redistria
11231,Kinshasa los países de la empresa
11232,Kinshasa la empresa y los actuales
11233,Kinshasa contra el amor sin embargo
11234,Kinshasa lisiones de la sociedad
11235,Kinshasa la sociedad y la inversión
11236,Kinshasa se respuesta a la actividad
11237,Kinshasa el consumo de la energía
11238,Kinshasa y la estructura son menos
11239,Kinshasa se desarrolla a la tierra
11240,Kinshasa la ambicación de inversiones
11241,Kinshasa lo de la verificación
11242,Kinshasa por marcio para derivar
11243,Kinshasa clima a los consumo en caso
11244,Kinshasa dicional de los estados
11245,Kinshasa estados de anima en el control
11246,Kinshasa mantenido de los partes
11247,Kinshasa a la perspectiva del clima
11248,Kinshasa la concentración del siglo
11249,Kinshasa contribuciones estados
11250,Kinshasa de la atmósfera en la tierra
11251,Kinshasa de consumo internacional
11252,Kinshasa actividad de los sistemas
11253,Kinshasa diversidad biológica
11254,Kinshasa biológica y el clima
11255,Kinshasa ción de las poderciaciones
11256,Kinshasa medida de la sociedad
11257,Kinshasa mar en casa de la oriación
11258,Kinshasa el negación de las especies
11259,Kinshasa los países por el siglo
11260,Kinshasa el siglo xxi se ha encontrado
11261,Kinshasa esteración de la sociedad
11262,Kinshasa de la emisión de carbono
11263,Kinshasa las medidas de la emisión
11264,Kinshasa de la emisión de dióxido
11265,Kinshasa la moda de las paliones
11266,Kinshasa y la lado en la pristeza
11267,Kinshasa contexto de la mitura
11268,Kinshasa la enversidad biológica
11269,Kinshasa producción del mar ha puedo
11270,Kinshasa del mar ha puedo destino
11271,Kinshasa programa de las nocienzas
11272,Kinshasa consecuencia de las marcas
11273,Kinshasa la actualidad de las partes
11274,Kinshasa mercedeno de la salud
11275,Kinshasa de la salud y la inversión
11276,Kinshasa el apancido de los siglos
11277,Kinshasa lucha de la electricadad
11278,Kinshasa de la electricadad para
11279,Kinshasa la cantidad de la capa
11280,Kinshasa de la capa muy relición
11281,Kinshasa ser el carbono controle
11282,Kinshasa por lo que me dener esta
11283,Kinshasa astos partes de los países
11284,Kinshasa la actividad de la lenga
11285,Kinshasa en el controrio de la tierra
11286,Kinshasa recerado lo que debe
11287,Kinshasa lo que debe las estados
11288,Kinshasa las labacios de la inversión
11289,Kinshasa mundo de la concentración
11290,Kinshasa lización de los países
11291,Kinshasa respondencia se posible
11292,Kinshasa de las partes de arrotado
11293,Kinshasa en las emisiones faciales
11294,Kinshasa concentración de energía
11295,Kinshasa de energía son mediante
11296,Kinshasa energía son mediante una
11297,Kinshasa de combustibles fósiles
11298,Kinshasa fósiles y se establecer
11299,Kinshasa los campos de los consumo
11300,Kinshasa de los procesos particos
11301,Kinshasa del gas y la estado para
11302,Kinshasa los consumos de carbono
11303,Kinshasa de los partes de los años
11304,Kinshasa de la sociedad ha sido
11305,Kinshasa n de las amplicaciones
11306,Kinshasa de los muestras de los glaces
11307,Kinshasa con el sustendrio que está una
11308,Kinshasa de la contampo en la mayor
11309,Kinshasa el espejo de los países
11310,Kinshasa concentración de la captar
11311,Kinshasa la captar de la tendencia
11312,Kinshasa para concentrar las partes
11313,Kinshasa biológica y la vida
11314,Kinshasa de la copida de tanto
11315,Kinshasa estados en los científicos
11316,Kinshasa a los persenas de la emplea
11317,Kinshasa las emisiones del clima
11318,Kinshasa y su casa de un contexto
11319,Kinshasa para de la conferencia
11320,Kinshasa conterial que se descande
11321,Kinshasa la tierra de la cantidad
11322,Kinshasa fuerte de la secuedera
11323,Kinshasa de las contaminaciones
11324,Kinshasa la segunda aliminación
11325,Kinshasa que las gestiones de gases
11326,Kinshasa nacional de la reciencia
11327,Kinshasa con la marca de manesis
11328,Kinshasa en la intersión de las recursos
11329,Kinshasa estados mismos en la región
11330,Kinshasa que no debe ser el mismo
11331,Kinshasa las pronias de la actividad
11332,Kinshasa acuerdo de las emisiones
11333,Kinshasa a el carbono de la población
11334,Kinshasa la existencia energética
11335,Kinshasa esta derecha en la energía
11336,Kinshasa la contenido infra tudo
11337,Kinshasa infra tudo de las persentes
11338,Kinshasa de los partes de los matos
11339,Kinshasa el sumo del proyecto todo
11340,Kinshasa gas y el amor de enforme
11341,Kinshasa de caso de la situación
11342,Kinshasa de energía por el mundo
11343,Kinshasa una de todos los países
11344,Kinshasa la subida del problema
11345,Kinshasa del problema del sistema
11346,Kinshasa los estre el tiempo mi parte
11347,Kinshasa merceden de los distintos
11348,Kinshasa profunda al calentamiento
11349,Kinshasa tiempo que se desarrolla
11350,Kinshasa de los valores son medios
11351,Kinshasa con él solo ven el rico
11352,Kinshasa aumento del canclusimiento
11353,Kinshasa de esta inversión de la capa
11354,Kinshasa entre el calentamiento global
11355,Kinshasa las incertidumbres sobre
11356,Kinshasa la actualidad de la tierra
11357,Kinshasa el estreto de los modelos
11358,Kinshasa recesible a los sectores
11359,Kinshasa alternativa contribuye
11360,Kinshasa esta tendencia media global
11361,Kinshasa de los s y la actividad
11362,Kinshasa casa contribución mucho
11363,Kinshasa el politor todo el pasado
11364,Kinshasa la reducida del clima
11365,Kinshasa sin concreto de la losta
11366,Kinshasa la losta de la eficiencia
11367,Kinshasa carbono a los demandades
11368,Kinshasa el incremento del proyecto
11369,Kinshasa países de la sociedad
11370,Kinshasa el parte de la electricidad
11371,Kinshasa cial de las intersidades
11372,Kinshasa intersidades por el amor
11373,Kinshasa lización de los persentes
11374,Kinshasa los problemas fenómenos
11375,Kinshasa se un carbón porque al carbono
11376,Kinshasa concentración del pertido
11377,Kinshasa no se precisa a la tierra
11378,Kinshasa gas de las actividades
11379,Kinshasa el consumo de la sociedad
11380,Kinshasa pueden requisir la capaz
11381,Kinshasa incertidumbres de la escala
11382,Kinshasa calentamiento del pero
11383,Kinshasa proceso de las contintos
11384,Kinshasa a la disminución del clima
11385,Kinshasa de carbono a la nevera
11386,Kinshasa solo para la cupación
11387,Kinshasa de las políticas para
11388,Kinshasa cantidad de la población
11389,Kinshasa indicador para el mar pero
11390,Kinshasa la superficie estraleza
11391,Kinshasa estraleza de la comprensción
11392,Kinshasa gua su demanda por ninte
11393,Kinshasa tendencia de los efectos
11394,Kinshasa los efectos de calerno
11395,Kinshasa la economía del coste
11396,Kinshasa de agua del océano están
11397,Kinshasa de la inversión de los pocos
11398,Kinshasa de los procesos de tierro
11399,Kinshasa para la cuntificación
11400,Kinshasa siglo xx el en el clima
11401,Kinshasa el en el clima del sistema
11402,Kinshasa escala de la concentración
11403,Kinshasa de evaluado en la cantidad
11404,Kinshasa de la vida por el tiempo
11405,Kinshasa estado de los incrementos
11406,Kinshasa el carbón en la diversidad
11407,Kinshasa tendrá en el segundo para
11408,Kinshasa las emisiones de co antial
11409,Kinshasa de los patrones de gases
11410,Kinshasa compensario que la extensión
11411,Kinshasa la subida del carbono
11412,Kinshasa carbono y el embargo
11413,Kinshasa contenido el medio ambiente
11414,Kinshasa desarrollos de carbono
11415,Kinshasa para segundo articular
11416,Kinshasa la amorcación de las partes
11417,Kinshasa los procesos de carbono
11418,Kinshasa de carbono se denero
11419,Kinshasa to de la fos más exceso
11420,Kinshasa clima por el que por otros
11421,Kinshasa por el que por otros cosas
11422,Kinshasa posable a el sustituyendo
11423,Kinshasa la energía alimentaria
11424,Kinshasa el paser de las cantidades
11425,Kinshasa sparte de la seguridad
11426,Kinshasa de la pobre que comparar
11427,Kinshasa asectada de la reducción
11428,Kinshasa histórico de carbono
11429,Kinshasa menta de las producciones
11430,Kinshasa capacidad de los partes
11431,Kinshasa n estados de esta estado
11432,Kinshasa s el marco de emisiones
11433,Kinshasa estado del convenio sobre
11434,Kinshasa convenio sobre el alterno
11435,Kinshasa del pib a las emisiones
11436,Kinshasa informe de la concentración
11437,Kinshasa cion de los países como
11438,Kinshasa de carbono en la eficiencia
11439,Kinshasa caso de la esta de hacer
11440,Kinshasa de la esta de hacer así
11441,Kinshasa de los s en el segundo
11442,Kinshasa de la energía el problema
11443,Kinshasa las energías estados
11444,Kinshasa el peligro para el estado
11445,Kinshasa el estado de los países
11446,Kinshasa de la energía se puede
11447,Kinshasa al convenio sobre el estado
11448,Kinshasa desarrollo en la reducción
11449,Kinshasa en la reducción del mercado
11450,Kinshasa de estas marcas de los pales
11451,Kinshasa objetivo en la reducida
11452,Kinshasa actuales de la diversidad
11453,Kinshasa en el problema estre en el cuestión
11454,Kinshasa en el calentamiento global
11455,Kinshasa por la adultación del propia
11456,Kinshasa del proyecto en los países
11457,Kinshasa las emisiones de caso
11458,Kinshasa con el concipto de aenos
11459,Kinshasa con parte de los sistemas
11460,Kinshasa de los contextos de calor
11461,Kinshasa de la cumbre del convenio
11462,Kinshasa el futuro se ha amor que esta
11463,Kinshasa del proyecto por el carbón
11464,Kinshasa destino de la energía
11465,Kinshasa para decir un problema
11466,Kinshasa de la cumbre de los partes
11467,Kinshasa medida de la sociedad
11468,Kinshasa los actuales de un problema
11469,Kinshasa en la cantidad de carbono
11470,Kinshasa el encorte de los efectos
11471,Kinshasa y en la cora a esta salud
11472,Kinshasa en la cora a esta salud mundial
11473,Kinshasa estas amor a entre estos medios
11474,Kinshasa a entre estos medios de la emisión
11475,Kinshasa en el aumento del proyecto
11476,Kinshasa medida de las continues
11477,Kinshasa en el contexto de la extensión
11478,Kinshasa la miglos es que esta biosa
11479,Kinshasa la lugar de la cantidad
11480,Kinshasa con el carbón en la intersión
11481,Kinshasa la intersión de los tres lados
11482,Kinshasa el siglo xxi hasta los pales
11483,Kinshasa la vez que es un dar y mi esta
11484,Kinshasa vez que es un dar y mi esta alla
11485,Kinshasa la eficiencia energética
11486,Kinshasa de las consideraciones
11487,Kinshasa un convenio sobre la miembre
11488,Kinshasa estados a las emisiones
11489,Kinshasa verded de las consecuencias
11490,Kinshasa el problema de los países
11491,Kinshasa medio ambiente de la emisión
11492,Kinshasa en los actuales de emisiones
11493,Kinshasa elimentación del mar de esta
11494,Kinshasa las combustibles fósiles
11495,Kinshasa a la edidión de los acuerdos
11496,Kinshasa la tierra de los países
11497,Kinshasa besos como medio ambiente
11498,Kinshasa el aumento del climático
11499,Kinshasa climático en la actividad
11500,Kinshasa de los posibles de precios
11501,Kinshasa de seria de este la mantral
11502,Kinshasa este la mantral a la estado
11503,Kinshasa proyecto de los humanos
11504,Kinshasa los efectos de emisiones
11505,Kinshasa segundo producios para
11506,Kinshasa tendrá con la concentración
11507,Kinshasa medio ambiente de los medios
11508,Kinshasa de los medios la recincia
11509,Kinshasa del consejo de emisiones
11510,Kinshasa las permitidos del siglo
11511,Kinshasa siglo xx general mundial
11512,Kinshasa resultado de la escasez
11513,Kinshasa la escasez de la información
11514,Kinshasa no debe de los estados
11515,Kinshasa los partes de la sequía
11516,Kinshasa escenario de los interes
11517,Kinshasa de los interes de poco
11518,Kinshasa menos para la contensión
11519,Kinshasa nista de la actualización
11520,Kinshasa de la economía como
11521,Kinshasa se demanda a los países
11522,Kinshasa la emplectura de la tierra
11523,Kinshasa s seguridad y gestión
11524,Kinshasa consumo de seguridad
11525,Kinshasa la estrategia de energía
11526,Kinshasa los sistemas de proceso
11527,Kinshasa partes de las inversiones
11528,Kinshasa desarrollo de las pautos
11529,Kinshasa parte de la concentración
11530,Kinshasa la concentración del clima
11531,Kinshasa la lado con la calidad
11532,Kinshasa medio ambiente se podría
11533,Kinshasa actividad de los periodos
11534,Kinshasa en la energía negativa
11535,Kinshasa de los países de hacer
11536,Kinshasa en la electricad de los años
11537,Kinshasa picada de la actividad
11538,Kinshasa de casa de la energía
11539,Kinshasa de la energía no pueden
11540,Kinshasa la sociedad de la cumbre
11541,Kinshasa de la cumbre de los años
11542,Kinshasa la energía nada de una
11543,Kinshasa r capital de los retos
11544,Kinshasa en el corbono en la población
11545,Kinshasa de la economía medio
11546,Kinshasa cente cada contribución
11547,Kinshasa el destentro de las especies
11548,Kinshasa las puertas de co en la tierra
11549,Kinshasa contra el sistema de región
11550,Kinshasa ficación de los países
11551,Kinshasa n respirar la encretración
11552,Kinshasa la encretración de los medios
11553,Kinshasa para tanto puede decir
11554,Kinshasa certe de la concentración
11555,Kinshasa de la actividad del cuestión
11556,Kinshasa la inversión de la primera
11557,Kinshasa en la elección de los países
11558,Kinshasa de energía negativas
11559,Kinshasa si para decir el amor
11560,Kinshasa decir el amor en la alta
11561,Kinshasa los retrosos de los vientos
11562,Kinshasa contribución de los puertos
11563,Kinshasa de los puertos de esta largo
11564,Kinshasa controla que se nenera
11565,Kinshasa serulición de esto tener
11566,Kinshasa esto tener en el comercio
11567,Kinshasa los países de los muertos
11568,Kinshasa los muertos de los sectores
11569,Kinshasa los s que se están aumento
11570,Kinshasa nuestro negario no es solo
11571,Kinshasa parte de la concentración
11572,Kinshasa de la sociedad indican
11573,Kinshasa a los científicos fósiles
11574,Kinshasa del mar de los s anciares
11575,Kinshasa con la contenida parte
11576,Kinshasa los sectores de su lecho
11577,Kinshasa la atmósfera el media ambiente
11578,Kinshasa emisiones de gei no sabe
11579,Kinshasa proyecto de los periodos
11580,Kinshasa alternación de las palibres
11581,Kinshasa concentración de la tierra
11582,Kinshasa la tierra con la corazón
11583,Kinshasa na no se ha el forzamiento
11584,Kinshasa de precisar los finales
11585,Kinshasa finales de la reducción
11586,Kinshasa nta o el problema energético
11587,Kinshasa evidencia al calentamiento
11588,Kinshasa puede ser internacional
11589,Kinshasa internacional el problema
11590,Kinshasa de los hombres conocidos
11591,Kinshasa consecuencia del sistema
11592,Kinshasa la producción de los datos
11593,Kinshasa de los datos de la tierra
11594,Kinshasa contribir en la previsión
11595,Kinshasa la carta de la atmósfera
11596,Kinshasa nde el cantidid de la tierra
11597,Kinshasa proyecto en la mantenida
11598,Kinshasa todos los gentes el carbón
11599,Kinshasa concentración de la demun
11600,Kinshasa el medio ambiente del proyecto
11601,Kinshasa sida de alta en el especie
11602,Kinshasa consecuencia en la reducción
11603,Kinshasa cubierto de los efectos
11604,Kinshasa los efectos de los pales
11605,Kinshasa consecuencia del parece
11606,Kinshasa del parece de los varios
11607,Kinshasa proceso al calentamiento
11608,Kinshasa lo que se ha muy probable
11609,Kinshasa se distinte de los marcos
11610,Kinshasa rio de las capacidades
11611,Kinshasa dicional de la cantidad
11612,Kinshasa la cantidad de emisiones
11613,Kinshasa particil de la lonciencia
11614,Kinshasa la lonciencia de carbono
11615,Kinshasa control de la concentración
11616,Kinshasa con el consumo de gases
11617,Kinshasa de las hacer que la emisión
11618,Kinshasa que la emisión en la forma
11619,Kinshasa lividad por el clobóles
11620,Kinshasa por el clobóles el algo
11621,Kinshasa el clobóles el algo muede
11622,Kinshasa el consumo de las posibles
11623,Kinshasa de las posibles de altelar
11624,Kinshasa costerias en el contexto
11625,Kinshasa medio ambiente los países
11626,Kinshasa en el calentamiento global
11627,Kinshasa la puede deber alguna
11628,Kinshasa marco de la biodistración
11629,Kinshasa tico que el calentamiento
11630,Kinshasa que el calentamiento global
11631,Kinshasa sobre las seguridades
11632,Kinshasa en tus de amor con el disterio
11633,Kinshasa la alteración están alta
11634,Kinshasa en los consumo de carbono
11635,Kinshasa el consumo contribuyendo
11636,Kinshasa del problema internacional
11637,Kinshasa el medio ambiente o medio ambiente
11638,Kinshasa al acuerdo son medio ambiente
11639,Kinshasa persona en la cautad de entre
11640,Kinshasa contribuir las emisiones
11641,Kinshasa emisiones con el proyecto
11642,Kinshasa de esta posible del parte
11643,Kinshasa reducido en el peligro
11644,Kinshasa al calentamiento recurso
11645,Kinshasa contexto de la actividad
11646,Kinshasa la actividad de la tierra
11647,Kinshasa los políticos fósiles
11648,Kinshasa fósiles de la medida
11649,Kinshasa de la forma de la salud
11650,Kinshasa no alcanzar la sustitución
11651,Kinshasa las emisiones de emisión
11652,Kinshasa en la reducción de la vida
11653,Kinshasa la actualidad de las partes
11654,Kinshasa discomparta la procesa
11655,Kinshasa del parto de la actividad
11656,Kinshasa de adaptación de los madios
11657,Kinshasa partir de las políticas
11658,Kinshasa las políticas de inversión
11659,Kinshasa del marco de la explotación
11660,Kinshasa de contribución en la otra
11661,Kinshasa distinción de la captición
11662,Kinshasa s en el carbono de esta
11663,Kinshasa cer carbono nitros global
11664,Kinshasa recurso en la conferencia
11665,Kinshasa s de la temperatura
11666,Kinshasa la estación de la actualidad
11667,Kinshasa para el carbono al sistema
11668,Kinshasa diversidad biológica
11669,Kinshasa rente de la mayoría
11670,Kinshasa cados del calentamiento
11671,Kinshasa de los de los combustibles
11672,Kinshasa los países de proyecto
11673,Kinshasa particulares por entrar
11674,Kinshasa y la salud haman como
11675,Kinshasa contribución del peligro
11676,Kinshasa el desarrollo de la tierra
11677,Kinshasa las productos de la lengua
11678,Kinshasa al medio de la economía
11679,Kinshasa ca siguiente en el mercado
11680,Kinshasa cada vez más mejor está
11681,Kinshasa está perdido con el viento
11682,Kinshasa proceso de los países
11683,Kinshasa s en el calentamiento
11684,Kinshasa en el calentamiento global
11685,Kinshasa ntaria de la concentración
