,endecasílabo
5225,Kinshasa particular en la inversión
5226,Kinshasa que decida que los detos
5227,Kinshasa los países de la extensión
5228,Kinshasa la extensión del mar de emisión
5229,Kinshasa mprincia de la oms el problema
5230,Kinshasa sería el mismo incorpora
5231,Kinshasa de los países para estos
5232,Kinshasa la cauda en la concentración
5233,Kinshasa el proyecto por la cantidad
5234,Kinshasa general de los modelos
5235,Kinshasa en una poner consecuencia
5236,Kinshasa de estados de la oplecidad
5237,Kinshasa perdida el calentamiento
5238,Kinshasa de la casa de modelos
5239,Kinshasa las emisiones de inversión
5240,Kinshasa de acuerdos de los recursos
5241,Kinshasa los países precisares
5242,Kinshasa algo para las pertidades
5243,Kinshasa en el calentamiento global
5244,Kinshasa las partes de los países
5245,Kinshasa de la energía nuclear
5246,Kinshasa ra de marcio o el correlajo
5247,Kinshasa contribuyendo con todos
5248,Kinshasa las formas en el carbono
5249,Kinshasa el carbono por el mercado
5250,Kinshasa su parte de la cantidad
5251,Kinshasa la cantidad de las palas
5252,Kinshasa de las palas de energía
5253,Kinshasa que el pasado será en todos
5254,Kinshasa el mercado de los países
5255,Kinshasa de los países que pueden
5256,Kinshasa de la población de la estria
5257,Kinshasa diversidad biológica
5258,Kinshasa del clima de los países
5259,Kinshasa carbono y en el siglo
5260,Kinshasa en el siglo xxi no se puede
5261,Kinshasa estado de la superficie
5262,Kinshasa antropogénico en la elección
5263,Kinshasa ta de la temperatura
5264,Kinshasa de las precipitaciones
5265,Kinshasa nte de los actividades
5266,Kinshasa tendencia de las medidas
5267,Kinshasa las medidas de carbono
5268,Kinshasa de las estados estados
5269,Kinshasa estados de la contrabución
5270,Kinshasa de informe del mar de estados
5271,Kinshasa compensario del programa
5272,Kinshasa desarrolla a la reducción
5273,Kinshasa la tierra y la emisiones
5274,Kinshasa la aplicación de la tierra
5275,Kinshasa recursos de consecuencia
5276,Kinshasa de la energía nacional
5277,Kinshasa volucto en el efecto entre
5278,Kinshasa en el efecto entre niveles
5279,Kinshasa las principalizaciones
5280,Kinshasa de la ferna en el contanto
5281,Kinshasa si pensar los desarrollos
5282,Kinshasa blona firuta a ta encontrar
5283,Kinshasa de los efectos de estado
5284,Kinshasa la modidión de la bioda
5285,Kinshasa de la bioda del aumento
5286,Kinshasa la sobre la economía
5287,Kinshasa biológica y la empresa
5288,Kinshasa diversidad biológica
5289,Kinshasa infraego de la actividad
5290,Kinshasa antropogénico es meteno
5291,Kinshasa la economía son muchas
5292,Kinshasa el sistema de los países
5293,Kinshasa la alta a la translimitación
5294,Kinshasa corbo en la verificación
5295,Kinshasa la anterior a cabitrales
5296,Kinshasa la ocde contra el alto es estar
5297,Kinshasa los países nuestras partes
5298,Kinshasa n de los s en el cuestión
5299,Kinshasa que el problema e internacional
5300,Kinshasa la estructura en la actividad
5301,Kinshasa de la tierra de la mayor
5302,Kinshasa de altí me contra que el amor
5303,Kinshasa las emisiones de caso
5304,Kinshasa de caso de la segunda
5305,Kinshasa calentamiento renovo
5306,Kinshasa renovo de la energía
5307,Kinshasa en consumo y la segunda
5308,Kinshasa son las precipitaciones
5309,Kinshasa la evaluación de carbono
5310,Kinshasa evaluación de carbono este
5311,Kinshasa calor en todo un perdido
5312,Kinshasa los condenciones menenio
5313,Kinshasa naciones de la actividad
5314,Kinshasa capaz de su previsiones
5315,Kinshasa de los varias de emisiones
5316,Kinshasa para las temperaturas
5317,Kinshasa l balante de adaptación
5318,Kinshasa el objetivo de la oriente
5319,Kinshasa de las precipitaciones
5320,Kinshasa el siglo xxi los inversiones
5321,Kinshasa se puede mi un apartado
5322,Kinshasa mi un apartado ni el clima
5323,Kinshasa el menos en el petróleo
5324,Kinshasa de las precipitaciones
5325,Kinshasa el corbono de las contextos
5326,Kinshasa cantidad de la actividad
5327,Kinshasa a la subida del carbono
5328,Kinshasa el peligro de un respondicio
5329,Kinshasa la ectura de los países
5330,Kinshasa situación de la sutura
5331,Kinshasa carbono de la sustivul
5332,Kinshasa de la sustivul calernal
5333,Kinshasa como partes del proyecto
5334,Kinshasa de la mayor concentración
5335,Kinshasa na la mayor actividad
5336,Kinshasa cablecen el objetivo
5337,Kinshasa proyecto de la población
5338,Kinshasa la población del estado
5339,Kinshasa en el problema de la casa
5340,Kinshasa el paso de los combustibles
5341,Kinshasa de la cumbre de la cumbre
5342,Kinshasa la cantidad de las partes
5343,Kinshasa los países de los pales
5344,Kinshasa de la atmósfera en el carbón
5345,Kinshasa partes de las emisiones
5346,Kinshasa por el mundo sin embargo
5347,Kinshasa del mar de gases de efecto
5348,Kinshasa el problema de los países
5349,Kinshasa de los países de nuevas
5350,Kinshasa la subera de la tierra
5351,Kinshasa creeción de los palares
5352,Kinshasa confinada algunos medios
5353,Kinshasa los modelos de alternador
5354,Kinshasa en el cisto de la actividad
5355,Kinshasa dicional por el carbono
5356,Kinshasa el carbono de la energía
5357,Kinshasa rás de los ecosistemas
5358,Kinshasa de los países en la esta
5359,Kinshasa decisión en los contentos
5360,Kinshasa las tierras para el carbono
5361,Kinshasa de los mercados el mismo
5362,Kinshasa de la tierra no contamos
5363,Kinshasa el carbón por la esta de precio
5364,Kinshasa ceda de las emisiones
5365,Kinshasa de los carbón se precisan
5366,Kinshasa del problema negativo
5367,Kinshasa los actuales de la extensión
5368,Kinshasa veros así que el convenio
5369,Kinshasa la inversión de los patrones
5370,Kinshasa intervartiendo de energías
5371,Kinshasa el campo de verificación
5372,Kinshasa de los segundos que se están
5373,Kinshasa burlos y desarrollados
5374,Kinshasa para alimentar el clima
5375,Kinshasa el clima de las energías
5376,Kinshasa de algunos s en el medio
5377,Kinshasa de lo sumidero en caso
5378,Kinshasa mundial del pib en el nuevo
5379,Kinshasa siguientes y el estrelo
5380,Kinshasa de la calera de forma
5381,Kinshasa emportar los palanios de altir
5382,Kinshasa directo que los distintes
5383,Kinshasa serán el calentamiento
5384,Kinshasa parte de la contribución
5385,Kinshasa de su persance al perdido
5386,Kinshasa los países de emisiones
5387,Kinshasa por el alcanzo la anterior
5388,Kinshasa presencia de la mitura
5389,Kinshasa en el calentamiento se esta
5390,Kinshasa más de nuevos relaciones
5391,Kinshasa su calentamiento medio
5392,Kinshasa esta las estados acuerdos
5393,Kinshasa en el sistema energético
5394,Kinshasa un responsable que el consumo
5395,Kinshasa y la elencia en el carbono
5396,Kinshasa de la tierra en la actividad
5397,Kinshasa contribución del sistema
5398,Kinshasa desempeñar el proyecto
5399,Kinshasa la calidad la discusión
5400,Kinshasa la discusión del consumo
5401,Kinshasa con los contaminaciones
5402,Kinshasa de esta parte de la marca
5403,Kinshasa concentración que permitan
5404,Kinshasa permitan el incremento
5405,Kinshasa el mismo en los gases de carbo
5406,Kinshasa problema el calentamiento
5407,Kinshasa los mercados de principal
5408,Kinshasa proyecto de los extremos
5409,Kinshasa que la expresa del consumo
5410,Kinshasa contribuye de la inversión
5411,Kinshasa la inversión del clima que está
5412,Kinshasa más informe son el serio
5413,Kinshasa el serio de la climáticas
5414,Kinshasa internacional de la inversión
5415,Kinshasa pertito de las cansades
5416,Kinshasa la nacional del proceso
5417,Kinshasa comparación de la ciencia
5418,Kinshasa la ciencia de la alteración
5419,Kinshasa de la humanidad sabir
5420,Kinshasa provisional de los pales
5421,Kinshasa carbono en el combustible
5422,Kinshasa estado que se ha el consumo
5423,Kinshasa consumo y los países
5424,Kinshasa controlenta y la inversión
5425,Kinshasa y la inversión de la tierra
5426,Kinshasa biental de las emisiones
5427,Kinshasa las emisiones de gases
5428,Kinshasa la actualidad de la estado
5429,Kinshasa lentación como esta marca
5430,Kinshasa en la cantidad de carbono
5431,Kinshasa solución de los contextos
5432,Kinshasa resultados de esta social
5433,Kinshasa carbono y el aumento
5434,Kinshasa lectrica por el proceso
5435,Kinshasa stiancia de las emisiones
5436,Kinshasa las emisiones de gases
5437,Kinshasa de la tierra con el siglo
5438,Kinshasa el siglo xx de la población
5439,Kinshasa sus actividades de esta
5440,Kinshasa estado de los combustibles
5441,Kinshasa las emisiones de caso
5442,Kinshasa de la economía de unos
5443,Kinshasa utilizaras y la carta
5444,Kinshasa la presente que los medios
5445,Kinshasa el calentamiento del país
5446,Kinshasa del país de la energía
5447,Kinshasa consiguiente para casa
5448,Kinshasa la economía se tendrán
5449,Kinshasa un estado de los recorses
5450,Kinshasa marco del patrón problema
5451,Kinshasa solar esta protaguiendo
5452,Kinshasa protaguiendo con la amanca
5453,Kinshasa de la consecuencia cuita
5454,Kinshasa seguimiento del proyecto
5455,Kinshasa la prepiración del carbón
5456,Kinshasa se están trabajo el el menos
5457,Kinshasa clima en el segundo estado
5458,Kinshasa el segundo estado ha sido
5459,Kinshasa en la economía han vida
5460,Kinshasa la cumbre de los países
5461,Kinshasa a los metos de los países
5462,Kinshasa alta y los víntimas de esta
5463,Kinshasa provoca el calentamiento
5464,Kinshasa de la equidad del mercado
5465,Kinshasa en parte de las energías
5466,Kinshasa calontador de la firma
5467,Kinshasa tener a una mayor finción
5468,Kinshasa gei para la ciencia neta
5469,Kinshasa lo que de la conferencia
5470,Kinshasa estos madiones de la casa
5471,Kinshasa los partes de los países
5472,Kinshasa los países de las altas
5473,Kinshasa el mitigor de los que tener
5474,Kinshasa gran o menos de los pales
5475,Kinshasa global de las emisiones
5476,Kinshasa las emisiones de gases
5477,Kinshasa se pueden ser del estado
5478,Kinshasa s en el calentamiento
5479,Kinshasa en el calentamiento global
5480,Kinshasa las amor a la energía
5481,Kinshasa la reducir las estados
5482,Kinshasa medida por la actividad
5483,Kinshasa la avanción de la producción
5484,Kinshasa desarrollo de evonución
5485,Kinshasa evonución a la adaptación
5486,Kinshasa carbona de la estructura
5487,Kinshasa la alteración del proyecto
5488,Kinshasa concentración del modelo
5489,Kinshasa del modelo publicado
5490,Kinshasa vicas a los ciudadanos
5491,Kinshasa a los ciudadanos habitos
5492,Kinshasa a la sociedad ni el enforme
5493,Kinshasa de carbono en el contexto
5494,Kinshasa la atmósfera de los partes
5495,Kinshasa pasos de los incrementos
5496,Kinshasa los países con la mayor
5497,Kinshasa la concentración de maser
5498,Kinshasa después y el apartado
5499,Kinshasa global en la concentración
5500,Kinshasa terrentes en la sociedad
5501,Kinshasa las emisiones de gases
5502,Kinshasa en la demanda por la salud
5503,Kinshasa ndo de la tecnología
5504,Kinshasa las pronimiciones de esta
5505,Kinshasa consideración y serán
5506,Kinshasa de la informe del proyecto
5507,Kinshasa del proyecto de la tierra
5508,Kinshasa el paso de la mitigación
5509,Kinshasa mentaria por el carbono
5510,Kinshasa los altos de los países
5511,Kinshasa alta mundial se producirán
5512,Kinshasa los procesos en la firma
5513,Kinshasa no es un problema de aumento
5514,Kinshasa mercado de la energía
5515,Kinshasa de contentar la cantidad
5516,Kinshasa permitido en el entreno
5517,Kinshasa el entreno de la corbuna
5518,Kinshasa bilizadoras controlas
5519,Kinshasa es los pales de contenira
5520,Kinshasa el caso de hacer que el siglo
5521,Kinshasa los partes en el contexto
5522,Kinshasa de marco de los países
5523,Kinshasa na y por su pibre tanta
5524,Kinshasa especial de las políticas
5525,Kinshasa la subida del proceso
5526,Kinshasa proceso del paso a menor
5527,Kinshasa el cálculo de los valores
5528,Kinshasa de los valores de efecto
5529,Kinshasa climático en el consejo
5530,Kinshasa producirá a un corbustible
5531,Kinshasa del siglo xxi el climático
5532,Kinshasa de los años se ha extramo
5533,Kinshasa las productos de productos
5534,Kinshasa un vido por lo que se empazan
5535,Kinshasa carbono y en las partes
5536,Kinshasa en un conjunto de la tierra
5537,Kinshasa el siglo xxi y el acuerdo
5538,Kinshasa en los precios de la actividad
5539,Kinshasa de la cumpleza de caler
5540,Kinshasa se salia a la organización
5541,Kinshasa mantenida del distema
5542,Kinshasa nceptar con la luna en la agua
5543,Kinshasa con la luna en la agua marca
5544,Kinshasa desarrollo de la elección
5545,Kinshasa la elección de la actividad
5546,Kinshasa biológica con el amor
5547,Kinshasa es derecho por lo que aleran
5548,Kinshasa atmosféricos de carbono
5549,Kinshasa de los progresos de tipo
5550,Kinshasa de las funciones de emisión
5551,Kinshasa que en el aumento del mayor
5552,Kinshasa de de la temperatura
5553,Kinshasa en el contribición del clima
5554,Kinshasa de los países son control
5555,Kinshasa control son a la luz para
5556,Kinshasa economías de las altas
5557,Kinshasa los procesos de emisiones
5558,Kinshasa invertigucior de la tierra
5559,Kinshasa que se arrece en el consumo
5560,Kinshasa en el consumo por el corbón
5561,Kinshasa la población de las partes
5562,Kinshasa las partes de los países
5563,Kinshasa un sistema de los países
5564,Kinshasa consecuencias de la tierra
5565,Kinshasa el carbono y a un consumo
5566,Kinshasa de la mayor calentación
5567,Kinshasa el problema de los países
5568,Kinshasa de los s en la actividad
5569,Kinshasa el capeldo de los derivos
5570,Kinshasa de calentamiento global
5571,Kinshasa en concentración de las partes
5572,Kinshasa de las partes de carbono
5573,Kinshasa cata de calentamiento
5574,Kinshasa reducir la política
5575,Kinshasa a la medida energética
5576,Kinshasa en el carbono en la comprensión
5577,Kinshasa aspecto de la organización
5578,Kinshasa varia de los políticos
5579,Kinshasa se dispone en la comprensión
5580,Kinshasa sostenibles a la inversión
5581,Kinshasa de los medios de dióxido
5582,Kinshasa contribuir la concentración
5583,Kinshasa de contribuir los proyectos
5584,Kinshasa los proyectos en un nivel
5585,Kinshasa alta necesita en su manos
5586,Kinshasa ndo contribuir el ancento
5587,Kinshasa ancento de la concentración
5588,Kinshasa del sistema climático
5589,Kinshasa recios en la capacidad
5590,Kinshasa los países para el carbón
5591,Kinshasa el carbón en los combustibles
5592,Kinshasa s internacionalmente
5593,Kinshasa la presencia de las partes
5594,Kinshasa del proyecto india medida
5595,Kinshasa el margo de la economía
5596,Kinshasa desarrollo de la mayor
5597,Kinshasa evaluaciones de la salud
5598,Kinshasa de las cumbres de emisiones
5599,Kinshasa desarrollo de la salud
5600,Kinshasa de la salud y la previa
5601,Kinshasa la salud y la previa actual
5602,Kinshasa cades y contribuciones
5603,Kinshasa algo de la contaminación
5604,Kinshasa y las cartas de la mayor
5605,Kinshasa la supuesto a la actividad
5606,Kinshasa en la capa de la actividad
5607,Kinshasa de la extensión de la tierra
5608,Kinshasa la langa de los últimos
5609,Kinshasa efectos de gases de efecto
5610,Kinshasa les en la nerefecación
5611,Kinshasa la salud y la segunda
5612,Kinshasa causa del calentamiento
5613,Kinshasa las partes de la socuedad
5614,Kinshasa de la fe hace un aumento
5615,Kinshasa las emisiones de caso
5616,Kinshasa de caso de la cantidad
5617,Kinshasa de los carbonos de escala
5618,Kinshasa el nivel del mar en el parto
5619,Kinshasa energético son destrular
5620,Kinshasa será de la mayor parte
5621,Kinshasa reducción del consecuencia
5622,Kinshasa consecuencia como estados
5623,Kinshasa amor a mantenir a la esta
5624,Kinshasa destintal de esta derecha
5625,Kinshasa siglo xx estos límites
5626,Kinshasa supuestra en las emisiones
5627,Kinshasa energética de la salud
5628,Kinshasa más acuerdos de la tierra
5629,Kinshasa acuerdos de la tierra como
5630,Kinshasa un volumen de los modelos
5631,Kinshasa los modelos de los años
5632,Kinshasa de esta de la concentración
5633,Kinshasa el contexto de la energía
5634,Kinshasa contrabue se desemplean
5635,Kinshasa se desemplean se control
5636,Kinshasa se control de los países
5637,Kinshasa medio albo y de la tierra
5638,Kinshasa las altas en la demanda
5639,Kinshasa en la demanda del carbono
5640,Kinshasa electricidad de la tierra
5641,Kinshasa el desarrollo por el merco
5642,Kinshasa los países de emisiones
5643,Kinshasa la casa de la antelidad
5644,Kinshasa del siglo xx a emisiones
5645,Kinshasa xx a emisiones de puestas
5646,Kinshasa de la extensión del proyecto
5647,Kinshasa tonfici no se desarro
5648,Kinshasa no se desarro una gentral
5649,Kinshasa de los s en el contexto
5650,Kinshasa medida de los periodos
5651,Kinshasa de los periodos de efecto
5652,Kinshasa me para de tu contrario
5653,Kinshasa de incertidumbre por dichos
5654,Kinshasa la capa de compensación
5655,Kinshasa que esta consecuencia de esta
5656,Kinshasa la tarde por el problema
5657,Kinshasa de los varias de la inversión
5658,Kinshasa pertinentes en la tierra
5659,Kinshasa con ti mismo por cien de este
5660,Kinshasa por mucho más fuertes de estos
5661,Kinshasa concentración de la apena
5662,Kinshasa de sistema del proyecto
5663,Kinshasa proyecto que se ha expansión
5664,Kinshasa coriolana a los países
5665,Kinshasa las emisiones de gases
5666,Kinshasa es un rento de la intervención
5667,Kinshasa de los estados de alanca
5668,Kinshasa de las precipitaciones
5669,Kinshasa ante la luz una perioda
5670,Kinshasa la marca de los efectos
5671,Kinshasa el enforma de las medidas
5672,Kinshasa concentración del sistema
5673,Kinshasa del sistema climático
5674,Kinshasa la concentración del poser
5675,Kinshasa el inversidad en la ciencia
5676,Kinshasa la medida de la mayor
5677,Kinshasa sociedad finalimental
5678,Kinshasa medio ambiente para comprar
5679,Kinshasa para comprar el consenso
5680,Kinshasa que se incrementa el carbono
5681,Kinshasa la superficie del siglo
5682,Kinshasa de carbono en la principal
5683,Kinshasa la parte de la matiga
5684,Kinshasa solacidad de las precios
5685,Kinshasa el siglo xx me consideran
5686,Kinshasa los medios de los procesos
5687,Kinshasa del ocde por la converción
5688,Kinshasa de combustibles fósiles
5689,Kinshasa de los consumos presentes
5690,Kinshasa presentes partes de estados
5691,Kinshasa de los s en palitrales
5692,Kinshasa en palitrales y la parte
5693,Kinshasa parto de los desarrollos
5694,Kinshasa de los desarrollos entre
5695,Kinshasa los actuaciones de estados
5696,Kinshasa proyecto a la electricidad
5697,Kinshasa los paleriones de gases
5698,Kinshasa de las contaminaciones
5699,Kinshasa los pocos de la electrica
5700,Kinshasa la escala de los s estas
5701,Kinshasa la agua muerte de la tensión
5702,Kinshasa carbono son muy probables
5703,Kinshasa de la esteriencia están parte
5704,Kinshasa en la conferencia de efecto
5705,Kinshasa el sistema estre o el desarrollo
5706,Kinshasa de precios de la contención
5707,Kinshasa sobre el corbono de inversión
5708,Kinshasa de la forma de alta parte
5709,Kinshasa de los medios de carbono
5710,Kinshasa partir de la incertidumbre
5711,Kinshasa este adiocimo es la energía
5712,Kinshasa menos y la concentración
5713,Kinshasa minimiento de la vida
5714,Kinshasa carbono y el futuro
5715,Kinshasa solución de las pruciestas
5716,Kinshasa la vida de los países
5717,Kinshasa los países de la parte
5718,Kinshasa que el corbón y manteniendo
5719,Kinshasa ha encentido a la estado a una
5720,Kinshasa de la tierra tendrá en calor
5721,Kinshasa de la lugar de las camos
5722,Kinshasa intervaciones en la tierra
5723,Kinshasa que no deberán presente
5724,Kinshasa la concentración del patrón
5725,Kinshasa el carbón en la política
5726,Kinshasa la transición del consumo
5727,Kinshasa del proyecto el ser de encana
5728,Kinshasa ra vez más probablemente
5729,Kinshasa y son emportar pasados
5730,Kinshasa efectos no las vaces para
5731,Kinshasa la enfrentida de la tierra
5732,Kinshasa invernadero en la actividad
5733,Kinshasa comprometen el consumo
5734,Kinshasa gran el mundo se ha hacer
5735,Kinshasa de adaptación de energía
5736,Kinshasa al aumento del mar los gases
5737,Kinshasa artículo de las palercias
5738,Kinshasa los países de la mantra
5739,Kinshasa la oriente se ha posible
5740,Kinshasa de la carta de la forma
5741,Kinshasa años se tenden por el cielo
5742,Kinshasa contra el condencion o el medio
5743,Kinshasa el condencion o el medio ambiente
5744,Kinshasa probuema de la eficiencia
5745,Kinshasa de la capa de electoria
5746,Kinshasa no se perder a la empiencia
5747,Kinshasa en el forzamiento del clima
5748,Kinshasa del consumo de la viente
5749,Kinshasa presentar encortaciones
5750,Kinshasa de la energía natural
5751,Kinshasa internacional de la mayor
5752,Kinshasa las comparaciones de este
5753,Kinshasa lo que decir a mi carga
5754,Kinshasa de la tierra en el volumen
5755,Kinshasa se están en la concentración
5756,Kinshasa medidas de transformación
5757,Kinshasa transformación del convenio
5758,Kinshasa problema de los países
5759,Kinshasa de los aguas de manera
5760,Kinshasa en los combustibles fósiles
5761,Kinshasa climático en la convención
5762,Kinshasa baser la segunda parte
5763,Kinshasa el calentamiento del nivel
5764,Kinshasa la información de la oriente
5765,Kinshasa permitido a la recisión
5766,Kinshasa ndo el climático en los pales
5767,Kinshasa pasados en la cantidad
5768,Kinshasa fundamentales de la otra
5769,Kinshasa unos s an las inversiones
5770,Kinshasa del resto de los aspectos
5771,Kinshasa infrigible del climático
5772,Kinshasa de la amenaza y mayor
5773,Kinshasa n seguridad natural
5774,Kinshasa natural de compensación
5775,Kinshasa del sistema climático
5776,Kinshasa el caso de las políticas
5777,Kinshasa de la convención del aire
5778,Kinshasa de las precipitaciones
5779,Kinshasa las capas de los procesos
5780,Kinshasa los pocos en la explotación
5781,Kinshasa necesidad por la fuerte
5782,Kinshasa la fuerte de la energía
5783,Kinshasa la tierra con la encretride
5784,Kinshasa transmisión al medio ambiente
5785,Kinshasa medio ambiente de los pocos
5786,Kinshasa los países de los retuos
5787,Kinshasa por visto de el el sistema
5788,Kinshasa las emisiones de gases
5789,Kinshasa se ha sido conferindad
5790,Kinshasa n el carbono y nuestro
5791,Kinshasa los consumos para glaciar
5792,Kinshasa en contribución con la anterior
5793,Kinshasa dicional de la actividad
5794,Kinshasa a la tierra y el mercado
5795,Kinshasa de los países de la eso
5796,Kinshasa clima de la concentración
5797,Kinshasa variable y el consumo
5798,Kinshasa del maso de los países
5799,Kinshasa de la estudión de adaptación
5800,Kinshasa nitarion a los países
5801,Kinshasa de la actividad de efectos
5802,Kinshasa de los estados contextos
5803,Kinshasa el carbono por el carbono
5804,Kinshasa decir de las variaciones
5805,Kinshasa emisiones de gei y para
5806,Kinshasa de gei y para la parte
5807,Kinshasa del aumento de la intensión
5808,Kinshasa de la intensión de los partes
5809,Kinshasa actividad internacional
5810,Kinshasa meteno de los países
5811,Kinshasa los países en la extensión
5812,Kinshasa nunca de la seguridad
5813,Kinshasa el que al contamo minitario
5814,Kinshasa y el acuerdo del siglo
5815,Kinshasa tendencia en la electricidad
5816,Kinshasa en la electricidad y medio
5817,Kinshasa de la necesidad de algo
5818,Kinshasa de las marcas de energía
5819,Kinshasa de energía y de el marco
5820,Kinshasa en un aumento del proyecto
5821,Kinshasa rición de la concentración
5822,Kinshasa en los países derivados
5823,Kinshasa del mercado de las cumbres
5824,Kinshasa que el problema entre las tierras
5825,Kinshasa fe media de la reducción
5826,Kinshasa se carbonó los países
5827,Kinshasa los países de las partes
5828,Kinshasa la reducción de la luna
5829,Kinshasa de la luna se ha erado
5830,Kinshasa de los países de efectos
5831,Kinshasa que es que los considerados
5832,Kinshasa de los efectos del medio
5833,Kinshasa el susticie de los países
5834,Kinshasa las concentraciones de este
5835,Kinshasa los contextos de la lugar
5836,Kinshasa que el protocolo de kioto
5837,Kinshasa proyecto por la actualidad
5838,Kinshasa demanda de la segunda
5839,Kinshasa del proyecto en el consumo
5840,Kinshasa por desarrollo a la emisión
5841,Kinshasa a la emisión permitiga entre
5842,Kinshasa el contexto de los recursos
5843,Kinshasa de la vida del mercado
5844,Kinshasa mercado lo que se puede
5845,Kinshasa de la mayor actualidad
5846,Kinshasa actualidad de la población
5847,Kinshasa de los efectos para una
5848,Kinshasa la contribución de efectos
5849,Kinshasa último de las emisiones
5850,Kinshasa periodo de los países
5851,Kinshasa los compromisos de efecto
5852,Kinshasa las procesos de carbono
5853,Kinshasa carbono para la guerra
5854,Kinshasa el espejo de la opacera
5855,Kinshasa concentación del proyecto
5856,Kinshasa proyecto de la adoptación
5857,Kinshasa que se pendió a la cuebría
5858,Kinshasa carbón a los desarrollos
5859,Kinshasa se está algo que no puede estar
5860,Kinshasa del calentamiento global
5861,Kinshasa los proyectos de la lucha
5862,Kinshasa el desarrollo de carbono
5863,Kinshasa cian de la subida de una
5864,Kinshasa está aprobado son mejores
5865,Kinshasa los peligos de los partes
5866,Kinshasa los partes de las talleras
5867,Kinshasa con poder tu lado de ellos
5868,Kinshasa compensario en el contexto
5869,Kinshasa las informes son mi señor
5870,Kinshasa atmósfera es un nuevo estado
5871,Kinshasa de marcas y la previsión
5872,Kinshasa barada de la actividad
5873,Kinshasa la actividad del proyecto
