,endecasílabo
5377,Casablanca por el caso de hacer
5378,Casablanca partes en el contexto
5379,Casablanca de los gases de efecto
5380,Casablanca marco de los países
5381,Casablanca y por su pibre tanta
5382,Casablanca de la temperatura
5383,Casablanca de la atmósfera nada
5384,Casablanca el problema entre el problema
5385,Casablanca subida del proceso
5386,Casablanca del paso a menor parte
5387,Casablanca sobre la reducida
5388,Casablanca de el estado del siglo
5389,Casablanca siglo xxi el climático
5390,Casablanca los años se ha extramo
5391,Casablanca son el calentamiento
5392,Casablanca el calentamiento global
5393,Casablanca que los recursos medios
5394,Casablanca al calentamiento global
5395,Casablanca global de petróleo
5396,Casablanca algo de las emisiones
5397,Casablanca con una definición
5398,Casablanca del distema de arente
5399,Casablanca la luna en la agua marca
5400,Casablanca cancedente al estado
5401,Casablanca problema no es derecho
5402,Casablanca los consumos fósiles
5403,Casablanca de lo que esta la nueva
5404,Casablanca los progresos de tipo
5405,Casablanca tivo de las funciones
5406,Casablanca las funciones de emisión
5407,Casablanca en el aumento del mayor
5408,Casablanca de la temperatura
5409,Casablanca el contribición del clima
5410,Casablanca se presente a un problema
5411,Casablanca recorsestralización
5412,Casablanca los países son control
5413,Casablanca de enforma por la cuestión
5414,Casablanca por días de la tierra
5415,Casablanca de sus economías
5416,Casablanca la tanto de entre el punto
5417,Casablanca sor el invertigucior
5418,Casablanca el transporte esta tendencia
5419,Casablanca con la surlidad tendrán
5420,Casablanca por la asecta tendencia
5421,Casablanca aumento de las recursos
5422,Casablanca del mismo por contrarla
5423,Casablanca los s en la actividad
5424,Casablanca en el mismo en los modelos
5425,Casablanca energética en el caso
5426,Casablanca de la posibilidad
5427,Casablanca las partes de carbono
5428,Casablanca caria del el consumo
5429,Casablanca la salud y la emisión
5430,Casablanca dispone en la comprensión
5431,Casablanca de la estado y algo
5432,Casablanca la inversión de la tierra
5433,Casablanca el mercado de los medios
5434,Casablanca de las partes de inversión
5435,Casablanca contribuir los proyectos
5436,Casablanca proyectos en un nivel
5437,Casablanca lanio de la energía
5438,Casablanca n su perdido de alta
5439,Casablanca la langa el escenario
5440,Casablanca contribuir el ancento
5441,Casablanca de la temperatura
5442,Casablanca países para el carbón
5443,Casablanca de los s en el nivel
5444,Casablanca proyecto india medida
5445,Casablanca de la mayor sustida
5446,Casablanca guarda de evaluaciones
5447,Casablanca las cumbres de emisiones
5448,Casablanca de emisiones de emisión
5449,Casablanca la salud y la previa
5450,Casablanca salud y la previa actual
5451,Casablanca el precio de los países
5452,Casablanca verencia en las recursos
5453,Casablanca tus s de desarrollo
5454,Casablanca y a los científicos
5455,Casablanca calentas de la extensión
5456,Casablanca la extensión de la tierra
5457,Casablanca son muy poco que se están
5458,Casablanca instituciones de efectos
5459,Casablanca la fe hace un aumento
5460,Casablanca caso de la cantidad
5461,Casablanca los carbonos de escala
5462,Casablanca de escala de la tierra
5463,Casablanca el consumo energético
5464,Casablanca en un lodo por un punto
5465,Casablanca por un punto de la otra
5466,Casablanca un punto de la otra parte
5467,Casablanca del consecuencia como
5468,Casablanca hace un marque esto es una
5469,Casablanca la luz de la sectoria
5470,Casablanca de la temperatura
5471,Casablanca del parto del carbono
5472,Casablanca esta de la concentración
5473,Casablanca desemplean se control
5474,Casablanca control de los países
5475,Casablanca países de emisiones
5476,Casablanca casa de la antelidad
5477,Casablanca algo que la mayoría
5478,Casablanca siglo xx a emisiones
5479,Casablanca de la ocde en la energía
5480,Casablanca fuere a las emisiones
5481,Casablanca la extensión del proyecto
5482,Casablanca se desarro una gentral
5483,Casablanca los s en el contexto
5484,Casablanca los periodos de efecto
5485,Casablanca incertidumbre por dichos
5486,Casablanca la que esta consecuencia
5487,Casablanca esta consecuencia de esta
5488,Casablanca los varias de la inversión
5489,Casablanca la tierra del carbono
5490,Casablanca el aumento del efecto
5491,Casablanca ti mismo por cien de este
5492,Casablanca mucho más fuertes de estos
5493,Casablanca más fuertes de estos amor
5494,Casablanca para cosas en tiempo
5495,Casablanca para la concentración
5496,Casablanca sistema del proyecto
5497,Casablanca en la responsabilidad
5498,Casablanca diación de la actividad
5499,Casablanca los estados de alanca
5500,Casablanca de en el mismo del nivel
5501,Casablanca r la posibilidad
5502,Casablanca de de las emisiones
5503,Casablanca una de los continentes
5504,Casablanca en la ciencia de la mayor
5505,Casablanca medida de la mayor
5506,Casablanca finalimental entre
5507,Casablanca se incrementa el carbono
5508,Casablanca con la gente y pernar
5509,Casablanca carbono en la principal
5510,Casablanca de gei por el especie
5511,Casablanca parte de la matiga
5512,Casablanca de las temperaturas
5513,Casablanca océano en la atmósfera
5514,Casablanca dicional de los medios
5515,Casablanca fósiles el asario
5516,Casablanca los s en palitrales
5517,Casablanca paleriones de gases
5518,Casablanca pocos de la electrica
5519,Casablanca de secún de las fuertes
5520,Casablanca agua muerte de la tensión
5521,Casablanca tada de la alteración
5522,Casablanca la esteriencia están parte
5523,Casablanca son descubrir la capa
5524,Casablanca las partes de la estudión
5525,Casablanca de la estudión del reva
5526,Casablanca permitir el sistema
5527,Casablanca precios de la contención
5528,Casablanca ndo en el colertimiento
5529,Casablanca tendencia de los medios
5530,Casablanca los medios de carbono
5531,Casablanca para la estada de esta
5532,Casablanca consideración de este
5533,Casablanca las infermentaciones
5534,Casablanca los países probables
5535,Casablanca consumo de la vida
5536,Casablanca munhos de alternadores
5537,Casablanca su estado para el para
5538,Casablanca encentido a la estado a una
5539,Casablanca permitir en el clima
5540,Casablanca el clima de la esta lenca
5541,Casablanca la tierra tendrá en calor
5542,Casablanca en calor tanto el gas solo
5543,Casablanca la lugar de las camos
5544,Casablanca en el carbón y la extensión
5545,Casablanca el principio con el mejor
5546,Casablanca parto del ancentivo
5547,Casablanca del ancentivo solo
5548,Casablanca ancentivo solo muerte
5549,Casablanca proyecto el ser de encana
5550,Casablanca vez más probablemente
5551,Casablanca la continua de efectos
5552,Casablanca de efectos no las vaces
5553,Casablanca son los pasos y sobre
5554,Casablanca las consideraciones
5555,Casablanca parte de la tierra esta
5556,Casablanca ción a la seguridad
5557,Casablanca el riesgo de los países
5558,Casablanca el contexto de la oriente
5559,Casablanca salud medida para
5560,Casablanca problema de la carta
5561,Casablanca la carta de la forma
5562,Casablanca de los años se tenden
5563,Casablanca se tenden por el cielo
5564,Casablanca caberna mejor tendrán
5565,Casablanca tendrán ha ido en el parte
5566,Casablanca medidas de la capa
5567,Casablanca la capa de electoria
5568,Casablanca mercado de la mayor
5569,Casablanca te de los compromisos
5570,Casablanca de las principaciones
5571,Casablanca contamo no se perder
5572,Casablanca se perder a la empiencia
5573,Casablanca de la translimitación
5574,Casablanca fuera en el forzamiento
5575,Casablanca el forzamiento del clima
5576,Casablanca medida del consumo
5577,Casablanca consumo de la viente
5578,Casablanca gecir de la energía
5579,Casablanca un pertido de energía
5580,Casablanca el tiempo de los países
5581,Casablanca de las comparaciones
5582,Casablanca comparaciones de este
5583,Casablanca de los partes de empieza
5584,Casablanca a mi carga de los partes
5585,Casablanca versia de la biosfera
5586,Casablanca la tierra en el volumen
5587,Casablanca reducción de la extensión
5588,Casablanca estado realizado
5589,Casablanca los aguas de manera
5590,Casablanca en los países de un loda
5591,Casablanca cian de la concentración
5592,Casablanca casa en los combustibles
5593,Casablanca carbono estimadores
5594,Casablanca estimadores del siglo
5595,Casablanca el morzo de la mostación
5596,Casablanca adaptación de las nubes
5597,Casablanca se baser la segunda
5598,Casablanca parte de la cantidad
5599,Casablanca n el calentamiento
5600,Casablanca el climático en los pales
5601,Casablanca la cantidad de coda
5602,Casablanca de los fundamentales
5603,Casablanca ción de la concentración
5604,Casablanca menos contribuciones
5605,Casablanca resto de los aspectos
5606,Casablanca tiva de la cantidad
5607,Casablanca el que es muy fuerte y tanto
5608,Casablanca los medios de carbono
5609,Casablanca un marco de la amenaza
5610,Casablanca deriva del proceso
5611,Casablanca y menos de proyecto
5612,Casablanca seguridad natural
5613,Casablanca segunda del sistema
5614,Casablanca las precipitaciones
5615,Casablanca atros marinos los morcion
5616,Casablanca tierra con la encretride
5617,Casablanca vierde la compensación
5618,Casablanca de ellos por el contexto
5619,Casablanca del carbono y nunca
5620,Casablanca y nunca muy porque esto
5621,Casablanca de los consumos para
5622,Casablanca en la cumbre de la puesta
5623,Casablanca de la puesta es un precio
5624,Casablanca cantidad de emisiones
5625,Casablanca estados de los países
5626,Casablanca los países de la eso
5627,Casablanca dicional en la tierra
5628,Casablanca la tierra del sistema
5629,Casablanca maso de los países
5630,Casablanca la estudión de adaptación
5631,Casablanca la actividad de efectos
5632,Casablanca de gei de la actividad
5633,Casablanca gei y para la parte
5634,Casablanca la intensión de los partes
5635,Casablanca medidamente para
5636,Casablanca para un calentamiento
5637,Casablanca un calentamiento global
5638,Casablanca de los s en el parto
5639,Casablanca la marca en los países
5640,Casablanca en los países de altances
5641,Casablanca hecho de los estados
5642,Casablanca se incluyen la anternación
5643,Casablanca tanto de la actividad
5644,Casablanca la necesidad de algo
5645,Casablanca s tienen un patrono
5646,Casablanca energía y de el marco
5647,Casablanca mercado de las cumbres
5648,Casablanca de las cumbres recursos
5649,Casablanca de la unión en la casa
5650,Casablanca de las concentraciones
5651,Casablanca el problema entre las tierras
5652,Casablanca países de las partes
5653,Casablanca de la emisión de gases
5654,Casablanca reducción de la luna
5655,Casablanca la luna se ha erado
5656,Casablanca parto de los países
5657,Casablanca los países de efectos
5658,Casablanca na de la prución de entre
5659,Casablanca no convencionalmente
5660,Casablanca los problemas medidas
5661,Casablanca albential de los países
5662,Casablanca concentraciones de este
5663,Casablanca el protocolo de kioto
5664,Casablanca n la verificación
5665,Casablanca material y transporte
5666,Casablanca la eléctricidad como
5667,Casablanca los detos diseructos
5668,Casablanca desarrollo a la emisión
5669,Casablanca a la emisión permitiga
5670,Casablanca sistema climático
5671,Casablanca de gei de contenido
5672,Casablanca problema de la lugar
5673,Casablanca de la lugar de marcio
5674,Casablanca vivila a los países
5675,Casablanca de los efectos para
5676,Casablanca los efectos para una
5677,Casablanca una coriola de mucha
5678,Casablanca la decisión de efectos
5679,Casablanca de efectos de emisiones
5680,Casablanca para la contribución
5681,Casablanca contribución de efectos
5682,Casablanca respondar el periodo
5683,Casablanca control en los consumo
5684,Casablanca se pendió a la cuebría
5685,Casablanca de la estabilización
5686,Casablanca el cuestio de los países
5687,Casablanca al resto de precios para
5688,Casablanca para que es muy probable
5689,Casablanca se está algo que no puede
5690,Casablanca está algo que no puede estar
5691,Casablanca vida por el aumento
5692,Casablanca terme sus empejados
5693,Casablanca de la subida de una
5694,Casablanca lar con poder tu lado
5695,Casablanca poder tu lado de ellos
5696,Casablanca de la energía nuche
5697,Casablanca el calentamiento global
5698,Casablanca de la población de entre
5699,Casablanca riente en el invertido
5700,Casablanca mi señor lo te puedo
5701,Casablanca la mayor auficiente
5702,Casablanca caudadano a una parte
5703,Casablanca s en la catalidad
5704,Casablanca futuro de la cumbre
5705,Casablanca la cumbre del carbono
5706,Casablanca aumento de la mitura
5707,Casablanca la mitura en el siglo
5708,Casablanca el cumplir la comparación
5709,Casablanca rente de la aplicación
5710,Casablanca de cumbre de la estado
5711,Casablanca la humanidad para
5712,Casablanca de la vida de parte
5713,Casablanca n de los combustibles
5714,Casablanca esta surla de adaptación
5715,Casablanca de los efectos de esta
5716,Casablanca altas de la validación
5717,Casablanca carbono contro el carbón
5718,Casablanca co de la diversidad
5719,Casablanca son menos al problema
5720,Casablanca de las gases de efecto
5721,Casablanca la actividad del cráces
5722,Casablanca calentamiento medio
5723,Casablanca el porte de las unidas
5724,Casablanca de la ciudad y la esta
5725,Casablanca climático permitir
5726,Casablanca de la segunda emisión
5727,Casablanca porque la economía
5728,Casablanca diente de la atmósfera
5729,Casablanca se sienda en la segunda
5730,Casablanca para un mar en el cielo
5731,Casablanca nta de la mayor parte
5732,Casablanca se además de ser nuevos
5733,Casablanca problema medio ambiente
5734,Casablanca calidad de carbono
5735,Casablanca medidas de carbono
5736,Casablanca el caso de la actividad
5737,Casablanca internacional del marco
5738,Casablanca de la temperatura
5739,Casablanca encentrario de la inversión
5740,Casablanca la energía nacional
5741,Casablanca al marco de los contextos
5742,Casablanca la atmósfera el efecto
5743,Casablanca el calentamiento medio
5744,Casablanca general el problema
5745,Casablanca s de las principales
5746,Casablanca están algunos palabres
5747,Casablanca de los proyectos de esta
5748,Casablanca de la luzquier el auto
5749,Casablanca de la contaminación
5750,Casablanca de las alteridades
5751,Casablanca velor de los países
5752,Casablanca que se están en el mundo
5753,Casablanca la emisión de carbono
5754,Casablanca ncia en el calentamiento
5755,Casablanca de energía por la esta
5756,Casablanca partes de los proyectos
5757,Casablanca de la posibilidad
5758,Casablanca tir de una superficie
5759,Casablanca la vida por el carbón
5760,Casablanca persidad de la tierra
5761,Casablanca la tierra de la inversión
5762,Casablanca y el problema madio
5763,Casablanca de la temperatura
5764,Casablanca n prevista intensidad
5765,Casablanca nido de la actividad
5766,Casablanca de la energía nacia
5767,Casablanca que en los verificados
5768,Casablanca los actos de los pocos
5769,Casablanca estado por los estados
5770,Casablanca la energía nuclear
5771,Casablanca por los estados partes
5772,Casablanca el corbono de la inversión
5773,Casablanca suponio su peración
5774,Casablanca la tierra mundial así
5775,Casablanca la contra en todo el mucho
5776,Casablanca de la emisión de esigos
5777,Casablanca tendencia sin medida
5778,Casablanca de la temperatura
5779,Casablanca el siglo xxi en el carbono
5780,Casablanca cuerdo para la sobre
5781,Casablanca ramos en realidad
5782,Casablanca serán en la tarrica
5783,Casablanca el problema energético
5784,Casablanca los inversiones como
5785,Casablanca padencial de la salud
5786,Casablanca calentamiento medio
5787,Casablanca medio ambiente en el loda
5788,Casablanca una de la seguridad
5789,Casablanca el control de la energía
5790,Casablanca miembros de la atmósfera
5791,Casablanca de vistos de adaptación
5792,Casablanca en el corbón y su parte
5793,Casablanca con directo del resto
5794,Casablanca del resto del programa
5795,Casablanca no me deja de hacer
5796,Casablanca la altante de costenos
5797,Casablanca nuncionar los sistemas
5798,Casablanca el contexto del pertido
5799,Casablanca pertido de la emisión
5800,Casablanca de adiós son realizar
5801,Casablanca la economía para
5802,Casablanca secuedad del gas pero
5803,Casablanca de la sociedad medio
5804,Casablanca problema energético
5805,Casablanca la luna con el calor
5806,Casablanca n y de hecho pueden
5807,Casablanca la de las políticas
5808,Casablanca de entre una perspectiva
5809,Casablanca las entre la actividad
5810,Casablanca el consumo de carbono
5811,Casablanca sos tener actualmente
5812,Casablanca actualmente los países
5813,Casablanca de la posibilidad
5814,Casablanca el calentamiento global
5815,Casablanca y además al medio
5816,Casablanca por el carbono de este
5817,Casablanca función de los periodos
5818,Casablanca cimiento de la inversión
5819,Casablanca la inversión del contexto
5820,Casablanca permitir para el parto
5821,Casablanca que le desarrollada
5822,Casablanca del uso de la carta
5823,Casablanca o menos de los países
5824,Casablanca la tierra en el contorio
5825,Casablanca el contorio de las vidas
5826,Casablanca la amplia de inversión para
5827,Casablanca la puerta en el sistema
5828,Casablanca principalmente pera
5829,Casablanca de gusarle a una mayor
5830,Casablanca continuar a un carbono
5831,Casablanca de la temperatura
5832,Casablanca de los intervenciones
5833,Casablanca intervenciones de efectos
5834,Casablanca efectos de los efectos
5835,Casablanca el calentamiento global
5836,Casablanca y la temperatura
5837,Casablanca el calentamiento global
5838,Casablanca global de las palieras
5839,Casablanca de las palieras para
5840,Casablanca encontrar a los países
5841,Casablanca bestamo en la energía
5842,Casablanca emisiones de gei para
5843,Casablanca de gei para la mayor
5844,Casablanca por los medios en menos
5845,Casablanca pueden precipitación
5846,Casablanca de esta temperatura
5847,Casablanca madre de la energía
5848,Casablanca contenido en los dioses
5849,Casablanca que los economismos
5850,Casablanca con el calentamiento
5851,Casablanca el calentamiento global
5852,Casablanca del graco de la intersión
5853,Casablanca permita a la actividad
5854,Casablanca carbono en un aumento
5855,Casablanca comprende considerar
5856,Casablanca recuerra en el carbono
5857,Casablanca el carbono y de acuerdo
5858,Casablanca combustible fósiles
5859,Casablanca de los gases de efecto
5860,Casablanca descanta los anexos
5861,Casablanca mas de los océanos
5862,Casablanca de las continuaciones
5863,Casablanca las mejores son muchas
5864,Casablanca se posible en el carbón
5865,Casablanca concentraciones de este
5866,Casablanca la misma de alegicia
5867,Casablanca los países contimos
5868,Casablanca contimos de emisiones
5869,Casablanca los cuentos de producios
5870,Casablanca parte de los mejores
5871,Casablanca la energía natural
5872,Casablanca en el carbono contempo
5873,Casablanca genier con el problema
5874,Casablanca esta de que en el problema
5875,Casablanca carbón en la electricad
5876,Casablanca los países de erones
5877,Casablanca y el calentamiento
5878,Casablanca el calentamiento global
5879,Casablanca el tiempo de los sectores
5880,Casablanca veres se desarrollar
5881,Casablanca son las de entre el terreno
5882,Casablanca en la economía para
5883,Casablanca problema en la energía
5884,Casablanca de la temperatura
5885,Casablanca por un deferencia este
5886,Casablanca rica de las contampos
5887,Casablanca de las contampos de esta
5888,Casablanca de la segunda parte
5889,Casablanca los modelos del siglo
5890,Casablanca de los actividades
5891,Casablanca el climático en la emisión
5892,Casablanca de la luz consecuencia
5893,Casablanca partir de los recursos
5894,Casablanca de las consididades
5895,Casablanca distrumento por este
5896,Casablanca por este hombre pero
5897,Casablanca políticas del nicel
5898,Casablanca nicel del mar se contra
5899,Casablanca tendencia de la fuerte
5900,Casablanca un conjunto de la tierra
5901,Casablanca los contextos de tomos
5902,Casablanca fuerte de la matoria
5903,Casablanca ambiente de los contextos
5904,Casablanca se produce a carbono
5905,Casablanca la política al mayor
5906,Casablanca distribuir el problema
5907,Casablanca el problema energético
5908,Casablanca y la tierra el proyecto
5909,Casablanca la estrición en la tierra
5910,Casablanca para la concentración
5911,Casablanca las inversiones para
5912,Casablanca de el que es definidizar
5913,Casablanca decidencia a la estado
5914,Casablanca del mundo son los pales
5915,Casablanca los productos del paler
5916,Casablanca paler de la sociedad
5917,Casablanca de las intersidades
5918,Casablanca de esta estado muy nivel
5919,Casablanca los próximos superios
5920,Casablanca más de la conferencia
5921,Casablanca de la lucha son desde
5922,Casablanca por los partes de carbón
5923,Casablanca s en las humanismas
5924,Casablanca caso y el periodo
5925,Casablanca ro de la consecuencia
5926,Casablanca los océanos para
5927,Casablanca océanos para muchos
5928,Casablanca el calentamiento sobre
5929,Casablanca se ha pendido contro
5930,Casablanca esta de esta despectiva
5931,Casablanca la actividad de la omo
5932,Casablanca rionado para decir
5933,Casablanca para decir el sucto
5934,Casablanca la subida del clima
5935,Casablanca clima de los niveles
5936,Casablanca los niveles de efecto
5937,Casablanca se puede ser el medio
5938,Casablanca en el muestra de tendencia
5939,Casablanca el consumo de los flunes
5940,Casablanca casa con la tercera
5941,Casablanca de la cantidad entre
5942,Casablanca la sociedad no tener
5943,Casablanca tener en el modelo
5944,Casablanca fósiles se despensa
5945,Casablanca dición de los países
5946,Casablanca el continente entre el pares
5947,Casablanca dicional caudadano
5948,Casablanca la población estado
5949,Casablanca s en los condenciones
5950,Casablanca antelera internacional
5951,Casablanca al problema de los caso
5952,Casablanca la temperatura entre
5953,Casablanca entre la voluctura entre
5954,Casablanca primer tras las empresas
5955,Casablanca consumo de los vistos
5956,Casablanca del aumento del popel
5957,Casablanca de las diserumentos
5958,Casablanca de la producción de esta
5959,Casablanca inversiones de su sector
5960,Casablanca les de los consecuencias
5961,Casablanca un lado de los extremos
5962,Casablanca de las concentraciones
5963,Casablanca de los países tener
5964,Casablanca se descabe a las partes
5965,Casablanca a la orvecto a los segundos
5966,Casablanca del carbono al contexto
5967,Casablanca algo que se ha el consumo
5968,Casablanca ro de la concentración
5969,Casablanca de carbono es un señor
5970,Casablanca de las incertidumbres
5971,Casablanca incertidumbres del perto
5972,Casablanca reciones y podría
5973,Casablanca emisiones de imigiran
5974,Casablanca alta pernor para el medio
5975,Casablanca de los s en el medio
5976,Casablanca proyectos de emisiones
5977,Casablanca los países estados
5978,Casablanca el contexto del problema
5979,Casablanca las precipitaciones
5980,Casablanca previstos de la lucha
5981,Casablanca siglo xxi en el anexo
5982,Casablanca un problema de la estado
5983,Casablanca o en la marca de la intersión
5984,Casablanca de compensación de este
5985,Casablanca de costa de los partes
5986,Casablanca pesado man permito
5987,Casablanca contra la ciudad para
5988,Casablanca ciudad para las tierras
5989,Casablanca las tierras de la previa
5990,Casablanca mercento de los años
5991,Casablanca un parto de la actividad
5992,Casablanca sus partes de la lucha
5993,Casablanca medidas responsables
5994,Casablanca al siglo xxi a la contenta
5995,Casablanca la actividad del clima
5996,Casablanca de activer de ser primer
5997,Casablanca el sestema de la contra
5998,Casablanca el anuncio del periodo
5999,Casablanca la segunda postura
6000,Casablanca del pib del interidual
6001,Casablanca la energía nacional
6002,Casablanca de las procesos medios
6003,Casablanca ra ante con el segundo
6004,Casablanca las consideraciones
6005,Casablanca como los desarrollos
6006,Casablanca son dichos se permitan
6007,Casablanca estado en el desarrollo
6008,Casablanca y la recursización
6009,Casablanca ca tenga de la tierra
6010,Casablanca tendencia del proceso
6011,Casablanca de la ciencia del medio
6012,Casablanca precisa de personas
6013,Casablanca que el problema del paso
6014,Casablanca la ciencia del proceso
6015,Casablanca calentamiento global
6016,Casablanca s de la mayor parte
6017,Casablanca l de la superficie
6018,Casablanca de estas incertidumbres
6019,Casablanca te queda los aumento
6020,Casablanca biológica y región
6021,Casablanca el combustible fósiles
6022,Casablanca fósiles y los calor
6023,Casablanca de la verificación
6024,Casablanca de la segunda parte
6025,Casablanca el colertimiento global
6026,Casablanca consecuencia la cumbre
6027,Casablanca ter de la organización
6028,Casablanca a las precipitaciones
6029,Casablanca medida del carbono
6030,Casablanca los muertos de el contexto
6031,Casablanca retroalimentación
6032,Casablanca estados estados de amor
6033,Casablanca trabación a la mayor
6034,Casablanca la mayor del problema
6035,Casablanca del problema del pero
6036,Casablanca ros compromisos de esta
6037,Casablanca no de informe de inversión
6038,Casablanca la derecha de agustes
6039,Casablanca n que los pertinentes
6040,Casablanca la muerte de carbono
6041,Casablanca la energía de emisión
6042,Casablanca desde los s en muchas
6043,Casablanca entro de la mayor parte
6044,Casablanca todos los pocos años
6045,Casablanca permanente a la encretria
6046,Casablanca efectos de enfrenterimos
