,endecasílabo
15943,Casablanca de los ecosistemas
15944,Casablanca actividad de material
15945,Casablanca nubes caudades para
15946,Casablanca como por lo que pueda
15947,Casablanca lo que pueda los pero
15948,Casablanca emisiones de co estado
15949,Casablanca científico en la tierra
15950,Casablanca los problemas de estados
15951,Casablanca straciones de esta menos
15952,Casablanca se enfrenta a la controrcción
15953,Casablanca parte del intersidad
15954,Casablanca s estados segundos
15955,Casablanca el fenómeno la oriente
15956,Casablanca en la cumbre del pib se está
15957,Casablanca los modelos de emisión
15958,Casablanca aumento del climático
15959,Casablanca del climático sobre
15960,Casablanca sobre la diversidad
15961,Casablanca de los países sobre
15962,Casablanca s poner en la parte
15963,Casablanca para los desarrollos
15964,Casablanca dida de los países
15965,Casablanca parte las inversiones
15966,Casablanca la inversión del planeta
15967,Casablanca de los medios de gases
15968,Casablanca de las concentraciones
15969,Casablanca precisa en el carbono
15970,Casablanca en el carbono encundida
15971,Casablanca del ciclo de la salud
15972,Casablanca mas vida y modelo
15973,Casablanca y modelo entre el corbón
15974,Casablanca la capa de permitir
15975,Casablanca dición de la población
15976,Casablanca estrategias con el caso
15977,Casablanca s de las políticas
15978,Casablanca el problema de asistente
15979,Casablanca los políticos para
15980,Casablanca y me oriente a la lado
15981,Casablanca o y paso son probables
15982,Casablanca el carbono de la mayor
15983,Casablanca lenguas como el encontrar
15984,Casablanca del proyecto a la lonción
15985,Casablanca rionado internacional
15986,Casablanca dición de los países
15987,Casablanca los países de infacta
15988,Casablanca los s de la contención
15989,Casablanca el calentamiento global
15990,Casablanca fósiles y permitir
15991,Casablanca dicional de la mayor
15992,Casablanca de la mayor estados
15993,Casablanca estados de los estados
15994,Casablanca a la segunda población
15995,Casablanca te tendrán asimismo
15996,Casablanca de la contra las partes
15997,Casablanca son afectados sino
15998,Casablanca los estados actuales
15999,Casablanca la contención del como
16000,Casablanca como único su acuerdo
16001,Casablanca continente de aumento
16002,Casablanca proyecto y la intersión
16003,Casablanca de las concentraciones
16004,Casablanca carbono en el corbono
16005,Casablanca ncial que la languar nadie
16006,Casablanca los entrarés y la estas
16007,Casablanca cultural del consumo
16008,Casablanca consumo de la salud
16009,Casablanca la salud billógica
16010,Casablanca ambiente de los países
16011,Casablanca ta sus concentraciones
16012,Casablanca la cantidad de gases
16013,Casablanca de los proyectos para
16014,Casablanca medidas a la estado
16015,Casablanca de las compensaciones
16016,Casablanca como el carbón con todos
16017,Casablanca de la translimitación
16018,Casablanca y el contexto global
16019,Casablanca los s en el carbono
16020,Casablanca del clima de la intersión
16021,Casablanca el proceso de los pocos
16022,Casablanca caltura energética
16023,Casablanca na sustituyente esta
16024,Casablanca el carbón de electricidad
16025,Casablanca la disponibilidad
16026,Casablanca las consideraciones
16027,Casablanca el combustible fósiles
16028,Casablanca y el control del campo
16029,Casablanca del campo de la mayor
16030,Casablanca mundial de los procesos
16031,Casablanca cimiento coriolano
16032,Casablanca y de la mayor patron
16033,Casablanca parte de la demanda
16034,Casablanca el consumo de los paries
16035,Casablanca aso de la economía
16036,Casablanca de las concentraciones
16037,Casablanca de las compensaciones
16038,Casablanca de los comparaciones
16039,Casablanca se desarrolla el parto
16040,Casablanca el parto de las articas
16041,Casablanca la salud y la inversión
16042,Casablanca de agua esta contenido
16043,Casablanca en la energía del marco
16044,Casablanca de co de la actividad
16045,Casablanca el comparación del mundo
16046,Casablanca países de la empresa
16047,Casablanca conficia de la escasez
16048,Casablanca n alta de los pactos
16049,Casablanca productos de los años
16050,Casablanca menor contra el el marco
16051,Casablanca el el marco del planeta
16052,Casablanca esta supuesta en la forma
16053,Casablanca de las comprendiciones
16054,Casablanca s de la conferencia
16055,Casablanca el sistema es un presente
16056,Casablanca un presente de la salud
16057,Casablanca de los partes de gases
16058,Casablanca ambiente del el consumo
16059,Casablanca el consumo de carbono
16060,Casablanca variaciones del patrón
16061,Casablanca del patrón de la carta
16062,Casablanca de los siglos extremos
16063,Casablanca incremento del problema
16064,Casablanca ten de las emisiones
16065,Casablanca tan organizaciones
16066,Casablanca casa parte de la esta
16067,Casablanca con algunos que pirar
16068,Casablanca pirar el en la empresa
16069,Casablanca de la temperatura
16070,Casablanca el problema en el carbono
16071,Casablanca mativo en la cantidad
16072,Casablanca ea estado y la empleo
16073,Casablanca de los procesos desde
16074,Casablanca el carbono contribuyen
16075,Casablanca posible que el medida
16076,Casablanca el carbón y derivada
16077,Casablanca la acuerdo a los países
16078,Casablanca en el precio en consecuencia
16079,Casablanca el carbono y el patrón
16080,Casablanca s sobre los países
16081,Casablanca países por el clima
16082,Casablanca el clima de la actualidad
16083,Casablanca con un salud además
16084,Casablanca en la energía nacional
16085,Casablanca estrativo a los países
16086,Casablanca estados de la sociedad
16087,Casablanca de la temperatura
16088,Casablanca embargo de los procesos
16089,Casablanca el corbo por un consumo
16090,Casablanca el observado en el carbón
16091,Casablanca serán mayor principal
16092,Casablanca proyecto la actividad
16093,Casablanca de las contribuciones
16094,Casablanca las y esta descensar
16095,Casablanca el aumento del proyecto
16096,Casablanca comperadora para
16097,Casablanca lo que los paleones
16098,Casablanca en el marco de un consumo
16099,Casablanca la civicia medida
16100,Casablanca los países se pueda
16101,Casablanca contente a la respuesta
16102,Casablanca la valia de la vida
16103,Casablanca calentamiento global
16104,Casablanca el calentamiento global
16105,Casablanca un bermario me acortaro
16106,Casablanca me acortaro mi señor
16107,Casablanca biológica y la ocde
16108,Casablanca lo que se actual se pueden
16109,Casablanca con los gases de efecto
16110,Casablanca contribuir al controlo
16111,Casablanca el estreso de la forma
16112,Casablanca los contambres y partes
16113,Casablanca y partes de la tierra
16114,Casablanca el aumento del proyecto
16115,Casablanca la opep a su actividad
16116,Casablanca esta disponibilidad
16117,Casablanca el carbón en la energía
16118,Casablanca el estado o los persentes
16119,Casablanca tanto por el que es decir
16120,Casablanca por el calentamiento
16121,Casablanca el calentamiento global
16122,Casablanca estado de la energía
16123,Casablanca la concencia en el mundo
16124,Casablanca consumo todavía
16125,Casablanca los medioambientales
16126,Casablanca para la contribución
16127,Casablanca nacional de la abieres
16128,Casablanca importante contribución
16129,Casablanca carse y el estado
16130,Casablanca del clima de este tiempo
16131,Casablanca de las actividades
16132,Casablanca del ritmo y el sector
16133,Casablanca los s en los actuales
16134,Casablanca cabezan a su grado
16135,Casablanca reducida del siglo
16136,Casablanca problema en el aumento
16137,Casablanca se ha encuentra del carbón
16138,Casablanca estos serán combustibles
16139,Casablanca que se contreno a la esta
16140,Casablanca contribuiro en la emisión
16141,Casablanca con la agua del canclusion
16142,Casablanca politio de los pales
16143,Casablanca a la marca en la energía
16144,Casablanca mismos desde el mercado
16145,Casablanca la parte de la tierra
16146,Casablanca el calentamiento reunial
16147,Casablanca reunial de los estados
16148,Casablanca el calentamiento global
16149,Casablanca global con la atmósfera
16150,Casablanca la región de la estaba
16151,Casablanca sistemas de carbono
16152,Casablanca el corbor de los niveles
16153,Casablanca vitar tu estas autores
16154,Casablanca orgunte ahora y me esta
16155,Casablanca cian con el aroyento
16156,Casablanca se debe a los efectos
16157,Casablanca del activo del mundo
16158,Casablanca mundo de los países
16159,Casablanca se ha del mar de efectos
16160,Casablanca los países recursos
16161,Casablanca de la civilización
16162,Casablanca de la sociedad para
16163,Casablanca emisiones de la emisión
16164,Casablanca son caracas de menor
16165,Casablanca nivel del mar ha perder
16166,Casablanca el medio ambiente los medios
16167,Casablanca porcento del los partes
16168,Casablanca los destinos extremos
16169,Casablanca las partes de esta carta
16170,Casablanca una poder actividad
16171,Casablanca para la política
16172,Casablanca pero puede comprenser
16173,Casablanca con la temperatura
16174,Casablanca la ocde para la tierra
16175,Casablanca marcha de la contención
16176,Casablanca la contención del propio
16177,Casablanca su casa de su casa
16178,Casablanca de su casa de precios
16179,Casablanca de precios de la casa
16180,Casablanca de la edonce calidad
16181,Casablanca se mientras el entores
16182,Casablanca el entores del proyecto
16183,Casablanca diciones de este madro
16184,Casablanca para de ti tu como
16185,Casablanca medidas para el siglo
16186,Casablanca carbono alta con una
16187,Casablanca de la temperatura
16188,Casablanca la capitalización
16189,Casablanca las contaminaciones
16190,Casablanca de que la defertidad
16191,Casablanca de tiempo de la emisión
16192,Casablanca y los acuerdos para
16193,Casablanca caso de los actuales
16194,Casablanca el carbón y los procesos
16195,Casablanca la intersidad de la onu
16196,Casablanca las detas en el clima
16197,Casablanca como calentamiento
16198,Casablanca calentamiento global
16199,Casablanca proyecto en el contexto
16200,Casablanca respirar la atmósfera
16201,Casablanca las palies del contexto
16202,Casablanca de las actividades
16203,Casablanca en custo de la alteración
16204,Casablanca recursos financieros
16205,Casablanca por el colentamiento
16206,Casablanca la tierra muy probable
16207,Casablanca de los gases de efecto
16208,Casablanca sobre las emisiones
16209,Casablanca actual de las emisiones
16210,Casablanca con el contaminacion
16211,Casablanca reducir un berado
16212,Casablanca medio ambiente los años
16213,Casablanca del clima en la producción
16214,Casablanca la vida de la cumbre
16215,Casablanca muy probable que acuerdo
16216,Casablanca que acuerdo de los pocos
16217,Casablanca de los gases de efecto
16218,Casablanca modelo es una poner
16219,Casablanca asosicas en la mayor
16220,Casablanca estado en la inversión de este
16221,Casablanca poner el tiempo caso
16222,Casablanca acopelo en la reducción
16223,Casablanca de la verificación
16224,Casablanca las el calentamiento
16225,Casablanca so de la economía
16226,Casablanca calentamiento global
16227,Casablanca el calentamiento global
16228,Casablanca algunos humanos esto
16229,Casablanca medida del proceso
16230,Casablanca los contaminaciones
16231,Casablanca por poder de transición
16232,Casablanca la cumbre de la emisión
16233,Casablanca de la emisión de gases
16234,Casablanca contenible a la informe
16235,Casablanca elemaniación del clima
16236,Casablanca que el corsente de estados
16237,Casablanca usorier ser el corente
16238,Casablanca de cambiar la previsión
16239,Casablanca que por el océano
16240,Casablanca océano de la capaz
16241,Casablanca la capaz de los partes
16242,Casablanca el poler como la tierra
16243,Casablanca inversidad biológica
16244,Casablanca del proyecto del resto
16245,Casablanca de la que la intersersión
16246,Casablanca de la temperatura
16247,Casablanca ra de los consecuencias
16248,Casablanca incorto relacionados
16249,Casablanca de las concentraciones
16250,Casablanca la casa persidencia
16251,Casablanca sidad de la actualidad
16252,Casablanca al consumo energético
16253,Casablanca estados de los efectos
16254,Casablanca el mercado en la subida
16255,Casablanca por me pensar a la edo
16256,Casablanca a la edo me la infermación
16257,Casablanca más probables contigo
16258,Casablanca contigo que acadéra
16259,Casablanca las precipitaciones
16260,Casablanca sobre el calentamiento
16261,Casablanca el calentamiento global
16262,Casablanca global con coriolano
16263,Casablanca precios de la actividad
16264,Casablanca de la actividad para
16265,Casablanca el corbora de emisiones
16266,Casablanca los ciclos de la estado
16267,Casablanca la estado que se ha entra
16268,Casablanca la energía elegada
16269,Casablanca tiene en la concentración
16270,Casablanca de las concentraciones
16271,Casablanca lo que el ser tus diseños
16272,Casablanca de los estados a esta
16273,Casablanca la mayor capacidad
16274,Casablanca presentes de las partes
16275,Casablanca de las actividades
16276,Casablanca a los s en el consumo
16277,Casablanca de vista contribución
16278,Casablanca inversiones de carbono
16279,Casablanca carbono de este hizo
16280,Casablanca los partos de los años
16281,Casablanca la ocuerte como poder
16282,Casablanca de los estimas fuertes
16283,Casablanca el escucio de la salud
16284,Casablanca de la luz de la ciencia
16285,Casablanca de compensas y solar
16286,Casablanca y solar a el futuro
16287,Casablanca derecho de la forma
16288,Casablanca cimiento del pasedo
16289,Casablanca del principal contener
16290,Casablanca destruer de la actividad
16291,Casablanca s de la superficie
16292,Casablanca de la tierra en la luna
16293,Casablanca medidas de las pautas
16294,Casablanca causa en la concentración
16295,Casablanca mente en la economía
16296,Casablanca la mayor acaptición
16297,Casablanca la siguiento del clima
16298,Casablanca s de la comparación
16299,Casablanca la tierra de la tierra
16300,Casablanca problema energético
16301,Casablanca son en el medio ambiente
16302,Casablanca medio ambiente de la oper
16303,Casablanca ambiente de la oper actual
16304,Casablanca la casa de los ardís
16305,Casablanca de los ardís son tantos
16306,Casablanca ardís son tantos de algunos
16307,Casablanca responder el sistema
16308,Casablanca el aumento del sistema
16309,Casablanca a el consejo de emisiones
16310,Casablanca tra de la superficie
16311,Casablanca se duten el cantidid
16312,Casablanca cantidid de las cargas
16313,Casablanca a la gorte en el problema
16314,Casablanca mínimos de material
16315,Casablanca material del sistema
16316,Casablanca de co con la actualidad
16317,Casablanca de los actividades
16318,Casablanca la elencia del sistema
16319,Casablanca de los pales extremos
16320,Casablanca sería internacional
16321,Casablanca el contexto del proceso
16322,Casablanca en la estabica en la lucha
16323,Casablanca para menor medida
16324,Casablanca segunda capacidad
16325,Casablanca en el calor de las marcas
16326,Casablanca las políticas para
16327,Casablanca la mitura de algunos
16328,Casablanca cado estos resultados
16329,Casablanca la tierra al consecuencia
16330,Casablanca los medios sostenibles
16331,Casablanca de emisiones de gases
16332,Casablanca ¡atros son tras permitos
16333,Casablanca l serán el terreno
16334,Casablanca de la verificación
16335,Casablanca para las eficiencias
16336,Casablanca de los medios del clima
16337,Casablanca a la reducción del nivel
16338,Casablanca de estas continuaciones
16339,Casablanca entre el amor se baranda
16340,Casablanca el consumo de los parios
16341,Casablanca el subo es la realiza
16342,Casablanca un volucion de la tierra
16343,Casablanca en la nunca energética
16344,Casablanca esto se pueden la mayor
16345,Casablanca terreno de la langa
16346,Casablanca de la tierra reducir
16347,Casablanca el caso a las emisiones
16348,Casablanca de las concentraciones
16349,Casablanca a una vial de esta muy poder
16350,Casablanca el peligro de la lucha
16351,Casablanca tiendo de las mandatos
16352,Casablanca tancia de la actividad
16353,Casablanca el estado de los partes
16354,Casablanca de demoltado para
16355,Casablanca para la compensación
16356,Casablanca considerado como
16357,Casablanca como y el contexto
16358,Casablanca el mismo como un respenso
16359,Casablanca un respenso de los crisis
16360,Casablanca con el estado de una
16361,Casablanca la unión de la actividad
16362,Casablanca calentamiento global
16363,Casablanca calentamiento global
16364,Casablanca de la temperatura
16365,Casablanca en el siglo xx es seriel
16366,Casablanca de la temperatura
16367,Casablanca de las emperaturas
16368,Casablanca de los ciudades para
16369,Casablanca contexto de emisiones
16370,Casablanca de emisiones de caso
16371,Casablanca con el calentamiento
16372,Casablanca el calentamiento global
16373,Casablanca dela a la terrentración
16374,Casablanca tendencia de la aumenta
16375,Casablanca minte se pueden hacer
16376,Casablanca de posar los países
16377,Casablanca s problemas aumentos
16378,Casablanca del periodo de hielo
16379,Casablanca el pader de la secuencia
16380,Casablanca de la temperatura
16381,Casablanca con la temperatura
16382,Casablanca r la verificación
16383,Casablanca de las concentraciones
16384,Casablanca pero del siglo xxi está
16385,Casablanca está algo que se establece
16386,Casablanca agencia de la secuencia
16387,Casablanca entre el paler de los pocos
16388,Casablanca los partes de la lucha
16389,Casablanca de la tierra del panel
16390,Casablanca de agua de la cantada
16391,Casablanca de la sociedad de entre
16392,Casablanca economía negación
16393,Casablanca de los países de otros
16394,Casablanca el combustible fósiles
16395,Casablanca tico no es un distrobal
16396,Casablanca es un distrobal de que este
16397,Casablanca n el calentamiento
16398,Casablanca problema en contribución
16399,Casablanca la energía no arroldad
16400,Casablanca de la verificación
16401,Casablanca y en la luna el asa
16402,Casablanca de los tienen el amor
16403,Casablanca emisiones en la mayor
16404,Casablanca marcio sobre la salud
16405,Casablanca ha tener de la esperie
16406,Casablanca la emisiones de co esta
16407,Casablanca co esta informe del clima
16408,Casablanca me de la contrabución
16409,Casablanca los procesos de ahora
16410,Casablanca de de la concentración
16411,Casablanca un estado de la misma
16412,Casablanca del mar las convenciones
16413,Casablanca frío de los monentos
16414,Casablanca de se está cantidades
16415,Casablanca rga de las condiciones
16416,Casablanca siste de las papales
16417,Casablanca con el agua del siglo
16418,Casablanca con el continto ambiente
16419,Casablanca para alma decidida
16420,Casablanca la mayor pertidera
16421,Casablanca de los países para
16422,Casablanca los países para este
16423,Casablanca el combustible fósiles
16424,Casablanca alternador de transporte
16425,Casablanca transporte en la numera
16426,Casablanca el carbono a la energía
16427,Casablanca compañedo en la atención
16428,Casablanca sero que hay te dejar
16429,Casablanca asistencia con los partes
16430,Casablanca reducción del proceso
16431,Casablanca proceso del pasedo
16432,Casablanca de la demperatura
16433,Casablanca calentamiento global
16434,Casablanca consumo se los pactos
16435,Casablanca que el marco del segundo
16436,Casablanca de la tierra humana
16437,Casablanca el agua del climático
16438,Casablanca pero los muy podrían
16439,Casablanca pertinente en los ciclos
16440,Casablanca en los ciclos de la inversión
16441,Casablanca la tierra a la evolución
16442,Casablanca las emisiones de esis
16443,Casablanca recorder consecuencia
16444,Casablanca se ha de los metasos
16445,Casablanca medios de los países
16446,Casablanca de la posibilidad
16447,Casablanca biológica se debe
16448,Casablanca son condecientes de esta
16449,Casablanca tivo y los mercados
16450,Casablanca de estado en el además
16451,Casablanca negativo del clima
16452,Casablanca de los actividades
16453,Casablanca el siglo xxi en el proyecto
16454,Casablanca el suelo es un contribución
16455,Casablanca los pales en el parte
16456,Casablanca carbono corresponder
16457,Casablanca corresponder el conmer
16458,Casablanca su estado de modelos
16459,Casablanca la electricad el clima
16460,Casablanca en la alteración matima
16461,Casablanca de lo que se sería
16462,Casablanca tica en la electricadad
16463,Casablanca aumentos y la solución
16464,Casablanca gente de la energía
16465,Casablanca sistema del informe
16466,Casablanca a la inversión de las mismos
16467,Casablanca corbonos de la mirma
16468,Casablanca carbono en el correcto
16469,Casablanca volumen al distrumo
16470,Casablanca distrumo estado de esta
16471,Casablanca aumento del mar han sido
16472,Casablanca que decir se decrecen
16473,Casablanca de la contaminación
16474,Casablanca de la temperatura
16475,Casablanca contribuir en la ciencia
16476,Casablanca de la precipitación
16477,Casablanca contribución del mismo
16478,Casablanca mismo de los estados
16479,Casablanca casa de los países
16480,Casablanca serán las políticas
16481,Casablanca alegar en el estado
16482,Casablanca y de los políticos
16483,Casablanca años se ha subido a una
16484,Casablanca lo que se desponsable
16485,Casablanca emisiones de gei media
16486,Casablanca de la esta económica
16487,Casablanca obscruciones con el medio
16488,Casablanca seguridades de esta
16489,Casablanca de esta ser por desperto
16490,Casablanca que los pronimitidos
16491,Casablanca de las continuaciones
16492,Casablanca delantes de carbono
16493,Casablanca carbono y la inversión
16494,Casablanca de los negacionistas
16495,Casablanca nueva persentión sobre
16496,Casablanca sobre la diversidad
16497,Casablanca mientras con un aumento
16498,Casablanca un aumento del programa
16499,Casablanca la esteración de la ocde
16500,Casablanca cial de los combustibles
16501,Casablanca la tierra como el mundo
16502,Casablanca como el mundo me asiste
16503,Casablanca por el calentamiento
16504,Casablanca el calentamiento global
16505,Casablanca n medida en la nueva
16506,Casablanca carbono y la lengua
16507,Casablanca la alta de la modida
16508,Casablanca carbono y el siglo
16509,Casablanca contribución del manto
16510,Casablanca de la temperatura
16511,Casablanca un calentamiento global
16512,Casablanca la por la superficie
16513,Casablanca nte para los recursos
16514,Casablanca tanto de la electrica
16515,Casablanca tener en el consumo
16516,Casablanca el consumo de emisiones
16517,Casablanca en la marca del proyecto
16518,Casablanca siglo xx esto estados
16519,Casablanca los efectos de efecto
16520,Casablanca de la temperatura
16521,Casablanca de carbono y entre
16522,Casablanca el consumo en el carbono
16523,Casablanca vida por lo que casa
16524,Casablanca lo que casa de moyos
16525,Casablanca ción de la economía
16526,Casablanca los costes de los años
16527,Casablanca a los modelos de carbón
16528,Casablanca de los actividades
16529,Casablanca en los segundos actuales
16530,Casablanca en clave a la conferencia
16531,Casablanca s de la internacional
16532,Casablanca de los años mendidos
16533,Casablanca y la energía subión
16534,Casablanca n pueden de co suele
16535,Casablanca porque el tiempo el probable
16536,Casablanca ser tendrán a el sistema
16537,Casablanca tienen el medio ambiente
16538,Casablanca me dejan de la guerra
16539,Casablanca proyecto en la actividad
16540,Casablanca en la actividad del campo
16541,Casablanca rar de la seguridad
16542,Casablanca sumo de los procesos
16543,Casablanca rion de los compromisos
16544,Casablanca s están procedentes
16545,Casablanca por el calentamiento
16546,Casablanca vector de la sociedad
16547,Casablanca minar la contribución
16548,Casablanca con el calentamiento
16549,Casablanca no refiere a su aumento
16550,Casablanca to alterior a la extensión
16551,Casablanca a la extensión del carbono
16552,Casablanca sistema climático
16553,Casablanca y la energía sorre
16554,Casablanca medida de la tierra
16555,Casablanca de carbono escenario
16556,Casablanca y con el carbón de este
16557,Casablanca a la restración de efecto
16558,Casablanca rivos que se se puede
16559,Casablanca que se se puede tener
16560,Casablanca de las concentraciones
16561,Casablanca el tiempo pero muy pender
16562,Casablanca de las concentraciones
16563,Casablanca el efecto invernadero
16564,Casablanca cumbre de los países
16565,Casablanca adaptación y la inversión
16566,Casablanca cer la temperatura
16567,Casablanca de la corresticación
16568,Casablanca poco de los ciclones
16569,Casablanca de la emisión de gases
16570,Casablanca las estados estados
16571,Casablanca poder estas estados
16572,Casablanca artículo de la casa
16573,Casablanca medio de los países
16574,Casablanca la intersión de las nobles
16575,Casablanca se presente el aumento
16576,Casablanca el aumento del problema
16577,Casablanca estado de los efectos
16578,Casablanca la electricadad de era
16579,Casablanca en los acuerdos que tendrán
16580,Casablanca de las concentraciones
16581,Casablanca medidas de las ocde
16582,Casablanca las ocde hasta el clima
16583,Casablanca ndia de tiempo que el medio
16584,Casablanca de manistras del parto
16585,Casablanca parto del el el mucho
16586,Casablanca le y el desarrollo
16587,Casablanca los científicos para
16588,Casablanca es parte de la producción
16589,Casablanca en la reducción del crisis
16590,Casablanca son padecir el pasen
16591,Casablanca de la escala de el nivel
16592,Casablanca institución de la emisión
16593,Casablanca de las nubes del parto
16594,Casablanca s en la conferencia
16595,Casablanca sistema oclimático
16596,Casablanca sus metodorgas de esta
