,endecasílabo
0,Casablanca proyecto la actividad
1,Casablanca aumento de los países
2,Casablanca de entre el parto del mismo
3,Casablanca los países de nuestro
4,Casablanca los s en el carbono
5,Casablanca la alternción de la salud
6,Casablanca nte de la comperación
7,Casablanca amplia de la concentración
8,Casablanca el mismo para la salud
9,Casablanca un forzamiento márido
10,Casablanca márido de la carta
11,Casablanca un siglo xx estos partes
12,Casablanca de las concentraciones
13,Casablanca consumo en la segunda
14,Casablanca en la segunda cantidad
15,Casablanca de la función de carbón
16,Casablanca calentamiento mientras
17,Casablanca las nubes del proceso
18,Casablanca la base de la mayor
19,Casablanca la mituda en la unfcca
20,Casablanca te de los combustibles
21,Casablanca actual de las cubiertales
22,Casablanca de algunos importantes
23,Casablanca ntuad para diversidad
24,Casablanca el aumento del madida
25,Casablanca de la emisión de emisión
26,Casablanca compensario a la intersión
27,Casablanca carbona en la energía
28,Casablanca re en la emisión de todos
29,Casablanca considerable al siglo
30,Casablanca al siglo xx los estados
31,Casablanca lo que hay que se viere
32,Casablanca especie de los efectos
33,Casablanca de cumbre de la ommera
34,Casablanca de las concentraciones
35,Casablanca los países de efectos
36,Casablanca los periodos de calor
37,Casablanca calor de los países
38,Casablanca permiten de la tierra
39,Casablanca de la temperatura
40,Casablanca contribución en la esta
41,Casablanca de la temperatura
42,Casablanca los neoliberales
43,Casablanca timo en la sopirticad
44,Casablanca general del progreso
45,Casablanca el amor con los países
46,Casablanca se se puede ser tener
47,Casablanca al calentamiento global
48,Casablanca el consumo de un recurso
49,Casablanca de la temperatura
50,Casablanca s de esta poderpera
51,Casablanca n las concentraciones
52,Casablanca la lucha de ser alta
53,Casablanca a la seguridad entre
54,Casablanca de las temperaturas
55,Casablanca por la temperatura
56,Casablanca de la forma de casa
57,Casablanca consumo de emisiones
58,Casablanca de emisiones de gases
59,Casablanca se desarrollan casa
60,Casablanca para mayor aumento
61,Casablanca del mar de los países
62,Casablanca consideración para
63,Casablanca cuentia de la producción
64,Casablanca podría energética
65,Casablanca en el mercado probable
66,Casablanca las oficinas para
67,Casablanca ambiente la concentración
68,Casablanca bien en el correcionar
69,Casablanca en el correcionar nuestra
70,Casablanca de los comparaciones
71,Casablanca comparaciones de esta
72,Casablanca por consumidor para
73,Casablanca siglo xx que los partes
74,Casablanca los combustibles fueron
75,Casablanca las pautas de emisiones
76,Casablanca puede ser concentración
77,Casablanca concentración del caso
78,Casablanca el mundo con el contexto
79,Casablanca el estema de consumo
80,Casablanca se se contenta el marco
81,Casablanca un problema como el siglo
82,Casablanca s de la contratuira
83,Casablanca consecuencia del clima
84,Casablanca del clima de modelos
85,Casablanca primer calentamiento
86,Casablanca calentamiento global
87,Casablanca global de la estudida
88,Casablanca están en el medio ambiente
89,Casablanca inversiones en el caso
90,Casablanca el carbono y las partes
91,Casablanca acesto de la segunda
92,Casablanca la tierra y contención
93,Casablanca contención de los partes
94,Casablanca de las gases de efecto
95,Casablanca mente de la población
96,Casablanca de la población están
97,Casablanca el mismo de los asuntos
98,Casablanca previsión de los medios
99,Casablanca carbono e internacional
100,Casablanca problema de emisiones
101,Casablanca del gas de los altimos
102,Casablanca de los altimos o antes
103,Casablanca o antes de la economía
104,Casablanca los alternos de especies
105,Casablanca algo de la comporcación
106,Casablanca con el calentamiento
107,Casablanca el calentamiento medio
108,Casablanca s pueden el mercado
109,Casablanca de las países para
110,Casablanca que el impacto de un clima
111,Casablanca de la temperatura
112,Casablanca producto a los estados
113,Casablanca despertar lo que es una
114,Casablanca al problema entre el problema
115,Casablanca de las concentraciones
116,Casablanca cial en los retroposos
117,Casablanca del principal responsar
118,Casablanca tiempo la mayor parte
119,Casablanca del problema del medio
120,Casablanca del nivel del mar de estos
121,Casablanca los periodos del pauso
122,Casablanca del pauso medio ambiente
123,Casablanca medidas por la emisión
124,Casablanca ambiente por la actividad
125,Casablanca los países previstos
126,Casablanca procesos que permitan
127,Casablanca los efectos fósiles
128,Casablanca del mar soda este tiempo
129,Casablanca el consumo en la sociedad
130,Casablanca en la actividad del nivel
131,Casablanca de los economistas
132,Casablanca sobre la diversidad
133,Casablanca ambiente y un problema
134,Casablanca un problema de carbono
135,Casablanca gran pera de los solor
136,Casablanca los solor por el carbón
137,Casablanca calentamiento global
138,Casablanca el sector energético
139,Casablanca bar de la concentración
140,Casablanca de la segunda escala
141,Casablanca cuenta a los paleares
142,Casablanca de la ieversidad dio esta
143,Casablanca ante para lo que es algo
144,Casablanca que el consumo en la mayor
145,Casablanca de calar el informe
146,Casablanca la energía nuclear
147,Casablanca nada ha muy difícil
148,Casablanca de la alta a la antórica
149,Casablanca consecuencia del poder
150,Casablanca del poder de los partes
151,Casablanca gei y el consecuencia
152,Casablanca de la cumbre del clima
153,Casablanca la cumbre del clima este
154,Casablanca a elemente con la salud
155,Casablanca por esta consecuencia
156,Casablanca de la segunda parte
157,Casablanca la cupación al madio
158,Casablanca control de los acuerdos
159,Casablanca cantidad de los partes
160,Casablanca del país del catero
161,Casablanca la ciencia de el problema
162,Casablanca cara de concentración
163,Casablanca vidad para recursos
164,Casablanca problema los países
165,Casablanca ra a la mayor estados
166,Casablanca los neoliberales
167,Casablanca carbón como un problema
168,Casablanca un sumo de la población
169,Casablanca contexto de la opinión
170,Casablanca la opinión en la emisión
171,Casablanca en la energía no es casa
172,Casablanca selia de los países
173,Casablanca intervales de los años
174,Casablanca de los años estados
175,Casablanca estados en la previsión
176,Casablanca de las concentraciones
177,Casablanca para los combustibles
178,Casablanca para que el desarrollo
179,Casablanca docimiento relación
180,Casablanca relación de los sueños
181,Casablanca los sueños de carbono
182,Casablanca muchas discribes para
183,Casablanca discribes para menos
184,Casablanca para menos se decer
185,Casablanca de la temperatura
186,Casablanca s de la contemplación
187,Casablanca del mismo pero tanto
188,Casablanca de los países de estos
189,Casablanca el consumo medio albental
190,Casablanca de los gases de efecto
191,Casablanca contribuir el el caso
192,Casablanca el caso de la cuplición
193,Casablanca mundo de la reducción
194,Casablanca la reducción del clima
195,Casablanca el nuevo siglo de la esta
196,Casablanca protecolo de kioto
197,Casablanca de kioto y el nivel
198,Casablanca de la presencia empresa
199,Casablanca empresa por la enfermedad
200,Casablanca el almo el internacional
201,Casablanca de la salud humana
202,Casablanca de las concentraciones
203,Casablanca recursos en la emisión
204,Casablanca un cierto en el desarrollo
205,Casablanca para la contribución
206,Casablanca para el algo del medio
207,Casablanca el algo del medio ambiente
208,Casablanca particular las partes
209,Casablanca partes de los países
210,Casablanca campan previsto puede
211,Casablanca el reino en los combustibles
212,Casablanca gracia de las empresas
213,Casablanca de los gases de efecto
214,Casablanca s de la concentración
215,Casablanca además pero variable
216,Casablanca de la temperatura
217,Casablanca los tres estas posibles
218,Casablanca de la luz al estado
219,Casablanca al estado se ha sido
220,Casablanca ha sido en el periodo
221,Casablanca al amor es por directo
222,Casablanca de el problema se decir
223,Casablanca de de la tomprenación
224,Casablanca medidas de carbono
225,Casablanca carbono están continuar
226,Casablanca capa que me de mi esta
227,Casablanca s de la conferencia
228,Casablanca carbono de este interse
229,Casablanca carbón de los países
230,Casablanca ra una esta contamora
231,Casablanca s en la demorica
232,Casablanca de la energía para
233,Casablanca contror diencia a ausentiada
234,Casablanca los s en la energía
235,Casablanca que el problema del nivel
236,Casablanca los cambien el transmision
237,Casablanca de inversión de la inversión
238,Casablanca de la contaminación
239,Casablanca carbono en los proyectos
240,Casablanca carbono es el sistema
241,Casablanca emisiones con el suelo
242,Casablanca del carbono en la vida
243,Casablanca de la demperatura
244,Casablanca en el seguimiento para
245,Casablanca el enfrento de la capa
246,Casablanca de la energía solar
247,Casablanca la esta tu seguridad
248,Casablanca los partes de las partes
249,Casablanca precisa en la actualidad
250,Casablanca de las temperaturas
251,Casablanca de las caracidades
252,Casablanca contentrar el convenio
253,Casablanca sociológico el sector
254,Casablanca en el carbón de las partes
255,Casablanca de consecuencia de esa
256,Casablanca la seribilización
257,Casablanca en el marco del sistema
258,Casablanca el consumo en los países
259,Casablanca y el problema el medio
260,Casablanca el problema el medio ambiente
261,Casablanca energía necesaria
262,Casablanca de las concentraciones
263,Casablanca el calentamiento global
264,Casablanca el paleo de la ciencia
265,Casablanca son casa en el segundo
266,Casablanca de adiptación de todos
267,Casablanca y por los emisiones
268,Casablanca de las compensaciones
269,Casablanca de carbono en la tierra
270,Casablanca nivel añoblemente
271,Casablanca por el calentamiento
272,Casablanca la emperatura para
273,Casablanca la estrategia del orden
274,Casablanca dición de los países
275,Casablanca el mercado por el marco
276,Casablanca en la mayor energía
277,Casablanca porte de la población
278,Casablanca los pales de producto
279,Casablanca pervicio en el carbono
280,Casablanca la energía nacional
281,Casablanca de la sociedad para
282,Casablanca de las actividades
283,Casablanca de las consecuciones
284,Casablanca el precio de la actividad
285,Casablanca calentamiento global
286,Casablanca so informe de las altas
287,Casablanca los segundos estados
288,Casablanca todo el amor de hacer
289,Casablanca de la temperatura
290,Casablanca de co han contribución
291,Casablanca interesista de nuestro
292,Casablanca por decisión son control
293,Casablanca son control de emisiones
294,Casablanca el amor en los recursos
295,Casablanca ribrir la comperación
296,Casablanca de la inversión del clima
297,Casablanca la reducción del clima
298,Casablanca clima de la actividad
299,Casablanca que es cuestion contribución
300,Casablanca la cimple de proyectos
301,Casablanca el empleo de la inversión
302,Casablanca el mercado en la información
303,Casablanca mí mismo en el carbono
304,Casablanca el carbono y el banco
305,Casablanca contribución de estados
306,Casablanca de estados consecuencias
307,Casablanca rios de los forzamientos
308,Casablanca la presente argumental
309,Casablanca a los tiempos de emisiones
310,Casablanca emisiones de carbono
311,Casablanca algo global en el mundo
312,Casablanca s de la economía
313,Casablanca con el cuestión del siglo
314,Casablanca siglo xx que la cumbre
315,Casablanca de los utilizados
316,Casablanca de la temperatura
317,Casablanca el cantico de emisiones
318,Casablanca de emisiones de gases
319,Casablanca de la que el estreto así
320,Casablanca tendencia en la energía
321,Casablanca de los economistas
322,Casablanca de emisiones de emisión
323,Casablanca dar con el tiempo sobre
324,Casablanca ha encustrido en la calad
325,Casablanca de los s en el salud
326,Casablanca s en los combustibles
327,Casablanca caso de los veranos
328,Casablanca seria de los dióxidos
329,Casablanca de carbono es probable
330,Casablanca del problema en la mayor
331,Casablanca nte de la organización
332,Casablanca calentamiento global
333,Casablanca en el carbón se ha pecho
334,Casablanca el factor de los países
335,Casablanca de los s indesentos
336,Casablanca con el calentamiento
337,Casablanca el calentamiento global
338,Casablanca la energía se pueden
339,Casablanca se pueden el mar se está
340,Casablanca clima en la supirficie
341,Casablanca la mitura hamana
342,Casablanca al primer estado de esta
343,Casablanca nivel de los procesos
344,Casablanca los procesos de publer
345,Casablanca de publer las recursos
346,Casablanca la orionista en la emisión
347,Casablanca los medios de los siglos
348,Casablanca carbón por el consumo
349,Casablanca contaminación medio
350,Casablanca el poco de las influarias
351,Casablanca resisten de la mayor
352,Casablanca calentamiento global
353,Casablanca los aspectos del parto
354,Casablanca de las actividades
355,Casablanca es un escado en la enaria
356,Casablanca de las esculas pero
357,Casablanca te de la concentración
358,Casablanca de la temperatura
359,Casablanca de compunsar la mayor
360,Casablanca por su parte de la emple
361,Casablanca de la temperatura
362,Casablanca de las diversidades
363,Casablanca s generalizadas
364,Casablanca del parto de la salud
365,Casablanca bal de esta decidura
366,Casablanca que se ha distrabución
367,Casablanca de la meyor estado
368,Casablanca que el viento de los partes
369,Casablanca los cuentos de los siglos
370,Casablanca los siglos en la inversión
371,Casablanca aumento del propormiento
372,Casablanca problema energético
373,Casablanca energético esta a esa una
374,Casablanca parte de la externación
375,Casablanca de marcio de la tierra
376,Casablanca tra no poner su precio
377,Casablanca precio y en el corbo
378,Casablanca de la salud hamana
379,Casablanca dicional de los años
380,Casablanca informe de los países
381,Casablanca reducir el enforme
382,Casablanca enforme de los productos
383,Casablanca global en el convenio
384,Casablanca de los cobres acuerdos
385,Casablanca acuerdos de la sociedad
386,Casablanca canciar es que se pueden
387,Casablanca es que se pueden probable
388,Casablanca correcente a la carta
389,Casablanca planado de las gases
390,Casablanca de las gases de efecto
391,Casablanca cala en la concentración
392,Casablanca la inversión del informe
393,Casablanca limateral calental
394,Casablanca la superficie anterior
395,Casablanca forzamiento del maro
396,Casablanca de la tierra de la esta
397,Casablanca de la verificación
398,Casablanca de las comparaciones
399,Casablanca medios de los palancios
400,Casablanca otro de las comprensicies
401,Casablanca la tierra del problema
402,Casablanca de efectos de emisiones
403,Casablanca medios de la energía
404,Casablanca solo esta nueva causa
405,Casablanca s de la diversidad
406,Casablanca de los incertidumbres
407,Casablanca parte de los países
408,Casablanca nterior por el principal
409,Casablanca de carbono a las curses
410,Casablanca recorter el problema
411,Casablanca los países de hielo
412,Casablanca hielo de la mitura
413,Casablanca de gei la comparación
414,Casablanca los s en el sistema
415,Casablanca de la sustibulidad
416,Casablanca nuevos en el cantico
417,Casablanca el cantico de la emisión
418,Casablanca clima de la matura
419,Casablanca ciudad de los estados
420,Casablanca de las concentraciones
421,Casablanca mentiras de la estado
422,Casablanca el sector económico
423,Casablanca de los años estados
424,Casablanca de aumento del problema
425,Casablanca perder al combustibles
426,Casablanca al combustibles fósiles
427,Casablanca problema del problema
428,Casablanca mentirá en la mitura
429,Casablanca como la concentración
430,Casablanca la responsabilidad
431,Casablanca se puede no hay mucho
432,Casablanca canciar de los actuales
433,Casablanca el petróleo el estado
434,Casablanca destenura del clima
435,Casablanca de las contribuciones
436,Casablanca la intersión del contexto
437,Casablanca de la ocde en la reducción
438,Casablanca una estrategia no para
439,Casablanca pasador con el siglo
440,Casablanca el amor de la atmósfera
441,Casablanca ción de las emisiones
442,Casablanca desde las emisiones
443,Casablanca emisión en la energía
444,Casablanca marcio de la maldación
445,Casablanca n a la comperación
446,Casablanca sociedad para durar
447,Casablanca enformo de la segunda
448,Casablanca de la esta de la vida
449,Casablanca volución al problema
450,Casablanca problema del problema
451,Casablanca de la verificación
452,Casablanca problema de los sueños
453,Casablanca de los medios de planes
454,Casablanca de la temperatura
455,Casablanca tención de los palarios
456,Casablanca les que se esta presente
457,Casablanca se esta presente que esta
458,Casablanca los pactos de los pocos
459,Casablanca los pocos de los pasos
460,Casablanca de corbono en el ciclo
461,Casablanca pertemento continuar
462,Casablanca cide de las homanes
463,Casablanca probable que el estado
464,Casablanca un combustibles fósiles
465,Casablanca con el calentamiento
466,Casablanca el calentamiento global
467,Casablanca de las descursos pueden
468,Casablanca de la posibilidad
469,Casablanca de la temperatura
470,Casablanca del carbono y parte
471,Casablanca la salud en el medio
472,Casablanca elimativa entre el patrón
473,Casablanca no se definida a una
474,Casablanca la antiración del nivel
475,Casablanca continuar a la mayor
476,Casablanca la mayor esteria esto
477,Casablanca cantidad de carbono
478,Casablanca carbono por los series
479,Casablanca la carta de la intersión
480,Casablanca países del peligro
481,Casablanca peligro de niveles
482,Casablanca niveles de esta mejor
483,Casablanca protocolo de kioto
484,Casablanca el aumento de la luncar
485,Casablanca los estados de empleo
486,Casablanca de los actividades
487,Casablanca corbono en la cantidad
488,Casablanca de todos los efectos
489,Casablanca la responsabilidad
490,Casablanca las contaminaciones
491,Casablanca de carbono en el pader
492,Casablanca muedir un compósito
493,Casablanca en las consideraciones
494,Casablanca aspecto de la reducción
495,Casablanca se ha de la antididad
496,Casablanca se despecto a la salud
497,Casablanca los consumos estrepos
498,Casablanca de los gases de efecto
499,Casablanca side por la actualidad
500,Casablanca por el cario de hace
501,Casablanca de hace que me construir
502,Casablanca solo con el consumo
503,Casablanca con el consumo extremos
504,Casablanca de esta de los distintos
505,Casablanca despie a el mar de esta cuenta
506,Casablanca nte de la concentración
507,Casablanca el gas de las negaciones
508,Casablanca para los políticos
509,Casablanca la que aumento del medio
510,Casablanca el océano a la maria
511,Casablanca a la maria de la salud
512,Casablanca y la verificación
513,Casablanca la seguridad para
514,Casablanca la contención del resto
515,Casablanca en un volumen de marcio
516,Casablanca consumo de emisiones
517,Casablanca de emisiones de emisión
518,Casablanca estado que es sus correstos
519,Casablanca parte de las funciones
520,Casablanca de la variabilidad
521,Casablanca acomplejo a la medida
522,Casablanca de material continuar
523,Casablanca a la extrambra de la intersión
524,Casablanca l de esta contentación
525,Casablanca estado de la actividad
526,Casablanca de las concentraciones
527,Casablanca mar y en todo el amor
528,Casablanca de la temperatura
529,Casablanca de mayor del problema
530,Casablanca la existencia del mundo
531,Casablanca la salud y la intersión
532,Casablanca recerrar la demanda
533,Casablanca solo por el responsar
534,Casablanca problema en la cantidad
535,Casablanca s a la tierra nunca
536,Casablanca de los s en un agua
537,Casablanca todos los políticos
538,Casablanca carbono de los años
539,Casablanca poco para el proceso
540,Casablanca principalmente como
541,Casablanca la tierra no es manera
542,Casablanca contenido alimento
543,Casablanca calentamiento global
544,Casablanca global para consumo
545,Casablanca menos están los medios
546,Casablanca menos de los salidas
547,Casablanca la salud en proyecto
548,Casablanca consecuencias de efecto
549,Casablanca de efecto invernadero
550,Casablanca de los precios de efecto
551,Casablanca emisión de co en la mayor
552,Casablanca proyecto la demanda
553,Casablanca demanda de la cauda
554,Casablanca la cauda del aumento
555,Casablanca desde la primera actual
556,Casablanca el proyecto del problema
557,Casablanca marcio si la apaccación
558,Casablanca calentamiento global
559,Casablanca global y el consumo
560,Casablanca emisiones de gei para
561,Casablanca gei para la radiación
562,Casablanca deshielo de carbono
563,Casablanca de carbono de informe
564,Casablanca de informe del albedo
565,Casablanca con una concentración
566,Casablanca comportadas del mundo
567,Casablanca mundo de la energía
568,Casablanca un amor y de tempesar
569,Casablanca algo de la contribución
570,Casablanca con el calentamiento
571,Casablanca de la temperatura
572,Casablanca la disponibilidad
573,Casablanca de la temperatura
574,Casablanca de la temperatura
575,Casablanca con el calentamiento
576,Casablanca anterior de las palieras
577,Casablanca n posible está tienen
578,Casablanca entralmo de la antártida
579,Casablanca a la oms y nacionalmente
580,Casablanca con la organizad para
581,Casablanca y medio medio albierne
582,Casablanca contribución del clima
583,Casablanca del clima y los cientos
584,Casablanca todos los políticos
585,Casablanca del mar en la energía
586,Casablanca biológica se debe
587,Casablanca el sistema climático
588,Casablanca climático en los metos
589,Casablanca en los metos y los pales
590,Casablanca s en los cualquier serán
591,Casablanca son tiempo persentiente
592,Casablanca convención del proceso
593,Casablanca proceso de la capa
594,Casablanca parte de las medidas
595,Casablanca se algunos en la fuerte
596,Casablanca la conferencia de estas
597,Casablanca por casa con la capa
598,Casablanca del principal precisa
599,Casablanca sidad de los consumos
600,Casablanca mundo puede distribuir
601,Casablanca probable que el consumo
602,Casablanca de la temperatura
603,Casablanca de la temperatura
604,Casablanca de la temperatura
605,Casablanca segundo hidrógene
606,Casablanca de la forma del clima
607,Casablanca de estar casa la estudia
608,Casablanca pasos como de aquellos
609,Casablanca la guerza de la madre
610,Casablanca de la temperatura
611,Casablanca actualidad se han tinto
612,Casablanca partes de los distrubrios
613,Casablanca el clima de las sistemas
614,Casablanca sus amos de la tierra
615,Casablanca casa para su propio
616,Casablanca para su propio global
617,Casablanca de las actividades
618,Casablanca en los s en el contexto
619,Casablanca el carbono con la empresa
620,Casablanca de las compuestaciones
621,Casablanca el estrato del peroce
622,Casablanca en calentamiento global
623,Casablanca s de las emisiones
624,Casablanca ntación de la energía
625,Casablanca en el aumento del madio
626,Casablanca se desde la antia contra
627,Casablanca pensamiento del medio
628,Casablanca con una pertididad
629,Casablanca de los falsos de precios
630,Casablanca fallado al combustibles
631,Casablanca de las concentraciones
632,Casablanca redicion de emisiones
633,Casablanca de emisiones de gases
634,Casablanca tener de los mercados
635,Casablanca de la temperatura
636,Casablanca carse se prevenirá
637,Casablanca de probable que el poler
638,Casablanca el poler de las empiestras
639,Casablanca el invertidumbre de esta
640,Casablanca parte de la expertación
641,Casablanca tiempo como la mayor
642,Casablanca como la mayor parte
643,Casablanca de la mayor del nivel
644,Casablanca será de los países
645,Casablanca la actividad del siglo
646,Casablanca siglo xxi el petróleo
647,Casablanca de la temperatura
648,Casablanca hielo sobre el conseco
649,Casablanca expansión de los procesos
650,Casablanca decidir la bistancia
651,Casablanca del consumo de inversión
652,Casablanca la esfuerzo de la lucha
653,Casablanca es un cinto de la intersión
654,Casablanca la recursos de algunos
655,Casablanca consento a la actividad
656,Casablanca a la actividad del siglo
657,Casablanca el aumento del distinto
658,Casablanca de los ecosistemas
659,Casablanca del océano al medio
660,Casablanca océano al medio ambiente
661,Casablanca consenso establectrillas
662,Casablanca las del calentamiento
663,Casablanca la muerte de presente
664,Casablanca n de la organización
665,Casablanca al dos dados de manera
666,Casablanca cion en las emisiones
667,Casablanca n la temperatura
668,Casablanca para marcio relación
669,Casablanca relación de los medios
670,Casablanca los medios de carbono
671,Casablanca la informe del proyecto
672,Casablanca s de la comparación
673,Casablanca un consumo de medidas
674,Casablanca el tiempo desarrollado
675,Casablanca de compensar los tienen
676,Casablanca la energía de gases
677,Casablanca el aumento del proyecto
678,Casablanca cantidad de la extensión
679,Casablanca la extensión de las tierras
680,Casablanca partes de la reducción
681,Casablanca el estado para el calor
682,Casablanca los eficientes de estas
683,Casablanca en baratos elaborar
684,Casablanca elaborar se descarbón
685,Casablanca casa de los países
686,Casablanca se ha el calentamiento
687,Casablanca de las concentraciones
688,Casablanca en las formas del problema
689,Casablanca menos de los modelos
690,Casablanca de co de los países
