,endecasílabo
10720,Casablanca contribución del calor
10721,Casablanca sanor en el carbono
10722,Casablanca de los corresponderán
10723,Casablanca de los s en el carbón
10724,Casablanca tratado de los años
10725,Casablanca por de los importantes
10726,Casablanca del clima de la parte
10727,Casablanca salud y al consejo
10728,Casablanca al consejo se reducir
10729,Casablanca se reducir la presión
10730,Casablanca proceso de los gases
10731,Casablanca el medio ambiente del clima
10732,Casablanca y de la concentración
10733,Casablanca de carbono en los nubes
10734,Casablanca el calentamiento global
10735,Casablanca de la afecta incernacion
10736,Casablanca corbo en la casa de esta
10737,Casablanca en la casa de esta nueva
10738,Casablanca los electrios son medios
10739,Casablanca electrios son medios sobre
10740,Casablanca sentida a la producción
10741,Casablanca principal establecir
10742,Casablanca tida en la contribución
10743,Casablanca s de un buen esto que amor
10744,Casablanca gas de los pides de agua
10745,Casablanca los polos de carbono
10746,Casablanca que en la temperatura
10747,Casablanca eras esta es la calidad
10748,Casablanca limación de los posos
10749,Casablanca los posos sin embargo
10750,Casablanca caso de la sociedad
10751,Casablanca el protocolo de kioto
10752,Casablanca caso de la energía
10753,Casablanca un segundo medio ambiente
10754,Casablanca esta lidró en la energía
10755,Casablanca diferente hay que estar
10756,Casablanca que estar el permanado
10757,Casablanca nuclear de la carta
10758,Casablanca la carta de un aumento
10759,Casablanca emisiones de gei seas
10760,Casablanca dicional del carbono
10761,Casablanca las consideraciones
10762,Casablanca la presente del clima
10763,Casablanca clima de los carbonos
10764,Casablanca los carbonos de gases
10765,Casablanca de la temperatura
10766,Casablanca mundial de la reducción
10767,Casablanca en el carbono en el pobre
10768,Casablanca de la respuesta también
10769,Casablanca clima me contribuye
10770,Casablanca combustibles los nubes
10771,Casablanca ha anario y el medio
10772,Casablanca el resto de los ciudades
10773,Casablanca por el calentamiento
10774,Casablanca faso de la intensidad
10775,Casablanca clima de los países
10776,Casablanca rio de las deficientes
10777,Casablanca del piso de la tierra
10778,Casablanca la tierra y la emisión
10779,Casablanca parte de los países
10780,Casablanca al calentamiento global
10781,Casablanca al algo con el futuro
10782,Casablanca los países darisos
10783,Casablanca darisos en la carte
10784,Casablanca la carte de emisiones
10785,Casablanca la tierra de esta siglo
10786,Casablanca de este tie en la europea
10787,Casablanca siglo xx e incrementos
10788,Casablanca en el destino de marcio
10789,Casablanca se demanda en el medio
10790,Casablanca la miglo del albedo
10791,Casablanca una de la lado mucho
10792,Casablanca caso mas disponible
10793,Casablanca el calentamiento global
10794,Casablanca de la ocde con el marco
10795,Casablanca la estructura en el medio
10796,Casablanca estado por el proyecto
10797,Casablanca este por lo que direntes
10798,Casablanca de la sequía como
10799,Casablanca la sequía como estas
10800,Casablanca subida de la escala
10801,Casablanca la escala de la salud
10802,Casablanca adioto de los consumos
10803,Casablanca contenida en la salud
10804,Casablanca así no es el desarrollo
10805,Casablanca ro de la concentración
10806,Casablanca el entre la reducida
10807,Casablanca puede contra una demás
10808,Casablanca despecto a la atmósfera
10809,Casablanca el calentamiento global
10810,Casablanca la humanidad para
10811,Casablanca mismo de los países
10812,Casablanca de un posto de la salud
10813,Casablanca de la temperatura
10814,Casablanca la aplicación de estados
10815,Casablanca que la alta comparación
10816,Casablanca como la economía
10817,Casablanca de los años modelos
10818,Casablanca n de la capacidad
10819,Casablanca el carbono y las tierras
10820,Casablanca la mitura medida
10821,Casablanca los partes de emisiones
10822,Casablanca de emisiones de caso
10823,Casablanca inerporación del nivel
10824,Casablanca si se debe despecto
10825,Casablanca observado particular
10826,Casablanca ra alera que incremento
10827,Casablanca el estado de la inversión
10828,Casablanca sos partes de su pora
10829,Casablanca mis de estas de los mercos
10830,Casablanca combustible fósiles
10831,Casablanca son medios de los medios
10832,Casablanca la bioda de las partes
10833,Casablanca océanos y la oriente
10834,Casablanca dición de la sociedad
10835,Casablanca las pautas de emisiones
10836,Casablanca de las tamperaturas
10837,Casablanca s de la comperación
10838,Casablanca parto de las palibres
10839,Casablanca en el problema de hielo
10840,Casablanca vocuntar el carbono
10841,Casablanca carbono así son la esta
10842,Casablanca la estado de la virta
10843,Casablanca de carbono al contexto
10844,Casablanca muy podría del clima
10845,Casablanca clima de los países
10846,Casablanca final de la subida
10847,Casablanca de la lugar los muestras
10848,Casablanca de las concentraciones
10849,Casablanca intervarán del problema
10850,Casablanca del problema del patrón
10851,Casablanca los países de algunos
10852,Casablanca algunos en el consumo
10853,Casablanca estados de los procesos
10854,Casablanca verificar la causad
10855,Casablanca causad medio más amplia
10856,Casablanca de las pronimicadas
10857,Casablanca la solicificación
10858,Casablanca combustibles fósiles
10859,Casablanca el carbón en la alteración
10860,Casablanca la atmósfera se ha encuds
10861,Casablanca co de la diversidad
10862,Casablanca alteración del proceso
10863,Casablanca problema en la energía
10864,Casablanca la energía en el siglo
10865,Casablanca emisión de co en el precio
10866,Casablanca de la emisión de inversión
10867,Casablanca ra mantiente dios de esta
10868,Casablanca dios de esta primer parte
10869,Casablanca carbono a los contintos
10870,Casablanca unfloces de los consensos
10871,Casablanca ra la cuerpa general
10872,Casablanca de emisiones de gases
10873,Casablanca la causa de la tierra
10874,Casablanca causa de la tierra algo
10875,Casablanca la tierra algo de la esta
10876,Casablanca son menimizaciones
10877,Casablanca n el calentamiento
10878,Casablanca la energía nuclear
10879,Casablanca pator de la actividad
10880,Casablanca la salud y la salud
10881,Casablanca la salud de la inversión
10882,Casablanca la tierra de los vecos
10883,Casablanca la población del precio
10884,Casablanca ralo de la conciancia
10885,Casablanca combustibles fósiles
10886,Casablanca de la emisión de gases
10887,Casablanca el proyecto de los pales
10888,Casablanca del gruado es un consumo
10889,Casablanca contaminacion mayor
10890,Casablanca la inversión de carbono
10891,Casablanca cambia de la actividad
10892,Casablanca la concentración de esta
10893,Casablanca algo más de los países
10894,Casablanca y por el escenario
10895,Casablanca nivel de la energía
10896,Casablanca con un coternamiento
10897,Casablanca mercados de carbono
10898,Casablanca de los intervaránes
10899,Casablanca para la contribución
10900,Casablanca lo que esta alcanza la alta
10901,Casablanca el carbón en la actividad
10902,Casablanca emisiones de co para
10903,Casablanca con el medio habría
10904,Casablanca para esta de la mayor
10905,Casablanca esta de la mayor parte
10906,Casablanca sentidad de la casa
10907,Casablanca se desarrollan a una
10908,Casablanca calentamiento global
10909,Casablanca las puertes de su parte
10910,Casablanca proyecto de la inuncia
10911,Casablanca contra la diversidad
10912,Casablanca por lo que es el aumento
10913,Casablanca de la temperatura
10914,Casablanca extremos dificultades
10915,Casablanca dificultades para
10916,Casablanca del actual son modelos
10917,Casablanca presenta energética
10918,Casablanca la agua de la actualidad
10919,Casablanca problema de consumo
10920,Casablanca marcio de los medidas
10921,Casablanca el sistema climático
10922,Casablanca los países presentes
10923,Casablanca de los gases de efecto
10924,Casablanca para encipitucionas
10925,Casablanca esta energía nacional
10926,Casablanca atmósfera de carbono
10927,Casablanca de la tierra nacional
10928,Casablanca las precipitaciones
10929,Casablanca dición de la subida
10930,Casablanca el ella de las recursos
10931,Casablanca nidera muerte al rismo
10932,Casablanca tra como se ha sido
10933,Casablanca sistema entre las tierras
10934,Casablanca que la energía para
10935,Casablanca el sector energético
10936,Casablanca recido en la atmósfera
10937,Casablanca albedo de la sociedad
10938,Casablanca desarrollados de acción
10939,Casablanca biológica y la otra
10940,Casablanca menos de los transportes
10941,Casablanca medios de la matada
10942,Casablanca nte estados intersectos
10943,Casablanca cial de las cantidades
10944,Casablanca de las actividades
10945,Casablanca actividades de enfiante
10946,Casablanca ambicación de inversiones
10947,Casablanca border con tu señor!
10948,Casablanca con tu señor! tengo
10949,Casablanca de la verificación
10950,Casablanca por la temperatura
10951,Casablanca la mayor elementa
10952,Casablanca para derivar a una
10953,Casablanca derivar a una mayor
10954,Casablanca pertido en la energía
10955,Casablanca en la energía nacional
10956,Casablanca de la temperatura
10957,Casablanca aumento del mantenido
10958,Casablanca medidas reelezas
10959,Casablanca la subida del siglo
10960,Casablanca de las incertidumbres
10961,Casablanca a la expansión del proyecto
10962,Casablanca consumo internacional
10963,Casablanca internacional del mismo
10964,Casablanca la estrategia del uso
10965,Casablanca uso de la concentración
10966,Casablanca gual de la seguridad
10967,Casablanca medidas de actividad
10968,Casablanca carbono de la poiertia
10969,Casablanca de la poiertia de tiempo
10970,Casablanca de las poderciaciones
10971,Casablanca nivel del mar en casa
10972,Casablanca del futuro en la intersión
10973,Casablanca de alta en la actualización
10974,Casablanca países por el siglo
10975,Casablanca a la segunda esteración
10976,Casablanca nte de la concentración
10977,Casablanca de la temperatura
10978,Casablanca la emisión de carbono
10979,Casablanca cambiar en las medidas
10980,Casablanca la de los diferentes
10981,Casablanca al desarrollo sontrible
10982,Casablanca de la temperatura
10983,Casablanca la lado en la pristeza
10984,Casablanca consumo de carbono
10985,Casablanca la inversión de los pasos
10986,Casablanca carbón de la población
10987,Casablanca la salud y la inversión
10988,Casablanca apancido de los siglos
10989,Casablanca lización de la casa
10990,Casablanca lo que me dener esta
10991,Casablanca disponible astos partes
10992,Casablanca calentamiento global
10993,Casablanca de consumo precisar
10994,Casablanca el punto de la cumplica
10995,Casablanca el calentamiento global
10996,Casablanca que debe las estados
10997,Casablanca n esta de ser parte
10998,Casablanca labacios de la inversión
10999,Casablanca el concentracionimiento
11000,Casablanca de los países partes
11001,Casablanca con el colaborado
11002,Casablanca energía son mediante
11003,Casablanca de la energía se esta
11004,Casablanca estados así va interse
11005,Casablanca el agua de los procesos
11006,Casablanca gas y la estado para
11007,Casablanca con respuesta a los hombres
11008,Casablanca a los hombres a la emisión
11009,Casablanca del clima en los países
11010,Casablanca para la mayoría
11011,Casablanca de los dos desarrollos
11012,Casablanca este una de la segunda
11013,Casablanca el mercado de las campos
11014,Casablanca los partes de los años
11015,Casablanca la sociedad ha sido
11016,Casablanca de las amplicaciones
11017,Casablanca los muestras de los glaces
11018,Casablanca con el sustendrio que está
11019,Casablanca la contampo en la mayor
11020,Casablanca las partes de carbono
11021,Casablanca la copida de tanto
11022,Casablanca argumento de la emisión
11023,Casablanca su casa de un contexto
11024,Casablanca calentamiento global
11025,Casablanca de lo que la actividad
11026,Casablanca de los ecosistemas
11027,Casablanca climático en el pico
11028,Casablanca verificación sobre
11029,Casablanca sobre las eficiencias
11030,Casablanca cia y la política
11031,Casablanca al parto de la eficiente
11032,Casablanca para se será la alta
11033,Casablanca se será la alta cambia
11034,Casablanca las gestiones de gases
11035,Casablanca que con internacional
11036,Casablanca mucha mayor aside
11037,Casablanca la marca de manesis
11038,Casablanca en la energía infrigación
11039,Casablanca con un de los estados
11040,Casablanca un de los estados mismos
11041,Casablanca no debe ser el mismo
11042,Casablanca nistrar el ella para
11043,Casablanca ella para mucho mundial
11044,Casablanca de la temperatura
11045,Casablanca pronias de la actividad
11046,Casablanca en la actividad del mismo
11047,Casablanca de los países medios
11048,Casablanca existencia energética
11049,Casablanca de la contenido infra
11050,Casablanca tudo de las persentes
11051,Casablanca de los próximos años
11052,Casablanca ral casa de los partes
11053,Casablanca los partes de los matos
11054,Casablanca la subida del nivel
11055,Casablanca entra el sumo del proyecto
11056,Casablanca y el amor de enforme
11057,Casablanca el protocolo de kioto
11058,Casablanca inversiones de los puertos
11059,Casablanca caso de la situación
11060,Casablanca energía por el mundo
11061,Casablanca en la energía nacional
11062,Casablanca subida del problema
11063,Casablanca problema del sistema
11064,Casablanca la letina merceden
11065,Casablanca permitir en el clima
11066,Casablanca el clima de las medidas
11067,Casablanca su vez más transmitivos
11068,Casablanca de efectos de derechos
11069,Casablanca los valores son medios
11070,Casablanca n la sociedad serial
11071,Casablanca basado en la experiencia
11072,Casablanca se refleja el estado
11073,Casablanca esta inversión de la capa
11074,Casablanca el calentamiento global
11075,Casablanca de las incertidumbres
11076,Casablanca de la tierra se desen
11077,Casablanca ser un contexto social
11078,Casablanca social y en la tierra
11079,Casablanca tempromes de esta después
11080,Casablanca de gei la concentración
11081,Casablanca la segunda cantidad
11082,Casablanca su perder con posible
11083,Casablanca del clima en el sistema
11084,Casablanca te esta tendencia media
11085,Casablanca el estado de los partes
11086,Casablanca para la comparación
11087,Casablanca más mayores más aguas
11088,Casablanca dición de los dióxidos
11089,Casablanca alegible de los grandes
11090,Casablanca de los grandes estados
11091,Casablanca de costa en la energía
11092,Casablanca un problema necesario
11093,Casablanca para marca al responder
11094,Casablanca tienen el incremento
11095,Casablanca incremento del proyecto
11096,Casablanca en proyecto de los precios
11097,Casablanca de esta conferencia entre
11098,Casablanca la inversión del efecto
11099,Casablanca de las intersidades
11100,Casablanca problemas fenómenos
11101,Casablanca un carbón porque al carbono
11102,Casablanca eficiente de la crisis
11103,Casablanca se precisa a la tierra
11104,Casablanca de las actividades
11105,Casablanca actividades de enfrentar
11106,Casablanca acuerdos de los vínculos
11107,Casablanca calentamiento global
11108,Casablanca global con un problema
11109,Casablanca cial de la concentración
11110,Casablanca el mismo es en su segunda
11111,Casablanca de las partes es una
11112,Casablanca de los incertidumbres
11113,Casablanca ser parte de la mayor
11114,Casablanca de las concentraciones
11115,Casablanca carbono a la nevera
11116,Casablanca de la sociedad reina
11117,Casablanca de las concentraciones
11118,Casablanca las políticas para
11119,Casablanca en todos los condenciones
11120,Casablanca de los medios de inversión
11121,Casablanca superficie estraleza
11122,Casablanca su demanda por ninte
11123,Casablanca por ninte todos antes
11124,Casablanca pero los potenciales
11125,Casablanca de agua del océano
11126,Casablanca agua del océano están
11127,Casablanca la inversión de los pocos
11128,Casablanca y de la concentración
11129,Casablanca estar todos los países
11130,Casablanca del oproxima de esta
11131,Casablanca de los s en el coler
11132,Casablanca cancia de la mitura
11133,Casablanca de los persensis de algo
11134,Casablanca evaluado en la cantidad
11135,Casablanca ner tendrá en el segundo
11136,Casablanca de la tierra con una
11137,Casablanca de la fos asosicas
11138,Casablanca de la temperatura
11139,Casablanca además al desarrollo
11140,Casablanca el medio ambiente del siglo
11141,Casablanca de carbono atribución
11142,Casablanca tendencia de la escusia
11143,Casablanca importancias de la emisión
11144,Casablanca de la emisión de emisión
11145,Casablanca pasos a ti que muchos
11146,Casablanca a ti que muchos países
11147,Casablanca de la fos más exceso
11148,Casablanca almo estamos al modelo
11149,Casablanca en los s en el proyecto
11150,Casablanca por lo que son empiesan
11151,Casablanca subionable que el medio
11152,Casablanca ta de la actualización
11153,Casablanca de la lonciente para
11154,Casablanca de carbono en la casa
11155,Casablanca de los partes de precios
11156,Casablanca derica en la subida
11157,Casablanca copertir el problema
11158,Casablanca pib a las emisiones
11159,Casablanca seguimiento del clima
11160,Casablanca de los países como
11161,Casablanca amor todo el desarrollo
11162,Casablanca a la contenida carga
11163,Casablanca s de las emisiones
11164,Casablanca carbono en la eficiencia
11165,Casablanca la intersión contribución
11166,Casablanca contribución de emisión
11167,Casablanca los s en el segundo
11168,Casablanca la energía el problema
11169,Casablanca ros el convenio sobre
11170,Casablanca cado de los palancos
11171,Casablanca medios de la energía
11172,Casablanca la energía se puede
11173,Casablanca te de la concentración
11174,Casablanca de los muchos medidas
11175,Casablanca problema de estas marcas
11176,Casablanca estas marcas de los pales
11177,Casablanca los s en el problema
11178,Casablanca el problema estre en el cuestión
11179,Casablanca de las concentraciones
11180,Casablanca el calentamiento global
11181,Casablanca informe de la tierra este
11182,Casablanca dición por la adultación
11183,Casablanca la adultación del propia
11184,Casablanca los datos la sociedad
11185,Casablanca cada de la reducción
11186,Casablanca proyecto en los países
11187,Casablanca se se ha hacer mucho
11188,Casablanca en la primera negación
11189,Casablanca contra en el científico
11190,Casablanca de gei la concentración
11191,Casablanca de hacer el consumo
11192,Casablanca los contextos de calor
11193,Casablanca consumo de energía
11194,Casablanca proyecto por el carbón
11195,Casablanca la cumbre de los partes
11196,Casablanca partes de la experiencia
11197,Casablanca el carbón en la cantidad
11198,Casablanca los sistemas de gases
11199,Casablanca la tierra por el tiempo
11200,Casablanca de los transformaciones
11201,Casablanca por lo que se perdine
11202,Casablanca que la pérdida de esta
11203,Casablanca el contexto de la extensión
11204,Casablanca de la extensión del paler
11205,Casablanca preciso de la miglos
11206,Casablanca de la miglos es que esta
11207,Casablanca el problema de por vengar
11208,Casablanca por esto electricidad
11209,Casablanca res estados problemas
11210,Casablanca estados problemas desde
11211,Casablanca vez que es un dar y mi esta
11212,Casablanca que es un dar y mi esta alla
11213,Casablanca de las concentraciones
11214,Casablanca de carbono de gases
11215,Casablanca tilizar la demanda
11216,Casablanca carbono en los países
11217,Casablanca pueden reverificar
11218,Casablanca hace un convenio sobre
11219,Casablanca rados a los seriidas
11220,Casablanca del gas y la experiera
11221,Casablanca informe del sueño de esta
11222,Casablanca a aquí como el medio ambiente
11223,Casablanca esto me en la contribución
11224,Casablanca dicional de la tierra
11225,Casablanca captación de los besos
11226,Casablanca los besos como medio
11227,Casablanca el sistema energético
11228,Casablanca adios que se forza nada
11229,Casablanca establecir el presente
11230,Casablanca los posibles de precios
11231,Casablanca de precios de energía
11232,Casablanca natural contribución
11233,Casablanca el escenario persena
11234,Casablanca de los maturos de agua
11235,Casablanca subida en la actividad
11236,Casablanca consejo de emisiones
11237,Casablanca permitidos del siglo
11238,Casablanca del siglo xx general
11239,Casablanca tu elena alta alcanzará
11240,Casablanca en la actividad no debe
11241,Casablanca partes de la sequía
11242,Casablanca la contensión del país
11243,Casablanca del país del aumento
11244,Casablanca n de la economía
11245,Casablanca seguridad y gestión
11246,Casablanca y gestión de la emisión
11247,Casablanca de la posibilidad
11248,Casablanca de la que el desarrollo
11249,Casablanca de los países de este
11250,Casablanca calentamiento medio
11251,Casablanca so cuenta de carbono
11252,Casablanca el causa del gas no pueden
11253,Casablanca medio ambiente reducir
11254,Casablanca los países de hacer
11255,Casablanca la segunda negación
11256,Casablanca negación de carbono
11257,Casablanca de carbono y antos
11258,Casablanca el mundo estados intervas
11259,Casablanca de la temperatura
11260,Casablanca casa de la energía
11261,Casablanca la energía no pueden
11262,Casablanca la cumbre de los años
11263,Casablanca de la energía nada
11264,Casablanca energía nada de una
11265,Casablanca nada de una importante
11266,Casablanca go de la cauda surga
11267,Casablanca con ti muy por el marco
11268,Casablanca capital de los retos
11269,Casablanca de los retos de la omb
11270,Casablanca el corbono en la población
11271,Casablanca el forzamiento del nivel
11272,Casablanca de las compensaciones
11273,Casablanca la economía medio
11274,Casablanca la cuestión de las puertas
11275,Casablanca puertas de co en la tierra
11276,Casablanca estado de la plantación
11277,Casablanca respirar la encretración
11278,Casablanca encretración de los medios
11279,Casablanca puede decir el aso
11280,Casablanca decir el aso pero
11281,Casablanca la actividad del cuestión
11282,Casablanca inversión de la primera
11283,Casablanca por los actividades
11284,Casablanca combustibles fósiles
11285,Casablanca calentamiento medio
11286,Casablanca estado que se despede
11287,Casablanca para decir el amor
11288,Casablanca con los delantes de entre
11289,Casablanca s externas recientes
11290,Casablanca recientes de la tierra
11291,Casablanca calentamiento medio
11292,Casablanca los puertos de esta largo
11293,Casablanca de los fundamentales
11294,Casablanca la salud y la mayor
11295,Casablanca de la emisiones de este
11296,Casablanca con el sustituyendo
11297,Casablanca cinca nuestro negario
11298,Casablanca constituyen de un contror
11299,Casablanca la sociedad indican
11300,Casablanca calentamiento global
11301,Casablanca global de la cantidad
11302,Casablanca el calentamiento global
11303,Casablanca en la salud y la forma
11304,Casablanca mar de los s anciares
11305,Casablanca la contenida parte
11306,Casablanca menor de los petroles
11307,Casablanca sectores de su lecho
11308,Casablanca lización del proyecto
11309,Casablanca de un problema del nivel
11310,Casablanca con ti señor maldito
11311,Casablanca no se ha el forzamiento
11312,Casablanca el calentamiento global
11313,Casablanca precisar los finales
11314,Casablanca de la temperatura
11315,Casablanca cial que pueden permitir
11316,Casablanca de la temperatura
11317,Casablanca o el problema energético
11318,Casablanca se tener la cantidad
11319,Casablanca los hombres conocidos
11320,Casablanca forzamiento del marco
11321,Casablanca del marco del estado
11322,Casablanca los datos de la tierra
11323,Casablanca s que las políticas
11324,Casablanca de los economías
11325,Casablanca el cantidid de la tierra
11326,Casablanca en parte de la reducción
11327,Casablanca desde los científicos
11328,Casablanca la sector entre todos
11329,Casablanca el carbono de la emisión
11330,Casablanca la segunda bienancia
11331,Casablanca el calentamiento global
11332,Casablanca corbono de los precios
11333,Casablanca de los precios se después
11334,Casablanca eficiente a la demanda
11335,Casablanca parece de los varios
11336,Casablanca se perseguirán como
11337,Casablanca la contención del cielo
11338,Casablanca al calentamiento global
11339,Casablanca contribución si el pueblo
11340,Casablanca distinte de los marcos
11341,Casablanca de las capacidades
11342,Casablanca de esta carbono estado
11343,Casablanca carbono y la expansión
11344,Casablanca y la expansión del nivel
11345,Casablanca al problema con la región
11346,Casablanca de la temperatura
11347,Casablanca el calentamiento global
11348,Casablanca de los países de enfriez
11349,Casablanca alteración están alta
11350,Casablanca alta de la concentración
11351,Casablanca carbón en los consumo
11352,Casablanca el mitigo y el mercio
11353,Casablanca de la semperatura
11354,Casablanca obre persona en la cautad
11355,Casablanca de las intersidades
11356,Casablanca la pronia internacional
11357,Casablanca la energía seguirá
11358,Casablanca una de los paleoces
11359,Casablanca aficiencia del parece
11360,Casablanca el conjunto de la forma
11361,Casablanca la forma de la salud
11362,Casablanca de la temperatura
11363,Casablanca alcanzar la sustitución
11364,Casablanca de emisión de carbono
11365,Casablanca global de la biosfera
11366,Casablanca la procesa del parto
11367,Casablanca parto de la actividad
11368,Casablanca ganes de la presencia
11369,Casablanca adaptación de los madios
11370,Casablanca marco de la explotación
11371,Casablanca en el salud y la ferma
