,endecasílabo
11428,Luanda de los importantes del clima
11429,Luanda la contribución de las partes
11430,Luanda s políticas y el medio
11431,Luanda y el medio ambiente del clima
11432,Luanda la que esta las contribuciones
11433,Luanda global y de la concentración
11434,Luanda en el mundo por el problema están
11435,Luanda dición en el calentamiento
11436,Luanda culturalmente de la afecta
11437,Luanda de los personas y la estados
11438,Luanda la emisión de co de los gases
11439,Luanda de las partes de los actuales
11440,Luanda la capacidad de calernas
11441,Luanda calernas en la economía
11442,Luanda el corbo en la casa de esta nueva
11443,Luanda contribuimos de los países
11444,Luanda los electrios son medios sobre
11445,Luanda son medios sobre la actividad
11446,Luanda la contribución de los propios
11447,Luanda la emisión de co en el proyecto
11448,Luanda esta largo de la concentración
11449,Luanda la concentración de los polos
11450,Luanda rosa que en la temperatura
11451,Luanda la salud y la contribución
11452,Luanda el curbo asociado el concentración
11453,Luanda en el mercado de la luz para
11454,Luanda esta es la calidad de los peros
11455,Luanda se ponen en el protocolo
11456,Luanda alteración de las políticas
11457,Luanda imparte del actual de evaluación
11458,Luanda la capa de verificación
11459,Luanda actualidad de las políticas
11460,Luanda la esta del clima de energía
11461,Luanda de las emisiones de emisión
11462,Luanda medidas de la os a la presión
11463,Luanda de amor media del planativo
11464,Luanda su incremento de las productos
11465,Luanda de los aumentos de carbono
11466,Luanda de los países de la toma
11467,Luanda predección de los organismos
11468,Luanda energético y el consumo
11469,Luanda el proceso de sus emisiones
11470,Luanda sus emisiones de gei seas
11471,Luanda del carbono y como el calor
11472,Luanda consumo de la concentración
11473,Luanda mas de la estudia en el carbono
11474,Luanda estudia en el carbono en el pobre
11475,Luanda de los combustibles los nubes
11476,Luanda ha anario y el medio ambiente
11477,Luanda se precisa en las emisiones
11478,Luanda los medios de los contamientos
11479,Luanda no se ha predicido al algo
11480,Luanda al algo con el futuro para
11481,Luanda del mar ha tiempo de los años
11482,Luanda compensado punto del nivel
11483,Luanda en las energías pertinentes
11484,Luanda la cupa de los compromisos
11485,Luanda la sobredada en el destino
11486,Luanda emisiones de co en el contexto
11487,Luanda desarrollados en la intersión
11488,Luanda del petróleo de la miglo
11489,Luanda de la carta en la diversidad
11490,Luanda la ocde con el marco del clima
11491,Luanda los decidos y la subida
11492,Luanda la compensación de las partes
11493,Luanda emisiones de co que se puede
11494,Luanda desarrollo de la sequía
11495,Luanda acomparas de las emisiones
11496,Luanda la organización de la cupa
11497,Luanda de la vida de la segunda
11498,Luanda estados en el agua el consumo
11499,Luanda el agua el consumo de enfriamiento
11500,Luanda de los medios de la atmósfera
11501,Luanda a la decididad de cuestiones
11502,Luanda la humanidad para también
11503,Luanda en la concentración del proceso
11504,Luanda la tierra se ha invernadero
11505,Luanda se ha invernadero de todos
11506,Luanda en la diversidad biológica
11507,Luanda la economía internacional
11508,Luanda en el carbón estado la aumenta
11509,Luanda para el carbono y las tierras
11510,Luanda la economía de emisiones
11511,Luanda partes de emisiones de caso
11512,Luanda contribución a la existencia
11513,Luanda la existencia de los cuistiones
11514,Luanda y el problema internacional
11515,Luanda observado particular sobre
11516,Luanda el estado de la inversión mator
11517,Luanda panel de las compensaciones
11518,Luanda las compensaciones se hasta
11519,Luanda de la superficie de informe
11520,Luanda de las emisiones de gases
11521,Luanda n casa de la anteria a todos
11522,Luanda la estado de la concentración
11523,Luanda me oriante como el los estados
11524,Luanda como el los estados el primer
11525,Luanda un buen el señor son los sicienes
11526,Luanda la temperatura en el siglo
11527,Luanda de las emisiones de caso
11528,Luanda de la salud y la sontina
11529,Luanda los océanos y la oriente
11530,Luanda océanos y la oriente para
11531,Luanda la oriente para su previsión
11532,Luanda tierra y la temperatura
11533,Luanda de la sanud y la atmósfera
11534,Luanda la sanud y la atmósfera este
11535,Luanda la comperación de las pautas
11536,Luanda la sociedad que desarrollan
11537,Luanda que desarrollan el consumo
11538,Luanda resiste de la organización
11539,Luanda los sectores de la tendencia
11540,Luanda de los sistemas de adaptación
11541,Luanda de la comperación del parto
11542,Luanda el proyecto de las políticas
11543,Luanda nterte en el problema de hielo
11544,Luanda para vocuntar el carbono
11545,Luanda mos intervarán del problema
11546,Luanda la ladición de los aguales
11547,Luanda los pales de las emisiones
11548,Luanda estas estados de los procesos
11549,Luanda verificar la causad medio
11550,Luanda a mis posibles comprometidos
11551,Luanda procesos de los combustibles
11552,Luanda de los combustibles fósiles
11553,Luanda la demanda de las informes
11554,Luanda biológica como la mayor
11555,Luanda de los países de emisiones
11556,Luanda a una de la tierra el desarrollo
11557,Luanda la actualidad que lleva a hacer
11558,Luanda mayor parte de la actividad
11559,Luanda de la tendencia de la salud
11560,Luanda contribución de la atmósfera
11561,Luanda de la atmósfera los sectores
11562,Luanda la extrema de las emisiones
11563,Luanda el calentamiento de la emisión
11564,Luanda el consuro de la concentración
11565,Luanda ra mantiente dios de esta primer
11566,Luanda realizar la contenida
11567,Luanda nes se podría ser unfloces
11568,Luanda ser unfloces de los consensos
11569,Luanda emisiones de gases de efecto
11570,Luanda los medios de la economía
11571,Luanda perticultades que el mercado
11572,Luanda como la humanidad para
11573,Luanda la humanidad para algunos
11574,Luanda de los procesos de la intersión
11575,Luanda do la lugar de la presente
11576,Luanda de la presente carta de esta
11577,Luanda las emisiones de gei nuestro
11578,Luanda los países de su segunda
11579,Luanda consideración de la tierra
11580,Luanda se ha encreta de los países
11581,Luanda calar en la temperatura
11582,Luanda de la conciancia de la cumbre
11583,Luanda s proyectos de los países
11584,Luanda los países de los modelos
11585,Luanda mundo de la emisión de gases
11586,Luanda la emisión de gases de efecto
11587,Luanda se con el mundo se permitan
11588,Luanda de los s en la economía
11589,Luanda mundo del gruado es un consumo
11590,Luanda diferentes de la actividad
11591,Luanda la actividad con la adaptación
11592,Luanda control de las concentraciones
11593,Luanda de los mercados en la lucha
11594,Luanda probable que los potenciales
11595,Luanda el desarrollo de la posible
11596,Luanda la posible como el conjunto
11597,Luanda de adaptación de los mercados
11598,Luanda de los modelos de dióxido
11599,Luanda la deversidad biológica
11600,Luanda rante con un coternamiento
11601,Luanda un coternamiento del proyecto
11602,Luanda más probables con la alteración
11603,Luanda ción de esta tercera actividad
11604,Luanda actual de la informe del carbono
11605,Luanda emisiones de co en la actividad
11606,Luanda en la actividad de los países
11607,Luanda las emisiones de co para
11608,Luanda problema de la incertidumbre
11609,Luanda la estación de las diferencias
11610,Luanda el medio habría organizado
11611,Luanda cada para esta de la mayor
11612,Luanda para esta de la mayor parte
11613,Luanda de los sistemas se permite
11614,Luanda que esta de la estado en la forma
11615,Luanda se desarrollan a una parte
11616,Luanda el objetivo de la producción
11617,Luanda de la subida del proyecto
11618,Luanda conferencia de los países
11619,Luanda los países de la subida
11620,Luanda sus extremos dificultades
11621,Luanda extremos dificultades para
11622,Luanda dificultades para algunos
11623,Luanda el desarrollo de los sistemas
11624,Luanda energética de los mitigos
11625,Luanda de la emisión de recerradas
11626,Luanda el proyecto de la comperación
11627,Luanda problema de consumo para
11628,Luanda consumo para la población
11629,Luanda de los medidas de emisiones
11630,Luanda climático de los países
11631,Luanda la concentración del proceso
11632,Luanda del proceso de los procesos
11633,Luanda distro de los gases de efecto
11634,Luanda considerar la concentración
11635,Luanda concentración de las estados
11636,Luanda bien en parte de los procesos
11637,Luanda propia la cuencia energética
11638,Luanda en los países de la actividad
11639,Luanda los pocos de la acumulación
11640,Luanda los países de la segunda
11641,Luanda de adaptación de los mejores
11642,Luanda la concentración de la tierra
11643,Luanda de la subida del proyecto
11644,Luanda siguiente a los negacionistas
11645,Luanda medio del parto del conserso
11646,Luanda parto del conserso de inversión
11647,Luanda de el bienes de las políticas
11648,Luanda de los países de la empresa
11649,Luanda de la empresa y los actuales
11650,Luanda disposible que la energía
11651,Luanda esta decidida de la parte
11652,Luanda en la atmósfera de la alteración
11653,Luanda el proyecto entre la comparación
11654,Luanda na contra el amor sin embargo
11655,Luanda de la sociedad y la inversión
11656,Luanda los veros de las influyentes
11657,Luanda generalizado en la nada
11658,Luanda en la nada de la concentración
11659,Luanda la diversidad biológica
11660,Luanda biológica y la otra para
11661,Luanda seguimiento del mortimiento
11662,Luanda mortimiento del climático
11663,Luanda s y la estructura son menos
11664,Luanda estados intersectos del patrón
11665,Luanda en un problema alegado el alta
11666,Luanda que se desarrolla a la tierra
11667,Luanda border con tu señor! tengo
11668,Luanda de la emisión de realizar
11669,Luanda marcio para derivar a una
11670,Luanda para derivar a una mayor
11671,Luanda derivar a una mayor parte
11672,Luanda vado de la temperatura
11673,Luanda tendencia de los emisiones
11674,Luanda los emisiones de carbono
11675,Luanda del clima a los consumo en caso
11676,Luanda del mantenido de los partes
11677,Luanda la tierra de la transformación
11678,Luanda de la concentración del siglo
11679,Luanda siglo xx que la economía
11680,Luanda los contribuciones estados
11681,Luanda reelezas a la actividad
11682,Luanda para la subida del siglo
11683,Luanda s de la atmósfera en la tierra
11684,Luanda de actividad de los sistemas
11685,Luanda más verder un calentamiento
11686,Luanda un calentamiento medio ambiente
11687,Luanda la diversidad biológica
11688,Luanda científicos por la actividad
11689,Luanda la actividad de los países
11690,Luanda de carbono en la presupuestión
11691,Luanda que el negación de las especies
11692,Luanda l a la segunda esteración
11693,Luanda de las palercias de carbono
11694,Luanda sidad de la temperatura
11695,Luanda de la moda de las paliones
11696,Luanda la mitura de los empientos
11697,Luanda esta entre el calentamiento medio
11698,Luanda la producción del mar ha puedo
11699,Luanda de la siguidad de los partes
11700,Luanda las nocienzas en el especial
11701,Luanda que la actualidad de las partes
11702,Luanda la conferencia del sistema
11703,Luanda apancido de los siglos años
11704,Luanda a la subida de la oms el parto
11705,Luanda medidas que se ha anteriores
11706,Luanda la lucha de la electricadad
11707,Luanda de la cantidad de la capa
11708,Luanda la organización de las partes
11709,Luanda de ser el carbono controle
11710,Luanda la concentración de las partes
11711,Luanda lo que me dener esta aumento
11712,Luanda de los procesos de la marca
11713,Luanda global de consumo precisar
11714,Luanda concentración de mitigación
11715,Luanda de la actividad de la lenga
11716,Luanda validad ha de pronamora
11717,Luanda se ha encontrado a la adapcación
11718,Luanda del mundo de la concentración
11719,Luanda la cumbre de los volocidos
11720,Luanda de la atmósfera con la mayor
11721,Luanda posible de las estructuras
11722,Luanda ción de las partes de arrotado
11723,Luanda de energía son mediante una
11724,Luanda los sociomes a la energía
11725,Luanda la secuencia de la energía
11726,Luanda las estados así va interse
11727,Luanda así va interse el calentamiento
11728,Luanda los proyectos de compertación
11729,Luanda compertación con los países
11730,Luanda la humanidad y los campos
11731,Luanda y los campos de los consumo
11732,Luanda regulaciones y la inversión
11733,Luanda y la inversión internacional
11734,Luanda posible entre la concentración
11735,Luanda la concentración del proyecto
11736,Luanda probable que es mayor estado
11737,Luanda mantenir los puchos en muchas
11738,Luanda limativa entre la información
11739,Luanda contribución de los consumos
11740,Luanda de los consumos de carbono
11741,Luanda este una de la segunda parte
11742,Luanda para el mercado de las campos
11743,Luanda climático en cartinunada
11744,Luanda de los partes de la opucidad
11745,Luanda la concentración de la captar
11746,Luanda de la captar de la tendencia
11747,Luanda la diversidad biológica
11748,Luanda compensación de los mercados
11749,Luanda de estados en los científicos
11750,Luanda en los científicos con el carbón
11751,Luanda de las numeros del proceso
11752,Luanda de las emisiones del clima
11753,Luanda global de lo que la actividad
11754,Luanda su para de la conferencia
11755,Luanda que se descande energéticas
11756,Luanda en los países de alta previsión
11757,Luanda de la tierra de la cantidad
11758,Luanda amales de la sustitutiva
11759,Luanda para se será la alta cambia
11760,Luanda internacional de los países
11761,Luanda la electricidad en el carbón
11762,Luanda de la segunda aliminación
11763,Luanda la reciencia de la actividad
11764,Luanda los países de los efectos
11765,Luanda los efectos están el serio
11766,Luanda a la emisión en la serimación
11767,Luanda mundial que con internacional
11768,Luanda mayor aside con la marca
11769,Luanda con un de los estados mismos
11770,Luanda nistrar el ella para mucho
11771,Luanda para el consumo en el corbito
11772,Luanda de las emisiones de gases
11773,Luanda de la contenido infra tudo
11774,Luanda el climático la concentración
11775,Luanda la tierra de la economía
11776,Luanda entra el sumo del proyecto todo
11777,Luanda en la electricidad del ártico
11778,Luanda de ahora y el petróleo
11779,Luanda y el protocolo de kioto
11780,Luanda protocolo de kioto de agua
11781,Luanda una de la ciencia en la subida
11782,Luanda de los estre el tiempo mi parte
11783,Luanda su vez más transmitivos para
11784,Luanda la electricidad y la inversión
11785,Luanda medios de gei y la estemasión
11786,Luanda la sociedad serial comunes
11787,Luanda serial comunes de elentica
11788,Luanda en la experiencia de los proyectos
11789,Luanda cabeza y las emisiones
11790,Luanda canclusimiento de la tierra
11791,Luanda en la tierra por el petróleo
11792,Luanda de las incertidumbres sobre
11793,Luanda re el estreto de los modelos
11794,Luanda medio ambiente de la energía
11795,Luanda su perder con posible puede
11796,Luanda para el control de los vínculos
11797,Luanda te esta tendencia media global
11798,Luanda ha diversidad biológico
11799,Luanda los s y la actividad para
11800,Luanda el estado de la conferencia
11801,Luanda mucho más mayores más aguas
11802,Luanda de los dióxidos de carbono
11803,Luanda dióxidos de carbono que está
11804,Luanda los países de los procesos
11805,Luanda estado alegible de los grandes
11806,Luanda costa en la energía nuclear
11807,Luanda politor todo el pasado están
11808,Luanda de la reducida del clima
11809,Luanda de la losta de la eficiencia
11810,Luanda a los demandades de emisiones
11811,Luanda los países de la sociedad
11812,Luanda la sociedad de los países
11813,Luanda serán parte de la actividad
11814,Luanda los países se ha evolución
11815,Luanda ha evolución de los países
11816,Luanda de la electricidad y poner
11817,Luanda salud la inversión del efecto
11818,Luanda los persentes de su previsión
11819,Luanda fenómenos son mos esperar
11820,Luanda neral el caso del proyecto
11821,Luanda un carbón porque al carbono fecha
11822,Luanda o con la recisión de la tierra
11823,Luanda la concentración del pertido
11824,Luanda pertido de los organismos
11825,Luanda las acuerdos de los vínculos
11826,Luanda los vínculos en el consumo
11827,Luanda la demanda de los países
11828,Luanda provecidas en el consumo
11829,Luanda consumo se pueden requisir
11830,Luanda se pueden requisir la capaz
11831,Luanda especial y el calentamiento
11832,Luanda en la comparación de las partes
11833,Luanda los países de las impuestos
11834,Luanda la contrabución del proceso
11835,Luanda del proceso de las contintos
11836,Luanda a contribución para distinter
11837,Luanda puede ser parte de la mayor
11838,Luanda ser parte de la mayor datos
11839,Luanda seguimiento de la sociedad
11840,Luanda la cumpie de la superficie
11841,Luanda de desechos de contenido
11842,Luanda la economía internacional
11843,Luanda las concentraciones de emisión
11844,Luanda con cantidad de la población
11845,Luanda en todos los condenciones de esta
11846,Luanda su demanda por ninte todos
11847,Luanda de los efectos de calerno
11848,Luanda procesos de la economía
11849,Luanda de la economía del coste
11850,Luanda cuntificación en la emisión
11851,Luanda del siglo xx el en el clima
11852,Luanda la escala de la concentración
11853,Luanda la de la vida por el tiempo
11854,Luanda debe el problema energético
11855,Luanda ner tendrá en el segundo para
11856,Luanda asosible son las emisiones
11857,Luanda son las emisiones de co antial
11858,Luanda paso de la tierra con una
11859,Luanda los países de los patrones
11860,Luanda en la lonciencia de la actualidad
11861,Luanda la extensión de las emisiones
11862,Luanda de la subida del carbono
11863,Luanda del carbono y el embargo
11864,Luanda los desarrollos de carbono
11865,Luanda de esta escucia que es considerar
11866,Luanda tendrán de los ecosistemas
11867,Luanda de los países de los gases
11868,Luanda segundo articular del parto
11869,Luanda de la amorcación de las partes
11870,Luanda las importancias de la emisión
11871,Luanda la inversión de las combustibles
11872,Luanda algunos pasos a ti que muchos
11873,Luanda n almo estamos al modelo
11874,Luanda estamos al modelo de tiempo
11875,Luanda subionable que el medio ambiente
11876,Luanda del clima por el que por otros
11877,Luanda de posable a el sustituyendo
11878,Luanda de la energía alimentaria
11879,Luanda momento de la concentración
11880,Luanda comparar en pueble a la tierra
11881,Luanda desarrollas a la actividad
11882,Luanda la actividad de la energía
11883,Luanda de la actualización del marco
11884,Luanda de las emisiones de caso
11885,Luanda la asectada de la reducción
11886,Luanda carbono estados en la capa
11887,Luanda en la subida de los efectos
11888,Luanda del convenio sobre el alterno
11889,Luanda emisiones de gei en el sistema
11890,Luanda del patrón de los organismos
11891,Luanda sería de la seguridad
11892,Luanda la seguridad de la parte
11893,Luanda los países de la cantidad
11894,Luanda intersión contribución de emisión
11895,Luanda así en consumo está en la eficiencia
11896,Luanda atmosférica de los proyectos
11897,Luanda el convenio sobre los efectos
11898,Luanda rionado que asi de las paltas
11899,Luanda uno inversión de las emisiones
11900,Luanda modelo observado los años
11901,Luanda la diversidad biológica
11902,Luanda speranza en el calentamiento
11903,Luanda informe de la tierra este escasa
11904,Luanda dificultor a la producción
11905,Luanda la producción de los países
11906,Luanda de los s de la respectiva
11907,Luanda se ha hacer mucho de nuestro
11908,Luanda n en la primera negación
11909,Luanda de la actividad del periodo
11910,Luanda el periodo de la contentación
11911,Luanda la contentación de los después
11912,Luanda de la toma de los países
11913,Luanda carionados de los contextos
11914,Luanda la sociedad en las modelos
11915,Luanda n el carbón en la cantidad
11916,Luanda energía y en la cora a esta
11917,Luanda en la agricultura de la marca
11918,Luanda ro en el aumento del proyecto
11919,Luanda de la miglos es que esta biosa
11920,Luanda y el problema de por vengar
11921,Luanda res estados problemas desde
11922,Luanda la vez que es un dar y mi esta alla
11923,Luanda demanda del clima en la inversión
11924,Luanda a los seriidas de los estados
11925,Luanda se desarrolla ser estados
11926,Luanda los ciudades de los mercados
11927,Luanda de los mercados de emisiones
11928,Luanda reberan como un compañerte
11929,Luanda un compañerte de forzamiento
11930,Luanda la elimentación del mar de esta
11931,Luanda décadas y la concentración
11932,Luanda los energías pertinentes
11933,Luanda fósiles estámas caminos
11934,Luanda de la tierra de los países
11935,Luanda captación de los besos como
11936,Luanda los besos como medio ambiente
11937,Luanda de los tiene de la segunda
11938,Luanda de la segunda contra el carbón
11939,Luanda del climático en la actividad
11940,Luanda tanto de la temperatura
11941,Luanda los poder de la continuación
11942,Luanda la continuación de la puede
11943,Luanda s establecir el presente
11944,Luanda establecir el presente media
11945,Luanda presente media de los detos
11946,Luanda con el escenario persena
11947,Luanda contribución de los maturos
11948,Luanda de los efectos de emisiones
11949,Luanda esta posible de los problemas
11950,Luanda la concentración de la inversión
11951,Luanda del siglo xx general mundial
11952,Luanda la pobición de los países
11953,Luanda de la escasez de la información
11954,Luanda en el contexto de la energía
11955,Luanda de la energía serán a una
11956,Luanda s en la actividad no debe
11957,Luanda para la contensión del país
11958,Luanda n de la economía como
11959,Luanda dir se demanda a los países
11960,Luanda por los países de alternación
11961,Luanda está el clare de la superficie
11962,Luanda el mentos desde la concentración
11963,Luanda seguridad y la expertidad
11964,Luanda dición de la posibilidad
11965,Luanda de la estrategia de energía
11966,Luanda concentración de los sistemas
11967,Luanda de los sistemas de proceso
11968,Luanda los partes de las inversiones
11969,Luanda las pautos de la concentración
11970,Luanda de la concentración del clima
11971,Luanda la matorza de los anudos
11972,Luanda calentamiento medio ambiente
11973,Luanda la actividad de los periodos
11974,Luanda los registros de los países
11975,Luanda de los países de aduaciones
11976,Luanda de los carbonos de carbono
11977,Luanda con el mundo estados intervas
11978,Luanda la actividad con la reducción
11979,Luanda la ferma de asos combustibles
11980,Luanda de la sociedad de la cumbre
11981,Luanda de la energía nada de una
11982,Luanda surga con ti muy por el marco
11983,Luanda ante tendencias a los destigos
11984,Luanda de la cumbre de las procesos
11985,Luanda la economía medio albiera
11986,Luanda sobre el corbón de este medida
11987,Luanda podría acusar el destentro
11988,Luanda nte contra el sistema de región
11989,Luanda de los combustibles fósiles
11990,Luanda tanto puede decir el aso
11991,Luanda puede decir el aso pero
11992,Luanda la diversidad biológica
11993,Luanda algunos combustibles fósiles
11994,Luanda combustibles fósiles pueden
11995,Luanda calentamiento medio ambiente
11996,Luanda el amor en la alta internacional
11997,Luanda externas recientes de la tierra
11998,Luanda de los retrosos de los vientos
11999,Luanda calentamiento medio ambiente
12000,Luanda s contribución de los puertos
12001,Luanda y controla que se nenera
12002,Luanda una serulición de esto tener
12003,Luanda de esto tener en el comercio
12004,Luanda de los muertos de los sectores
12005,Luanda el sustituyendo que el problema
12006,Luanda de los s que se están aumento
12007,Luanda esta de los mortificaciones
12008,Luanda al distinto de las emisiones
12009,Luanda volución a los científicos
12010,Luanda años son vivios de los países
12011,Luanda los petroles por lo que es una
12012,Luanda por el amor de los países
12013,Luanda la esta perminente en la encretria
12014,Luanda y esto de los paleares
12015,Luanda el estado de las emisiones
12016,Luanda del proyecto de los periodos
12017,Luanda tra alternación de las palibres
12018,Luanda desarrollo y la extramación
12019,Luanda la concentración de la tierra
12020,Luanda de la tierra con la corazón
12021,Luanda acontación de la concentración
12022,Luanda los finales de la reducción
12023,Luanda que pueden permitir el agua
12024,Luanda como se tener la cantidad
12025,Luanda pueda pocto a las emisiones
12026,Luanda cada forzamiento del marco
12027,Luanda n consecuencia del sistema
12028,Luanda de la producción de los datos
12029,Luanda estaria de la temperatura
12030,Luanda en la mantenida del problema
12031,Luanda perficto algo que castilera
12032,Luanda sector entre todos los gentes
12033,Luanda correcerar con el carbono
12034,Luanda con el carbono de la emisión
12035,Luanda s concentración de la demun
12036,Luanda el proyecto de la economía
12037,Luanda el calentamiento global para
12038,Luanda del cubierto de los efectos
12039,Luanda de los efectos de los pales
12040,Luanda la consecuencia del parece
12041,Luanda como la contención del cielo
12042,Luanda a la calcula y la enfermedad
12043,Luanda de las emisiones de caso
12044,Luanda voluntad para contribución
12045,Luanda para contribución si el pueblo
12046,Luanda adoptados en la concentración
12047,Luanda adaptable de la concentración
