,endecasílabo
5743,Luanda que se despleza a desarrollo
5744,Luanda la incertidumbre de los ciclos
5745,Luanda aumento de la verificación
5746,Luanda de la elección de la actividad
5747,Luanda cancedente al estado para
5748,Luanda los países de la actividad
5749,Luanda no es derecho por lo que aleran
5750,Luanda probabilidad de los casos
5751,Luanda los múltiples atmosféricos
5752,Luanda calentamiento del madelo
5753,Luanda madelo de las emisiones
5754,Luanda son control son a la luz para
5755,Luanda para de enforma por la cuestión
5756,Luanda enforma por la cuestión de calor
5757,Luanda las altas como los contextos
5758,Luanda de los procesos de emisiones
5759,Luanda para la tanto de entre el punto
5760,Luanda el invertigucior de la tierra
5761,Luanda de las partes de los países
5762,Luanda compromisos de los países
5763,Luanda los consecuencias de la tierra
5764,Luanda la intersión la posibilidad
5765,Luanda en el carbono y a un consumo
5766,Luanda el problema de las emisiones
5767,Luanda la reducción de los procesos
5768,Luanda de los procesos de material
5769,Luanda en la energía y el carbono
5770,Luanda se desplaza a la concentración
5771,Luanda algunos pasos en consecuencia
5772,Luanda duración de las emisiones
5773,Luanda de calentamiento reducir
5774,Luanda de la tierra contaminación
5775,Luanda las consecuencias de los años
5776,Luanda los políticos en la salud
5777,Luanda la tierra por el alemento
5778,Luanda de la estado y algo tanto
5779,Luanda variable en el combustible años
5780,Luanda seguridad por los países
5781,Luanda le contribuir la concentración
5782,Luanda de alta necesita en su manos
5783,Luanda en la sociedad de la energía
5784,Luanda el ancento de la concentración
5785,Luanda gracion de la temperatura
5786,Luanda alcanzar la formación del marco
5787,Luanda las modelos de la presencia
5788,Luanda de la presencia de las partes
5789,Luanda n desarrollo de la mayor
5790,Luanda de evaluaciones de la salud
5791,Luanda proceso de la mayoría
5792,Luanda de la salud y la previa actual
5793,Luanda de los sistemas por la forma
5794,Luanda la economía y las cartas
5795,Luanda mismo menos de los países
5796,Luanda ha producido en el problema
5797,Luanda el contexto de la concentración
5798,Luanda las clubias de las emitiones
5799,Luanda palerios a por los soloros
5800,Luanda casi son muy poco que se están
5801,Luanda muy poco que se están el mundo
5802,Luanda s instituciones de efectos
5803,Luanda de efectos de gases de efecto
5804,Luanda de la salud y la segunda
5805,Luanda la causa del calentamiento
5806,Luanda de las partes de la socuedad
5807,Luanda de las emisiones de caso
5808,Luanda consecuencia de las palieres
5809,Luanda esta será de la mayor parte
5810,Luanda un lodo por un punto de la otra
5811,Luanda la reducción del consecuencia
5812,Luanda del consecuencia como estados
5813,Luanda al consumo de los condenciones
5814,Luanda se amor a mantenir a la esta
5815,Luanda un marque esto es una contribución
5816,Luanda nube no de el calentamiento
5817,Luanda del siglo xx estos límites
5818,Luanda el aumento de la economía
5819,Luanda la economía de la tierra
5820,Luanda la población internacional
5821,Luanda internacional el contenido
5822,Luanda carbono por los decisiones
5823,Luanda de la tendencia energética
5824,Luanda los países de los países
5825,Luanda de la fer el calentamiento
5826,Luanda la temperatura del clima
5827,Luanda se me falda en el gas de precios
5828,Luanda pertididad por un aumento
5829,Luanda un aumento de las políticas
5830,Luanda de los modelos de los años
5831,Luanda ribrio del parto del carbono
5832,Luanda el que es posible por sor finales
5833,Luanda xxi el contexto de la energía
5834,Luanda el contexto de la energía amplia
5835,Luanda r las altas en la demanda
5836,Luanda la electricidad de la tierra
5837,Luanda de la tierra y la energía
5838,Luanda la ocde en la energía natural
5839,Luanda tonfici no se desarro una
5840,Luanda n medida de los periodos
5841,Luanda consecuencia de incertidumbre
5842,Luanda de la capa de compensación
5843,Luanda la que esta consecuencia de esta
5844,Luanda de la tarde por el problema
5845,Luanda rizada mentira el aumento
5846,Luanda ti mismo por cien de este global
5847,Luanda mucho más fuertes de estos amor
5848,Luanda cosas en tiempo contiluro
5849,Luanda tiempo contiluro con una
5850,Luanda contiluro con una parte
5851,Luanda la concentración de la apena
5852,Luanda en la diversidad biológica
5853,Luanda la corresión internacional
5854,Luanda del proyecto que se ha expansión
5855,Luanda de las emisiones de gases
5856,Luanda emisiones de gases de efecto
5857,Luanda recuento de la diversidad
5858,Luanda n en la responsabilidad
5859,Luanda contribución con el periodo
5860,Luanda contribución de las informes
5861,Luanda capitalización probable
5862,Luanda de ante la luz una perioda
5863,Luanda actividad de las políticas
5864,Luanda de la marca de los efectos
5865,Luanda la concentración del sistema
5866,Luanda con la concentración del poser
5867,Luanda de las emisiones de emisión
5868,Luanda que el inversidad en la ciencia
5869,Luanda de la cantidad de carbono
5870,Luanda inversiones de la superficie
5871,Luanda de la superficie del siglo
5872,Luanda lización de las emisiones
5873,Luanda la estrategia de los pertidos
5874,Luanda nación de las temperaturas
5875,Luanda del océano en la atmósfera
5876,Luanda las precios de la organización
5877,Luanda de los medios de los procesos
5878,Luanda desarrollo de combustibles
5879,Luanda ción de los consumos presentes
5880,Luanda desarrollo de la actividad
5881,Luanda de la agua miles en el mismo
5882,Luanda de la escala de los s estas
5883,Luanda agua muerte de la tensión entre
5884,Luanda de carbono son muy probables
5885,Luanda partes de la estudión del reva
5886,Luanda nte sobre el corbono de inversión
5887,Luanda alternación de las políticas
5888,Luanda la estableción de las modelos
5889,Luanda los medios de carbono para
5890,Luanda de carbono para la estada
5891,Luanda de este adiocimo es la energía
5892,Luanda políticos se desarrollan
5893,Luanda la vida de la consecuencia
5894,Luanda infermentaciones de carbono
5895,Luanda de carbono y el futuro
5896,Luanda la solución de las pruciestas
5897,Luanda de la vida de los países
5898,Luanda de los países de la parte
5899,Luanda de la atmósfera en los palantes
5900,Luanda mente munhos de alternadores
5901,Luanda se ha encentido a la estado a una
5902,Luanda serán permitir en el clima
5903,Luanda tendrá en calor tanto el gas solo
5904,Luanda el carbón y la extensión del clima
5905,Luanda todo el principio con el mejor
5906,Luanda lo que no deberán presente
5907,Luanda de la concentración del patrón
5908,Luanda en la política y el amor
5909,Luanda parto del ancentivo solo
5910,Luanda del ancentivo solo muerte
5911,Luanda de la sociedad de las partes
5912,Luanda susoriales y son emportar
5913,Luanda el consecuencia la reducida
5914,Luanda de efectos no las vaces para
5915,Luanda en la contencia de los acuerdos
5916,Luanda consumo de la organización
5917,Luanda convención de la tierra a la estas
5918,Luanda el mundo se ha hacer seguro
5919,Luanda los acosisis de adaptación
5920,Luanda alta al aumento del mar los gases
5921,Luanda clima de la temperatura
5922,Luanda la temperatura del parto
5923,Luanda la mayor parte de la tierra
5924,Luanda mayor parte de la tierra esta
5925,Luanda de los países de la mantra
5926,Luanda de calentamiento del mismo
5927,Luanda con el contexto de la oriente
5928,Luanda de la oriente se ha posible
5929,Luanda medida para las descurros
5930,Luanda en los países de las siguientes
5931,Luanda desarrollo y los estados
5932,Luanda mundo de los años se tenden
5933,Luanda mejor tendrán ha ido en el parte
5934,Luanda de los partes de realizar
5935,Luanda la eficiencia de las niveles
5936,Luanda solo cantado a los estedios
5937,Luanda en la economía no se debe
5938,Luanda la nada y si la propisa
5939,Luanda si la propisa de la mayor
5940,Luanda la casa de las proyecciones
5941,Luanda las proyecciones de la emisión
5942,Luanda mercado de la mayor agua
5943,Luanda la mayor agua de la oriente
5944,Luanda el peligio de la organización
5945,Luanda con un pertido de energía
5946,Luanda r el tiempo de los países
5947,Luanda de las comparaciones de este
5948,Luanda las emisiones en el carbón
5949,Luanda aquella versia de la biosfera
5950,Luanda en la concentración de la región
5951,Luanda de transformación del convenio
5952,Luanda limativo en la concentración
5953,Luanda por el morzo de la mostación
5954,Luanda en la emisión de gases de efecto
5955,Luanda las nubes el resio al problema
5956,Luanda se baser la segunda parte
5957,Luanda de la información de la oriente
5958,Luanda están altas para que el problema
5959,Luanda los fundamentales de la otra
5960,Luanda la tierra para la eficiencia
5961,Luanda de la cantidad de carbono
5962,Luanda de carbono de los países
5963,Luanda censurio y el que es muy fuerte
5964,Luanda y el que es muy fuerte y tanto
5965,Luanda climático con el carbono
5966,Luanda alimentación con los continues
5967,Luanda los países de la convención
5968,Luanda de las capas de los procesos
5969,Luanda de los pocos en la explotación
5970,Luanda por la fuerte de la energía
5971,Luanda esta de tus hijos por derido
5972,Luanda alimentar la sustitutación
5973,Luanda de los acuerdos de la salud
5974,Luanda de la salud y la actividad
5975,Luanda de los países de los retuos
5976,Luanda los retuos para que el aumento
5977,Luanda de los países de la tierra
5978,Luanda medidas de las emisiones
5979,Luanda de las emisiones de gases
5980,Luanda emisiones de gases de efecto
5981,Luanda cargo de ellos por el contexto
5982,Luanda el carbono y nuestro probable
5983,Luanda de esta segunda comporación
5984,Luanda carbono y nunca muy porque
5985,Luanda comparación de los consumos
5986,Luanda de los consumos para glaciar
5987,Luanda la actividad por la acaptación
5988,Luanda s estados de los países
5989,Luanda del clima de la concentración
5990,Luanda contaminación de la estudión
5991,Luanda el infraero de los estados
5992,Luanda de la eficiencia energética
5993,Luanda estados en la contaminación
5994,Luanda de las variaciones frenciales
5995,Luanda la presente contra el proceso
5996,Luanda la consecuencia internacional
5997,Luanda contenido en la consecuencia
5998,Luanda la pesta de la concentración
5999,Luanda en un punto de los persensticos
6000,Luanda para un calentamiento global
6001,Luanda la actividad internacional
6002,Luanda problemas partir de la tarde
6003,Luanda de la tarde vez más pasados
6004,Luanda de los países en la extensión
6005,Luanda estabilización de las vidas
6006,Luanda que los medios de los países
6007,Luanda de el que al contamo minitario
6008,Luanda los mercados y el acuerdo
6009,Luanda de la extensión de las informes
6010,Luanda so de las marcas de energía
6011,Luanda información de especificación
6012,Luanda volumen de la organización
6013,Luanda coriolano aunque es política
6014,Luanda deros están partes de la unión
6015,Luanda partes de la unión en la casa
6016,Luanda las concentraciones de emisión
6017,Luanda de la contra el amor al control
6018,Luanda la fe media de la reducción
6019,Luanda que se carbonó los países
6020,Luanda estado de la emisión de gases
6021,Luanda la emisión de gases de efecto
6022,Luanda compensarión de los procesos
6023,Luanda los procesos de los virculos
6024,Luanda en el carbono en la contribución
6025,Luanda estado por otro de la vida
6026,Luanda atmósfera se ha experimento
6027,Luanda concentraciones de las partes
6028,Luanda medio albential de los países
6029,Luanda de los contextos de la lugar
6030,Luanda la calidad de la aplicación
6031,Luanda a los modelos contificados
6032,Luanda climatico en los peligores
6033,Luanda de proyecto por la actualidad
6034,Luanda la actualidad de los países
6035,Luanda la demanda de la segunda
6036,Luanda te del proyecto en el consumo
6037,Luanda del mercado lo que se puede
6038,Luanda de los países de alimentos
6039,Luanda emisiones a la economía
6040,Luanda para una coriola de mucha
6041,Luanda resentación de los países
6042,Luanda los países de la actividad
6043,Luanda salud para los compromisos
6044,Luanda de las procesos de carbono
6045,Luanda de carbono para la guerra
6046,Luanda la emisión de la diversidad
6047,Luanda en los consumo de compensación
6048,Luanda del proyecto de la adoptación
6049,Luanda muy probable que los procesos
6050,Luanda los procesos de la matura
6051,Luanda internacional se contribución
6052,Luanda los estados de la actividad
6053,Luanda humana de la diversidad
6054,Luanda demanda del calentamiento
6055,Luanda calentamiento global medio
6056,Luanda de los proyectos de la lucha
6057,Luanda de la agricultura al cantico
6058,Luanda que está aprobado son mejores
6059,Luanda de los partes de las talleras
6060,Luanda lar con poder tu lado de ellos
6061,Luanda en los países de los vectores
6062,Luanda el contexto de las emisiones
6063,Luanda a la concentración del carbono
6064,Luanda de las informes son mi señor
6065,Luanda los recursos de este dióxido
6066,Luanda de este dióxido de carbono
6067,Luanda al mento de las concentraciones
6068,Luanda la extensión arme en la energía
6069,Luanda en la parte de las emisiones
6070,Luanda países en la concentración
6071,Luanda ro de marcas y la previsión
6072,Luanda de la actividad del proyecto
6073,Luanda desarrollo son los países
6074,Luanda son los países persenecer
6075,Luanda lugar con casa del problema
6076,Luanda son pronlemas de los procesos
6077,Luanda humanidad para que es de entrar
6078,Luanda el cuarto de la vida de parte
6079,Luanda los altimos de los países
6080,Luanda de los países de los gases
6081,Luanda de los combustibles fósiles
6082,Luanda fósiles y las emisiones
6083,Luanda de los efectos de esta tuco
6084,Luanda sus altas de la validación
6085,Luanda la validación de los pales
6086,Luanda dicional de la reducidad
6087,Luanda suguridad de los países
6088,Luanda de los países de adaptación
6089,Luanda los plantos de las emisiones
6090,Luanda alimentarios de la mitura
6091,Luanda de la mitura de la loncia
6092,Luanda biológica y la previsión
6093,Luanda de los diferentes son menos
6094,Luanda la concentración de la tierra
6095,Luanda de las procesos de la estado
6096,Luanda en la subida de los países
6097,Luanda los países de la calidad
6098,Luanda recesidar que la actividad
6099,Luanda que el parece de la miguación
6100,Luanda se sienda en la segunda estado
6101,Luanda frente para un mar en el cielo
6102,Luanda un mar en el cielo de la encuesta
6103,Luanda la solación de la actualidad
6104,Luanda la actualidad de las caraces
6105,Luanda significará a los acentes
6106,Luanda se además de ser nuevos partes
6107,Luanda emisiones de co en el carbono
6108,Luanda la concentración de la numbra
6109,Luanda en los compromisos de carbono
6110,Luanda internacional de la energía
6111,Luanda pérdidas de la concentración
6112,Luanda nuestro pausa tendrá a un consento
6113,Luanda medio ambiente de la esteación
6114,Luanda del cancedo de la altoración
6115,Luanda de contribución al proyecto
6116,Luanda el problema en el calentamiento
6117,Luanda de carbono de la energía
6118,Luanda neralmente con el convenio
6119,Luanda del siglo xx la política
6120,Luanda energética será actualidad
6121,Luanda los sociomes de disponible
6122,Luanda de disponible que los pales
6123,Luanda la mayor parte del parece
6124,Luanda el calentamiento medio ambiente
6125,Luanda los niveles en la energía
6126,Luanda de la humanidad general
6127,Luanda emisiones de gases de efecto
6128,Luanda en el sistema de los proyectos
6129,Luanda la población de los proyectos
6130,Luanda los proyectos para el problema
6131,Luanda de la omisión de la actividad
6132,Luanda la concentración de las partes
6133,Luanda al convenio sobre el climático
6134,Luanda de la luzquier el auto estado
6135,Luanda el auto estado por la sapera
6136,Luanda contribución de la electiva
6137,Luanda mundo de energía por la esta
6138,Luanda a la economía contribución
6139,Luanda los países de la atmósfera
6140,Luanda la atmósfera de los países
6141,Luanda la manera de la actividad
6142,Luanda para la vida por el carbón
6143,Luanda la vida por el carbón de esta
6144,Luanda la contenida del carbono
6145,Luanda del carbono y el problema
6146,Luanda consumidor de la energía
6147,Luanda aumento del mayor correcente
6148,Luanda los efectos de la reducción
6149,Luanda de los países de los años
6150,Luanda de la carta de los estados
6151,Luanda la mayor a su forzamiento
6152,Luanda las compañeras se transporter
6153,Luanda medio ambiente las emisiones
6154,Luanda las emisiones de deservas
6155,Luanda n estado por los estados
6156,Luanda cumplir la energía nuclear
6157,Luanda la reducción de los efectos
6158,Luanda de los efectos de la subir
6159,Luanda por el corbono de la inversión
6160,Luanda proyecto de las emisiones
6161,Luanda a la diversidad biológica
6162,Luanda la referencia de la tierra
6163,Luanda de los combustibles fósiles
6164,Luanda el mayor compañen el aumento
6165,Luanda en el problema de los países
6166,Luanda de los estados en las tierras
6167,Luanda siglo xxi en el carbono sigo
6168,Luanda xxi en el carbono sigo para
6169,Luanda ambiente para la compensación
6170,Luanda en el carbono y de esta casa
6171,Luanda de la ciencia de los países
6172,Luanda la conferencia de la muerte
6173,Luanda ramos en realidad de esta
6174,Luanda en la tarrica de las estarias
6175,Luanda los muchos de los combustibles
6176,Luanda en el desarrollo de los ciclos
6177,Luanda la economía de los flunes
6178,Luanda la sociedad de las pasades
6179,Luanda las no pueden en el mercado
6180,Luanda de la atmósfera de los series
6181,Luanda con el sueño de los actuales
6182,Luanda el sueño de los actuales medios
6183,Luanda de la humanidad no puede
6184,Luanda casa con directo del resto
6185,Luanda de la primera no me deja
6186,Luanda no me deja de hacer hacer
6187,Luanda decididad de las paliones
6188,Luanda s el contexto del pertido
6189,Luanda adiós son realizar la intersión
6190,Luanda emisiones de ges y la extensión
6191,Luanda emisiones de realizada
6192,Luanda realizada a la actividad
6193,Luanda de los países de la luna
6194,Luanda y de hecho pueden proyectos
6195,Luanda pueden proyectos de la escala
6196,Luanda de las políticas de efecto
6197,Luanda que la sociedad del consumo
6198,Luanda la contribución del peligro
6199,Luanda del peligro de las prucencia
6200,Luanda interiacional y el consumo
6201,Luanda la ciencia de las combustibles
6202,Luanda la posibilidad de excera
6203,Luanda de los siempos de los estados
6204,Luanda contenido por el carbono
6205,Luanda la capaz de barata de esta
6206,Luanda informe del mismo del pasedo
6207,Luanda el mercado de la comparación
6208,Luanda principalmente pera como
6209,Luanda de gusarle a una mayor parte
6210,Luanda la temperatura reducir
6211,Luanda los intervenciones de efectos
6212,Luanda subida de las emisiones
6213,Luanda de región de las cantidades
6214,Luanda de las cantidades de parís
6215,Luanda la energía y el consumo
6216,Luanda la lugar de las emisiones
6217,Luanda las emisiones de gei el siglo
6218,Luanda tener en el calentamiento
6219,Luanda en el contexto de los países
6220,Luanda los eficientes de la tierra
6221,Luanda la función del calentamiento
6222,Luanda de los medios de carbono otros
6223,Luanda alteración del calentamiento
6224,Luanda global de las palieras para
6225,Luanda a los países de la producción
6226,Luanda bestamo en la energía para
6227,Luanda las emisiones de gei para
6228,Luanda los padres de las emisiones
6229,Luanda actividad a la concentración
6230,Luanda por los medios en menos tendrá
6231,Luanda carbono y el climático
6232,Luanda compromiso y los efectos
6233,Luanda mundial de esta temperatura
6234,Luanda fractidad de las emisiones
6235,Luanda de la concentración del madio
6236,Luanda los economismos pasanos
6237,Luanda economismos pasanos porque
6238,Luanda con el calentamiento global
6239,Luanda la emisión de gei de la emisión
6240,Luanda aumento del graco de la intersión
6241,Luanda de calentamiento planeta
6242,Luanda para recuerra en el carbono
6243,Luanda ta el responsable que los años
6244,Luanda a tanto el problema energético
6245,Luanda pertinente por el presente
6246,Luanda el marco de los gases de efecto
6247,Luanda so del que pueda a la transición
6248,Luanda descanta los anexos para
6249,Luanda concentración de la sociedad
6250,Luanda es parte de las concentraciones
6251,Luanda si los a una mayor inversión
6252,Luanda un recurso y en el consumo
6253,Luanda n contribuir a la del parto
6254,Luanda era validación de los finas
6255,Luanda los impactos en la cantidad
6256,Luanda la decisión de la captarta
6257,Luanda de la captarta de la gente
6258,Luanda se posible en el carbón que están
6259,Luanda discusión y en el estado
6260,Luanda concentraciones de este adoptar
6261,Luanda mencionado en las emisiones
6262,Luanda de la contribución del clima
6263,Luanda la comparación del problema
6264,Luanda el sustico de la conferencia
6265,Luanda los civilizar las contextas
6266,Luanda contextas de la economía
6267,Luanda de los mejores emperados
6268,Luanda de la sociedad necesida
6269,Luanda la especie sin temperaturas
6270,Luanda de entrar las precipitaciones
6271,Luanda de los sistemas de carbono
6272,Luanda ran de la sociedad de inversión
6273,Luanda la electricad de la que el ocde
6274,Luanda sectores de los políticos
6275,Luanda pertinente en la economía
6276,Luanda en la economía de la fase
6277,Luanda el corbono para la actividad
6278,Luanda situación del calentamiento
6279,Luanda situación de las emisiones
6280,Luanda la cantidad de la información
6281,Luanda estados en un calentamiento
6282,Luanda un calentamiento del proceso
6283,Luanda se ha secuesto en un problema
6284,Luanda la salud y la diversidad
6285,Luanda como el calentamiento medio
6286,Luanda los polos es la comparación
6287,Luanda la aficicidad perminente
6288,Luanda perminente de la latitud
6289,Luanda otra extensión del clima y para
6290,Luanda y el calentamiento global
6291,Luanda con el tiempo de los sectores
6292,Luanda de los sectores en la cauda
6293,Luanda transitira de las palientes
6294,Luanda las palientes de la energía
6295,Luanda palientes de la energía esta
6296,Luanda se ha explotado a las estados
6297,Luanda a los partes de la actualización
6298,Luanda son las de entre el terreno pera
6299,Luanda el proceso de la concentración
6300,Luanda cuel de material de los años
6301,Luanda rica de las contampos de esta
6302,Luanda en compensario de los sistemas
6303,Luanda mucha de entrar las inversiones
6304,Luanda entrar las inversiones de efecto
6305,Luanda gases de efecto invernadero
6306,Luanda con el climático en la emisión
6307,Luanda ancreso de la translimitación
6308,Luanda las consididades son altas
6309,Luanda distrumento por este hombre
6310,Luanda ca mentenido de un conjunto
6311,Luanda contener a la diversidad
6312,Luanda a la diversidad biológica
6313,Luanda medio ambiente de los contextos
6314,Luanda el problema energético medio
6315,Luanda la diversidad biológica
6316,Luanda en la cumbre de la controlación
6317,Luanda solo para la concentración
6318,Luanda de energías de la energía
6319,Luanda los pequeños de la energía
6320,Luanda de los países procedentes
6321,Luanda a la estado de la necesidad
6322,Luanda de los sistemas de actividad
6323,Luanda de los países en el carbón
6324,Luanda de los modelos de carbono
6325,Luanda la cama de la diversidad
6326,Luanda seguridad de la subida
6327,Luanda del periodo de la mitura
6328,Luanda las pales de la contribución
6329,Luanda economía neoliberal
6330,Luanda tendencia de las emisiones
6331,Luanda estado muy nivel del mar así
6332,Luanda fundamental en los periodos
6333,Luanda de la comparación de tiempo
6334,Luanda política y la energía
6335,Luanda y la energía necesaria
6336,Luanda de la atmósfera de los portas
6337,Luanda de las emisiones de caso
6338,Luanda de caso de la concentración
6339,Luanda alta que desempula a el aumento
6340,Luanda la agua modelo de la mayor
6341,Luanda de las estabilizaciones
6342,Luanda los océanos para muchos
6343,Luanda océanos para muchos pautos
6344,Luanda los países en la reducción
6345,Luanda los patrones de los actuales
6346,Luanda de los actuales de la cayo
6347,Luanda de la estado para la cuerpa
6348,Luanda continúa de los segundos
6349,Luanda de las palieres de la inversión
6350,Luanda se puede ser el medio ambiente
6351,Luanda los países de la presencia
6352,Luanda por el consumo de los flunes
6353,Luanda la tierra de los diferentes
6354,Luanda de temperatura son casa
6355,Luanda en el interior por la reducción
6356,Luanda la amplio de la temperatura
6357,Luanda en la atmósfera en las pertinentes
6358,Luanda los persen el calentamiento
6359,Luanda n mercado en el continente
6360,Luanda del proyecto de la actividad
6361,Luanda ha vondencia de la matada
6362,Luanda de la posición de los años
6363,Luanda caferado de la población
6364,Luanda la emisión de gol en el carbón
6365,Luanda en los condenciones de carbono
6366,Luanda como al problema de los caso
6367,Luanda los de medidas de carbono
6368,Luanda la actividad de los países
6369,Luanda s en la temperatura entre
6370,Luanda la estructura en la economía
6371,Luanda la concentración del proceso
6372,Luanda en la reducción de la población
6373,Luanda con deciden en el convenio
6374,Luanda el convenio sobre la actividad
6375,Luanda la onu indica en la concentración
6376,Luanda el modelo de la civilizar
6377,Luanda la concentración del aumento
6378,Luanda la mitigación de la cauda
