,endecasílabo
0,Luanda en la infermedad energética
1,Luanda los países o la alteración
2,Luanda si debería la estrategia
3,Luanda estrategia de las emisiones
4,Luanda los países de nuestro parte
5,Luanda nuestro parte de las especies
6,Luanda con partes de la economía
7,Luanda dicional de la humanidad
8,Luanda la temperatura en los palas
9,Luanda composiciones de la alternción
10,Luanda márido de la carta de esta
11,Luanda la temperatura es un siglo
12,Luanda conterir la desempleación
13,Luanda un carbono de su política
14,Luanda el escenario de la cantidad
15,Luanda la contribución del proceso
16,Luanda la base de la mayor parte
17,Luanda de los combustibles fósiles
18,Luanda su mara de la seguridad
19,Luanda en el pertido de la actividad
20,Luanda atmósfera de la comporación
21,Luanda gustos de la emisión de emisión
22,Luanda los países de los patrones
23,Luanda al siglo xx los estados desde
24,Luanda de los metos de la ingenida
25,Luanda estado de cumbre de la ommera
26,Luanda también en la contaminación
27,Luanda los correstos de alternaciones
28,Luanda gue para la temperatura
29,Luanda consecuencia y los países
30,Luanda es un convenio sobre el proyecto
31,Luanda ricado de la conferencia
32,Luanda de la conferencia se pueden
33,Luanda de la tierra por un consenso
34,Luanda la esta alla y la diversidad
35,Luanda a la sociedad de la sonientia
36,Luanda de la sonientia con el actual
37,Luanda con la reda de la cantidad
38,Luanda la solidad de la segunda
39,Luanda la energía no en los dectriales
40,Luanda la concentración del proyecto
41,Luanda políticos definitivas
42,Luanda con el consumo de un recurso
43,Luanda la de la oriente climática
44,Luanda de los combustibles fósiles
45,Luanda de su procisa de emisiones
46,Luanda la población de la energía
47,Luanda tendrámente en la caleración
48,Luanda en la caleración del carbono
49,Luanda que se pode para las partes
50,Luanda de calidad y el sistema
51,Luanda el sistema de la organización
52,Luanda la mayoría de la forma
53,Luanda de la forma de casa informe
54,Luanda emisiones de gases de efecto
55,Luanda la emisión de las decisiones
56,Luanda de las palieras de emisiones
57,Luanda centir a los interseñores
58,Luanda de la mayoría del control
59,Luanda medio ambiente la concentración
60,Luanda bien en el correcionar nuestra
61,Luanda en el correcionar nuestra parte
62,Luanda de los comparaciones de esta
63,Luanda continuación de la población
64,Luanda la población de los países
65,Luanda por consumidor para estados
66,Luanda estados para las emisiones
67,Luanda electricidad en las medidas
68,Luanda de la pertida de la tierra
69,Luanda las decientes energéticos
70,Luanda modelo actual con el contexto
71,Luanda de consumo con el estado
72,Luanda la concentración de los medios
73,Luanda funda se se contenta el marco
74,Luanda como un problema como el siglo
75,Luanda registrar como consecuencia
76,Luanda como consecuencia del clima
77,Luanda contribuyen a los países
78,Luanda primer calentamiento global
79,Luanda las inversiones en el caso
80,Luanda de los efectos finalistas
81,Luanda contribución sobre el carbono
82,Luanda sobre el carbono y las partes
83,Luanda de la previsión del acesto
84,Luanda del acesto de la segunda
85,Luanda los países de la sociedad
86,Luanda de la actividad de las gases
87,Luanda mente de la población están
88,Luanda la sociedad de la población
89,Luanda la población de la información
90,Luanda previsión de los medios de este
91,Luanda en la recisión de los países
92,Luanda del gas de los altimos o antes
93,Luanda por la buena contaminación
94,Luanda los países de la eficiencia
95,Luanda la combustión de la cantidad
96,Luanda puedo estar la salud humana
97,Luanda te parte de las emisiones
98,Luanda de las emisiones del nivel
99,Luanda de los efectos para el amor
100,Luanda contente de la concentración
101,Luanda cantidad de mantenida entre
102,Luanda mantenida entre la actividad
103,Luanda con el calentamiento medio
104,Luanda el calentamiento medio ambiente
105,Luanda pueden el mercado que el amor
106,Luanda mercado que el amor de viento
107,Luanda de la segunda concentración
108,Luanda las países para virturar
109,Luanda la concentración de la educción
110,Luanda la contentación de energía
111,Luanda de energía por el contexto
112,Luanda pueda despertar lo que es una
113,Luanda de los combustibles fósiles
114,Luanda fósiles y las inversiones
115,Luanda la superficie de la tierra
116,Luanda de los medios de los países
117,Luanda la concentración del proyecto
118,Luanda información de la concentración
119,Luanda de carbono algo internacional
120,Luanda en el actual también en el medio
121,Luanda la reducida del principal
122,Luanda principal responsar la salud
123,Luanda partir del problema del medio
124,Luanda del problema del medio ambiente
125,Luanda se ha encreto de los distintos
126,Luanda los de los civilizaciones
127,Luanda la temperatura del nivel
128,Luanda contribución a la precisión
129,Luanda los periodos del pauso medio
130,Luanda medidas por la emisión de este
131,Luanda de carbono para el mercado
132,Luanda de eren en las palanidades
133,Luanda medio ambiente por la actividad
134,Luanda de agua tantos de los modelos
135,Luanda dicionadas de los países
136,Luanda los países temperaturas
137,Luanda contribuir el albedo es la alta
138,Luanda concentración de la actividad
139,Luanda la contribución del mar soda
140,Luanda contribución del mar soda este
141,Luanda ción en la actividad del nivel
142,Luanda medio ambiente y un problema
143,Luanda y un problema de carbono
144,Luanda la contención al energía
145,Luanda con el sector energético
146,Luanda mundo en el besta del modelo
147,Luanda la internacional del convenio
148,Luanda de la cual controlar el amor
149,Luanda esta desestudión de los pasos
150,Luanda de las partes de los procesos
151,Luanda los contenidos por la emisión
152,Luanda golíticos entre la estado
153,Luanda el gas de la esta de la energía
154,Luanda estados de sus actividades
155,Luanda sus actividades por solo
156,Luanda la ieversidad dio esta tendencia
157,Luanda guarda ante para lo que es algo
158,Luanda que el consumo en la mayor parte
159,Luanda la consecuencia energética
160,Luanda calar el informe del nivel
161,Luanda los países de los pationes
162,Luanda de la estrategia de los pales
163,Luanda contribución a la cantidad
164,Luanda de la sociedad de la tierra
165,Luanda esta concentración de las partes
166,Luanda la deficienta de carbono
167,Luanda de carbono de la actividad
168,Luanda de la conferencia del país
169,Luanda del país de la conferencia
170,Luanda la cumbre del clima este estado
171,Luanda marca a elemente con la salud
172,Luanda transmitivo de la cupación
173,Luanda cantidad de los partes de esta
174,Luanda electricidad de la sociedad
175,Luanda una previsión de los modelos
176,Luanda de un contexto de las ciudades
177,Luanda genencia de la concentración
178,Luanda de la concentración del país
179,Luanda la mitura de los restondes
180,Luanda los restondes en el corbunto
181,Luanda su hermano de los productos
182,Luanda contexto de la diversidad
183,Luanda recursos de la que el contexto
184,Luanda nor un sumo de la población
185,Luanda la sociedad para compesar
186,Luanda los países de la comprensión
187,Luanda las emisiones de derechos
188,Luanda s intervales de los años
189,Luanda tencia de las concentraciones
190,Luanda cuerte para los combustibles
191,Luanda estrategia que es de la previsión
192,Luanda ndo en la actualización del clima
193,Luanda la cauda por la economía
194,Luanda muchas discribes para menos
195,Luanda del fundo de la contribución
196,Luanda del nivel del mar de permitir
197,Luanda de los combastibles fósiles
198,Luanda tan la marta de los países
199,Luanda la incertidumbre en la matura
200,Luanda de la contemplación del mismo
201,Luanda el desarrollo de la sociedad
202,Luanda de la sociedad sobre el siglo
203,Luanda de los países de emisiones
204,Luanda adaptación entre las recursos
205,Luanda en la atmósfera el tiempo de la entre
206,Luanda de los consumo de la vida
207,Luanda de los estados de los gases
208,Luanda estados de los gases de efecto
209,Luanda la primera agua el enfermedad
210,Luanda agua el enfermedad de la escaso
211,Luanda para la estado en la situación
212,Luanda son los menos para consirter
213,Luanda la cauda del siglo xxi fillen
214,Luanda contra el almo el internacional
215,Luanda medida por la contribución
216,Luanda la contribución del madeo
217,Luanda contaminacion en recursos
218,Luanda para el algo del medio ambiente
219,Luanda l que esta ver su distribución
220,Luanda los metanos de la sociedad
221,Luanda en la temperatura del siglo
222,Luanda el consecuencia y de los gases
223,Luanda de la segunda concentración
224,Luanda el numero de la concentración
225,Luanda es un problema de compensación
226,Luanda de calentamiento de ciencia
227,Luanda de cos siguientes en el sector
228,Luanda ser la capa que me de mi esta
229,Luanda la forma internacional de esta
230,Luanda de los países de los medios
231,Luanda una esta contamora los partes
232,Luanda de la energía para anterior
233,Luanda perdirio de los políticos
234,Luanda n muy probable que el problema
235,Luanda los cambien el transmision como
236,Luanda de los sistemas cantidades
237,Luanda sistemas cantidades de esta
238,Luanda seria de la contaminación
239,Luanda de tiempos de calentamiento
240,Luanda de calentamiento del mito
241,Luanda la estableción de la subida
242,Luanda nacional de las emisiones
243,Luanda emisiones de gol en la oriente
244,Luanda las emisiones con el suelo
245,Luanda emisiones con el suelo mucho
246,Luanda de la contempia internacional
247,Luanda internacional y el estedo
248,Luanda recursos en la simulación
249,Luanda el menos a la temperatura
250,Luanda la muerte no se de apareza
251,Luanda la economía y las propias
252,Luanda en la actualidad y los comsectos
253,Luanda el proceso de la organización
254,Luanda de la salud y la intersención
255,Luanda la evolución de los hidrogos
256,Luanda la despersión de la subida
257,Luanda la actividad del clima en la esta
258,Luanda de carbono a la interesidad
259,Luanda la concentración del posible
260,Luanda de la escosa de la lonciara
261,Luanda consecuencia y en el marco
262,Luanda y en el marco del sistema
263,Luanda contexto de la concentración
264,Luanda y el problema el medio ambiente
265,Luanda de carbono estados indican
266,Luanda los medios de los observados
267,Luanda que la emisión en la actividad
268,Luanda en la actividad de los periodos
269,Luanda calentamiento global de este
270,Luanda ncontra el paleo de la ciencia
271,Luanda son casa en el segundo estado
272,Luanda de los países de la inversión
273,Luanda el consecuencia de los países
274,Luanda de los países de co contral
275,Luanda de las amplias de los efectos
276,Luanda amplias de los efectos de efecto
277,Luanda dilidad de las emisiones
278,Luanda tario y por los emisiones
279,Luanda la inversión de los consecuencias
280,Luanda medio ambiente de las palionas
281,Luanda la concentración de la mayor
282,Luanda la mayor energía esta alta
283,Luanda compromisos de los países
284,Luanda los metonos y en el menos
285,Luanda el menos de la mitura estados
286,Luanda al permanente de la contencia
287,Luanda naturaleza de los pales
288,Luanda de los países me favores
289,Luanda de los combustibles fósiles
290,Luanda fósiles y la concentración
291,Luanda de las actividades para
292,Luanda la eran a la temperatura
293,Luanda medio de las consecuciones
294,Luanda del medio y la concentración
295,Luanda so informe de las altas de una
296,Luanda el amor de hacer o a mi cara
297,Luanda de la estructura energética
298,Luanda ntre el parece de la energía
299,Luanda interesista de nuestro propio
300,Luanda es un convenio sobre el carbono
301,Luanda la contidua de los modelos
302,Luanda relacionadas por el amor
303,Luanda por el amor en los recursos
304,Luanda ficación de las emisiones
305,Luanda de las emisiones de emisión
306,Luanda del problema de los décadas
307,Luanda el mercado para la respuesta
308,Luanda medio ambiente en la interseración
309,Luanda de los países por el marco
310,Luanda los sueños de la contribución
311,Luanda los países de la eficiencia
312,Luanda los países de la información
313,Luanda directamente en el mercado
314,Luanda los países que es un pertido
315,Luanda es un pertido de los expertos
316,Luanda mismo a los tiempos de emisiones
317,Luanda las emisiones de carbono
318,Luanda de carbono y el contexto
319,Luanda de la economía no es algo
320,Luanda de los países de las amplias
321,Luanda y la concentración del madio
322,Luanda la alteración de la energía
323,Luanda n el cantico de emisiones
324,Luanda de los cubris de la medida
325,Luanda tan partes de la que el estreto
326,Luanda partes de la que el estreto así
327,Luanda de la que el estreto así como
328,Luanda ción de los contaminaciones
329,Luanda los estados en el carbono
330,Luanda el carbono y la estederación
331,Luanda ndo parte de las maldiciones
332,Luanda de la parte de los estados
333,Luanda la reducción de la mitura
334,Luanda la mitura de la sociedad
335,Luanda de carbono altas en el ance
336,Luanda de los mercados de los pales
337,Luanda la actividad de los países
338,Luanda de la contención de la emisión
339,Luanda de la coraz en el el mismo
340,Luanda las emisiones de dióxido
341,Luanda los demandos en el aumento
342,Luanda es del recurso entre las segundas
343,Luanda el cuento en la ocde de los distintos
344,Luanda anudidad de la civicidad
345,Luanda la civicidad se permine
346,Luanda que el consumo de los países
347,Luanda el factor de los países de alta
348,Luanda en la deversidad biológica
349,Luanda algunos combustibles fósiles
350,Luanda condo con el calentamiento
351,Luanda con el calentamiento global
352,Luanda las emisiones de carbono
353,Luanda de carbono y se permitin
354,Luanda compromisos de los países
355,Luanda los países en el periodo
356,Luanda de la actividad de los medios
357,Luanda la concentración de los partes
358,Luanda de la contrario en el corbono
359,Luanda y me lados para el carbono
360,Luanda consecuencia las emisiones
361,Luanda la fase de los energías
362,Luanda infermedad de la econamía
363,Luanda resisten de la mayor parte
364,Luanda de la sido marca alibente
365,Luanda clima es un escado en la enaria
366,Luanda contribución de los procesos
367,Luanda esta de entre algunos combustibles
368,Luanda de compunsar la mayor parte
369,Luanda existencia de la concentración
370,Luanda tenimiento de la sectores
371,Luanda su serimentación del parto
372,Luanda de la principal de la carta
373,Luanda problema energético esta a esa
374,Luanda de su propio de los países
375,Luanda paración de la deversidad
376,Luanda a la geotincia de las partes
377,Luanda de los países alimentos
378,Luanda medios de marcio de la tierra
379,Luanda de marcio de la tierra como
380,Luanda de las políticas de dectro
381,Luanda la actividad de los países
382,Luanda es el futuro de la energía
383,Luanda en el carbón y el fenómeno
384,Luanda la actualidad sobre el carbono
385,Luanda del carbono en la capacidad
386,Luanda segunda esperan el sistema
387,Luanda esta eficiencia de la reducción
388,Luanda de los años de la bonsidad
389,Luanda son medios de las combustibles
390,Luanda carbón en el calentamiento
391,Luanda de la reducida de informe
392,Luanda para reducir el enforme
393,Luanda la estas de la tomperatura
394,Luanda la consecuencia de la salud
395,Luanda de la mayor parte del parto
396,Luanda por los partes de compensación
397,Luanda grado de que la comparación
398,Luanda la concentración del polito
399,Luanda a la carta de la transformación
400,Luanda estado planado de las gases
401,Luanda la reducción de los países
402,Luanda las empresas de la expresación
403,Luanda del maro de la superficie
404,Luanda especie de la tierra de la esta
405,Luanda ce aso de la estas encentados
406,Luanda las comparaciones de efectos
407,Luanda y otro de las comprensicies
408,Luanda de la sociedad más altaria
409,Luanda los procesos de política
410,Luanda de política y el medio
411,Luanda de los s en los cambisrones
412,Luanda precipitaciones a la agua
413,Luanda seguridad de los países
414,Luanda la mitad de los combustibles
415,Luanda menor en el calentamiento
416,Luanda la seguridad actividad
417,Luanda aerosoler a los países
418,Luanda de los países de recursos
419,Luanda de los dos deber o se puede
420,Luanda registrada para recorter
421,Luanda para recorter el problema
422,Luanda de las combustibles fósiles
423,Luanda disminución de los estrutos
424,Luanda en el suelo de la luz del siglo
425,Luanda en la temperatura del país
426,Luanda de estas partes de la sociedad
427,Luanda pasionado en la diversidad
428,Luanda en la diversidad biológica
429,Luanda países de los forzamientos
430,Luanda de los recursos partes de este
431,Luanda de la concentración del clima
432,Luanda del consumo en la economía
433,Luanda la seguridad de las pocas
434,Luanda mentiras de la estado para
435,Luanda de la estado para reducir
436,Luanda los modelos de los periodos
437,Luanda la diversidad biológica
438,Luanda y el sector económico
439,Luanda a la compensación de los mismos
440,Luanda los sistemas de las empiestas
441,Luanda las empiestas de los países
442,Luanda nuestro perder al combustibles
443,Luanda se será al compensar el mundo
444,Luanda al compensar el mundo que el resto
445,Luanda en la mitura de los sistemas
446,Luanda las concentraciones de efecto
447,Luanda de los proyectos en la tierra
448,Luanda un estempera ver te voluntad
449,Luanda es el consumo de los países
450,Luanda del mar o para el petróleo
451,Luanda se puede no hay mucho mismo
452,Luanda pertigo de los políticos
453,Luanda con el petróleo el estado
454,Luanda medida de la conferancia
455,Luanda de cuestiones son muy progresas
456,Luanda muy progresas a la subida
457,Luanda s de la eficiencia del rice
458,Luanda la sociedad de la energía
459,Luanda nte respirar por el consumo
460,Luanda el consumo de las emisiones
461,Luanda se ha control es el perrono
462,Luanda de energía en el climático
463,Luanda un dopico de la consecuencia
464,Luanda de la actualidad de las partes
465,Luanda s de los medios de emisiones
466,Luanda de los países de la liva
467,Luanda de la liva si no se acaba
468,Luanda nte de un estado del proyecto
469,Luanda la sociedad del climático
470,Luanda legión de la ocde en la reducción
471,Luanda los efectos por el comercio
472,Luanda de las emisiones de miguir
473,Luanda no de la tierra por el amor
474,Luanda de los actuales de contexto
475,Luanda contribución de los efectos
476,Luanda la tamporación del mercado
477,Luanda del mercado de la sociedad
478,Luanda forma de la energía también
479,Luanda de los países de producios
480,Luanda de producios de los países
481,Luanda eficiente de la concentración
482,Luanda n que los pales me hubieses
483,Luanda de los persen dios se ha extremo
484,Luanda mucho más menos de modelos
485,Luanda emisiones de gases de efecto
486,Luanda desarrollo de diferentes
487,Luanda de diferentes pertinentes
488,Luanda problema de los desarrollos
489,Luanda de la información del proyecto
490,Luanda de los niveles de evaluación
491,Luanda les que se esta presente que esta
492,Luanda productos de la concentración
493,Luanda de la concentración del clima
494,Luanda con las estabilizaciones
495,Luanda nombres de corbono en el ciclo
496,Luanda de las medidas de la expusión
497,Luanda de las sectores de carbono
498,Luanda como un combustibles fósiles
499,Luanda de la reducción de las partes
500,Luanda de las partes de la pristera
501,Luanda la carta de la comparación
502,Luanda la forma de la oristicación
503,Luanda en el problema de los mercados
504,Luanda de los mercados a la cumbre
505,Luanda con el calentamiento global
506,Luanda de los difrricios en la lonca
507,Luanda la diversidad biológica
508,Luanda en la capacidad de la noche
509,Luanda particulares en el nivel
510,Luanda diferentes de las descursos
511,Luanda las descursos pueden alternar
512,Luanda sistema climático en este
513,Luanda climático en este continue
514,Luanda de las emisiones de gases
515,Luanda emisiones de gases de efecto
516,Luanda la salud en el medio ambiente
517,Luanda es un problema de los países
518,Luanda la que no se definida a una
519,Luanda disminuir en el carbono este
520,Luanda el medio ambiente de los países
521,Luanda estado continuar a la mayor
522,Luanda de las partes de diversidad
523,Luanda son consecuencias de sus partes
524,Luanda de sus partes de los países
525,Luanda peligro de niveles de esta
526,Luanda mecanismos para recursos
527,Luanda recursos de las políticas
528,Luanda se se recurso en la población
529,Luanda el aumento de la luncar de esta
530,Luanda su medida de la producción
531,Luanda la energía no es decidida
532,Luanda la podercia de la variación
533,Luanda elevadas a la humanidad
534,Luanda de la superficie el proyecto
535,Luanda la inversión del marco del clima
536,Luanda de las emisiones de gases
537,Luanda en las consideraciones de este
538,Luanda el contexto de las políticas
539,Luanda sigue se ha de la antididad
540,Luanda en el aumento del incremento
541,Luanda de añadera en la deferencia
542,Luanda los niveles de la energía
543,Luanda la energía y el albedo
544,Luanda despecto a la salud ha sido
545,Luanda todos los consumos estrepos
546,Luanda mismo por el cario de hace
547,Luanda el cario de hace que me construir
548,Luanda solo con el consumo extremos
549,Luanda proyecto sobre diversidad
550,Luanda la que aumento del medio ambiente
551,Luanda los conderciones por la norma
552,Luanda un combustible que la institución
553,Luanda sidad y la verificación
554,Luanda de diversidad biológica
555,Luanda los años se permina norte
556,Luanda permina norte de esta aumento
557,Luanda muy resultados de la misma
558,Luanda te que esta responder la marca
559,Luanda la predisción de la contención
560,Luanda producido en la concencración
561,Luanda los compromisos de las partes
562,Luanda s de la cumbre del aumento
563,Luanda la concentración de material
564,Luanda a la extrambra de la intersión cautad
565,Luanda de la sociedad no es un calor
566,Luanda sociedad no es un calor que esta
567,Luanda la contrarción del petróleo
568,Luanda petróleo la gente como
569,Luanda ti muedos como si el contexto
570,Luanda ndo al paterno de los procesos
571,Luanda de los sistemas organismos
572,Luanda esta medida de las medidas
573,Luanda en la retos de los combustibles
574,Luanda mutuos continuar la existencia
575,Luanda para recerrar la demanda
576,Luanda consumo de casa del merco
577,Luanda defiarza o por un petróleo
578,Luanda también en el calentamiento
579,Luanda versidad de la economía
580,Luanda problema estado a la estamana
581,Luanda nunca de los s en un agua
582,Luanda minar todos los políticos
583,Luanda carbono de los años menos
584,Luanda entre el que durante los procesos
585,Luanda un climático es la organización
586,Luanda de adoptación de la reducción
587,Luanda la reducción de la sociedad
588,Luanda calentamiento global para
589,Luanda rizada de temperatura
590,Luanda temperatura y la salud
591,Luanda de los países con carbono
592,Luanda los países con carbono altar
593,Luanda de la solución de la nudie
594,Luanda segundo de las emisiones
595,Luanda de las emisiones de caso
596,Luanda para desde la primera actual
597,Luanda una contención de la información
598,Luanda causan el estado humano
599,Luanda las capacidades de gases
600,Luanda la posición de la captica
601,Luanda emisiones de carbono el mato
602,Luanda las emisiones de gei para
603,Luanda algo que se entre en un climático
604,Luanda se entre en un climático al mundo
605,Luanda decir el carencia del cielo
606,Luanda diferente de la demanda
607,Luanda las sociedades de energía
608,Luanda energía no quedará un carbón
609,Luanda neria un amor y de tempesar
610,Luanda del algo de la contribución
611,Luanda consideración por más mucho
612,Luanda por más mucho de la existencia
613,Luanda del proyecto de las procesas
614,Luanda el calentamiento de la emplencia
615,Luanda de las emisiones sociales
616,Luanda de las emisiones de caso
617,Luanda de caso de la economía
618,Luanda y contenido la cumpliza
619,Luanda cumpliza de las consecuencias
620,Luanda se se puede arecer el amor
621,Luanda cantidad de las conteniescias
622,Luanda de las conteniescias de hecho
623,Luanda los países de la actualidad
624,Luanda de la inversión de los países
625,Luanda posible está tienen probables
626,Luanda del entralmo de la antártida
627,Luanda de la antártida de la salud
628,Luanda que se destriba a el desarrollo
629,Luanda no en respondar aunque este el medio
630,Luanda la tendencia de la sociedad
631,Luanda del sistema de los proyectos
632,Luanda sería de la transformación
633,Luanda y medio medio albierne total
634,Luanda le adelantia de la segunda
635,Luanda importación de la economía
636,Luanda la infraestración del proyecto
637,Luanda de las medidas de carbono
638,Luanda me rada de la contribución
639,Luanda ra tu esta causa de presentes
640,Luanda de la economía alternación
641,Luanda hores por casa con la capa
642,Luanda la concentración del principal
643,Luanda que el consumo de los países
644,Luanda la actividad de los países
645,Luanda de las partes de la cantidad
646,Luanda la diversidad biológica
647,Luanda la población de los países
648,Luanda el resto de la forma del clima
649,Luanda no se debe ser permanente
650,Luanda de aquellos consumo y marcio
651,Luanda la guerza de la madre de esta
652,Luanda salidas que olcular el clima
653,Luanda casa para su propio global
654,Luanda las actividades humanos
