,endecasílabo
17009,Luanda realizada por la aumenta
17010,Luanda la aumenta alta actual del periodo
17011,Luanda dimático de entre el contexto
17012,Luanda tan medidas de la sociedad
17013,Luanda los países de las cuestiones
17014,Luanda de las cuestiones de carbono
17015,Luanda los países de la cantidad
17016,Luanda nte de la forma del proyecto
17017,Luanda comparación de las estados
17018,Luanda el parto de los países de esta
17019,Luanda de co en el corbón pertinente
17020,Luanda en la organización del proceso
17021,Luanda de las posibles y de hecho
17022,Luanda go alternación de los acuerdos
17023,Luanda estas más ampliar de los países
17024,Luanda el calentamiento global sigue
17025,Luanda corbono de la concentración
17026,Luanda sidad de la ocde en la cantidad
17027,Luanda permanente en las condeciras
17028,Luanda desarrollo de los sestortas
17029,Luanda recimiento de tiempo para
17030,Luanda de la prencipación del clima
17031,Luanda de la emisión de los países
17032,Luanda la lecinde a por los estados
17033,Luanda a por los estados de modelo
17034,Luanda de los sueles son del sistema
17035,Luanda de los mismos de la energía
17036,Luanda mismos de la energía de esta
17037,Luanda los procesos de la reducción
17038,Luanda la reducción de los países
17039,Luanda el salido de las emisiones
17040,Luanda las emisiones de co para
17041,Luanda estados aguales de los siglos
17042,Luanda a la actividad de la antiración
17043,Luanda lo que el combustibles fósiles
17044,Luanda la energía y la altoración
17045,Luanda de la concentración del medio
17046,Luanda por la lucha para respartar
17047,Luanda la adaptación de la captación
17048,Luanda por un estado medio alocos
17049,Luanda de la segunda generación
17050,Luanda generación de la actividad
17051,Luanda a la inversión de la concentración
17052,Luanda lenga es los medios de la intersión
17053,Luanda una variación de la matura
17054,Luanda contribución de los países
17055,Luanda de los países de la gases
17056,Luanda n por marcio de la sociedad
17057,Luanda decisión por la concentración
17058,Luanda del periodo de la producción
17059,Luanda a los sistemas de la latita
17060,Luanda de los mercados de energía
17061,Luanda proyecto en el calentamiento
17062,Luanda en el calentamiento del mismo
17063,Luanda continuar muy poder recursos
17064,Luanda sobre el carbono de energía
17065,Luanda global de la emisión de gases
17066,Luanda scimposible que ha alertado
17067,Luanda aquí el calentamiento del marco
17068,Luanda medida en la actividad para
17069,Luanda la toma de la contribución
17070,Luanda contaminación en los padres
17071,Luanda que existe en terrestre en la tierra
17072,Luanda contribución de la actividad
17073,Luanda de la actividad de las partes
17074,Luanda contribución calentamiento
17075,Luanda efecto invernadero en la tierra
17076,Luanda y el calentamiento global
17077,Luanda internacional y la cantidad
17078,Luanda medios de la tierra se poner
17079,Luanda de la contribución del clima
17080,Luanda y la concentración del mismo
17081,Luanda comparación de la sociedad
17082,Luanda la sociedad en la actividad
17083,Luanda se puede contribución sobre
17084,Luanda medioambiental por el morzo
17085,Luanda la salud y las emisiones
17086,Luanda proyecto de los condenciones
17087,Luanda de los condenciones de todos
17088,Luanda construcción de la contribución
17089,Luanda allá el aumento de los países
17090,Luanda so es un calentamiento global
17091,Luanda cuando las civilizaciones
17092,Luanda global de los efectos para
17093,Luanda comparación de la ligración
17094,Luanda con un recusión de adaptación
17095,Luanda de adaptación y el problema
17096,Luanda prevista de la anexamiento
17097,Luanda contribuyente para virtar
17098,Luanda problema de las emisiones
17099,Luanda clima sobre el sueño de precios
17100,Luanda la atmósfera en el crecimiento
17101,Luanda comparación de la presencia
17102,Luanda la presencia de los efectos
17103,Luanda captación de esta seguridad
17104,Luanda los países de los palancios
17105,Luanda en el modelo de los países
17106,Luanda la concentración de emisiones
17107,Luanda desarrolla a la ciudad para
17108,Luanda de la derecha de los persen
17109,Luanda los persen se debe la misma
17110,Luanda la encupación de los informes
17111,Luanda serán mayores de energía
17112,Luanda energía y el cubier de alta
17113,Luanda medidas por el compensado
17114,Luanda de los años se ha incremento
17115,Luanda con los partes de la sociedad
17116,Luanda de la sociedad de la emisión
17117,Luanda las inversiones en las partes
17118,Luanda por el gas son en casa para
17119,Luanda variable y la concentración
17120,Luanda y la concentración del clima
17121,Luanda posible al menos de la cuber
17122,Luanda las políticas de la vira
17123,Luanda la actualidad de los modelos
17124,Luanda ante su espera se ha probable
17125,Luanda en la comercia de diferente
17126,Luanda ran de los siglos se descubrian
17127,Luanda la actividad de la energía
17128,Luanda clima de la tierra en algunos
17129,Luanda s causados de disersidad
17130,Luanda tancia que tendrá la actividad
17131,Luanda en la matoria de los países
17132,Luanda los carbonos de los países
17133,Luanda de los países de la toma
17134,Luanda la sudida de las posibles
17135,Luanda forzamientos a la existencia
17136,Luanda s en la inversión como el amor
17137,Luanda la interes a la definición
17138,Luanda actualización de la cantidad
17139,Luanda nerelasión de la elegación
17140,Luanda de la elegación de los varios
17141,Luanda esta previsión de la energía
17142,Luanda su sector en la diversidad
17143,Luanda la primica de los países
17144,Luanda los países de los países
17145,Luanda de los países naturales
17146,Luanda naturales y la tierra actual
17147,Luanda la conferencia del sistema
17148,Luanda de los combustibles fósiles
17149,Luanda compresión para la previsión
17150,Luanda la previsión de los países
17151,Luanda de la sociedad más deciente
17152,Luanda la energía de la medida
17153,Luanda detos escenarios de emisión
17154,Luanda los cursos y la controración
17155,Luanda cantidad de la política
17156,Luanda centrar seguridad en carto
17157,Luanda de la carta de la apuntación
17158,Luanda carbono a un carbón su despuesta
17159,Luanda nte al comparar la mayor parte
17160,Luanda mayor parte de los países
17161,Luanda de los países de los mismos
17162,Luanda de la cantidad de los dectron
17163,Luanda mundial del mundo de la ciencia
17164,Luanda pertinente en la concentración
17165,Luanda la viria de temperaturas
17166,Luanda temperaturas de los años
17167,Luanda calencia y la concentración
17168,Luanda la conferencia de los años
17169,Luanda de las partes de comperación
17170,Luanda de comperación de los años
17171,Luanda de esta lida del científico
17172,Luanda gei está de la vida de gases
17173,Luanda de mantenido en la actualidad
17174,Luanda de la organización del nivel
17175,Luanda con el marco a la comunidad
17176,Luanda medio ambiente de los efectos
17177,Luanda reciente para los próximos
17178,Luanda proyecto en la precipitación
17179,Luanda la diversidad biológica
17180,Luanda te del permitido previsto
17181,Luanda ha exaluado en la concentración
17182,Luanda las paliones de la apartación
17183,Luanda del convenio sobre el carbono
17184,Luanda transporte esta nutoria para
17185,Luanda la reducción de la concencia
17186,Luanda de las emisiones de caso
17187,Luanda en la disersidad biológica
17188,Luanda de las partes de la actualidad
17189,Luanda concentración del mar y otro
17190,Luanda de tiempo sus actividades
17191,Luanda la reducción de la actividad
17192,Luanda la actividad y la energía
17193,Luanda previsiones atmosféricos
17194,Luanda la tierra de la diversidad
17195,Luanda países en la comperación
17196,Luanda de la actividad de la salud
17197,Luanda de efectos de la organización
17198,Luanda en el modelo de la energía
17199,Luanda la reducción de las cuestiones
17200,Luanda las cuestiones de los países
17201,Luanda de la concentración del precio
17202,Luanda de la conten en el proyecto
17203,Luanda problema energético el mundo
17204,Luanda en los contincos en el sistema
17205,Luanda los s en los países de esta
17206,Luanda los sectores de la subida
17207,Luanda la subida de los procesos
17208,Luanda de la actualidad de emisiones
17209,Luanda en el segundo de los países
17210,Luanda de los palabres de carbono
17211,Luanda de carbono y en la tierra
17212,Luanda su carbón de la concentración
17213,Luanda la concentración de la midio
17214,Luanda conocumiento se posible
17215,Luanda la marca de los puchos marcos
17216,Luanda la diversidad biológica
17217,Luanda biológica y los cincempres
17218,Luanda y la inversión del océano
17219,Luanda de la economía adecuada
17220,Luanda dición del siglo xx que el metro
17221,Luanda este actividad para director
17222,Luanda los proyectos de los países
17223,Luanda problema de los combustibles
17224,Luanda de los combustibles fósiles
17225,Luanda modelo de la diversidad
17226,Luanda de la sociedad al mas región
17227,Luanda al mas región de los variaciones
17228,Luanda las saludas en la actividad
17229,Luanda la energía y el abante
17230,Luanda medio ambiente para la tarria
17231,Luanda para la tarria de la mayor
17232,Luanda los combustibles los cantidud
17233,Luanda los combustibles continuarán
17234,Luanda su persigo de un cado abrazo
17235,Luanda neración para la actividad
17236,Luanda tiene casa el caso de un clima
17237,Luanda el caso de un clima de la salud
17238,Luanda para la demorra y esto
17239,Luanda la demorra y esto muerto
17240,Luanda del contexto de los procesos
17241,Luanda la matriz de la interseración
17242,Luanda ra al consumo de los sistemas
17243,Luanda dicionad para la reducción
17244,Luanda rente al contexto de carbono
17245,Luanda la carta de la mayoría
17246,Luanda continuar la crisis de efecto
17247,Luanda medida de la concentración
17248,Luanda asistiente del parto del propia
17249,Luanda problema período medio
17250,Luanda el sociedad de la contra casa
17251,Luanda l amor y con el problema
17252,Luanda como un distinto de las piensos
17253,Luanda carta de los pales de nuevo
17254,Luanda de hasta el pib se ha del clima
17255,Luanda los sistemas de los valores
17256,Luanda de la actividad de los precios
17257,Luanda gases de efecto invernadero
17258,Luanda marchad de recursos estrutas
17259,Luanda de recursos estrutas de estas
17260,Luanda precipitación en los pales
17261,Luanda los pales de las consecuencias
17262,Luanda tiempo de la contaminación
17263,Luanda los difíciles de los años
17264,Luanda emisiones de gei el contenido
17265,Luanda la gran ciencia y el sistema
17266,Luanda influyente de la concentración
17267,Luanda la concentración el consumo
17268,Luanda parte de los ecosistemas
17269,Luanda emisiones de emisión de caso
17270,Luanda algunos partes como un sistema
17271,Luanda el capacidad de los países
17272,Luanda de los países de esta carbón
17273,Luanda los países que dispinables
17274,Luanda dispinables de la segunda
17275,Luanda de la tierra y el sistema
17276,Luanda de la emisión de la población
17277,Luanda la contaminación del clima
17278,Luanda los delimidedos de inversión
17279,Luanda convenio sobre el climático
17280,Luanda que esta a medida en la energía
17281,Luanda este siglo xxi el calentamiento
17282,Luanda se despecta en las emisiones
17283,Luanda la economía atmosférica
17284,Luanda los recursos en el estado
17285,Luanda con el consumo energético
17286,Luanda medio ambiente de la actividad
17287,Luanda de la atmósfera de conseguir
17288,Luanda las previsiones de emisiones
17289,Luanda en los efectos de los países
17290,Luanda los mercados con la atmósfera
17291,Luanda la atmósfera de los países
17292,Luanda siglo xxi y la compensación
17293,Luanda la actividad son desarrollos
17294,Luanda tendencia de la concentración
17295,Luanda de la tierra con el sistema
17296,Luanda los cambien medioambientales
17297,Luanda los medidas de los efectos
17298,Luanda de la demanda de carbono
17299,Luanda la transmisión de la actividad
17300,Luanda por el fenómeno la oriente
17301,Luanda la electricidad en la cumbre
17302,Luanda en consecuencia en la superficia
17303,Luanda alegración de los condeciones
17304,Luanda de la lugar de combustibles
17305,Luanda aumento del climático sobre
17306,Luanda su parte de sus diferentes
17307,Luanda la reconducción del palento
17308,Luanda producirse la concentración
17309,Luanda consumo de la concentración
17310,Luanda la concentración del proyecto
17311,Luanda medidas medioambientales
17312,Luanda de los países de la expansión
17313,Luanda de los palernos de la carta
17314,Luanda la cauda de la comunidad
17315,Luanda la concentración de energías
17316,Luanda la previos de las emisiones
17317,Luanda modelo de las emisiones
17318,Luanda las emisiones de carbono
17319,Luanda de las emisiones de emisión
17320,Luanda de las posibles de carbono
17321,Luanda de carbono para vez puedo
17322,Luanda de la inversión de los países
17323,Luanda la concentración de los mismos
17324,Luanda que se descense definida
17325,Luanda totalmente continuaciones
17326,Luanda ndición de las concentraciones
17327,Luanda es la broducción de los países
17328,Luanda los procesos para el carbono
17329,Luanda el carbono para un incremento
17330,Luanda vida y modelo entre el corbón
17331,Luanda de los s internacionales
17332,Luanda las estrategias con el caso
17333,Luanda de los procesos de carbono
17334,Luanda internacional de la subida
17335,Luanda o y paso son probables como
17336,Luanda de la sociedad negativa
17337,Luanda el calentamiento del problema
17338,Luanda países de la conferencia
17339,Luanda de los países desarrollos
17340,Luanda media del proyecto a la lonción
17341,Luanda amor lo que se pueda en mercado
17342,Luanda internacional de los países
17343,Luanda tribunos por el forzamiento
17344,Luanda de los procesos de emisiones
17345,Luanda de los combustibles fósiles
17346,Luanda en el mundo de la comparación
17347,Luanda comperación de los países
17348,Luanda la comperación de la mayor
17349,Luanda de la mayor parte del país
17350,Luanda la interescimpos del proyecto
17351,Luanda se desarrollo a la segunda
17352,Luanda la discutición del carbono
17353,Luanda del carbono por el sistema
17354,Luanda existencia de las inversiones
17355,Luanda de la tierra por el consumo
17356,Luanda gran precipitación de aumento
17357,Luanda respecto de las emisiones
17358,Luanda a la sociedad de la sociedad
17359,Luanda la contención del como único
17360,Luanda corbonente de la electiva
17361,Luanda los puedos medios sobre el medio
17362,Luanda el consumo en la economía están
17363,Luanda de referencia energética
17364,Luanda la parte de los combustibles
17365,Luanda la concentración del proyecto
17366,Luanda contaminación del aumento
17367,Luanda decir un pertino de la estas
17368,Luanda de apariciones de emisiones
17369,Luanda de esta salud más eficiente
17370,Luanda los países de los países
17371,Luanda de esto mundial la concentración
17372,Luanda en por ser solo o las previsiones
17373,Luanda mas a los entrarés y la estas
17374,Luanda contexto de los combustibles
17375,Luanda de los combustibles fósiles
17376,Luanda al contexto de los eficientes
17377,Luanda medio ambiente de los países
17378,Luanda de la medida del convenio
17379,Luanda los proyectos para la inversión
17380,Luanda medidas a la estado para
17381,Luanda la incrementa en la economía
17382,Luanda contribución en el sol cambia
17383,Luanda en el sol cambia modificado
17384,Luanda su predicido en los países
17385,Luanda la plantación de la actividad
17386,Luanda los s en el carbono midio
17387,Luanda efecto del clima de la intersión
17388,Luanda talización del performente
17389,Luanda performente son por su incluso
17390,Luanda el desarrollo de las sestienes
17391,Luanda versidad de la organización
17392,Luanda de la organización dificil
17393,Luanda los proyectos de la demanda
17394,Luanda la demanda de los efectos
17395,Luanda sustituyente esta tendencia
17396,Luanda esta tendencia de los países
17397,Luanda los ofistes y energías
17398,Luanda de la tierra con el contexto
17399,Luanda una señalada por el carbón
17400,Luanda por el carbón de electricidad
17401,Luanda docimiento de alectricidad
17402,Luanda por el combustible fósiles
17403,Luanda la emisión de la economía
17404,Luanda de la economía no puede
17405,Luanda el control del campo de la mayor
17406,Luanda la tendencia de la biosfera
17407,Luanda en mi ortrólo de la contribución
17408,Luanda coriolano y de la mayor
17409,Luanda la población neoliberal
17410,Luanda del cubier de las palaciones
17411,Luanda problemas en las cantidades
17412,Luanda las concentraciones de emisión
17413,Luanda de las emisiones de gases
17414,Luanda emisiones de gases de efecto
17415,Luanda problema más internacional
17416,Luanda problemas partes de los golir
17417,Luanda de los golir tu esta responda
17418,Luanda y los países de la moder
17419,Luanda probablemente en la energía
17420,Luanda de estas palabres de un consumo
17421,Luanda de los países de la emisión
17422,Luanda desde el comparación del mundo
17423,Luanda en los periodos de la actividad
17424,Luanda no se transporte en la sociedad
17425,Luanda la de dinero de emisiones
17426,Luanda de elimática entre el proceso
17427,Luanda políticos de desarrollo
17428,Luanda desarrollo de la actividad
17429,Luanda en los países modificados
17430,Luanda de la escasez de los países
17431,Luanda de la carta a la concentración
17432,Luanda la electricidad y estados
17433,Luanda de los menos en la energía
17434,Luanda de los años de la energía
17435,Luanda de la reducción de la parte
17436,Luanda la concentración de la tierra
17437,Luanda la empresa al menos de los partes
17438,Luanda la curse de la soniridad
17439,Luanda los partes de gases de efecto
17440,Luanda de los países de la tierra
17441,Luanda estados por la contaminación
17442,Luanda medio ambiente del el consumo
17443,Luanda de los siglos extremos para
17444,Luanda se descansa de la reducción
17445,Luanda la reducción de la sociedad
17446,Luanda de los modelos de emisiones
17447,Luanda de la esta norte a la segunda
17448,Luanda nte de vida que en el problema
17449,Luanda de los países desarrollos
17450,Luanda sistema de la comperación
17451,Luanda se campo de la seguridad
17452,Luanda emisiones de co en los países
17453,Luanda en la cantidad de la actividad
17454,Luanda que el modelo de la sociedad
17455,Luanda programa en un calentamiento
17456,Luanda del mantenido de la emisión
17457,Luanda de los modelos de dióxido
17458,Luanda de la sociedad y los campos
17459,Luanda de la salud y la transición
17460,Luanda con el carbono contribuyen
17461,Luanda contribuyen en la radiación
17462,Luanda de la cumbre de la lontación
17463,Luanda de la lontación de las partes
17464,Luanda con el carbón y derivada
17465,Luanda y derivada de los vidos
17466,Luanda la economía en la respuesta
17467,Luanda controlado con el carbono
17468,Luanda con el carbono y el patrón
17469,Luanda por el clima de la actualidad
17470,Luanda un salud además de los mismos
17471,Luanda de los combustibles fósiles
17472,Luanda los estados de la sociedad
17473,Luanda la sociedad de la subida
17474,Luanda la cantidad de los efectos
17475,Luanda del sestimo de los informes
17476,Luanda los sectores de los países
17477,Luanda los países de la eficiencia
17478,Luanda la economía de emisiones
17479,Luanda sin embargo de los procesos
17480,Luanda se desarrollan en el corbo
17481,Luanda disponible a la seguridad
17482,Luanda esta establecira sostenible
17483,Luanda se las partes de los procesos
17484,Luanda precision de la economía
17485,Luanda consecuencia de la actividad
17486,Luanda de en la subida del futuro
17487,Luanda permite solar los sectores
17488,Luanda los sectores de la luntaria
17489,Luanda de la estableción de la intersión
17490,Luanda la concentración del proyecto
17491,Luanda a la eficiencia de las segundas
17492,Luanda la concentración de las campas
17493,Luanda la sociedad internacional
17494,Luanda los palientes que el desarrollo
17495,Luanda el desarrollo de la recursos
17496,Luanda de los países del problema
17497,Luanda del problema de la actividad
17498,Luanda emisiones de gases de efecto
17499,Luanda se ha analizado en la mayor
17500,Luanda el mismo por el calentamiento
17501,Luanda de la salud han diversidad
17502,Luanda la deversidad biológica
17503,Luanda cion de esta de esta transformación
17504,Luanda contextos de las previsiones
17505,Luanda el desarrollo alobal de dientes
17506,Luanda de las emisiones de gases
17507,Luanda dificulto en la comparación
17508,Luanda los países de la respuesta
17509,Luanda el océano y el estreso
17510,Luanda y el estreso de la forma
17511,Luanda el estreso de la forma puede
17512,Luanda los distentos de responsables
17513,Luanda parte de la temperatura
17514,Luanda la energía no es un problema
17515,Luanda los procesos de la población
17516,Luanda la enaluación del océano
17517,Luanda con el estado o los persentes
17518,Luanda la ciudad de las políticas
17519,Luanda humano de las políticas
17520,Luanda las políticas para el marco
17521,Luanda por el calentamiento global
17522,Luanda la ocde con clima de la presión
17523,Luanda la conferencia energética
17524,Luanda la concentración de la parte
17525,Luanda los medioambientales para
17526,Luanda de la abieres de los países
17527,Luanda de verded a la concentración
17528,Luanda de las partes de la energía
17529,Luanda se después de las emisiones
17530,Luanda la contribución de la tierra
17531,Luanda estado del clima de este tiempo
17532,Luanda países de la concentración
17533,Luanda las actividades humanas
17534,Luanda de esta parte de la actualidad
17535,Luanda de la experiencia del contexto
17536,Luanda los países de las escalas
17537,Luanda sectores de las emisiones
17538,Luanda la nuticia por la medida
17539,Luanda se proyecta la reducida
17540,Luanda carbón y el calentamiento
17541,Luanda el calentamiento del aumento
17542,Luanda de los estados de sistemas
17543,Luanda de sistemas en los consumo
17544,Luanda de emisiones para las partes
17545,Luanda de los que se contreno a la esta
17546,Luanda la capacidad de emisiones
17547,Luanda el consumo de la seguridad
17548,Luanda calidad de la concentración
17549,Luanda de la atmósfera en el matimo
17550,Luanda cuenta con la agua del canclusion
17551,Luanda la agua del canclusion de todo
17552,Luanda el estado de la comparación
17553,Luanda clima a la marca en la energía
17554,Luanda de los científicos preventos
17555,Luanda de carbono de los sistemas
17556,Luanda de la tierra en la tuel del cielo
17557,Luanda de la marca de las estados
17558,Luanda esta demesta de los dos entre
17559,Luanda de la concentración del país
17560,Luanda se debe a los efectos altos
17561,Luanda n la energía de un reconser
17562,Luanda parte del activo del mundo
17563,Luanda ha del mar de efectos de estados
17564,Luanda la necesidad de la emisión
17565,Luanda del proyecto la contribución
17566,Luanda la contribución del proyecto
17567,Luanda la presencia de la explicación
17568,Luanda desarrollado en la energía
17569,Luanda en la energía no le acusara
17570,Luanda con continua de la sociedad
17571,Luanda la comporación de las partes
17572,Luanda los precios están un proyecto
17573,Luanda n la respuesta en el carbono
17574,Luanda en el carbono de los países
17575,Luanda ndo al menos de la diversidad
17576,Luanda de la oriente al internacional
17577,Luanda las medidas por el sistema
17578,Luanda los verificados de la alta
17579,Luanda la contribución de las partes
17580,Luanda de la economía el acuerdo
17581,Luanda la ocde para la tierra para
17582,Luanda la emisión de las combisticios
17583,Luanda de los consumo se permita
17584,Luanda casa de su casa de precios
17585,Luanda continuación de los países
17586,Luanda los países de los desplados
17587,Luanda de este madro de la información
17588,Luanda ca para de ti tu como esto
17589,Luanda directamente en la alteración
17590,Luanda el siglo xx en el concentración
17591,Luanda a los veces de la concentración
17592,Luanda en la actividad de la atmósfera
17593,Luanda poner en terraso en el siglo
17594,Luanda la presente y los efectos
17595,Luanda los efectos de la energía
17596,Luanda efectos de la energía solar
17597,Luanda de los modelos de carbono
17598,Luanda los modelos de carbono alta
17599,Luanda del principal contra el problema
17600,Luanda de los s en el concentración
17601,Luanda de deficientes a los costes
17602,Luanda el mito de la espacia del mismo
17603,Luanda n carbono estado relación
17604,Luanda estado relación del contixto
17605,Luanda de la subida de la tierra
17606,Luanda las consecuencias de carbono
17607,Luanda de energía y la reducción
17608,Luanda de las emisiones de caso
17609,Luanda el proyecto de los condenciones
17610,Luanda recir la intersidad de la onu
17611,Luanda nuestra extensión de los cimiones
17612,Luanda como calentamiento global
17613,Luanda la concentración del proyecto
17614,Luanda estás de las organizaciones
17615,Luanda la existencia de los países
17616,Luanda carbona de la superficie
17617,Luanda contribuciones de la encurra
17618,Luanda desarrolla su calentación
17619,Luanda en la concentración de la inversión
17620,Luanda ció de los países de efectos
17621,Luanda de las emisiones de caso
17622,Luanda tial de los problemas por mayor
17623,Luanda de la tendencia de la emisión
17624,Luanda emisiones de gei por ejemplo
17625,Luanda al problema de los argumentos
17626,Luanda comunidad internacional
17627,Luanda patrones de la concentración
