,endecasílabo
5570,Realejo Alto medida de enormes
5571,Realejo Alto de enormes probables
5572,Realejo Alto la emisión de inversión
5573,Realejo Alto miento de emisiones
5574,Realejo Alto emisiones de caso
5575,Realejo Alto de la loncentración
5576,Realejo Alto de la concentración
5577,Realejo Alto de la diversidad
5578,Realejo Alto de la oms el problema
5579,Realejo Alto de la concentración
5580,Realejo Alto en la salud humana
5581,Realejo Alto de la concentración
5582,Realejo Alto es el problema estántre
5583,Realejo Alto de que la geoguez
5584,Realejo Alto de las emisiones
5585,Realejo Alto la temperatura
5586,Realejo Alto de las emisiones
5587,Realejo Alto emisiones de inversión
5588,Realejo Alto n de los países
5589,Realejo Alto mi alma de que no esta
5590,Realejo Alto países de acuerdos
5591,Realejo Alto de la diversidad
5592,Realejo Alto de la concentración
5593,Realejo Alto en el calentamiento
5594,Realejo Alto pertinente sobre
5595,Realejo Alto mundo de la tierra
5596,Realejo Alto el carbono a la muerte
5597,Realejo Alto todos los consumos
5598,Realejo Alto pero es un problema
5599,Realejo Alto para en un problema
5600,Realejo Alto de la seguridad
5601,Realejo Alto población de la estria
5602,Realejo Alto de la noche reina
5603,Realejo Alto la parte de el paso
5604,Realejo Alto el paso por su paler
5605,Realejo Alto cada consecuencia
5606,Realejo Alto a la conferencia astras
5607,Realejo Alto de las emisiones
5608,Realejo Alto las emperaturas
5609,Realejo Alto es la lente a su parte
5610,Realejo Alto en las economías
5611,Realejo Alto liberalización
5612,Realejo Alto de la diversidad
5613,Realejo Alto de la economía
5614,Realejo Alto el efecto del nivel
5615,Realejo Alto tiempos de la toma
5616,Realejo Alto firuta a ta encontrar
5617,Realejo Alto carbono a transporte
5618,Realejo Alto n de los procesos
5619,Realejo Alto de las emisiones
5620,Realejo Alto de la lucha nueva
5621,Realejo Alto biológica pero
5622,Realejo Alto cos en consecuencia
5623,Realejo Alto s compartificar
5624,Realejo Alto en el estrado como
5625,Realejo Alto global del mar de esta
5626,Realejo Alto rios de los países
5627,Realejo Alto los países nuestras
5628,Realejo Alto nuestras partes para
5629,Realejo Alto el amor de la vida
5630,Realejo Alto de las emisiones
5631,Realejo Alto son de las especies
5632,Realejo Alto de la concentración
5633,Realejo Alto las concentraciones
5634,Realejo Alto so de los estados
5635,Realejo Alto ción de los países
5636,Realejo Alto de la economía
5637,Realejo Alto la tierra en el mundo
5638,Realejo Alto emisiones de caso
5639,Realejo Alto en el tiempo que pueden
5640,Realejo Alto pero la reducción
5641,Realejo Alto reducción del medio
5642,Realejo Alto de los escenarios
5643,Realejo Alto medidas de salud
5644,Realejo Alto salud por el clima
5645,Realejo Alto adaptación al madio
5646,Realejo Alto de al calentamiento
5647,Realejo Alto cial en la sociedad
5648,Realejo Alto cale a la subida
5649,Realejo Alto de la economía
5650,Realejo Alto como el amor pera
5651,Realejo Alto cielo internacional
5652,Realejo Alto l valor del parto
5653,Realejo Alto calernal del mismo
5654,Realejo Alto partes del proyecto
5655,Realejo Alto en el calentamiento
5656,Realejo Alto la capa de marcio
5657,Realejo Alto de los organismos
5658,Realejo Alto todos los extremos
5659,Realejo Alto de la tierra tenga
5660,Realejo Alto tenga de los partes
5661,Realejo Alto de la concentración
5662,Realejo Alto de la economía
5663,Realejo Alto el mundo sin embargo
5664,Realejo Alto pendiente segundo
5665,Realejo Alto parte de la inversión
5666,Realejo Alto de la ciencia contra
5667,Realejo Alto te se desarrolla
5668,Realejo Alto en el internacional
5669,Realejo Alto parte del problema
5670,Realejo Alto de la organización
5671,Realejo Alto el efecto del mercio
5672,Realejo Alto confinada algunos
5673,Realejo Alto países en la esta
5674,Realejo Alto ha encontrado al cuestion
5675,Realejo Alto mercados el mismo
5676,Realejo Alto s de la conura
5677,Realejo Alto de los condenciones
5678,Realejo Alto en el carbón por la esta
5679,Realejo Alto de las emisiones
5680,Realejo Alto segundo en el suelo
5681,Realejo Alto de la compensación
5682,Realejo Alto de las emisiones
5683,Realejo Alto la tierra precisa
5684,Realejo Alto de las pertinentes
5685,Realejo Alto carbono este menor
5686,Realejo Alto menor de la sada
5687,Realejo Alto de la diversidad
5688,Realejo Alto la curse presenta
5689,Realejo Alto la tierra del primer
5690,Realejo Alto cumbre de carbono
5691,Realejo Alto actuales de la extensión
5692,Realejo Alto la extensión del medio
5693,Realejo Alto patrón de las partes
5694,Realejo Alto de la conferencia
5695,Realejo Alto la segunda porque
5696,Realejo Alto energías ocuerdas
5697,Realejo Alto de los compromisos
5698,Realejo Alto las serán altances
5699,Realejo Alto segundos que se están
5700,Realejo Alto s de la energía
5701,Realejo Alto de los consecuencias
5702,Realejo Alto alimentar el clima
5703,Realejo Alto la mayor aumenta
5704,Realejo Alto la llama de algunos
5705,Realejo Alto del pib en el nuevo
5706,Realejo Alto tendrá con algunos
5707,Realejo Alto forma de los muertos
5708,Realejo Alto la agua misma cuenta
5709,Realejo Alto emportar los palanios
5710,Realejo Alto los palanios de altir
5711,Realejo Alto de la superficie
5712,Realejo Alto de las emisiones
5713,Realejo Alto emisiones de informe
5714,Realejo Alto global de la extensión
5715,Realejo Alto de la contribución
5716,Realejo Alto algo limpie de vida
5717,Realejo Alto el alcanzo la anterior
5718,Realejo Alto que tendrán el mismo
5719,Realejo Alto tendrán el mismo así
5720,Realejo Alto al controlo relado
5721,Realejo Alto dido en el estado
5722,Realejo Alto de los s estemas
5723,Realejo Alto de los consecuencias
5724,Realejo Alto en el calentamiento
5725,Realejo Alto la cumbre del clima
5726,Realejo Alto su calentamiento
5727,Realejo Alto que esta las estados
5728,Realejo Alto de la comparación
5729,Realejo Alto el proyecto de informe
5730,Realejo Alto tendrá en el sistema
5731,Realejo Alto como un responsable
5732,Realejo Alto en la temperatura
5733,Realejo Alto las concentraciones
5734,Realejo Alto el control de los medios
5735,Realejo Alto nte los políticos
5736,Realejo Alto los países partes
5737,Realejo Alto de la diversidad
5738,Realejo Alto de las emisiones
5739,Realejo Alto de gei se despecto
5740,Realejo Alto y en el estado
5741,Realejo Alto de carbono nunca
5742,Realejo Alto mercado al el carbón
5743,Realejo Alto a por su estado para
5744,Realejo Alto que de la pestigue
5745,Realejo Alto de las emisiones
5746,Realejo Alto en los gases de carbo
5747,Realejo Alto de la economía
5748,Realejo Alto para consicuencia
5749,Realejo Alto y el concentración
5750,Realejo Alto el concentración sobre
5751,Realejo Alto la inversión del clima
5752,Realejo Alto informe son el serio
5753,Realejo Alto oms política para
5754,Realejo Alto de la humanidad
5755,Realejo Alto de la transformación
5756,Realejo Alto de la concentración
5757,Realejo Alto to de casa mundial
5758,Realejo Alto que se ha el consumo
5759,Realejo Alto de las emisiones
5760,Realejo Alto emisiones de gases
5761,Realejo Alto de gases de efecto
5762,Realejo Alto lentación como esta
5763,Realejo Alto tamente solución
5764,Realejo Alto los contextos de esta
5765,Realejo Alto resultados de esta
5766,Realejo Alto de las emisiones
5767,Realejo Alto emisiones de gases
5768,Realejo Alto de gases de efecto
5769,Realejo Alto la estealización
5770,Realejo Alto para recir sobre
5771,Realejo Alto actividades de esta
5772,Realejo Alto de las emisiones
5773,Realejo Alto emisiones de caso
5774,Realejo Alto caso de cantidad
5775,Realejo Alto significativo
5776,Realejo Alto de la economía
5777,Realejo Alto economía de unos
5778,Realejo Alto posible en la tener
5779,Realejo Alto en la tener el merco
5780,Realejo Alto de la trayectoria
5781,Realejo Alto del sistema es casa
5782,Realejo Alto consiguiente para
5783,Realejo Alto de la economía
5784,Realejo Alto por ti quiere dejo
5785,Realejo Alto dejo de ver cuando
5786,Realejo Alto recide en la emisión
5787,Realejo Alto y la noche perder
5788,Realejo Alto de la concentración
5789,Realejo Alto de la seguridad
5790,Realejo Alto pelhí relacionan
5791,Realejo Alto de los años solo
5792,Realejo Alto solo con la forma
5793,Realejo Alto n el contamiento
5794,Realejo Alto la demunda parte
5795,Realejo Alto en la temperatura
5796,Realejo Alto global el estado
5797,Realejo Alto de la consecuencia
5798,Realejo Alto de los combustibles
5799,Realejo Alto fósiles y la orian
5800,Realejo Alto de la prepiración
5801,Realejo Alto clima en el segundo
5802,Realejo Alto en el segundo estado
5803,Realejo Alto de la deversidad
5804,Realejo Alto de que la energía
5805,Realejo Alto de las inversiones
5806,Realejo Alto de la consecuencia
5807,Realejo Alto que es un comparacion
5808,Realejo Alto de la comperación
5809,Realejo Alto de la conterincia
5810,Realejo Alto tener a una mayor
5811,Realejo Alto de las emisiones
5812,Realejo Alto gei para la ciencia
5813,Realejo Alto de la respectiva
5814,Realejo Alto de la contribución
5815,Realejo Alto de las emisiones
5816,Realejo Alto la esta esta la delo
5817,Realejo Alto el carbono sabiendo
5818,Realejo Alto o menos de los pales
5819,Realejo Alto la de la sustible
5820,Realejo Alto de las emisiones
5821,Realejo Alto emisiones de gases
5822,Realejo Alto en el calentamiento
5823,Realejo Alto global de los palas
5824,Realejo Alto con tu internacional
5825,Realejo Alto la mayor emisión
5826,Realejo Alto cantidad de región
5827,Realejo Alto de agustica es una
5828,Realejo Alto para la reducir
5829,Realejo Alto las estados de algo
5830,Realejo Alto falta y aumento
5831,Realejo Alto s al desarrollo
5832,Realejo Alto arrocana en su casa
5833,Realejo Alto y la conferencia
5834,Realejo Alto desarrollo de esta
5835,Realejo Alto ocde de la sociedad
5836,Realejo Alto del convenio sobre
5837,Realejo Alto sobre la pérdida
5838,Realejo Alto no hay que consumo
5839,Realejo Alto el buckingham verdado
5840,Realejo Alto de la estructura entre
5841,Realejo Alto del siglo xx puedan
5842,Realejo Alto de los políticos
5843,Realejo Alto de los combustibles
5844,Realejo Alto de la economía
5845,Realejo Alto de los computados
5846,Realejo Alto los de colanosa
5847,Realejo Alto de colanosa ese
5848,Realejo Alto ese la internacional
5849,Realejo Alto de los incrementos
5850,Realejo Alto s en el peroce
5851,Realejo Alto los países de una
5852,Realejo Alto de la concentración
5853,Realejo Alto un s contribuyentes
5854,Realejo Alto de los condenciones
5855,Realejo Alto de la concentración
5856,Realejo Alto emisiones de gases
5857,Realejo Alto de gases de efecto
5858,Realejo Alto de las emisiones
5859,Realejo Alto rio de la demorra
5860,Realejo Alto de arte son medidas
5861,Realejo Alto las pronimiciones
5862,Realejo Alto to de la comprensión
5863,Realejo Alto serán crecimientos
5864,Realejo Alto de la economía
5865,Realejo Alto de la conferencia
5866,Realejo Alto de los verdederas
5867,Realejo Alto la temperatura
5868,Realejo Alto y el solo estaba
5869,Realejo Alto altos de los países
5870,Realejo Alto de la disersidad
5871,Realejo Alto que la concentración
5872,Realejo Alto tado en la actividad
5873,Realejo Alto la teapicación
5874,Realejo Alto de hacer que el siglo
5875,Realejo Alto con la humanidad
5876,Realejo Alto los gases de efecto
5877,Realejo Alto na y por su pibre
5878,Realejo Alto la temperatura
5879,Realejo Alto la atmósfera nada
5880,Realejo Alto paso a menor parte
5881,Realejo Alto de la concentración
5882,Realejo Alto de las emisiones
5883,Realejo Alto el estado del siglo
5884,Realejo Alto desenva del siglo
5885,Realejo Alto problema del siglo
5886,Realejo Alto del siglo xx perse
5887,Realejo Alto caso de los años
5888,Realejo Alto de climático están
5889,Realejo Alto de aumento del nivel
5890,Realejo Alto los recursos medios
5891,Realejo Alto medios de los aguas
5892,Realejo Alto r con el proyecto
5893,Realejo Alto mayor seguridad
5894,Realejo Alto en la temperatura
5895,Realejo Alto la temperatura
5896,Realejo Alto de los voluciones
5897,Realejo Alto en el carbono al clima
5898,Realejo Alto al clima de la langa
5899,Realejo Alto de las políticas
5900,Realejo Alto de la perspectiva
5901,Realejo Alto distema de arente
5902,Realejo Alto de arente lo que estoy
5903,Realejo Alto con la luna en la agua
5904,Realejo Alto de la diversidad
5905,Realejo Alto de las emisiones
5906,Realejo Alto de los casos de arman
5907,Realejo Alto a un problema de arrollo
5908,Realejo Alto son a la luz para
5909,Realejo Alto enforma por la cuestión
5910,Realejo Alto días de la tierra
5911,Realejo Alto sus economías
5912,Realejo Alto de las altas como
5913,Realejo Alto tanto de entre el punto
5914,Realejo Alto la surlidad tendrán
5915,Realejo Alto la tierra el problema
5916,Realejo Alto mismo por contrarla
5917,Realejo Alto sector de la mayor
5918,Realejo Alto es todo se comprensar
5919,Realejo Alto s en la energía
5920,Realejo Alto con alternativas
5921,Realejo Alto de calentamiento
5922,Realejo Alto de la consecuencia
5923,Realejo Alto la posibilidad
5924,Realejo Alto para algunos pasos
5925,Realejo Alto de las emisiones
5926,Realejo Alto serial de la salud
5927,Realejo Alto de calentamiento
5928,Realejo Alto mucho de la tierra
5929,Realejo Alto en la temperatura
5930,Realejo Alto sector de energía
5931,Realejo Alto de las consecuencias
5932,Realejo Alto de los políticos
5933,Realejo Alto en el combustible años
5934,Realejo Alto las partes de inversión
5935,Realejo Alto su perdido de alta
5936,Realejo Alto alcanzar la formación
5937,Realejo Alto del calentamiento
5938,Realejo Alto de los políticos
5939,Realejo Alto ce con el mercado
5940,Realejo Alto los s en el nivel
5941,Realejo Alto internacionalmente
5942,Realejo Alto de la conferencia
5943,Realejo Alto de estos recordidos
5944,Realejo Alto aumento del proyecto
5945,Realejo Alto la mayor sustida
5946,Realejo Alto la perticultación
5947,Realejo Alto y contribuciones
5948,Realejo Alto drán de los sistemas
5949,Realejo Alto por la forma mundial
5950,Realejo Alto camo se distrobar
5951,Realejo Alto recimiento de estas
5952,Realejo Alto de estas emisiones
5953,Realejo Alto de algunos palerios
5954,Realejo Alto casi son muy poco
5955,Realejo Alto muy poco que se están
5956,Realejo Alto que se están el mundo
5957,Realejo Alto s instituciones
5958,Realejo Alto de efectos de gases
5959,Realejo Alto en la nerefecación
5960,Realejo Alto de la organización
5961,Realejo Alto de las emisiones
5962,Realejo Alto emisiones de caso
5963,Realejo Alto escala de la tierra
5964,Realejo Alto del mar en el parto
5965,Realejo Alto mayor esta será
5966,Realejo Alto será de la mayor
5967,Realejo Alto de la mayor parte
5968,Realejo Alto se amor a mantenir
5969,Realejo Alto a mantenir a la esta
5970,Realejo Alto del siglo xx estos
5971,Realejo Alto luz de la sectoria
5972,Realejo Alto s de la tendencia
5973,Realejo Alto parte de las altas
5974,Realejo Alto rado más acuerdos
5975,Realejo Alto acuerdos de la tierra
5976,Realejo Alto de la tierra como
5977,Realejo Alto siglo xxi el contexto
5978,Realejo Alto de la energía amplia
5979,Realejo Alto tra muerte de la alta
5980,Realejo Alto problema medio albo
5981,Realejo Alto albo y de la tierra
5982,Realejo Alto para el desarrollo
5983,Realejo Alto medios de eficiencias
5984,Realejo Alto a emisiones de puestas
5985,Realejo Alto la posibilidad
5986,Realejo Alto la ocde en la energía
5987,Realejo Alto biente dimigado
5988,Realejo Alto la temperatura
5989,Realejo Alto no se desarro una
5990,Realejo Alto de la concentración
5991,Realejo Alto de la diversidad
5992,Realejo Alto que esta consecuencia
5993,Realejo Alto estado de la tarde
5994,Realejo Alto secuos pertinentes
5995,Realejo Alto mentira el aumento
5996,Realejo Alto aumento del efecto
5997,Realejo Alto mismo por cien de este
5998,Realejo Alto por cien de este global
5999,Realejo Alto por mucho más fuertes
6000,Realejo Alto fuertes de estos amor
6001,Realejo Alto en tiempo contiluro
6002,Realejo Alto el forzamiento global
6003,Realejo Alto y de la biosfera
6004,Realejo Alto de las emisiones
6005,Realejo Alto emisiones de gases
6006,Realejo Alto de gases de efecto
6007,Realejo Alto en la temperatura
6008,Realejo Alto de la contribución
6009,Realejo Alto en el mismo del nivel
6010,Realejo Alto capitalización
6011,Realejo Alto de ante la luz una
6012,Realejo Alto la posibilidad
6013,Realejo Alto con el escenario
6014,Realejo Alto de la mayor partir
6015,Realejo Alto de las emisiones
6016,Realejo Alto en la temperatura
6017,Realejo Alto de la organización
6018,Realejo Alto con la concentración
6019,Realejo Alto de la comparación
6020,Realejo Alto de las emisiones
6021,Realejo Alto emisiones de emisión
6022,Realejo Alto medio ambiente para
6023,Realejo Alto ambiente para comprar
6024,Realejo Alto comprar el consenso
6025,Realejo Alto se de la cantidad
6026,Realejo Alto de la superficie
6027,Realejo Alto la gente y pernar
6028,Realejo Alto todos los países
6029,Realejo Alto de las emisiones
6030,Realejo Alto gei por el especie
6031,Realejo Alto de las emisiones
6032,Realejo Alto de la mitigación
6033,Realejo Alto que los desarrollos
6034,Realejo Alto ocde por la converción
6035,Realejo Alto ción de los consumos
6036,Realejo Alto actuaciones de estados
6037,Realejo Alto de gases de efecto
6038,Realejo Alto de la concentración
6039,Realejo Alto de las emisiones
6040,Realejo Alto carbono de secún
6041,Realejo Alto secún de las fuertes
6042,Realejo Alto de la esteriencia están
6043,Realejo Alto partes de la estudión
6044,Realejo Alto la estudión del reva
6045,Realejo Alto comprensión de precios
6046,Realejo Alto nte sobre el corbono
6047,Realejo Alto el corbono de inversión
6048,Realejo Alto en el colertimiento
6049,Realejo Alto de la forma de alta
6050,Realejo Alto gue de la segunda
6051,Realejo Alto y la concentración
6052,Realejo Alto de la diversidad
6053,Realejo Alto y las emisiones
6054,Realejo Alto a la estado a una mayor
6055,Realejo Alto el carbón y la extensión
6056,Realejo Alto lo que no deberán
6057,Realejo Alto de la concentración
6058,Realejo Alto de las partes siglos
6059,Realejo Alto de la contentración
6060,Realejo Alto parte de la emisión
6061,Realejo Alto continua de efectos
6062,Realejo Alto efectos no las vaces
6063,Realejo Alto no las vaces para
6064,Realejo Alto los pasos y sobre
6065,Realejo Alto mente en la contencia
6066,Realejo Alto de la tierra a la estas
6067,Realejo Alto el mundo se ha hacer
6068,Realejo Alto en la segunda capa
6069,Realejo Alto de los acosisis
6070,Realejo Alto con la mayor parte
6071,Realejo Alto parte de la tierra
6072,Realejo Alto para las descurros
6073,Realejo Alto n en los países
6074,Realejo Alto distinto dimigar
6075,Realejo Alto mundo de los años
6076,Realejo Alto los años se tenden
6077,Realejo Alto tenden por el cielo
6078,Realejo Alto vista contra marca
6079,Realejo Alto el condencion o el medio
6080,Realejo Alto de la mayor agua
6081,Realejo Alto la translimitación
6082,Realejo Alto de la comperación
6083,Realejo Alto de sus incrementos
6084,Realejo Alto y la propiración
6085,Realejo Alto de la diversidad
6086,Realejo Alto parte de la lugar
6087,Realejo Alto los partes de empieza
6088,Realejo Alto ran aquella versia
6089,Realejo Alto a un recuerdo a recorder
6090,Realejo Alto estados de la tierra
6091,Realejo Alto con la concentración
6092,Realejo Alto del convenio sobre
6093,Realejo Alto son de la medida
6094,Realejo Alto ndo de amos es casa
6095,Realejo Alto de la concentración
6096,Realejo Alto en la emisión de gases
6097,Realejo Alto baser la segunda
6098,Realejo Alto la segunda parte
6099,Realejo Alto son alternaciones
6100,Realejo Alto las concentraciones
6101,Realejo Alto s del climático
6102,Realejo Alto sta están altas para
6103,Realejo Alto en la temperatura
6104,Realejo Alto de la concentración
6105,Realejo Alto nte que es puedo de esta
6106,Realejo Alto de la concentración
6107,Realejo Alto de los escenarios
6108,Realejo Alto de compunsaría
6109,Realejo Alto de la tierra para
6110,Realejo Alto de la mayoría
6111,Realejo Alto de la organización
6112,Realejo Alto y el que es muy fuerte
6113,Realejo Alto medios de carbono
6114,Realejo Alto más segundos para
6115,Realejo Alto para las empresas
6116,Realejo Alto n en la presente
6117,Realejo Alto la contaminación
6118,Realejo Alto continuar aumento
6119,Realejo Alto transmisión al medio
6120,Realejo Alto ambiente de los pocos
6121,Realejo Alto go de los acuerdos
6122,Realejo Alto acuerdos de la salud
6123,Realejo Alto miento de los partes
6124,Realejo Alto de los retuos para
6125,Realejo Alto de las emisiones
6126,Realejo Alto emisiones de gases
6127,Realejo Alto de gases de efecto
6128,Realejo Alto el carbono y nuestro
6129,Realejo Alto carbono y nunca
6130,Realejo Alto y nunca muy porque
6131,Realejo Alto nunca muy porque esto
6132,Realejo Alto los consumos para
6133,Realejo Alto rias en contribución
6134,Realejo Alto la puesta es un precio
6135,Realejo Alto que los desarrollos
6136,Realejo Alto de las emisiones
6137,Realejo Alto países de la eso
6138,Realejo Alto por el infraero
6139,Realejo Alto de efectos de efecto
6140,Realejo Alto los negociaciones
6141,Realejo Alto a la naturaleza
6142,Realejo Alto de las emisiones
6143,Realejo Alto gei de la actividad
6144,Realejo Alto de las emisiones
6145,Realejo Alto de las emisiones
6146,Realejo Alto de gei la energía
6147,Realejo Alto aumento de la intensión
6148,Realejo Alto comparar el clima
6149,Realejo Alto clima de parecer
6150,Realejo Alto para la presente
6151,Realejo Alto los s en el parto
6152,Realejo Alto partir de la tarde
6153,Realejo Alto de la seguridad
6154,Realejo Alto de la organización
6155,Realejo Alto todos los mercados
6156,Realejo Alto el acuerdo del siglo
6157,Realejo Alto incluyen la anternación
6158,Realejo Alto de la disersidad
6159,Realejo Alto de la necesidad
6160,Realejo Alto necesidad de algo
6161,Realejo Alto de algo incontraciones
6162,Realejo Alto tienen un patrono
6163,Realejo Alto de la concentración
6164,Realejo Alto de la organización
6165,Realejo Alto deros están partes
6166,Realejo Alto la unión en la casa
6167,Realejo Alto de la contra el amor
6168,Realejo Alto estado de la emisión
6169,Realejo Alto la emisión de gases
6170,Realejo Alto de gases de efecto
6171,Realejo Alto sobre la reducción
6172,Realejo Alto de co por el marco
6173,Realejo Alto de la prución de entre
6174,Realejo Alto problemas medidas
6175,Realejo Alto son concentraciones
6176,Realejo Alto las concentraciones
6177,Realejo Alto la verificación
6178,Realejo Alto del calentamiento
6179,Realejo Alto y la transformación
6180,Realejo Alto detos diseructos
6181,Realejo Alto alma al calentamiento
6182,Realejo Alto de la concencración
6183,Realejo Alto gei de contenido
6184,Realejo Alto la lugar de marcio
6185,Realejo Alto ta de los países
6186,Realejo Alto de la concentración
6187,Realejo Alto de la contribución
6188,Realejo Alto de la superficie
6189,Realejo Alto los efectos para
6190,Realejo Alto para una coriola
6191,Realejo Alto coriola de mucha
6192,Realejo Alto la civilización
6193,Realejo Alto liberalizado
6194,Realejo Alto de la diversidad
6195,Realejo Alto está algo que no puede
6196,Realejo Alto de la lucha para
6197,Realejo Alto cian de la subida
6198,Realejo Alto la subida de una
6199,Realejo Alto con poder tu lado
6200,Realejo Alto la energía nuche
6201,Realejo Alto en el calentamiento
6202,Realejo Alto a la temperatura
6203,Realejo Alto de los escenarios
6204,Realejo Alto la población de entre
6205,Realejo Alto informes son mi señor
6206,Realejo Alto señor lo te puedo
6207,Realejo Alto los recursos de este
6208,Realejo Alto atmósfera es un nuevo
6209,Realejo Alto la lugar con casa
6210,Realejo Alto una de enfermedades
6211,Realejo Alto la espera no fuera
6212,Realejo Alto s en la aplicación
6213,Realejo Alto el pio ve está distinto
6214,Realejo Alto se metible aumento
6215,Realejo Alto s de los países
6216,Realejo Alto cumbre de la estado
6217,Realejo Alto humanidad para
6218,Realejo Alto que es de entrar cantidad
6219,Realejo Alto el cuarto de la vida
6220,Realejo Alto de los combustibles
6221,Realejo Alto y las emisiones
6222,Realejo Alto los efectos de esta
6223,Realejo Alto efectos de esta tuco
6224,Realejo Alto de esta tuco confian
6225,Realejo Alto de las emisiones
6226,Realejo Alto de la reducidad
6227,Realejo Alto de la economía
6228,Realejo Alto de minitadores
6229,Realejo Alto contra los efectos
6230,Realejo Alto efectos de carbono
6231,Realejo Alto s alimentarios
6232,Realejo Alto de la diversidad
6233,Realejo Alto de los políticos
6234,Realejo Alto de los diferentes
6235,Realejo Alto menos al problema
6236,Realejo Alto todos los sectores
6237,Realejo Alto tos alimentados
6238,Realejo Alto de la concentración
6239,Realejo Alto las gases de efecto
6240,Realejo Alto emisiones de caso
6241,Realejo Alto de las emisiones
6242,Realejo Alto para reguridad
6243,Realejo Alto mento al gas relación
6244,Realejo Alto del calentamiento
6245,Realejo Alto ambiente en el consumo
6246,Realejo Alto los a la demanda
6247,Realejo Alto la ciudad y la esta
6248,Realejo Alto la segunda emisión
6249,Realejo Alto la de armos de el gante
6250,Realejo Alto de la incertidumbre
6251,Realejo Alto ambiente en la concencia
6252,Realejo Alto de la mayor parte
6253,Realejo Alto se de la eficiencia
6254,Realejo Alto solo de la tierra
6255,Realejo Alto además de ser nuevos
6256,Realejo Alto s de la población
6257,Realejo Alto n la concentración
6258,Realejo Alto los cantificados
6259,Realejo Alto serán las medidas
6260,Realejo Alto energética será
6261,Realejo Alto medio albo del clima
6262,Realejo Alto albo del clima carga
6263,Realejo Alto de la comparación
6264,Realejo Alto de la concentración
