,endecasílabo
11767,Realejo Alto de la anteria a todos
11768,Realejo Alto y la compensación
11769,Realejo Alto de la concentración
11770,Realejo Alto de estas de los mercos
11771,Realejo Alto una vitalización
11772,Realejo Alto fósiles son medios
11773,Realejo Alto medios de los medios
11774,Realejo Alto partir de la bioda
11775,Realejo Alto de las emisiones
11776,Realejo Alto emisiones de caso
11777,Realejo Alto y la oriente para
11778,Realejo Alto n la comperación
11779,Realejo Alto de la organización
11780,Realejo Alto de la comperación
11781,Realejo Alto energía nacional
11782,Realejo Alto de calentamiento
11783,Realejo Alto nterte en el problema
11784,Realejo Alto el problema de hielo
11785,Realejo Alto estado de la virta
11786,Realejo Alto podría del clima
11787,Realejo Alto de las políticas
11788,Realejo Alto la lugar los muestras
11789,Realejo Alto de los pertinentes
11790,Realejo Alto problema del patrón
11791,Realejo Alto para estas estados
11792,Realejo Alto las pronimicadas
11793,Realejo Alto solicificación
11794,Realejo Alto de la conferencia
11795,Realejo Alto atmósfera se ha encuds
11796,Realejo Alto de la contribución
11797,Realejo Alto de las emisiones
11798,Realejo Alto fuerza de la carta
11799,Realejo Alto de la diversidad
11800,Realejo Alto en las concentraciones
11801,Realejo Alto ca a una de la tierra
11802,Realejo Alto sobre el concentración
11803,Realejo Alto la emisión de inversión
11804,Realejo Alto de la diversidad
11805,Realejo Alto la de los países
11806,Realejo Alto mantiente dios de esta
11807,Realejo Alto de esta primer parte
11808,Realejo Alto la cuerpa general
11809,Realejo Alto de los políticos
11810,Realejo Alto emisiones de gases
11811,Realejo Alto de gases de efecto
11812,Realejo Alto s que la actividad
11813,Realejo Alto causa de la tierra
11814,Realejo Alto tierra algo de la esta
11815,Realejo Alto na sobre el caibino
11816,Realejo Alto to intervanto como
11817,Realejo Alto limativo para
11818,Realejo Alto menimizaciones
11819,Realejo Alto es el control de la orma
11820,Realejo Alto de las emisiones
11821,Realejo Alto de las emisiones
11822,Realejo Alto co en las emisiones
11823,Realejo Alto parte de la salud
11824,Realejo Alto emisiones de emisión
11825,Realejo Alto en la temperatura
11826,Realejo Alto de la concentración
11827,Realejo Alto por la concentración
11828,Realejo Alto de las combustibles
11829,Realejo Alto mundo de la emisión
11830,Realejo Alto la emisión de gases
11831,Realejo Alto de gases de efecto
11832,Realejo Alto stica en el proyecto
11833,Realejo Alto mayor el proceso
11834,Realejo Alto respecto a las partes
11835,Realejo Alto que los potenciales
11836,Realejo Alto de las políticas
11837,Realejo Alto de la concentración
11838,Realejo Alto marco del proyecto
11839,Realejo Alto para la actualidad
11840,Realejo Alto por el escenario
11841,Realejo Alto informe de los mundos
11842,Realejo Alto ción de esta tercera
11843,Realejo Alto de las emisiones
11844,Realejo Alto que esta alcanza la alta
11845,Realejo Alto de las emisiones
11846,Realejo Alto ción de los distintos
11847,Realejo Alto ción de los sistemas
11848,Realejo Alto de los consecuencias
11849,Realejo Alto al cielo al medio ambiente
11850,Realejo Alto s de los países
11851,Realejo Alto de las experiencias
11852,Realejo Alto no se desarrollan
11853,Realejo Alto desarrollan a una
11854,Realejo Alto global por ejemplo
11855,Realejo Alto global son las puertes
11856,Realejo Alto y su capacidad
11857,Realejo Alto la temperatura
11858,Realejo Alto de consumo para
11859,Realejo Alto para la población
11860,Realejo Alto de las emisiones
11861,Realejo Alto de la concentración
11862,Realejo Alto distro de los gases
11863,Realejo Alto los gases de efecto
11864,Realejo Alto de los paleanes
11865,Realejo Alto se algo más probable
11866,Realejo Alto de las políticas
11867,Realejo Alto del tiempo al estado
11868,Realejo Alto de la concentración
11869,Realejo Alto la tierra nacional
11870,Realejo Alto a los negacionistas
11871,Realejo Alto del carbono el ella
11872,Realejo Alto ella de las recursos
11873,Realejo Alto de las emisiones
11874,Realejo Alto mo medio del parto
11875,Realejo Alto la energía para
11876,Realejo Alto con el proyecto entre
11877,Realejo Alto de la concentración
11878,Realejo Alto de la capacidad
11879,Realejo Alto de las políticas
11880,Realejo Alto s y la estructura
11881,Realejo Alto estados intersectos
11882,Realejo Alto intersectos del patrón
11883,Realejo Alto de las cantidades
11884,Realejo Alto las actividades
11885,Realejo Alto de enfiante en la emisión
11886,Realejo Alto de las cantidades
11887,Realejo Alto de la forma parte
11888,Realejo Alto a la temperatura
11889,Realejo Alto de la comperación
11890,Realejo Alto de los emisiones
11891,Realejo Alto a los consumo en caso
11892,Realejo Alto de anima en el control
11893,Realejo Alto de la concentración
11894,Realejo Alto los contribuciones
11895,Realejo Alto en el calentamiento
11896,Realejo Alto para la subida
11897,Realejo Alto subida del siglo
11898,Realejo Alto mentado a la expansión
11899,Realejo Alto el mercado nicesen
11900,Realejo Alto de la seguridad
11901,Realejo Alto la poiertia de tiempo
11902,Realejo Alto casa de la oriación
11903,Realejo Alto estados de carbono
11904,Realejo Alto futuro en la intersión
11905,Realejo Alto de la organización
11906,Realejo Alto alta en la actualización
11907,Realejo Alto de la economía
11908,Realejo Alto l a la segunda
11909,Realejo Alto de la concentración
11910,Realejo Alto de la humanidad
11911,Realejo Alto cción de las palercias
11912,Realejo Alto de los diferentes
11913,Realejo Alto y al desarrollo
11914,Realejo Alto de la agricultura
11915,Realejo Alto por lo que se después
11916,Realejo Alto se estaban del pargo
11917,Realejo Alto de la conteriación
11918,Realejo Alto que se ha anteriores
11919,Realejo Alto en la energía será
11920,Realejo Alto de ser el carbono
11921,Realejo Alto la determinación
11922,Realejo Alto de las políticas
11923,Realejo Alto las concentraciones
11924,Realejo Alto de carbono estados
11925,Realejo Alto de la concentración
11926,Realejo Alto por lo que me dener
11927,Realejo Alto cion de los procesos
11928,Realejo Alto de la marca anuncia
11929,Realejo Alto global de consumo
11930,Realejo Alto ártico de la contra
11931,Realejo Alto se contaminante
11932,Realejo Alto de la comparación
11933,Realejo Alto ha de pronamora
11934,Realejo Alto de la compensación
11935,Realejo Alto los países partes
11936,Realejo Alto la energía se esta
11937,Realejo Alto las estados así
11938,Realejo Alto agua de los procesos
11939,Realejo Alto los regulaciones
11940,Realejo Alto entre la concentración
11941,Realejo Alto de las emisiones
11942,Realejo Alto del gas y la estado
11943,Realejo Alto probable que es mayor
11944,Realejo Alto que es mayor estado
11945,Realejo Alto mantenir los puchos
11946,Realejo Alto los puchos en muchas
11947,Realejo Alto clima en los países
11948,Realejo Alto de la concentración
11949,Realejo Alto son las energías
11950,Realejo Alto los dos desarrollos
11951,Realejo Alto una de la segunda
11952,Realejo Alto ra para el mercado
11953,Realejo Alto sustendrio que está una
11954,Realejo Alto de los compromisos
11955,Realejo Alto concentrar las partes
11956,Realejo Alto partes de carbono
11957,Realejo Alto y la diversidad
11958,Realejo Alto ción a los persenas
11959,Realejo Alto de las emisiones
11960,Realejo Alto emisiones del clima
11961,Realejo Alto la temperatura
11962,Realejo Alto los ecosistemas
11963,Realejo Alto en los países de alta
11964,Realejo Alto tivo para decir
11965,Realejo Alto aumento de la tierra
11966,Realejo Alto y la política
11967,Realejo Alto será la alta cambia
11968,Realejo Alto de gases de efecto
11969,Realejo Alto problema en la intersión
11970,Realejo Alto mismos en la región
11971,Realejo Alto para mucho mundial
11972,Realejo Alto de las emisiones
11973,Realejo Alto tendencia a el carbono
11974,Realejo Alto respondar la intersión
11975,Realejo Alto los países medios
11976,Realejo Alto de la contenido
11977,Realejo Alto la contenido infra
11978,Realejo Alto los próximos años
11979,Realejo Alto casa de los partes
11980,Realejo Alto co de los actuales
11981,Realejo Alto la civilización
11982,Realejo Alto y el protocolo
11983,Realejo Alto de kioto de agua ala
11984,Realejo Alto de las inversiones
11985,Realejo Alto de los estre el tiempo
11986,Realejo Alto estre el tiempo mi parte
11987,Realejo Alto letina merceden
11988,Realejo Alto la sociedad serial
11989,Realejo Alto él solo ven el rico
11990,Realejo Alto y las emisiones
11991,Realejo Alto refleja el estado
11992,Realejo Alto entre el calentamiento
11993,Realejo Alto de las emisiones
11994,Realejo Alto sobre la demanda
11995,Realejo Alto la estudión me tener
11996,Realejo Alto de la concentración
11997,Realejo Alto de la guerra para
11998,Realejo Alto gei la concentración
11999,Realejo Alto n alternativa
12000,Realejo Alto contribuye a un pader
12001,Realejo Alto de las emisiones
12002,Realejo Alto clima en el sistema
12003,Realejo Alto esta tendencia media
12004,Realejo Alto rios de disponibles
12005,Realejo Alto se ha diversidad
12006,Realejo Alto y los paleones
12007,Realejo Alto estado de los partes
12008,Realejo Alto de los combustibles
12009,Realejo Alto casa contribución
12010,Realejo Alto contribución mucho
12011,Realejo Alto mucho más mayores
12012,Realejo Alto mayores más aguas
12013,Realejo Alto de carbono que está
12014,Realejo Alto el estado alegible
12015,Realejo Alto global de la emisión
12016,Realejo Alto costa en la energía
12017,Realejo Alto de la mantitución
12018,Realejo Alto ncia de la subida
12019,Realejo Alto de las políticas
12020,Realejo Alto todo el pasado están
12021,Realejo Alto de la reducida
12022,Realejo Alto de esta conferencia
12023,Realejo Alto esta conferencia entre
12024,Realejo Alto inversión del efecto
12025,Realejo Alto el caso del proyecto
12026,Realejo Alto de la concentración
12027,Realejo Alto ro o con la recisión
12028,Realejo Alto de la concentración
12029,Realejo Alto de la concentración
12030,Realejo Alto consumo se pueden
12031,Realejo Alto se pueden requisir
12032,Realejo Alto requisir la capaz
12033,Realejo Alto a contribución para
12034,Realejo Alto se puede ser parte
12035,Realejo Alto parte de la mayor
12036,Realejo Alto de la mayor datos
12037,Realejo Alto las concentraciones
12038,Realejo Alto n los políticos
12039,Realejo Alto de la organización
12040,Realejo Alto la sociedad reina
12041,Realejo Alto para la cupación
12042,Realejo Alto de la economía
12043,Realejo Alto pueden desarrollo
12044,Realejo Alto de las políticas
12045,Realejo Alto reportencia en todos
12046,Realejo Alto de la concentración
12047,Realejo Alto mar en la actividad
12048,Realejo Alto y de definición
12049,Realejo Alto dición de la inversión
12050,Realejo Alto de la concentración
12051,Realejo Alto los s en el coler
12052,Realejo Alto los persensis de algo
12053,Realejo Alto xx el en el clima
12054,Realejo Alto se debe el problema
12055,Realejo Alto tendrá en el segundo
12056,Realejo Alto en el segundo para
12057,Realejo Alto emisiones de co antial
12058,Realejo Alto paso de la tierra
12059,Realejo Alto la tierra con una
12060,Realejo Alto la temperatura
12061,Realejo Alto de esta definición
12062,Realejo Alto contenido el medio
12063,Realejo Alto y de los países
12064,Realejo Alto segundo articular
12065,Realejo Alto articular del parto
12066,Realejo Alto lo que la estribución
12067,Realejo Alto de las importancias
12068,Realejo Alto la emisión de emisión
12069,Realejo Alto de la concentración
12070,Realejo Alto al modelo de tiempo
12071,Realejo Alto por el que por otros
12072,Realejo Alto el que por otros cosas
12073,Realejo Alto a la siguientífica
12074,Realejo Alto de la seguridad
12075,Realejo Alto de la consecuencia
12076,Realejo Alto de la actualización
12077,Realejo Alto de las emisiones
12078,Realejo Alto emisiones de caso
12079,Realejo Alto la lonciente para
12080,Realejo Alto de carbono estados
12081,Realejo Alto estados en la capa
12082,Realejo Alto de las emisiones
12083,Realejo Alto carbono en la casa
12084,Realejo Alto de las producciones
12085,Realejo Alto nuestra capacidad
12086,Realejo Alto los partes de precios
12087,Realejo Alto s particulares
12088,Realejo Alto n estados de esta
12089,Realejo Alto estados de esta estado
12090,Realejo Alto el marco de emisiones
12091,Realejo Alto estado del convenio
12092,Realejo Alto los gases de efecto
12093,Realejo Alto cion de los países
12094,Realejo Alto de las emisiones
12095,Realejo Alto de la esta de hacer
12096,Realejo Alto intersión contribución
12097,Realejo Alto de emisión es una
12098,Realejo Alto sobre los efectos
12099,Realejo Alto efectos de emisiones
12100,Realejo Alto que asi de las paltas
12101,Realejo Alto l de los países
12102,Realejo Alto energías estados
12103,Realejo Alto los países medios
12104,Realejo Alto de la concentración
12105,Realejo Alto modelo observado
12106,Realejo Alto observado los años
12107,Realejo Alto de la diversidad
12108,Realejo Alto y la concentración
12109,Realejo Alto s en el problema
12110,Realejo Alto de la concentración
12111,Realejo Alto en el calentamiento
12112,Realejo Alto informe de la tierra
12113,Realejo Alto nto de la actividad
12114,Realejo Alto las compensaciones
12115,Realejo Alto se ha hacer mucho
12116,Realejo Alto emisiones de caso
12117,Realejo Alto n en la primera
12118,Realejo Alto de la seguridad
12119,Realejo Alto el concipto de aenos
12120,Realejo Alto de las emisiones
12121,Realejo Alto gei la concentración
12122,Realejo Alto de la concentración
12123,Realejo Alto hacer el consumo
12124,Realejo Alto las concentraciones
12125,Realejo Alto de deserminación
12126,Realejo Alto el futuro se ha amor
12127,Realejo Alto el parto del proyecto
12128,Realejo Alto por el carbón solo
12129,Realejo Alto en las modelos como
12130,Realejo Alto de gases de efecto
12131,Realejo Alto los transformaciones
12132,Realejo Alto de la mayor parte
12133,Realejo Alto rios de los países
12134,Realejo Alto y en la cora a esta
12135,Realejo Alto en la cora a esta salud
12136,Realejo Alto lo que se perdine
12137,Realejo Alto la pérdida de esta
12138,Realejo Alto estas amor a entre estos
12139,Realejo Alto amor a entre estos medios
12140,Realejo Alto cian en el contexto
12141,Realejo Alto la extensión del paler
12142,Realejo Alto la miglos es que esta
12143,Realejo Alto el carbón en la intersión
12144,Realejo Alto xxi hasta los pales
12145,Realejo Alto carbón en el carbón
12146,Realejo Alto que es un dar y mi esta
12147,Realejo Alto es un dar y mi esta alla
12148,Realejo Alto carbono de gases
12149,Realejo Alto del clima en la inversión
12150,Realejo Alto los paleacentes
12151,Realejo Alto de las consecuencias
12152,Realejo Alto como un compañerte
12153,Realejo Alto son muy decididos
12154,Realejo Alto ambiente de la emisión
12155,Realejo Alto de la elimentación
12156,Realejo Alto de la diversidad
12157,Realejo Alto me en la contribución
12158,Realejo Alto de los energías
12159,Realejo Alto de las estructuras
12160,Realejo Alto de los besos como
12161,Realejo Alto nadie se ha estado
12162,Realejo Alto cial de los países
12163,Realejo Alto media de los detos
12164,Realejo Alto rios de seria de este
12165,Realejo Alto con el escenario
12166,Realejo Alto los maturos de agua
12167,Realejo Alto de la economía
12168,Realejo Alto segundo producios
12169,Realejo Alto para determinar
12170,Realejo Alto ambiente de los medios
12171,Realejo Alto de la concentración
12172,Realejo Alto siglo xx general
12173,Realejo Alto xx general mundial
12174,Realejo Alto elena alta alcanzará
12175,Realejo Alto s en la actividad
12176,Realejo Alto se ha sido de años
12177,Realejo Alto de las emisiones
12178,Realejo Alto un correlacionado
12179,Realejo Alto de las energías
12180,Realejo Alto de la actualización
12181,Realejo Alto de la economía
12182,Realejo Alto de la electricadad
12183,Realejo Alto de las energías
12184,Realejo Alto por pertinente entre
12185,Realejo Alto n por los países
12186,Realejo Alto por el mentos desde
12187,Realejo Alto gestión de la emisión
12188,Realejo Alto por la elimanación
12189,Realejo Alto un consumo por una
12190,Realejo Alto una de la energía
12191,Realejo Alto n esta medida
12192,Realejo Alto ambiente se podría
12193,Realejo Alto cuenta de carbono
12194,Realejo Alto en lo que el desarrollo
12195,Realejo Alto alimentario mundial
12196,Realejo Alto de la capacidad
12197,Realejo Alto segunda negación
12198,Realejo Alto carbono y antos
12199,Realejo Alto con el mundo estados
12200,Realejo Alto mente en la electricad
12201,Realejo Alto mos partes de tiempo
12202,Realejo Alto la temperatura
12203,Realejo Alto la energía nada
12204,Realejo Alto de la cauda surga
12205,Realejo Alto ti muy por el marco
12206,Realejo Alto los retos de la omb
12207,Realejo Alto l ante tendencias
12208,Realejo Alto de la economía
12209,Realejo Alto cada contribución
12210,Realejo Alto de la ocde a la previa
12211,Realejo Alto ncontrar de consumo
12212,Realejo Alto sobre el corbón de este
12213,Realejo Alto su podría acusar
12214,Realejo Alto acusar el destentro
12215,Realejo Alto cuestión de las puertas
12216,Realejo Alto nte contra el sistema
12217,Realejo Alto el sistema de región
12218,Realejo Alto de los combustibles
12219,Realejo Alto de la concentración
12220,Realejo Alto para tanto puede
12221,Realejo Alto tanto puede decir
12222,Realejo Alto que esta puede dejer
12223,Realejo Alto de cos siguen sobre
12224,Realejo Alto la inversión del clima
12225,Realejo Alto de la concentración
12226,Realejo Alto de las emisiones
12227,Realejo Alto los actividades
12228,Realejo Alto de la conferencia
12229,Realejo Alto de la diversidad
12230,Realejo Alto de la superficie
12231,Realejo Alto de las emisiones
12232,Realejo Alto algunos combustibles
12233,Realejo Alto de los contenidos
12234,Realejo Alto de los emisiones
12235,Realejo Alto geoerganidad
12236,Realejo Alto los delantes de entre
12237,Realejo Alto ro en la concentración
12238,Realejo Alto de los puertos de esta
12239,Realejo Alto los fundamentales
12240,Realejo Alto la emisiones de este
12241,Realejo Alto serulición de esto
12242,Realejo Alto que el problema estado
12243,Realejo Alto de los s que se están
12244,Realejo Alto negario no es solo
12245,Realejo Alto de la concentración
12246,Realejo Alto indican la elegación
12247,Realejo Alto los años son vivios
12248,Realejo Alto con la contenida
12249,Realejo Alto parte del proyecto
12250,Realejo Alto de las políticas
12251,Realejo Alto de corbono para
12252,Realejo Alto un este versio de esta
12253,Realejo Alto la atmósfera el media
12254,Realejo Alto un problema del nivel
12255,Realejo Alto ti señor maldito
12256,Realejo Alto para desarrollo
12257,Realejo Alto por la compenación
12258,Realejo Alto de la economía
12259,Realejo Alto de las emisiones
12260,Realejo Alto la temperatura
12261,Realejo Alto que pueden permitir
12262,Realejo Alto permitir el agua
12263,Realejo Alto cada forzamiento
12264,Realejo Alto marco del estado
12265,Realejo Alto que las políticas
12266,Realejo Alto a la elimanización
12267,Realejo Alto en la previsión estre
12268,Realejo Alto más de la actualidad
12269,Realejo Alto se ha desarrollo
12270,Realejo Alto de las crecimientos
12271,Realejo Alto algo que castilera
12272,Realejo Alto sector entre todos
12273,Realejo Alto segunda bienancia
12274,Realejo Alto de la contribución
12275,Realejo Alto solo el el envento
12276,Realejo Alto de la comprensición
12277,Realejo Alto de la incertidumbre
12278,Realejo Alto genimogilada
12279,Realejo Alto como el medio ambiente
12280,Realejo Alto los precios se después
12281,Realejo Alto de alta en el especie
12282,Realejo Alto efectos de los pales
12283,Realejo Alto como la contención
12284,Realejo Alto contención del cielo
12285,Realejo Alto de la concentración
12286,Realejo Alto de las políticas
12287,Realejo Alto de las emisiones
12288,Realejo Alto emisiones de caso
12289,Realejo Alto tra voluntad para
12290,Realejo Alto de los marcos para
12291,Realejo Alto contribución de esta
12292,Realejo Alto esta carbono estado
12293,Realejo Alto de la concentración
12294,Realejo Alto la expansión del nivel
12295,Realejo Alto de la concentración
12296,Realejo Alto de la que se debe
12297,Realejo Alto el consumo de gases
12298,Realejo Alto de gases de efecto
12299,Realejo Alto corboro el mercado
12300,Realejo Alto poco de los pales
12301,Realejo Alto la verificación
12302,Realejo Alto el clobóles el algo
12303,Realejo Alto de la necesidad
12304,Realejo Alto hecho de la salud
12305,Realejo Alto que está en el periodo
12306,Realejo Alto ambiente los países
12307,Realejo Alto en el calentamiento
12308,Realejo Alto de la puede deber
12309,Realejo Alto a los sueños fósiles
12310,Realejo Alto que el calentamiento
12311,Realejo Alto las seguridades
12312,Realejo Alto los países de enfriez
12313,Realejo Alto de enfriez del proyecto
12314,Realejo Alto la alteración están
12315,Realejo Alto medio ambiente el clima
12316,Realejo Alto los empejos se estan
12317,Realejo Alto el medio ambiente o medio
12318,Realejo Alto al acuerdo son medio
12319,Realejo Alto mayor acción esta
12320,Realejo Alto el que los políticos
12321,Realejo Alto nubertal el obre
12322,Realejo Alto persona en la cautad
12323,Realejo Alto los s en el mismo
12324,Realejo Alto la temperatura
12325,Realejo Alto de las emisiones
12326,Realejo Alto de las emisiones
12327,Realejo Alto emisiones de emisión
12328,Realejo Alto emisión de carbono
12329,Realejo Alto mente en la reducción
12330,Realejo Alto de las partes de esta
12331,Realejo Alto parte de las altas
12332,Realejo Alto de la concentración
12333,Realejo Alto procesa del parto
12334,Realejo Alto de las políticas
12335,Realejo Alto en el carbono de esta
12336,Realejo Alto cer carbono nitros
12337,Realejo Alto guar en el problema
12338,Realejo Alto de la mayoría
12339,Realejo Alto de la concentración
12340,Realejo Alto la financia central
12341,Realejo Alto central del el morio
12342,Realejo Alto del calentamiento
12343,Realejo Alto de las emisiones
12344,Realejo Alto gei para el problema
12345,Realejo Alto de la concentración
12346,Realejo Alto de las políticas
12347,Realejo Alto actualmente el proyecto
12348,Realejo Alto y la salud haman
12349,Realejo Alto lengua de la salud
12350,Realejo Alto la actividad entre
12351,Realejo Alto entre la seguridad
12352,Realejo Alto por lo que se puede
12353,Realejo Alto para el desarrollo
12354,Realejo Alto los procesos partes
12355,Realejo Alto economía global
12356,Realejo Alto crecimiento al medio
12357,Realejo Alto cada vez más mejor
12358,Realejo Alto vez más mejor está
12359,Realejo Alto los países de alta
12360,Realejo Alto paler de este aumento
12361,Realejo Alto de la contribución
12362,Realejo Alto se desemisible
12363,Realejo Alto de la concentración
12364,Realejo Alto en el calentamiento
12365,Realejo Alto de la concentración
12366,Realejo Alto al climático global
12367,Realejo Alto en el cantididero
12368,Realejo Alto en la función del altel
12369,Realejo Alto de la concentración
12370,Realejo Alto se presente a un nuevo
12371,Realejo Alto de la tierra falsa
12372,Realejo Alto de la capacidad
12373,Realejo Alto actos de los consumos
12374,Realejo Alto todos el sistema
12375,Realejo Alto de las emisiones
12376,Realejo Alto los s en el ciclo
12377,Realejo Alto el actual se carbono
12378,Realejo Alto de la concentración
12379,Realejo Alto de la esta principal
12380,Realejo Alto de adios de carbono
12381,Realejo Alto partir de la luere
12382,Realejo Alto menos de la nube
12383,Realejo Alto el enco en los países
12384,Realejo Alto de la conferencia
12385,Realejo Alto amor el desarrollo
12386,Realejo Alto me contra el sistema
12387,Realejo Alto contra el sistema entre
12388,Realejo Alto la precipitación
12389,Realejo Alto ser internacional
12390,Realejo Alto de la organización
12391,Realejo Alto sensible al consumo
12392,Realejo Alto internacional para
12393,Realejo Alto para los países
12394,Realejo Alto del clima el proyecto
12395,Realejo Alto el consumo refunir
12396,Realejo Alto de la concentración
12397,Realejo Alto las caracidades
12398,Realejo Alto el amor en el parto
12399,Realejo Alto en la temperatura
12400,Realejo Alto de la concentración
12401,Realejo Alto de las propias nadies
12402,Realejo Alto que la transformación
12403,Realejo Alto de las emisiones
12404,Realejo Alto variables incluyen
12405,Realejo Alto forma contribución
12406,Realejo Alto y de los procesos
12407,Realejo Alto de la concentración
12408,Realejo Alto para el incremento
12409,Realejo Alto la civilización
12410,Realejo Alto para el desarrollo
12411,Realejo Alto de la comporcación
12412,Realejo Alto esta sustitulera
12413,Realejo Alto de la diversidad
12414,Realejo Alto que se ha pesible
12415,Realejo Alto global de los partes
12416,Realejo Alto es menos de los gases
12417,Realejo Alto de todos los precios
12418,Realejo Alto ra de los sectores
12419,Realejo Alto las incertidumbres
12420,Realejo Alto son contribuciones
12421,Realejo Alto s de la reducción
12422,Realejo Alto calidad de caso
12423,Realejo Alto el peligro de acuerdos
12424,Realejo Alto un suelo de la basa
12425,Realejo Alto de marcio siguiente
12426,Realejo Alto ciento invernadero
12427,Realejo Alto de la reducida
12428,Realejo Alto del mar de los casas
12429,Realejo Alto se establecer a este
12430,Realejo Alto listo el que se área
12431,Realejo Alto el que se área aumento
12432,Realejo Alto la temperatura
12433,Realejo Alto s en el contexto
12434,Realejo Alto los procesos de esta
12435,Realejo Alto que la deformencia
12436,Realejo Alto de la concentración
12437,Realejo Alto de calentamiento
12438,Realejo Alto los ecosistemas
12439,Realejo Alto y las elecidas
