,endecasílabo
17838,Realejo Alto ra de la estrategia
17839,Realejo Alto escucio de la salud
17840,Realejo Alto de la lado contra
17841,Realejo Alto ción de la presencia
17842,Realejo Alto son los emisiones
17843,Realejo Alto de co energética
17844,Realejo Alto compensas y solar
17845,Realejo Alto solar a el futuro
17846,Realejo Alto el futuro de la era
17847,Realejo Alto las nubles el amor
17848,Realejo Alto l presente se esta
17849,Realejo Alto de los políticos
17850,Realejo Alto efecto del principal
17851,Realejo Alto de la superficie
17852,Realejo Alto por su desarrollo
17853,Realejo Alto la tierra en la luna
17854,Realejo Alto en la temperatura
17855,Realejo Alto decir de la elena
17856,Realejo Alto de la diversidad
17857,Realejo Alto del consumo de esta
17858,Realejo Alto de la comparación
17859,Realejo Alto el caso de actividad
17860,Realejo Alto de la comperación
17861,Realejo Alto de la organización
17862,Realejo Alto s en la concención
17863,Realejo Alto aguales en el medio
17864,Realejo Alto casa de los ardís
17865,Realejo Alto los ardís son tantos
17866,Realejo Alto son tantos de algunos
17867,Realejo Alto l alternadivo
17868,Realejo Alto de la sopirtación
17869,Realejo Alto de las emisiones
17870,Realejo Alto diferencia estado
17871,Realejo Alto para que el sistema
17872,Realejo Alto sistema ocdemente
17873,Realejo Alto de la empresa para
17874,Realejo Alto y a los países
17875,Realejo Alto los países de entre
17876,Realejo Alto solo de los partes
17877,Realejo Alto de su forzamiento
17878,Realejo Alto gan que los países
17879,Realejo Alto de la superficie
17880,Realejo Alto de las emisiones
17881,Realejo Alto los utilizandos
17882,Realejo Alto contra en la adaptación
17883,Realejo Alto o la cuencia surilla
17884,Realejo Alto nte las emisiones
17885,Realejo Alto co con la actualidad
17886,Realejo Alto son muy por el medio
17887,Realejo Alto de el calentamiento
17888,Realejo Alto paración al año
17889,Realejo Alto los actividades
17890,Realejo Alto actividades entre
17891,Realejo Alto los pales extremos
17892,Realejo Alto extremos de adaptación
17893,Realejo Alto del marco del clima
17894,Realejo Alto de las inversiones
17895,Realejo Alto de las pertinentes
17896,Realejo Alto el clima de su estado
17897,Realejo Alto ra su podre en cada
17898,Realejo Alto el calor de las marcas
17899,Realejo Alto y medioambiental
17900,Realejo Alto aserial de la tierra
17901,Realejo Alto que las políticas
17902,Realejo Alto para la mitura
17903,Realejo Alto mitura de algunos
17904,Realejo Alto de la comunidad
17905,Realejo Alto internacional de esta
17906,Realejo Alto emisiones de gases
17907,Realejo Alto durante mi señor
17908,Realejo Alto serán el terreno
17909,Realejo Alto el terreno probable
17910,Realejo Alto que la diversidad
17911,Realejo Alto continuar la emisión
17912,Realejo Alto la emisión de emisión
17913,Realejo Alto los medios del clima
17914,Realejo Alto del clima con todos
17915,Realejo Alto algunas partes de esta
17916,Realejo Alto como en el contrxto
17917,Realejo Alto mayor decididad
17918,Realejo Alto de la economía
17919,Realejo Alto de las proyecciones
17920,Realejo Alto n siguiente para
17921,Realejo Alto un clima de la parte
17922,Realejo Alto de a la superficie
17923,Realejo Alto la tierra reducir
17924,Realejo Alto de la concentración
17925,Realejo Alto que los políticos
17926,Realejo Alto siglo xx comparte
17927,Realejo Alto la temperatura
17928,Realejo Alto de la estacionado
17929,Realejo Alto de la concentración
17930,Realejo Alto tual de los países
17931,Realejo Alto que estos verificas
17932,Realejo Alto de la concentración
17933,Realejo Alto del carbono a mientras
17934,Realejo Alto dad de demoltado
17935,Realejo Alto de la contantación
17936,Realejo Alto del clima en los pocos
17937,Realejo Alto de la diversidad
17938,Realejo Alto desde la cantidad
17939,Realejo Alto global del proyecto
17940,Realejo Alto de las variaciones
17941,Realejo Alto por los menos así
17942,Realejo Alto así con los países
17943,Realejo Alto el siglo xx es seriel
17944,Realejo Alto es seriel de las partes
17945,Realejo Alto disponialización
17946,Realejo Alto el segundo contexto
17947,Realejo Alto de la mayor parte
17948,Realejo Alto ción de los ciudades
17949,Realejo Alto directir de la amplia
17950,Realejo Alto interior mecanismo
17951,Realejo Alto emisiones de caso
17952,Realejo Alto con el petróleo
17953,Realejo Alto el probable que el corbor
17954,Realejo Alto acéino de la oriente
17955,Realejo Alto por lo que recurren
17956,Realejo Alto de las emisiones
17957,Realejo Alto posar los países
17958,Realejo Alto del clima por trata
17959,Realejo Alto pero el muy probable
17960,Realejo Alto problemas aumentos
17961,Realejo Alto de la mayoría
17962,Realejo Alto de la economía
17963,Realejo Alto y la concencración
17964,Realejo Alto la temperatura
17965,Realejo Alto y los forzamientos
17966,Realejo Alto la verificación
17967,Realejo Alto la verificación
17968,Realejo Alto las concentraciones
17969,Realejo Alto de la concentración
17970,Realejo Alto de la expertigación
17971,Realejo Alto partes de la lucha
17972,Realejo Alto la tierra del panel
17973,Realejo Alto los volados de agua
17974,Realejo Alto agua de la cantada
17975,Realejo Alto por la concentración
17976,Realejo Alto la sociedad de entre
17977,Realejo Alto segundo precisa
17978,Realejo Alto sus concentraciones
17979,Realejo Alto de personas partes
17980,Realejo Alto de las políticas
17981,Realejo Alto un distrobal de que este
17982,Realejo Alto parte de los tienen
17983,Realejo Alto los tienen el amor
17984,Realejo Alto de las combustibles
17985,Realejo Alto de las emisiones
17986,Realejo Alto en el calentamiento
17987,Realejo Alto significativo
17988,Realejo Alto emisiones de co esta
17989,Realejo Alto de la superficie
17990,Realejo Alto de las condeciencias
17991,Realejo Alto ahora en el informe
17992,Realejo Alto de la concentración
17993,Realejo Alto de las condecciones
17994,Realejo Alto interes son el caso
17995,Realejo Alto el caso de la tierra
17996,Realejo Alto en el calentamiento
17997,Realejo Alto mar las convenciones
17998,Realejo Alto se está cantidades
17999,Realejo Alto l de la actividad
18000,Realejo Alto de las condiciones
18001,Realejo Alto de esta seguridad
18002,Realejo Alto de los observados
18003,Realejo Alto los países para
18004,Realejo Alto países para este
18005,Realejo Alto para este maldito
18006,Realejo Alto este maldito solo
18007,Realejo Alto como sostenible
18008,Realejo Alto de la concentración
18009,Realejo Alto remos alternador
18010,Realejo Alto de las pertinentes
18011,Realejo Alto de las proyecciones
18012,Realejo Alto de esta de asimentar
18013,Realejo Alto global a la inversión
18014,Realejo Alto global con el resto
18015,Realejo Alto el resto de la tierra
18016,Realejo Alto entre la concentración
18017,Realejo Alto vida de consumo
18018,Realejo Alto de la concentración
18019,Realejo Alto de las emisiones
18020,Realejo Alto de lo que se hace
18021,Realejo Alto la tierra humana
18022,Realejo Alto de las emisiones
18023,Realejo Alto están las energías
18024,Realejo Alto de las emisiones
18025,Realejo Alto emisiones del clima
18026,Realejo Alto la contaminación
18027,Realejo Alto se de la capticia
18028,Realejo Alto a la evolución de esta
18029,Realejo Alto de la concentración
18030,Realejo Alto del marco del patrón
18031,Realejo Alto de las emisiones
18032,Realejo Alto de las emisiones
18033,Realejo Alto ha de los metasos
18034,Realejo Alto la temperatura
18035,Realejo Alto partes de carbono
18036,Realejo Alto de los combustibles
18037,Realejo Alto de la superficie
18038,Realejo Alto la posibilidad
18039,Realejo Alto y al medio ambiente
18040,Realejo Alto ambiente de la tierra
18041,Realejo Alto de los incrementos
18042,Realejo Alto condecientes de esta
18043,Realejo Alto estado en el además
18044,Realejo Alto las estados partes
18045,Realejo Alto partes de carbono
18046,Realejo Alto mantenir la salud
18047,Realejo Alto la salud han mismo
18048,Realejo Alto les de la cantidad
18049,Realejo Alto nte de la contexta
18050,Realejo Alto en el parto del clima
18051,Realejo Alto de la contribución
18052,Realejo Alto lo que se sería
18053,Realejo Alto l de los países
18054,Realejo Alto se encuentra el problema
18055,Realejo Alto de incursos futuros
18056,Realejo Alto na sus emisiones
18057,Realejo Alto los supuestos para
18058,Realejo Alto entre las emisiones
18059,Realejo Alto de las consecuencias
18060,Realejo Alto la contaminación
18061,Realejo Alto la temperatura
18062,Realejo Alto la ciencia del siglo
18063,Realejo Alto del siglo xx esta
18064,Realejo Alto de la organización
18065,Realejo Alto consumo de casa
18066,Realejo Alto y el desarrollo
18067,Realejo Alto concentrar la tierra
18068,Realejo Alto una contaminación
18069,Realejo Alto de nuestro de aumento
18070,Realejo Alto de las emisiones
18071,Realejo Alto de la comportación
18072,Realejo Alto de la concentración
18073,Realejo Alto de la concentración
18074,Realejo Alto de los políticos
18075,Realejo Alto de la diversidad
18076,Realejo Alto y las emisiones
18077,Realejo Alto se ha subido a una
18078,Realejo Alto no de la reducción
18079,Realejo Alto curso por el peso
18080,Realejo Alto de las estructuras
18081,Realejo Alto posible a los partes
18082,Realejo Alto a los partes de gases
18083,Realejo Alto por el continente
18084,Realejo Alto de los políticos
18085,Realejo Alto el sector en la favor
18086,Realejo Alto s las obscruciones
18087,Realejo Alto con el medio ambiente
18088,Realejo Alto las seguridades
18089,Realejo Alto esta ser por desperto
18090,Realejo Alto ambiente de la tierra
18091,Realejo Alto los pronimitidos
18092,Realejo Alto las continuaciones
18093,Realejo Alto alturas de la inversión
18094,Realejo Alto el tiempo como en esta
18095,Realejo Alto los negacionistas
18096,Realejo Alto meneran el mayor
18097,Realejo Alto esteración de la ocde
18098,Realejo Alto de los combustibles
18099,Realejo Alto de las inversiones
18100,Realejo Alto parte de la tierra
18101,Realejo Alto cuenta previsiones
18102,Realejo Alto previsiones solo
18103,Realejo Alto se ha sido el carbón
18104,Realejo Alto de la contenida
18105,Realejo Alto medida en la nueva
18106,Realejo Alto y la lengua de esta
18107,Realejo Alto alta de la modida
18108,Realejo Alto de la superficie
18109,Realejo Alto la temperatura
18110,Realejo Alto de la concentración
18111,Realejo Alto de los combustibles
18112,Realejo Alto s para ser nunca
18113,Realejo Alto por la superficie
18114,Realejo Alto de las políticas
18115,Realejo Alto para los recursos
18116,Realejo Alto de la organización
18117,Realejo Alto de la mayoría
18118,Realejo Alto recurso en la marca
18119,Realejo Alto del siglo xx esto
18120,Realejo Alto esto estados los hombres
18121,Realejo Alto la temperatura
18122,Realejo Alto de las emisiones
18123,Realejo Alto de la concentración
18124,Realejo Alto en las caracidades
18125,Realejo Alto carbono y entre
18126,Realejo Alto la profunda apace
18127,Realejo Alto de la economía
18128,Realejo Alto en la energía nada
18129,Realejo Alto que se me certida
18130,Realejo Alto esta acción de emisiones
18131,Realejo Alto los actividades
18132,Realejo Alto de la consecución
18133,Realejo Alto de la conferencia
18134,Realejo Alto informe transformación
18135,Realejo Alto de la concentración
18136,Realejo Alto n por el terreno
18137,Realejo Alto vectores como una
18138,Realejo Alto como una producción
18139,Realejo Alto de la internacional
18140,Realejo Alto la energía subión
18141,Realejo Alto a la contaminación
18142,Realejo Alto nuel pera el proceso
18143,Realejo Alto pueden de co suele
18144,Realejo Alto y en el condecir
18145,Realejo Alto de las emisiones
18146,Realejo Alto de los compensados
18147,Realejo Alto pero de recursos
18148,Realejo Alto de recursos de esta
18149,Realejo Alto de las emisiones
18150,Realejo Alto la verificación
18151,Realejo Alto de la seguridad
18152,Realejo Alto la oristiva para
18153,Realejo Alto consumo del sumo
18154,Realejo Alto n el desarrollo
18155,Realejo Alto de la concentración
18156,Realejo Alto de los compromisos
18157,Realejo Alto de las producciones
18158,Realejo Alto de la diversidad
18159,Realejo Alto y la capacidad
18160,Realejo Alto de la transformación
18161,Realejo Alto de las emisiones
18162,Realejo Alto l de las palieras
18163,Realejo Alto alterior a la extensión
18164,Realejo Alto la energía sorre
18165,Realejo Alto de la tierra mundial
18166,Realejo Alto de gei las describen
18167,Realejo Alto son las proyecciones
18168,Realejo Alto la mayor que aumento
18169,Realejo Alto n el medio ambiente
18170,Realejo Alto se se puede tener
18171,Realejo Alto las concentraciones
18172,Realejo Alto el consumo de emisión
18173,Realejo Alto con el tiempo pero
18174,Realejo Alto las concentraciones
18175,Realejo Alto en el cantificación
18176,Realejo Alto además de energía
18177,Realejo Alto la temperatura
18178,Realejo Alto en la naturaleza
18179,Realejo Alto la corresticación
18180,Realejo Alto de la concentración
18181,Realejo Alto la emisión de gases
18182,Realejo Alto la desarrollada
18183,Realejo Alto desen un convenio
18184,Realejo Alto empresas al el nivel
18185,Realejo Alto rente de las partes
18186,Realejo Alto de la electricadad
18187,Realejo Alto electricadad de era
18188,Realejo Alto de las emisiones
18189,Realejo Alto de co seguridad
18190,Realejo Alto el poder de la salud
18191,Realejo Alto las concentraciones
18192,Realejo Alto sobre concentración
18193,Realejo Alto que no se precesan
18194,Realejo Alto la empleo del parto
18195,Realejo Alto el clima más el mismo
18196,Realejo Alto medidas de viento
18197,Realejo Alto de tiempo que el medio
18198,Realejo Alto de los científicos
18199,Realejo Alto que hace el que no estan
18200,Realejo Alto el que no estan los pales
18201,Realejo Alto y el desarrollo
18202,Realejo Alto aquella internacional
18203,Realejo Alto por el consecuencia
18204,Realejo Alto emisiones de caso
18205,Realejo Alto climático es parte
18206,Realejo Alto padecir el pasen
18207,Realejo Alto pasen de la escala
18208,Realejo Alto la escala de el nivel
18209,Realejo Alto las nubes del parto
18210,Realejo Alto oclimático algunos
18211,Realejo Alto de sus metodorgas
18212,Realejo Alto metodorgas de esta
18213,Realejo Alto de las emisiones
18214,Realejo Alto emisiones de caso
18215,Realejo Alto la cual concentración
18216,Realejo Alto de las previsiones
18217,Realejo Alto por la superficie
18218,Realejo Alto de la consecuencia
18219,Realejo Alto serán alimentar
18220,Realejo Alto co en el contamiento
18221,Realejo Alto con la economía
18222,Realejo Alto cado con sectores
18223,Realejo Alto tiempos de los vidos
18224,Realejo Alto y por los cuestiones
18225,Realejo Alto y la política
18226,Realejo Alto s alta el problema
18227,Realejo Alto la energía de esta
18228,Realejo Alto el patir de los precios
18229,Realejo Alto las gases de efecto
18230,Realejo Alto de la amplia en la escasa
18231,Realejo Alto de las inversiones
18232,Realejo Alto de las consecuencias
18233,Realejo Alto medio ambiente para
18234,Realejo Alto scande los corbones
18235,Realejo Alto para la segunda
18236,Realejo Alto global son que pueden
18237,Realejo Alto son que pueden mayor
18238,Realejo Alto de los eficientes
18239,Realejo Alto la extensión del clima
18240,Realejo Alto de las emisiones
18241,Realejo Alto s están incluyen
18242,Realejo Alto estos de la atmósfera
18243,Realejo Alto partir de validad
18244,Realejo Alto cial precisa en la ocde
18245,Realejo Alto en la ocde por la ciencia
18246,Realejo Alto de las definición
18247,Realejo Alto son calentamiento
18248,Realejo Alto datos de la tierra
18249,Realejo Alto el cuisio de la cupa
18250,Realejo Alto en el calentamiento
18251,Realejo Alto de la electricidad
18252,Realejo Alto mucho medio ambiente
18253,Realejo Alto ambiente de la inversión
18254,Realejo Alto de las humanismos
18255,Realejo Alto de la economía
18256,Realejo Alto capitalización
18257,Realejo Alto a una modilización
18258,Realejo Alto el climático es una
18259,Realejo Alto al gas de los países
18260,Realejo Alto se están de la tierna
18261,Realejo Alto las concentraciones
18262,Realejo Alto la segunda tierra
18263,Realejo Alto cial se puede tener
18264,Realejo Alto alto de la segunda
18265,Realejo Alto la tierra prevista
18266,Realejo Alto de gei y posibles
18267,Realejo Alto sistemas de un siglo
18268,Realejo Alto de un siglo xxi para
18269,Realejo Alto este mercado como
18270,Realejo Alto a los actuales asto
18271,Realejo Alto hayera permitir
18272,Realejo Alto el contexto de todos
18273,Realejo Alto las gases de efecto
18274,Realejo Alto la temperatura
18275,Realejo Alto finalimentación
18276,Realejo Alto sobre los acuerdos
18277,Realejo Alto los acuerdos entre
18278,Realejo Alto la energía elenta
18279,Realejo Alto de la economía
18280,Realejo Alto de la concentración
18281,Realejo Alto el control de los casos
18282,Realejo Alto del calentamiento
18283,Realejo Alto el carbono en la nube
18284,Realejo Alto la encentración allá
18285,Realejo Alto allá será contropo
18286,Realejo Alto que en por el informe
18287,Realejo Alto control de la lados
18288,Realejo Alto tan en concentración
18289,Realejo Alto del economista
18290,Realejo Alto de los políticos
18291,Realejo Alto de la concentración
18292,Realejo Alto de la superficie
18293,Realejo Alto debe algunos partes
18294,Realejo Alto algunos partes de esta
18295,Realejo Alto n el amor sino
18296,Realejo Alto los países de amor
18297,Realejo Alto de las consecuencias
18298,Realejo Alto s menos de precios
18299,Realejo Alto por el medio ambiente
18300,Realejo Alto para la presencia
18301,Realejo Alto puerta por el siglo
18302,Realejo Alto una de la segunda
18303,Realejo Alto la cartificación
18304,Realejo Alto la temperatura
18305,Realejo Alto n la contribución
18306,Realejo Alto de las emisiones
18307,Realejo Alto de la concentración
18308,Realejo Alto estración de la informe
18309,Realejo Alto las emisión para
18310,Realejo Alto para la actividad
18311,Realejo Alto de los años siglas
18312,Realejo Alto los pasos de tiempo
18313,Realejo Alto de tiempo se puede
18314,Realejo Alto para de derechos
18315,Realejo Alto de la concentración
18316,Realejo Alto los gases de efecto
18317,Realejo Alto son los anteriores
18318,Realejo Alto capaz de las gases
18319,Realejo Alto las gases de efecto
18320,Realejo Alto de las políticas
18321,Realejo Alto sario al responsable
18322,Realejo Alto las naciones entre
18323,Realejo Alto era estabilización
18324,Realejo Alto la temperatura
18325,Realejo Alto deforestes para
18326,Realejo Alto de las emisiones
18327,Realejo Alto de las políticas
18328,Realejo Alto de la concentración
18329,Realejo Alto del pib de emisiones
18330,Realejo Alto para de energía
18331,Realejo Alto de la economía
18332,Realejo Alto de la mayor parte
18333,Realejo Alto n de la altercidad
18334,Realejo Alto nte de las mayores
18335,Realejo Alto tiempo que no debe
18336,Realejo Alto liberalización
18337,Realejo Alto naturalizado
18338,Realejo Alto la contaminación
18339,Realejo Alto los cantificados
18340,Realejo Alto aumenta el mator medio
18341,Realejo Alto forma que podría
18342,Realejo Alto que podría algunos
18343,Realejo Alto y la lado purme
18344,Realejo Alto de las emisiones
18345,Realejo Alto de las diferencias
18346,Realejo Alto es la satuda de alta
18347,Realejo Alto el paser de la oms como
18348,Realejo Alto los años se penden
18349,Realejo Alto como por su parte
18350,Realejo Alto las desarrollados
18351,Realejo Alto los mundos o medios
18352,Realejo Alto ma continua el marco
18353,Realejo Alto el marco del proyecto
18354,Realejo Alto la percancia medio
18355,Realejo Alto cosa legitima
18356,Realejo Alto legitima de esta
18357,Realejo Alto la pobición de entre
18358,Realejo Alto de entre las palionas
18359,Realejo Alto la salud humana
18360,Realejo Alto humana del ciclo
18361,Realejo Alto ciclo de la emisión
18362,Realejo Alto que los pales nuevos
18363,Realejo Alto en la temperatura
18364,Realejo Alto de la superficia
18365,Realejo Alto concentrar al gante
18366,Realejo Alto aumento del proyecto
18367,Realejo Alto que panes con esta
18368,Realejo Alto tuerra de la lucha
18369,Realejo Alto de la lucha mucha
18370,Realejo Alto resto de la forma
18371,Realejo Alto como desarrollo
18372,Realejo Alto de los políticos
18373,Realejo Alto la planificación
18374,Realejo Alto la función del siglo
18375,Realejo Alto ncial de los países
18376,Realejo Alto de la internacional
18377,Realejo Alto global de la emisión
18378,Realejo Alto a lo que el mantenico
18379,Realejo Alto intersión en la inunial
18380,Realejo Alto de las emisiones
18381,Realejo Alto partes de la nueva
18382,Realejo Alto las extramas de otros
18383,Realejo Alto porque al desarrollo
18384,Realejo Alto encontrar la sociedad
18385,Realejo Alto verificaciones
18386,Realejo Alto de los seriedores
18387,Realejo Alto y en el sostema
18388,Realejo Alto nte de los detales
18389,Realejo Alto la carre a energía
18390,Realejo Alto el alternado para
18391,Realejo Alto los padres en casa
18392,Realejo Alto en casa los países
18393,Realejo Alto de la tierra al carbón
18394,Realejo Alto de esta conferencia
18395,Realejo Alto comprensibilidad
18396,Realejo Alto la energía forma
18397,Realejo Alto te podría encaucar
18398,Realejo Alto encaucar la energía
18399,Realejo Alto s de las procesos
18400,Realejo Alto de la diversidad
18401,Realejo Alto de adaptación de este
18402,Realejo Alto de la concentración
18403,Realejo Alto de los continersos
18404,Realejo Alto continersos de esta
18405,Realejo Alto medios de la tierra
18406,Realejo Alto y por mi mi carga
18407,Realejo Alto pasa de la salud
18408,Realejo Alto menos de los años
18409,Realejo Alto alta de la actividad
18410,Realejo Alto los países tienes
18411,Realejo Alto porte en el sistema
18412,Realejo Alto la temperatura
18413,Realejo Alto ser cuerpo y mayor
18414,Realejo Alto carbono en la anterior
18415,Realejo Alto de la seguridad
18416,Realejo Alto la temperatura
18417,Realejo Alto de la concentración
18418,Realejo Alto de la economía
18419,Realejo Alto los asosicidus
18420,Realejo Alto de la crecimiento
18421,Realejo Alto compuesar el siglo
18422,Realejo Alto el problema del nivel
18423,Realejo Alto lo que no de hacer
18424,Realejo Alto n el mundo de esta
18425,Realejo Alto estado de los precios
18426,Realejo Alto de las emisiones
18427,Realejo Alto de las diferencias
18428,Realejo Alto la posibilidad
18429,Realejo Alto de la concentración
18430,Realejo Alto emisiones de caso
18431,Realejo Alto nación de la cumbre
18432,Realejo Alto de las emisiones
18433,Realejo Alto emisiones de caso
18434,Realejo Alto y los políticos
18435,Realejo Alto de la concentración
18436,Realejo Alto de la concentración
18437,Realejo Alto con la concentración
18438,Realejo Alto de la concentración
18439,Realejo Alto los actividades
18440,Realejo Alto actividades como
18441,Realejo Alto lla en las emisiones
18442,Realejo Alto son que los preserves
18443,Realejo Alto nte del clima de esta
18444,Realejo Alto dición de la tierra
18445,Realejo Alto la precipitación
18446,Realejo Alto las concentraciones
18447,Realejo Alto consumo en el carbón
18448,Realejo Alto de la organización
18449,Realejo Alto la atmósfera para
18450,Realejo Alto persona capital
18451,Realejo Alto de la organización
18452,Realejo Alto en el calentamiento
18453,Realejo Alto gla el historio global
18454,Realejo Alto para la variación
18455,Realejo Alto variación de la onu
18456,Realejo Alto carbón de la intersión
18457,Realejo Alto de carbono amigos
18458,Realejo Alto amigos de energía
18459,Realejo Alto mercados con custos
18460,Realejo Alto custos de los propias
18461,Realejo Alto de la diversidad
18462,Realejo Alto de la concentración
18463,Realejo Alto de la concentración
18464,Realejo Alto de la mayor parte
18465,Realejo Alto ve que el seguimiento
18466,Realejo Alto ción de la subida
18467,Realejo Alto de las emisiones
18468,Realejo Alto interes sobre el patrón
18469,Realejo Alto sostenible de alta
18470,Realejo Alto alta cuenta en la inversión
18471,Realejo Alto carbono ha sido
18472,Realejo Alto esta también es esta
18473,Realejo Alto las temperaturas
18474,Realejo Alto energía natural
18475,Realejo Alto sidad de emisiones
18476,Realejo Alto co en la concentración
18477,Realejo Alto los años se pueden
18478,Realejo Alto escala de los partes
18479,Realejo Alto de las políticas
18480,Realejo Alto de la contribución
18481,Realejo Alto primer faltas están
18482,Realejo Alto comprensibilidad
18483,Realejo Alto que la organización
18484,Realejo Alto factores sin amor
18485,Realejo Alto de la contribución
18486,Realejo Alto y la energía esta
18487,Realejo Alto medida del clima
18488,Realejo Alto gas para propirar
18489,Realejo Alto los negociaciones
18490,Realejo Alto ro lo que se debe
18491,Realejo Alto debe se han de entrar
18492,Realejo Alto mismo político
18493,Realejo Alto que se está en el parto
18494,Realejo Alto de los voluciones
18495,Realejo Alto cados sicinionas
18496,Realejo Alto en el calentamiento
18497,Realejo Alto lisio de los años
18498,Realejo Alto de los años pero
18499,Realejo Alto de la organización
18500,Realejo Alto del compañer mucho
18501,Realejo Alto de la diversidad
18502,Realejo Alto so a la estada para
18503,Realejo Alto en la naturaleza
18504,Realejo Alto de la organización
18505,Realejo Alto la temperatura
18506,Realejo Alto de la sodo uno está
18507,Realejo Alto mundial de la entresa
18508,Realejo Alto mar en la actividad
18509,Realejo Alto mos de los países
18510,Realejo Alto de las políticas
18511,Realejo Alto son diversidader
18512,Realejo Alto en la nombre de algunos
18513,Realejo Alto de la comparación
18514,Realejo Alto n estar a todos
18515,Realejo Alto a todos los países
