,endecasílabo
0,Realejo Alto ### load libraries
1,Realejo Alto la recursosidad
2,Realejo Alto de las emisiones
3,Realejo Alto de la concentración
4,Realejo Alto entre el parto del mismo
5,Realejo Alto países de nuestro
6,Realejo Alto contigo en la emisión
7,Realejo Alto eficientes con partes
8,Realejo Alto de la humanidad
9,Realejo Alto marcio a la presencia
10,Realejo Alto los composiciones
11,Realejo Alto de la comperación
12,Realejo Alto de la carta de esta
13,Realejo Alto es un siglo xx estos
14,Realejo Alto la desempleación
15,Realejo Alto s de los países
16,Realejo Alto de los combustibles
17,Realejo Alto la función de carbón
18,Realejo Alto nubes del proceso
19,Realejo Alto estado a la subida
20,Realejo Alto de los combustibles
21,Realejo Alto para diversidad
22,Realejo Alto gustos de la emisión
23,Realejo Alto la emisión de emisión
24,Realejo Alto de algunos países
25,Realejo Alto la nueva alta al nivel
26,Realejo Alto la inercia de efectos
27,Realejo Alto en la emisión de todos
28,Realejo Alto el que debe el mercado
29,Realejo Alto que hay que se viere
30,Realejo Alto el estado de cumbre
31,Realejo Alto cumbre de la ommera
32,Realejo Alto en la contaminación
33,Realejo Alto s es un convenio
34,Realejo Alto es un convenio sobre
35,Realejo Alto de la conferencia
36,Realejo Alto medidas permiten
37,Realejo Alto la temperatura
38,Realejo Alto del calentamiento
39,Realejo Alto la temperatura
40,Realejo Alto de la contribución
41,Realejo Alto de la concentración
42,Realejo Alto los actividades
43,Realejo Alto para que se poner
44,Realejo Alto la temperatura
45,Realejo Alto albiente con su fecha
46,Realejo Alto de los combustibles
47,Realejo Alto de esta poderpera
48,Realejo Alto las concentraciones
49,Realejo Alto lucha de ser alta
50,Realejo Alto el paso de la guerra
51,Realejo Alto de la comperación
52,Realejo Alto que se pode para
53,Realejo Alto un forzamiento también
54,Realejo Alto de la mayoría
55,Realejo Alto la forma de casa
56,Realejo Alto emisiones de gases
57,Realejo Alto de gases de efecto
58,Realejo Alto desarrollan casa
59,Realejo Alto casa de la mayor
60,Realejo Alto de las principales
61,Realejo Alto a mucha marca descual
62,Realejo Alto del clima en la tierra
63,Realejo Alto mar de los países
64,Realejo Alto el mercado probable
65,Realejo Alto a los interseñores
66,Realejo Alto y las oficinas
67,Realejo Alto de la mayoría
68,Realejo Alto de esta incentidumbre
69,Realejo Alto para estados para
70,Realejo Alto de los combustibles
71,Realejo Alto energéticos entre
72,Realejo Alto s son los proyectos
73,Realejo Alto actual con el contexto
74,Realejo Alto se contenta el marco
75,Realejo Alto de la contratuira
76,Realejo Alto s registrar como
77,Realejo Alto clima de modelos
78,Realejo Alto biente de la intersión
79,Realejo Alto aumento del problema
80,Realejo Alto compensario que están
81,Realejo Alto que están en el medio
82,Realejo Alto de las inversiones
83,Realejo Alto de la conferencia
84,Realejo Alto la población están
85,Realejo Alto disculpa en la lado
86,Realejo Alto de los medios de este
87,Realejo Alto n establecida
88,Realejo Alto de la concentración
89,Realejo Alto de la concentración
90,Realejo Alto puedo estar la salud
91,Realejo Alto efectos para el amor
92,Realejo Alto el amor de la función
93,Realejo Alto de mantenida entre
94,Realejo Alto pueden el mercado
95,Realejo Alto mercado que el amor
96,Realejo Alto que el amor de viento
97,Realejo Alto de las emisiones
98,Realejo Alto de gei no establecer
99,Realejo Alto las países para
100,Realejo Alto el impacto de un clima
101,Realejo Alto no pueda despertar
102,Realejo Alto de la diversidad
103,Realejo Alto de los combustibles
104,Realejo Alto y las inversiones
105,Realejo Alto s electricidad
106,Realejo Alto de las políticas
107,Realejo Alto de la comperación
108,Realejo Alto la en el actual también
109,Realejo Alto responsar la salud
110,Realejo Alto de las de recursos
111,Realejo Alto partir del problema
112,Realejo Alto problema del medio
113,Realejo Alto de la concentración
114,Realejo Alto la temperatura
115,Realejo Alto nivel del mar de estos
116,Realejo Alto la precisión para
117,Realejo Alto por la emisión de este
118,Realejo Alto mar soda este tiempo
119,Realejo Alto ción en la actividad
120,Realejo Alto los economistas
121,Realejo Alto continua el distinto
122,Realejo Alto ambiente con la parte
123,Realejo Alto crecimiento sobre
124,Realejo Alto pera de los solor
125,Realejo Alto global del proyecto
126,Realejo Alto de la concentración
127,Realejo Alto la segunda escala
128,Realejo Alto de la cual controlar
129,Realejo Alto de esta desestudión
130,Realejo Alto de los pasos así
131,Realejo Alto na los contenidos
132,Realejo Alto de las emisiones
133,Realejo Alto por el gas de la esta
134,Realejo Alto la ieversidad dio esta
135,Realejo Alto el informe del nivel
136,Realejo Alto energía nuclear
137,Realejo Alto de la humanidad
138,Realejo Alto de esta concentración
139,Realejo Alto la alta a la antórica
140,Realejo Alto de la conferencia
141,Realejo Alto poder de los partes
142,Realejo Alto de las emisiones
143,Realejo Alto la cumbre del clima
144,Realejo Alto cumbre del clima este
145,Realejo Alto del clima este estado
146,Realejo Alto la segunda parte
147,Realejo Alto se pueden recursos
148,Realejo Alto el carbono e intensidad
149,Realejo Alto menos del problema
150,Realejo Alto de los partes de esta
151,Realejo Alto el climático sobre
152,Realejo Alto el problema del nivel
153,Realejo Alto tiene una previsión
154,Realejo Alto de la concentración
155,Realejo Alto país del catero
156,Realejo Alto s de la encusita
157,Realejo Alto carbón formativo
158,Realejo Alto el marco de los partes
159,Realejo Alto de la que el contexto
160,Realejo Alto a la mayor estados
161,Realejo Alto de los asosicos
162,Realejo Alto que pueden reprevar
163,Realejo Alto la sociedad para
164,Realejo Alto para desarrollo
165,Realejo Alto de las emisiones
166,Realejo Alto un farzamiento selia
167,Realejo Alto sucuento al besoar
168,Realejo Alto los años estados
169,Realejo Alto coriolano para
170,Realejo Alto ndo en la actualización
171,Realejo Alto a las actividades
172,Realejo Alto el siglo xx proyecto
173,Realejo Alto problema del nivel
174,Realejo Alto con la concentración
175,Realejo Alto de la concentración
176,Realejo Alto de los combastibles
177,Realejo Alto de la contemplación
178,Realejo Alto mismo pero tanto
179,Realejo Alto los países de estos
180,Realejo Alto ción de la expertidad
181,Realejo Alto el climático sobre
182,Realejo Alto clima ecológica
183,Realejo Alto de adaptación entre
184,Realejo Alto amor en el consumo
185,Realejo Alto en el consumo medio
186,Realejo Alto en la atmósfera el tiempo
187,Realejo Alto estados de los gases
188,Realejo Alto los gases de efecto
189,Realejo Alto esta segunda cinco
190,Realejo Alto son los menos para
191,Realejo Alto sión de la reducir
192,Realejo Alto la cauda del siglo
193,Realejo Alto del siglo xxi fillen
194,Realejo Alto kioto y el nivel
195,Realejo Alto de las políticas
196,Realejo Alto por la contribución
197,Realejo Alto la salud humana
198,Realejo Alto de la concentración
199,Realejo Alto n contaminacion
200,Realejo Alto de la conferencia
201,Realejo Alto s de la subida
202,Realejo Alto algo del medio ambiente
203,Realejo Alto do campan previsto
204,Realejo Alto en la temperatura
205,Realejo Alto de las producciones
206,Realejo Alto de las emisiones
207,Realejo Alto de la concentración
208,Realejo Alto de las cantidades
209,Realejo Alto amor es por directo
210,Realejo Alto el problema se decir
211,Realejo Alto de la tomprenación
212,Realejo Alto puede tierra serán
213,Realejo Alto tierra serán altas
214,Realejo Alto la contaminación
215,Realejo Alto de las emisiones
216,Realejo Alto mente ser la capa
217,Realejo Alto de la conferencia
218,Realejo Alto de carbono de este
219,Realejo Alto una esta contamora
220,Realejo Alto la energía para
221,Realejo Alto cambien el transmision
222,Realejo Alto de la diversidad
223,Realejo Alto cantidades de esta
224,Realejo Alto carbono de inversión
225,Realejo Alto inversión de la inversión
226,Realejo Alto de las decisiones
227,Realejo Alto de las emisiones
228,Realejo Alto de gol en la oriente
229,Realejo Alto de las emisiones
230,Realejo Alto con el suelo mucho
231,Realejo Alto carbono en la vida
232,Realejo Alto el seguimiento para
233,Realejo Alto enfrento de la capa
234,Realejo Alto sistema del siglo
235,Realejo Alto y de la energía
236,Realejo Alto de la economía
237,Realejo Alto impacto de las cubres
238,Realejo Alto de la economía
239,Realejo Alto todo el desarrollo
240,Realejo Alto continua en el carbón
241,Realejo Alto el carbón de las partes
242,Realejo Alto a las concentraciones
243,Realejo Alto un aumento del país
244,Realejo Alto consecuencia de esa
245,Realejo Alto de esa contribución
246,Realejo Alto seribilización
247,Realejo Alto de la concentración
248,Realejo Alto de carbono estados
249,Realejo Alto las concentraciones
250,Realejo Alto n las emisiones
251,Realejo Alto co en la diversidad
252,Realejo Alto el de los desarrollos
253,Realejo Alto de carbono es algo
254,Realejo Alto de la economía
255,Realejo Alto en el calentamiento
256,Realejo Alto habla demendiente
257,Realejo Alto adiptación de todos
258,Realejo Alto con el consecuencia
259,Realejo Alto riente de las amplias
260,Realejo Alto de la respitación
261,Realejo Alto de las emisiones
262,Realejo Alto las compensaciones
263,Realejo Alto carbono en la tierra
264,Realejo Alto la estabilización
265,Realejo Alto las marcas de tiempo
266,Realejo Alto el marco del informe
267,Realejo Alto en partorer estados
268,Realejo Alto estados entre el carbón
269,Realejo Alto de los inversiones
270,Realejo Alto el peligro de precios
271,Realejo Alto da de los países
272,Realejo Alto la naturaleza
273,Realejo Alto de los combustibles
274,Realejo Alto y la concentración
275,Realejo Alto r con concentración
276,Realejo Alto la sociedad para
277,Realejo Alto para la presente
278,Realejo Alto la estabilización
279,Realejo Alto informe de las altas
280,Realejo Alto de las altas de una
281,Realejo Alto el algune prevento
282,Realejo Alto co han contribución
283,Realejo Alto peso de sestible
284,Realejo Alto de nuestro propio amor
285,Realejo Alto estas contribuciones
286,Realejo Alto de las emisiones
287,Realejo Alto con el sub estado
288,Realejo Alto estado de la tierra
289,Realejo Alto decisión son control
290,Realejo Alto control de emisiones
291,Realejo Alto de las emisiones
292,Realejo Alto emisiones de emisión
293,Realejo Alto la alta capacidad
294,Realejo Alto la inversión del clima
295,Realejo Alto de la superficie
296,Realejo Alto de las emisiones
297,Realejo Alto es cuestion contribución
298,Realejo Alto aumento del problema
299,Realejo Alto estados consecuencias
300,Realejo Alto de estas esperientes
301,Realejo Alto de los forzamientos
302,Realejo Alto tiene a comperación
303,Realejo Alto de la mayor parte
304,Realejo Alto estados algo global
305,Realejo Alto de la economía
306,Realejo Alto ción de los países
307,Realejo Alto nuestra de la sido
308,Realejo Alto y la concentración
309,Realejo Alto para las demandas
310,Realejo Alto emisiones de gases
311,Realejo Alto de la concentración
312,Realejo Alto emisiones de emisión
313,Realejo Alto en el sistema estrecto
314,Realejo Alto los s en el salud
315,Realejo Alto de la conferencia
316,Realejo Alto tancias de la coraz
317,Realejo Alto en el el mismo sector
318,Realejo Alto de las emisiones
319,Realejo Alto de la conferencia
320,Realejo Alto de la esta de inversión
321,Realejo Alto de la organización
322,Realejo Alto altas en el carbono
323,Realejo Alto de la civicidad
324,Realejo Alto se permine todos
325,Realejo Alto de la compensación
326,Realejo Alto de las emisiones
327,Realejo Alto con una decisión
328,Realejo Alto de las eficiencias
329,Realejo Alto de calentamiento
330,Realejo Alto global al el mesio
331,Realejo Alto el carbón se ha pecho
332,Realejo Alto los s indesentos
333,Realejo Alto de la economía
334,Realejo Alto algunos combustibles
335,Realejo Alto el problema en el ciclo
336,Realejo Alto global de la tierra
337,Realejo Alto de las emisiones
338,Realejo Alto las concentraciones
339,Realejo Alto orionista en la emisión
340,Realejo Alto medio de los medios
341,Realejo Alto medio de la larga
342,Realejo Alto el climático el poco
343,Realejo Alto de la mayor parte
344,Realejo Alto de la economía
345,Realejo Alto ser organización
346,Realejo Alto de la economía
347,Realejo Alto global de la sido
348,Realejo Alto de la sido marca
349,Realejo Alto las actividades
350,Realejo Alto un escado en la enaria
351,Realejo Alto pero se ha lonta
352,Realejo Alto de esta de entre algunos
353,Realejo Alto compunsar la mayor
354,Realejo Alto su vida en el siglo
355,Realejo Alto su parte de la emple
356,Realejo Alto generalizadas
357,Realejo Alto su serimentación
358,Realejo Alto parto de la salud
359,Realejo Alto de esta decidura
360,Realejo Alto se ha distrabución
361,Realejo Alto para el desarrollo
362,Realejo Alto la meyor estado
363,Realejo Alto de la concentración
364,Realejo Alto cuentos de los siglos
365,Realejo Alto energético esta a esa
366,Realejo Alto de la deversidad
367,Realejo Alto de la concentración
368,Realejo Alto los medios de marcio
369,Realejo Alto marcio de la tierra
370,Realejo Alto de la tierra como
371,Realejo Alto de las emisiones
372,Realejo Alto no poner su precio
373,Realejo Alto de la concentración
374,Realejo Alto de las emisiones
375,Realejo Alto la salud hamana
376,Realejo Alto esperan el sistema
377,Realejo Alto por esta eficiencia
378,Realejo Alto aumento de la mayor
379,Realejo Alto de la mayor parte
380,Realejo Alto que al calentamiento
381,Realejo Alto y la concentración
382,Realejo Alto cado a no he decir
383,Realejo Alto nunca en particular
384,Realejo Alto las gases de efecto
385,Realejo Alto que la comparación
386,Realejo Alto de la economía
387,Realejo Alto de la superficie
388,Realejo Alto especie de la tierra
389,Realejo Alto de los que te desen
390,Realejo Alto la ocuesta al problema
391,Realejo Alto de la diversidad
392,Realejo Alto de la contribución
393,Realejo Alto de las emisiones
394,Realejo Alto de la deferencia
395,Realejo Alto en el calentamiento
396,Realejo Alto te solo esta nueva
397,Realejo Alto generalización
398,Realejo Alto de la seguridad
399,Realejo Alto de la diversidad
400,Realejo Alto los incertidumbres
401,Realejo Alto de las emisiones
402,Realejo Alto carbono a las curses
403,Realejo Alto registrada para
404,Realejo Alto de las combustibles
405,Realejo Alto fósiles y no están
406,Realejo Alto de las emisiones
407,Realejo Alto gei la comparación
408,Realejo Alto en la temperatura
409,Realejo Alto la sustibulidad
410,Realejo Alto mis de los recursos
411,Realejo Alto partes de este nivel
412,Realejo Alto de la concentración
413,Realejo Alto la correspondidad
414,Realejo Alto las concentraciones
415,Realejo Alto de la estado para
416,Realejo Alto todos los modelos
417,Realejo Alto de la diversidad
418,Realejo Alto de la concentración
419,Realejo Alto los años estados
420,Realejo Alto proyecto de aumento
421,Realejo Alto aumento del problema
422,Realejo Alto se será al compensar
423,Realejo Alto al compensar el mundo
424,Realejo Alto las concentraciones
425,Realejo Alto n de los proyectos
426,Realejo Alto en la tierra tendría
427,Realejo Alto del pero el estado
428,Realejo Alto de las emisiones
429,Realejo Alto el carbono en la nueva
430,Realejo Alto va esta destinado
431,Realejo Alto de la incertidumbre
432,Realejo Alto de las cantidades
433,Realejo Alto rada de cuestiones
434,Realejo Alto las contribuciones
435,Realejo Alto de la preductiva
436,Realejo Alto creta necesarias
437,Realejo Alto necesarias para
438,Realejo Alto para la subida
439,Realejo Alto s de la eficiencia
440,Realejo Alto de la concentración
441,Realejo Alto intersión del contexto
442,Realejo Alto de la contribución
443,Realejo Alto de las emisiones
444,Realejo Alto emisiones de miguir
445,Realejo Alto de las emisiones
446,Realejo Alto emisiones de emisión
447,Realejo Alto de las inversiones
448,Realejo Alto hacia la sociedad
449,Realejo Alto la sociedad para
450,Realejo Alto durar el problema
451,Realejo Alto nte me desarrollo
452,Realejo Alto carbono al enformo
453,Realejo Alto la esta de la vida
454,Realejo Alto n la tamporación
455,Realejo Alto de la concentración
456,Realejo Alto lario en la energía
457,Realejo Alto en la energía de esta
458,Realejo Alto la alta de la cumbre
459,Realejo Alto la verificación
460,Realejo Alto emisiones de gases
461,Realejo Alto de gases de efecto
462,Realejo Alto por su política
463,Realejo Alto de las emisiones
464,Realejo Alto de la contemplación
465,Realejo Alto que se esta presente
466,Realejo Alto esta presente que esta
467,Realejo Alto de la concentración
468,Realejo Alto de las emisiones
469,Realejo Alto de la concentración
470,Realejo Alto de los años serán
471,Realejo Alto corbono en el ciclo
472,Realejo Alto como un combustibles
473,Realejo Alto cian en el problema
474,Realejo Alto para cosas están
475,Realejo Alto y la diversidad
476,Realejo Alto de la organización
477,Realejo Alto las descursos pueden
478,Realejo Alto climático en este
479,Realejo Alto la posibilidad
480,Realejo Alto la temperatura
481,Realejo Alto carbono y parte
482,Realejo Alto esta ser interiación
483,Realejo Alto de las emisiones
484,Realejo Alto emisiones de gases
485,Realejo Alto de gases de efecto
486,Realejo Alto el carbono este precio
487,Realejo Alto precipitaciones
488,Realejo Alto de la superficie
489,Realejo Alto no sido el carbono
490,Realejo Alto desarrollo sobre
491,Realejo Alto la suctiricación
492,Realejo Alto antiración del nivel
493,Realejo Alto a la mayor esteria
494,Realejo Alto de las políticas
495,Realejo Alto de niveles de esta
496,Realejo Alto mecanismos para
497,Realejo Alto de las políticas
498,Realejo Alto s de los supuestos
499,Realejo Alto de la luncar de esta
500,Realejo Alto de empleo de gases
501,Realejo Alto medio medio albiente
502,Realejo Alto a las contribuciones
503,Realejo Alto los actividades
504,Realejo Alto todos los efectos
505,Realejo Alto responsabilidad
506,Realejo Alto el aumento del mismo
507,Realejo Alto de la superficie
508,Realejo Alto carbono en el pader
509,Realejo Alto la inversión del marco
510,Realejo Alto todos los procesos
511,Realejo Alto como un consecuencia
512,Realejo Alto despecto a la salud
513,Realejo Alto a la salud ha sido
514,Realejo Alto todos los consumos
515,Realejo Alto los gases de efecto
516,Realejo Alto mismo por el cario
517,Realejo Alto hace que me construir
518,Realejo Alto la despie a el mar de esta
519,Realejo Alto la contaminación
520,Realejo Alto la secuencia medio
521,Realejo Alto sobre diversidad
522,Realejo Alto de la concentración
523,Realejo Alto de de los retuosos
524,Realejo Alto n la capacidad
525,Realejo Alto de los conderciones
526,Realejo Alto océano a la maria
527,Realejo Alto de la concentración
528,Realejo Alto para un combustible
529,Realejo Alto de la economía
530,Realejo Alto la en el medio ambiente
531,Realejo Alto el enfermedad para
532,Realejo Alto con la buena parte
533,Realejo Alto norte de esta aumento
534,Realejo Alto de la seguridad
535,Realejo Alto la de los países
536,Realejo Alto te que esta responder
537,Realejo Alto un volumen de marcio
538,Realejo Alto emisiones de emisión
539,Realejo Alto tiempo es muy posible
540,Realejo Alto no es un calor que esta
541,Realejo Alto con el mucho muerto
542,Realejo Alto muerto de la vida
543,Realejo Alto de esta contentación
544,Realejo Alto en las programas tendrán
545,Realejo Alto tendrán por el primer
546,Realejo Alto con ti muedos como
547,Realejo Alto te de los sistemas
548,Realejo Alto y en todo el amor
549,Realejo Alto el amor en el siglo
550,Realejo Alto la temperatura
551,Realejo Alto y la política
552,Realejo Alto de un retrollogines
553,Realejo Alto mayor del problema
554,Realejo Alto contra los palores
555,Realejo Alto s mutuos continuar
556,Realejo Alto existencia del mundo
557,Realejo Alto actuales en la salud
558,Realejo Alto consumo de casa
559,Realejo Alto de casa del merco
560,Realejo Alto en el calentamiento
561,Realejo Alto de la economía
562,Realejo Alto estado a la estamana
563,Realejo Alto los s en un agua
564,Realejo Alto en la estructura extrema
565,Realejo Alto alcanzar el corbono
566,Realejo Alto de los años menos
567,Realejo Alto de entre el que durante
568,Realejo Alto factores al menos
569,Realejo Alto ambiente de las coper
570,Realejo Alto de temperatura
571,Realejo Alto los precios de efecto
572,Realejo Alto de las emisiones
573,Realejo Alto pero la autividad
574,Realejo Alto consumo para estar
575,Realejo Alto estar la calentación
576,Realejo Alto na la enira marcia
577,Realejo Alto causan el estado
578,Realejo Alto el estado humano
579,Realejo Alto estado humano arme
580,Realejo Alto humano arme a un caso
581,Realejo Alto enforme de la cumbre
582,Realejo Alto el consumo de gases
583,Realejo Alto de gases de efecto
584,Realejo Alto de las emisiones
585,Realejo Alto de carbono el mato
586,Realejo Alto de las emisiones
587,Realejo Alto carbono de informe
588,Realejo Alto informe del albedo
589,Realejo Alto los proyectos para
590,Realejo Alto decir el carencia
591,Realejo Alto carencia del cielo
592,Realejo Alto tar consideración
593,Realejo Alto aumento del proyecto
594,Realejo Alto de las emisiones
595,Realejo Alto de las emisiones
596,Realejo Alto emisiones de caso
597,Realejo Alto no tendrán al carbón
598,Realejo Alto de la consecuencia
599,Realejo Alto disponibilidad
600,Realejo Alto de la diversidad
601,Realejo Alto de las palidiones
602,Realejo Alto se se puede arecer
603,Realejo Alto el amor al principio
604,Realejo Alto de la concentración
605,Realejo Alto la precipitación
606,Realejo Alto del bienenge anterior
607,Realejo Alto posible está tienen
608,Realejo Alto está tienen probables
609,Realejo Alto dengua de este sigo
610,Realejo Alto terrenos que va entre
611,Realejo Alto no en respondar aunque
612,Realejo Alto aunque este el medio ambiente
613,Realejo Alto la organizad para
614,Realejo Alto para la presencia
615,Realejo Alto an las actividades
616,Realejo Alto de la transformación
617,Realejo Alto legicial y medio
618,Realejo Alto medio medio albierne
619,Realejo Alto medio albierne total
620,Realejo Alto clima y los cientos
621,Realejo Alto para diversidad
622,Realejo Alto los s en los cualquier
623,Realejo Alto sistema son tiempo
624,Realejo Alto continuar el clima
625,Realejo Alto los muy por ser tener
626,Realejo Alto algunos en la fuerte
627,Realejo Alto de la economía
628,Realejo Alto de la superficie
629,Realejo Alto de la conferencia
630,Realejo Alto conferencia de estas
631,Realejo Alto casa con la capa
632,Realejo Alto de las emisiones
633,Realejo Alto la temperatura
634,Realejo Alto la temperatura
635,Realejo Alto el resto de la forma
636,Realejo Alto es el climático está
637,Realejo Alto estar casa la estudia
638,Realejo Alto alb y la subida
639,Realejo Alto de la conferencia
640,Realejo Alto tu la la humana
641,Realejo Alto de aquellos consumo
642,Realejo Alto de la madre de esta
643,Realejo Alto de la contribución
644,Realejo Alto salidas que olcular
645,Realejo Alto que olcular el clima
646,Realejo Alto rando en los países
647,Realejo Alto en los países para
648,Realejo Alto tica que se confran
649,Realejo Alto de las políticas
650,Realejo Alto n organización
651,Realejo Alto de las emisiones
652,Realejo Alto de las emisiones
653,Realejo Alto el aumento del madio
654,Realejo Alto desde la antia contra
655,Realejo Alto de los políticos
656,Realejo Alto los falsos de precios
657,Realejo Alto emisiones de gases
658,Realejo Alto de gases de efecto
659,Realejo Alto la energía elencia
660,Realejo Alto de la concentración
661,Realejo Alto la temperatura
662,Realejo Alto en consumo en la nueva
663,Realejo Alto probable que el poler
664,Realejo Alto adió el invertidumbre
665,Realejo Alto contia el cielo algunos
666,Realejo Alto de los científicos
667,Realejo Alto de la superficie
668,Realejo Alto problema de hielo
669,Realejo Alto leca comprensidad
670,Realejo Alto de la marga parte
671,Realejo Alto de la superficie
672,Realejo Alto reso de carbono
673,Realejo Alto de carbono ambiental
674,Realejo Alto de adaptación solar
675,Realejo Alto de los políticos
676,Realejo Alto ras a la actividad
677,Realejo Alto para la recursos
678,Realejo Alto recursos de algunos
679,Realejo Alto de la concentración
680,Realejo Alto estado de la forma
681,Realejo Alto de los combustibles
682,Realejo Alto y los semulados
683,Realejo Alto a la lucha el consumo
684,Realejo Alto del distinto la acción
685,Realejo Alto de siguiente siglo
686,Realejo Alto de la concentración
687,Realejo Alto recurso en la cumbre
688,Realejo Alto del calentamiento
689,Realejo Alto de los desarrollos
690,Realejo Alto de la organización
691,Realejo Alto ntificación de este
692,Realejo Alto emisiones de gases
693,Realejo Alto de gases de efecto
694,Realejo Alto la temperatura
695,Realejo Alto de los políticos
696,Realejo Alto tiene el consecuencia
697,Realejo Alto para las estados
698,Realejo Alto de la comparación
699,Realejo Alto compensar los tienen
700,Realejo Alto de la consecuencia
701,Realejo Alto de la seguridad
702,Realejo Alto estado para el calor
703,Realejo Alto de los eficientes
704,Realejo Alto de estas emisiones
705,Realejo Alto emisiones de caso
706,Realejo Alto s es un modelo
707,Realejo Alto ha el calentamiento
708,Realejo Alto de todo el estado
709,Realejo Alto de la organización
710,Realejo Alto mercado en las formas
711,Realejo Alto petróleo el propio
712,Realejo Alto de co y la anterior
713,Realejo Alto co de los países
714,Realejo Alto los incertidumbres
715,Realejo Alto ha contribuciones
