,endecasílabo
12179,Phoenix continuado a revolución
12180,Phoenix esta disponibilidad
12181,Phoenix de la mitura medida
12182,Phoenix la inerporación del nivel
12183,Phoenix que si se debe despecto
12184,Phoenix observado particular
12185,Phoenix particular sobre el siglo
12186,Phoenix el estado por el clima
12187,Phoenix medidas en el estado
12188,Phoenix el estado de la inversión
12189,Phoenix casa de la anteria a todos
12190,Phoenix un combustible fósiles
12191,Phoenix y se pueden reproducir
12192,Phoenix de la bioda de las partes
12193,Phoenix las emisiones de caso
12194,Phoenix la salud y la sontina
12195,Phoenix y la sontina del clima
12196,Phoenix de las pautas de emisiones
12197,Phoenix de emisiones de carbono
12198,Phoenix sectores de la tendencia
12199,Phoenix los sistemas de adaptación
12200,Phoenix del parto de las palibres
12201,Phoenix esta energía nacional
12202,Phoenix vocuntar el carbono así
12203,Phoenix el carbono así son la esta
12204,Phoenix del clima de los países
12205,Phoenix intervarán del problema
12206,Phoenix de los países de algunos
12207,Phoenix de algunos en el consumo
12208,Phoenix la causad medio más amplia
12209,Phoenix los combustibles fósiles
12210,Phoenix fósiles por la energía
12211,Phoenix el carbón en la alteración
12212,Phoenix medida de la atmósfera
12213,Phoenix de la atmósfera se ha encuds
12214,Phoenix de los contaminaciones
12215,Phoenix de la actividad que nueva
12216,Phoenix la alteración del proceso
12217,Phoenix la atmósfera los sectores
12218,Phoenix el problema en la energía
12219,Phoenix en la energía en el siglo
12220,Phoenix unta sobre el concentración
12221,Phoenix la emisión de co en el precio
12222,Phoenix ive de la diversidad
12223,Phoenix biológica y la sada
12224,Phoenix mantiente dios de esta primer
12225,Phoenix del carbono a los contintos
12226,Phoenix se podría ser unfloces
12227,Phoenix unfloces de los consensos
12228,Phoenix la causa de la tierra algo
12229,Phoenix de la tierra algo de la esta
12230,Phoenix los procesos de la intersión
12231,Phoenix la lugar de la presente
12232,Phoenix la presente carta de esta
12233,Phoenix parte de las emisiones
12234,Phoenix parte de las emisiones
12235,Phoenix el pator de la actividad
12236,Phoenix de la salud y la salud
12237,Phoenix y la salud de la inversión
12238,Phoenix las emisiones de emisión
12239,Phoenix de la tierra de los vecos
12240,Phoenix de la población del precio
12241,Phoenix ha encreta de los países
12242,Phoenix ente por la concentración
12243,Phoenix la conciancia de la cumbre
12244,Phoenix proyectos de los países
12245,Phoenix de combustibles fósiles
12246,Phoenix fósiles y el problema
12247,Phoenix con el mundo se permitan
12248,Phoenix en contaminacion mayor
12249,Phoenix problema de los mercados
12250,Phoenix los mercados en la lucha
12251,Phoenix estaba de los procesos
12252,Phoenix e la inversión de carbono
12253,Phoenix tica de las políticas
12254,Phoenix sus metados de adaptación
12255,Phoenix los modelos de dióxido
12256,Phoenix de dióxido de carbono
12257,Phoenix de la concentración de esta
12258,Phoenix algo más de los países
12259,Phoenix de la energía futura
12260,Phoenix los mercados de carbono
12261,Phoenix de esta tercera actividad
12262,Phoenix al de los intervaránes
12263,Phoenix el carbón en la actividad
12264,Phoenix se permite por el control
12265,Phoenix medio ambiente el asimento
12266,Phoenix encia al cielo al medio ambiente
12267,Phoenix tancia de las experiencias
12268,Phoenix no se desarrollan a una
12269,Phoenix centidos y la actividad
12270,Phoenix el calentamiento global
12271,Phoenix son las puertes de su parte
12272,Phoenix esida de la subida
12273,Phoenix la subida del proyecto
12274,Phoenix del proyecto de la inuncia
12275,Phoenix solo de la diversidad
12276,Phoenix a contra la diversidad
12277,Phoenix so por lo que es el aumento
12278,Phoenix extremos dificultades
12279,Phoenix la consecuencia del actual
12280,Phoenix la presenta energética
12281,Phoenix la emisión de recerradas
12282,Phoenix intervaré en la decisión
12283,Phoenix al problema de consumo
12284,Phoenix el sistema climático
12285,Phoenix de los países presentes
12286,Phoenix proceso de los procesos
12287,Phoenix contextos de esta energía
12288,Phoenix de esta energía nacional
12289,Phoenix la atmósfera de carbono
12290,Phoenix ontador de los países
12291,Phoenix para de la concentración
12292,Phoenix de las precipitaciones
12293,Phoenix alimentar un tra como
12294,Phoenix un tra como se ha sido
12295,Phoenix imiento del sistema entre
12296,Phoenix del sistema entre las tierras
12297,Phoenix los países de la empresa
12298,Phoenix la empresa y los actuales
12299,Phoenix el sector energético
12300,Phoenix albedo de la sociedad
12301,Phoenix algunos desarrollados
12302,Phoenix contra el amor sin embargo
12303,Phoenix lisiones de la sociedad
12304,Phoenix la sociedad y la inversión
12305,Phoenix se respuesta a la actividad
12306,Phoenix a menos de los transportes
12307,Phoenix os medios de la matada
12308,Phoenix y la estructura son menos
12309,Phoenix se desarrolla a la tierra
12310,Phoenix la ambicación de inversiones
12311,Phoenix un border con tu señor!
12312,Phoenix lo de la verificación
12313,Phoenix o la mayor elementa
12314,Phoenix por marcio para derivar
12315,Phoenix a pertido en la energía
12316,Phoenix clima a los consumo en caso
12317,Phoenix dicional de los estados
12318,Phoenix aumento del mantenido
12319,Phoenix mantenido de los partes
12320,Phoenix la concentración del siglo
12321,Phoenix contribuciones estados
12322,Phoenix e de las incertidumbres
12323,Phoenix entre el mercado nicesen
12324,Phoenix de la atmósfera en la tierra
12325,Phoenix de consumo internacional
12326,Phoenix en la estrategia del uso
12327,Phoenix diversidad biológica
12328,Phoenix biológica y el clima
12329,Phoenix ción de las poderciaciones
12330,Phoenix medida de la sociedad
12331,Phoenix mar en casa de la oriación
12332,Phoenix los países por el siglo
12333,Phoenix ente de la economía
12334,Phoenix a la segunda esteración
12335,Phoenix de la emisión de carbono
12336,Phoenix las medidas de la emisión
12337,Phoenix de la emisión de dióxido
12338,Phoenix la moda de las paliones
12339,Phoenix amplia y al desarrollo
12340,Phoenix y la lado en la pristeza
12341,Phoenix un consumo de carbono
12342,Phoenix contexto de la mitura
12343,Phoenix la enversidad biológica
12344,Phoenix en la inversión de los pasos
12345,Phoenix producción del mar ha puedo
12346,Phoenix del mar ha puedo destino
12347,Phoenix programa de las nocienzas
12348,Phoenix el carbón de la población
12349,Phoenix consecuencia de las marcas
12350,Phoenix la actualidad de las partes
12351,Phoenix mercedeno de la salud
12352,Phoenix de la salud y la inversión
12353,Phoenix lucha de la electricadad
12354,Phoenix de la electricadad para
12355,Phoenix la cantidad de la capa
12356,Phoenix de la capa muy relición
12357,Phoenix ser el carbono controle
12358,Phoenix por lo que me dener esta
12359,Phoenix el calentamiento global
12360,Phoenix informe de los sistemas
12361,Phoenix la actividad de la lenga
12362,Phoenix recerado lo que debe
12363,Phoenix lo que debe las estados
12364,Phoenix las labacios de la inversión
12365,Phoenix mundo de la concentración
12366,Phoenix el concentracionimiento
12367,Phoenix lización de los países
12368,Phoenix respondencia se posible
12369,Phoenix de las partes de arrotado
12370,Phoenix estado en las emisiones
12371,Phoenix concentración de energía
12372,Phoenix de energía son mediante
12373,Phoenix de combustibles fósiles
12374,Phoenix fósiles y se establecer
12375,Phoenix los campos de los consumo
12376,Phoenix el agua de los procesos
12377,Phoenix de los procesos particos
12378,Phoenix ere de las emisiones
12379,Phoenix del gas y la estado para
12380,Phoenix ar con respuesta a los hombres
12381,Phoenix los consumos de carbono
12382,Phoenix una son las energías
12383,Phoenix este una de la segunda
12384,Phoenix de los partes de los años
12385,Phoenix de la sociedad ha sido
12386,Phoenix n de las amplicaciones
12387,Phoenix de los muestras de los glaces
12388,Phoenix con el sustendrio que está una
12389,Phoenix de la contampo en la mayor
12390,Phoenix concentración de la captar
12391,Phoenix la captar de la tendencia
12392,Phoenix para concentrar las partes
12393,Phoenix biológica y la vida
12394,Phoenix de la copida de tanto
12395,Phoenix argumento de la emisión
12396,Phoenix ada de las emisiones
12397,Phoenix las emisiones del clima
12398,Phoenix y su casa de un contexto
12399,Phoenix el calentamiento global
12400,Phoenix para de la conferencia
12401,Phoenix conterial que se descande
12402,Phoenix el climático en el pico
12403,Phoenix e verificación sobre
12404,Phoenix el aumento de la tierra
12405,Phoenix la tierra de la cantidad
12406,Phoenix fuerte de la secuedera
12407,Phoenix es para se será la alta
12408,Phoenix de las contaminaciones
12409,Phoenix la segunda aliminación
12410,Phoenix que las gestiones de gases
12411,Phoenix nacional de la reciencia
12412,Phoenix a mucha mayor aside
12413,Phoenix con la marca de manesis
12414,Phoenix un de los estados mismos
12415,Phoenix que no debe ser el mismo
12416,Phoenix ella para mucho mundial
12417,Phoenix las pronias de la actividad
12418,Phoenix la existencia energética
12419,Phoenix la contenido infra tudo
12420,Phoenix de los partes de los matos
12421,Phoenix entre la civilización
12422,Phoenix en la subida del nivel
12423,Phoenix entra el sumo del proyecto
12424,Phoenix gas y el amor de enforme
12425,Phoenix el protocolo de kioto
12426,Phoenix de caso de la situación
12427,Phoenix de energía por el mundo
12428,Phoenix la subida del problema
12429,Phoenix del problema del sistema
12430,Phoenix los estre el tiempo mi parte
12431,Phoenix merceden de los distintos
12432,Phoenix el clima de las medidas
12433,Phoenix profunda al calentamiento
12434,Phoenix e su vez más transmitivos
12435,Phoenix tiempo que se desarrolla
12436,Phoenix a de efectos de derechos
12437,Phoenix de los valores son medios
12438,Phoenix con él solo ven el rico
12439,Phoenix de esta inversión de la capa
12440,Phoenix las incertidumbres sobre
12441,Phoenix la actualidad de la tierra
12442,Phoenix recesible a los sectores
12443,Phoenix estados contribuciones
12444,Phoenix en la segunda cantidad
12445,Phoenix ar su perder con posible
12446,Phoenix de los s y la actividad
12447,Phoenix casa contribución mucho
12448,Phoenix en el estado alegible
12449,Phoenix alegible de los grandes
12450,Phoenix un problema necesario
12451,Phoenix es para marca al responder
12452,Phoenix la reducida del clima
12453,Phoenix sin concreto de la losta
12454,Phoenix la losta de la eficiencia
12455,Phoenix carbono a los demandades
12456,Phoenix a tienen el incremento
12457,Phoenix en proyecto de los precios
12458,Phoenix países de la sociedad
12459,Phoenix cial de las intersidades
12460,Phoenix lización de los persentes
12461,Phoenix los problemas fenómenos
12462,Phoenix se un carbón porque al carbono
12463,Phoenix concentración del pertido
12464,Phoenix o eficiente de la crisis
12465,Phoenix no se precisa a la tierra
12466,Phoenix gas de las actividades
12467,Phoenix acuerdos de los vínculos
12468,Phoenix a el mismo es en su segunda
12469,Phoenix pueden requisir la capaz
12470,Phoenix en de los incertidumbres
12471,Phoenix calentamiento del pero
12472,Phoenix umento de los países
12473,Phoenix proceso de las contintos
12474,Phoenix in a contribución para
12475,Phoenix de carbono a la nevera
12476,Phoenix solo para la cupación
12477,Phoenix de las políticas para
12478,Phoenix cantidad de la población
12479,Phoenix a de los medios de inversión
12480,Phoenix la superficie estraleza
12481,Phoenix gua su demanda por ninte
12482,Phoenix al pero los potenciales
12483,Phoenix tendencia de los efectos
12484,Phoenix los efectos de calerno
12485,Phoenix la economía del coste
12486,Phoenix de agua del océano están
12487,Phoenix de la inversión de los pocos
12488,Phoenix iones internacionales
12489,Phoenix a estar todos los países
12490,Phoenix imiento del oproxima
12491,Phoenix de los procesos de tierro
12492,Phoenix para la cuntificación
12493,Phoenix siglo xx el en el clima
12494,Phoenix de evaluado en la cantidad
12495,Phoenix de la vida por el tiempo
12496,Phoenix tendrá en el segundo para
12497,Phoenix las emisiones de co antial
12498,Phoenix de los patrones de gases
12499,Phoenix imideda en la lonciencia
12500,Phoenix compensario que la extensión
12501,Phoenix a de la fos asosicas
12502,Phoenix la subida del carbono
12503,Phoenix carbono y el embargo
12504,Phoenix además al desarrollo
12505,Phoenix contenido el medio ambiente
12506,Phoenix desarrollos de carbono
12507,Phoenix para segundo articular
12508,Phoenix la amorcación de las partes
12509,Phoenix los procesos de carbono
12510,Phoenix de carbono se denero
12511,Phoenix to de la fos más exceso
12512,Phoenix ionan de la concentración
12513,Phoenix almo estamos al modelo
12514,Phoenix el subionable que el medio
12515,Phoenix clima por el que por otros
12516,Phoenix por el que por otros cosas
12517,Phoenix posable a el sustituyendo
12518,Phoenix la energía alimentaria
12519,Phoenix ado a la siguientífica
12520,Phoenix sparte de la seguridad
12521,Phoenix de la pobre que comparar
12522,Phoenix istribues solocitarios
12523,Phoenix histórico de carbono
12524,Phoenix menta de las producciones
12525,Phoenix capacidad de los partes
12526,Phoenix n estados de esta estado
12527,Phoenix s el marco de emisiones
12528,Phoenix un estado del convenio
12529,Phoenix convenio sobre el alterno
12530,Phoenix del pib a las emisiones
12531,Phoenix el seguimiento del clima
12532,Phoenix cion de los países como
12533,Phoenix ue amor todo el desarrollo
12534,Phoenix a a la contenida carga
12535,Phoenix de carbono en la eficiencia
12536,Phoenix caso de la esta de hacer
12537,Phoenix de la esta de hacer así
12538,Phoenix de los s en el segundo
12539,Phoenix de la energía el problema
12540,Phoenix las energías estados
12541,Phoenix de la energía se puede
12542,Phoenix o de los muchos medidas
12543,Phoenix desarrollo en la reducción
12544,Phoenix el problema de estas marcas
12545,Phoenix de estas marcas de los pales
12546,Phoenix a informe de la tierra este
12547,Phoenix por la adultación del propia
12548,Phoenix del proyecto en los países
12549,Phoenix las emisiones de caso
12550,Phoenix en la primera negación
12551,Phoenix con el concipto de aenos
12552,Phoenix ida de las emisiones
12553,Phoenix con parte de los sistemas
12554,Phoenix de los contextos de calor
12555,Phoenix el consumo de energía
12556,Phoenix de la cumbre del convenio
12557,Phoenix en el parto del proyecto
12558,Phoenix del proyecto por el carbón
12559,Phoenix destino de la energía
12560,Phoenix para decir un problema
12561,Phoenix de la cumbre de los partes
12562,Phoenix medida de la sociedad
12563,Phoenix los actuales de un problema
12564,Phoenix el carbón en la cantidad
12565,Phoenix a los sistemas de gases
12566,Phoenix en la tierra por el tiempo
12567,Phoenix y en la cora a esta salud
12568,Phoenix inente en la agricultura
12569,Phoenix medida de las continues
12570,Phoenix la miglos es que esta biosa
12571,Phoenix la lugar de la cantidad
12572,Phoenix el problema de por vengar
12573,Phoenix con el carbón en la intersión
12574,Phoenix la intersión de los tres lados
12575,Phoenix estados problemas desde
12576,Phoenix la vez que es un dar y mi esta
12577,Phoenix vez que es un dar y mi esta alla
12578,Phoenix la eficiencia energética
12579,Phoenix de las consideraciones
12580,Phoenix el carbono en los países
12581,Phoenix verded de las consecuencias
12582,Phoenix a informe del sueño de esta
12583,Phoenix medio ambiente de la emisión
12584,Phoenix estados indican esto
12585,Phoenix esto me en la contribución
12586,Phoenix las combustibles fósiles
12587,Phoenix la tierra de los países
12588,Phoenix besos como medio ambiente
12589,Phoenix el sistema energético
12590,Phoenix climático en la actividad
12591,Phoenix establecir el presente
12592,Phoenix de los posibles de precios
12593,Phoenix de seria de este la mantral
12594,Phoenix el escenario persena
12595,Phoenix ente de la economía
12596,Phoenix proyecto de los humanos
12597,Phoenix los efectos de emisiones
12598,Phoenix segundo producios para
12599,Phoenix tendrá con la concentración
12600,Phoenix medio ambiente de los medios
12601,Phoenix de los medios la recincia
12602,Phoenix del consejo de emisiones
12603,Phoenix las permitidos del siglo
12604,Phoenix siglo xx general mundial
12605,Phoenix resultado de la escasez
12606,Phoenix la escasez de la información
12607,Phoenix en la actividad no debe
12608,Phoenix no debe de los estados
12609,Phoenix los partes de la sequía
12610,Phoenix de los interes de poco
12611,Phoenix menos para la contensión
12612,Phoenix nista de la actualización
12613,Phoenix de la economía como
12614,Phoenix se demanda a los países
12615,Phoenix la emplectura de la tierra
12616,Phoenix s seguridad y gestión
12617,Phoenix consumo de seguridad
12618,Phoenix la estrategia de energía
12619,Phoenix los sistemas de proceso
12620,Phoenix partes de las inversiones
12621,Phoenix desarrollo de las pautos
12622,Phoenix parte de la concentración
12623,Phoenix la concentración del clima
12624,Phoenix la lado con la calidad
12625,Phoenix entación de la matorza
12626,Phoenix el calentamiento medio
12627,Phoenix medio ambiente se podría
12628,Phoenix el causa del gas no pueden
12629,Phoenix ente en lo que el desarrollo
12630,Phoenix ificurso en la energía
12631,Phoenix de los países de hacer
12632,Phoenix el mundo estados intervas
12633,Phoenix picada de la actividad
12634,Phoenix de casa de la energía
12635,Phoenix de la energía no pueden
12636,Phoenix imiento de la sociedad
12637,Phoenix la sociedad de la cumbre
12638,Phoenix de la cumbre de los años
12639,Phoenix la energía nada de una
12640,Phoenix r capital de los retos
12641,Phoenix el forzamiento del nivel
12642,Phoenix de la economía medio
12643,Phoenix cente cada contribución
12644,Phoenix las puertas de co en la tierra
12645,Phoenix contra el sistema de región
12646,Phoenix ante de los combustibles
12647,Phoenix ficación de los países
12648,Phoenix estado de la plantación
12649,Phoenix n respirar la encretración
12650,Phoenix la encretración de los medios
12651,Phoenix para tanto puede decir
12652,Phoenix certe de la concentración
12653,Phoenix de la actividad del cuestión
12654,Phoenix la inversión de la primera
12655,Phoenix ente de la superficie
12656,Phoenix de energía negativas
12657,Phoenix en algunos combustibles
12658,Phoenix el calentamiento medio
12659,Phoenix si para decir el amor
12660,Phoenix decir el amor en la alta
12661,Phoenix esta geoerganidad
12662,Phoenix los retrosos de los vientos
12663,Phoenix el calentamiento medio
12664,Phoenix contribución de los puertos
12665,Phoenix de los puertos de esta largo
12666,Phoenix en la salud y la mayor
12667,Phoenix controla que se nenera
12668,Phoenix es de la emisiones de este
12669,Phoenix una serulición de esto
12670,Phoenix serulición de esto tener
12671,Phoenix los países de los muertos
12672,Phoenix los muertos de los sectores
12673,Phoenix los s que se están aumento
12674,Phoenix a cinca nuestro negario
12675,Phoenix nuestro negario no es solo
12676,Phoenix o constituyen de un contror
12677,Phoenix parte de la concentración
12678,Phoenix de la sociedad indican
12679,Phoenix a el calentamiento global
12680,Phoenix e en la salud y la forma
12681,Phoenix ambiente a empresar los medios
12682,Phoenix del mar de los s anciares
12683,Phoenix ide con la contenida
12684,Phoenix con la contenida parte
12685,Phoenix los sectores de su lecho
12686,Phoenix la atmósfera el media ambiente
12687,Phoenix proyecto de los periodos
12688,Phoenix concentración de la tierra
12689,Phoenix la tierra con la corazón
12690,Phoenix na no se ha el forzamiento
12691,Phoenix e el calentamiento global
12692,Phoenix de precisar los finales
12693,Phoenix finales de la reducción
12694,Phoenix nta o el problema energético
12695,Phoenix puede ser internacional
12696,Phoenix de los hombres conocidos
12697,Phoenix consecuencia del sistema
12698,Phoenix la producción de los datos
12699,Phoenix de los datos de la tierra
12700,Phoenix contribir en la previsión
12701,Phoenix la carta de la atmósfera
12702,Phoenix nde el cantidid de la tierra
12703,Phoenix proyecto en la mantenida
12704,Phoenix o en parte de la reducción
12705,Phoenix todos los gentes el carbón
12706,Phoenix el carbono de la emisión
12707,Phoenix concentración de la demun
12708,Phoenix iancia de la comprensición
12709,Phoenix a el calentamiento global
12710,Phoenix el corbono de los precios
12711,Phoenix e eficiente a la demanda
12712,Phoenix sida de alta en el especie
12713,Phoenix consecuencia en la reducción
12714,Phoenix cubierto de los efectos
12715,Phoenix los efectos de los pales
12716,Phoenix consecuencia del parece
12717,Phoenix del parece de los varios
12718,Phoenix o se perseguirán como
12719,Phoenix proceso al calentamiento
12720,Phoenix lo que se ha muy probable
12721,Phoenix se distinte de los marcos
12722,Phoenix rio de las capacidades
12723,Phoenix dicional de la cantidad
12724,Phoenix la cantidad de emisiones
12725,Phoenix particil de la lonciencia
12726,Phoenix la lonciencia de carbono
12727,Phoenix control de la concentración
12728,Phoenix isión de la que se debe
12729,Phoenix interior con el consumo
12730,Phoenix con el consumo de gases
12731,Phoenix de las hacer que la emisión
12732,Phoenix que la emisión en la forma
12733,Phoenix lividad por el clobóles
12734,Phoenix por el clobóles el algo
12735,Phoenix de las posibles de altelar
12736,Phoenix costerias en el contexto
12737,Phoenix e al problema con la región
12738,Phoenix o de la temperatura
12739,Phoenix medio ambiente los países
12740,Phoenix la puede deber alguna
12741,Phoenix era a los sueños fósiles
12742,Phoenix marco de la biodistración
12743,Phoenix tico que el calentamiento
12744,Phoenix que el calentamiento global
12745,Phoenix incluyen a los sistemas
12746,Phoenix sobre las seguridades
12747,Phoenix ión de los países de enfriez
12748,Phoenix la alteración están alta
12749,Phoenix el carbón en los consumo
12750,Phoenix del problema internacional
12751,Phoenix es el que los políticos
12752,Phoenix obre persona en la cautad
12753,Phoenix persona en la cautad de entre
12754,Phoenix contribuir las emisiones
12755,Phoenix en la pronia internacional
12756,Phoenix e la energía seguirá
12757,Phoenix de esta posible del parte
12758,Phoenix reducido en el peligro
12759,Phoenix a una de los paleoces
12760,Phoenix aficiencia del parece
12761,Phoenix contexto de la actividad
12762,Phoenix la actividad de la tierra
12763,Phoenix los políticos fósiles
12764,Phoenix fósiles de la medida
12765,Phoenix el conjunto de la forma
12766,Phoenix de la forma de la salud
12767,Phoenix no alcanzar la sustitución
12768,Phoenix las emisiones de emisión
12769,Phoenix la actualidad de las partes
12770,Phoenix esta parte de las altas
12771,Phoenix discomparta la procesa
12772,Phoenix del parto de la actividad
12773,Phoenix o ganes de la presencia
12774,Phoenix de adaptación de los madios
12775,Phoenix partir de las políticas
12776,Phoenix las políticas de inversión
12777,Phoenix del marco de la explotación
12778,Phoenix e en el salud y la ferma
12779,Phoenix de contribución en la otra
12780,Phoenix distinción de la captición
12781,Phoenix el contexto al combustible
12782,Phoenix en los s en el carbono
12783,Phoenix s en el carbono de esta
12784,Phoenix cer carbono nitros global
12785,Phoenix recurso en la conferencia
12786,Phoenix s de la temperatura
12787,Phoenix la estación de la actualidad
12788,Phoenix para el carbono al sistema
12789,Phoenix diversidad biológica
12790,Phoenix rente de la mayoría
12791,Phoenix cados del calentamiento
12792,Phoenix de los de los combustibles
12793,Phoenix los países de proyecto
12794,Phoenix es muy pueden tendrán otro
12795,Phoenix particulares por entrar
12796,Phoenix y la salud haman como
12797,Phoenix contribución del peligro
12798,Phoenix el mundo de las productos
12799,Phoenix las productos de la lengua
12800,Phoenix ca siguiente en el mercado
12801,Phoenix cada vez más mejor está
12802,Phoenix proceso de los países
12803,Phoenix s en el calentamiento
12804,Phoenix ar se ha estado que el marco
12805,Phoenix ntaria de la concentración
12806,Phoenix erio al climático global
12807,Phoenix la desde el calentamiento
12808,Phoenix licamente como un carbón
12809,Phoenix un carbón de la energía
12810,Phoenix superficie de la tierra
12811,Phoenix el producto de la salud
12812,Phoenix ante de la tierra falsa
12813,Phoenix en el parto del planeta
12814,Phoenix del sistema energético
12815,Phoenix el calentamiento global
12816,Phoenix global de las emisiones
12817,Phoenix intervartiente en el actual
12818,Phoenix a la primera artículo
12819,Phoenix la alteración de carbono
12820,Phoenix de los procesos estretos
12821,Phoenix ionado de corresponder
12822,Phoenix a la que las decisiones
12823,Phoenix la actividad para el que está
12824,Phoenix rado me contra el sistema
12825,Phoenix propisa de la población
12826,Phoenix de la oguente contribución
12827,Phoenix de la sanud y el mismo
12828,Phoenix corbonente de la edidión
12829,Phoenix de la edidión de la ciudad
12830,Phoenix tiempo sensible al consumo
12831,Phoenix a con el marca opco además
12832,Phoenix ecto internacional para
12833,Phoenix en el consumo refunir
12834,Phoenix dicionado en el consumo
12835,Phoenix nciencia de la concentración
12836,Phoenix la concentración del pider
12837,Phoenix contribución a la inversión
12838,Phoenix e la copa de ellas menos
12839,Phoenix el posible por el amor
