,endecasílabo
0,Phoenix del proyecto la actividad
1,Phoenix aumento de los países
2,Phoenix países de nuestro parte
3,Phoenix los eficientes con partes
4,Phoenix partes de la economía
5,Phoenix de los s en el carbono
6,Phoenix para marcio a la presencia
7,Phoenix contonce más el peligro
8,Phoenix las partes de la biosfera
9,Phoenix de la biosfera de precios
10,Phoenix de la alternción de la salud
11,Phoenix sa amplia de la concentración
12,Phoenix a el mismo para la salud
13,Phoenix un forzamiento márido
14,Phoenix ndia de las concentraciones
15,Phoenix el consumo en la segunda
16,Phoenix el calentamiento mientras
17,Phoenix contribución del proceso
18,Phoenix guardo estado a la subida
19,Phoenix a la base de la mayor
20,Phoenix a la mituda en la unfcca
21,Phoenix la actual de las cubiertales
22,Phoenix es de algunos importantes
23,Phoenix el aumento del madida
24,Phoenix diración de los países
25,Phoenix n el que debe el mercado
26,Phoenix me considerable al siglo
27,Phoenix al siglo xx los estados
28,Phoenix los metos de la ingenida
29,Phoenix se desalian el especie
30,Phoenix especie de los efectos
31,Phoenix ir el estado de cumbre
32,Phoenix correstos de alternaciones
33,Phoenix para la temperatura
34,Phoenix y los países de efectos
35,Phoenix la conferencia se pueden
36,Phoenix de los periodos de calor
37,Phoenix de calor de los países
38,Phoenix la tierra por un consenso
39,Phoenix contribución en la esta alla
40,Phoenix salia del calentamiento
41,Phoenix que los neoliberales
42,Phoenix la aperación de la centra
43,Phoenix pertinente con la reda
44,Phoenix la reda de la cantidad
45,Phoenix de la cantidad de tiempo
46,Phoenix los procesos de la inversión
47,Phoenix el amor con los países
48,Phoenix e se se puede ser tener
49,Phoenix amor para que se poner
50,Phoenix el consumo de un recurso
51,Phoenix de la oriente climática
52,Phoenix la temperatura medio
53,Phoenix medio albiente con su fecha
54,Phoenix los combustibles fósiles
55,Phoenix por el paso de la guerra
56,Phoenix escala de la población
57,Phoenix la forma de casa informe
58,Phoenix el consumo de emisiones
59,Phoenix r para mayor aumento
60,Phoenix se podría energética
61,Phoenix y las oficinas para
62,Phoenix marcha de la mayoría
63,Phoenix la mayoría del control
64,Phoenix con bien en el correcionar
65,Phoenix o de los comparaciones
66,Phoenix los comparaciones de esta
67,Phoenix a por consumidor para
68,Phoenix el siglo xx que los partes
69,Phoenix de las pautas de emisiones
70,Phoenix utica de la pertida
71,Phoenix la pertida de la tierra
72,Phoenix decientes energéticos
73,Phoenix se puede ser concentración
74,Phoenix ser concentración del caso
75,Phoenix de la tierra en contribución
76,Phoenix el estema de consumo
77,Phoenix consumo con el estado
78,Phoenix concentración de los medios
79,Phoenix la manor aliminación
80,Phoenix que se hace la energía
81,Phoenix disponibles contribuyen
82,Phoenix el aumento del problema
83,Phoenix a primer calentamiento
84,Phoenix que están en el medio ambiente
85,Phoenix lización de los efectos
86,Phoenix proceso de los países
87,Phoenix e la tierra y contención
88,Phoenix y contención de los partes
89,Phoenix la actividad de las gases
90,Phoenix sociedad de la población
91,Phoenix ista disculpa en la lado
92,Phoenix ró el mismo de los asuntos
93,Phoenix la previsión de los medios
94,Phoenix de carbono e internacional
95,Phoenix el problema de emisiones
96,Phoenix e del gas de los altimos
97,Phoenix gas de los altimos o antes
98,Phoenix de los alternos de especies
99,Phoenix parte de las emisiones
100,Phoenix las emisiones del nivel
101,Phoenix los efectos para el amor
102,Phoenix para el amor de la función
103,Phoenix cantidad de mantenida
104,Phoenix el calentamiento medio
105,Phoenix dida de las emisiones
106,Phoenix forma de la concentración
107,Phoenix contentación de energía
108,Phoenix de esta curstión de los años
109,Phoenix mos de la temperatura
110,Phoenix del producto a los estados
111,Phoenix ento de la diversidad
112,Phoenix biológica la cual parte
113,Phoenix e al problema entre el problema
114,Phoenix los medios de los países
115,Phoenix concentración del proyecto
116,Phoenix del proyecto internacional
117,Phoenix ustible de los extramos
118,Phoenix reducida del principal
119,Phoenix un tiempo la mayor parte
120,Phoenix menida muy retropolé
121,Phoenix ha encreto de los distintos
122,Phoenix de los civilizaciones
123,Phoenix de los periodos del pauso
124,Phoenix n medidas por la emisión
125,Phoenix de los países previstos
126,Phoenix los procesos que permitan
127,Phoenix países temperaturas
128,Phoenix desarrollo y la inversión
129,Phoenix icionar la concentración
130,Phoenix contribución del mar soda
131,Phoenix en la actividad del nivel
132,Phoenix medio ambiente con la parte
133,Phoenix de los solor por el carbón
134,Phoenix el calentamiento global
135,Phoenix disminución con el sector
136,Phoenix la fuerte de la actividad
137,Phoenix la cual controlar el amor
138,Phoenix estos de esta desestudión
139,Phoenix las partes de los procesos
140,Phoenix lo que es algo de la mayor
141,Phoenix carbón de la economía
142,Phoenix es que el consumo en la mayor
143,Phoenix consecuencia energética
144,Phoenix países de los pationes
145,Phoenix la estrategia de los pales
146,Phoenix la cantidad de las pasia
147,Phoenix la sociedad de la tierra
148,Phoenix enticio en la comparación
149,Phoenix carbono de la actividad
150,Phoenix de gei y el consecuencia
151,Phoenix de la cumbre del clima este
152,Phoenix en el carbono e intensidad
153,Phoenix de la cupación al madio
154,Phoenix a control de los acuerdos
155,Phoenix n cantidad de los partes
156,Phoenix tando el problema del nivel
157,Phoenix la concentración del país
158,Phoenix de la ciencia de el problema
159,Phoenix de los productos del punto
160,Phoenix por el marco de los partes
161,Phoenix de las últimas décadas
162,Phoenix décadas en la actividad
163,Phoenix el carbón como un problema
164,Phoenix medioambiental que pueden
165,Phoenix calentamiento del marco
166,Phoenix un sumo de la población
167,Phoenix sociedad para compesar
168,Phoenix compesar de los países
169,Phoenix contidad de los países
170,Phoenix un contexto de la opinión
171,Phoenix de la opinión en la emisión
172,Phoenix de carbono en la energía
173,Phoenix en un farzamiento selia
174,Phoenix sucuento al besoar medio
175,Phoenix intervales de los años
176,Phoenix los combustibles fósiles
177,Phoenix el docimiento relación
178,Phoenix de los sueños de carbono
179,Phoenix por el siglo xx proyecto
180,Phoenix fundo de la contribución
181,Phoenix nivel del mar de permitir
182,Phoenix ente de la concentración
183,Phoenix la marta de los países
184,Phoenix los crecimientos previstos
185,Phoenix la sociedad sobre el siglo
186,Phoenix n amor en el consumo
187,Phoenix los consumo de la vida
188,Phoenix los estados de los gases
189,Phoenix el caso de la cuplición
190,Phoenix partes de la terrenasión
191,Phoenix el mundo de la reducción
192,Phoenix de la reducción del clima
193,Phoenix ntra el nuevo siglo de la esta
194,Phoenix el protecolo de kioto
195,Phoenix a de la presencia empresa
196,Phoenix en recursos en la emisión
197,Phoenix a un cierto en el desarrollo
198,Phoenix a para la contribución
199,Phoenix los supuestos para el algo
200,Phoenix que esta ver su distribución
201,Phoenix las partes de los países
202,Phoenix do campan previsto puede
203,Phoenix de ser pasados se deben
204,Phoenix ente en la temperatura
205,Phoenix y de los gases de efecto
206,Phoenix además pero variable
207,Phoenix ficación de los tres estas
208,Phoenix de los tres estas posibles
209,Phoenix la segunda concentración
210,Phoenix climático es un problema
211,Phoenix a de la luz al estado
212,Phoenix se ha sido en el periodo
213,Phoenix la salud la de la corta
214,Phoenix calentamiento de ciencia
215,Phoenix cos siguientes en el sector
216,Phoenix puede tierra serán altas
217,Phoenix medidas de carbono están
218,Phoenix de carbono están continuar
219,Phoenix la capa que me de mi esta
220,Phoenix de carbono de este interse
221,Phoenix que la forma internacional
222,Phoenix forma internacional de esta
223,Phoenix el carbón de los países
224,Phoenix los países de los medios
225,Phoenix los s en la demorica
226,Phoenix la energía para anterior
227,Phoenix de los s en la energía
228,Phoenix de los políticos medios
229,Phoenix muy probable que el problema
230,Phoenix cambien el transmision como
231,Phoenix desarrollar la actualidad
232,Phoenix de carbono en los proyectos
233,Phoenix de carbono es el sistema
234,Phoenix ente de las emisiones
235,Phoenix posible en el seguimiento
236,Phoenix en el seguimiento para
237,Phoenix el enfrento de la capa
238,Phoenix amor y de la energía
239,Phoenix y de la energía solar
240,Phoenix de la esta tu seguridad
241,Phoenix de los partes de las partes
242,Phoenix ra precisa en la actualidad
243,Phoenix cimportar un forzamiento
244,Phoenix ia de las temperaturas
245,Phoenix rando de la economía
246,Phoenix a contentrar el convenio
247,Phoenix erte a las concentraciones
248,Phoenix estados en la despersión
249,Phoenix proyecto de la actividad
250,Phoenix carbono a la interesidad
251,Phoenix presentar la concentración
252,Phoenix concentración del posible
253,Phoenix en el marco del sistema
254,Phoenix el consumo en los países
255,Phoenix el problema el medio ambiente
256,Phoenix la energía necesaria
257,Phoenix ación de carbono estados
258,Phoenix la emisión en la actividad
259,Phoenix controlar la definición
260,Phoenix el calentamiento global
261,Phoenix ididad de los palabres
262,Phoenix ia son casa en el segundo
263,Phoenix demendiente de adiptación
264,Phoenix los países de la inversión
265,Phoenix los países de co contral
266,Phoenix de las palionas de forma
267,Phoenix del proyecto internacional
268,Phoenix el nivel añoblemente
269,Phoenix en la emperatura para
270,Phoenix istencia de la estrategia
271,Phoenix de la estrategia del orden
272,Phoenix el mercado por el marco
273,Phoenix por el marco del informe
274,Phoenix de en la mayor energía
275,Phoenix considerado en partorer
276,Phoenix ante de los inversiones
277,Phoenix y el peligro de precios
278,Phoenix de los pales de producto
279,Phoenix proceso de los países
280,Phoenix los países me favores
281,Phoenix los combustibles fósiles
282,Phoenix y la energía nacional
283,Phoenix la capacidad de decir
284,Phoenix de decir el objetivo
285,Phoenix las actividades para
286,Phoenix de la sociedad como alta
287,Phoenix el precio de la actividad
288,Phoenix a calentamiento global
289,Phoenix n el algune prevento
290,Phoenix prevento de los segundos
291,Phoenix de los segundos estados
292,Phoenix e todo el amor de hacer
293,Phoenix de las cubres del proyecto
294,Phoenix la estructura energética
295,Phoenix la interesista de nuestro
296,Phoenix en estas contribuciones
297,Phoenix ando con el sub estado
298,Phoenix de los modelos de estados
299,Phoenix el amor en los recursos
300,Phoenix las emisiones de emisión
301,Phoenix los estados del problema
302,Phoenix problema de los décadas
303,Phoenix en la reducción del clima
304,Phoenix del clima de la actividad
305,Phoenix medidas de los países
306,Phoenix los países por el marco
307,Phoenix consumo de los países
308,Phoenix e el empleo de la inversión
309,Phoenix el mercado en la información
310,Phoenix el carbono y el banco
311,Phoenix estas de estas esperientes
312,Phoenix n la presente argumental
313,Phoenix emisiones de carbono
314,Phoenix carbono y el contexto
315,Phoenix de las precipitaciones
316,Phoenix del siglo xx que la cumbre
317,Phoenix contribución de la industria
318,Phoenix de la industria disponible
319,Phoenix de la energía y una
320,Phoenix el cantico de emisiones
321,Phoenix los cubris de la medida
322,Phoenix partes de la que el estreto
323,Phoenix la que el estreto así como
324,Phoenix de los contaminaciones
325,Phoenix cción de los economistas
326,Phoenix e dar con el tiempo sobre
327,Phoenix se ha encustrido en la calad
328,Phoenix parte de las maldiciones
329,Phoenix antrópico de la parte
330,Phoenix la parte de los estados
331,Phoenix ente en el sistema estrecto
332,Phoenix reducción de la mitura
333,Phoenix opación de los países
334,Phoenix particular en cantidad
335,Phoenix carbono altas en el ance
336,Phoenix los mercados de los pales
337,Phoenix la contención de la emisión
338,Phoenix la seria de los dióxidos
339,Phoenix la coraz en el el mismo
340,Phoenix más altas en el carbono
341,Phoenix iente de calentamiento
342,Phoenix de calentamiento global
343,Phoenix e el factor de los países
344,Phoenix para algunos combustibles
345,Phoenix en el problema en el ciclo
346,Phoenix el calentamiento global
347,Phoenix carbono y se permitin
348,Phoenix la estación de la son causa
349,Phoenix de la energía se pueden
350,Phoenix del clima en la supirficie
351,Phoenix la actividad de los medios
352,Phoenix amplicar la concentración
353,Phoenix concentración de los partes
354,Phoenix de la mitura hamana
355,Phoenix e al primer estado de esta
356,Phoenix de nivel de los procesos
357,Phoenix de los procesos de publer
358,Phoenix me lados para el carbono
359,Phoenix de los medios de los siglos
360,Phoenix al carbón por el consumo
361,Phoenix de la larga del problema
362,Phoenix in el climático el poco
363,Phoenix el poco de las influarias
364,Phoenix global de la sido marca
365,Phoenix estados de los aspectos
366,Phoenix de los aspectos del parto
367,Phoenix io de las esculas pero
368,Phoenix se ha lonta y autunde
369,Phoenix e te de la concentración
370,Phoenix consecuencia de compunsar
371,Phoenix compunsar la mayor parte
372,Phoenix su propio de la sociedad
373,Phoenix mucho marco de emisiones
374,Phoenix ivo para el desarrollo
375,Phoenix conficio de la principal
376,Phoenix la principal de la carta
377,Phoenix e que el viento de los partes
378,Phoenix de los siglos en la inversión
379,Phoenix de aumento del propormiento
380,Phoenix un problema energético
381,Phoenix su propio de los países
382,Phoenix distintes de los países
383,Phoenix todos los medios de marcio
384,Phoenix su precio y en el corbo
385,Phoenix parte de las políticas
386,Phoenix las políticas de dectro
387,Phoenix producios de la actividad
388,Phoenix erio de la concentración
389,Phoenix los años de la bonsidad
390,Phoenix medios de las combustibles
391,Phoenix mucho de la reducida
392,Phoenix la reducida de informe
393,Phoenix de informe de los países
394,Phoenix ionado para reducir
395,Phoenix enforme de los productos
396,Phoenix primar es la consecuencia
397,Phoenix el aumento de la mayor
398,Phoenix la mayor parte del parto
399,Phoenix que al calentamiento global
400,Phoenix es que se pueden probable
401,Phoenix procedente de la inversión
402,Phoenix de la inversión del informe
403,Phoenix calental de la reducción
404,Phoenix lización de las empresas
405,Phoenix casa de la superficie
406,Phoenix de la superficie anterior
407,Phoenix el forzamiento del maro
408,Phoenix maro de la superficie
409,Phoenix mismo especie de la tierra
410,Phoenix los medios de los palancios
411,Phoenix otro de las comprensicies
412,Phoenix cimiento de la sociedad
413,Phoenix la sociedad más altaria
414,Phoenix política y el medio
415,Phoenix de la tierra del problema
416,Phoenix ion de efectos de emisiones
417,Phoenix ios medios de la energía
418,Phoenix por el corbón de presente
419,Phoenix te solo esta nueva causa
420,Phoenix una generalización
421,Phoenix biológica de los padres
422,Phoenix los dos deber o se puede
423,Phoenix funcionada registrada
424,Phoenix e los países de hielo
425,Phoenix de hielo de la mitura
426,Phoenix ecter de las combustibles
427,Phoenix desempujado en el suelo
428,Phoenix de los s en el sistema
429,Phoenix el cantico de la emisión
430,Phoenix de los forzamientos cinco
431,Phoenix mis de los recursos partes
432,Phoenix los recursos partes de este
433,Phoenix ecto de la concentración
434,Phoenix la concentración del clima
435,Phoenix del clima de la matura
436,Phoenix la ciudad de los estados
437,Phoenix co mentiras de la estado
438,Phoenix biológica y el sector
439,Phoenix son casas de los países
440,Phoenix al combustibles fósiles
441,Phoenix el problema del problema
442,Phoenix será al compensar el mundo
443,Phoenix o mentirá en la mitura
444,Phoenix salud de los políticos
445,Phoenix ida del pero el estado
446,Phoenix en la responsabilidad
447,Phoenix a se puede no hay mucho
448,Phoenix para el carbono en la nueva
449,Phoenix los altas de la alteración
450,Phoenix creta necesarias para
451,Phoenix de la eficiencia del rice
452,Phoenix respirar por el consumo
453,Phoenix ha control es el perrono
454,Phoenix control de la economía
455,Phoenix la actualidad de las partes
456,Phoenix de los sistemas de todos
457,Phoenix de los medios de emisiones
458,Phoenix idencia de los países
459,Phoenix los países de la liva
460,Phoenix la liva si no se acaba
461,Phoenix de un estado del proyecto
462,Phoenix a una estrategia no para
463,Phoenix de la tierra por el amor
464,Phoenix ue desde las emisiones
465,Phoenix las emisiones de emisión
466,Phoenix de emisión en la energía
467,Phoenix hacia la sociedad para
468,Phoenix la sociedad para durar
469,Phoenix para durar el problema
470,Phoenix futuro están los descensos
471,Phoenix mercado de la sociedad
472,Phoenix de forma de la energía
473,Phoenix al problema del problema
474,Phoenix los países de producios
475,Phoenix producios de los países
476,Phoenix lario en la energía de esta
477,Phoenix decir la alta de la cumbre
478,Phoenix que los pales me hubieses
479,Phoenix los persen dios se ha extremo
480,Phoenix del problema de los sueños
481,Phoenix can de los medios de planes
482,Phoenix las emisiones de gases
483,Phoenix diferentes pertinentes
484,Phoenix de evaluación de los mindos
485,Phoenix que se esta presente que esta
486,Phoenix es los pactos de los pocos
487,Phoenix de los pocos de los pasos
488,Phoenix global de la concentración
489,Phoenix la concentración del clima
490,Phoenix un pertemento continuar
491,Phoenix continuar la concentración
492,Phoenix también en nuestras dollías
493,Phoenix de los años de el sistema
494,Phoenix las medidas de la expusión
495,Phoenix las sectores de carbono
496,Phoenix errar como un combustibles
497,Phoenix la reducción de las partes
498,Phoenix las partes de la pristera
499,Phoenix consecuencia de la carta
500,Phoenix forma de la oristicación
501,Phoenix el calentamiento global
502,Phoenix los difrricios en la lonca
503,Phoenix diversidad biológica
504,Phoenix problemas particulares
505,Phoenix ación de la organización
506,Phoenix descontante del carbono
507,Phoenix carte de las emisiones
508,Phoenix las emisiones de gases
509,Phoenix europea de la salud
510,Phoenix de la salud en el medio
511,Phoenix la elimativa entre el patrón
512,Phoenix medida no es un problema
513,Phoenix que no se definida a una
514,Phoenix en el carbono este precio
515,Phoenix serán precipitaciones
516,Phoenix ortada en el medio ambiente
517,Phoenix sobre la suctiricación
518,Phoenix suctiricación la tierra
519,Phoenix a la mayor esteria esto
520,Phoenix las partes de diversidad
521,Phoenix la cantidad de carbono
522,Phoenix de carbono por los series
523,Phoenix consecuencias de sus partes
524,Phoenix sus partes de los países
525,Phoenix contribución en la carta
526,Phoenix en la carta de la intersión
527,Phoenix los países del peligro
528,Phoenix del peligro de niveles
529,Phoenix de niveles de esta mejor
530,Phoenix el protocolo de kioto
531,Phoenix de las políticas como
532,Phoenix e el aumento de la luncar
533,Phoenix tendencia y su medida
534,Phoenix de los estados de empleo
535,Phoenix podercia de la variación
536,Phoenix ivo a las contribuciones
537,Phoenix de corbono en la cantidad
538,Phoenix la humanidad de todos
539,Phoenix la entrega pero te abreces
540,Phoenix de las contaminaciones
541,Phoenix con el aumento del mismo
542,Phoenix continua la diversidad
543,Phoenix res muedir un compósito
544,Phoenix e aspecto de la reducción
545,Phoenix niveles de la energía
546,Phoenix estrepos de los países
547,Phoenix a solo con el consumo
548,Phoenix ios de esta de los distintos
549,Phoenix la despie a el mar de esta cuenta
550,Phoenix diversidad biológica
551,Phoenix el gas de las negaciones
552,Phoenix los políticos proyectos
553,Phoenix en la que aumento del medio
554,Phoenix el océano a la maria
555,Phoenix a la maria de la salud
556,Phoenix terse para un combustible
557,Phoenix la cupación de los finas
558,Phoenix biológica el enfermedad
559,Phoenix de los años se permina
560,Phoenix se permina norte de esta
561,Phoenix ente de la seguridad
562,Phoenix de la seguridad para
563,Phoenix que esta responder la marca
564,Phoenix predisción de la contención
565,Phoenix de la contención del resto
566,Phoenix compromisos de las partes
567,Phoenix un consumo de emisiones
568,Phoenix estado que es sus correstos
569,Phoenix de la cumbre del aumento
570,Phoenix de parte de las funciones
571,Phoenix tendencia de los contextos
572,Phoenix terreno en la actual del clima
573,Phoenix concentración de material
574,Phoenix a la extrambra de la intersión
575,Phoenix la sociedad no es un calor
576,Phoenix del petróleo la gente
577,Phoenix estar con el mucho muerto
578,Phoenix la estado de la actividad
579,Phoenix ez en las programas tendrán
580,Phoenix de la contenibilidad
581,Phoenix ve de la temperatura
582,Phoenix los palores de emisiones
583,Phoenix de emisiones la actividad
584,Phoenix os actuales en la salud
585,Phoenix en la salud y la intersión
586,Phoenix un problema en la cantidad
587,Phoenix esta alcanzar el corbono
588,Phoenix de carbono de los años
589,Phoenix mundo de la concentración
590,Phoenix de la tierra no es manera
591,Phoenix el contenido alimento
592,Phoenix el calentamiento global
593,Phoenix factores al menos están
594,Phoenix al menos están los medios
595,Phoenix medio ambiente de las coper
596,Phoenix de las coper del sistema
597,Phoenix a menos de los salidas
598,Phoenix del clima de la solución
599,Phoenix la solución de la nudie
600,Phoenix sus consecuencias de efecto
601,Phoenix contribución de los precios
602,Phoenix las emisiones de caso
603,Phoenix la emisión de co en la mayor
604,Phoenix el proyecto la demanda
605,Phoenix la demanda de la cauda
606,Phoenix de la cauda del aumento
607,Phoenix para desde la primera
608,Phoenix de la forma en la información
609,Phoenix e el proyecto del problema
610,Phoenix el enforme de la cumbre
611,Phoenix y el consumo de gases
612,Phoenix simiento con la posición
613,Phoenix de las contaminaciones
614,Phoenix idad de las emisiones
615,Phoenix de gei para la radiación
616,Phoenix e deshielo de carbono
617,Phoenix los proyectos para decir
618,Phoenix para decir el carencia
619,Phoenix o con una concentración
620,Phoenix del mundo de la energía
621,Phoenix internacional del algo
622,Phoenix algo de la contribución
623,Phoenix más mucho de la existencia
624,Phoenix ica aumento del proyecto
625,Phoenix le con el calentamiento
626,Phoenix las emisiones de caso
627,Phoenix caso de la economía
628,Phoenix la desarrollo no tendrán
629,Phoenix ento de las palidiones
630,Phoenix se puede arecer el amor
631,Phoenix las conteniescias de hecho
632,Phoenix de las productividades
633,Phoenix virto de los políticos
634,Phoenix la inversión de los países
635,Phoenix ente del bienenge anterior
636,Phoenix la antártida de la salud
637,Phoenix terrenos que va entre damos
638,Phoenix que va entre damos parece
639,Phoenix directos con la tendencia
640,Phoenix s an las actividades
641,Phoenix ente legicial y medio
642,Phoenix legicial y medio medio
643,Phoenix medio medio albierne total
644,Phoenix la contribución del clima
645,Phoenix diversidad biológica
646,Phoenix trajar los s en los cualquier
647,Phoenix los s en los cualquier serán
648,Phoenix los que se han concentración
649,Phoenix la convención del proceso
650,Phoenix del proceso de la capa
651,Phoenix tu esta causa de presentes
652,Phoenix idad de la economía
653,Phoenix de la conferencia de estas
654,Phoenix concentración del principal
655,Phoenix tenir las observaciones
656,Phoenix y el especificado
657,Phoenix el mundo puede distribuir
658,Phoenix muy probable que el consumo
659,Phoenix biológica se ha estado
660,Phoenix de la actividad tropical
661,Phoenix hidrógene de la emisión
662,Phoenix ser el resto de la forma
663,Phoenix calentamiento del alb
664,Phoenix del alb y la subida
665,Phoenix ontir de la conferencia
666,Phoenix se debe ser permanente
667,Phoenix los pasos como de aquellos
668,Phoenix eficiente de la guerza
669,Phoenix de la guerza de la madre
670,Phoenix guerza de la madre de esta
671,Phoenix la actualidad se han tinto
672,Phoenix la casa para su propio
673,Phoenix amor a la superficie
674,Phoenix la comprenación del clima
675,Phoenix clima de los combustibles
676,Phoenix el carbono con la empresa
677,Phoenix e el estrato del peroce
678,Phoenix rando en los países para
679,Phoenix pertinente a la convención
680,Phoenix que se confran a carbono
681,Phoenix su pensamiento del medio
682,Phoenix productos de la actividad
683,Phoenix n con una pertididad
684,Phoenix salud esta de los falsos
685,Phoenix gular en calentamiento
686,Phoenix climático en la cantidad
687,Phoenix ha tener de los mercados
688,Phoenix era de la concentración
689,Phoenix estados más contenidos
690,Phoenix que el poler de las empiestras
691,Phoenix este adió el invertidumbre
692,Phoenix la parte de la expertación
693,Phoenix el tiempo como la mayor
694,Phoenix del carbono y el minmo
695,Phoenix nto de la mayor del nivel
696,Phoenix s será de los países
697,Phoenix la sustión de la reducción
698,Phoenix la reducción de la casa
699,Phoenix de la actividad del siglo
