,endecasílabo
6127,Phoenix las emisiones de gases
6128,Phoenix aumento de los sectores
6129,Phoenix en la responsabilidad
6130,Phoenix de los estados de alanca
6131,Phoenix de las precipitaciones
6132,Phoenix ente de la contribución
6133,Phoenix alta capitalización
6134,Phoenix la marca de los efectos
6135,Phoenix una de los continentes
6136,Phoenix concentración del sistema
6137,Phoenix del sistema climático
6138,Phoenix la concentración del poser
6139,Phoenix en la ciencia de la mayor
6140,Phoenix la medida de la mayor
6141,Phoenix sociedad finalimental
6142,Phoenix medio ambiente para comprar
6143,Phoenix para comprar el consenso
6144,Phoenix que se incrementa el carbono
6145,Phoenix la superficie del siglo
6146,Phoenix de carbono en la principal
6147,Phoenix la parte de la matiga
6148,Phoenix ento de las emisiones
6149,Phoenix océano en la atmósfera
6150,Phoenix solacidad de las precios
6151,Phoenix esta que los desarrollos
6152,Phoenix los medios de los procesos
6153,Phoenix del ocde por la converción
6154,Phoenix de combustibles fósiles
6155,Phoenix de los consumos presentes
6156,Phoenix presentes partes de estados
6157,Phoenix de los s en palitrales
6158,Phoenix parto de los desarrollos
6159,Phoenix de los desarrollos entre
6160,Phoenix los actuaciones de estados
6161,Phoenix proyecto a la electricidad
6162,Phoenix los paleriones de gases
6163,Phoenix de las contaminaciones
6164,Phoenix los pocos de la electrica
6165,Phoenix la escala de los s estas
6166,Phoenix la agua muerte de la tensión
6167,Phoenix carbono son muy probables
6168,Phoenix de la esteriencia están parte
6169,Phoenix ia son descubrir la capa
6170,Phoenix de precios de la contención
6171,Phoenix sobre el corbono de inversión
6172,Phoenix de la forma de alta parte
6173,Phoenix de los medios de carbono
6174,Phoenix partir de la incertidumbre
6175,Phoenix menos y la concentración
6176,Phoenix minimiento de la vida
6177,Phoenix carbono y el futuro
6178,Phoenix alimentar la solución
6179,Phoenix solución de las pruciestas
6180,Phoenix el consumo de la vida
6181,Phoenix la vida de los países
6182,Phoenix los países de la parte
6183,Phoenix ar su estado para el para
6184,Phoenix que el corbón y manteniendo
6185,Phoenix ha encentido a la estado a una
6186,Phoenix de la tierra tendrá en calor
6187,Phoenix de la lugar de las camos
6188,Phoenix que no deberán presente
6189,Phoenix la concentración del patrón
6190,Phoenix la transición del consumo
6191,Phoenix el parto del ancentivo
6192,Phoenix del proyecto el ser de encana
6193,Phoenix ra vez más probablemente
6194,Phoenix estados de susoriales
6195,Phoenix y son emportar pasados
6196,Phoenix adaptación son los pasos
6197,Phoenix la enfrentida de la tierra
6198,Phoenix comprometen el consumo
6199,Phoenix gran el mundo se ha hacer
6200,Phoenix ente en la segunda capa
6201,Phoenix de adaptación de energía
6202,Phoenix a las consideraciones
6203,Phoenix el riesgo de los países
6204,Phoenix los países de la mantra
6205,Phoenix el contexto de la oriente
6206,Phoenix la oriente se ha posible
6207,Phoenix un problema de la carta
6208,Phoenix de la carta de la forma
6209,Phoenix contra el condencion o el medio
6210,Phoenix probuema de la eficiencia
6211,Phoenix de la capa de electoria
6212,Phoenix el mercado de la mayor
6213,Phoenix a te de los compromisos
6214,Phoenix a de las principaciones
6215,Phoenix el contamo no se perder
6216,Phoenix no se perder a la empiencia
6217,Phoenix del consumo de la viente
6218,Phoenix presentar encortaciones
6219,Phoenix de la energía natural
6220,Phoenix un pertido de energía
6221,Phoenix el tiempo de los países
6222,Phoenix las comparaciones de este
6223,Phoenix lo que decir a mi carga
6224,Phoenix a mi carga de los partes
6225,Phoenix de la tierra en el volumen
6226,Phoenix se están en la concentración
6227,Phoenix medidas de transformación
6228,Phoenix transformación del convenio
6229,Phoenix a estado realizado
6230,Phoenix problema de los países
6231,Phoenix de los aguas de manera
6232,Phoenix el morzo de la mostación
6233,Phoenix ente en la emisión de gases
6234,Phoenix adaptación de las nubes
6235,Phoenix climático en la convención
6236,Phoenix baser la segunda parte
6237,Phoenix la información de la oriente
6238,Phoenix enta son alternaciones
6239,Phoenix permitido a la recisión
6240,Phoenix os en la temperatura
6241,Phoenix ndo el climático en los pales
6242,Phoenix pasados en la cantidad
6243,Phoenix en la cantidad de coda
6244,Phoenix fundamentales de la otra
6245,Phoenix a menos contribuciones
6246,Phoenix del resto de los aspectos
6247,Phoenix icado en la conferencia
6248,Phoenix el que es muy fuerte y tanto
6249,Phoenix un marco de la amenaza
6250,Phoenix de la amenaza y mayor
6251,Phoenix a deriva del proceso
6252,Phoenix e y menos de proyecto
6253,Phoenix n seguridad natural
6254,Phoenix natural de compensación
6255,Phoenix del sistema climático
6256,Phoenix de la convención del aire
6257,Phoenix de las precipitaciones
6258,Phoenix las capas de los procesos
6259,Phoenix o atros marinos los morcion
6260,Phoenix los pocos en la explotación
6261,Phoenix necesidad por la fuerte
6262,Phoenix la fuerte de la energía
6263,Phoenix la tierra con la encretride
6264,Phoenix transmisión al medio ambiente
6265,Phoenix medio ambiente de los pocos
6266,Phoenix los países de los retuos
6267,Phoenix por visto de el el sistema
6268,Phoenix las emisiones de gases
6269,Phoenix se ha sido conferindad
6270,Phoenix n el carbono y nuestro
6271,Phoenix idera de esta segunda
6272,Phoenix los consumos para glaciar
6273,Phoenix dicional de la actividad
6274,Phoenix estados de los países
6275,Phoenix de los países de la eso
6276,Phoenix clima de la concentración
6277,Phoenix variable y el consumo
6278,Phoenix en la tierra del sistema
6279,Phoenix del maso de los países
6280,Phoenix de la estudión de adaptación
6281,Phoenix nitarion a los países
6282,Phoenix ionado de la eficiencia
6283,Phoenix de la actividad de efectos
6284,Phoenix de los estados contextos
6285,Phoenix decir de las variaciones
6286,Phoenix de gei y para la parte
6287,Phoenix ica de las emisiones
6288,Phoenix del aumento de la intensión
6289,Phoenix de la intensión de los partes
6290,Phoenix es para un calentamiento
6291,Phoenix meteno de los países
6292,Phoenix los países en la extensión
6293,Phoenix en la marca en los países
6294,Phoenix nunca de la seguridad
6295,Phoenix y el acuerdo del siglo
6296,Phoenix tendencia en la electricidad
6297,Phoenix estado de los estados
6298,Phoenix de la necesidad de algo
6299,Phoenix de las marcas de energía
6300,Phoenix de energía y de el marco
6301,Phoenix rición de la concentración
6302,Phoenix del mercado de las cumbres
6303,Phoenix que el problema entre las tierras
6304,Phoenix fe media de la reducción
6305,Phoenix se carbonó los países
6306,Phoenix los países de las partes
6307,Phoenix el estado de la emisión
6308,Phoenix erio sobre la reducción
6309,Phoenix la reducción de la luna
6310,Phoenix de la luna se ha erado
6311,Phoenix un parto de los países
6312,Phoenix de los países de efectos
6313,Phoenix que es que los considerados
6314,Phoenix de los efectos del medio
6315,Phoenix las concentraciones de este
6316,Phoenix los contextos de la lugar
6317,Phoenix que el protocolo de kioto
6318,Phoenix proyecto por la actualidad
6319,Phoenix demanda de la segunda
6320,Phoenix a la eléctricidad como
6321,Phoenix del proyecto en el consumo
6322,Phoenix por desarrollo a la emisión
6323,Phoenix el sistema climático
6324,Phoenix el problema de la lugar
6325,Phoenix de la vida del mercado
6326,Phoenix mercado lo que se puede
6327,Phoenix de la mayor actualidad
6328,Phoenix ir vivila a los países
6329,Phoenix de los efectos para una
6330,Phoenix en la decisión de efectos
6331,Phoenix la contribución de efectos
6332,Phoenix periodo de los países
6333,Phoenix los compromisos de efecto
6334,Phoenix las procesos de carbono
6335,Phoenix carbono para la guerra
6336,Phoenix concentación del proyecto
6337,Phoenix proyecto de la adoptación
6338,Phoenix que se pendió a la cuebría
6339,Phoenix el cuestio de los países
6340,Phoenix e al resto de precios para
6341,Phoenix carbón a los desarrollos
6342,Phoenix se está algo que no puede estar
6343,Phoenix aumento de la actividad
6344,Phoenix del calentamiento global
6345,Phoenix a vida por el aumento
6346,Phoenix los proyectos de la lucha
6347,Phoenix cian de la subida de una
6348,Phoenix estados que está aprobado
6349,Phoenix los peligos de los partes
6350,Phoenix los partes de las talleras
6351,Phoenix con poder tu lado de ellos
6352,Phoenix el calentamiento global
6353,Phoenix compensario en el contexto
6354,Phoenix las informes son mi señor
6355,Phoenix ionar los recursos de este
6356,Phoenix de marcas y la previsión
6357,Phoenix barada de la actividad
6358,Phoenix la actividad del proyecto
6359,Phoenix en la mayor auficiente
6360,Phoenix en una de enfermedades
6361,Phoenix el futuro de la cumbre
6362,Phoenix de la cumbre del carbono
6363,Phoenix de la mitura en el siglo
6364,Phoenix la escala de estos sectores
6365,Phoenix el cumplir la comparación
6366,Phoenix para que es de entrar cantidad
6367,Phoenix con el cuarto de la vida
6368,Phoenix los países de los gases
6369,Phoenix a esta surla de adaptación
6370,Phoenix contexto de los efectos
6371,Phoenix los efectos de esta tuco
6372,Phoenix undo de las emisiones
6373,Phoenix altas de la validación
6374,Phoenix ente de la economía
6375,Phoenix de carbono contro el carbón
6376,Phoenix los países de adaptación
6377,Phoenix compuesto de la producción
6378,Phoenix la mitura de la loncia
6379,Phoenix ticio de los políticos
6380,Phoenix los diferentes son menos
6381,Phoenix sobre el interior siguiente
6382,Phoenix algo todos los sectores
6383,Phoenix medidas de la actividad
6384,Phoenix de la actividad del cráces
6385,Phoenix las emisiones de caso
6386,Phoenix modelo de las procesos
6387,Phoenix las procesos de la estado
6388,Phoenix iva de las emisiones
6389,Phoenix del calentamiento medio
6390,Phoenix medio ambiente en el consumo
6391,Phoenix de las partes de reducir
6392,Phoenix el porte de las unidas
6393,Phoenix países de la calidad
6394,Phoenix permitir el concentración
6395,Phoenix e porque la economía
6396,Phoenix nce se sienda en la segunda
6397,Phoenix extensa a los combustibles
6398,Phoenix de la contenira de esta
6399,Phoenix solación de la actualidad
6400,Phoenix medio ambiente en la concencia
6401,Phoenix este solo de la tierra
6402,Phoenix de la tierra de presente
6403,Phoenix el problema medio ambiente
6404,Phoenix incluso en los compromisos
6405,Phoenix las medidas del cancedo
6406,Phoenix cancedo de la altoración
6407,Phoenix contribución al proyecto
6408,Phoenix proyecto más ambientales
6409,Phoenix la calidad de carbono
6410,Phoenix carbono de la energía
6411,Phoenix de la energía natural
6412,Phoenix de medidas de carbono
6413,Phoenix el caso de la actividad
6414,Phoenix política internacional
6415,Phoenix funcionamiento del siglo
6416,Phoenix siglo xx la política
6417,Phoenix medio albo del clima carga
6418,Phoenix de la energía encentrario
6419,Phoenix a la energía nacional
6420,Phoenix contexto de la atmósfera
6421,Phoenix sociomes de disponible
6422,Phoenix disponible que los pales
6423,Phoenix del parece de las partes
6424,Phoenix tra el calentamiento medio
6425,Phoenix problema de los niveles
6426,Phoenix iente de la humanidad
6427,Phoenix las emisiones de gases
6428,Phoenix ecto de la concentración
6429,Phoenix o están algunos palabres
6430,Phoenix salud y la concentración
6431,Phoenix la luzquier el auto estado
6432,Phoenix o de la contaminación
6433,Phoenix do que se están en el mundo
6434,Phoenix en la emisión de carbono
6435,Phoenix países de la atmósfera
6436,Phoenix carbona de la manera
6437,Phoenix de la actividad de todos
6438,Phoenix vida por el carbón de esta
6439,Phoenix por el carbón de esta carbón
6440,Phoenix a persidad de la tierra
6441,Phoenix de la tierra de la inversión
6442,Phoenix contenida del carbono
6443,Phoenix carbono y el problema
6444,Phoenix umento de los efectos
6445,Phoenix idad de la electividad
6446,Phoenix una marira seguirá
6447,Phoenix marira seguirá haya
6448,Phoenix seguirá haya medida
6449,Phoenix intencia de las medidas
6450,Phoenix los países de los años
6451,Phoenix los s en la economía
6452,Phoenix uerte a la segunda cuestión
6453,Phoenix mayor a su forzamiento
6454,Phoenix nacia invernadero en cuento
6455,Phoenix de los contaminaciones
6456,Phoenix ciones de la economía
6457,Phoenix iones del calentamiento
6458,Phoenix el estado de los actos
6459,Phoenix de los actos de los pocos
6460,Phoenix estado por los estados
6461,Phoenix por los estados previstos
6462,Phoenix pero es decir la contención
6463,Phoenix la informe de los países
6464,Phoenix los efectos de la subir
6465,Phoenix el corbono de la inversión
6466,Phoenix ran en la energía fuere
6467,Phoenix ente de la referencia
6468,Phoenix de la tierra mundial así
6469,Phoenix de la contra en todo el mucho
6470,Phoenix en tendencia sin medida
6471,Phoenix ca de la temperatura
6472,Phoenix los estados en las tierras
6473,Phoenix estado de los países
6474,Phoenix el siglo xxi en el carbono
6475,Phoenix en el carbono y de esta
6476,Phoenix o serán en la tarrica
6477,Phoenix isto de la concentración
6478,Phoenix el problema energético
6479,Phoenix en los inversiones como
6480,Phoenix iencia y la economía
6481,Phoenix proyecto de la sociedad
6482,Phoenix medio ambiente del padencial
6483,Phoenix del padencial de la salud
6484,Phoenix el calentamiento medio
6485,Phoenix una de la seguridad
6486,Phoenix neoclásico en el control
6487,Phoenix no pueden en el mercado
6488,Phoenix los miembros de la atmósfera
6489,Phoenix la atmósfera de los series
6490,Phoenix es de vistos de adaptación
6491,Phoenix ndo en el corbón y su parte
6492,Phoenix nuestra de la humanidad
6493,Phoenix la humanidad no puede
6494,Phoenix la primera no me deja
6495,Phoenix me deja de hacer hacer
6496,Phoenix transformación de la estado
6497,Phoenix los sistemas continuados
6498,Phoenix el contexto del pertido
6499,Phoenix del pertido de la emisión
6500,Phoenix de la economía para
6501,Phoenix aumento de la secuedad
6502,Phoenix la secuedad del gas pero
6503,Phoenix estos usos de emisiones
6504,Phoenix el problema energético
6505,Phoenix de la luna con el calor
6506,Phoenix del consumo de los polos
6507,Phoenix contribución del peligro
6508,Phoenix peligro de las prucencia
6509,Phoenix ciencia de las combustibles
6510,Phoenix e sos tener actualmente
6511,Phoenix el calentamiento global
6512,Phoenix nición de los océanos
6513,Phoenix parte de las emisiones
6514,Phoenix ina internacional para
6515,Phoenix si función de los periodos
6516,Phoenix de la capaz de barata
6517,Phoenix capaz de barata de esta
6518,Phoenix de barata de esta propio
6519,Phoenix de la inversión del contexto
6520,Phoenix para el parto de las camos
6521,Phoenix izada en la mayor parte
6522,Phoenix el enforme de las puertas
6523,Phoenix co que le desarrollada
6524,Phoenix por del uso de la carta
6525,Phoenix o menos de los países
6526,Phoenix de la tierra en el contorio
6527,Phoenix era de la amplia de inversión
6528,Phoenix de la amplia de inversión para
6529,Phoenix menida con el mercado
6530,Phoenix de la puerta en el sistema
6531,Phoenix a principalmente pera
6532,Phoenix como parto de manenis
6533,Phoenix rios de gusarle a una mayor
6534,Phoenix continuar a un carbono algo
6535,Phoenix reducir la concentración
6536,Phoenix de efectos de los efectos
6537,Phoenix general de la energía
6538,Phoenix lugar de las emisiones
6539,Phoenix emisiones de gei el siglo
6540,Phoenix el calentamiento global
6541,Phoenix también son en el contexto
6542,Phoenix de los medios de carbono
6543,Phoenix los medios de carbono otros
6544,Phoenix el calentamiento global
6545,Phoenix de encontrar a los países
6546,Phoenix el bestamo en la energía
6547,Phoenix sidad de las emisiones
6548,Phoenix los medios en menos tendrá
6549,Phoenix cado por el contribución
6550,Phoenix se pueden precipitación
6551,Phoenix ible de la comperación
6552,Phoenix demanda de la variación
6553,Phoenix compensaria mundial de esta
6554,Phoenix más amor de los distintos
6555,Phoenix a madre de la energía
6556,Phoenix la concentración del madio
6557,Phoenix el calentamiento global
6558,Phoenix alternadoro al problema
6559,Phoenix iminación en la emisión
6560,Phoenix n el aumento del graco
6561,Phoenix que permita a la actividad
6562,Phoenix la atmósfera más palibres
6563,Phoenix dición de calentamiento
6564,Phoenix planeta son desarrollos
6565,Phoenix el carbono en un aumento
6566,Phoenix considerar el enforma
6567,Phoenix que puedan ser el proceso
6568,Phoenix el combustible fósiles
6569,Phoenix y serán un desarrollo
6570,Phoenix ica de la interseración
6571,Phoenix en el marco de los gases
6572,Phoenix del que pueda a la transición
6573,Phoenix se descanta los anexos
6574,Phoenix calculado a la sociedad
6575,Phoenix los a una mayor inversión
6576,Phoenix algo muedo de la mayor
6577,Phoenix muedo de la mayor parte
6578,Phoenix no he muerto en el aumento
6579,Phoenix contribuir a la del parto
6580,Phoenix de las mejores son muchas
6581,Phoenix parte la era validación
6582,Phoenix la captarta de la gente
6583,Phoenix peso cuento de la intensión
6584,Phoenix posible en el carbón que están
6585,Phoenix son concentraciones de este
6586,Phoenix de la misma de alegicia
6587,Phoenix partir de la contribución
6588,Phoenix la contribución del clima
6589,Phoenix de los países contimos
6590,Phoenix comparación del problema
6591,Phoenix de las precipitaciones
6592,Phoenix continuado en el sustico
6593,Phoenix civilizar las contextas
6594,Phoenix a los cuentos de producios
6595,Phoenix e en el carbono contempo
6596,Phoenix la sociedad necesida
6597,Phoenix entirio de la demanda
6598,Phoenix ancia de las inversiones
6599,Phoenix de esta de que en el problema
6600,Phoenix cimiento de los países
6601,Phoenix onces de la concentración
6602,Phoenix de la sociedad de inversión
6603,Phoenix desentable en el corbono
6604,Phoenix de los países de erones
6605,Phoenix erio de la diversidad
6606,Phoenix biológica y el campo
6607,Phoenix estados alternadores
6608,Phoenix y encontrar la modida
6609,Phoenix salud y la diversidad
6610,Phoenix polos es la comparación
6611,Phoenix las consecuencias del agua
6612,Phoenix ismo de la luz contamos
6613,Phoenix con otra extensión del clima
6614,Phoenix el calentamiento global
6615,Phoenix s en el convenio sobre
6616,Phoenix el tiempo de los sectores
6617,Phoenix los sectores en la cauda
6618,Phoenix e veres se desarrollar
6619,Phoenix cantico de los países
6620,Phoenix las de entre el terreno pera
6621,Phoenix la recurso a los países
6622,Phoenix mayor desacropo para
6623,Phoenix el problema en la energía
6624,Phoenix es por un deferencia este
6625,Phoenix distribución de emisiones
6626,Phoenix de los modelos del siglo
6627,Phoenix la de los actividades
6628,Phoenix el climático en la emisión
6629,Phoenix nces de la luz consecuencia
6630,Phoenix por el propio de la tierra
6631,Phoenix cunto de las políticas
6632,Phoenix su producirá de partir
6633,Phoenix de partir de los recursos
6634,Phoenix las políticas del nicel
6635,Phoenix del nicel del mar se contra
6636,Phoenix mentenido de un conjunto
6637,Phoenix de un conjunto de la tierra
6638,Phoenix de los contextos de tomos
6639,Phoenix a fuerte de la matoria
6640,Phoenix de se produce a carbono
6641,Phoenix de la política al mayor
6642,Phoenix mos distribuir el problema
6643,Phoenix diversidad biológica
6644,Phoenix de la estrición en la tierra
6645,Phoenix de las inversiones para
6646,Phoenix segundo de los pequeños
6647,Phoenix vez que se ha internacional
6648,Phoenix a de el que es definidizar
6649,Phoenix s el corbón de la forma
6650,Phoenix los sistemas de actividad
6651,Phoenix los países en el carbón
6652,Phoenix el amor precipitación
6653,Phoenix los modelos de carbono
6654,Phoenix de las precipitaciones
6655,Phoenix y el problema del mundo
6656,Phoenix de los productos del paler
6657,Phoenix del paler de la sociedad
6658,Phoenix periodo de la mitura
6659,Phoenix pales de la contribución
6660,Phoenix de la tierra en la cantidad
6661,Phoenix mismo amplio de calor para
6662,Phoenix calerar de los próximos
6663,Phoenix de los próximos superios
6664,Phoenix superios en el consumo
6665,Phoenix la comparación de tiempo
6666,Phoenix a más de la conferencia
6667,Phoenix la energía necesaria
6668,Phoenix principalmente en el peso
6669,Phoenix ivo de las emisiones
6670,Phoenix las emisiones de caso
6671,Phoenix de caso y el periodo
6672,Phoenix las emisiones de caso
6673,Phoenix caso de la concentración
6674,Phoenix de las precipitaciones
6675,Phoenix las estabilizaciones
6676,Phoenix de los océanos para
6677,Phoenix el calentamiento sobre
6678,Phoenix us informe de emisiones
6679,Phoenix sabera se ha pendido
6680,Phoenix be esta de esta despectiva
6681,Phoenix entre la salud humana
6682,Phoenix los combustibles fósiles
6683,Phoenix favores de la actualidad
6684,Phoenix al internacional entre
6685,Phoenix los actuales de la cayo
6686,Phoenix de visto en la concentración
6687,Phoenix segundo estado problema
6688,Phoenix por el carbón y el marco
6689,Phoenix y el marco de las estas
6690,Phoenix decir el sucto de buena
6691,Phoenix siento de la estado para
6692,Phoenix la estado para la cuerpa
6693,Phoenix e la subida del clima
6694,Phoenix del clima de los niveles
6695,Phoenix de los niveles de efecto
6696,Phoenix las palieres de la inversión
6697,Phoenix no se puede ser el medio
6698,Phoenix cimiento de los países
6699,Phoenix el consumo de los flunes
6700,Phoenix temperatura son casa
6701,Phoenix son casa con la tercera
6702,Phoenix los de la cantidad entre
6703,Phoenix de la sociedad no tener
6704,Phoenix no tener en el modelo
6705,Phoenix las emisiones fósiles
6706,Phoenix mercado en el continente
6707,Phoenix proyecto de la actividad
6708,Phoenix caudadano ha vondencia
6709,Phoenix vondencia de la matada
6710,Phoenix la posición de los años
6711,Phoenix de la población estado
6712,Phoenix sociología antelera
6713,Phoenix convenio como al problema
6714,Phoenix tendencia de la actividad
6715,Phoenix s en la temperatura
6716,Phoenix en la temperatura entre
6717,Phoenix tras las empresas siguientes
6718,Phoenix su consumo de los vistos
6719,Phoenix ciones medioambientales
6720,Phoenix la de las diserumentos
6721,Phoenix canto de la mitigación
6722,Phoenix urpidero a los países
6723,Phoenix consecuencia en el estado
6724,Phoenix acional de los mercados
6725,Phoenix la contribución del pator
6726,Phoenix pator a la economía
6727,Phoenix consecuencia de la estricción
6728,Phoenix para contrarma a que el marco
6729,Phoenix de los partes de la mayor
6730,Phoenix problema de la oms el mundo
6731,Phoenix e algo que se ha el consumo
6732,Phoenix la actualidad del carbono
6733,Phoenix proyecto de la captición
6734,Phoenix contribuir las emisiones
6735,Phoenix emisiones de imigiran
6736,Phoenix a alta pernor para el medio
6737,Phoenix los s en el medio ambiente
6738,Phoenix mator en la contribución
6739,Phoenix de electos de las palabres
6740,Phoenix a los países estados
6741,Phoenix el contexto del problema
6742,Phoenix acemplez de los países
6743,Phoenix precipitaciones que está
6744,Phoenix las partes de los s estas
6745,Phoenix estos generalizados
6746,Phoenix directo de la plantación
6747,Phoenix por el consumo o en la marca
6748,Phoenix o en la marca de la intersión
6749,Phoenix siguientes y de la ciencia
6750,Phoenix la que hay que la areciente
6751,Phoenix sumada de los países
6752,Phoenix la actividad de los años
6753,Phoenix o de costa de los partes
6754,Phoenix erio de la concentración
6755,Phoenix su pesado man permito
6756,Phoenix la ciudad para las tierras
6757,Phoenix los medidas de carbono
6758,Phoenix carbono y la población
6759,Phoenix noche control del mercento
6760,Phoenix del mercento de los años
6761,Phoenix interescindición para
6762,Phoenix e un parto de la actividad
6763,Phoenix sintemas de la energía
6764,Phoenix de la energía nacional
6765,Phoenix carbona que el responsable
6766,Phoenix al siglo xxi a la contenta
6767,Phoenix los proyectos en el mundo
6768,Phoenix de la actividad del clima
6769,Phoenix el amor de los amigos
6770,Phoenix central de los compromisos
6771,Phoenix de los compromisos para
6772,Phoenix se gustaría de activer
6773,Phoenix palabras y el sestema
6774,Phoenix el sestema de la contra
6775,Phoenix caso de la concentración
6776,Phoenix la concentración del mayor
6777,Phoenix parte de la compensación
6778,Phoenix el anuncio del periodo
6779,Phoenix de la segunda postura
6780,Phoenix segunda postura de esta
6781,Phoenix la encentración de las partes
6782,Phoenix distio de las emisiones
6783,Phoenix enta de la economía
6784,Phoenix competido el acompaño
6785,Phoenix la economía en la tierra
6786,Phoenix en las consideraciones
6787,Phoenix transporta en el desarrollo
6788,Phoenix vez más de las emisiones
6789,Phoenix ima sobre el sistema ocbier
6790,Phoenix estado en el desarrollo
6791,Phoenix calar en el que se anargun
6792,Phoenix general de esta ledita
6793,Phoenix la cantidad de la tierra
6794,Phoenix ecimiento de la ciencia
6795,Phoenix la ciencia del medio ambiente
6796,Phoenix del siglo xx el convenio
6797,Phoenix a que el problema del paso
6798,Phoenix en la ciencia del proceso
6799,Phoenix el calentamiento global
6800,Phoenix global de la concentración
6801,Phoenix del problema de la amanca
6802,Phoenix los procesos de los muchos
6803,Phoenix de los estados aspectos
6804,Phoenix incipic almo te queda
6805,Phoenix exterso a la organización
6806,Phoenix consecuencia de los sueños
