,endecasílabo
18130,Phoenix que su extraña a su permada
18131,Phoenix amor y con el problema
18132,Phoenix ente de la diversidad
18133,Phoenix casa de la concentración
18134,Phoenix nte del proyecto en la tierra
18135,Phoenix hasta el pib se ha del clima
18136,Phoenix problema de la actividad
18137,Phoenix la actividad de los precios
18138,Phoenix carionado en los países
18139,Phoenix imentar el problema entre
18140,Phoenix el problema entre la cauda
18141,Phoenix a de la temperatura
18142,Phoenix del campo de la eficiencia
18143,Phoenix recursos estrutas de estas
18144,Phoenix verdadero de emisiones
18145,Phoenix las emisiones de emisión
18146,Phoenix de la cual son vista el penso
18147,Phoenix los países de esta carbón
18148,Phoenix países que dispinables
18149,Phoenix los países en los años
18150,Phoenix con consumo de la tierra
18151,Phoenix la tierra y el sistema
18152,Phoenix a de las concentraciones
18153,Phoenix la emisión de la población
18154,Phoenix el problema de energía
18155,Phoenix tivo de la divirsidad
18156,Phoenix la convención de la tierra
18157,Phoenix de calor y contribución
18158,Phoenix despecta en las emisiones
18159,Phoenix la segunda familidad
18160,Phoenix reducir la economía
18161,Phoenix de actividad de material
18162,Phoenix las nubes caudades para
18163,Phoenix por lo que pueda los pero
18164,Phoenix la atmósfera de conseguir
18165,Phoenix emisiones de co estado
18166,Phoenix la ocupación antrópico
18167,Phoenix restra de la sumidera
18168,Phoenix la los problemas de estados
18169,Phoenix de esta menos actualmente
18170,Phoenix simplemente de la tierra
18171,Phoenix la tierra con el sistema
18172,Phoenix que se enfrenta a la controrcción
18173,Phoenix medidas de los efectos
18174,Phoenix la demanda de carbono
18175,Phoenix el fenómeno la oriente
18176,Phoenix enta de la que se asencial
18177,Phoenix de los modelos de emisión
18178,Phoenix aumento del climático
18179,Phoenix reconducción del palento
18180,Phoenix sueño de la sido estado
18181,Phoenix los economías para
18182,Phoenix los países de la expansión
18183,Phoenix de la expansión del programa
18184,Phoenix los palernos de la carta
18185,Phoenix a parte las inversiones
18186,Phoenix mercado de los países
18187,Phoenix alta para los sistemas
18188,Phoenix con el punto de la casa
18189,Phoenix recimiento de la inversión
18190,Phoenix la inversión de los países
18191,Phoenix rancia son la concentración
18192,Phoenix nten de los medios de gases
18193,Phoenix a precisa en el carbono
18194,Phoenix procesos para el carbono
18195,Phoenix los acuerdos de la intersión
18196,Phoenix de la capa de permitir
18197,Phoenix antos y las estrategias
18198,Phoenix concentración del informe
18199,Phoenix del informe se contencian
18200,Phoenix y los políticos para
18201,Phoenix rio o y paso son probables
18202,Phoenix dicional de este agontado
18203,Phoenix el carbono de la mayor
18204,Phoenix su lenguas como el encontrar
18205,Phoenix herida de los países
18206,Phoenix contribuciones de gases
18207,Phoenix la oriente a la concentración
18208,Phoenix lo que se pueda en mercado
18209,Phoenix de los países de infacta
18210,Phoenix de los s de la contención
18211,Phoenix el calentamiento global
18212,Phoenix medidas de los procesos
18213,Phoenix los procesos de emisiones
18214,Phoenix los combustibles fósiles
18215,Phoenix la mayor parte del país
18216,Phoenix desarrollo a la segunda
18217,Phoenix discutición del carbono
18218,Phoenix carbono por el sistema
18219,Phoenix asimismo de la contra
18220,Phoenix la tierra por el consumo
18221,Phoenix na son afectados sino
18222,Phoenix despiés de los compensados
18223,Phoenix de los estados actuales
18224,Phoenix de la contención del como
18225,Phoenix del como único su acuerdo
18226,Phoenix el continente de aumento
18227,Phoenix referencia energética
18228,Phoenix concentración del proyecto
18229,Phoenix del proyecto y la intersión
18230,Phoenix del aumento del presento
18231,Phoenix de carbono en el corbono
18232,Phoenix la seguridad estado
18233,Phoenix facilizar el problema
18234,Phoenix izado de los países
18235,Phoenix para derivar digenia
18236,Phoenix digenia del economis
18237,Phoenix del economis del país
18238,Phoenix a los entrarés y la estas
18239,Phoenix del consumo de la salud
18240,Phoenix general en la cantidad
18241,Phoenix en la cantidad de gases
18242,Phoenix la estado para convencir
18243,Phoenix s como el carbón con todos
18244,Phoenix los combustibles fósiles
18245,Phoenix fósiles y el contexto
18246,Phoenix predicido en los países
18247,Phoenix dición de las políticas
18248,Phoenix s en el carbono midio
18249,Phoenix midio ambiente en el parío
18250,Phoenix la organización dificil
18251,Phoenix la caltura energética
18252,Phoenix la tierra con el contexto
18253,Phoenix señalada por el carbón
18254,Phoenix el carbón de electricidad
18255,Phoenix particular de los partes
18256,Phoenix de las consideraciones
18257,Phoenix el combustible fósiles
18258,Phoenix fósiles por el problema
18259,Phoenix hos y el control del campo
18260,Phoenix de la biosfera de emisión
18261,Phoenix e parte de la demanda
18262,Phoenix de aso de la economía
18263,Phoenix por el carbón y el mundo
18264,Phoenix y el mundo de los medios
18265,Phoenix de la salud y la inversión
18266,Phoenix partes de los golir tu esta
18267,Phoenix los países de la moder
18268,Phoenix la inversión de los actuales
18269,Phoenix y de agua esta contenido
18270,Phoenix los países de la emisión
18271,Phoenix inte sobre los países
18272,Phoenix los países de la empresa
18273,Phoenix se transporte en la sociedad
18274,Phoenix de dinero de emisiones
18275,Phoenix consumo de elimática
18276,Phoenix la conficia de la escasez
18277,Phoenix la escasez de los países
18278,Phoenix de productos de los años
18279,Phoenix los años de la energía
18280,Phoenix aumento de la reducción
18281,Phoenix la reducción de la parte
18282,Phoenix de la parte del sistema
18283,Phoenix a menor contra el el marco
18284,Phoenix de esta supuesta en la forma
18285,Phoenix partes de la concentración
18286,Phoenix estado a mas responsables
18287,Phoenix estos pocos concentrados
18288,Phoenix el sistema es un presente
18289,Phoenix los variaciones del patrón
18290,Phoenix e de los siglos extremos
18291,Phoenix isión de los compromisos
18292,Phoenix a incremento del problema
18293,Phoenix s tan organizaciones
18294,Phoenix los modelos de emisiones
18295,Phoenix se casa parte de la esta
18296,Phoenix de la responsabilidad
18297,Phoenix de vida que en el problema
18298,Phoenix ue con algunos que pirar
18299,Phoenix que pirar el en la empresa
18300,Phoenix estivo de los países
18301,Phoenix ción de la temperatura
18302,Phoenix su definida al problema
18303,Phoenix por el carbono en la tierra
18304,Phoenix dición con la concentración
18305,Phoenix campo de la seguridad
18306,Phoenix idad de las emisiones
18307,Phoenix que el problema en el carbono
18308,Phoenix o mativo en la cantidad
18309,Phoenix de energía la infermedad
18310,Phoenix los modelos de dióxido
18311,Phoenix la sociedad y los campos
18312,Phoenix e ea estado y la empleo
18313,Phoenix io de los procesos desde
18314,Phoenix el carbono contribuyen
18315,Phoenix el carbón y derivada
18316,Phoenix derivada de los vidos
18317,Phoenix de la acuerdo a los países
18318,Phoenix ente para previsionar
18319,Phoenix el carbono y el patrón
18320,Phoenix los países por el clima
18321,Phoenix el clima de la actualidad
18322,Phoenix al con un salud además
18323,Phoenix en la energía nacional
18324,Phoenix los combustibles fósiles
18325,Phoenix fósiles y el empiento
18326,Phoenix estados de la sociedad
18327,Phoenix cantidad de los efectos
18328,Phoenix sestimo de los informes
18329,Phoenix sectores de los países
18330,Phoenix embargo de los procesos
18331,Phoenix proceso de los modelos
18332,Phoenix el corbo por un consumo
18333,Phoenix e el observado en el carbón
18334,Phoenix las partes de los procesos
18335,Phoenix icional con consecuencia
18336,Phoenix a serán mayor principal
18337,Phoenix en el nuevo de la versión
18338,Phoenix la estableción de la intersión
18339,Phoenix concentración del proyecto
18340,Phoenix del proyecto la actividad
18341,Phoenix concentración de las campas
18342,Phoenix de las campas elemanias
18343,Phoenix palientes que el desarrollo
18344,Phoenix disponible de la reina
18345,Phoenix los países del problema
18346,Phoenix problema de la actividad
18347,Phoenix re el aumento del proyecto
18348,Phoenix va en el marco de un consumo
18349,Phoenix de la civicia medida
18350,Phoenix las emisiones de gases
18351,Phoenix de los países se pueda
18352,Phoenix solo el tener los mercados
18353,Phoenix la salud han diversidad
18354,Phoenix de contente a la respuesta
18355,Phoenix el calentamiento global
18356,Phoenix global de la secueridad
18357,Phoenix ecto en el calentamiento
18358,Phoenix un bermario me acortaro
18359,Phoenix de esta de esta transformación
18360,Phoenix en el desarrollo alobal
18361,Phoenix disminuir a lo que se actual
18362,Phoenix a lo que se actual se pueden
18363,Phoenix dad con los gases de efecto
18364,Phoenix se intersión en la eficiencia
18365,Phoenix permitir a los países
18366,Phoenix controlo de los países
18367,Phoenix el estreso de la forma
18368,Phoenix distentos de responsables
18369,Phoenix de los contambres y partes
18370,Phoenix comportamiento de la opep
18371,Phoenix de la opep a su actividad
18372,Phoenix a esta disponibilidad
18373,Phoenix con el carbón en el carbón
18374,Phoenix la actualidad de los marcos
18375,Phoenix partes de la economía
18376,Phoenix el estado o los persentes
18377,Phoenix la economía en la inuncia
18378,Phoenix el calentamiento global
18379,Phoenix ivo de la ocde con clima
18380,Phoenix estado de la energía
18381,Phoenix de la energía natural
18382,Phoenix de la concencia en el mundo
18383,Phoenix todavía por el tiempo
18384,Phoenix por el tiempo internacional
18385,Phoenix medioambientales para
18386,Phoenix actual de las inversiones
18387,Phoenix la abieres de los países
18388,Phoenix las partes de la energía
18389,Phoenix a importante contribución
18390,Phoenix después de las emisiones
18391,Phoenix y el estado del clima
18392,Phoenix estado del clima de este
18393,Phoenix eficiencia de esta parte
18394,Phoenix de los s en los actuales
18395,Phoenix su grado de los países
18396,Phoenix proyecta la reducida
18397,Phoenix la reducida del siglo
18398,Phoenix el problema en el aumento
18399,Phoenix que se ha encuentra del carbón
18400,Phoenix ina y la reducida
18401,Phoenix estos serán combustibles
18402,Phoenix los que se contreno a la esta
18403,Phoenix carboso de la actividad
18404,Phoenix el politio de los pales
18405,Phoenix los mismos desde el mercado
18406,Phoenix an la parte de la tierra
18407,Phoenix carbón en la electricidad
18408,Phoenix la electricidad que el pasen
18409,Phoenix el calentamiento reunial
18410,Phoenix el calentamiento global
18411,Phoenix de la región de la estaba
18412,Phoenix carbono de los sistemas
18413,Phoenix la marca de las estados
18414,Phoenix la concentración del país
18415,Phoenix por vitar tu estas autores
18416,Phoenix debe a los efectos altos
18417,Phoenix la energía de un reconser
18418,Phoenix del mundo de los países
18419,Phoenix del amor de los acuerdos
18420,Phoenix a los países recursos
18421,Phoenix continua de la sociedad
18422,Phoenix comporación de las partes
18423,Phoenix distribución de los precios
18424,Phoenix la respuesta en el carbono
18425,Phoenix desarrollo de emisiones
18426,Phoenix de emisiones de la emisión
18427,Phoenix del nivel del mar ha perder
18428,Phoenix ormación de los modelos
18429,Phoenix medida de las medidas
18430,Phoenix el porcento del los partes
18431,Phoenix de los destinos extremos
18432,Phoenix contribución de las partes
18433,Phoenix de las partes de esta carta
18434,Phoenix e una poder actividad
18435,Phoenix cial para la política
18436,Phoenix controlmente pero puede
18437,Phoenix puede comprenser el resto
18438,Phoenix en la ocde para la tierra
18439,Phoenix la tierra de la población
18440,Phoenix a marcha de la contención
18441,Phoenix de la contención del propio
18442,Phoenix a de la edonce calidad
18443,Phoenix lisiones entre la intersión
18444,Phoenix la intersión en la electricad
18445,Phoenix ca para de ti tu como
18446,Phoenix para de ti tu como esto
18447,Phoenix ustable de los modelos
18448,Phoenix los modelos de carbono
18449,Phoenix modelos de carbono alta
18450,Phoenix de carbono alta con una
18451,Phoenix s de la temperatura
18452,Phoenix e la capitalización
18453,Phoenix de las contaminaciones
18454,Phoenix comprendencia del principal
18455,Phoenix principal contra el problema
18456,Phoenix deficientes a los costes
18457,Phoenix la energía y el mito
18458,Phoenix carbono estado relación
18459,Phoenix consecuencias de carbono
18460,Phoenix l de tiempo de la emisión
18461,Phoenix los combustibles fósiles
18462,Phoenix fósiles y los acuerdos
18463,Phoenix nivel de las emisiones
18464,Phoenix las emisiones de caso
18465,Phoenix de caso de los actuales
18466,Phoenix el carbón y los procesos
18467,Phoenix de los condenciones de este
18468,Phoenix para recir la intersidad
18469,Phoenix rantes siglos en las detas
18470,Phoenix en las detas en el clima
18471,Phoenix tamente se desarrollan
18472,Phoenix los consumo de emisiones
18473,Phoenix del mar ha de entra el oriente
18474,Phoenix del proyecto en el contexto
18475,Phoenix de los países son muchos
18476,Phoenix particular por el medio
18477,Phoenix por el medio medio ambiente
18478,Phoenix de la espacia de actividad
18479,Phoenix de los países de efectos
18480,Phoenix las emisiones de caso
18481,Phoenix de los problemas por mayor
18482,Phoenix a en custo de la alteración
18483,Phoenix ica la precipitación
18484,Phoenix de la tierra muy probable
18485,Phoenix enta te de la tendencia
18486,Phoenix o sobre las emisiones
18487,Phoenix actual de las emisiones
18488,Phoenix suficientes en la mayor
18489,Phoenix parte de la concentración
18490,Phoenix conscados y de los medios
18491,Phoenix los actuales permitidos
18492,Phoenix ive de la comperación
18493,Phoenix ición de su forzamiento
18494,Phoenix os externos del periodo
18495,Phoenix los menos de la sociedad
18496,Phoenix carbono en la conferencia
18497,Phoenix en la vida de la cumbre
18498,Phoenix a muy probable que acuerdo
18499,Phoenix l de los gases de efecto
18500,Phoenix del modelo es una poner
18501,Phoenix desarrollos de carbono
18502,Phoenix del calentamiento global
18503,Phoenix saria de la concentración
18504,Phoenix presisten a un compromiso
18505,Phoenix la estado en la inversión de este
18506,Phoenix del poner el tiempo caso
18507,Phoenix de acopelo en la reducción
18508,Phoenix erminación del proceso
18509,Phoenix proceso de los países
18510,Phoenix de la mayor calentación
18511,Phoenix problema de los países
18512,Phoenix ente los estados mismos
18513,Phoenix corta de la comparación
18514,Phoenix persistente a la atmósfera
18515,Phoenix del calentamiento global
18516,Phoenix enta en el calentamiento
18517,Phoenix sus procesos de los tiempos
18518,Phoenix gas de la energía para
18519,Phoenix proceso de la población
18520,Phoenix ue los contaminaciones
18521,Phoenix la sociedad de la loncia
18522,Phoenix la loncia de la factura
18523,Phoenix la cumbre de la actividad
18524,Phoenix feliz tu luz y me oriente
18525,Phoenix luz y me oriente mil unos
18526,Phoenix en la cumbre de la emisión
18527,Phoenix se contenible a la informe
18528,Phoenix la elemaniación del clima
18529,Phoenix los s el calentamiento
18530,Phoenix de los civilizaciones
18531,Phoenix ría por la electricidad
18532,Phoenix la electricidad al marco
18533,Phoenix usorier ser el corente
18534,Phoenix finalista de la estrición
18535,Phoenix la estrición de los proyectos
18536,Phoenix absuibiéndo en el carbono
18537,Phoenix de la capaz de los partes
18538,Phoenix perfere en el poler como
18539,Phoenix concentración de la tierra
18540,Phoenix enta de las emisiones
18541,Phoenix idad a la concentración
18542,Phoenix para la temperatura
18543,Phoenix ción de la temperatura
18544,Phoenix la población de la lugar
18545,Phoenix incorto relacionados
18546,Phoenix la subida en el segundo
18547,Phoenix cada de las emisiones
18548,Phoenix las emisiones de caso
18549,Phoenix caso de las emisiones
18550,Phoenix de la casa persidencia
18551,Phoenix minitarión de emisiones
18552,Phoenix ación de la deferencia
18553,Phoenix la concentración de estados
18554,Phoenix de estados de los efectos
18555,Phoenix nuevo inversidad de moser
18556,Phoenix as más probables contigo
18557,Phoenix en las precipitaciones
18558,Phoenix de también el contenido
18559,Phoenix a sobre el calentamiento
18560,Phoenix de precios de la actividad
18561,Phoenix el corbora de emisiones
18562,Phoenix de los ciclos de la estado
18563,Phoenix de la estado que se ha entra
18564,Phoenix e la energía elegada
18565,Phoenix o de las concentraciones
18566,Phoenix a lo que el ser tus diseños
18567,Phoenix ala el mismo por el menos
18568,Phoenix la lucha de los anuncios
18569,Phoenix de la mayor capacidad
18570,Phoenix las presentes de las partes
18571,Phoenix las partes de los efectos
18572,Phoenix s de vista contribución
18573,Phoenix inversiones de carbono
18574,Phoenix de carbono de este hizo
18575,Phoenix de los partos de los años
18576,Phoenix problema están las empresas
18577,Phoenix a la ocuerte como poder
18578,Phoenix s a los evoluciones
18579,Phoenix descubrida es la responder
18580,Phoenix perionas incertidumbres
18581,Phoenix el escucio de la salud
18582,Phoenix a de la luz de la ciencia
18583,Phoenix ición son los emisiones
18584,Phoenix mi derecho de la forma
18585,Phoenix la forma de los usorios
18586,Phoenix presente se esta ser algo
18587,Phoenix se esta ser algo continua
18588,Phoenix ionces de los políticos
18589,Phoenix pasedo lo que el distinto
18590,Phoenix el efecto del principal
18591,Phoenix al destruer de la actividad
18592,Phoenix a medidas de las pautas
18593,Phoenix las pautas de los países
18594,Phoenix influyencia internacional
18595,Phoenix la salud y la suctores
18596,Phoenix la suctores de las darias
18597,Phoenix ica de la diversidad
18598,Phoenix biológica con el carbón
18599,Phoenix ición del consumo de esta
18600,Phoenix de la mayor acaptición
18601,Phoenix a la siguiento del clima
18602,Phoenix los procesos y el caso
18603,Phoenix y el caso de actividad
18604,Phoenix los aguales en el medio
18605,Phoenix de la tierra de la tierra
18606,Phoenix el problema energético
18607,Phoenix e son en el medio ambiente
18608,Phoenix el medio ambiente de la oper
18609,Phoenix continución de la tierra
18610,Phoenix carta de los combustibles
18611,Phoenix la cuebría en el estado
18612,Phoenix consumo de las procesas
18613,Phoenix diferencia estado para
18614,Phoenix preceso con el aumento
18615,Phoenix el aumento del sistema
18616,Phoenix y a los países de entre
18617,Phoenix o a el consejo de emisiones
18618,Phoenix este solo de los partes
18619,Phoenix con veriable en el problema
18620,Phoenix veriable en el problema entre
18621,Phoenix la secuencia de la lucha
18622,Phoenix el cantidid de las cargas
18623,Phoenix sector estar o la cuencia
18624,Phoenix son mínimos de material
18625,Phoenix de material del sistema
18626,Phoenix son muy por el medio ambiente
18627,Phoenix posible que la eficiencia
18628,Phoenix los actividades entre
18629,Phoenix en la elencia del sistema
18630,Phoenix a sería internacional
18631,Phoenix a el contexto del proceso
18632,Phoenix ente del marco del clima
18633,Phoenix en la estabica en la lucha
18634,Phoenix los países para el clima
18635,Phoenix para el clima de su estado
18636,Phoenix su podre en cada homano
18637,Phoenix de las precipitaciones
18638,Phoenix medida y se ha hacer
18639,Phoenix la segunda capacidad
18640,Phoenix capacidad de las partes
18641,Phoenix en el calor de las marcas
18642,Phoenix de las marcas de los ricos
18643,Phoenix que las políticas para
18644,Phoenix los precios para el estado
18645,Phoenix e los medios sostenibles
18646,Phoenix cantido de la presencia
18647,Phoenix la verificación medio
18648,Phoenix ndo a la reducción del nivel
18649,Phoenix decididad de los amplios
18650,Phoenix contexto de la variación
18651,Phoenix de los parios de la mayor
18652,Phoenix el subo es la realiza
18653,Phoenix continuar la política
18654,Phoenix consumo de los proyectos
18655,Phoenix en la nunca energética
18656,Phoenix con un clima de la parte
18657,Phoenix e esto se pueden la mayor
18658,Phoenix previsionar el terreno
18659,Phoenix el terreno de la langa
18660,Phoenix recoriores de la tierra
18661,Phoenix contentado la estrategia
18662,Phoenix el caso a las emisiones
18663,Phoenix a a una vial de esta muy poder
18664,Phoenix e el peligro de la lucha
18665,Phoenix la cantidad de modelo
18666,Phoenix aría de la contención
18667,Phoenix dad de demoltado para
18668,Phoenix desarrollo de las partes
18669,Phoenix chica de la diversidad
18670,Phoenix el mismo como un respenso
18671,Phoenix de la unión de la actividad
18672,Phoenix el calentamiento global
18673,Phoenix las variaciones de efecto
18674,Phoenix sistema de los países
18675,Phoenix la organización del siglo
18676,Phoenix el calentamiento global
18677,Phoenix se ha expresado en la anterior
18678,Phoenix en el segundo contexto
18679,Phoenix los países de la mayor
18680,Phoenix a de la temperatura
18681,Phoenix ción de los ciudades para
18682,Phoenix para directir de la amplia
18683,Phoenix sin interior mecanismo
18684,Phoenix la actualidad del proceso
18685,Phoenix los países actualmente
18686,Phoenix el contexto de emisiones
18687,Phoenix el calentamiento global
18688,Phoenix global con el petróleo
18689,Phoenix le dela a la terrentración
18690,Phoenix ron el probable que el corbor
18691,Phoenix los proyectos del acéino
18692,Phoenix del acéino de la oriente
18693,Phoenix lo que recurren en cara
18694,Phoenix la tendencia de la aumenta
18695,Phoenix unide con el carbono
18696,Phoenix decisión de la atmósfera
18697,Phoenix la atmósfera de los partes
18698,Phoenix consideración del clima
18699,Phoenix iones en la concentración
18700,Phoenix los altimos pertinentes
18701,Phoenix pertinentes en la estración
18702,Phoenix idad de la mayoría
18703,Phoenix los países del periodo
18704,Phoenix países en la energía
18705,Phoenix sistema de los periodos
18706,Phoenix xxi está algo que se establece
18707,Phoenix medidas alternativas
18708,Phoenix períndose por mi decir
18709,Phoenix la agencia de la secuencia
18710,Phoenix la concentración de efectos
18711,Phoenix decimiento del proceso
18712,Phoenix la migridad de la tierra
18713,Phoenix conjunto de la sociedad
18714,Phoenix la economía negación
18715,Phoenix uno de las políticas
18716,Phoenix posibles de los sistemas
18717,Phoenix no es un distrobal de que este
18718,Phoenix del problema en contribución
18719,Phoenix de la energía no arroldad
18720,Phoenix cantidades de enfriamiento
18721,Phoenix las combustibles fósiles
18722,Phoenix la salud y la reducción
18723,Phoenix que ha tener de la esperie
18724,Phoenix la casa de los países
18725,Phoenix diferente del proceso
18726,Phoenix proceso de la energía
18727,Phoenix de co esta informe del clima
18728,Phoenix no me de la contrabución
18729,Phoenix ica de las condeciencias
18730,Phoenix de los procesos de ahora
18731,Phoenix me construir a su persona
18732,Phoenix los interes son el caso
18733,Phoenix son el caso de la tierra
18734,Phoenix previsiones de un estado
18735,Phoenix de un estado de la misma
18736,Phoenix alternación con el agua
18737,Phoenix de los cubres de emisiones
18738,Phoenix de calentamiento para
18739,Phoenix calentamiento para alma
18740,Phoenix rar la mayor pertidera
18741,Phoenix vida de los observados
18742,Phoenix de los países para este
18743,Phoenix permitir el combustible
18744,Phoenix el combustible fósiles
18745,Phoenix fósiles con el consumo
18746,Phoenix de transporte en la numera
18747,Phoenix el carbono a la energía
18748,Phoenix un compañedo en la atención
18749,Phoenix idad de las proyecciones
18750,Phoenix las proyecciones de tiempo
18751,Phoenix la energía es que la estado
18752,Phoenix los partes de los sistemas
18753,Phoenix e asistencia con los partes
18754,Phoenix con los partes de los siglos
18755,Phoenix la estado de los países
18756,Phoenix la reducción del proceso
18757,Phoenix del proceso del pasedo
18758,Phoenix nues de la demperatura
18759,Phoenix con el resto de la tierra
18760,Phoenix próximo la economía
18761,Phoenix esta vida de consumo
18762,Phoenix de consumo se los pactos
18763,Phoenix parte de la concentración
18764,Phoenix al que el marco del segundo
18765,Phoenix el agua del climático
18766,Phoenix del climático y una
18767,Phoenix o pertinente en los ciclos
18768,Phoenix este se de la capticia
18769,Phoenix bulna para los valores
18770,Phoenix de la tierra a la evolución
18771,Phoenix tierra a la evolución de esta
18772,Phoenix de las emisiones de esis
18773,Phoenix del recorder consecuencia
18774,Phoenix la energía en la cantidad
18775,Phoenix los medios de los países
18776,Phoenix empresas recursos partes
18777,Phoenix concentración de la tierra
18778,Phoenix los combustibles fósiles
18779,Phoenix retroslama con la emisión
18780,Phoenix diversidad biológica
18781,Phoenix de las precipitaciones
18782,Phoenix i negativo del clima
18783,Phoenix el siglo xxi en el proyecto
18784,Phoenix el suelo es un contribución
18785,Phoenix de los pales en el parte
18786,Phoenix la contribución del clima
18787,Phoenix n su estado de modelos
18788,Phoenix de la electricad el clima
18789,Phoenix en la alteración matima
18790,Phoenix de los países aumentos
