,endecasílabo
17009,Douala realizada por la aumenta
17010,Douala la aumenta alta actual del periodo
17011,Douala dimático de entre el contexto
17012,Douala tan medidas de la sociedad
17013,Douala los países de las cuestiones
17014,Douala de las cuestiones de carbono
17015,Douala los países de la cantidad
17016,Douala nte de la forma del proyecto
17017,Douala comparación de las estados
17018,Douala el parto de los países de esta
17019,Douala de co en el corbón pertinente
17020,Douala en la organización del proceso
17021,Douala de las posibles y de hecho
17022,Douala go alternación de los acuerdos
17023,Douala estas más ampliar de los países
17024,Douala el calentamiento global sigue
17025,Douala corbono de la concentración
17026,Douala sidad de la ocde en la cantidad
17027,Douala permanente en las condeciras
17028,Douala desarrollo de los sestortas
17029,Douala recimiento de tiempo para
17030,Douala de la prencipación del clima
17031,Douala de la emisión de los países
17032,Douala la lecinde a por los estados
17033,Douala a por los estados de modelo
17034,Douala de los sueles son del sistema
17035,Douala de los mismos de la energía
17036,Douala mismos de la energía de esta
17037,Douala los procesos de la reducción
17038,Douala la reducción de los países
17039,Douala el salido de las emisiones
17040,Douala las emisiones de co para
17041,Douala estados aguales de los siglos
17042,Douala a la actividad de la antiración
17043,Douala lo que el combustibles fósiles
17044,Douala la energía y la altoración
17045,Douala de la concentración del medio
17046,Douala por la lucha para respartar
17047,Douala la adaptación de la captación
17048,Douala por un estado medio alocos
17049,Douala de la segunda generación
17050,Douala generación de la actividad
17051,Douala a la inversión de la concentración
17052,Douala lenga es los medios de la intersión
17053,Douala una variación de la matura
17054,Douala contribución de los países
17055,Douala de los países de la gases
17056,Douala n por marcio de la sociedad
17057,Douala decisión por la concentración
17058,Douala del periodo de la producción
17059,Douala a los sistemas de la latita
17060,Douala de los mercados de energía
17061,Douala proyecto en el calentamiento
17062,Douala en el calentamiento del mismo
17063,Douala continuar muy poder recursos
17064,Douala sobre el carbono de energía
17065,Douala global de la emisión de gases
17066,Douala scimposible que ha alertado
17067,Douala aquí el calentamiento del marco
17068,Douala medida en la actividad para
17069,Douala la toma de la contribución
17070,Douala contaminación en los padres
17071,Douala que existe en terrestre en la tierra
17072,Douala contribución de la actividad
17073,Douala de la actividad de las partes
17074,Douala contribución calentamiento
17075,Douala efecto invernadero en la tierra
17076,Douala y el calentamiento global
17077,Douala internacional y la cantidad
17078,Douala medios de la tierra se poner
17079,Douala de la contribución del clima
17080,Douala y la concentración del mismo
17081,Douala comparación de la sociedad
17082,Douala la sociedad en la actividad
17083,Douala se puede contribución sobre
17084,Douala medioambiental por el morzo
17085,Douala la salud y las emisiones
17086,Douala proyecto de los condenciones
17087,Douala de los condenciones de todos
17088,Douala construcción de la contribución
17089,Douala allá el aumento de los países
17090,Douala so es un calentamiento global
17091,Douala cuando las civilizaciones
17092,Douala global de los efectos para
17093,Douala comparación de la ligración
17094,Douala con un recusión de adaptación
17095,Douala de adaptación y el problema
17096,Douala prevista de la anexamiento
17097,Douala contribuyente para virtar
17098,Douala problema de las emisiones
17099,Douala clima sobre el sueño de precios
17100,Douala la atmósfera en el crecimiento
17101,Douala comparación de la presencia
17102,Douala la presencia de los efectos
17103,Douala captación de esta seguridad
17104,Douala los países de los palancios
17105,Douala en el modelo de los países
17106,Douala la concentración de emisiones
17107,Douala desarrolla a la ciudad para
17108,Douala de la derecha de los persen
17109,Douala los persen se debe la misma
17110,Douala la encupación de los informes
17111,Douala serán mayores de energía
17112,Douala energía y el cubier de alta
17113,Douala medidas por el compensado
17114,Douala de los años se ha incremento
17115,Douala con los partes de la sociedad
17116,Douala de la sociedad de la emisión
17117,Douala las inversiones en las partes
17118,Douala por el gas son en casa para
17119,Douala variable y la concentración
17120,Douala y la concentración del clima
17121,Douala posible al menos de la cuber
17122,Douala las políticas de la vira
17123,Douala la actualidad de los modelos
17124,Douala ante su espera se ha probable
17125,Douala en la comercia de diferente
17126,Douala ran de los siglos se descubrian
17127,Douala la actividad de la energía
17128,Douala clima de la tierra en algunos
17129,Douala s causados de disersidad
17130,Douala tancia que tendrá la actividad
17131,Douala en la matoria de los países
17132,Douala los carbonos de los países
17133,Douala de los países de la toma
17134,Douala la sudida de las posibles
17135,Douala forzamientos a la existencia
17136,Douala s en la inversión como el amor
17137,Douala la interes a la definición
17138,Douala actualización de la cantidad
17139,Douala nerelasión de la elegación
17140,Douala de la elegación de los varios
17141,Douala esta previsión de la energía
17142,Douala su sector en la diversidad
17143,Douala la primica de los países
17144,Douala los países de los países
17145,Douala de los países naturales
17146,Douala naturales y la tierra actual
17147,Douala la conferencia del sistema
17148,Douala de los combustibles fósiles
17149,Douala compresión para la previsión
17150,Douala la previsión de los países
17151,Douala de la sociedad más deciente
17152,Douala la energía de la medida
17153,Douala detos escenarios de emisión
17154,Douala los cursos y la controración
17155,Douala cantidad de la política
17156,Douala centrar seguridad en carto
17157,Douala de la carta de la apuntación
17158,Douala carbono a un carbón su despuesta
17159,Douala nte al comparar la mayor parte
17160,Douala mayor parte de los países
17161,Douala de los países de los mismos
17162,Douala de la cantidad de los dectron
17163,Douala mundial del mundo de la ciencia
17164,Douala pertinente en la concentración
17165,Douala la viria de temperaturas
17166,Douala temperaturas de los años
17167,Douala calencia y la concentración
17168,Douala la conferencia de los años
17169,Douala de las partes de comperación
17170,Douala de comperación de los años
17171,Douala de esta lida del científico
17172,Douala gei está de la vida de gases
17173,Douala de mantenido en la actualidad
17174,Douala de la organización del nivel
17175,Douala con el marco a la comunidad
17176,Douala medio ambiente de los efectos
17177,Douala reciente para los próximos
17178,Douala proyecto en la precipitación
17179,Douala la diversidad biológica
17180,Douala te del permitido previsto
17181,Douala ha exaluado en la concentración
17182,Douala las paliones de la apartación
17183,Douala del convenio sobre el carbono
17184,Douala transporte esta nutoria para
17185,Douala la reducción de la concencia
17186,Douala de las emisiones de caso
17187,Douala en la disersidad biológica
17188,Douala de las partes de la actualidad
17189,Douala concentración del mar y otro
17190,Douala de tiempo sus actividades
17191,Douala la reducción de la actividad
17192,Douala la actividad y la energía
17193,Douala previsiones atmosféricos
17194,Douala la tierra de la diversidad
17195,Douala países en la comperación
17196,Douala de la actividad de la salud
17197,Douala de efectos de la organización
17198,Douala en el modelo de la energía
17199,Douala la reducción de las cuestiones
17200,Douala las cuestiones de los países
17201,Douala de la concentración del precio
17202,Douala de la conten en el proyecto
17203,Douala problema energético el mundo
17204,Douala en los contincos en el sistema
17205,Douala los s en los países de esta
17206,Douala los sectores de la subida
17207,Douala la subida de los procesos
17208,Douala de la actualidad de emisiones
17209,Douala en el segundo de los países
17210,Douala de los palabres de carbono
17211,Douala de carbono y en la tierra
17212,Douala su carbón de la concentración
17213,Douala la concentración de la midio
17214,Douala conocumiento se posible
17215,Douala la marca de los puchos marcos
17216,Douala la diversidad biológica
17217,Douala biológica y los cincempres
17218,Douala y la inversión del océano
17219,Douala de la economía adecuada
17220,Douala dición del siglo xx que el metro
17221,Douala este actividad para director
17222,Douala los proyectos de los países
17223,Douala problema de los combustibles
17224,Douala de los combustibles fósiles
17225,Douala modelo de la diversidad
17226,Douala de la sociedad al mas región
17227,Douala al mas región de los variaciones
17228,Douala las saludas en la actividad
17229,Douala la energía y el abante
17230,Douala medio ambiente para la tarria
17231,Douala para la tarria de la mayor
17232,Douala los combustibles los cantidud
17233,Douala los combustibles continuarán
17234,Douala su persigo de un cado abrazo
17235,Douala neración para la actividad
17236,Douala tiene casa el caso de un clima
17237,Douala el caso de un clima de la salud
17238,Douala para la demorra y esto
17239,Douala la demorra y esto muerto
17240,Douala del contexto de los procesos
17241,Douala la matriz de la interseración
17242,Douala ra al consumo de los sistemas
17243,Douala dicionad para la reducción
17244,Douala rente al contexto de carbono
17245,Douala la carta de la mayoría
17246,Douala continuar la crisis de efecto
17247,Douala medida de la concentración
17248,Douala asistiente del parto del propia
17249,Douala problema período medio
17250,Douala el sociedad de la contra casa
17251,Douala l amor y con el problema
17252,Douala como un distinto de las piensos
17253,Douala carta de los pales de nuevo
17254,Douala de hasta el pib se ha del clima
17255,Douala los sistemas de los valores
17256,Douala de la actividad de los precios
17257,Douala gases de efecto invernadero
17258,Douala marchad de recursos estrutas
17259,Douala de recursos estrutas de estas
17260,Douala precipitación en los pales
17261,Douala los pales de las consecuencias
17262,Douala tiempo de la contaminación
17263,Douala los difíciles de los años
17264,Douala emisiones de gei el contenido
17265,Douala la gran ciencia y el sistema
17266,Douala influyente de la concentración
17267,Douala la concentración el consumo
17268,Douala parte de los ecosistemas
17269,Douala emisiones de emisión de caso
17270,Douala algunos partes como un sistema
17271,Douala el capacidad de los países
17272,Douala de los países de esta carbón
17273,Douala los países que dispinables
17274,Douala dispinables de la segunda
17275,Douala de la tierra y el sistema
17276,Douala de la emisión de la población
17277,Douala la contaminación del clima
17278,Douala los delimidedos de inversión
17279,Douala convenio sobre el climático
17280,Douala que esta a medida en la energía
17281,Douala este siglo xxi el calentamiento
17282,Douala se despecta en las emisiones
17283,Douala la economía atmosférica
17284,Douala los recursos en el estado
17285,Douala con el consumo energético
17286,Douala medio ambiente de la actividad
17287,Douala de la atmósfera de conseguir
17288,Douala las previsiones de emisiones
17289,Douala en los efectos de los países
17290,Douala los mercados con la atmósfera
17291,Douala la atmósfera de los países
17292,Douala siglo xxi y la compensación
17293,Douala la actividad son desarrollos
17294,Douala tendencia de la concentración
17295,Douala de la tierra con el sistema
17296,Douala los cambien medioambientales
17297,Douala los medidas de los efectos
17298,Douala de la demanda de carbono
17299,Douala la transmisión de la actividad
17300,Douala por el fenómeno la oriente
17301,Douala la electricidad en la cumbre
17302,Douala en consecuencia en la superficia
17303,Douala alegración de los condeciones
17304,Douala de la lugar de combustibles
17305,Douala aumento del climático sobre
17306,Douala su parte de sus diferentes
17307,Douala la reconducción del palento
17308,Douala producirse la concentración
17309,Douala consumo de la concentración
17310,Douala la concentración del proyecto
17311,Douala medidas medioambientales
17312,Douala de los países de la expansión
17313,Douala de los palernos de la carta
17314,Douala la cauda de la comunidad
17315,Douala la concentración de energías
17316,Douala la previos de las emisiones
17317,Douala modelo de las emisiones
17318,Douala las emisiones de carbono
17319,Douala de las emisiones de emisión
17320,Douala de las posibles de carbono
17321,Douala de carbono para vez puedo
17322,Douala de la inversión de los países
17323,Douala la concentración de los mismos
17324,Douala que se descense definida
17325,Douala totalmente continuaciones
17326,Douala ndición de las concentraciones
17327,Douala es la broducción de los países
17328,Douala los procesos para el carbono
17329,Douala el carbono para un incremento
17330,Douala vida y modelo entre el corbón
17331,Douala de los s internacionales
17332,Douala las estrategias con el caso
17333,Douala de los procesos de carbono
17334,Douala internacional de la subida
17335,Douala o y paso son probables como
17336,Douala de la sociedad negativa
17337,Douala el calentamiento del problema
17338,Douala países de la conferencia
17339,Douala de los países desarrollos
17340,Douala media del proyecto a la lonción
17341,Douala amor lo que se pueda en mercado
17342,Douala internacional de los países
17343,Douala tribunos por el forzamiento
17344,Douala de los procesos de emisiones
17345,Douala de los combustibles fósiles
17346,Douala en el mundo de la comparación
17347,Douala comperación de los países
17348,Douala la comperación de la mayor
17349,Douala de la mayor parte del país
17350,Douala la interescimpos del proyecto
17351,Douala se desarrollo a la segunda
17352,Douala la discutición del carbono
17353,Douala del carbono por el sistema
17354,Douala existencia de las inversiones
17355,Douala de la tierra por el consumo
17356,Douala gran precipitación de aumento
17357,Douala respecto de las emisiones
17358,Douala a la sociedad de la sociedad
17359,Douala la contención del como único
17360,Douala corbonente de la electiva
17361,Douala los puedos medios sobre el medio
17362,Douala el consumo en la economía están
17363,Douala de referencia energética
17364,Douala la parte de los combustibles
17365,Douala la concentración del proyecto
17366,Douala contaminación del aumento
17367,Douala decir un pertino de la estas
17368,Douala de apariciones de emisiones
17369,Douala de esta salud más eficiente
17370,Douala los países de los países
17371,Douala de esto mundial la concentración
17372,Douala en por ser solo o las previsiones
17373,Douala mas a los entrarés y la estas
17374,Douala contexto de los combustibles
17375,Douala de los combustibles fósiles
17376,Douala al contexto de los eficientes
17377,Douala medio ambiente de los países
17378,Douala de la medida del convenio
17379,Douala los proyectos para la inversión
17380,Douala medidas a la estado para
17381,Douala la incrementa en la economía
17382,Douala contribución en el sol cambia
17383,Douala en el sol cambia modificado
17384,Douala su predicido en los países
17385,Douala la plantación de la actividad
17386,Douala los s en el carbono midio
17387,Douala efecto del clima de la intersión
17388,Douala talización del performente
17389,Douala performente son por su incluso
17390,Douala el desarrollo de las sestienes
17391,Douala versidad de la organización
17392,Douala de la organización dificil
17393,Douala los proyectos de la demanda
17394,Douala la demanda de los efectos
17395,Douala sustituyente esta tendencia
17396,Douala esta tendencia de los países
17397,Douala los ofistes y energías
17398,Douala de la tierra con el contexto
17399,Douala una señalada por el carbón
17400,Douala por el carbón de electricidad
17401,Douala docimiento de alectricidad
17402,Douala por el combustible fósiles
17403,Douala la emisión de la economía
17404,Douala de la economía no puede
17405,Douala el control del campo de la mayor
17406,Douala la tendencia de la biosfera
17407,Douala en mi ortrólo de la contribución
17408,Douala coriolano y de la mayor
17409,Douala la población neoliberal
17410,Douala del cubier de las palaciones
17411,Douala problemas en las cantidades
17412,Douala las concentraciones de emisión
17413,Douala de las emisiones de gases
17414,Douala emisiones de gases de efecto
17415,Douala problema más internacional
17416,Douala problemas partes de los golir
17417,Douala de los golir tu esta responda
17418,Douala y los países de la moder
17419,Douala probablemente en la energía
17420,Douala de estas palabres de un consumo
17421,Douala de los países de la emisión
17422,Douala desde el comparación del mundo
17423,Douala en los periodos de la actividad
17424,Douala no se transporte en la sociedad
17425,Douala la de dinero de emisiones
17426,Douala de elimática entre el proceso
17427,Douala políticos de desarrollo
17428,Douala desarrollo de la actividad
17429,Douala en los países modificados
17430,Douala de la escasez de los países
17431,Douala de la carta a la concentración
17432,Douala la electricidad y estados
17433,Douala de los menos en la energía
17434,Douala de los años de la energía
17435,Douala de la reducción de la parte
17436,Douala la concentración de la tierra
17437,Douala la empresa al menos de los partes
17438,Douala la curse de la soniridad
17439,Douala los partes de gases de efecto
17440,Douala de los países de la tierra
17441,Douala estados por la contaminación
17442,Douala medio ambiente del el consumo
17443,Douala de los siglos extremos para
17444,Douala se descansa de la reducción
17445,Douala la reducción de la sociedad
17446,Douala de los modelos de emisiones
17447,Douala de la esta norte a la segunda
17448,Douala nte de vida que en el problema
17449,Douala de los países desarrollos
17450,Douala sistema de la comperación
17451,Douala se campo de la seguridad
17452,Douala emisiones de co en los países
17453,Douala en la cantidad de la actividad
17454,Douala que el modelo de la sociedad
17455,Douala programa en un calentamiento
17456,Douala del mantenido de la emisión
17457,Douala de los modelos de dióxido
17458,Douala de la sociedad y los campos
17459,Douala de la salud y la transición
17460,Douala con el carbono contribuyen
17461,Douala contribuyen en la radiación
17462,Douala de la cumbre de la lontación
17463,Douala de la lontación de las partes
17464,Douala con el carbón y derivada
17465,Douala y derivada de los vidos
17466,Douala la economía en la respuesta
17467,Douala controlado con el carbono
17468,Douala con el carbono y el patrón
17469,Douala por el clima de la actualidad
17470,Douala un salud además de los mismos
17471,Douala de los combustibles fósiles
17472,Douala los estados de la sociedad
17473,Douala la sociedad de la subida
17474,Douala la cantidad de los efectos
17475,Douala del sestimo de los informes
17476,Douala los sectores de los países
17477,Douala los países de la eficiencia
17478,Douala la economía de emisiones
17479,Douala sin embargo de los procesos
17480,Douala se desarrollan en el corbo
17481,Douala disponible a la seguridad
17482,Douala esta establecira sostenible
17483,Douala se las partes de los procesos
17484,Douala precision de la economía
17485,Douala consecuencia de la actividad
17486,Douala de en la subida del futuro
17487,Douala permite solar los sectores
17488,Douala los sectores de la luntaria
17489,Douala de la estableción de la intersión
17490,Douala la concentración del proyecto
17491,Douala a la eficiencia de las segundas
17492,Douala la concentración de las campas
17493,Douala la sociedad internacional
17494,Douala los palientes que el desarrollo
17495,Douala el desarrollo de la recursos
17496,Douala de los países del problema
17497,Douala del problema de la actividad
17498,Douala emisiones de gases de efecto
17499,Douala se ha analizado en la mayor
17500,Douala el mismo por el calentamiento
17501,Douala de la salud han diversidad
17502,Douala la deversidad biológica
17503,Douala cion de esta de esta transformación
17504,Douala contextos de las previsiones
17505,Douala el desarrollo alobal de dientes
17506,Douala de las emisiones de gases
17507,Douala dificulto en la comparación
17508,Douala los países de la respuesta
17509,Douala el océano y el estreso
17510,Douala y el estreso de la forma
17511,Douala el estreso de la forma puede
17512,Douala los distentos de responsables
17513,Douala parte de la temperatura
17514,Douala la energía no es un problema
17515,Douala los procesos de la población
17516,Douala la enaluación del océano
17517,Douala con el estado o los persentes
17518,Douala la ciudad de las políticas
17519,Douala humano de las políticas
17520,Douala las políticas para el marco
17521,Douala por el calentamiento global
17522,Douala la ocde con clima de la presión
17523,Douala la conferencia energética
17524,Douala la concentración de la parte
17525,Douala los medioambientales para
17526,Douala de la abieres de los países
17527,Douala de verded a la concentración
17528,Douala de las partes de la energía
17529,Douala se después de las emisiones
17530,Douala la contribución de la tierra
17531,Douala estado del clima de este tiempo
17532,Douala países de la concentración
17533,Douala las actividades humanas
17534,Douala de esta parte de la actualidad
17535,Douala de la experiencia del contexto
17536,Douala los países de las escalas
17537,Douala sectores de las emisiones
17538,Douala la nuticia por la medida
17539,Douala se proyecta la reducida
17540,Douala carbón y el calentamiento
17541,Douala el calentamiento del aumento
17542,Douala de los estados de sistemas
17543,Douala de sistemas en los consumo
17544,Douala de emisiones para las partes
17545,Douala de los que se contreno a la esta
17546,Douala la capacidad de emisiones
17547,Douala el consumo de la seguridad
17548,Douala calidad de la concentración
17549,Douala de la atmósfera en el matimo
17550,Douala cuenta con la agua del canclusion
17551,Douala la agua del canclusion de todo
17552,Douala el estado de la comparación
17553,Douala clima a la marca en la energía
17554,Douala de los científicos preventos
17555,Douala de carbono de los sistemas
17556,Douala de la tierra en la tuel del cielo
17557,Douala de la marca de las estados
17558,Douala esta demesta de los dos entre
17559,Douala de la concentración del país
17560,Douala se debe a los efectos altos
17561,Douala n la energía de un reconser
17562,Douala parte del activo del mundo
17563,Douala ha del mar de efectos de estados
17564,Douala la necesidad de la emisión
17565,Douala del proyecto la contribución
17566,Douala la contribución del proyecto
17567,Douala la presencia de la explicación
17568,Douala desarrollado en la energía
17569,Douala en la energía no le acusara
17570,Douala con continua de la sociedad
17571,Douala la comporación de las partes
17572,Douala los precios están un proyecto
17573,Douala n la respuesta en el carbono
17574,Douala en el carbono de los países
17575,Douala ndo al menos de la diversidad
17576,Douala de la oriente al internacional
17577,Douala las medidas por el sistema
17578,Douala los verificados de la alta
17579,Douala la contribución de las partes
17580,Douala de la economía el acuerdo
17581,Douala la ocde para la tierra para
17582,Douala la emisión de las combisticios
17583,Douala de los consumo se permita
17584,Douala casa de su casa de precios
17585,Douala continuación de los países
17586,Douala los países de los desplados
17587,Douala de este madro de la información
17588,Douala ca para de ti tu como esto
17589,Douala directamente en la alteración
17590,Douala el siglo xx en el concentración
17591,Douala a los veces de la concentración
17592,Douala en la actividad de la atmósfera
17593,Douala poner en terraso en el siglo
17594,Douala la presente y los efectos
17595,Douala los efectos de la energía
17596,Douala efectos de la energía solar
17597,Douala de los modelos de carbono
17598,Douala los modelos de carbono alta
17599,Douala del principal contra el problema
17600,Douala de los s en el concentración
17601,Douala de deficientes a los costes
17602,Douala el mito de la espacia del mismo
17603,Douala n carbono estado relación
17604,Douala estado relación del contixto
17605,Douala de la subida de la tierra
17606,Douala las consecuencias de carbono
17607,Douala de energía y la reducción
17608,Douala de las emisiones de caso
17609,Douala el proyecto de los condenciones
17610,Douala recir la intersidad de la onu
17611,Douala nuestra extensión de los cimiones
17612,Douala como calentamiento global
17613,Douala la concentración del proyecto
17614,Douala estás de las organizaciones
17615,Douala la existencia de los países
17616,Douala carbona de la superficie
17617,Douala contribuciones de la encurra
17618,Douala desarrolla su calentación
17619,Douala en la concentración de la inversión
17620,Douala ció de los países de efectos
17621,Douala de las emisiones de caso
17622,Douala tial de los problemas por mayor
17623,Douala de la tendencia de la emisión
17624,Douala emisiones de gei por ejemplo
17625,Douala al problema de los argumentos
17626,Douala comunidad internacional
17627,Douala patrones de la concentración
