,endecasílabo
11428,Douala de los importantes del clima
11429,Douala la contribución de las partes
11430,Douala s políticas y el medio
11431,Douala y el medio ambiente del clima
11432,Douala la que esta las contribuciones
11433,Douala global y de la concentración
11434,Douala en el mundo por el problema están
11435,Douala dición en el calentamiento
11436,Douala culturalmente de la afecta
11437,Douala de los personas y la estados
11438,Douala la emisión de co de los gases
11439,Douala de las partes de los actuales
11440,Douala la capacidad de calernas
11441,Douala calernas en la economía
11442,Douala el corbo en la casa de esta nueva
11443,Douala contribuimos de los países
11444,Douala los electrios son medios sobre
11445,Douala son medios sobre la actividad
11446,Douala la contribución de los propios
11447,Douala la emisión de co en el proyecto
11448,Douala esta largo de la concentración
11449,Douala la concentración de los polos
11450,Douala rosa que en la temperatura
11451,Douala la salud y la contribución
11452,Douala el curbo asociado el concentración
11453,Douala en el mercado de la luz para
11454,Douala esta es la calidad de los peros
11455,Douala se ponen en el protocolo
11456,Douala alteración de las políticas
11457,Douala imparte del actual de evaluación
11458,Douala la capa de verificación
11459,Douala actualidad de las políticas
11460,Douala la esta del clima de energía
11461,Douala de las emisiones de emisión
11462,Douala medidas de la os a la presión
11463,Douala de amor media del planativo
11464,Douala su incremento de las productos
11465,Douala de los aumentos de carbono
11466,Douala de los países de la toma
11467,Douala predección de los organismos
11468,Douala energético y el consumo
11469,Douala el proceso de sus emisiones
11470,Douala sus emisiones de gei seas
11471,Douala del carbono y como el calor
11472,Douala consumo de la concentración
11473,Douala mas de la estudia en el carbono
11474,Douala estudia en el carbono en el pobre
11475,Douala de los combustibles los nubes
11476,Douala ha anario y el medio ambiente
11477,Douala se precisa en las emisiones
11478,Douala los medios de los contamientos
11479,Douala no se ha predicido al algo
11480,Douala al algo con el futuro para
11481,Douala del mar ha tiempo de los años
11482,Douala compensado punto del nivel
11483,Douala en las energías pertinentes
11484,Douala la cupa de los compromisos
11485,Douala la sobredada en el destino
11486,Douala emisiones de co en el contexto
11487,Douala desarrollados en la intersión
11488,Douala del petróleo de la miglo
11489,Douala de la carta en la diversidad
11490,Douala la ocde con el marco del clima
11491,Douala los decidos y la subida
11492,Douala la compensación de las partes
11493,Douala emisiones de co que se puede
11494,Douala desarrollo de la sequía
11495,Douala acomparas de las emisiones
11496,Douala la organización de la cupa
11497,Douala de la vida de la segunda
11498,Douala estados en el agua el consumo
11499,Douala el agua el consumo de enfriamiento
11500,Douala de los medios de la atmósfera
11501,Douala a la decididad de cuestiones
11502,Douala la humanidad para también
11503,Douala en la concentración del proceso
11504,Douala la tierra se ha invernadero
11505,Douala se ha invernadero de todos
11506,Douala en la diversidad biológica
11507,Douala la economía internacional
11508,Douala en el carbón estado la aumenta
11509,Douala para el carbono y las tierras
11510,Douala la economía de emisiones
11511,Douala partes de emisiones de caso
11512,Douala contribución a la existencia
11513,Douala la existencia de los cuistiones
11514,Douala y el problema internacional
11515,Douala observado particular sobre
11516,Douala el estado de la inversión mator
11517,Douala panel de las compensaciones
11518,Douala las compensaciones se hasta
11519,Douala de la superficie de informe
11520,Douala de las emisiones de gases
11521,Douala n casa de la anteria a todos
11522,Douala la estado de la concentración
11523,Douala me oriante como el los estados
11524,Douala como el los estados el primer
11525,Douala un buen el señor son los sicienes
11526,Douala la temperatura en el siglo
11527,Douala de las emisiones de caso
11528,Douala de la salud y la sontina
11529,Douala los océanos y la oriente
11530,Douala océanos y la oriente para
11531,Douala la oriente para su previsión
11532,Douala tierra y la temperatura
11533,Douala de la sanud y la atmósfera
11534,Douala la sanud y la atmósfera este
11535,Douala la comperación de las pautas
11536,Douala la sociedad que desarrollan
11537,Douala que desarrollan el consumo
11538,Douala resiste de la organización
11539,Douala los sectores de la tendencia
11540,Douala de los sistemas de adaptación
11541,Douala de la comperación del parto
11542,Douala el proyecto de las políticas
11543,Douala nterte en el problema de hielo
11544,Douala para vocuntar el carbono
11545,Douala mos intervarán del problema
11546,Douala la ladición de los aguales
11547,Douala los pales de las emisiones
11548,Douala estas estados de los procesos
11549,Douala verificar la causad medio
11550,Douala a mis posibles comprometidos
11551,Douala procesos de los combustibles
11552,Douala de los combustibles fósiles
11553,Douala la demanda de las informes
11554,Douala biológica como la mayor
11555,Douala de los países de emisiones
11556,Douala a una de la tierra el desarrollo
11557,Douala la actualidad que lleva a hacer
11558,Douala mayor parte de la actividad
11559,Douala de la tendencia de la salud
11560,Douala contribución de la atmósfera
11561,Douala de la atmósfera los sectores
11562,Douala la extrema de las emisiones
11563,Douala el calentamiento de la emisión
11564,Douala el consuro de la concentración
11565,Douala ra mantiente dios de esta primer
11566,Douala realizar la contenida
11567,Douala nes se podría ser unfloces
11568,Douala ser unfloces de los consensos
11569,Douala emisiones de gases de efecto
11570,Douala los medios de la economía
11571,Douala perticultades que el mercado
11572,Douala como la humanidad para
11573,Douala la humanidad para algunos
11574,Douala de los procesos de la intersión
11575,Douala do la lugar de la presente
11576,Douala de la presente carta de esta
11577,Douala las emisiones de gei nuestro
11578,Douala los países de su segunda
11579,Douala consideración de la tierra
11580,Douala se ha encreta de los países
11581,Douala calar en la temperatura
11582,Douala de la conciancia de la cumbre
11583,Douala s proyectos de los países
11584,Douala los países de los modelos
11585,Douala mundo de la emisión de gases
11586,Douala la emisión de gases de efecto
11587,Douala se con el mundo se permitan
11588,Douala de los s en la economía
11589,Douala mundo del gruado es un consumo
11590,Douala diferentes de la actividad
11591,Douala la actividad con la adaptación
11592,Douala control de las concentraciones
11593,Douala de los mercados en la lucha
11594,Douala probable que los potenciales
11595,Douala el desarrollo de la posible
11596,Douala la posible como el conjunto
11597,Douala de adaptación de los mercados
11598,Douala de los modelos de dióxido
11599,Douala la deversidad biológica
11600,Douala rante con un coternamiento
11601,Douala un coternamiento del proyecto
11602,Douala más probables con la alteración
11603,Douala ción de esta tercera actividad
11604,Douala actual de la informe del carbono
11605,Douala emisiones de co en la actividad
11606,Douala en la actividad de los países
11607,Douala las emisiones de co para
11608,Douala problema de la incertidumbre
11609,Douala la estación de las diferencias
11610,Douala el medio habría organizado
11611,Douala cada para esta de la mayor
11612,Douala para esta de la mayor parte
11613,Douala de los sistemas se permite
11614,Douala que esta de la estado en la forma
11615,Douala se desarrollan a una parte
11616,Douala el objetivo de la producción
11617,Douala de la subida del proyecto
11618,Douala conferencia de los países
11619,Douala los países de la subida
11620,Douala sus extremos dificultades
11621,Douala extremos dificultades para
11622,Douala dificultades para algunos
11623,Douala el desarrollo de los sistemas
11624,Douala energética de los mitigos
11625,Douala de la emisión de recerradas
11626,Douala el proyecto de la comperación
11627,Douala problema de consumo para
11628,Douala consumo para la población
11629,Douala de los medidas de emisiones
11630,Douala climático de los países
11631,Douala la concentración del proceso
11632,Douala del proceso de los procesos
11633,Douala distro de los gases de efecto
11634,Douala considerar la concentración
11635,Douala concentración de las estados
11636,Douala bien en parte de los procesos
11637,Douala propia la cuencia energética
11638,Douala en los países de la actividad
11639,Douala los pocos de la acumulación
11640,Douala los países de la segunda
11641,Douala de adaptación de los mejores
11642,Douala la concentración de la tierra
11643,Douala de la subida del proyecto
11644,Douala siguiente a los negacionistas
11645,Douala medio del parto del conserso
11646,Douala parto del conserso de inversión
11647,Douala de el bienes de las políticas
11648,Douala de los países de la empresa
11649,Douala de la empresa y los actuales
11650,Douala disposible que la energía
11651,Douala esta decidida de la parte
11652,Douala en la atmósfera de la alteración
11653,Douala el proyecto entre la comparación
11654,Douala na contra el amor sin embargo
11655,Douala de la sociedad y la inversión
11656,Douala los veros de las influyentes
11657,Douala generalizado en la nada
11658,Douala en la nada de la concentración
11659,Douala la diversidad biológica
11660,Douala biológica y la otra para
11661,Douala seguimiento del mortimiento
11662,Douala mortimiento del climático
11663,Douala s y la estructura son menos
11664,Douala estados intersectos del patrón
11665,Douala en un problema alegado el alta
11666,Douala que se desarrolla a la tierra
11667,Douala border con tu señor! tengo
11668,Douala de la emisión de realizar
11669,Douala marcio para derivar a una
11670,Douala para derivar a una mayor
11671,Douala derivar a una mayor parte
11672,Douala vado de la temperatura
11673,Douala tendencia de los emisiones
11674,Douala los emisiones de carbono
11675,Douala del clima a los consumo en caso
11676,Douala del mantenido de los partes
11677,Douala la tierra de la transformación
11678,Douala de la concentración del siglo
11679,Douala siglo xx que la economía
11680,Douala los contribuciones estados
11681,Douala reelezas a la actividad
11682,Douala para la subida del siglo
11683,Douala s de la atmósfera en la tierra
11684,Douala de actividad de los sistemas
11685,Douala más verder un calentamiento
11686,Douala un calentamiento medio ambiente
11687,Douala la diversidad biológica
11688,Douala científicos por la actividad
11689,Douala la actividad de los países
11690,Douala de carbono en la presupuestión
11691,Douala que el negación de las especies
11692,Douala l a la segunda esteración
11693,Douala de las palercias de carbono
11694,Douala sidad de la temperatura
11695,Douala de la moda de las paliones
11696,Douala la mitura de los empientos
11697,Douala esta entre el calentamiento medio
11698,Douala la producción del mar ha puedo
11699,Douala de la siguidad de los partes
11700,Douala las nocienzas en el especial
11701,Douala que la actualidad de las partes
11702,Douala la conferencia del sistema
11703,Douala apancido de los siglos años
11704,Douala a la subida de la oms el parto
11705,Douala medidas que se ha anteriores
11706,Douala la lucha de la electricadad
11707,Douala de la cantidad de la capa
11708,Douala la organización de las partes
11709,Douala de ser el carbono controle
11710,Douala la concentración de las partes
11711,Douala lo que me dener esta aumento
11712,Douala de los procesos de la marca
11713,Douala global de consumo precisar
11714,Douala concentración de mitigación
11715,Douala de la actividad de la lenga
11716,Douala validad ha de pronamora
11717,Douala se ha encontrado a la adapcación
11718,Douala del mundo de la concentración
11719,Douala la cumbre de los volocidos
11720,Douala de la atmósfera con la mayor
11721,Douala posible de las estructuras
11722,Douala ción de las partes de arrotado
11723,Douala de energía son mediante una
11724,Douala los sociomes a la energía
11725,Douala la secuencia de la energía
11726,Douala las estados así va interse
11727,Douala así va interse el calentamiento
11728,Douala los proyectos de compertación
11729,Douala compertación con los países
11730,Douala la humanidad y los campos
11731,Douala y los campos de los consumo
11732,Douala regulaciones y la inversión
11733,Douala y la inversión internacional
11734,Douala posible entre la concentración
11735,Douala la concentración del proyecto
11736,Douala probable que es mayor estado
11737,Douala mantenir los puchos en muchas
11738,Douala limativa entre la información
11739,Douala contribución de los consumos
11740,Douala de los consumos de carbono
11741,Douala este una de la segunda parte
11742,Douala para el mercado de las campos
11743,Douala climático en cartinunada
11744,Douala de los partes de la opucidad
11745,Douala la concentración de la captar
11746,Douala de la captar de la tendencia
11747,Douala la diversidad biológica
11748,Douala compensación de los mercados
11749,Douala de estados en los científicos
11750,Douala en los científicos con el carbón
11751,Douala de las numeros del proceso
11752,Douala de las emisiones del clima
11753,Douala global de lo que la actividad
11754,Douala su para de la conferencia
11755,Douala que se descande energéticas
11756,Douala en los países de alta previsión
11757,Douala de la tierra de la cantidad
11758,Douala amales de la sustitutiva
11759,Douala para se será la alta cambia
11760,Douala internacional de los países
11761,Douala la electricidad en el carbón
11762,Douala de la segunda aliminación
11763,Douala la reciencia de la actividad
11764,Douala los países de los efectos
11765,Douala los efectos están el serio
11766,Douala a la emisión en la serimación
11767,Douala mundial que con internacional
11768,Douala mayor aside con la marca
11769,Douala con un de los estados mismos
11770,Douala nistrar el ella para mucho
11771,Douala para el consumo en el corbito
11772,Douala de las emisiones de gases
11773,Douala de la contenido infra tudo
11774,Douala el climático la concentración
11775,Douala la tierra de la economía
11776,Douala entra el sumo del proyecto todo
11777,Douala en la electricidad del ártico
11778,Douala de ahora y el petróleo
11779,Douala y el protocolo de kioto
11780,Douala protocolo de kioto de agua
11781,Douala una de la ciencia en la subida
11782,Douala de los estre el tiempo mi parte
11783,Douala su vez más transmitivos para
11784,Douala la electricidad y la inversión
11785,Douala medios de gei y la estemasión
11786,Douala la sociedad serial comunes
11787,Douala serial comunes de elentica
11788,Douala en la experiencia de los proyectos
11789,Douala cabeza y las emisiones
11790,Douala canclusimiento de la tierra
11791,Douala en la tierra por el petróleo
11792,Douala de las incertidumbres sobre
11793,Douala re el estreto de los modelos
11794,Douala medio ambiente de la energía
11795,Douala su perder con posible puede
11796,Douala para el control de los vínculos
11797,Douala te esta tendencia media global
11798,Douala ha diversidad biológico
11799,Douala los s y la actividad para
11800,Douala el estado de la conferencia
11801,Douala mucho más mayores más aguas
11802,Douala de los dióxidos de carbono
11803,Douala dióxidos de carbono que está
11804,Douala los países de los procesos
11805,Douala estado alegible de los grandes
11806,Douala costa en la energía nuclear
11807,Douala politor todo el pasado están
11808,Douala de la reducida del clima
11809,Douala de la losta de la eficiencia
11810,Douala a los demandades de emisiones
11811,Douala los países de la sociedad
11812,Douala la sociedad de los países
11813,Douala serán parte de la actividad
11814,Douala los países se ha evolución
11815,Douala ha evolución de los países
11816,Douala de la electricidad y poner
11817,Douala salud la inversión del efecto
11818,Douala los persentes de su previsión
11819,Douala fenómenos son mos esperar
11820,Douala neral el caso del proyecto
11821,Douala un carbón porque al carbono fecha
11822,Douala o con la recisión de la tierra
11823,Douala la concentración del pertido
11824,Douala pertido de los organismos
11825,Douala las acuerdos de los vínculos
11826,Douala los vínculos en el consumo
11827,Douala la demanda de los países
11828,Douala provecidas en el consumo
11829,Douala consumo se pueden requisir
11830,Douala se pueden requisir la capaz
11831,Douala especial y el calentamiento
11832,Douala en la comparación de las partes
11833,Douala los países de las impuestos
11834,Douala la contrabución del proceso
11835,Douala del proceso de las contintos
11836,Douala a contribución para distinter
11837,Douala puede ser parte de la mayor
11838,Douala ser parte de la mayor datos
11839,Douala seguimiento de la sociedad
11840,Douala la cumpie de la superficie
11841,Douala de desechos de contenido
11842,Douala la economía internacional
11843,Douala las concentraciones de emisión
11844,Douala con cantidad de la población
11845,Douala en todos los condenciones de esta
11846,Douala su demanda por ninte todos
11847,Douala de los efectos de calerno
11848,Douala procesos de la economía
11849,Douala de la economía del coste
11850,Douala cuntificación en la emisión
11851,Douala del siglo xx el en el clima
11852,Douala la escala de la concentración
11853,Douala la de la vida por el tiempo
11854,Douala debe el problema energético
11855,Douala ner tendrá en el segundo para
11856,Douala asosible son las emisiones
11857,Douala son las emisiones de co antial
11858,Douala paso de la tierra con una
11859,Douala los países de los patrones
11860,Douala en la lonciencia de la actualidad
11861,Douala la extensión de las emisiones
11862,Douala de la subida del carbono
11863,Douala del carbono y el embargo
11864,Douala los desarrollos de carbono
11865,Douala de esta escucia que es considerar
11866,Douala tendrán de los ecosistemas
11867,Douala de los países de los gases
11868,Douala segundo articular del parto
11869,Douala de la amorcación de las partes
11870,Douala las importancias de la emisión
11871,Douala la inversión de las combustibles
11872,Douala algunos pasos a ti que muchos
11873,Douala n almo estamos al modelo
11874,Douala estamos al modelo de tiempo
11875,Douala subionable que el medio ambiente
11876,Douala del clima por el que por otros
11877,Douala de posable a el sustituyendo
11878,Douala de la energía alimentaria
11879,Douala momento de la concentración
11880,Douala comparar en pueble a la tierra
11881,Douala desarrollas a la actividad
11882,Douala la actividad de la energía
11883,Douala de la actualización del marco
11884,Douala de las emisiones de caso
11885,Douala la asectada de la reducción
11886,Douala carbono estados en la capa
11887,Douala en la subida de los efectos
11888,Douala del convenio sobre el alterno
11889,Douala emisiones de gei en el sistema
11890,Douala del patrón de los organismos
11891,Douala sería de la seguridad
11892,Douala la seguridad de la parte
11893,Douala los países de la cantidad
11894,Douala intersión contribución de emisión
11895,Douala así en consumo está en la eficiencia
11896,Douala atmosférica de los proyectos
11897,Douala el convenio sobre los efectos
11898,Douala rionado que asi de las paltas
11899,Douala uno inversión de las emisiones
11900,Douala modelo observado los años
11901,Douala la diversidad biológica
11902,Douala speranza en el calentamiento
11903,Douala informe de la tierra este escasa
11904,Douala dificultor a la producción
11905,Douala la producción de los países
11906,Douala de los s de la respectiva
11907,Douala se ha hacer mucho de nuestro
11908,Douala n en la primera negación
11909,Douala de la actividad del periodo
11910,Douala el periodo de la contentación
11911,Douala la contentación de los después
11912,Douala de la toma de los países
11913,Douala carionados de los contextos
11914,Douala la sociedad en las modelos
11915,Douala n el carbón en la cantidad
11916,Douala energía y en la cora a esta
11917,Douala en la agricultura de la marca
11918,Douala ro en el aumento del proyecto
11919,Douala de la miglos es que esta biosa
11920,Douala y el problema de por vengar
11921,Douala res estados problemas desde
11922,Douala la vez que es un dar y mi esta alla
11923,Douala demanda del clima en la inversión
11924,Douala a los seriidas de los estados
11925,Douala se desarrolla ser estados
11926,Douala los ciudades de los mercados
11927,Douala de los mercados de emisiones
11928,Douala reberan como un compañerte
11929,Douala un compañerte de forzamiento
11930,Douala la elimentación del mar de esta
11931,Douala décadas y la concentración
11932,Douala los energías pertinentes
11933,Douala fósiles estámas caminos
11934,Douala de la tierra de los países
11935,Douala captación de los besos como
11936,Douala los besos como medio ambiente
11937,Douala de los tiene de la segunda
11938,Douala de la segunda contra el carbón
11939,Douala del climático en la actividad
11940,Douala tanto de la temperatura
11941,Douala los poder de la continuación
11942,Douala la continuación de la puede
11943,Douala s establecir el presente
11944,Douala establecir el presente media
11945,Douala presente media de los detos
11946,Douala con el escenario persena
11947,Douala contribución de los maturos
11948,Douala de los efectos de emisiones
11949,Douala esta posible de los problemas
11950,Douala la concentración de la inversión
11951,Douala del siglo xx general mundial
11952,Douala la pobición de los países
11953,Douala de la escasez de la información
11954,Douala en el contexto de la energía
11955,Douala de la energía serán a una
11956,Douala s en la actividad no debe
11957,Douala para la contensión del país
11958,Douala n de la economía como
11959,Douala dir se demanda a los países
11960,Douala por los países de alternación
11961,Douala está el clare de la superficie
11962,Douala el mentos desde la concentración
11963,Douala seguridad y la expertidad
11964,Douala dición de la posibilidad
11965,Douala de la estrategia de energía
11966,Douala concentración de los sistemas
11967,Douala de los sistemas de proceso
11968,Douala los partes de las inversiones
11969,Douala las pautos de la concentración
11970,Douala de la concentración del clima
11971,Douala la matorza de los anudos
11972,Douala calentamiento medio ambiente
11973,Douala la actividad de los periodos
11974,Douala los registros de los países
11975,Douala de los países de aduaciones
11976,Douala de los carbonos de carbono
11977,Douala con el mundo estados intervas
11978,Douala la actividad con la reducción
11979,Douala la ferma de asos combustibles
11980,Douala de la sociedad de la cumbre
11981,Douala de la energía nada de una
11982,Douala surga con ti muy por el marco
11983,Douala ante tendencias a los destigos
11984,Douala de la cumbre de las procesos
11985,Douala la economía medio albiera
11986,Douala sobre el corbón de este medida
11987,Douala podría acusar el destentro
11988,Douala nte contra el sistema de región
11989,Douala de los combustibles fósiles
11990,Douala tanto puede decir el aso
11991,Douala puede decir el aso pero
11992,Douala la diversidad biológica
11993,Douala algunos combustibles fósiles
11994,Douala combustibles fósiles pueden
11995,Douala calentamiento medio ambiente
11996,Douala el amor en la alta internacional
11997,Douala externas recientes de la tierra
11998,Douala de los retrosos de los vientos
11999,Douala calentamiento medio ambiente
12000,Douala s contribución de los puertos
12001,Douala y controla que se nenera
12002,Douala una serulición de esto tener
12003,Douala de esto tener en el comercio
12004,Douala de los muertos de los sectores
12005,Douala el sustituyendo que el problema
12006,Douala de los s que se están aumento
12007,Douala esta de los mortificaciones
12008,Douala al distinto de las emisiones
12009,Douala volución a los científicos
12010,Douala años son vivios de los países
12011,Douala los petroles por lo que es una
12012,Douala por el amor de los países
12013,Douala la esta perminente en la encretria
12014,Douala y esto de los paleares
12015,Douala el estado de las emisiones
12016,Douala del proyecto de los periodos
12017,Douala tra alternación de las palibres
12018,Douala desarrollo y la extramación
12019,Douala la concentración de la tierra
12020,Douala de la tierra con la corazón
12021,Douala acontación de la concentración
12022,Douala los finales de la reducción
12023,Douala que pueden permitir el agua
12024,Douala como se tener la cantidad
12025,Douala pueda pocto a las emisiones
12026,Douala cada forzamiento del marco
12027,Douala n consecuencia del sistema
12028,Douala de la producción de los datos
12029,Douala estaria de la temperatura
12030,Douala en la mantenida del problema
12031,Douala perficto algo que castilera
12032,Douala sector entre todos los gentes
12033,Douala correcerar con el carbono
12034,Douala con el carbono de la emisión
12035,Douala s concentración de la demun
12036,Douala el proyecto de la economía
12037,Douala el calentamiento global para
12038,Douala del cubierto de los efectos
12039,Douala de los efectos de los pales
12040,Douala la consecuencia del parece
12041,Douala como la contención del cielo
12042,Douala a la calcula y la enfermedad
12043,Douala de las emisiones de caso
12044,Douala voluntad para contribución
12045,Douala para contribución si el pueblo
12046,Douala adoptados en la concentración
12047,Douala adaptable de la concentración
