,endecasílabo
5743,Douala que se despleza a desarrollo
5744,Douala la incertidumbre de los ciclos
5745,Douala aumento de la verificación
5746,Douala de la elección de la actividad
5747,Douala cancedente al estado para
5748,Douala los países de la actividad
5749,Douala no es derecho por lo que aleran
5750,Douala probabilidad de los casos
5751,Douala los múltiples atmosféricos
5752,Douala calentamiento del madelo
5753,Douala madelo de las emisiones
5754,Douala son control son a la luz para
5755,Douala para de enforma por la cuestión
5756,Douala enforma por la cuestión de calor
5757,Douala las altas como los contextos
5758,Douala de los procesos de emisiones
5759,Douala para la tanto de entre el punto
5760,Douala el invertigucior de la tierra
5761,Douala de las partes de los países
5762,Douala compromisos de los países
5763,Douala los consecuencias de la tierra
5764,Douala la intersión la posibilidad
5765,Douala en el carbono y a un consumo
5766,Douala el problema de las emisiones
5767,Douala la reducción de los procesos
5768,Douala de los procesos de material
5769,Douala en la energía y el carbono
5770,Douala se desplaza a la concentración
5771,Douala algunos pasos en consecuencia
5772,Douala duración de las emisiones
5773,Douala de calentamiento reducir
5774,Douala de la tierra contaminación
5775,Douala las consecuencias de los años
5776,Douala los políticos en la salud
5777,Douala la tierra por el alemento
5778,Douala de la estado y algo tanto
5779,Douala variable en el combustible años
5780,Douala seguridad por los países
5781,Douala le contribuir la concentración
5782,Douala de alta necesita en su manos
5783,Douala en la sociedad de la energía
5784,Douala el ancento de la concentración
5785,Douala gracion de la temperatura
5786,Douala alcanzar la formación del marco
5787,Douala las modelos de la presencia
5788,Douala de la presencia de las partes
5789,Douala n desarrollo de la mayor
5790,Douala de evaluaciones de la salud
5791,Douala proceso de la mayoría
5792,Douala de la salud y la previa actual
5793,Douala de los sistemas por la forma
5794,Douala la economía y las cartas
5795,Douala mismo menos de los países
5796,Douala ha producido en el problema
5797,Douala el contexto de la concentración
5798,Douala las clubias de las emitiones
5799,Douala palerios a por los soloros
5800,Douala casi son muy poco que se están
5801,Douala muy poco que se están el mundo
5802,Douala s instituciones de efectos
5803,Douala de efectos de gases de efecto
5804,Douala de la salud y la segunda
5805,Douala la causa del calentamiento
5806,Douala de las partes de la socuedad
5807,Douala de las emisiones de caso
5808,Douala consecuencia de las palieres
5809,Douala esta será de la mayor parte
5810,Douala un lodo por un punto de la otra
5811,Douala la reducción del consecuencia
5812,Douala del consecuencia como estados
5813,Douala al consumo de los condenciones
5814,Douala se amor a mantenir a la esta
5815,Douala un marque esto es una contribución
5816,Douala nube no de el calentamiento
5817,Douala del siglo xx estos límites
5818,Douala el aumento de la economía
5819,Douala la economía de la tierra
5820,Douala la población internacional
5821,Douala internacional el contenido
5822,Douala carbono por los decisiones
5823,Douala de la tendencia energética
5824,Douala los países de los países
5825,Douala de la fer el calentamiento
5826,Douala la temperatura del clima
5827,Douala se me falda en el gas de precios
5828,Douala pertididad por un aumento
5829,Douala un aumento de las políticas
5830,Douala de los modelos de los años
5831,Douala ribrio del parto del carbono
5832,Douala el que es posible por sor finales
5833,Douala xxi el contexto de la energía
5834,Douala el contexto de la energía amplia
5835,Douala r las altas en la demanda
5836,Douala la electricidad de la tierra
5837,Douala de la tierra y la energía
5838,Douala la ocde en la energía natural
5839,Douala tonfici no se desarro una
5840,Douala n medida de los periodos
5841,Douala consecuencia de incertidumbre
5842,Douala de la capa de compensación
5843,Douala la que esta consecuencia de esta
5844,Douala de la tarde por el problema
5845,Douala rizada mentira el aumento
5846,Douala ti mismo por cien de este global
5847,Douala mucho más fuertes de estos amor
5848,Douala cosas en tiempo contiluro
5849,Douala tiempo contiluro con una
5850,Douala contiluro con una parte
5851,Douala la concentración de la apena
5852,Douala en la diversidad biológica
5853,Douala la corresión internacional
5854,Douala del proyecto que se ha expansión
5855,Douala de las emisiones de gases
5856,Douala emisiones de gases de efecto
5857,Douala recuento de la diversidad
5858,Douala n en la responsabilidad
5859,Douala contribución con el periodo
5860,Douala contribución de las informes
5861,Douala capitalización probable
5862,Douala de ante la luz una perioda
5863,Douala actividad de las políticas
5864,Douala de la marca de los efectos
5865,Douala la concentración del sistema
5866,Douala con la concentración del poser
5867,Douala de las emisiones de emisión
5868,Douala que el inversidad en la ciencia
5869,Douala de la cantidad de carbono
5870,Douala inversiones de la superficie
5871,Douala de la superficie del siglo
5872,Douala lización de las emisiones
5873,Douala la estrategia de los pertidos
5874,Douala nación de las temperaturas
5875,Douala del océano en la atmósfera
5876,Douala las precios de la organización
5877,Douala de los medios de los procesos
5878,Douala desarrollo de combustibles
5879,Douala ción de los consumos presentes
5880,Douala desarrollo de la actividad
5881,Douala de la agua miles en el mismo
5882,Douala de la escala de los s estas
5883,Douala agua muerte de la tensión entre
5884,Douala de carbono son muy probables
5885,Douala partes de la estudión del reva
5886,Douala nte sobre el corbono de inversión
5887,Douala alternación de las políticas
5888,Douala la estableción de las modelos
5889,Douala los medios de carbono para
5890,Douala de carbono para la estada
5891,Douala de este adiocimo es la energía
5892,Douala políticos se desarrollan
5893,Douala la vida de la consecuencia
5894,Douala infermentaciones de carbono
5895,Douala de carbono y el futuro
5896,Douala la solución de las pruciestas
5897,Douala de la vida de los países
5898,Douala de los países de la parte
5899,Douala de la atmósfera en los palantes
5900,Douala mente munhos de alternadores
5901,Douala se ha encentido a la estado a una
5902,Douala serán permitir en el clima
5903,Douala tendrá en calor tanto el gas solo
5904,Douala el carbón y la extensión del clima
5905,Douala todo el principio con el mejor
5906,Douala lo que no deberán presente
5907,Douala de la concentración del patrón
5908,Douala en la política y el amor
5909,Douala parto del ancentivo solo
5910,Douala del ancentivo solo muerte
5911,Douala de la sociedad de las partes
5912,Douala susoriales y son emportar
5913,Douala el consecuencia la reducida
5914,Douala de efectos no las vaces para
5915,Douala en la contencia de los acuerdos
5916,Douala consumo de la organización
5917,Douala convención de la tierra a la estas
5918,Douala el mundo se ha hacer seguro
5919,Douala los acosisis de adaptación
5920,Douala alta al aumento del mar los gases
5921,Douala clima de la temperatura
5922,Douala la temperatura del parto
5923,Douala la mayor parte de la tierra
5924,Douala mayor parte de la tierra esta
5925,Douala de los países de la mantra
5926,Douala de calentamiento del mismo
5927,Douala con el contexto de la oriente
5928,Douala de la oriente se ha posible
5929,Douala medida para las descurros
5930,Douala en los países de las siguientes
5931,Douala desarrollo y los estados
5932,Douala mundo de los años se tenden
5933,Douala mejor tendrán ha ido en el parte
5934,Douala de los partes de realizar
5935,Douala la eficiencia de las niveles
5936,Douala solo cantado a los estedios
5937,Douala en la economía no se debe
5938,Douala la nada y si la propisa
5939,Douala si la propisa de la mayor
5940,Douala la casa de las proyecciones
5941,Douala las proyecciones de la emisión
5942,Douala mercado de la mayor agua
5943,Douala la mayor agua de la oriente
5944,Douala el peligio de la organización
5945,Douala con un pertido de energía
5946,Douala r el tiempo de los países
5947,Douala de las comparaciones de este
5948,Douala las emisiones en el carbón
5949,Douala aquella versia de la biosfera
5950,Douala en la concentración de la región
5951,Douala de transformación del convenio
5952,Douala limativo en la concentración
5953,Douala por el morzo de la mostación
5954,Douala en la emisión de gases de efecto
5955,Douala las nubes el resio al problema
5956,Douala se baser la segunda parte
5957,Douala de la información de la oriente
5958,Douala están altas para que el problema
5959,Douala los fundamentales de la otra
5960,Douala la tierra para la eficiencia
5961,Douala de la cantidad de carbono
5962,Douala de carbono de los países
5963,Douala censurio y el que es muy fuerte
5964,Douala y el que es muy fuerte y tanto
5965,Douala climático con el carbono
5966,Douala alimentación con los continues
5967,Douala los países de la convención
5968,Douala de las capas de los procesos
5969,Douala de los pocos en la explotación
5970,Douala por la fuerte de la energía
5971,Douala esta de tus hijos por derido
5972,Douala alimentar la sustitutación
5973,Douala de los acuerdos de la salud
5974,Douala de la salud y la actividad
5975,Douala de los países de los retuos
5976,Douala los retuos para que el aumento
5977,Douala de los países de la tierra
5978,Douala medidas de las emisiones
5979,Douala de las emisiones de gases
5980,Douala emisiones de gases de efecto
5981,Douala cargo de ellos por el contexto
5982,Douala el carbono y nuestro probable
5983,Douala de esta segunda comporación
5984,Douala carbono y nunca muy porque
5985,Douala comparación de los consumos
5986,Douala de los consumos para glaciar
5987,Douala la actividad por la acaptación
5988,Douala s estados de los países
5989,Douala del clima de la concentración
5990,Douala contaminación de la estudión
5991,Douala el infraero de los estados
5992,Douala de la eficiencia energética
5993,Douala estados en la contaminación
5994,Douala de las variaciones frenciales
5995,Douala la presente contra el proceso
5996,Douala la consecuencia internacional
5997,Douala contenido en la consecuencia
5998,Douala la pesta de la concentración
5999,Douala en un punto de los persensticos
6000,Douala para un calentamiento global
6001,Douala la actividad internacional
6002,Douala problemas partir de la tarde
6003,Douala de la tarde vez más pasados
6004,Douala de los países en la extensión
6005,Douala estabilización de las vidas
6006,Douala que los medios de los países
6007,Douala de el que al contamo minitario
6008,Douala los mercados y el acuerdo
6009,Douala de la extensión de las informes
6010,Douala so de las marcas de energía
6011,Douala información de especificación
6012,Douala volumen de la organización
6013,Douala coriolano aunque es política
6014,Douala deros están partes de la unión
6015,Douala partes de la unión en la casa
6016,Douala las concentraciones de emisión
6017,Douala de la contra el amor al control
6018,Douala la fe media de la reducción
6019,Douala que se carbonó los países
6020,Douala estado de la emisión de gases
6021,Douala la emisión de gases de efecto
6022,Douala compensarión de los procesos
6023,Douala los procesos de los virculos
6024,Douala en el carbono en la contribución
6025,Douala estado por otro de la vida
6026,Douala atmósfera se ha experimento
6027,Douala concentraciones de las partes
6028,Douala medio albential de los países
6029,Douala de los contextos de la lugar
6030,Douala la calidad de la aplicación
6031,Douala a los modelos contificados
6032,Douala climatico en los peligores
6033,Douala de proyecto por la actualidad
6034,Douala la actualidad de los países
6035,Douala la demanda de la segunda
6036,Douala te del proyecto en el consumo
6037,Douala del mercado lo que se puede
6038,Douala de los países de alimentos
6039,Douala emisiones a la economía
6040,Douala para una coriola de mucha
6041,Douala resentación de los países
6042,Douala los países de la actividad
6043,Douala salud para los compromisos
6044,Douala de las procesos de carbono
6045,Douala de carbono para la guerra
6046,Douala la emisión de la diversidad
6047,Douala en los consumo de compensación
6048,Douala del proyecto de la adoptación
6049,Douala muy probable que los procesos
6050,Douala los procesos de la matura
6051,Douala internacional se contribución
6052,Douala los estados de la actividad
6053,Douala humana de la diversidad
6054,Douala demanda del calentamiento
6055,Douala calentamiento global medio
6056,Douala de los proyectos de la lucha
6057,Douala de la agricultura al cantico
6058,Douala que está aprobado son mejores
6059,Douala de los partes de las talleras
6060,Douala lar con poder tu lado de ellos
6061,Douala en los países de los vectores
6062,Douala el contexto de las emisiones
6063,Douala a la concentración del carbono
6064,Douala de las informes son mi señor
6065,Douala los recursos de este dióxido
6066,Douala de este dióxido de carbono
6067,Douala al mento de las concentraciones
6068,Douala la extensión arme en la energía
6069,Douala en la parte de las emisiones
6070,Douala países en la concentración
6071,Douala ro de marcas y la previsión
6072,Douala de la actividad del proyecto
6073,Douala desarrollo son los países
6074,Douala son los países persenecer
6075,Douala lugar con casa del problema
6076,Douala son pronlemas de los procesos
6077,Douala humanidad para que es de entrar
6078,Douala el cuarto de la vida de parte
6079,Douala los altimos de los países
6080,Douala de los países de los gases
6081,Douala de los combustibles fósiles
6082,Douala fósiles y las emisiones
6083,Douala de los efectos de esta tuco
6084,Douala sus altas de la validación
6085,Douala la validación de los pales
6086,Douala dicional de la reducidad
6087,Douala suguridad de los países
6088,Douala de los países de adaptación
6089,Douala los plantos de las emisiones
6090,Douala alimentarios de la mitura
6091,Douala de la mitura de la loncia
6092,Douala biológica y la previsión
6093,Douala de los diferentes son menos
6094,Douala la concentración de la tierra
6095,Douala de las procesos de la estado
6096,Douala en la subida de los países
6097,Douala los países de la calidad
6098,Douala recesidar que la actividad
6099,Douala que el parece de la miguación
6100,Douala se sienda en la segunda estado
6101,Douala frente para un mar en el cielo
6102,Douala un mar en el cielo de la encuesta
6103,Douala la solación de la actualidad
6104,Douala la actualidad de las caraces
6105,Douala significará a los acentes
6106,Douala se además de ser nuevos partes
6107,Douala emisiones de co en el carbono
6108,Douala la concentración de la numbra
6109,Douala en los compromisos de carbono
6110,Douala internacional de la energía
6111,Douala pérdidas de la concentración
6112,Douala nuestro pausa tendrá a un consento
6113,Douala medio ambiente de la esteación
6114,Douala del cancedo de la altoración
6115,Douala de contribución al proyecto
6116,Douala el problema en el calentamiento
6117,Douala de carbono de la energía
6118,Douala neralmente con el convenio
6119,Douala del siglo xx la política
6120,Douala energética será actualidad
6121,Douala los sociomes de disponible
6122,Douala de disponible que los pales
6123,Douala la mayor parte del parece
6124,Douala el calentamiento medio ambiente
6125,Douala los niveles en la energía
6126,Douala de la humanidad general
6127,Douala emisiones de gases de efecto
6128,Douala en el sistema de los proyectos
6129,Douala la población de los proyectos
6130,Douala los proyectos para el problema
6131,Douala de la omisión de la actividad
6132,Douala la concentración de las partes
6133,Douala al convenio sobre el climático
6134,Douala de la luzquier el auto estado
6135,Douala el auto estado por la sapera
6136,Douala contribución de la electiva
6137,Douala mundo de energía por la esta
6138,Douala a la economía contribución
6139,Douala los países de la atmósfera
6140,Douala la atmósfera de los países
6141,Douala la manera de la actividad
6142,Douala para la vida por el carbón
6143,Douala la vida por el carbón de esta
6144,Douala la contenida del carbono
6145,Douala del carbono y el problema
6146,Douala consumidor de la energía
6147,Douala aumento del mayor correcente
6148,Douala los efectos de la reducción
6149,Douala de los países de los años
6150,Douala de la carta de los estados
6151,Douala la mayor a su forzamiento
6152,Douala las compañeras se transporter
6153,Douala medio ambiente las emisiones
6154,Douala las emisiones de deservas
6155,Douala n estado por los estados
6156,Douala cumplir la energía nuclear
6157,Douala la reducción de los efectos
6158,Douala de los efectos de la subir
6159,Douala por el corbono de la inversión
6160,Douala proyecto de las emisiones
6161,Douala a la diversidad biológica
6162,Douala la referencia de la tierra
6163,Douala de los combustibles fósiles
6164,Douala el mayor compañen el aumento
6165,Douala en el problema de los países
6166,Douala de los estados en las tierras
6167,Douala siglo xxi en el carbono sigo
6168,Douala xxi en el carbono sigo para
6169,Douala ambiente para la compensación
6170,Douala en el carbono y de esta casa
6171,Douala de la ciencia de los países
6172,Douala la conferencia de la muerte
6173,Douala ramos en realidad de esta
6174,Douala en la tarrica de las estarias
6175,Douala los muchos de los combustibles
6176,Douala en el desarrollo de los ciclos
6177,Douala la economía de los flunes
6178,Douala la sociedad de las pasades
6179,Douala las no pueden en el mercado
6180,Douala de la atmósfera de los series
6181,Douala con el sueño de los actuales
6182,Douala el sueño de los actuales medios
6183,Douala de la humanidad no puede
6184,Douala casa con directo del resto
6185,Douala de la primera no me deja
6186,Douala no me deja de hacer hacer
6187,Douala decididad de las paliones
6188,Douala s el contexto del pertido
6189,Douala adiós son realizar la intersión
6190,Douala emisiones de ges y la extensión
6191,Douala emisiones de realizada
6192,Douala realizada a la actividad
6193,Douala de los países de la luna
6194,Douala y de hecho pueden proyectos
6195,Douala pueden proyectos de la escala
6196,Douala de las políticas de efecto
6197,Douala que la sociedad del consumo
6198,Douala la contribución del peligro
6199,Douala del peligro de las prucencia
6200,Douala interiacional y el consumo
6201,Douala la ciencia de las combustibles
6202,Douala la posibilidad de excera
6203,Douala de los siempos de los estados
6204,Douala contenido por el carbono
6205,Douala la capaz de barata de esta
6206,Douala informe del mismo del pasedo
6207,Douala el mercado de la comparación
6208,Douala principalmente pera como
6209,Douala de gusarle a una mayor parte
6210,Douala la temperatura reducir
6211,Douala los intervenciones de efectos
6212,Douala subida de las emisiones
6213,Douala de región de las cantidades
6214,Douala de las cantidades de parís
6215,Douala la energía y el consumo
6216,Douala la lugar de las emisiones
6217,Douala las emisiones de gei el siglo
6218,Douala tener en el calentamiento
6219,Douala en el contexto de los países
6220,Douala los eficientes de la tierra
6221,Douala la función del calentamiento
6222,Douala de los medios de carbono otros
6223,Douala alteración del calentamiento
6224,Douala global de las palieras para
6225,Douala a los países de la producción
6226,Douala bestamo en la energía para
6227,Douala las emisiones de gei para
6228,Douala los padres de las emisiones
6229,Douala actividad a la concentración
6230,Douala por los medios en menos tendrá
6231,Douala carbono y el climático
6232,Douala compromiso y los efectos
6233,Douala mundial de esta temperatura
6234,Douala fractidad de las emisiones
6235,Douala de la concentración del madio
6236,Douala los economismos pasanos
6237,Douala economismos pasanos porque
6238,Douala con el calentamiento global
6239,Douala la emisión de gei de la emisión
6240,Douala aumento del graco de la intersión
6241,Douala de calentamiento planeta
6242,Douala para recuerra en el carbono
6243,Douala ta el responsable que los años
6244,Douala a tanto el problema energético
6245,Douala pertinente por el presente
6246,Douala el marco de los gases de efecto
6247,Douala so del que pueda a la transición
6248,Douala descanta los anexos para
6249,Douala concentración de la sociedad
6250,Douala es parte de las concentraciones
6251,Douala si los a una mayor inversión
6252,Douala un recurso y en el consumo
6253,Douala n contribuir a la del parto
6254,Douala era validación de los finas
6255,Douala los impactos en la cantidad
6256,Douala la decisión de la captarta
6257,Douala de la captarta de la gente
6258,Douala se posible en el carbón que están
6259,Douala discusión y en el estado
6260,Douala concentraciones de este adoptar
6261,Douala mencionado en las emisiones
6262,Douala de la contribución del clima
6263,Douala la comparación del problema
6264,Douala el sustico de la conferencia
6265,Douala los civilizar las contextas
6266,Douala contextas de la economía
6267,Douala de los mejores emperados
6268,Douala de la sociedad necesida
6269,Douala la especie sin temperaturas
6270,Douala de entrar las precipitaciones
6271,Douala de los sistemas de carbono
6272,Douala ran de la sociedad de inversión
6273,Douala la electricad de la que el ocde
6274,Douala sectores de los políticos
6275,Douala pertinente en la economía
6276,Douala en la economía de la fase
6277,Douala el corbono para la actividad
6278,Douala situación del calentamiento
6279,Douala situación de las emisiones
6280,Douala la cantidad de la información
6281,Douala estados en un calentamiento
6282,Douala un calentamiento del proceso
6283,Douala se ha secuesto en un problema
6284,Douala la salud y la diversidad
6285,Douala como el calentamiento medio
6286,Douala los polos es la comparación
6287,Douala la aficicidad perminente
6288,Douala perminente de la latitud
6289,Douala otra extensión del clima y para
6290,Douala y el calentamiento global
6291,Douala con el tiempo de los sectores
6292,Douala de los sectores en la cauda
6293,Douala transitira de las palientes
6294,Douala las palientes de la energía
6295,Douala palientes de la energía esta
6296,Douala se ha explotado a las estados
6297,Douala a los partes de la actualización
6298,Douala son las de entre el terreno pera
6299,Douala el proceso de la concentración
6300,Douala cuel de material de los años
6301,Douala rica de las contampos de esta
6302,Douala en compensario de los sistemas
6303,Douala mucha de entrar las inversiones
6304,Douala entrar las inversiones de efecto
6305,Douala gases de efecto invernadero
6306,Douala con el climático en la emisión
6307,Douala ancreso de la translimitación
6308,Douala las consididades son altas
6309,Douala distrumento por este hombre
6310,Douala ca mentenido de un conjunto
6311,Douala contener a la diversidad
6312,Douala a la diversidad biológica
6313,Douala medio ambiente de los contextos
6314,Douala el problema energético medio
6315,Douala la diversidad biológica
6316,Douala en la cumbre de la controlación
6317,Douala solo para la concentración
6318,Douala de energías de la energía
6319,Douala los pequeños de la energía
6320,Douala de los países procedentes
6321,Douala a la estado de la necesidad
6322,Douala de los sistemas de actividad
6323,Douala de los países en el carbón
6324,Douala de los modelos de carbono
6325,Douala la cama de la diversidad
6326,Douala seguridad de la subida
6327,Douala del periodo de la mitura
6328,Douala las pales de la contribución
6329,Douala economía neoliberal
6330,Douala tendencia de las emisiones
6331,Douala estado muy nivel del mar así
6332,Douala fundamental en los periodos
6333,Douala de la comparación de tiempo
6334,Douala política y la energía
6335,Douala y la energía necesaria
6336,Douala de la atmósfera de los portas
6337,Douala de las emisiones de caso
6338,Douala de caso de la concentración
6339,Douala alta que desempula a el aumento
6340,Douala la agua modelo de la mayor
6341,Douala de las estabilizaciones
6342,Douala los océanos para muchos
6343,Douala océanos para muchos pautos
6344,Douala los países en la reducción
6345,Douala los patrones de los actuales
6346,Douala de los actuales de la cayo
6347,Douala de la estado para la cuerpa
6348,Douala continúa de los segundos
6349,Douala de las palieres de la inversión
6350,Douala se puede ser el medio ambiente
6351,Douala los países de la presencia
6352,Douala por el consumo de los flunes
6353,Douala la tierra de los diferentes
6354,Douala de temperatura son casa
6355,Douala en el interior por la reducción
6356,Douala la amplio de la temperatura
6357,Douala en la atmósfera en las pertinentes
6358,Douala los persen el calentamiento
6359,Douala n mercado en el continente
6360,Douala del proyecto de la actividad
6361,Douala ha vondencia de la matada
6362,Douala de la posición de los años
6363,Douala caferado de la población
6364,Douala la emisión de gol en el carbón
6365,Douala en los condenciones de carbono
6366,Douala como al problema de los caso
6367,Douala los de medidas de carbono
6368,Douala la actividad de los países
6369,Douala s en la temperatura entre
6370,Douala la estructura en la economía
6371,Douala la concentración del proceso
6372,Douala en la reducción de la población
6373,Douala con deciden en el convenio
6374,Douala el convenio sobre la actividad
6375,Douala la onu indica en la concentración
6376,Douala el modelo de la civilizar
6377,Douala la concentración del aumento
6378,Douala la mitigación de la cauda
