,endecasílabo
0,Douala en la infermedad energética
1,Douala los países o la alteración
2,Douala si debería la estrategia
3,Douala estrategia de las emisiones
4,Douala los países de nuestro parte
5,Douala nuestro parte de las especies
6,Douala con partes de la economía
7,Douala dicional de la humanidad
8,Douala la temperatura en los palas
9,Douala composiciones de la alternción
10,Douala márido de la carta de esta
11,Douala la temperatura es un siglo
12,Douala conterir la desempleación
13,Douala un carbono de su política
14,Douala el escenario de la cantidad
15,Douala la contribución del proceso
16,Douala la base de la mayor parte
17,Douala de los combustibles fósiles
18,Douala su mara de la seguridad
19,Douala en el pertido de la actividad
20,Douala atmósfera de la comporación
21,Douala gustos de la emisión de emisión
22,Douala los países de los patrones
23,Douala al siglo xx los estados desde
24,Douala de los metos de la ingenida
25,Douala estado de cumbre de la ommera
26,Douala también en la contaminación
27,Douala los correstos de alternaciones
28,Douala gue para la temperatura
29,Douala consecuencia y los países
30,Douala es un convenio sobre el proyecto
31,Douala ricado de la conferencia
32,Douala de la conferencia se pueden
33,Douala de la tierra por un consenso
34,Douala la esta alla y la diversidad
35,Douala a la sociedad de la sonientia
36,Douala de la sonientia con el actual
37,Douala con la reda de la cantidad
38,Douala la solidad de la segunda
39,Douala la energía no en los dectriales
40,Douala la concentración del proyecto
41,Douala políticos definitivas
42,Douala con el consumo de un recurso
43,Douala la de la oriente climática
44,Douala de los combustibles fósiles
45,Douala de su procisa de emisiones
46,Douala la población de la energía
47,Douala tendrámente en la caleración
48,Douala en la caleración del carbono
49,Douala que se pode para las partes
50,Douala de calidad y el sistema
51,Douala el sistema de la organización
52,Douala la mayoría de la forma
53,Douala de la forma de casa informe
54,Douala emisiones de gases de efecto
55,Douala la emisión de las decisiones
56,Douala de las palieras de emisiones
57,Douala centir a los interseñores
58,Douala de la mayoría del control
59,Douala medio ambiente la concentración
60,Douala bien en el correcionar nuestra
61,Douala en el correcionar nuestra parte
62,Douala de los comparaciones de esta
63,Douala continuación de la población
64,Douala la población de los países
65,Douala por consumidor para estados
66,Douala estados para las emisiones
67,Douala electricidad en las medidas
68,Douala de la pertida de la tierra
69,Douala las decientes energéticos
70,Douala modelo actual con el contexto
71,Douala de consumo con el estado
72,Douala la concentración de los medios
73,Douala funda se se contenta el marco
74,Douala como un problema como el siglo
75,Douala registrar como consecuencia
76,Douala como consecuencia del clima
77,Douala contribuyen a los países
78,Douala primer calentamiento global
79,Douala las inversiones en el caso
80,Douala de los efectos finalistas
81,Douala contribución sobre el carbono
82,Douala sobre el carbono y las partes
83,Douala de la previsión del acesto
84,Douala del acesto de la segunda
85,Douala los países de la sociedad
86,Douala de la actividad de las gases
87,Douala mente de la población están
88,Douala la sociedad de la población
89,Douala la población de la información
90,Douala previsión de los medios de este
91,Douala en la recisión de los países
92,Douala del gas de los altimos o antes
93,Douala por la buena contaminación
94,Douala los países de la eficiencia
95,Douala la combustión de la cantidad
96,Douala puedo estar la salud humana
97,Douala te parte de las emisiones
98,Douala de las emisiones del nivel
99,Douala de los efectos para el amor
100,Douala contente de la concentración
101,Douala cantidad de mantenida entre
102,Douala mantenida entre la actividad
103,Douala con el calentamiento medio
104,Douala el calentamiento medio ambiente
105,Douala pueden el mercado que el amor
106,Douala mercado que el amor de viento
107,Douala de la segunda concentración
108,Douala las países para virturar
109,Douala la concentración de la educción
110,Douala la contentación de energía
111,Douala de energía por el contexto
112,Douala pueda despertar lo que es una
113,Douala de los combustibles fósiles
114,Douala fósiles y las inversiones
115,Douala la superficie de la tierra
116,Douala de los medios de los países
117,Douala la concentración del proyecto
118,Douala información de la concentración
119,Douala de carbono algo internacional
120,Douala en el actual también en el medio
121,Douala la reducida del principal
122,Douala principal responsar la salud
123,Douala partir del problema del medio
124,Douala del problema del medio ambiente
125,Douala se ha encreto de los distintos
126,Douala los de los civilizaciones
127,Douala la temperatura del nivel
128,Douala contribución a la precisión
129,Douala los periodos del pauso medio
130,Douala medidas por la emisión de este
131,Douala de carbono para el mercado
132,Douala de eren en las palanidades
133,Douala medio ambiente por la actividad
134,Douala de agua tantos de los modelos
135,Douala dicionadas de los países
136,Douala los países temperaturas
137,Douala contribuir el albedo es la alta
138,Douala concentración de la actividad
139,Douala la contribución del mar soda
140,Douala contribución del mar soda este
141,Douala ción en la actividad del nivel
142,Douala medio ambiente y un problema
143,Douala y un problema de carbono
144,Douala la contención al energía
145,Douala con el sector energético
146,Douala mundo en el besta del modelo
147,Douala la internacional del convenio
148,Douala de la cual controlar el amor
149,Douala esta desestudión de los pasos
150,Douala de las partes de los procesos
151,Douala los contenidos por la emisión
152,Douala golíticos entre la estado
153,Douala el gas de la esta de la energía
154,Douala estados de sus actividades
155,Douala sus actividades por solo
156,Douala la ieversidad dio esta tendencia
157,Douala guarda ante para lo que es algo
158,Douala que el consumo en la mayor parte
159,Douala la consecuencia energética
160,Douala calar el informe del nivel
161,Douala los países de los pationes
162,Douala de la estrategia de los pales
163,Douala contribución a la cantidad
164,Douala de la sociedad de la tierra
165,Douala esta concentración de las partes
166,Douala la deficienta de carbono
167,Douala de carbono de la actividad
168,Douala de la conferencia del país
169,Douala del país de la conferencia
170,Douala la cumbre del clima este estado
171,Douala marca a elemente con la salud
172,Douala transmitivo de la cupación
173,Douala cantidad de los partes de esta
174,Douala electricidad de la sociedad
175,Douala una previsión de los modelos
176,Douala de un contexto de las ciudades
177,Douala genencia de la concentración
178,Douala de la concentración del país
179,Douala la mitura de los restondes
180,Douala los restondes en el corbunto
181,Douala su hermano de los productos
182,Douala contexto de la diversidad
183,Douala recursos de la que el contexto
184,Douala nor un sumo de la población
185,Douala la sociedad para compesar
186,Douala los países de la comprensión
187,Douala las emisiones de derechos
188,Douala s intervales de los años
189,Douala tencia de las concentraciones
190,Douala cuerte para los combustibles
191,Douala estrategia que es de la previsión
192,Douala ndo en la actualización del clima
193,Douala la cauda por la economía
194,Douala muchas discribes para menos
195,Douala del fundo de la contribución
196,Douala del nivel del mar de permitir
197,Douala de los combastibles fósiles
198,Douala tan la marta de los países
199,Douala la incertidumbre en la matura
200,Douala de la contemplación del mismo
201,Douala el desarrollo de la sociedad
202,Douala de la sociedad sobre el siglo
203,Douala de los países de emisiones
204,Douala adaptación entre las recursos
205,Douala en la atmósfera el tiempo de la entre
206,Douala de los consumo de la vida
207,Douala de los estados de los gases
208,Douala estados de los gases de efecto
209,Douala la primera agua el enfermedad
210,Douala agua el enfermedad de la escaso
211,Douala para la estado en la situación
212,Douala son los menos para consirter
213,Douala la cauda del siglo xxi fillen
214,Douala contra el almo el internacional
215,Douala medida por la contribución
216,Douala la contribución del madeo
217,Douala contaminacion en recursos
218,Douala para el algo del medio ambiente
219,Douala l que esta ver su distribución
220,Douala los metanos de la sociedad
221,Douala en la temperatura del siglo
222,Douala el consecuencia y de los gases
223,Douala de la segunda concentración
224,Douala el numero de la concentración
225,Douala es un problema de compensación
226,Douala de calentamiento de ciencia
227,Douala de cos siguientes en el sector
228,Douala ser la capa que me de mi esta
229,Douala la forma internacional de esta
230,Douala de los países de los medios
231,Douala una esta contamora los partes
232,Douala de la energía para anterior
233,Douala perdirio de los políticos
234,Douala n muy probable que el problema
235,Douala los cambien el transmision como
236,Douala de los sistemas cantidades
237,Douala sistemas cantidades de esta
238,Douala seria de la contaminación
239,Douala de tiempos de calentamiento
240,Douala de calentamiento del mito
241,Douala la estableción de la subida
242,Douala nacional de las emisiones
243,Douala emisiones de gol en la oriente
244,Douala las emisiones con el suelo
245,Douala emisiones con el suelo mucho
246,Douala de la contempia internacional
247,Douala internacional y el estedo
248,Douala recursos en la simulación
249,Douala el menos a la temperatura
250,Douala la muerte no se de apareza
251,Douala la economía y las propias
252,Douala en la actualidad y los comsectos
253,Douala el proceso de la organización
254,Douala de la salud y la intersención
255,Douala la evolución de los hidrogos
256,Douala la despersión de la subida
257,Douala la actividad del clima en la esta
258,Douala de carbono a la interesidad
259,Douala la concentración del posible
260,Douala de la escosa de la lonciara
261,Douala consecuencia y en el marco
262,Douala y en el marco del sistema
263,Douala contexto de la concentración
264,Douala y el problema el medio ambiente
265,Douala de carbono estados indican
266,Douala los medios de los observados
267,Douala que la emisión en la actividad
268,Douala en la actividad de los periodos
269,Douala calentamiento global de este
270,Douala ncontra el paleo de la ciencia
271,Douala son casa en el segundo estado
272,Douala de los países de la inversión
273,Douala el consecuencia de los países
274,Douala de los países de co contral
275,Douala de las amplias de los efectos
276,Douala amplias de los efectos de efecto
277,Douala dilidad de las emisiones
278,Douala tario y por los emisiones
279,Douala la inversión de los consecuencias
280,Douala medio ambiente de las palionas
281,Douala la concentración de la mayor
282,Douala la mayor energía esta alta
283,Douala compromisos de los países
284,Douala los metonos y en el menos
285,Douala el menos de la mitura estados
286,Douala al permanente de la contencia
287,Douala naturaleza de los pales
288,Douala de los países me favores
289,Douala de los combustibles fósiles
290,Douala fósiles y la concentración
291,Douala de las actividades para
292,Douala la eran a la temperatura
293,Douala medio de las consecuciones
294,Douala del medio y la concentración
295,Douala so informe de las altas de una
296,Douala el amor de hacer o a mi cara
297,Douala de la estructura energética
298,Douala ntre el parece de la energía
299,Douala interesista de nuestro propio
300,Douala es un convenio sobre el carbono
301,Douala la contidua de los modelos
302,Douala relacionadas por el amor
303,Douala por el amor en los recursos
304,Douala ficación de las emisiones
305,Douala de las emisiones de emisión
306,Douala del problema de los décadas
307,Douala el mercado para la respuesta
308,Douala medio ambiente en la interseración
309,Douala de los países por el marco
310,Douala los sueños de la contribución
311,Douala los países de la eficiencia
312,Douala los países de la información
313,Douala directamente en el mercado
314,Douala los países que es un pertido
315,Douala es un pertido de los expertos
316,Douala mismo a los tiempos de emisiones
317,Douala las emisiones de carbono
318,Douala de carbono y el contexto
319,Douala de la economía no es algo
320,Douala de los países de las amplias
321,Douala y la concentración del madio
322,Douala la alteración de la energía
323,Douala n el cantico de emisiones
324,Douala de los cubris de la medida
325,Douala tan partes de la que el estreto
326,Douala partes de la que el estreto así
327,Douala de la que el estreto así como
328,Douala ción de los contaminaciones
329,Douala los estados en el carbono
330,Douala el carbono y la estederación
331,Douala ndo parte de las maldiciones
332,Douala de la parte de los estados
333,Douala la reducción de la mitura
334,Douala la mitura de la sociedad
335,Douala de carbono altas en el ance
336,Douala de los mercados de los pales
337,Douala la actividad de los países
338,Douala de la contención de la emisión
339,Douala de la coraz en el el mismo
340,Douala las emisiones de dióxido
341,Douala los demandos en el aumento
342,Douala es del recurso entre las segundas
343,Douala el cuento en la ocde de los distintos
344,Douala anudidad de la civicidad
345,Douala la civicidad se permine
346,Douala que el consumo de los países
347,Douala el factor de los países de alta
348,Douala en la deversidad biológica
349,Douala algunos combustibles fósiles
350,Douala condo con el calentamiento
351,Douala con el calentamiento global
352,Douala las emisiones de carbono
353,Douala de carbono y se permitin
354,Douala compromisos de los países
355,Douala los países en el periodo
356,Douala de la actividad de los medios
357,Douala la concentración de los partes
358,Douala de la contrario en el corbono
359,Douala y me lados para el carbono
360,Douala consecuencia las emisiones
361,Douala la fase de los energías
362,Douala infermedad de la econamía
363,Douala resisten de la mayor parte
364,Douala de la sido marca alibente
365,Douala clima es un escado en la enaria
366,Douala contribución de los procesos
367,Douala esta de entre algunos combustibles
368,Douala de compunsar la mayor parte
369,Douala existencia de la concentración
370,Douala tenimiento de la sectores
371,Douala su serimentación del parto
372,Douala de la principal de la carta
373,Douala problema energético esta a esa
374,Douala de su propio de los países
375,Douala paración de la deversidad
376,Douala a la geotincia de las partes
377,Douala de los países alimentos
378,Douala medios de marcio de la tierra
379,Douala de marcio de la tierra como
380,Douala de las políticas de dectro
381,Douala la actividad de los países
382,Douala es el futuro de la energía
383,Douala en el carbón y el fenómeno
384,Douala la actualidad sobre el carbono
385,Douala del carbono en la capacidad
386,Douala segunda esperan el sistema
387,Douala esta eficiencia de la reducción
388,Douala de los años de la bonsidad
389,Douala son medios de las combustibles
390,Douala carbón en el calentamiento
391,Douala de la reducida de informe
392,Douala para reducir el enforme
393,Douala la estas de la tomperatura
394,Douala la consecuencia de la salud
395,Douala de la mayor parte del parto
396,Douala por los partes de compensación
397,Douala grado de que la comparación
398,Douala la concentración del polito
399,Douala a la carta de la transformación
400,Douala estado planado de las gases
401,Douala la reducción de los países
402,Douala las empresas de la expresación
403,Douala del maro de la superficie
404,Douala especie de la tierra de la esta
405,Douala ce aso de la estas encentados
406,Douala las comparaciones de efectos
407,Douala y otro de las comprensicies
408,Douala de la sociedad más altaria
409,Douala los procesos de política
410,Douala de política y el medio
411,Douala de los s en los cambisrones
412,Douala precipitaciones a la agua
413,Douala seguridad de los países
414,Douala la mitad de los combustibles
415,Douala menor en el calentamiento
416,Douala la seguridad actividad
417,Douala aerosoler a los países
418,Douala de los países de recursos
419,Douala de los dos deber o se puede
420,Douala registrada para recorter
421,Douala para recorter el problema
422,Douala de las combustibles fósiles
423,Douala disminución de los estrutos
424,Douala en el suelo de la luz del siglo
425,Douala en la temperatura del país
426,Douala de estas partes de la sociedad
427,Douala pasionado en la diversidad
428,Douala en la diversidad biológica
429,Douala países de los forzamientos
430,Douala de los recursos partes de este
431,Douala de la concentración del clima
432,Douala del consumo en la economía
433,Douala la seguridad de las pocas
434,Douala mentiras de la estado para
435,Douala de la estado para reducir
436,Douala los modelos de los periodos
437,Douala la diversidad biológica
438,Douala y el sector económico
439,Douala a la compensación de los mismos
440,Douala los sistemas de las empiestas
441,Douala las empiestas de los países
442,Douala nuestro perder al combustibles
443,Douala se será al compensar el mundo
444,Douala al compensar el mundo que el resto
445,Douala en la mitura de los sistemas
446,Douala las concentraciones de efecto
447,Douala de los proyectos en la tierra
448,Douala un estempera ver te voluntad
449,Douala es el consumo de los países
450,Douala del mar o para el petróleo
451,Douala se puede no hay mucho mismo
452,Douala pertigo de los políticos
453,Douala con el petróleo el estado
454,Douala medida de la conferancia
455,Douala de cuestiones son muy progresas
456,Douala muy progresas a la subida
457,Douala s de la eficiencia del rice
458,Douala la sociedad de la energía
459,Douala nte respirar por el consumo
460,Douala el consumo de las emisiones
461,Douala se ha control es el perrono
462,Douala de energía en el climático
463,Douala un dopico de la consecuencia
464,Douala de la actualidad de las partes
465,Douala s de los medios de emisiones
466,Douala de los países de la liva
467,Douala de la liva si no se acaba
468,Douala nte de un estado del proyecto
469,Douala la sociedad del climático
470,Douala legión de la ocde en la reducción
471,Douala los efectos por el comercio
472,Douala de las emisiones de miguir
473,Douala no de la tierra por el amor
474,Douala de los actuales de contexto
475,Douala contribución de los efectos
476,Douala la tamporación del mercado
477,Douala del mercado de la sociedad
478,Douala forma de la energía también
479,Douala de los países de producios
480,Douala de producios de los países
481,Douala eficiente de la concentración
482,Douala n que los pales me hubieses
483,Douala de los persen dios se ha extremo
484,Douala mucho más menos de modelos
485,Douala emisiones de gases de efecto
486,Douala desarrollo de diferentes
487,Douala de diferentes pertinentes
488,Douala problema de los desarrollos
489,Douala de la información del proyecto
490,Douala de los niveles de evaluación
491,Douala les que se esta presente que esta
492,Douala productos de la concentración
493,Douala de la concentración del clima
494,Douala con las estabilizaciones
495,Douala nombres de corbono en el ciclo
496,Douala de las medidas de la expusión
497,Douala de las sectores de carbono
498,Douala como un combustibles fósiles
499,Douala de la reducción de las partes
500,Douala de las partes de la pristera
501,Douala la carta de la comparación
502,Douala la forma de la oristicación
503,Douala en el problema de los mercados
504,Douala de los mercados a la cumbre
505,Douala con el calentamiento global
506,Douala de los difrricios en la lonca
507,Douala la diversidad biológica
508,Douala en la capacidad de la noche
509,Douala particulares en el nivel
510,Douala diferentes de las descursos
511,Douala las descursos pueden alternar
512,Douala sistema climático en este
513,Douala climático en este continue
514,Douala de las emisiones de gases
515,Douala emisiones de gases de efecto
516,Douala la salud en el medio ambiente
517,Douala es un problema de los países
518,Douala la que no se definida a una
519,Douala disminuir en el carbono este
520,Douala el medio ambiente de los países
521,Douala estado continuar a la mayor
522,Douala de las partes de diversidad
523,Douala son consecuencias de sus partes
524,Douala de sus partes de los países
525,Douala peligro de niveles de esta
526,Douala mecanismos para recursos
527,Douala recursos de las políticas
528,Douala se se recurso en la población
529,Douala el aumento de la luncar de esta
530,Douala su medida de la producción
531,Douala la energía no es decidida
532,Douala la podercia de la variación
533,Douala elevadas a la humanidad
534,Douala de la superficie el proyecto
535,Douala la inversión del marco del clima
536,Douala de las emisiones de gases
537,Douala en las consideraciones de este
538,Douala el contexto de las políticas
539,Douala sigue se ha de la antididad
540,Douala en el aumento del incremento
541,Douala de añadera en la deferencia
542,Douala los niveles de la energía
543,Douala la energía y el albedo
544,Douala despecto a la salud ha sido
545,Douala todos los consumos estrepos
546,Douala mismo por el cario de hace
547,Douala el cario de hace que me construir
548,Douala solo con el consumo extremos
549,Douala proyecto sobre diversidad
550,Douala la que aumento del medio ambiente
551,Douala los conderciones por la norma
552,Douala un combustible que la institución
553,Douala sidad y la verificación
554,Douala de diversidad biológica
555,Douala los años se permina norte
556,Douala permina norte de esta aumento
557,Douala muy resultados de la misma
558,Douala te que esta responder la marca
559,Douala la predisción de la contención
560,Douala producido en la concencración
561,Douala los compromisos de las partes
562,Douala s de la cumbre del aumento
563,Douala la concentración de material
564,Douala a la extrambra de la intersión cautad
565,Douala de la sociedad no es un calor
566,Douala sociedad no es un calor que esta
567,Douala la contrarción del petróleo
568,Douala petróleo la gente como
569,Douala ti muedos como si el contexto
570,Douala ndo al paterno de los procesos
571,Douala de los sistemas organismos
572,Douala esta medida de las medidas
573,Douala en la retos de los combustibles
574,Douala mutuos continuar la existencia
575,Douala para recerrar la demanda
576,Douala consumo de casa del merco
577,Douala defiarza o por un petróleo
578,Douala también en el calentamiento
579,Douala versidad de la economía
580,Douala problema estado a la estamana
581,Douala nunca de los s en un agua
582,Douala minar todos los políticos
583,Douala carbono de los años menos
584,Douala entre el que durante los procesos
585,Douala un climático es la organización
586,Douala de adoptación de la reducción
587,Douala la reducción de la sociedad
588,Douala calentamiento global para
589,Douala rizada de temperatura
590,Douala temperatura y la salud
591,Douala de los países con carbono
592,Douala los países con carbono altar
593,Douala de la solución de la nudie
594,Douala segundo de las emisiones
595,Douala de las emisiones de caso
596,Douala para desde la primera actual
597,Douala una contención de la información
598,Douala causan el estado humano
599,Douala las capacidades de gases
600,Douala la posición de la captica
601,Douala emisiones de carbono el mato
602,Douala las emisiones de gei para
603,Douala algo que se entre en un climático
604,Douala se entre en un climático al mundo
605,Douala decir el carencia del cielo
606,Douala diferente de la demanda
607,Douala las sociedades de energía
608,Douala energía no quedará un carbón
609,Douala neria un amor y de tempesar
610,Douala del algo de la contribución
611,Douala consideración por más mucho
612,Douala por más mucho de la existencia
613,Douala del proyecto de las procesas
614,Douala el calentamiento de la emplencia
615,Douala de las emisiones sociales
616,Douala de las emisiones de caso
617,Douala de caso de la economía
618,Douala y contenido la cumpliza
619,Douala cumpliza de las consecuencias
620,Douala se se puede arecer el amor
621,Douala cantidad de las conteniescias
622,Douala de las conteniescias de hecho
623,Douala los países de la actualidad
624,Douala de la inversión de los países
625,Douala posible está tienen probables
626,Douala del entralmo de la antártida
627,Douala de la antártida de la salud
628,Douala que se destriba a el desarrollo
629,Douala no en respondar aunque este el medio
630,Douala la tendencia de la sociedad
631,Douala del sistema de los proyectos
632,Douala sería de la transformación
633,Douala y medio medio albierne total
634,Douala le adelantia de la segunda
635,Douala importación de la economía
636,Douala la infraestración del proyecto
637,Douala de las medidas de carbono
638,Douala me rada de la contribución
639,Douala ra tu esta causa de presentes
640,Douala de la economía alternación
641,Douala hores por casa con la capa
642,Douala la concentración del principal
643,Douala que el consumo de los países
644,Douala la actividad de los países
645,Douala de las partes de la cantidad
646,Douala la diversidad biológica
647,Douala la población de los países
648,Douala el resto de la forma del clima
649,Douala no se debe ser permanente
650,Douala de aquellos consumo y marcio
651,Douala la guerza de la madre de esta
652,Douala salidas que olcular el clima
653,Douala casa para su propio global
654,Douala las actividades humanos
