,verse,terminacion
311,Chongqing marco de la concentración,"[<'con':cVc>, <'cen':cVc>, <'tra':ccV>, <'ción':cvVc>]"
312,Chongqing la temperatura mundial,"[<'mun':cvc>, <'dial':cvVc>]"
313,Chongqing ser producido en la propia,"[<'pro':ccV>, <'pia':cvV>]"
314,Chongqing la propia con la producción,"[<'pro':ccV>, <'duc':cvc>, <'ción':cvVc>]"
315,Chongqing parte de la concentración,"[<'con':cVc>, <'cen':cVc>, <'tra':ccV>, <'ción':cvVc>]"
316,Chongqing menos en la compromisa,"[<'com':cVc>, <'pro':ccV>, <'mi':cv>, <'sa':sV>]"
317,Chongqing propuesta en la contrabución,"[<'con':cVc>, <'tra':ccV>, <'bu':cv>, <'ción':cvVc>]"
318,Chongqing marco de la concentración,"[<'con':cVc>, <'cen':cVc>, <'tra':ccV>, <'ción':cvVc>]"
319,Chongqing estado en la capacidad,"[<'ca':cV>, <'pa':cV>, <'ci':cv>, <'dad':cVc>]"
320,Chongqing de carbono y la propia,"[<'pro':ccV>, <'pia':cvV>]"
