,endecasílabo
0,Zhengzhou permitado en la atmósfera
1,Zhengzhou en el proyecto de la tierra
2,Zhengzhou de carbono a la producción
3,Zhengzhou problema de compromiso
4,Zhengzhou modelos de compromiso
5,Zhengzhou contribución de la propia
6,Zhengzhou entre el mar de la concentración
7,Zhengzhou carbono en la concentración
8,Zhengzhou menos de la consecuencia
9,Zhengzhou parte de la concentración
10,Zhengzhou parte de la concentración
11,Zhengzhou mundial de la concentración
12,Zhengzhou contribución de la compra
13,Zhengzhou mayor parte de la salud
14,Zhengzhou marca de la concentración
15,Zhengzhou mayor en la compromisa
16,Zhengzhou climático como el cambio
17,Zhengzhou como el cambio climático
18,Zhengzhou producto en la compromisa
19,Zhengzhou el petróleo y la propia
20,Zhengzhou marco de la concentración
21,Zhengzhou climático en la atmósfera
22,Zhengzhou está contra la compromica
23,Zhengzhou marca de la concentración
24,Zhengzhou parte de la contra el cambio
25,Zhengzhou política en la producción
26,Zhengzhou climática y el cambio
27,Zhengzhou carbono en la compromisa
28,Zhengzhou propia de la concentración
29,Zhengzhou contra el cambio climático
30,Zhengzhou contra el cambio climático
31,Zhengzhou el cambio climático sobre
32,Zhengzhou menos de la compromisa
33,Zhengzhou la compra de compromiso
34,Zhengzhou marco de la concentración
35,Zhengzhou la comprar en la producción
36,Zhengzhou por el contral de la propia
37,Zhengzhou el contral de la propia contra
38,Zhengzhou en el proceso de la propia
39,Zhengzhou la contrar con la estrategia
40,Zhengzhou permitado de la propia
41,Zhengzhou de la propia climática
42,Zhengzhou para el cambio climático
43,Zhengzhou contra el cambio climático
44,Zhengzhou el cambio climático sobre
45,Zhengzhou la producción de la compra
46,Zhengzhou permitado de la compra
47,Zhengzhou parte de la compromisa
48,Zhengzhou emisiones de contra el cambio
49,Zhengzhou la propia de contra el cambio
50,Zhengzhou producirá a la energía
51,Zhengzhou el proyecto de la actualidad
52,Zhengzhou permitado de la propia
53,Zhengzhou de la propia contra el cambio
54,Zhengzhou menos de la concentración
55,Zhengzhou permitado por la propia
56,Zhengzhou el contrado en la compromisa
57,Zhengzhou parte de la compromisa
58,Zhengzhou en la propia de la comprensión
59,Zhengzhou contra el cambio climático
60,Zhengzhou contra el cambio climático
61,Zhengzhou menos precipitaciones
62,Zhengzhou permita de la producción
63,Zhengzhou la capa de compromiso
64,Zhengzhou de contra la compromisa
65,Zhengzhou menos de la compromisa
66,Zhengzhou por el mar en la producción
67,Zhengzhou permita en la compromisa
68,Zhengzhou la producción de la compra
69,Zhengzhou contra el cambio climático
70,Zhengzhou permitado de la estado
71,Zhengzhou producido a la energía
72,Zhengzhou el proceso de compromiso
73,Zhengzhou parte de la contra el cambio
74,Zhengzhou de contra la compromisa
75,Zhengzhou la contrar la compromisa
76,Zhengzhou comprensión de la producción
77,Zhengzhou propia con la compromisa
78,Zhengzhou permita en la compromisa
79,Zhengzhou por el cambio climático
80,Zhengzhou problema de la producción
81,Zhengzhou parte de la compromisa
82,Zhengzhou la propia de la comprensión
83,Zhengzhou el mercado de la producción
84,Zhengzhou permitado en la producción
85,Zhengzhou seguir en la contribución
86,Zhengzhou la estada de compromiso
87,Zhengzhou parte de la concentración
88,Zhengzhou la propia como el problema
89,Zhengzhou problema con la atmósfera
90,Zhengzhou carbono que la comprensión
91,Zhengzhou la compromisa de deces
92,Zhengzhou deces con la compromisa
93,Zhengzhou se producirá en la propia
94,Zhengzhou en la propia de compromiso
95,Zhengzhou manor en la compromisa
96,Zhengzhou modelo de la producción
97,Zhengzhou el cambio climático sobre
98,Zhengzhou la energía necesaria
99,Zhengzhou los combustibles fósiles
100,Zhengzhou la propia como el estado
101,Zhengzhou compromiso de carbono
102,Zhengzhou carbono y el problema
103,Zhengzhou la energía contra el cambio
104,Zhengzhou contribución de la compra
105,Zhengzhou se esta mayor producida
106,Zhengzhou compromiso de la capa
107,Zhengzhou el contrado en la compromisa
108,Zhengzhou producto a las emisiones
109,Zhengzhou la propia de los procesos
110,Zhengzhou el contrado en la concentración
111,Zhengzhou segundo de la producción
112,Zhengzhou la comprensión de la propia
113,Zhengzhou a la propia de compromiso
114,Zhengzhou permitado en la comprensión
115,Zhengzhou parte de la concentración
116,Zhengzhou parte de la compromisa
117,Zhengzhou climático en la producción
118,Zhengzhou parte de la compromisa
119,Zhengzhou el proceso de la comprensión
120,Zhengzhou la producción de la compra
121,Zhengzhou la compra de la producción
122,Zhengzhou menos de la compromisa
123,Zhengzhou marco de la concentración
124,Zhengzhou menos en la concentración
125,Zhengzhou ser estado a la producción
126,Zhengzhou contra el cambio climático
127,Zhengzhou los procesos de carbono
128,Zhengzhou seguridad establecir
129,Zhengzhou parte de la contribución
130,Zhengzhou parte de la compromisa
131,Zhengzhou consecuencia de la contrar
132,Zhengzhou la contrar la compromisa
133,Zhengzhou en la producción de la capa
134,Zhengzhou en la cumbre de la actualidad
135,Zhengzhou la compra de la estructura
136,Zhengzhou contra el cambio climático
137,Zhengzhou de la compra de consumo
138,Zhengzhou la compromisa de cambio
139,Zhengzhou por el cambio climático
140,Zhengzhou permitado en el promedio
141,Zhengzhou la estado de la comprensión
142,Zhengzhou se desarrollar la estada
143,Zhengzhou mercado de la energía
144,Zhengzhou carbono en la compromisa
145,Zhengzhou menos de la concentración
146,Zhengzhou permitado en la producción
147,Zhengzhou contración de la producción
148,Zhengzhou el contral de la concentración
149,Zhengzhou de todo la contra el cambio
150,Zhengzhou menos de la concentración
151,Zhengzhou contra el cambio climático
152,Zhengzhou la comprensión de la compra
153,Zhengzhou la producción de la compra
154,Zhengzhou parte de la concentración
155,Zhengzhou menos de la concentración
156,Zhengzhou proceso de esta producción
157,Zhengzhou proceso de compromiso
158,Zhengzhou sin embargo se producir
159,Zhengzhou contra el mar en la atmósfera
160,Zhengzhou de compromiso de contra
161,Zhengzhou contra la temperatura
162,Zhengzhou menos de la concentración
163,Zhengzhou carbono que los países
164,Zhengzhou la producción de la mayor
165,Zhengzhou problema de la producción
166,Zhengzhou de compromiso de contra
167,Zhengzhou menos de la contribución
168,Zhengzhou por el cambio climático
169,Zhengzhou climático y la propia
170,Zhengzhou de compromiso de carbón
171,Zhengzhou carbono en la compromisa
172,Zhengzhou permitado de la tierra
173,Zhengzhou carbono por un problema
174,Zhengzhou de combustibles fósiles
175,Zhengzhou producto en la concentración
176,Zhengzhou proceso de compromiso
177,Zhengzhou el proyecto en la compromisa
178,Zhengzhou contra el cambio climático
179,Zhengzhou medida de compromiso
180,Zhengzhou la estado de la comprensión
181,Zhengzhou parte de la comprendencia
182,Zhengzhou la comprensión de la compra
183,Zhengzhou de la compra de carbono
184,Zhengzhou proceso de compromiso
185,Zhengzhou desarrollar el problema
186,Zhengzhou compromiso de la contrar
187,Zhengzhou la compromisa de cambio
188,Zhengzhou contra el cambio climático
189,Zhengzhou segundo contra la propia
190,Zhengzhou la propia de compromiso
191,Zhengzhou la propia de compromiso
192,Zhengzhou compromiso de la compra
193,Zhengzhou de carbono en la atmósfera
194,Zhengzhou menos en la contribución
195,Zhengzhou menos en las emisiones
196,Zhengzhou carbono en la compromisa
197,Zhengzhou ser producido en la propia
198,Zhengzhou la energía para el cambio
199,Zhengzhou a la producción de la propia
200,Zhengzhou parte de la concentración
201,Zhengzhou de carbono a la producción
202,Zhengzhou de compromiso de cambio
203,Zhengzhou tendría en la consecuencia
204,Zhengzhou consecuencia de la contrar
205,Zhengzhou la contrar la concentración
206,Zhengzhou de contra la contra el cambio
207,Zhengzhou en la comprensión de la estada
208,Zhengzhou en el cambio climático esta
209,Zhengzhou de la propia como contra
210,Zhengzhou producto en la contra el cambio
211,Zhengzhou productos de la producción
212,Zhengzhou propio con la concentración
213,Zhengzhou de carbono de la propia
214,Zhengzhou marca de la concentración
215,Zhengzhou producción de la producción
216,Zhengzhou contra la compromicado
217,Zhengzhou la producción de la compra
218,Zhengzhou países de contra el cambio
219,Zhengzhou se desarrollar el cambio
220,Zhengzhou problema de compromiso
221,Zhengzhou medida de la intersidad
222,Zhengzhou el proceso de contra el cambio
223,Zhengzhou conjunto de compromiso
224,Zhengzhou la producción de la compra
225,Zhengzhou en la concentración de la actual
226,Zhengzhou consecuencia de la compren
227,Zhengzhou la compren de consecuencia
228,Zhengzhou parte de la contribución
229,Zhengzhou contra el cambio climático
230,Zhengzhou compromiso de la mayor
231,Zhengzhou secuedad de la atmósfera
232,Zhengzhou la mayor por la producción
233,Zhengzhou la producción de la compra
234,Zhengzhou la propia en la compromisa
235,Zhengzhou contra el cambio climático
236,Zhengzhou la demanda de la propia
237,Zhengzhou de la propia contra el cambio
238,Zhengzhou contra el cambio climático
239,Zhengzhou la intersidad biológica
240,Zhengzhou la compromisa continuar
241,Zhengzhou de la contrar la contración
242,Zhengzhou el problema de compromiso
243,Zhengzhou parte de la compromisa
244,Zhengzhou contra el cambio climático
245,Zhengzhou contra el cambio climático
246,Zhengzhou economía necesitad
247,Zhengzhou parte de la contra el cambio
248,Zhengzhou permitado en el consumo
249,Zhengzhou parte de la contra el cambio
250,Zhengzhou menos de la concentración
251,Zhengzhou de carbono y la contrar
252,Zhengzhou compromiso de la propia
253,Zhengzhou la energía necesaria
254,Zhengzhou carbono a la compromisa
255,Zhengzhou en el cambio climático esta
256,Zhengzhou ser producido en la contral
257,Zhengzhou parte de la concentración
258,Zhengzhou compra de la propia como
259,Zhengzhou el contrado en la propia como
260,Zhengzhou compromisa contra el cambio
261,Zhengzhou contra el cambio climático
262,Zhengzhou el cambio climático sobre
263,Zhengzhou de compromiso de un medio
264,Zhengzhou permitan para la compra
265,Zhengzhou la compra de compromiso
266,Zhengzhou la propia de la comprensión
267,Zhengzhou cambio climático sobre
268,Zhengzhou la propia de compromiso
269,Zhengzhou marco de la concentración
270,Zhengzhou la temperatura mundial
271,Zhengzhou ser producido en la propia
272,Zhengzhou la propia con la producción
273,Zhengzhou parte de la concentración
274,Zhengzhou menos en la compromisa
275,Zhengzhou en el mar de la contribución
276,Zhengzhou propuesta en la contrabución
277,Zhengzhou marco de la concentración
278,Zhengzhou de carbono y la propia
279,Zhengzhou el sumento de la demanda
