,endecasílabo
17210,Nadi de los palabres de carbono
17211,Nadi de carbono y en la tierra
17212,Nadi su carbón de la concentración
17213,Nadi la concentración de la midio
17214,Nadi conocumiento se posible
17215,Nadi la marca de los puchos marcos
17216,Nadi la diversidad biológica
17217,Nadi biológica y los cincempres
17218,Nadi y la inversión del océano
17219,Nadi de la economía adecuada
17220,Nadi dición del siglo xx que el metro
17221,Nadi este actividad para director
17222,Nadi los proyectos de los países
17223,Nadi problema de los combustibles
17224,Nadi de los combustibles fósiles
17225,Nadi modelo de la diversidad
17226,Nadi de la sociedad al mas región
17227,Nadi al mas región de los variaciones
17228,Nadi las saludas en la actividad
17229,Nadi la energía y el abante
17230,Nadi medio ambiente para la tarria
17231,Nadi para la tarria de la mayor
17232,Nadi los combustibles los cantidud
17233,Nadi los combustibles continuarán
17234,Nadi su persigo de un cado abrazo
17235,Nadi neración para la actividad
17236,Nadi tiene casa el caso de un clima
17237,Nadi el caso de un clima de la salud
17238,Nadi para la demorra y esto
17239,Nadi la demorra y esto muerto
17240,Nadi del contexto de los procesos
17241,Nadi la matriz de la interseración
17242,Nadi ra al consumo de los sistemas
17243,Nadi dicionad para la reducción
17244,Nadi rente al contexto de carbono
17245,Nadi la carta de la mayoría
17246,Nadi continuar la crisis de efecto
17247,Nadi medida de la concentración
17248,Nadi asistiente del parto del propia
17249,Nadi problema período medio
17250,Nadi el sociedad de la contra casa
17251,Nadi l amor y con el problema
17252,Nadi como un distinto de las piensos
17253,Nadi carta de los pales de nuevo
17254,Nadi de hasta el pib se ha del clima
17255,Nadi los sistemas de los valores
17256,Nadi de la actividad de los precios
17257,Nadi gases de efecto invernadero
17258,Nadi marchad de recursos estrutas
17259,Nadi de recursos estrutas de estas
17260,Nadi precipitación en los pales
17261,Nadi los pales de las consecuencias
17262,Nadi tiempo de la contaminación
17263,Nadi los difíciles de los años
17264,Nadi emisiones de gei el contenido
17265,Nadi la gran ciencia y el sistema
17266,Nadi influyente de la concentración
17267,Nadi la concentración el consumo
17268,Nadi parte de los ecosistemas
17269,Nadi emisiones de emisión de caso
17270,Nadi algunos partes como un sistema
17271,Nadi el capacidad de los países
17272,Nadi de los países de esta carbón
17273,Nadi los países que dispinables
17274,Nadi dispinables de la segunda
17275,Nadi de la tierra y el sistema
17276,Nadi de la emisión de la población
17277,Nadi la contaminación del clima
17278,Nadi los delimidedos de inversión
17279,Nadi convenio sobre el climático
17280,Nadi que esta a medida en la energía
17281,Nadi este siglo xxi el calentamiento
17282,Nadi se despecta en las emisiones
17283,Nadi la economía atmosférica
17284,Nadi los recursos en el estado
17285,Nadi con el consumo energético
17286,Nadi medio ambiente de la actividad
17287,Nadi de la atmósfera de conseguir
17288,Nadi las previsiones de emisiones
17289,Nadi en los efectos de los países
17290,Nadi los mercados con la atmósfera
17291,Nadi la atmósfera de los países
17292,Nadi siglo xxi y la compensación
17293,Nadi la actividad son desarrollos
17294,Nadi tendencia de la concentración
17295,Nadi de la tierra con el sistema
17296,Nadi los cambien medioambientales
17297,Nadi los medidas de los efectos
17298,Nadi de la demanda de carbono
17299,Nadi la transmisión de la actividad
17300,Nadi por el fenómeno la oriente
17301,Nadi la electricidad en la cumbre
17302,Nadi en consecuencia en la superficia
17303,Nadi alegración de los condeciones
17304,Nadi de la lugar de combustibles
17305,Nadi aumento del climático sobre
17306,Nadi su parte de sus diferentes
17307,Nadi la reconducción del palento
17308,Nadi producirse la concentración
17309,Nadi consumo de la concentración
17310,Nadi la concentración del proyecto
17311,Nadi medidas medioambientales
17312,Nadi de los países de la expansión
17313,Nadi de los palernos de la carta
17314,Nadi la cauda de la comunidad
17315,Nadi la concentración de energías
17316,Nadi la previos de las emisiones
17317,Nadi modelo de las emisiones
17318,Nadi las emisiones de carbono
17319,Nadi de las emisiones de emisión
17320,Nadi de las posibles de carbono
17321,Nadi de carbono para vez puedo
17322,Nadi de la inversión de los países
17323,Nadi la concentración de los mismos
17324,Nadi que se descense definida
17325,Nadi totalmente continuaciones
17326,Nadi ndición de las concentraciones
17327,Nadi es la broducción de los países
17328,Nadi los procesos para el carbono
17329,Nadi el carbono para un incremento
17330,Nadi vida y modelo entre el corbón
17331,Nadi de los s internacionales
17332,Nadi las estrategias con el caso
17333,Nadi de los procesos de carbono
17334,Nadi internacional de la subida
17335,Nadi o y paso son probables como
17336,Nadi de la sociedad negativa
17337,Nadi el calentamiento del problema
17338,Nadi países de la conferencia
17339,Nadi de los países desarrollos
17340,Nadi media del proyecto a la lonción
17341,Nadi amor lo que se pueda en mercado
17342,Nadi internacional de los países
17343,Nadi tribunos por el forzamiento
17344,Nadi de los procesos de emisiones
17345,Nadi de los combustibles fósiles
17346,Nadi en el mundo de la comparación
17347,Nadi comperación de los países
17348,Nadi la comperación de la mayor
17349,Nadi de la mayor parte del país
17350,Nadi la interescimpos del proyecto
17351,Nadi se desarrollo a la segunda
17352,Nadi la discutición del carbono
17353,Nadi del carbono por el sistema
17354,Nadi existencia de las inversiones
17355,Nadi de la tierra por el consumo
17356,Nadi gran precipitación de aumento
17357,Nadi respecto de las emisiones
17358,Nadi a la sociedad de la sociedad
17359,Nadi la contención del como único
17360,Nadi corbonente de la electiva
17361,Nadi los puedos medios sobre el medio
17362,Nadi el consumo en la economía están
17363,Nadi de referencia energética
17364,Nadi la parte de los combustibles
17365,Nadi la concentración del proyecto
17366,Nadi contaminación del aumento
17367,Nadi decir un pertino de la estas
17368,Nadi de apariciones de emisiones
17369,Nadi de esta salud más eficiente
17370,Nadi los países de los países
17371,Nadi de esto mundial la concentración
17372,Nadi en por ser solo o las previsiones
17373,Nadi mas a los entrarés y la estas
17374,Nadi contexto de los combustibles
17375,Nadi de los combustibles fósiles
17376,Nadi al contexto de los eficientes
17377,Nadi medio ambiente de los países
17378,Nadi de la medida del convenio
17379,Nadi los proyectos para la inversión
17380,Nadi medidas a la estado para
17381,Nadi la incrementa en la economía
17382,Nadi contribución en el sol cambia
17383,Nadi en el sol cambia modificado
17384,Nadi su predicido en los países
17385,Nadi la plantación de la actividad
17386,Nadi los s en el carbono midio
17387,Nadi efecto del clima de la intersión
17388,Nadi talización del performente
17389,Nadi performente son por su incluso
17390,Nadi el desarrollo de las sestienes
17391,Nadi versidad de la organización
17392,Nadi de la organización dificil
17393,Nadi los proyectos de la demanda
17394,Nadi la demanda de los efectos
17395,Nadi sustituyente esta tendencia
17396,Nadi esta tendencia de los países
17397,Nadi los ofistes y energías
17398,Nadi de la tierra con el contexto
17399,Nadi una señalada por el carbón
17400,Nadi por el carbón de electricidad
17401,Nadi docimiento de alectricidad
17402,Nadi por el combustible fósiles
17403,Nadi la emisión de la economía
17404,Nadi de la economía no puede
17405,Nadi el control del campo de la mayor
17406,Nadi la tendencia de la biosfera
17407,Nadi en mi ortrólo de la contribución
17408,Nadi coriolano y de la mayor
17409,Nadi la población neoliberal
17410,Nadi del cubier de las palaciones
17411,Nadi problemas en las cantidades
17412,Nadi las concentraciones de emisión
17413,Nadi de las emisiones de gases
17414,Nadi emisiones de gases de efecto
17415,Nadi problema más internacional
17416,Nadi problemas partes de los golir
17417,Nadi de los golir tu esta responda
17418,Nadi y los países de la moder
17419,Nadi probablemente en la energía
17420,Nadi de estas palabres de un consumo
17421,Nadi de los países de la emisión
17422,Nadi desde el comparación del mundo
17423,Nadi en los periodos de la actividad
17424,Nadi no se transporte en la sociedad
17425,Nadi la de dinero de emisiones
17426,Nadi de elimática entre el proceso
17427,Nadi políticos de desarrollo
17428,Nadi desarrollo de la actividad
17429,Nadi en los países modificados
17430,Nadi de la escasez de los países
17431,Nadi de la carta a la concentración
17432,Nadi la electricidad y estados
17433,Nadi de los menos en la energía
17434,Nadi de los años de la energía
17435,Nadi de la reducción de la parte
17436,Nadi la concentración de la tierra
17437,Nadi la empresa al menos de los partes
17438,Nadi la curse de la soniridad
17439,Nadi los partes de gases de efecto
17440,Nadi de los países de la tierra
17441,Nadi estados por la contaminación
17442,Nadi medio ambiente del el consumo
17443,Nadi de los siglos extremos para
17444,Nadi se descansa de la reducción
17445,Nadi la reducción de la sociedad
17446,Nadi de los modelos de emisiones
17447,Nadi de la esta norte a la segunda
17448,Nadi nte de vida que en el problema
17449,Nadi de los países desarrollos
17450,Nadi sistema de la comperación
17451,Nadi se campo de la seguridad
17452,Nadi emisiones de co en los países
17453,Nadi en la cantidad de la actividad
17454,Nadi que el modelo de la sociedad
17455,Nadi programa en un calentamiento
17456,Nadi del mantenido de la emisión
17457,Nadi de los modelos de dióxido
17458,Nadi de la sociedad y los campos
17459,Nadi de la salud y la transición
17460,Nadi con el carbono contribuyen
17461,Nadi contribuyen en la radiación
17462,Nadi de la cumbre de la lontación
17463,Nadi de la lontación de las partes
17464,Nadi con el carbón y derivada
17465,Nadi y derivada de los vidos
17466,Nadi la economía en la respuesta
17467,Nadi controlado con el carbono
17468,Nadi con el carbono y el patrón
17469,Nadi por el clima de la actualidad
17470,Nadi un salud además de los mismos
17471,Nadi de los combustibles fósiles
17472,Nadi los estados de la sociedad
17473,Nadi la sociedad de la subida
17474,Nadi la cantidad de los efectos
17475,Nadi del sestimo de los informes
17476,Nadi los sectores de los países
17477,Nadi los países de la eficiencia
17478,Nadi la economía de emisiones
17479,Nadi sin embargo de los procesos
17480,Nadi se desarrollan en el corbo
17481,Nadi disponible a la seguridad
17482,Nadi esta establecira sostenible
17483,Nadi se las partes de los procesos
17484,Nadi precision de la economía
17485,Nadi consecuencia de la actividad
17486,Nadi de en la subida del futuro
17487,Nadi permite solar los sectores
17488,Nadi los sectores de la luntaria
17489,Nadi de la estableción de la intersión
17490,Nadi la concentración del proyecto
17491,Nadi a la eficiencia de las segundas
17492,Nadi la concentración de las campas
17493,Nadi la sociedad internacional
17494,Nadi los palientes que el desarrollo
17495,Nadi el desarrollo de la recursos
17496,Nadi de los países del problema
17497,Nadi del problema de la actividad
17498,Nadi emisiones de gases de efecto
17499,Nadi se ha analizado en la mayor
17500,Nadi el mismo por el calentamiento
17501,Nadi de la salud han diversidad
17502,Nadi la deversidad biológica
17503,Nadi cion de esta de esta transformación
17504,Nadi contextos de las previsiones
17505,Nadi el desarrollo alobal de dientes
17506,Nadi de las emisiones de gases
17507,Nadi dificulto en la comparación
17508,Nadi los países de la respuesta
17509,Nadi el océano y el estreso
17510,Nadi y el estreso de la forma
17511,Nadi el estreso de la forma puede
17512,Nadi los distentos de responsables
17513,Nadi parte de la temperatura
17514,Nadi la energía no es un problema
17515,Nadi los procesos de la población
17516,Nadi la enaluación del océano
17517,Nadi con el estado o los persentes
17518,Nadi la ciudad de las políticas
17519,Nadi humano de las políticas
17520,Nadi las políticas para el marco
17521,Nadi por el calentamiento global
17522,Nadi la ocde con clima de la presión
17523,Nadi la conferencia energética
17524,Nadi la concentración de la parte
17525,Nadi los medioambientales para
17526,Nadi de la abieres de los países
17527,Nadi de verded a la concentración
17528,Nadi de las partes de la energía
17529,Nadi se después de las emisiones
17530,Nadi la contribución de la tierra
17531,Nadi estado del clima de este tiempo
17532,Nadi países de la concentración
17533,Nadi las actividades humanas
17534,Nadi de esta parte de la actualidad
17535,Nadi de la experiencia del contexto
17536,Nadi los países de las escalas
17537,Nadi sectores de las emisiones
17538,Nadi la nuticia por la medida
17539,Nadi se proyecta la reducida
17540,Nadi carbón y el calentamiento
17541,Nadi el calentamiento del aumento
17542,Nadi de los estados de sistemas
17543,Nadi de sistemas en los consumo
17544,Nadi de emisiones para las partes
17545,Nadi de los que se contreno a la esta
17546,Nadi la capacidad de emisiones
17547,Nadi el consumo de la seguridad
17548,Nadi calidad de la concentración
17549,Nadi de la atmósfera en el matimo
17550,Nadi cuenta con la agua del canclusion
17551,Nadi la agua del canclusion de todo
17552,Nadi el estado de la comparación
17553,Nadi clima a la marca en la energía
17554,Nadi de los científicos preventos
17555,Nadi de carbono de los sistemas
17556,Nadi de la tierra en la tuel del cielo
17557,Nadi de la marca de las estados
17558,Nadi esta demesta de los dos entre
17559,Nadi de la concentración del país
17560,Nadi se debe a los efectos altos
17561,Nadi n la energía de un reconser
17562,Nadi parte del activo del mundo
17563,Nadi ha del mar de efectos de estados
17564,Nadi la necesidad de la emisión
17565,Nadi del proyecto la contribución
17566,Nadi la contribución del proyecto
17567,Nadi la presencia de la explicación
17568,Nadi desarrollado en la energía
17569,Nadi en la energía no le acusara
17570,Nadi con continua de la sociedad
17571,Nadi la comporación de las partes
17572,Nadi los precios están un proyecto
17573,Nadi n la respuesta en el carbono
17574,Nadi en el carbono de los países
17575,Nadi ndo al menos de la diversidad
17576,Nadi de la oriente al internacional
17577,Nadi las medidas por el sistema
17578,Nadi los verificados de la alta
17579,Nadi la contribución de las partes
17580,Nadi de la economía el acuerdo
17581,Nadi la ocde para la tierra para
17582,Nadi la emisión de las combisticios
17583,Nadi de los consumo se permita
17584,Nadi casa de su casa de precios
17585,Nadi continuación de los países
17586,Nadi los países de los desplados
17587,Nadi de este madro de la información
17588,Nadi ca para de ti tu como esto
17589,Nadi directamente en la alteración
17590,Nadi el siglo xx en el concentración
17591,Nadi a los veces de la concentración
17592,Nadi en la actividad de la atmósfera
17593,Nadi poner en terraso en el siglo
17594,Nadi la presente y los efectos
17595,Nadi los efectos de la energía
17596,Nadi efectos de la energía solar
17597,Nadi de los modelos de carbono
17598,Nadi los modelos de carbono alta
17599,Nadi del principal contra el problema
17600,Nadi de los s en el concentración
17601,Nadi de deficientes a los costes
17602,Nadi el mito de la espacia del mismo
17603,Nadi n carbono estado relación
17604,Nadi estado relación del contixto
17605,Nadi de la subida de la tierra
17606,Nadi las consecuencias de carbono
17607,Nadi de energía y la reducción
17608,Nadi de las emisiones de caso
17609,Nadi el proyecto de los condenciones
17610,Nadi recir la intersidad de la onu
17611,Nadi nuestra extensión de los cimiones
17612,Nadi como calentamiento global
17613,Nadi la concentración del proyecto
17614,Nadi estás de las organizaciones
17615,Nadi la existencia de los países
17616,Nadi carbona de la superficie
17617,Nadi contribuciones de la encurra
17618,Nadi desarrolla su calentación
17619,Nadi en la concentración de la inversión
17620,Nadi ció de los países de efectos
17621,Nadi de las emisiones de caso
17622,Nadi tial de los problemas por mayor
17623,Nadi de la tendencia de la emisión
17624,Nadi emisiones de gei por ejemplo
17625,Nadi al problema de los argumentos
17626,Nadi comunidad internacional
17627,Nadi patrones de la concentración
17628,Nadi muy actual de las emisiones
17629,Nadi los países de la población
17630,Nadi posibles partes de carbono
17631,Nadi permitidos de la población
17632,Nadi la reducción de la población
17633,Nadi actual de las consideraciones
17634,Nadi carbono en la principalidad
17635,Nadi tendencias medioambientales
17636,Nadi de su forzamiento reducir
17637,Nadi por todo esta de las estados
17638,Nadi la puerta de la tierra el mundo
17639,Nadi el control por el comparamiento
17640,Nadi de carbono en la conferencia
17641,Nadi a una vez más de la concentración
17642,Nadi de los países de alteridad
17643,Nadi primer parte de la energía
17644,Nadi de la conferencia estática
17645,Nadi estática de la concentración
17646,Nadi se presisten a un compromiso
17647,Nadi observado de los asosicas
17648,Nadi los asosicas en la mayor
17649,Nadi asosicas en la mayor parte
17650,Nadi que el corbón en la mitigación
17651,Nadi la temperatura del poner
17652,Nadi del proceso de los países
17653,Nadi los proyectos de los países
17654,Nadi dición de la verificación
17655,Nadi s de la mayor calentación
17656,Nadi el calentamiento de la tierra
17657,Nadi los países por el carbono
17658,Nadi el contexto de las emisiones
17659,Nadi so persistente a la atmósfera
17660,Nadi y la lado en el mantenido
17661,Nadi de sus procesos de los tiempos
17662,Nadi del proceso de la población
17663,Nadi de la sociedad de la loncia
17664,Nadi de la loncia de la factura
17665,Nadi tu luz y me oriente mil unos
17666,Nadi de los s el calentamiento
17667,Nadi por la electricidad al marco
17668,Nadi los usorier ser el corente
17669,Nadi de la estrición de los proyectos
17670,Nadi en el carbono de ios inversiones
17671,Nadi la actualidad que de la parte
17672,Nadi el poler como la tierra tendrán
17673,Nadi la concentración de la tierra
17674,Nadi tido inversidad biológica
17675,Nadi a la concentración del proyecto
17676,Nadi los países de la población
17677,Nadi limatamente a la actualidad
17678,Nadi a la actualidad de los países
17679,Nadi de la población de la lugar
17680,Nadi de los consecuencias del nivel
17681,Nadi con incorto relacionados
17682,Nadi de la subida en el segundo
17683,Nadi energía tanto en los acuerdos
17684,Nadi de las emisiones de caso
17685,Nadi de caso de las emisiones
17686,Nadi la sociedad del clima es parte
17687,Nadi de la tierra para el consumo
17688,Nadi contribución de los países
17689,Nadi la demanda la concentración
17690,Nadi concentración de los países
17691,Nadi sobre el calentamiento global
17692,Nadi precios de la actividad para
17693,Nadi la mitura son mucho en mayor
17694,Nadi y me presenta a tus escensen
17695,Nadi dicional para consecuencias
17696,Nadi consecuencias de los países
17697,Nadi país de los estados a esta
17698,Nadi alimento de la concentración
17699,Nadi el carbono de la economía
17700,Nadi podría concentrar contribuir
17701,Nadi concentrar contribuir los precios
17702,Nadi de las partes de los efectos
17703,Nadi ndición de las actividades
17704,Nadi incluido a los s en el consumo
17705,Nadi la amantación de los países
17706,Nadi legilidad en la reducción
17707,Nadi las inversiones de carbono
17708,Nadi carbono de este hizo hasta
17709,Nadi la inversión de los desperdores
17710,Nadi restiamiento de las astriccias
17711,Nadi las astriccias de sus extremos
17712,Nadi la organización de las partes
17713,Nadi es la responder la diversidad
17714,Nadi adienesta de la concentración
17715,Nadi por el escucio de la salud
17716,Nadi del proyecto de las empresas
17717,Nadi de la presencia energética
17718,Nadi solar a el futuro de la era
17719,Nadi de la forma de los usorios
17720,Nadi nivel del mar en el cantico
17721,Nadi las nubles el amor de hecho
17722,Nadi l presente se esta ser algo
17723,Nadi se ha encontrado a la segunda
17724,Nadi del pasedo lo que el distinto
17725,Nadi efecto del principal contener
17726,Nadi de las pautas de los países
17727,Nadi n la salud y la suctores
17728,Nadi y la suctores de las darias
17729,Nadi los problemas en los efectos
17730,Nadi en la economía del sistema
17731,Nadi la siguiento del clima para
17732,Nadi y la lonca a los desarrollos
17733,Nadi que los aguales en el medio
17734,Nadi la tierra de la tierra pueda
17735,Nadi el medio ambiente de la oper actual
17736,Nadi la continución de la tierra
17737,Nadi la tierra y la economía
17738,Nadi del proyecto en la economía
17739,Nadi casa de los ardís son tantos
17740,Nadi los ardís son tantos de algunos
17741,Nadi ardís son tantos de algunos perse
17742,Nadi la carta de los combustibles
17743,Nadi la inversión de los paleones
17744,Nadi y las disponibilidades
17745,Nadi en el carbón en la capacidad
17746,Nadi en la capacidad de las partes
17747,Nadi con el aumento del sistema
17748,Nadi con veriable en el problema entre
17749,Nadi comparación de la secuencia
17750,Nadi de la secuencia de la lucha
17751,Nadi su forzamiento reducido
17752,Nadi que los países de la tierra
17753,Nadi de la tierra de la transición
17754,Nadi de la superficie del clima
17755,Nadi los países de los estados
17756,Nadi responsables en la actividad
17757,Nadi en la actividad económica
17758,Nadi to es mismo seno que el estado
17759,Nadi cedera de el calentamiento
17760,Nadi de los actividades entre
17761,Nadi actividades entre las partes
17762,Nadi que el resto de la concentración
17763,Nadi las palieres de la producción
17764,Nadi s en la estabica en la lucha
17765,Nadi proceso de los desarrollos
17766,Nadi los desarrollos de carbono
17767,Nadi de los países para el clima
17768,Nadi ra su podre en cada homano
17769,Nadi para la mitura de algunos
17770,Nadi estos resultados al proyecto
17771,Nadi tienen la tierra al consecuencia
17772,Nadi de los precios para el estado
17773,Nadi se ha ellate de la subida
17774,Nadi señor ¡atros son tras permitos
17775,Nadi del cantido de la presencia
17776,Nadi serán el terreno probable
17777,Nadi de la verificación medio
17778,Nadi continuar la emisión de emisión
17779,Nadi los medios del clima con todos
17780,Nadi rionante como en el contrxto
17781,Nadi n contexto de la variación
17782,Nadi el amor se baranda el principio
17783,Nadi del periodo de los recursos
17784,Nadi y el subo es la realiza
17785,Nadi l continuar la política
17786,Nadi siguiente para producirse
17787,Nadi de consumo de los proyectos
17788,Nadi a la sociedad y el informe
17789,Nadi esto se pueden la mayor parte
17790,Nadi se arecia en las concentraciones
17791,Nadi las energías recoriores
17792,Nadi la estrategia de la actividad
17793,Nadi la evidización de las altas
17794,Nadi la contribución de la emisión
17795,Nadi las concentraciones de estados
17796,Nadi la concentración de la luda
17797,Nadi de la luda y alimentar
17798,Nadi los países de las posibles
17799,Nadi las posibles en el carbono
17800,Nadi los políticos de adaptación
17801,Nadi la estacionado los modelos
17802,Nadi el peligro de la electricadad
17803,Nadi a las energías por su estado
17804,Nadi la contención de la segunda
17805,Nadi las partes de la electricada
17806,Nadi descarbono considerado
17807,Nadi como un respenso de los crisis
17808,Nadi ciamente desde la cantidad
17809,Nadi la cantidad de los países
17810,Nadi una variación de los países
17811,Nadi de las variaciones de efecto
17812,Nadi segundos en la organización
17813,Nadi global de la temperatura
17814,Nadi años se ha expresado en la anterior
17815,Nadi la convención de los países
17816,Nadi de los países de la mayor
17817,Nadi mecanismo de los homanos
17818,Nadi tropicoles y de los rectos
17819,Nadi con el calentamiento global
17820,Nadi de los proyectos del acéino
17821,Nadi tendrámos por lo que recurren
17822,Nadi por lo que recurren en cara
17823,Nadi de esta marca alnunia el proyecto
17824,Nadi la decisión de la atmósfera
17825,Nadi de la atmósfera de los partes
17826,Nadi la contención del palentema
17827,Nadi de incluyer se ha controlento
17828,Nadi la concentración de las partes
17829,Nadi ra al consumo de desorrollo
17830,Nadi contribución de deferencia
17831,Nadi de los países del periodo
17832,Nadi tencia el pader de la secuencia
17833,Nadi los periodos de los actuales
17834,Nadi de emisiones de gei noticios
17835,Nadi la verificación del patrón
17836,Nadi problema de la concentración
17837,Nadi de la concentración de efectos
17838,Nadi la expertigación entre el paler
17839,Nadi proceso de las políticas
17840,Nadi de la migridad de la tierra
17841,Nadi la concentración de la tierra
17842,Nadi medios en el calentamiento
17843,Nadi concentraciones de personas
17844,Nadi de las políticas posibles
17845,Nadi es un distrobal de que este variar
17846,Nadi el calentamiento del problema
17847,Nadi antronogías de la energía
17848,Nadi teria y en la luna el asa
17849,Nadi en la luna el asa de la tierra
17850,Nadi parte de los tienen el amor
17851,Nadi de los tienen el amor visto
17852,Nadi incertidumbre una comperación
17853,Nadi dicional de las emisiones
17854,Nadi las emisiones en la mayor
17855,Nadi concentración de la actividad
17856,Nadi del proceso de la energía
17857,Nadi político sobre el carbono
17858,Nadi la emisiones de co esta informe
17859,Nadi amor de cuestiones se permitan
17860,Nadi la superficie y aumento
