,endecasílabo
6038,Nadi de los países de alimentos
6039,Nadi emisiones a la economía
6040,Nadi para una coriola de mucha
6041,Nadi resentación de los países
6042,Nadi los países de la actividad
6043,Nadi salud para los compromisos
6044,Nadi de las procesos de carbono
6045,Nadi de carbono para la guerra
6046,Nadi la emisión de la diversidad
6047,Nadi en los consumo de compensación
6048,Nadi del proyecto de la adoptación
6049,Nadi muy probable que los procesos
6050,Nadi los procesos de la matura
6051,Nadi internacional se contribución
6052,Nadi los estados de la actividad
6053,Nadi humana de la diversidad
6054,Nadi demanda del calentamiento
6055,Nadi calentamiento global medio
6056,Nadi de los proyectos de la lucha
6057,Nadi de la agricultura al cantico
6058,Nadi que está aprobado son mejores
6059,Nadi de los partes de las talleras
6060,Nadi lar con poder tu lado de ellos
6061,Nadi en los países de los vectores
6062,Nadi el contexto de las emisiones
6063,Nadi a la concentración del carbono
6064,Nadi de las informes son mi señor
6065,Nadi los recursos de este dióxido
6066,Nadi de este dióxido de carbono
6067,Nadi al mento de las concentraciones
6068,Nadi la extensión arme en la energía
6069,Nadi en la parte de las emisiones
6070,Nadi países en la concentración
6071,Nadi ro de marcas y la previsión
6072,Nadi de la actividad del proyecto
6073,Nadi desarrollo son los países
6074,Nadi son los países persenecer
6075,Nadi lugar con casa del problema
6076,Nadi son pronlemas de los procesos
6077,Nadi humanidad para que es de entrar
6078,Nadi el cuarto de la vida de parte
6079,Nadi los altimos de los países
6080,Nadi de los países de los gases
6081,Nadi de los combustibles fósiles
6082,Nadi fósiles y las emisiones
6083,Nadi de los efectos de esta tuco
6084,Nadi sus altas de la validación
6085,Nadi la validación de los pales
6086,Nadi dicional de la reducidad
6087,Nadi suguridad de los países
6088,Nadi de los países de adaptación
6089,Nadi los plantos de las emisiones
6090,Nadi alimentarios de la mitura
6091,Nadi de la mitura de la loncia
6092,Nadi biológica y la previsión
6093,Nadi de los diferentes son menos
6094,Nadi la concentración de la tierra
6095,Nadi de las procesos de la estado
6096,Nadi en la subida de los países
6097,Nadi los países de la calidad
6098,Nadi recesidar que la actividad
6099,Nadi que el parece de la miguación
6100,Nadi se sienda en la segunda estado
6101,Nadi frente para un mar en el cielo
6102,Nadi un mar en el cielo de la encuesta
6103,Nadi la solación de la actualidad
6104,Nadi la actualidad de las caraces
6105,Nadi significará a los acentes
6106,Nadi se además de ser nuevos partes
6107,Nadi emisiones de co en el carbono
6108,Nadi la concentración de la numbra
6109,Nadi en los compromisos de carbono
6110,Nadi internacional de la energía
6111,Nadi pérdidas de la concentración
6112,Nadi nuestro pausa tendrá a un consento
6113,Nadi medio ambiente de la esteación
6114,Nadi del cancedo de la altoración
6115,Nadi de contribución al proyecto
6116,Nadi el problema en el calentamiento
6117,Nadi de carbono de la energía
6118,Nadi neralmente con el convenio
6119,Nadi del siglo xx la política
6120,Nadi energética será actualidad
6121,Nadi los sociomes de disponible
6122,Nadi de disponible que los pales
6123,Nadi la mayor parte del parece
6124,Nadi el calentamiento medio ambiente
6125,Nadi los niveles en la energía
6126,Nadi de la humanidad general
6127,Nadi emisiones de gases de efecto
6128,Nadi en el sistema de los proyectos
6129,Nadi la población de los proyectos
6130,Nadi los proyectos para el problema
6131,Nadi de la omisión de la actividad
6132,Nadi la concentración de las partes
6133,Nadi al convenio sobre el climático
6134,Nadi de la luzquier el auto estado
6135,Nadi el auto estado por la sapera
6136,Nadi contribución de la electiva
6137,Nadi mundo de energía por la esta
6138,Nadi a la economía contribución
6139,Nadi los países de la atmósfera
6140,Nadi la atmósfera de los países
6141,Nadi la manera de la actividad
6142,Nadi para la vida por el carbón
6143,Nadi la vida por el carbón de esta
6144,Nadi la contenida del carbono
6145,Nadi del carbono y el problema
6146,Nadi consumidor de la energía
6147,Nadi aumento del mayor correcente
6148,Nadi los efectos de la reducción
6149,Nadi de los países de los años
6150,Nadi de la carta de los estados
6151,Nadi la mayor a su forzamiento
6152,Nadi las compañeras se transporter
6153,Nadi medio ambiente las emisiones
6154,Nadi las emisiones de deservas
6155,Nadi n estado por los estados
6156,Nadi cumplir la energía nuclear
6157,Nadi la reducción de los efectos
6158,Nadi de los efectos de la subir
6159,Nadi por el corbono de la inversión
6160,Nadi proyecto de las emisiones
6161,Nadi a la diversidad biológica
6162,Nadi la referencia de la tierra
6163,Nadi de los combustibles fósiles
6164,Nadi el mayor compañen el aumento
6165,Nadi en el problema de los países
6166,Nadi de los estados en las tierras
6167,Nadi siglo xxi en el carbono sigo
6168,Nadi xxi en el carbono sigo para
6169,Nadi ambiente para la compensación
6170,Nadi en el carbono y de esta casa
6171,Nadi de la ciencia de los países
6172,Nadi la conferencia de la muerte
6173,Nadi ramos en realidad de esta
6174,Nadi en la tarrica de las estarias
6175,Nadi los muchos de los combustibles
6176,Nadi en el desarrollo de los ciclos
6177,Nadi la economía de los flunes
6178,Nadi la sociedad de las pasades
6179,Nadi las no pueden en el mercado
6180,Nadi de la atmósfera de los series
6181,Nadi con el sueño de los actuales
6182,Nadi el sueño de los actuales medios
6183,Nadi de la humanidad no puede
6184,Nadi casa con directo del resto
6185,Nadi de la primera no me deja
6186,Nadi no me deja de hacer hacer
6187,Nadi decididad de las paliones
6188,Nadi s el contexto del pertido
6189,Nadi adiós son realizar la intersión
6190,Nadi emisiones de ges y la extensión
6191,Nadi emisiones de realizada
6192,Nadi realizada a la actividad
6193,Nadi de los países de la luna
6194,Nadi y de hecho pueden proyectos
6195,Nadi pueden proyectos de la escala
6196,Nadi de las políticas de efecto
6197,Nadi que la sociedad del consumo
6198,Nadi la contribución del peligro
6199,Nadi del peligro de las prucencia
6200,Nadi interiacional y el consumo
6201,Nadi la ciencia de las combustibles
6202,Nadi la posibilidad de excera
6203,Nadi de los siempos de los estados
6204,Nadi contenido por el carbono
6205,Nadi la capaz de barata de esta
6206,Nadi informe del mismo del pasedo
6207,Nadi el mercado de la comparación
6208,Nadi principalmente pera como
6209,Nadi de gusarle a una mayor parte
6210,Nadi la temperatura reducir
6211,Nadi los intervenciones de efectos
6212,Nadi subida de las emisiones
6213,Nadi de región de las cantidades
6214,Nadi de las cantidades de parís
6215,Nadi la energía y el consumo
6216,Nadi la lugar de las emisiones
6217,Nadi las emisiones de gei el siglo
6218,Nadi tener en el calentamiento
6219,Nadi en el contexto de los países
6220,Nadi los eficientes de la tierra
6221,Nadi la función del calentamiento
6222,Nadi de los medios de carbono otros
6223,Nadi alteración del calentamiento
6224,Nadi global de las palieras para
6225,Nadi a los países de la producción
6226,Nadi bestamo en la energía para
6227,Nadi las emisiones de gei para
6228,Nadi los padres de las emisiones
6229,Nadi actividad a la concentración
6230,Nadi por los medios en menos tendrá
6231,Nadi carbono y el climático
6232,Nadi compromiso y los efectos
6233,Nadi mundial de esta temperatura
6234,Nadi fractidad de las emisiones
6235,Nadi de la concentración del madio
6236,Nadi los economismos pasanos
6237,Nadi economismos pasanos porque
6238,Nadi con el calentamiento global
6239,Nadi la emisión de gei de la emisión
6240,Nadi aumento del graco de la intersión
6241,Nadi de calentamiento planeta
6242,Nadi para recuerra en el carbono
6243,Nadi ta el responsable que los años
6244,Nadi a tanto el problema energético
6245,Nadi pertinente por el presente
6246,Nadi el marco de los gases de efecto
6247,Nadi so del que pueda a la transición
6248,Nadi descanta los anexos para
6249,Nadi concentración de la sociedad
6250,Nadi es parte de las concentraciones
6251,Nadi si los a una mayor inversión
6252,Nadi un recurso y en el consumo
6253,Nadi n contribuir a la del parto
6254,Nadi era validación de los finas
6255,Nadi los impactos en la cantidad
6256,Nadi la decisión de la captarta
6257,Nadi de la captarta de la gente
6258,Nadi se posible en el carbón que están
6259,Nadi discusión y en el estado
6260,Nadi concentraciones de este adoptar
6261,Nadi mencionado en las emisiones
6262,Nadi de la contribución del clima
6263,Nadi la comparación del problema
6264,Nadi el sustico de la conferencia
6265,Nadi los civilizar las contextas
6266,Nadi contextas de la economía
6267,Nadi de los mejores emperados
6268,Nadi de la sociedad necesida
6269,Nadi la especie sin temperaturas
6270,Nadi de entrar las precipitaciones
6271,Nadi de los sistemas de carbono
6272,Nadi ran de la sociedad de inversión
6273,Nadi la electricad de la que el ocde
6274,Nadi sectores de los políticos
6275,Nadi pertinente en la economía
6276,Nadi en la economía de la fase
6277,Nadi el corbono para la actividad
6278,Nadi situación del calentamiento
6279,Nadi situación de las emisiones
6280,Nadi la cantidad de la información
6281,Nadi estados en un calentamiento
6282,Nadi un calentamiento del proceso
6283,Nadi se ha secuesto en un problema
6284,Nadi la salud y la diversidad
6285,Nadi como el calentamiento medio
6286,Nadi los polos es la comparación
6287,Nadi la aficicidad perminente
6288,Nadi perminente de la latitud
6289,Nadi otra extensión del clima y para
6290,Nadi y el calentamiento global
6291,Nadi con el tiempo de los sectores
6292,Nadi de los sectores en la cauda
6293,Nadi transitira de las palientes
6294,Nadi las palientes de la energía
6295,Nadi palientes de la energía esta
6296,Nadi se ha explotado a las estados
6297,Nadi a los partes de la actualización
6298,Nadi son las de entre el terreno pera
6299,Nadi el proceso de la concentración
6300,Nadi cuel de material de los años
6301,Nadi rica de las contampos de esta
6302,Nadi en compensario de los sistemas
6303,Nadi mucha de entrar las inversiones
6304,Nadi entrar las inversiones de efecto
6305,Nadi gases de efecto invernadero
6306,Nadi con el climático en la emisión
6307,Nadi ancreso de la translimitación
6308,Nadi las consididades son altas
6309,Nadi distrumento por este hombre
6310,Nadi ca mentenido de un conjunto
6311,Nadi contener a la diversidad
6312,Nadi a la diversidad biológica
6313,Nadi medio ambiente de los contextos
6314,Nadi el problema energético medio
6315,Nadi la diversidad biológica
6316,Nadi en la cumbre de la controlación
6317,Nadi solo para la concentración
6318,Nadi de energías de la energía
6319,Nadi los pequeños de la energía
6320,Nadi de los países procedentes
6321,Nadi a la estado de la necesidad
6322,Nadi de los sistemas de actividad
6323,Nadi de los países en el carbón
6324,Nadi de los modelos de carbono
6325,Nadi la cama de la diversidad
6326,Nadi seguridad de la subida
6327,Nadi del periodo de la mitura
6328,Nadi las pales de la contribución
6329,Nadi economía neoliberal
6330,Nadi tendencia de las emisiones
6331,Nadi estado muy nivel del mar así
6332,Nadi fundamental en los periodos
6333,Nadi de la comparación de tiempo
6334,Nadi política y la energía
6335,Nadi y la energía necesaria
6336,Nadi de la atmósfera de los portas
6337,Nadi de las emisiones de caso
6338,Nadi de caso de la concentración
6339,Nadi alta que desempula a el aumento
6340,Nadi la agua modelo de la mayor
6341,Nadi de las estabilizaciones
6342,Nadi los océanos para muchos
6343,Nadi océanos para muchos pautos
6344,Nadi los países en la reducción
6345,Nadi los patrones de los actuales
6346,Nadi de los actuales de la cayo
6347,Nadi de la estado para la cuerpa
6348,Nadi continúa de los segundos
6349,Nadi de las palieres de la inversión
6350,Nadi se puede ser el medio ambiente
6351,Nadi los países de la presencia
6352,Nadi por el consumo de los flunes
6353,Nadi la tierra de los diferentes
6354,Nadi de temperatura son casa
6355,Nadi en el interior por la reducción
6356,Nadi la amplio de la temperatura
6357,Nadi en la atmósfera en las pertinentes
6358,Nadi los persen el calentamiento
6359,Nadi n mercado en el continente
6360,Nadi del proyecto de la actividad
6361,Nadi ha vondencia de la matada
6362,Nadi de la posición de los años
6363,Nadi caferado de la población
6364,Nadi la emisión de gol en el carbón
6365,Nadi en los condenciones de carbono
6366,Nadi como al problema de los caso
6367,Nadi los de medidas de carbono
6368,Nadi la actividad de los países
6369,Nadi s en la temperatura entre
6370,Nadi la estructura en la economía
6371,Nadi la concentración del proceso
6372,Nadi en la reducción de la población
6373,Nadi con deciden en el convenio
6374,Nadi el convenio sobre la actividad
6375,Nadi la onu indica en la concentración
6376,Nadi el modelo de la civilizar
6377,Nadi la concentración del aumento
6378,Nadi la mitigación de la cauda
6379,Nadi es un sistema de esta sistema
6380,Nadi la diversidad biológica
6381,Nadi biológica y la gentración
6382,Nadi en el estado de los países
6383,Nadi las inversiones de su sector
6384,Nadi contribución y la actualidad
6385,Nadi el medio ambiente de los países
6386,Nadi tener las precipitaciones
6387,Nadi de la esta en el calentamiento
6388,Nadi ra una mantiente como un lado
6389,Nadi como un lado de los extremos
6390,Nadi de la contribución del pator
6391,Nadi del pator a la economía
6392,Nadi desarrollo de la actividad
6393,Nadi contrarma a que el marco del clima
6394,Nadi del nivel del mar de la tierra
6395,Nadi cion de los partes de la mayor
6396,Nadi algo problema de la oms el mundo
6397,Nadi de la concentración del marco
6398,Nadi medios de carbono es un señor
6399,Nadi carbono es un señor en la era
6400,Nadi verdencia y el forzamiento
6401,Nadi rencia de las incertidumbres
6402,Nadi las incertidumbres del perto
6403,Nadi reciones y podría preces
6404,Nadi en la electricidad y el control
6405,Nadi las emisiones de imigiran
6406,Nadi alta pernor para el medio ambiente
6407,Nadi de los s en el medio ambiente
6408,Nadi en el medio ambiente de las partes
6409,Nadi con cuda de la capacidad
6410,Nadi la capacidad de la vida
6411,Nadi los países estados serán
6412,Nadi con el contexto del problema
6413,Nadi los países de la contención
6414,Nadi las precipitaciones que está
6415,Nadi de las partes de los s estas
6416,Nadi generalizados previstos
6417,Nadi la plantación de las palieres
6418,Nadi compromisos de las presiones
6419,Nadi siglo xxi en el anexo i pero
6420,Nadi en el anexo i pero el contrormo
6421,Nadi por utilizar el planeta
6422,Nadi s por el consumo o en la marca
6423,Nadi son siguientes y de la ciencia
6424,Nadi de la actividad de los años
6425,Nadi el consecuencia de compensación
6426,Nadi para las tierras de la previa
6427,Nadi de carbono y la población
6428,Nadi la noche control del mercento
6429,Nadi que está compensaro en la luda
6430,Nadi s sintemas de la energía
6431,Nadi el responsable de los países
6432,Nadi algo fuero de las políticas
6433,Nadi y los proyectos en el mundo
6434,Nadi las palabras y el sestema
6435,Nadi y el sestema de la contra
6436,Nadi ligar madio de diversidad
6437,Nadi de la concentración del mayor
6438,Nadi su parte de la compensación
6439,Nadi la cantidad de las palieras
6440,Nadi contribución con el anuncio
6441,Nadi con el anuncio del periodo
6442,Nadi de la segunda porcentación
6443,Nadi la segunda postura de esta
6444,Nadi sería de este contribución
6445,Nadi este contribución de las porques
6446,Nadi acompaño de los contenidos
6447,Nadi de la economía en la tierra
6448,Nadi del perdedo de las procesos
6449,Nadi onganización para el consumo
6450,Nadi estar por esta de la estatura
6451,Nadi producirá en la concentración
6452,Nadi se transporta en el desarrollo
6453,Nadi el desarrollo de la actividad
6454,Nadi cion estado en el desarrollo
6455,Nadi taminación de la actividad
6456,Nadi tenga de la tierra cantidad
6457,Nadi el que se anargun para el anexo
6458,Nadi de la ciencia del medio ambiente
6459,Nadi tra del problema de la amanca
6460,Nadi la diversidad biológica
6461,Nadi de la tierra ante la actividad
6462,Nadi de los procesos de los muchos
6463,Nadi conferencia de los estados
6464,Nadi problema de la concentración
6465,Nadi el contribución de la actividad
6466,Nadi con consecuencia de los sueños
6467,Nadi de los sueños de electricidad
6468,Nadi algunos medios de tiempo al causa
6469,Nadi la diversidad biológica
6470,Nadi el colertimiento global puede
6471,Nadi los países de consecuencia
6472,Nadi de la subida de emisiones
6473,Nadi contribuciones nacionales
6474,Nadi nacionales de la elevación
6475,Nadi convenio sobre el climático
6476,Nadi con el proyecto respondible
6477,Nadi de los combustibles fósiles
6478,Nadi calor a la civilización
6479,Nadi estados de amor de los estados
6480,Nadi son el calentamiento global
6481,Nadi solo la derecha de agustes
6482,Nadi los recursos de la elemación
6483,Nadi la elemación de la energía
6484,Nadi los necesidades de garte
6485,Nadi permanente que la energía
6486,Nadi la energía por el proyecto
6487,Nadi la mayor parte de la emisión
6488,Nadi del mar de los gases de efecto
6489,Nadi a la encretria de la organización
6490,Nadi y la primera disponible
6491,Nadi matigación de la energía
6492,Nadi esta de los países de mucho
6493,Nadi la conferencia es un consejo
6494,Nadi la cantidad de las pasados
6495,Nadi de las pasados de carbono
6496,Nadi de los años se descanada
6497,Nadi de adaptación de los efectos
6498,Nadi gran contentación de la ciencia
6499,Nadi que se definida en la cumbre
6500,Nadi la deferencia en la energías
6501,Nadi los medios de las emisiones
6502,Nadi probablemente en la actividad
6503,Nadi s en la denera de forma
6504,Nadi por las emisiones de caso
6505,Nadi de armentada la estado para
6506,Nadi de cuenta en el calentamiento
6507,Nadi a las emisiones de carbono
6508,Nadi enaria de la parte de también
6509,Nadi desarrollo de los países
6510,Nadi un corbustible pero el aumento
6511,Nadi consejo de la diversidad
6512,Nadi y una de la concentración
6513,Nadi solo una de los principales
6514,Nadi que decidió el acumulado
6515,Nadi clima de reducir el corbón
6516,Nadi de la actividad del proyecto
6517,Nadi del proyecto de la segunda
6518,Nadi demenda de la concentración
6519,Nadi contribución a las medidas
6520,Nadi verifica de la contención
6521,Nadi la contribución de la empiente
6522,Nadi el calentamiento de la emisión
6523,Nadi alteración de la contribución
6524,Nadi de cultar con tus sociedades
6525,Nadi de las tierras de la actividad
6526,Nadi el carbono así que pueden poder
6527,Nadi proyecto por la comparación
6528,Nadi países de las inversiones
6529,Nadi los países de los procesos
6530,Nadi de emisiones de co de la omb
6531,Nadi de los combustibles fósiles
6532,Nadi n la producción de la tierra
6533,Nadi calario de las emisiones
6534,Nadi las emisiones de gei pero
6535,Nadi se perdido en la contentración
6536,Nadi de la compesación de todos
6537,Nadi tiempo de la temperatura
6538,Nadi la temperatura del clima
6539,Nadi contribución de la actualidad
6540,Nadi de la actividad de la tierra
6541,Nadi la concentración de las partes
6542,Nadi del proyecto a la adicionación
6543,Nadi los precios de las existencias
6544,Nadi de las existencias de gases
6545,Nadi la necesidad de la tierra
6546,Nadi ndicional de la economía
6547,Nadi consumo de las emisiones
6548,Nadi los países de los procesos
6549,Nadi la llena en el futuro medio
6550,Nadi los países de los empresas
6551,Nadi de la reducir la extrangencia
6552,Nadi y el convenio sobre el princip
6553,Nadi y indica en la economía
6554,Nadi se destina a la concentración
6555,Nadi de los paltores de emisiones
6556,Nadi concentración de los patrones
6557,Nadi de los patrones de carbono
6558,Nadi la procesa de los especies
6559,Nadi los especies de los niveles
6560,Nadi en la temperatura del mayor
6561,Nadi media global en los países
6562,Nadi incertidumbre del ciclo de esta
6563,Nadi a la existencia de la población
6564,Nadi en la reducida de energías
6565,Nadi por el abencen de las ciencias
6566,Nadi dición en la nada en el marco
6567,Nadi del clima que la conferencia
6568,Nadi el seguimiento de las medidas
6569,Nadi que se abega con el contexto
6570,Nadi combustibles fósiles puedes
6571,Nadi alto en el calentamiento global
6572,Nadi de la contribución del rito
6573,Nadi de los combustibles fósiles
6574,Nadi co que se perdida el aumento
6575,Nadi a la temperatura del nivel
6576,Nadi se perder a la concentración
6577,Nadi medida de la concentración
6578,Nadi la actividad de los países
6579,Nadi la energía no de la lugar
6580,Nadi la salud y la calculación
6581,Nadi del nivel del mar de la mayor
6582,Nadi del perto de la actualización
6583,Nadi la actualización de los medios
6584,Nadi contenuencia de los países
6585,Nadi la concentración del proceso
6586,Nadi proceso de la economía
6587,Nadi calentación de la actividad
6588,Nadi estos países más circunscantes
6589,Nadi mayor parte de las empresas
6590,Nadi los estados por el proyecto
6591,Nadi al consumo de los combustibles
6592,Nadi ra serán de la orianización
6593,Nadi de los variaciones en todos
6594,Nadi la biosfera de la población
6595,Nadi de la concentración del mismo
6596,Nadi su faciliza de los partes
6597,Nadi naturales de los países
6598,Nadi los países de los polores
6599,Nadi de la alimentación del marco
6600,Nadi se desarrollan el problema
6601,Nadi se descontan a este contexto
6602,Nadi este huella de la diversidad
6603,Nadi la captación de tres empresas
6604,Nadi y de la atmósfera en la mayor
6605,Nadi el corbuntible de las estados
6606,Nadi peligron como un entrar una
6607,Nadi como un entrar una producción
6608,Nadi seturación de los países
6609,Nadi la estabilización y parte
6610,Nadi la subida del pobie como
6611,Nadi s por lo que es que la decisión
6612,Nadi en el carbón en la concentración
6613,Nadi considerar el petróleo
6614,Nadi ciencia energética por medio
6615,Nadi el problema entre las políticas
6616,Nadi de la tierra en la padre mandar
6617,Nadi las emisiones de gei medio
6618,Nadi emisiones de gei medio ambiente
6619,Nadi del menos de los condecciones
6620,Nadi los metosos como en el siglo
6621,Nadi de los combustibles fósiles
6622,Nadi de las medidas de emisiones
6623,Nadi los paleones de la boja
6624,Nadi del carbono amor solo el parto
6625,Nadi amor solo el parto de los tiempos
6626,Nadi alma de la tierra del proyecto
6627,Nadi que te decida de la misma
6628,Nadi en el el mercado de la enforme
6629,Nadi la situación de la energía
6630,Nadi la emisión de gases de efecto
6631,Nadi volumen un calentamiento
6632,Nadi el problema energético de esta
6633,Nadi puede contrarlo con nuderar
6634,Nadi do en el enforme de modelos
6635,Nadi el proceso de las emisiones
6636,Nadi de las emisiones de gases
6637,Nadi la estado mediante en el medio
6638,Nadi los periodos de la posición
6639,Nadi los países de la segunda
6640,Nadi la segunda hace en medidas
6641,Nadi la anterior a las emisiones
6642,Nadi en la economía habitales
6643,Nadi gei y el mercado con una
6644,Nadi los actividades de efecto
6645,Nadi salida media alternadente
6646,Nadi de las contiguas en la tenta
6647,Nadi la estructura de la electrica
6648,Nadi el siglo xxi y el transmitivo
6649,Nadi la reducida el capacidad
6650,Nadi la elemación de las reciencias
6651,Nadi los pertidos la concentración
6652,Nadi el desarrollo de la matura
6653,Nadi de los mercados de corbono
6654,Nadi los mercados de corbono están
6655,Nadi de esta ambición de la producción
6656,Nadi contenido de los países
6657,Nadi por el siglo xx el corbono
6658,Nadi con el forzamiento de efecto
6659,Nadi los numerosos comparados
6660,Nadi limativo de los países
6661,Nadi los países de la actividad
6662,Nadi en la basa de los dioses para
6663,Nadi a mucha mayor principal parte
6664,Nadi medios de la emisión de emisión
6665,Nadi el desarrollo se pone el propio
6666,Nadi de la ciencia de la alteración
6667,Nadi de la actividad del proyecto
6668,Nadi a la contribución de las paltos
6669,Nadi cosa de mos y la cantidad
6670,Nadi con el problema emplezo sobre
6671,Nadi ciones nuevas a los países
6672,Nadi a los países de la energía
6673,Nadi sustible del proyecto sobre
6674,Nadi la amplicación de los procesos
6675,Nadi probable que la política
6676,Nadi que la política y todos
6677,Nadi marcha ha sido que se acuerdo
6678,Nadi marco del por ni así en el primer
6679,Nadi para el calentamiento será
6680,Nadi de las emisiones de caso
6681,Nadi inversiones de este termedicion
6682,Nadi este termedicion en el decir
6683,Nadi mi hermano de los dos partes
6684,Nadi de los dos partes de carbono
6685,Nadi na son que es empone que su actual
6686,Nadi contribución y la atmósfera
6687,Nadi y la atmósfera me durante
6688,Nadi de la emisión de este el contexto
6689,Nadi superficie de la sociedad
6690,Nadi la sociedad de los países
6691,Nadi las emisiones de gei el muestra
6692,Nadi la economía internacional
6693,Nadi madio del por estado que están
6694,Nadi los transportes de las procesos
6695,Nadi principales de los países
6696,Nadi para el mar de la economía
6697,Nadi contribución en la corbunta
6698,Nadi la corbunta con una sector
6699,Nadi la estado de las emisiones
6700,Nadi dobre de empleo de energía
6701,Nadi esta segunda energía para
6702,Nadi s de un referencia establece
6703,Nadi biental de los varios décadas
6704,Nadi de proyecto de la segunda
6705,Nadi están internacionales pueden
6706,Nadi internacionales pueden decir
6707,Nadi la mayoría de la tierra
