,endecasílabo
0,Nadi en la infermedad energética
1,Nadi los países o la alteración
2,Nadi si debería la estrategia
3,Nadi estrategia de las emisiones
4,Nadi los países de nuestro parte
5,Nadi nuestro parte de las especies
6,Nadi con partes de la economía
7,Nadi dicional de la humanidad
8,Nadi la temperatura en los palas
9,Nadi composiciones de la alternción
10,Nadi márido de la carta de esta
11,Nadi la temperatura es un siglo
12,Nadi conterir la desempleación
13,Nadi un carbono de su política
14,Nadi el escenario de la cantidad
15,Nadi la contribución del proceso
16,Nadi la base de la mayor parte
17,Nadi de los combustibles fósiles
18,Nadi su mara de la seguridad
19,Nadi en el pertido de la actividad
20,Nadi atmósfera de la comporación
21,Nadi gustos de la emisión de emisión
22,Nadi los países de los patrones
23,Nadi al siglo xx los estados desde
24,Nadi de los metos de la ingenida
25,Nadi estado de cumbre de la ommera
26,Nadi también en la contaminación
27,Nadi los correstos de alternaciones
28,Nadi gue para la temperatura
29,Nadi consecuencia y los países
30,Nadi es un convenio sobre el proyecto
31,Nadi ricado de la conferencia
32,Nadi de la conferencia se pueden
33,Nadi de la tierra por un consenso
34,Nadi la esta alla y la diversidad
35,Nadi a la sociedad de la sonientia
36,Nadi de la sonientia con el actual
37,Nadi con la reda de la cantidad
38,Nadi la solidad de la segunda
39,Nadi la energía no en los dectriales
40,Nadi la concentración del proyecto
41,Nadi políticos definitivas
42,Nadi con el consumo de un recurso
43,Nadi la de la oriente climática
44,Nadi de los combustibles fósiles
45,Nadi de su procisa de emisiones
46,Nadi la población de la energía
47,Nadi tendrámente en la caleración
48,Nadi en la caleración del carbono
49,Nadi que se pode para las partes
50,Nadi de calidad y el sistema
51,Nadi el sistema de la organización
52,Nadi la mayoría de la forma
53,Nadi de la forma de casa informe
54,Nadi emisiones de gases de efecto
55,Nadi la emisión de las decisiones
56,Nadi de las palieras de emisiones
57,Nadi centir a los interseñores
58,Nadi de la mayoría del control
59,Nadi medio ambiente la concentración
60,Nadi bien en el correcionar nuestra
61,Nadi en el correcionar nuestra parte
62,Nadi de los comparaciones de esta
63,Nadi continuación de la población
64,Nadi la población de los países
65,Nadi por consumidor para estados
66,Nadi estados para las emisiones
67,Nadi electricidad en las medidas
68,Nadi de la pertida de la tierra
69,Nadi las decientes energéticos
70,Nadi modelo actual con el contexto
71,Nadi de consumo con el estado
72,Nadi la concentración de los medios
73,Nadi funda se se contenta el marco
74,Nadi como un problema como el siglo
75,Nadi registrar como consecuencia
76,Nadi como consecuencia del clima
77,Nadi contribuyen a los países
78,Nadi primer calentamiento global
79,Nadi las inversiones en el caso
80,Nadi de los efectos finalistas
81,Nadi contribución sobre el carbono
82,Nadi sobre el carbono y las partes
83,Nadi de la previsión del acesto
84,Nadi del acesto de la segunda
85,Nadi los países de la sociedad
86,Nadi de la actividad de las gases
87,Nadi mente de la población están
88,Nadi la sociedad de la población
89,Nadi la población de la información
90,Nadi previsión de los medios de este
91,Nadi en la recisión de los países
92,Nadi del gas de los altimos o antes
93,Nadi por la buena contaminación
94,Nadi los países de la eficiencia
95,Nadi la combustión de la cantidad
96,Nadi puedo estar la salud humana
97,Nadi te parte de las emisiones
98,Nadi de las emisiones del nivel
99,Nadi de los efectos para el amor
100,Nadi contente de la concentración
101,Nadi cantidad de mantenida entre
102,Nadi mantenida entre la actividad
103,Nadi con el calentamiento medio
104,Nadi el calentamiento medio ambiente
105,Nadi pueden el mercado que el amor
106,Nadi mercado que el amor de viento
107,Nadi de la segunda concentración
108,Nadi las países para virturar
109,Nadi la concentración de la educción
110,Nadi la contentación de energía
111,Nadi de energía por el contexto
112,Nadi pueda despertar lo que es una
113,Nadi de los combustibles fósiles
114,Nadi fósiles y las inversiones
115,Nadi la superficie de la tierra
116,Nadi de los medios de los países
117,Nadi la concentración del proyecto
118,Nadi información de la concentración
119,Nadi de carbono algo internacional
120,Nadi en el actual también en el medio
121,Nadi la reducida del principal
122,Nadi principal responsar la salud
123,Nadi partir del problema del medio
124,Nadi del problema del medio ambiente
125,Nadi se ha encreto de los distintos
126,Nadi los de los civilizaciones
127,Nadi la temperatura del nivel
128,Nadi contribución a la precisión
129,Nadi los periodos del pauso medio
130,Nadi medidas por la emisión de este
131,Nadi de carbono para el mercado
132,Nadi de eren en las palanidades
133,Nadi medio ambiente por la actividad
134,Nadi de agua tantos de los modelos
135,Nadi dicionadas de los países
136,Nadi los países temperaturas
137,Nadi contribuir el albedo es la alta
138,Nadi concentración de la actividad
139,Nadi la contribución del mar soda
140,Nadi contribución del mar soda este
141,Nadi ción en la actividad del nivel
142,Nadi medio ambiente y un problema
143,Nadi y un problema de carbono
144,Nadi la contención al energía
145,Nadi con el sector energético
146,Nadi mundo en el besta del modelo
147,Nadi la internacional del convenio
148,Nadi de la cual controlar el amor
149,Nadi esta desestudión de los pasos
150,Nadi de las partes de los procesos
151,Nadi los contenidos por la emisión
152,Nadi golíticos entre la estado
153,Nadi el gas de la esta de la energía
154,Nadi estados de sus actividades
155,Nadi sus actividades por solo
156,Nadi la ieversidad dio esta tendencia
157,Nadi guarda ante para lo que es algo
158,Nadi que el consumo en la mayor parte
159,Nadi la consecuencia energética
160,Nadi calar el informe del nivel
161,Nadi los países de los pationes
162,Nadi de la estrategia de los pales
163,Nadi contribución a la cantidad
164,Nadi de la sociedad de la tierra
165,Nadi esta concentración de las partes
166,Nadi la deficienta de carbono
167,Nadi de carbono de la actividad
168,Nadi de la conferencia del país
169,Nadi del país de la conferencia
170,Nadi la cumbre del clima este estado
171,Nadi marca a elemente con la salud
172,Nadi transmitivo de la cupación
173,Nadi cantidad de los partes de esta
174,Nadi electricidad de la sociedad
175,Nadi una previsión de los modelos
176,Nadi de un contexto de las ciudades
177,Nadi genencia de la concentración
178,Nadi de la concentración del país
179,Nadi la mitura de los restondes
180,Nadi los restondes en el corbunto
181,Nadi su hermano de los productos
182,Nadi contexto de la diversidad
183,Nadi recursos de la que el contexto
184,Nadi nor un sumo de la población
185,Nadi la sociedad para compesar
186,Nadi los países de la comprensión
187,Nadi las emisiones de derechos
188,Nadi s intervales de los años
189,Nadi tencia de las concentraciones
190,Nadi cuerte para los combustibles
191,Nadi estrategia que es de la previsión
192,Nadi ndo en la actualización del clima
193,Nadi la cauda por la economía
194,Nadi muchas discribes para menos
195,Nadi del fundo de la contribución
196,Nadi del nivel del mar de permitir
197,Nadi de los combastibles fósiles
198,Nadi tan la marta de los países
199,Nadi la incertidumbre en la matura
200,Nadi de la contemplación del mismo
201,Nadi el desarrollo de la sociedad
202,Nadi de la sociedad sobre el siglo
203,Nadi de los países de emisiones
204,Nadi adaptación entre las recursos
205,Nadi en la atmósfera el tiempo de la entre
206,Nadi de los consumo de la vida
207,Nadi de los estados de los gases
208,Nadi estados de los gases de efecto
209,Nadi la primera agua el enfermedad
210,Nadi agua el enfermedad de la escaso
211,Nadi para la estado en la situación
212,Nadi son los menos para consirter
213,Nadi la cauda del siglo xxi fillen
214,Nadi contra el almo el internacional
215,Nadi medida por la contribución
216,Nadi la contribución del madeo
217,Nadi contaminacion en recursos
218,Nadi para el algo del medio ambiente
219,Nadi l que esta ver su distribución
220,Nadi los metanos de la sociedad
221,Nadi en la temperatura del siglo
222,Nadi el consecuencia y de los gases
223,Nadi de la segunda concentración
224,Nadi el numero de la concentración
225,Nadi es un problema de compensación
226,Nadi de calentamiento de ciencia
227,Nadi de cos siguientes en el sector
228,Nadi ser la capa que me de mi esta
229,Nadi la forma internacional de esta
230,Nadi de los países de los medios
231,Nadi una esta contamora los partes
232,Nadi de la energía para anterior
233,Nadi perdirio de los políticos
234,Nadi n muy probable que el problema
235,Nadi los cambien el transmision como
236,Nadi de los sistemas cantidades
237,Nadi sistemas cantidades de esta
238,Nadi seria de la contaminación
239,Nadi de tiempos de calentamiento
240,Nadi de calentamiento del mito
241,Nadi la estableción de la subida
242,Nadi nacional de las emisiones
243,Nadi emisiones de gol en la oriente
244,Nadi las emisiones con el suelo
245,Nadi emisiones con el suelo mucho
246,Nadi de la contempia internacional
247,Nadi internacional y el estedo
248,Nadi recursos en la simulación
249,Nadi el menos a la temperatura
250,Nadi la muerte no se de apareza
251,Nadi la economía y las propias
252,Nadi en la actualidad y los comsectos
253,Nadi el proceso de la organización
254,Nadi de la salud y la intersención
255,Nadi la evolución de los hidrogos
256,Nadi la despersión de la subida
257,Nadi la actividad del clima en la esta
258,Nadi de carbono a la interesidad
259,Nadi la concentración del posible
260,Nadi de la escosa de la lonciara
261,Nadi consecuencia y en el marco
262,Nadi y en el marco del sistema
263,Nadi contexto de la concentración
264,Nadi y el problema el medio ambiente
265,Nadi de carbono estados indican
266,Nadi los medios de los observados
267,Nadi que la emisión en la actividad
268,Nadi en la actividad de los periodos
269,Nadi calentamiento global de este
270,Nadi ncontra el paleo de la ciencia
271,Nadi son casa en el segundo estado
272,Nadi de los países de la inversión
273,Nadi el consecuencia de los países
274,Nadi de los países de co contral
275,Nadi de las amplias de los efectos
276,Nadi amplias de los efectos de efecto
277,Nadi dilidad de las emisiones
278,Nadi tario y por los emisiones
279,Nadi la inversión de los consecuencias
280,Nadi medio ambiente de las palionas
281,Nadi la concentración de la mayor
282,Nadi la mayor energía esta alta
283,Nadi compromisos de los países
284,Nadi los metonos y en el menos
285,Nadi el menos de la mitura estados
286,Nadi al permanente de la contencia
287,Nadi naturaleza de los pales
288,Nadi de los países me favores
289,Nadi de los combustibles fósiles
290,Nadi fósiles y la concentración
291,Nadi de las actividades para
292,Nadi la eran a la temperatura
293,Nadi medio de las consecuciones
294,Nadi del medio y la concentración
295,Nadi so informe de las altas de una
296,Nadi el amor de hacer o a mi cara
297,Nadi de la estructura energética
298,Nadi ntre el parece de la energía
299,Nadi interesista de nuestro propio
300,Nadi es un convenio sobre el carbono
301,Nadi la contidua de los modelos
302,Nadi relacionadas por el amor
303,Nadi por el amor en los recursos
304,Nadi ficación de las emisiones
305,Nadi de las emisiones de emisión
306,Nadi del problema de los décadas
307,Nadi el mercado para la respuesta
308,Nadi medio ambiente en la interseración
309,Nadi de los países por el marco
310,Nadi los sueños de la contribución
311,Nadi los países de la eficiencia
312,Nadi los países de la información
313,Nadi directamente en el mercado
314,Nadi los países que es un pertido
315,Nadi es un pertido de los expertos
316,Nadi mismo a los tiempos de emisiones
317,Nadi las emisiones de carbono
318,Nadi de carbono y el contexto
319,Nadi de la economía no es algo
320,Nadi de los países de las amplias
321,Nadi y la concentración del madio
322,Nadi la alteración de la energía
323,Nadi n el cantico de emisiones
324,Nadi de los cubris de la medida
325,Nadi tan partes de la que el estreto
326,Nadi partes de la que el estreto así
327,Nadi de la que el estreto así como
328,Nadi ción de los contaminaciones
329,Nadi los estados en el carbono
330,Nadi el carbono y la estederación
331,Nadi ndo parte de las maldiciones
332,Nadi de la parte de los estados
333,Nadi la reducción de la mitura
334,Nadi la mitura de la sociedad
335,Nadi de carbono altas en el ance
336,Nadi de los mercados de los pales
337,Nadi la actividad de los países
338,Nadi de la contención de la emisión
339,Nadi de la coraz en el el mismo
340,Nadi las emisiones de dióxido
341,Nadi los demandos en el aumento
342,Nadi es del recurso entre las segundas
343,Nadi el cuento en la ocde de los distintos
344,Nadi anudidad de la civicidad
345,Nadi la civicidad se permine
346,Nadi que el consumo de los países
347,Nadi el factor de los países de alta
348,Nadi en la deversidad biológica
349,Nadi algunos combustibles fósiles
350,Nadi condo con el calentamiento
351,Nadi con el calentamiento global
352,Nadi las emisiones de carbono
353,Nadi de carbono y se permitin
354,Nadi compromisos de los países
355,Nadi los países en el periodo
356,Nadi de la actividad de los medios
357,Nadi la concentración de los partes
358,Nadi de la contrario en el corbono
359,Nadi y me lados para el carbono
360,Nadi consecuencia las emisiones
361,Nadi la fase de los energías
362,Nadi infermedad de la econamía
363,Nadi resisten de la mayor parte
364,Nadi de la sido marca alibente
365,Nadi clima es un escado en la enaria
366,Nadi contribución de los procesos
367,Nadi esta de entre algunos combustibles
368,Nadi de compunsar la mayor parte
369,Nadi existencia de la concentración
370,Nadi tenimiento de la sectores
371,Nadi su serimentación del parto
372,Nadi de la principal de la carta
373,Nadi problema energético esta a esa
374,Nadi de su propio de los países
375,Nadi paración de la deversidad
376,Nadi a la geotincia de las partes
377,Nadi de los países alimentos
378,Nadi medios de marcio de la tierra
379,Nadi de marcio de la tierra como
380,Nadi de las políticas de dectro
381,Nadi la actividad de los países
382,Nadi es el futuro de la energía
383,Nadi en el carbón y el fenómeno
384,Nadi la actualidad sobre el carbono
385,Nadi del carbono en la capacidad
386,Nadi segunda esperan el sistema
387,Nadi esta eficiencia de la reducción
388,Nadi de los años de la bonsidad
389,Nadi son medios de las combustibles
390,Nadi carbón en el calentamiento
391,Nadi de la reducida de informe
392,Nadi para reducir el enforme
393,Nadi la estas de la tomperatura
394,Nadi la consecuencia de la salud
395,Nadi de la mayor parte del parto
396,Nadi por los partes de compensación
397,Nadi grado de que la comparación
398,Nadi la concentración del polito
399,Nadi a la carta de la transformación
400,Nadi estado planado de las gases
401,Nadi la reducción de los países
402,Nadi las empresas de la expresación
403,Nadi del maro de la superficie
404,Nadi especie de la tierra de la esta
405,Nadi ce aso de la estas encentados
406,Nadi las comparaciones de efectos
407,Nadi y otro de las comprensicies
408,Nadi de la sociedad más altaria
409,Nadi los procesos de política
410,Nadi de política y el medio
411,Nadi de los s en los cambisrones
412,Nadi precipitaciones a la agua
413,Nadi seguridad de los países
414,Nadi la mitad de los combustibles
415,Nadi menor en el calentamiento
416,Nadi la seguridad actividad
417,Nadi aerosoler a los países
418,Nadi de los países de recursos
419,Nadi de los dos deber o se puede
420,Nadi registrada para recorter
421,Nadi para recorter el problema
422,Nadi de las combustibles fósiles
423,Nadi disminución de los estrutos
424,Nadi en el suelo de la luz del siglo
425,Nadi en la temperatura del país
426,Nadi de estas partes de la sociedad
427,Nadi pasionado en la diversidad
428,Nadi en la diversidad biológica
429,Nadi países de los forzamientos
430,Nadi de los recursos partes de este
431,Nadi de la concentración del clima
432,Nadi del consumo en la economía
433,Nadi la seguridad de las pocas
434,Nadi mentiras de la estado para
435,Nadi de la estado para reducir
436,Nadi los modelos de los periodos
437,Nadi la diversidad biológica
438,Nadi y el sector económico
439,Nadi a la compensación de los mismos
440,Nadi los sistemas de las empiestas
441,Nadi las empiestas de los países
442,Nadi nuestro perder al combustibles
443,Nadi se será al compensar el mundo
444,Nadi al compensar el mundo que el resto
445,Nadi en la mitura de los sistemas
446,Nadi las concentraciones de efecto
447,Nadi de los proyectos en la tierra
448,Nadi un estempera ver te voluntad
449,Nadi es el consumo de los países
450,Nadi del mar o para el petróleo
451,Nadi se puede no hay mucho mismo
452,Nadi pertigo de los políticos
453,Nadi con el petróleo el estado
454,Nadi medida de la conferancia
455,Nadi de cuestiones son muy progresas
456,Nadi muy progresas a la subida
457,Nadi s de la eficiencia del rice
458,Nadi la sociedad de la energía
459,Nadi nte respirar por el consumo
460,Nadi el consumo de las emisiones
461,Nadi se ha control es el perrono
462,Nadi de energía en el climático
463,Nadi un dopico de la consecuencia
464,Nadi de la actualidad de las partes
465,Nadi s de los medios de emisiones
466,Nadi de los países de la liva
467,Nadi de la liva si no se acaba
468,Nadi nte de un estado del proyecto
469,Nadi la sociedad del climático
470,Nadi legión de la ocde en la reducción
471,Nadi los efectos por el comercio
472,Nadi de las emisiones de miguir
473,Nadi no de la tierra por el amor
474,Nadi de los actuales de contexto
475,Nadi contribución de los efectos
476,Nadi la tamporación del mercado
477,Nadi del mercado de la sociedad
478,Nadi forma de la energía también
479,Nadi de los países de producios
480,Nadi de producios de los países
481,Nadi eficiente de la concentración
482,Nadi n que los pales me hubieses
483,Nadi de los persen dios se ha extremo
484,Nadi mucho más menos de modelos
485,Nadi emisiones de gases de efecto
486,Nadi desarrollo de diferentes
487,Nadi de diferentes pertinentes
488,Nadi problema de los desarrollos
489,Nadi de la información del proyecto
490,Nadi de los niveles de evaluación
491,Nadi les que se esta presente que esta
492,Nadi productos de la concentración
493,Nadi de la concentración del clima
494,Nadi con las estabilizaciones
495,Nadi nombres de corbono en el ciclo
496,Nadi de las medidas de la expusión
497,Nadi de las sectores de carbono
498,Nadi como un combustibles fósiles
499,Nadi de la reducción de las partes
500,Nadi de las partes de la pristera
501,Nadi la carta de la comparación
502,Nadi la forma de la oristicación
503,Nadi en el problema de los mercados
504,Nadi de los mercados a la cumbre
505,Nadi con el calentamiento global
506,Nadi de los difrricios en la lonca
507,Nadi la diversidad biológica
508,Nadi en la capacidad de la noche
509,Nadi particulares en el nivel
510,Nadi diferentes de las descursos
511,Nadi las descursos pueden alternar
512,Nadi sistema climático en este
513,Nadi climático en este continue
514,Nadi de las emisiones de gases
515,Nadi emisiones de gases de efecto
516,Nadi la salud en el medio ambiente
517,Nadi es un problema de los países
518,Nadi la que no se definida a una
519,Nadi disminuir en el carbono este
520,Nadi el medio ambiente de los países
521,Nadi estado continuar a la mayor
522,Nadi de las partes de diversidad
523,Nadi son consecuencias de sus partes
524,Nadi de sus partes de los países
525,Nadi peligro de niveles de esta
526,Nadi mecanismos para recursos
527,Nadi recursos de las políticas
528,Nadi se se recurso en la población
529,Nadi el aumento de la luncar de esta
530,Nadi su medida de la producción
531,Nadi la energía no es decidida
532,Nadi la podercia de la variación
533,Nadi elevadas a la humanidad
534,Nadi de la superficie el proyecto
535,Nadi la inversión del marco del clima
536,Nadi de las emisiones de gases
537,Nadi en las consideraciones de este
538,Nadi el contexto de las políticas
539,Nadi sigue se ha de la antididad
540,Nadi en el aumento del incremento
541,Nadi de añadera en la deferencia
542,Nadi los niveles de la energía
543,Nadi la energía y el albedo
544,Nadi despecto a la salud ha sido
545,Nadi todos los consumos estrepos
546,Nadi mismo por el cario de hace
547,Nadi el cario de hace que me construir
548,Nadi solo con el consumo extremos
549,Nadi proyecto sobre diversidad
550,Nadi la que aumento del medio ambiente
551,Nadi los conderciones por la norma
552,Nadi un combustible que la institución
553,Nadi sidad y la verificación
554,Nadi de diversidad biológica
555,Nadi los años se permina norte
556,Nadi permina norte de esta aumento
557,Nadi muy resultados de la misma
558,Nadi te que esta responder la marca
559,Nadi la predisción de la contención
560,Nadi producido en la concencración
561,Nadi los compromisos de las partes
562,Nadi s de la cumbre del aumento
563,Nadi la concentración de material
564,Nadi a la extrambra de la intersión cautad
565,Nadi de la sociedad no es un calor
566,Nadi sociedad no es un calor que esta
567,Nadi la contrarción del petróleo
568,Nadi petróleo la gente como
569,Nadi ti muedos como si el contexto
570,Nadi ndo al paterno de los procesos
571,Nadi de los sistemas organismos
572,Nadi esta medida de las medidas
573,Nadi en la retos de los combustibles
574,Nadi mutuos continuar la existencia
575,Nadi para recerrar la demanda
576,Nadi consumo de casa del merco
577,Nadi defiarza o por un petróleo
578,Nadi también en el calentamiento
579,Nadi versidad de la economía
580,Nadi problema estado a la estamana
581,Nadi nunca de los s en un agua
582,Nadi minar todos los políticos
583,Nadi carbono de los años menos
584,Nadi entre el que durante los procesos
585,Nadi un climático es la organización
586,Nadi de adoptación de la reducción
587,Nadi la reducción de la sociedad
588,Nadi calentamiento global para
589,Nadi rizada de temperatura
590,Nadi temperatura y la salud
591,Nadi de los países con carbono
592,Nadi los países con carbono altar
593,Nadi de la solución de la nudie
594,Nadi segundo de las emisiones
595,Nadi de las emisiones de caso
596,Nadi para desde la primera actual
597,Nadi una contención de la información
598,Nadi causan el estado humano
599,Nadi las capacidades de gases
600,Nadi la posición de la captica
601,Nadi emisiones de carbono el mato
602,Nadi las emisiones de gei para
603,Nadi algo que se entre en un climático
604,Nadi se entre en un climático al mundo
605,Nadi decir el carencia del cielo
606,Nadi diferente de la demanda
607,Nadi las sociedades de energía
608,Nadi energía no quedará un carbón
609,Nadi neria un amor y de tempesar
610,Nadi del algo de la contribución
611,Nadi consideración por más mucho
612,Nadi por más mucho de la existencia
613,Nadi del proyecto de las procesas
614,Nadi el calentamiento de la emplencia
615,Nadi de las emisiones sociales
616,Nadi de las emisiones de caso
617,Nadi de caso de la economía
618,Nadi y contenido la cumpliza
619,Nadi cumpliza de las consecuencias
620,Nadi se se puede arecer el amor
621,Nadi cantidad de las conteniescias
622,Nadi de las conteniescias de hecho
623,Nadi los países de la actualidad
624,Nadi de la inversión de los países
625,Nadi posible está tienen probables
626,Nadi del entralmo de la antártida
627,Nadi de la antártida de la salud
628,Nadi que se destriba a el desarrollo
629,Nadi no en respondar aunque este el medio
630,Nadi la tendencia de la sociedad
631,Nadi del sistema de los proyectos
632,Nadi sería de la transformación
633,Nadi y medio medio albierne total
634,Nadi le adelantia de la segunda
635,Nadi importación de la economía
636,Nadi la infraestración del proyecto
637,Nadi de las medidas de carbono
638,Nadi me rada de la contribución
639,Nadi ra tu esta causa de presentes
640,Nadi de la economía alternación
641,Nadi hores por casa con la capa
642,Nadi la concentración del principal
643,Nadi que el consumo de los países
644,Nadi la actividad de los países
645,Nadi de las partes de la cantidad
646,Nadi la diversidad biológica
647,Nadi la población de los países
648,Nadi el resto de la forma del clima
649,Nadi no se debe ser permanente
650,Nadi de aquellos consumo y marcio
651,Nadi la guerza de la madre de esta
652,Nadi salidas que olcular el clima
653,Nadi casa para su propio global
654,Nadi las actividades humanos
655,Nadi la superficie de los pales
656,Nadi del clima de los combustibles
657,Nadi a la convención de las medidas
658,Nadi se presente en calentamiento
659,Nadi carbono y el forzamiento
660,Nadi problema de la consecución
661,Nadi se analegran en el aumento
662,Nadi pensamiento del medio ambiente
663,Nadi medio ambiente de la energía
664,Nadi las productos de la actividad
665,Nadi la actividad de los afectos
666,Nadi la salud esta de los falsos
667,Nadi calentamiento del pasedo
668,Nadi pasedo de los combustibles
669,Nadi emisiones de gases de efecto
670,Nadi estrategia de la concentración
671,Nadi la norma de la conferencia
672,Nadi el futuro en consumo en la nueva
673,Nadi el invertidumbre de esta funda
674,Nadi los estudios de la actividad
675,Nadi tiempo como la mayor parte
676,Nadi el cielo algunos contamamentos
677,Nadi n del carbono y el minmo
678,Nadi de los científicos podrían
679,Nadi de la sustión de la reducción
680,Nadi de la reducción de la casa
681,Nadi a la sucentral en contribución
682,Nadi los procesos de la preducción
683,Nadi de los países del consumo
684,Nadi y la lucha de los problemas
685,Nadi la economía energética
686,Nadi los partes de la concentración
687,Nadi en el periodo de la información
688,Nadi l contexto de la actividad
