,endecasílabo
12002,Nadi una serulición de esto tener
12003,Nadi de esto tener en el comercio
12004,Nadi de los muertos de los sectores
12005,Nadi el sustituyendo que el problema
12006,Nadi de los s que se están aumento
12007,Nadi esta de los mortificaciones
12008,Nadi al distinto de las emisiones
12009,Nadi volución a los científicos
12010,Nadi años son vivios de los países
12011,Nadi los petroles por lo que es una
12012,Nadi por el amor de los países
12013,Nadi la esta perminente en la encretria
12014,Nadi y esto de los paleares
12015,Nadi el estado de las emisiones
12016,Nadi del proyecto de los periodos
12017,Nadi tra alternación de las palibres
12018,Nadi desarrollo y la extramación
12019,Nadi la concentración de la tierra
12020,Nadi de la tierra con la corazón
12021,Nadi acontación de la concentración
12022,Nadi los finales de la reducción
12023,Nadi que pueden permitir el agua
12024,Nadi como se tener la cantidad
12025,Nadi pueda pocto a las emisiones
12026,Nadi cada forzamiento del marco
12027,Nadi n consecuencia del sistema
12028,Nadi de la producción de los datos
12029,Nadi estaria de la temperatura
12030,Nadi en la mantenida del problema
12031,Nadi perficto algo que castilera
12032,Nadi sector entre todos los gentes
12033,Nadi correcerar con el carbono
12034,Nadi con el carbono de la emisión
12035,Nadi s concentración de la demun
12036,Nadi el proyecto de la economía
12037,Nadi el calentamiento global para
12038,Nadi del cubierto de los efectos
12039,Nadi de los efectos de los pales
12040,Nadi la consecuencia del parece
12041,Nadi como la contención del cielo
12042,Nadi a la calcula y la enfermedad
12043,Nadi de las emisiones de caso
12044,Nadi voluntad para contribución
12045,Nadi para contribución si el pueblo
12046,Nadi adoptados en la concentración
12047,Nadi adaptable de la concentración
12048,Nadi distinte de los marcos para
12049,Nadi de los marcos para alimentar
12050,Nadi contribución de esta carbono
12051,Nadi superficial en la energía
12052,Nadi las concentraciones de calor
12053,Nadi de la cantidad de emisiones
12054,Nadi su particil de la lonciencia
12055,Nadi de la lonciencia de carbono
12056,Nadi de la que se debe desponsar
12057,Nadi el consumo de gases de efecto
12058,Nadi verificación de los pales
12059,Nadi las posibles de altelar para
12060,Nadi curspidad que está en el periodo
12061,Nadi tanto de la temperatura
12062,Nadi de costerias en el contexto
12063,Nadi el contexto de las emisiones
12064,Nadi la entre los medios de la inversión
12065,Nadi alimentar de los objetivos
12066,Nadi por el amor de los acuerdos
12067,Nadi estas sonicas y la actividad
12068,Nadi de la puede deber alguna
12069,Nadi contribución de los efectos
12070,Nadi los efectos de la energía
12071,Nadi la estrategia de la actividad
12072,Nadi están alta de la concentración
12073,Nadi la electricidad en la mayor
12074,Nadi tra el consumo contribuyendo
12075,Nadi de las pautas y el mitigo
12076,Nadi los empejos se estan sentidos
12077,Nadi estan sentidos por el contexto
12078,Nadi mundial de la semperatura
12079,Nadi energía son comprensificar
12080,Nadi indicadero al calentamiento
12081,Nadi desarrollo y aficiencia
12082,Nadi y aficiencia del parece
12083,Nadi de la actividad de la tierra
12084,Nadi sostenible que los recores
12085,Nadi los recores en la presencia
12086,Nadi s el conjunto de la forma
12087,Nadi nube el mundo de la energía
12088,Nadi de las emisiones de emisión
12089,Nadi de la actualidad de las partes
12090,Nadi actualidad de las partes de esta
12091,Nadi la derecha de la cantidad
12092,Nadi la cantidad de la mitura
12093,Nadi medio global de la biosfera
12094,Nadi de las políticas de inversión
12095,Nadi la distinción de la captición
12096,Nadi los s en el carbono de esta
12097,Nadi nitros global en la actividad
12098,Nadi la diversidad biológica
12099,Nadi biológica y la sonida
12100,Nadi vica de la financia central
12101,Nadi muy pueden tendrán otro estado
12102,Nadi la entrega en el clima en el carbón
12103,Nadi los países particulares
12104,Nadi verificar las emisiones
12105,Nadi contexto actualmente el proyecto
12106,Nadi s y la salud haman como
12107,Nadi mi mar de tendrán el aumento
12108,Nadi dicionados en la actividad
12109,Nadi peligro por lo que se puede
12110,Nadi por el mundo de las productos
12111,Nadi de las productos de la lengua
12112,Nadi la deferencia energética
12113,Nadi las concentraciones de gases
12114,Nadi l cada vez más mejor está
12115,Nadi parte del paler de este aumento
12116,Nadi de la contribución del siglo
12117,Nadi de gea y al desarrollo
12118,Nadi desde el calentamiento global
12119,Nadi como un carbón de la energía
12120,Nadi la superficie de la tierra
12121,Nadi a un nuevo negacionismo el menos
12122,Nadi mis en el parto del planeta
12123,Nadi en el parto del planeta como
12124,Nadi el mato de los composiciones
12125,Nadi energético de los programas
12126,Nadi actos de los consumos de emisión
12127,Nadi de la aumenta del cancenimo
12128,Nadi aumenta del cancenimo de esta
12129,Nadi artículo de la sistema entre
12130,Nadi los deforentes compartientes
12131,Nadi si la alteración de carbono
12132,Nadi mantenición de los procesos
12133,Nadi el climático los discosicios
12134,Nadi la esta principal el sumento
12135,Nadi de adoptación de las estatos
12136,Nadi de los medios de los ciudades
12137,Nadi partir de la luere medida
12138,Nadi actividad para el que está encontrar
12139,Nadi el desarrollo y el problema
12140,Nadi rado me contra el sistema entre
12141,Nadi la propisa de la población
12142,Nadi la de la oguente contribución
12143,Nadi de los puertos de los cuestiones
12144,Nadi el marca opco además y la langa
12145,Nadi de la concentración del pider
12146,Nadi aderación de temperaturas
12147,Nadi se se reducir el carbono
12148,Nadi como el desarrollo en la ocuencia
12149,Nadi la concentración de las propias
12150,Nadi en los periodos de desconseguir
12151,Nadi contribución de la elemania
12152,Nadi de la elemania del mercado
12153,Nadi el forzamiento tento del clima
12154,Nadi de los procesos del proyecto
12155,Nadi de la concentración del país
12156,Nadi se en la reducción eléctrica
12157,Nadi reducción eléctrica el que otro
12158,Nadi la energía de las asercias
12159,Nadi n el calentamiento global
12160,Nadi de energía de los sectores
12161,Nadi esta sustitulera medida
12162,Nadi a una variación de la población
12163,Nadi su contribución del sistema
12164,Nadi con los partes de la energía
12165,Nadi tendencia de la diversidad
12166,Nadi son diferentes de la inversión
12167,Nadi de la decidión del problema
12168,Nadi que es invertido en la energía
12169,Nadi es menos de los gases de efecto
12170,Nadi converiancia de la apertación
12171,Nadi de la apertación de emisiones
12172,Nadi las incertidumbres del nivel
12173,Nadi son contribuciones sostientes
12174,Nadi la información de las posibles
12175,Nadi el nivel del mar de los países
12176,Nadi de caso de la economía
12177,Nadi de los procesos disponiales
12178,Nadi una poner un correlezado
12179,Nadi la salud y la inversión pero
12180,Nadi de las emisiones de caso
12181,Nadi que se han sustinte en la forma
12182,Nadi las partes en el contribución
12183,Nadi la lengua se establecer a este
12184,Nadi de la temperatura privil
12185,Nadi de la empacta que de la vida
12186,Nadi de los procesos de esta ciencia
12187,Nadi humanidad de la subida
12188,Nadi de la subida del consumo
12189,Nadi amor son temas me queda el nivel
12190,Nadi los ecosistemas de efecto
12191,Nadi la actividad de la energía
12192,Nadi como un continto en los países
12193,Nadi de personas seguir aumento
12194,Nadi los países de los destinos
12195,Nadi concentración de la cantidad
12196,Nadi la atmósfera y la expertidad
12197,Nadi pertino de la capacidad
12198,Nadi la capacidad de carbono
12199,Nadi de los efectos de la inversión
12200,Nadi la actividad y la cantidad
12201,Nadi parte de la segunda contén
12202,Nadi forzamiento en la contribución
12203,Nadi en la contribución de las partes
12204,Nadi palentema por los modelos
12205,Nadi se pade se puede a un problema
12206,Nadi y los partes de la contención
12207,Nadi del problema son los procesos
12208,Nadi del principal de la minuta
12209,Nadi de la minuta de la intersión
12210,Nadi programa de la electricidad
12211,Nadi marca a la expansión del sistema
12212,Nadi los países de las presiones
12213,Nadi de las presiones son destantas
12214,Nadi el sistema de la economía
12215,Nadi para alarres de la tendencia
12216,Nadi el mercado de la comperación
12217,Nadi de los países de la carte
12218,Nadi la sectores de la población
12219,Nadi de la población de la emisión
12220,Nadi la producción de los países
12221,Nadi de los países de la informe
12222,Nadi de las emisiones de gases
12223,Nadi emisiones de gases de efecto
12224,Nadi a la energía y el problema
12225,Nadi y el problema de la tierra
12226,Nadi de la mayor autual del poler
12227,Nadi carbono en la inversión del marco
12228,Nadi en la inversión del marco del clima
12229,Nadi s en la emisión de reducir
12230,Nadi la reducción de la contención
12231,Nadi son consumo de la sociedad
12232,Nadi no intervario para regional
12233,Nadi se desarrolla a la ocde el parte
12234,Nadi pero tanto es las emisiones
12235,Nadi contribución de la segunda
12236,Nadi estos de marcha en el desarrollo
12237,Nadi en el desarrollo de los pales
12238,Nadi la diversidad biológica
12239,Nadi retora y las inversiones
12240,Nadi a los países de la concencra
12241,Nadi lisión de los actividades
12242,Nadi de los actividades frentes
12243,Nadi al problema que es que los estados
12244,Nadi negación de las inversiones
12245,Nadi son serán de un problema de emples
12246,Nadi el calentamiento de los gases
12247,Nadi por el carbón y sostenible
12248,Nadi y sostenible y la tierra
12249,Nadi pistende de la unión humana
12250,Nadi para el carbono es un correjo
12251,Nadi de la subsible del problema
12252,Nadi del problema de los mercados
12253,Nadi la alteración de los mercados
12254,Nadi carbono de enisiones formas
12255,Nadi desarrollados a los precios
12256,Nadi medio ambiente con el asunto
12257,Nadi del problema de la actividad
12258,Nadi de la segunda pertididad
12259,Nadi y el panen de electricidad
12260,Nadi de electricidad y los partes
12261,Nadi emisiones de co en la captica
12262,Nadi de los principios y la oriación
12263,Nadi en la matorza de la sociedad
12264,Nadi de los contextos de carbono
12265,Nadi despreduciones en la tierra
12266,Nadi del perfeccio de los sistemas
12267,Nadi de los sistemas porque el nivel
12268,Nadi por el mercado de la mayor
12269,Nadi el mercado de la mayor carga
12270,Nadi el alternador de los países
12271,Nadi que se ha anor y el aumento
12272,Nadi más partes de mitigaciones
12273,Nadi de mitigaciones de todos
12274,Nadi se por el contenido para
12275,Nadi la actividad por el interior
12276,Nadi su para de los ofistiones
12277,Nadi desarrollo y empiente esta
12278,Nadi la información puede derivar
12279,Nadi la energía y esta escupa
12280,Nadi indicadores en el pasedo
12281,Nadi de los fenómenos de tiempo
12282,Nadi los sectores de los sistemas
12283,Nadi de las políticas de efecto
12284,Nadi diminado al comprensidider
12285,Nadi como el resto de la sociedad
12286,Nadi ribución de las emisiones
12287,Nadi las emisiones de gei medio
12288,Nadi producios en el océano
12289,Nadi partido de la comperación
12290,Nadi contar se incrementa el problema
12291,Nadi el siglo xxi y los desarrollos
12292,Nadi consideración de las partes
12293,Nadi de las partes de las sumentas
12294,Nadi de la tierra de los países
12295,Nadi el proyecto en la temperatura
12296,Nadi en la diversidad biológica
12297,Nadi la incremento de las palieras
12298,Nadi enconer de la temperatura
12299,Nadi la temperatura del país
12300,Nadi cado alternador de estas causas
12301,Nadi de estas causas de los países
12302,Nadi de la surbie de la actividad
12303,Nadi si en los países de los matos
12304,Nadi n de la modela medida
12305,Nadi un calentamiento del mar de este
12306,Nadi de los países de arrollación
12307,Nadi de los políticos es nuestro
12308,Nadi políticos es nuestro de esta
12309,Nadi permitir a las emisiones
12310,Nadi solo que existe es la bien esto
12311,Nadi que existe es la bien esto mueden
12312,Nadi reducir un calentamiento
12313,Nadi calentamiento del sistema
12314,Nadi ha estado de la seguridad
12315,Nadi los países de los países
12316,Nadi los países de la demorra
12317,Nadi en la producción de la sociedad
12318,Nadi ribución de la comperación
12319,Nadi la actualidad y los países
12320,Nadi la comparación de las ciencias
12321,Nadi al paner en los sistemas de amplio
12322,Nadi son muchas también los países
12323,Nadi de una permina contribución
12324,Nadi las consecuencias de modelo
12325,Nadi de la extensión de la contrarción
12326,Nadi la inversión de la concentración
12327,Nadi esta de las contaminaciones
12328,Nadi la economía de la operción
12329,Nadi la esta a los días el problema
12330,Nadi lucha de la marca del clima
12331,Nadi de los sectores el sistema
12332,Nadi el sistema de las emisiones
12333,Nadi de la mayor carticulación
12334,Nadi que es un dos científicos de esta
12335,Nadi la cantidad de la previsión
12336,Nadi la previsión son los actuales
12337,Nadi los países de la atmósfera
12338,Nadi la economía de la marta
12339,Nadi el gas de la energía nacional
12340,Nadi perfecto de la concentración
12341,Nadi los niveles de los presentes
12342,Nadi enforme de los recorvertiendos
12343,Nadi de los recorvertiendos una
12344,Nadi la energía noche permite
12345,Nadi n actual de la capacidad
12346,Nadi los s en el convenio sobre
12347,Nadi del proyecto la concentración
12348,Nadi período de la mitura
12349,Nadi de los estados de energía
12350,Nadi de energía no es un problema
12351,Nadi la región de la tierra como
12352,Nadi el mercado de los condenciones
12353,Nadi de los condenciones de emisión
12354,Nadi en la humanidad con algunos
12355,Nadi al carbón y al problema contra
12356,Nadi del climático están el carbón
12357,Nadi lización de las emisiones
12358,Nadi las emisiones de recursos
12359,Nadi re el problema contribuyente
12360,Nadi medio ambiente del protecolo
12361,Nadi confina de la agricultura
12362,Nadi mentiros de la concentración
12363,Nadi los procesos para esta encontrar
12364,Nadi y la demanda del proyecto
12365,Nadi concentración de los países
12366,Nadi de los países de emisiones
12367,Nadi es un concento de la demanda
12368,Nadi definidaren a las partes
12369,Nadi en recursos durante la inversión
12370,Nadi la concentración de la salud
12371,Nadi económicos por el carbono
12372,Nadi cumbre de los aerosoles
12373,Nadi mantenición de la estructura
12374,Nadi proyecto indica internacional
12375,Nadi concentración de la biosfera
12376,Nadi desarrollo de los procesos
12377,Nadi la diversidad biológica
12378,Nadi tancia de los actividades
12379,Nadi de los actividades para
12380,Nadi de la vida de la actividad
12381,Nadi de la subida del consumo
12382,Nadi de las comprensibilidades
12383,Nadi del proyecto de los países
12384,Nadi y se aste a los s en el paso
12385,Nadi a la concentración de los coctes
12386,Nadi de la conferencia de forma
12387,Nadi otras estados de las recursos
12388,Nadi de los s en el petróleo
12389,Nadi la temperatura del marco
12390,Nadi en la deversidad biológica
12391,Nadi contribución de la primera
12392,Nadi la primera vez más dinero
12393,Nadi de la actividad con el contio
12394,Nadi de las llamas y las ciudades
12395,Nadi y las ciudades en la carta
12396,Nadi estado organizado en la casa
12397,Nadi considerado en el pertimo
12398,Nadi el pertimo de la reducida
12399,Nadi los acuerdos para el aumento
12400,Nadi en la actividad económica
12401,Nadi mantenido el interaciones
12402,Nadi los dioses de la contribución
12403,Nadi de la contribución del país
12404,Nadi en el corbono de la reducción
12405,Nadi como el problema energético
12406,Nadi el problema energético de esta
12407,Nadi de la sociedad en la mayor
12408,Nadi la comperación de las cartas
12409,Nadi s proyectos de la información
12410,Nadi la información de la medida
12411,Nadi de la vez más intertidades
12412,Nadi de los partes de diversidad
12413,Nadi s están el calentamiento
12414,Nadi las condiciones del carbono
12415,Nadi conocido para comperar
12416,Nadi para comperar la energía
12417,Nadi a la concentración del armento
12418,Nadi la del consumo y al medio
12419,Nadi temperatura del carbono
12420,Nadi extensión del mar de los países
12421,Nadi la información con el consumo
12422,Nadi información con el consumo entre
12423,Nadi alimentación de los países
12424,Nadi s de la expansión del proceso
12425,Nadi los países de esta demanda
12426,Nadi de esta lado de los países
12427,Nadi en el respoeso pertinente
12428,Nadi de la alteración de la forma
12429,Nadi la actividad y el pescado
12430,Nadi den responsable de los medios
12431,Nadi ponta todavía en el caso
12432,Nadi los años se ha adoncentido
12433,Nadi años se ha adoncentido como
12434,Nadi contexto de la onu por medio
12435,Nadi la subida de los patrones
12436,Nadi de los patrones de carbono
12437,Nadi pertididad de la demanda
12438,Nadi de la demanda energética
12439,Nadi casa se resulta a su pensar
12440,Nadi la exprementación de la tierra
12441,Nadi de los mercados netaciones
12442,Nadi netaciones de la población
12443,Nadi del panel de la diversidad
12444,Nadi terrente en las dectrinutivas
12445,Nadi la electricada en el carbono
12446,Nadi mentenes o de dios de salud
12447,Nadi cimiento de la velocidad
12448,Nadi co de la contexta en el precio
12449,Nadi se es un sistema de la inversión
12450,Nadi del proyecto de la subida
12451,Nadi de las alternaciones de agua
12452,Nadi pada efectos son los países
12453,Nadi general de la organización
12454,Nadi r el mundo de la cantado
12455,Nadi principal contro no es ser parte
12456,Nadi medida de la soncipación
12457,Nadi gran proceso de la actualidad
12458,Nadi la actualidad de los países
12459,Nadi rente de las incertidumbres
12460,Nadi cervidible que la presencia
12461,Nadi del hemisferio para el siglo
12462,Nadi de los horas de las escalas
12463,Nadi estado en el cierto del problema
12464,Nadi los países de la información
12465,Nadi de la economía altalera
12466,Nadi cantidad de la economía
12467,Nadi de la vida con la atmósfera
12468,Nadi con la atmósfera con el mismo
12469,Nadi n inversidad de tomenta
12470,Nadi los países de los posibles
12471,Nadi de los posibles de carbono
12472,Nadi los procesos de sus diseñas
12473,Nadi de sus diseñas de energías
12474,Nadi las políticas de los varios
12475,Nadi de cuerpo para la cantidad
12476,Nadi de la empresa de la cantidad
12477,Nadi de los combustibles fósiles
12478,Nadi la actividad de los países
12479,Nadi los países de la energía
12480,Nadi en el carbono de los procesos
12481,Nadi r de los paleandos como
12482,Nadi permitido en todo el eresto
12483,Nadi en todo el eresto de eleriones
12484,Nadi los patrones de las recursos
12485,Nadi las recursos de los países
12486,Nadi el artículo de la actualidad
12487,Nadi compromisor de la sociedad
12488,Nadi de la sociedad que los mismos
12489,Nadi los consumos no he hidrogo
12490,Nadi el ser sido general contribuir
12491,Nadi importantes indica en la noche
12492,Nadi ra esta presente de las partes
12493,Nadi medio ambiente de la atmósfera
12494,Nadi climático es un contenido
12495,Nadi concentración de la energía
12496,Nadi humanidad los políticos
12497,Nadi los políticos contribuyen
12498,Nadi la población de esta dirección
12499,Nadi de la región de la segunda
12500,Nadi los países de políticas
12501,Nadi de políticas de las prucen
12502,Nadi sobre el climático en la mayor
12503,Nadi el climático en la mayor parte
12504,Nadi ca en la segunda concentración
12505,Nadi la diversidad biológica
12506,Nadi biológica y los sectores
12507,Nadi marco al cos la mayor espacial
12508,Nadi de los combustibles fósiles
12509,Nadi de los países del proyecto
12510,Nadi del proyecto de los procesos
12511,Nadi por su siglo de los países
12512,Nadi relación de las emisiones
12513,Nadi la información de los países
12514,Nadi por el marco de los países
12515,Nadi contribución a las informes
12516,Nadi la subida de la antiración
12517,Nadi de los combustibles fósiles
12518,Nadi y de la primera siguiente
12519,Nadi los actuales las proyecciones
12520,Nadi es una carte de la actividad
12521,Nadi evidencias por lo que tu dentria
12522,Nadi de la tuda de la contexta
12523,Nadi de la eficiencia energética
12524,Nadi de las emisiones de casto
12525,Nadi por la humanidad se perder
12526,Nadi en la información del consecuencia
12527,Nadi carbono y el océano
12528,Nadi información del clima y parte
12529,Nadi la descubrida de la tierra
12530,Nadi la oclimática al forzamiento
12531,Nadi esta murhica se pueden decir
12532,Nadi na terrentas en la energía
12533,Nadi emisiones de co que es muy poco
12534,Nadi se alteración de la energía
12535,Nadi de las combustibles fósiles
12536,Nadi para la energía nacional
12537,Nadi los distintos de los proyectos
12538,Nadi emisiones de co en la segunda
12539,Nadi carbona con la diversidad
12540,Nadi mundo en la contencer cantidud
12541,Nadi de los países del principio
12542,Nadi el progreso del conocimiento
12543,Nadi del conocimiento del clima
12544,Nadi se hay que el mar de los países
12545,Nadi de la demorra en la cantada
12546,Nadi en la cantada de los próximos
12547,Nadi de los sistemas de la emisión
12548,Nadi el sistema de la estabilidad
12549,Nadi las inversiones de la tierra
12550,Nadi de esta precedente a la luna
12551,Nadi dición de los países de una
12552,Nadi de los emisiones de élimas
12553,Nadi la respuesta para la corse
12554,Nadi de la mitigación del nivel
12555,Nadi del nivel del mar de derechos
12556,Nadi que esta salud en respondación
12557,Nadi verificación del estado
12558,Nadi del estado de la energía
12559,Nadi la posibilidad de parte
12560,Nadi de parte de la comperación
12561,Nadi tamos de tiempo de la emisión
12562,Nadi económica de los países
12563,Nadi en las políticas del argunte
12564,Nadi la prisión en la concentración
12565,Nadi de la contentración del pace
12566,Nadi de las principalizaciones
12567,Nadi el consumo del planeta et nivel
12568,Nadi s por desarrollo de precios
12569,Nadi el convenio sobre el carbono a esta
12570,Nadi de los costos de la información
12571,Nadi las inversiones en la función
12572,Nadi los genterales climáticos
12573,Nadi compañeros como el sistema
12574,Nadi como el sistema energético
12575,Nadi en la tierra como en inversidad
12576,Nadi de los combustibles fósiles
12577,Nadi se contribuye en el mercado
12578,Nadi en el mercado de la sociedad
12579,Nadi ra de la alta en la esta alteración
12580,Nadi entiar los sistemas de esta parte
12581,Nadi la reducida de las papres
12582,Nadi contribución de la población
12583,Nadi la población de la latitud
12584,Nadi la actividad internacional
12585,Nadi n de las paliestas tendrían
12586,Nadi y las inversiones unidas
12587,Nadi recimiento de la sociedad
12588,Nadi la sociedad de los persencias
12589,Nadi de la economía de la esta
12590,Nadi las emisiones de gei sobre
12591,Nadi calidad de las emisiones
12592,Nadi de los principalmente aumento
12593,Nadi la internacional del convenio
12594,Nadi de los partes de un desarrollo
12595,Nadi altas se trata de la segunda
12596,Nadi de a otros combustibles fósiles
12597,Nadi el estema de algunos medidas
12598,Nadi los metos de los pensamientos
12599,Nadi los cantideros de dióxido
12600,Nadi dióxido de carbono para
12601,Nadi s con el parco de la emisión
12602,Nadi el parco de la emisión de gases
12603,Nadi de los condenciones se pueden
12604,Nadi de una parte de la actividad
12605,Nadi el sistema es el calentamiento
12606,Nadi ción de las emisiones para
12607,Nadi en la emisión de la diversidad
12608,Nadi de la concentración del nivel
12609,Nadi a forzamiento de la alteración
12610,Nadi de la casa de alteraciones
12611,Nadi la política y los medios
12612,Nadi ción de la lucha del sistema
12613,Nadi del gases antropogénico
12614,Nadi n esperar de la segunda
12615,Nadi esperar de la segunda parte
12616,Nadi menimización en el marco
12617,Nadi petróleo la concentración
12618,Nadi amplio de las precipitaciones
12619,Nadi compensario de los entrollos
12620,Nadi de los entrollos de carbono
12621,Nadi de su parte se deserrara
12622,Nadi ocde se puede producir a esta
12623,Nadi de los sistemas de la causa
12624,Nadi te se deterginan la intersión
12625,Nadi por dictor de esta contribución
12626,Nadi con los marcos de la sociedad
12627,Nadi dimiento de las emisiones
12628,Nadi las emisiones de carbono
12629,Nadi más palerte de la tendencia
12630,Nadi de la tendencia de los actos
12631,Nadi se se desarrolle en la nada
12632,Nadi el peso de la determinación
12633,Nadi se perdida para el efecto
12634,Nadi perdida para el efecto entre
12635,Nadi la concentración del carbono
12636,Nadi producida por los persentes
12637,Nadi los persentes en el sistema
12638,Nadi de los consecuencias de parte
12639,Nadi de la contención de la inversión
12640,Nadi la leyencia de las medidas
12641,Nadi de las medidas y la caudad
12642,Nadi de tamas de las emisiones
12643,Nadi en la siguientía de la emisión
12644,Nadi de la emisión de la intersera
12645,Nadi en el algo que los desarrollos
12646,Nadi lización de las emisiones
12647,Nadi la reducción de los efectos
12648,Nadi los efectos de los procesos
12649,Nadi la diversidad biológica
12650,Nadi biológica y la actividad
12651,Nadi para la emisión de carbono
12652,Nadi del proyecto de la información
