,endecasílabo
0,Timaru permitado en la atmósfera
1,Timaru en el proyecto de la tierra
2,Timaru de carbono a la producción
3,Timaru problema de compromiso
4,Timaru modelos de compromiso
5,Timaru contribución de la propia
6,Timaru entre el mar de la concentración
7,Timaru carbono en la concentración
8,Timaru menos de la consecuencia
9,Timaru parte de la concentración
10,Timaru parte de la concentración
11,Timaru mundial de la concentración
12,Timaru contribución de la compra
13,Timaru mayor parte de la salud
14,Timaru marca de la concentración
15,Timaru mayor en la compromisa
16,Timaru climático como el cambio
17,Timaru como el cambio climático
18,Timaru producto en la compromisa
19,Timaru el petróleo y la propia
20,Timaru marco de la concentración
21,Timaru climático en la atmósfera
22,Timaru está contra la compromica
23,Timaru marca de la concentración
24,Timaru parte de la contra el cambio
25,Timaru política en la producción
26,Timaru climática y el cambio
27,Timaru carbono en la compromisa
28,Timaru propia de la concentración
29,Timaru contra el cambio climático
30,Timaru contra el cambio climático
31,Timaru el cambio climático sobre
32,Timaru menos de la compromisa
33,Timaru la compra de compromiso
34,Timaru marco de la concentración
35,Timaru la comprar en la producción
36,Timaru por el contral de la propia
37,Timaru el contral de la propia contra
38,Timaru en el proceso de la propia
39,Timaru la contrar con la estrategia
40,Timaru permitado de la propia
41,Timaru de la propia climática
42,Timaru para el cambio climático
43,Timaru contra el cambio climático
44,Timaru el cambio climático sobre
45,Timaru la producción de la compra
46,Timaru permitado de la compra
47,Timaru parte de la compromisa
48,Timaru emisiones de contra el cambio
49,Timaru la propia de contra el cambio
50,Timaru producirá a la energía
51,Timaru el proyecto de la actualidad
52,Timaru permitado de la propia
53,Timaru de la propia contra el cambio
54,Timaru menos de la concentración
55,Timaru permitado por la propia
56,Timaru el contrado en la compromisa
57,Timaru parte de la compromisa
58,Timaru en la propia de la comprensión
59,Timaru contra el cambio climático
60,Timaru contra el cambio climático
61,Timaru menos precipitaciones
62,Timaru permita de la producción
63,Timaru la capa de compromiso
64,Timaru de contra la compromisa
65,Timaru menos de la compromisa
66,Timaru por el mar en la producción
67,Timaru permita en la compromisa
68,Timaru la producción de la compra
69,Timaru contra el cambio climático
70,Timaru permitado de la estado
71,Timaru producido a la energía
72,Timaru el proceso de compromiso
73,Timaru parte de la contra el cambio
74,Timaru de contra la compromisa
75,Timaru la contrar la compromisa
76,Timaru comprensión de la producción
77,Timaru propia con la compromisa
78,Timaru permita en la compromisa
79,Timaru por el cambio climático
80,Timaru problema de la producción
81,Timaru parte de la compromisa
82,Timaru la propia de la comprensión
83,Timaru el mercado de la producción
84,Timaru permitado en la producción
85,Timaru seguir en la contribución
86,Timaru la estada de compromiso
87,Timaru parte de la concentración
88,Timaru la propia como el problema
89,Timaru problema con la atmósfera
90,Timaru carbono que la comprensión
91,Timaru la compromisa de deces
92,Timaru deces con la compromisa
93,Timaru se producirá en la propia
94,Timaru en la propia de compromiso
95,Timaru manor en la compromisa
96,Timaru modelo de la producción
97,Timaru el cambio climático sobre
98,Timaru la energía necesaria
99,Timaru los combustibles fósiles
100,Timaru la propia como el estado
101,Timaru compromiso de carbono
102,Timaru carbono y el problema
103,Timaru la energía contra el cambio
104,Timaru contribución de la compra
105,Timaru se esta mayor producida
106,Timaru compromiso de la capa
107,Timaru el contrado en la compromisa
108,Timaru producto a las emisiones
109,Timaru la propia de los procesos
110,Timaru el contrado en la concentración
111,Timaru segundo de la producción
112,Timaru la comprensión de la propia
113,Timaru a la propia de compromiso
114,Timaru permitado en la comprensión
115,Timaru parte de la concentración
116,Timaru parte de la compromisa
117,Timaru climático en la producción
118,Timaru parte de la compromisa
119,Timaru el proceso de la comprensión
120,Timaru la producción de la compra
121,Timaru la compra de la producción
122,Timaru menos de la compromisa
123,Timaru marco de la concentración
124,Timaru menos en la concentración
125,Timaru ser estado a la producción
126,Timaru contra el cambio climático
127,Timaru los procesos de carbono
128,Timaru seguridad establecir
129,Timaru parte de la contribución
130,Timaru parte de la compromisa
131,Timaru consecuencia de la contrar
132,Timaru la contrar la compromisa
133,Timaru en la producción de la capa
134,Timaru en la cumbre de la actualidad
135,Timaru la compra de la estructura
136,Timaru contra el cambio climático
137,Timaru de la compra de consumo
138,Timaru la compromisa de cambio
139,Timaru por el cambio climático
140,Timaru permitado en el promedio
141,Timaru la estado de la comprensión
142,Timaru se desarrollar la estada
143,Timaru mercado de la energía
144,Timaru carbono en la compromisa
145,Timaru menos de la concentración
146,Timaru permitado en la producción
147,Timaru contración de la producción
148,Timaru el contral de la concentración
149,Timaru de todo la contra el cambio
150,Timaru menos de la concentración
151,Timaru contra el cambio climático
152,Timaru la comprensión de la compra
153,Timaru la producción de la compra
154,Timaru parte de la concentración
155,Timaru menos de la concentración
156,Timaru proceso de esta producción
157,Timaru proceso de compromiso
158,Timaru sin embargo se producir
159,Timaru contra el mar en la atmósfera
160,Timaru de compromiso de contra
161,Timaru contra la temperatura
162,Timaru menos de la concentración
163,Timaru carbono que los países
164,Timaru la producción de la mayor
165,Timaru problema de la producción
166,Timaru de compromiso de contra
167,Timaru menos de la contribución
168,Timaru por el cambio climático
169,Timaru climático y la propia
170,Timaru de compromiso de carbón
171,Timaru carbono en la compromisa
172,Timaru permitado de la tierra
173,Timaru carbono por un problema
174,Timaru de combustibles fósiles
175,Timaru producto en la concentración
176,Timaru proceso de compromiso
177,Timaru el proyecto en la compromisa
178,Timaru contra el cambio climático
179,Timaru medida de compromiso
180,Timaru la estado de la comprensión
181,Timaru parte de la comprendencia
182,Timaru la comprensión de la compra
183,Timaru de la compra de carbono
184,Timaru proceso de compromiso
185,Timaru desarrollar el problema
186,Timaru compromiso de la contrar
187,Timaru la compromisa de cambio
188,Timaru contra el cambio climático
189,Timaru segundo contra la propia
190,Timaru la propia de compromiso
191,Timaru la propia de compromiso
192,Timaru compromiso de la compra
193,Timaru de carbono en la atmósfera
194,Timaru menos en la contribución
195,Timaru menos en las emisiones
196,Timaru carbono en la compromisa
197,Timaru ser producido en la propia
198,Timaru la energía para el cambio
199,Timaru a la producción de la propia
200,Timaru parte de la concentración
201,Timaru de carbono a la producción
202,Timaru de compromiso de cambio
203,Timaru tendría en la consecuencia
204,Timaru consecuencia de la contrar
205,Timaru la contrar la concentración
206,Timaru de contra la contra el cambio
207,Timaru en la comprensión de la estada
208,Timaru en el cambio climático esta
209,Timaru de la propia como contra
210,Timaru producto en la contra el cambio
211,Timaru productos de la producción
212,Timaru propio con la concentración
213,Timaru de carbono de la propia
214,Timaru marca de la concentración
215,Timaru producción de la producción
216,Timaru contra la compromicado
217,Timaru la producción de la compra
218,Timaru países de contra el cambio
219,Timaru se desarrollar el cambio
220,Timaru problema de compromiso
221,Timaru medida de la intersidad
222,Timaru el proceso de contra el cambio
223,Timaru conjunto de compromiso
224,Timaru la producción de la compra
225,Timaru en la concentración de la actual
226,Timaru consecuencia de la compren
227,Timaru la compren de consecuencia
228,Timaru parte de la contribución
229,Timaru contra el cambio climático
230,Timaru compromiso de la mayor
231,Timaru secuedad de la atmósfera
232,Timaru la mayor por la producción
233,Timaru la producción de la compra
234,Timaru la propia en la compromisa
235,Timaru contra el cambio climático
236,Timaru la demanda de la propia
237,Timaru de la propia contra el cambio
238,Timaru contra el cambio climático
239,Timaru la intersidad biológica
240,Timaru la compromisa continuar
241,Timaru de la contrar la contración
242,Timaru el problema de compromiso
243,Timaru parte de la compromisa
244,Timaru contra el cambio climático
245,Timaru contra el cambio climático
246,Timaru economía necesitad
247,Timaru parte de la contra el cambio
248,Timaru permitado en el consumo
249,Timaru parte de la contra el cambio
250,Timaru menos de la concentración
251,Timaru de carbono y la contrar
252,Timaru compromiso de la propia
253,Timaru la energía necesaria
254,Timaru carbono a la compromisa
255,Timaru en el cambio climático esta
256,Timaru ser producido en la contral
257,Timaru parte de la concentración
258,Timaru compra de la propia como
259,Timaru el contrado en la propia como
260,Timaru compromisa contra el cambio
261,Timaru contra el cambio climático
262,Timaru el cambio climático sobre
263,Timaru de compromiso de un medio
264,Timaru permitan para la compra
265,Timaru la compra de compromiso
266,Timaru la propia de la comprensión
267,Timaru cambio climático sobre
268,Timaru la propia de compromiso
269,Timaru marco de la concentración
270,Timaru la temperatura mundial
271,Timaru ser producido en la propia
272,Timaru la propia con la producción
273,Timaru parte de la concentración
274,Timaru menos en la compromisa
275,Timaru en el mar de la contribución
276,Timaru propuesta en la contrabución
277,Timaru marco de la concentración
278,Timaru de carbono y la propia
279,Timaru el sumento de la demanda
