,endecasílabo
0,Tripoli permitado en la atmósfera
1,Tripoli en el proyecto de la tierra
2,Tripoli de carbono a la producción
3,Tripoli problema de compromiso
4,Tripoli modelos de compromiso
5,Tripoli contribución de la propia
6,Tripoli entre el mar de la concentración
7,Tripoli carbono en la concentración
8,Tripoli menos de la consecuencia
9,Tripoli parte de la concentración
10,Tripoli parte de la concentración
11,Tripoli mundial de la concentración
12,Tripoli contribución de la compra
13,Tripoli mayor parte de la salud
14,Tripoli marca de la concentración
15,Tripoli mayor en la compromisa
16,Tripoli climático como el cambio
17,Tripoli como el cambio climático
18,Tripoli producto en la compromisa
19,Tripoli el petróleo y la propia
20,Tripoli marco de la concentración
21,Tripoli climático en la atmósfera
22,Tripoli está contra la compromica
23,Tripoli marca de la concentración
24,Tripoli parte de la contra el cambio
25,Tripoli política en la producción
26,Tripoli climática y el cambio
27,Tripoli carbono en la compromisa
28,Tripoli propia de la concentración
29,Tripoli contra el cambio climático
30,Tripoli contra el cambio climático
31,Tripoli el cambio climático sobre
32,Tripoli menos de la compromisa
33,Tripoli la compra de compromiso
34,Tripoli marco de la concentración
35,Tripoli la comprar en la producción
36,Tripoli por el contral de la propia
37,Tripoli el contral de la propia contra
38,Tripoli en el proceso de la propia
39,Tripoli la contrar con la estrategia
40,Tripoli permitado de la propia
41,Tripoli de la propia climática
42,Tripoli para el cambio climático
43,Tripoli contra el cambio climático
44,Tripoli el cambio climático sobre
45,Tripoli la producción de la compra
46,Tripoli permitado de la compra
47,Tripoli parte de la compromisa
48,Tripoli emisiones de contra el cambio
49,Tripoli la propia de contra el cambio
50,Tripoli producirá a la energía
51,Tripoli el proyecto de la actualidad
52,Tripoli permitado de la propia
53,Tripoli de la propia contra el cambio
54,Tripoli menos de la concentración
55,Tripoli permitado por la propia
56,Tripoli el contrado en la compromisa
57,Tripoli parte de la compromisa
58,Tripoli en la propia de la comprensión
59,Tripoli contra el cambio climático
60,Tripoli contra el cambio climático
61,Tripoli menos precipitaciones
62,Tripoli permita de la producción
63,Tripoli la capa de compromiso
64,Tripoli de contra la compromisa
65,Tripoli menos de la compromisa
66,Tripoli por el mar en la producción
67,Tripoli permita en la compromisa
68,Tripoli la producción de la compra
69,Tripoli contra el cambio climático
70,Tripoli permitado de la estado
71,Tripoli producido a la energía
72,Tripoli el proceso de compromiso
73,Tripoli parte de la contra el cambio
74,Tripoli de contra la compromisa
75,Tripoli la contrar la compromisa
76,Tripoli comprensión de la producción
77,Tripoli propia con la compromisa
78,Tripoli permita en la compromisa
79,Tripoli por el cambio climático
80,Tripoli problema de la producción
81,Tripoli parte de la compromisa
82,Tripoli la propia de la comprensión
83,Tripoli el mercado de la producción
84,Tripoli permitado en la producción
85,Tripoli seguir en la contribución
86,Tripoli la estada de compromiso
87,Tripoli parte de la concentración
88,Tripoli la propia como el problema
89,Tripoli problema con la atmósfera
90,Tripoli carbono que la comprensión
91,Tripoli la compromisa de deces
92,Tripoli deces con la compromisa
93,Tripoli se producirá en la propia
94,Tripoli en la propia de compromiso
95,Tripoli manor en la compromisa
96,Tripoli modelo de la producción
97,Tripoli el cambio climático sobre
98,Tripoli la energía necesaria
99,Tripoli los combustibles fósiles
100,Tripoli la propia como el estado
101,Tripoli compromiso de carbono
102,Tripoli carbono y el problema
103,Tripoli la energía contra el cambio
104,Tripoli contribución de la compra
105,Tripoli se esta mayor producida
106,Tripoli compromiso de la capa
107,Tripoli el contrado en la compromisa
108,Tripoli producto a las emisiones
109,Tripoli la propia de los procesos
110,Tripoli el contrado en la concentración
111,Tripoli segundo de la producción
112,Tripoli la comprensión de la propia
113,Tripoli a la propia de compromiso
114,Tripoli permitado en la comprensión
115,Tripoli parte de la concentración
116,Tripoli parte de la compromisa
117,Tripoli climático en la producción
118,Tripoli parte de la compromisa
119,Tripoli el proceso de la comprensión
120,Tripoli la producción de la compra
121,Tripoli la compra de la producción
122,Tripoli menos de la compromisa
123,Tripoli marco de la concentración
124,Tripoli menos en la concentración
125,Tripoli ser estado a la producción
126,Tripoli contra el cambio climático
127,Tripoli los procesos de carbono
128,Tripoli seguridad establecir
129,Tripoli parte de la contribución
130,Tripoli parte de la compromisa
131,Tripoli consecuencia de la contrar
132,Tripoli la contrar la compromisa
133,Tripoli en la producción de la capa
134,Tripoli en la cumbre de la actualidad
135,Tripoli la compra de la estructura
136,Tripoli contra el cambio climático
137,Tripoli de la compra de consumo
138,Tripoli la compromisa de cambio
139,Tripoli por el cambio climático
140,Tripoli permitado en el promedio
141,Tripoli la estado de la comprensión
142,Tripoli se desarrollar la estada
143,Tripoli mercado de la energía
144,Tripoli carbono en la compromisa
145,Tripoli menos de la concentración
146,Tripoli permitado en la producción
147,Tripoli contración de la producción
148,Tripoli el contral de la concentración
149,Tripoli de todo la contra el cambio
150,Tripoli menos de la concentración
151,Tripoli contra el cambio climático
152,Tripoli la comprensión de la compra
153,Tripoli la producción de la compra
154,Tripoli parte de la concentración
155,Tripoli menos de la concentración
156,Tripoli proceso de esta producción
157,Tripoli proceso de compromiso
158,Tripoli sin embargo se producir
159,Tripoli contra el mar en la atmósfera
160,Tripoli de compromiso de contra
161,Tripoli contra la temperatura
162,Tripoli menos de la concentración
163,Tripoli carbono que los países
164,Tripoli la producción de la mayor
165,Tripoli problema de la producción
166,Tripoli de compromiso de contra
167,Tripoli menos de la contribución
168,Tripoli por el cambio climático
169,Tripoli climático y la propia
170,Tripoli de compromiso de carbón
171,Tripoli carbono en la compromisa
172,Tripoli permitado de la tierra
173,Tripoli carbono por un problema
174,Tripoli de combustibles fósiles
175,Tripoli producto en la concentración
176,Tripoli proceso de compromiso
177,Tripoli el proyecto en la compromisa
178,Tripoli contra el cambio climático
179,Tripoli medida de compromiso
180,Tripoli la estado de la comprensión
181,Tripoli parte de la comprendencia
182,Tripoli la comprensión de la compra
183,Tripoli de la compra de carbono
184,Tripoli proceso de compromiso
185,Tripoli desarrollar el problema
186,Tripoli compromiso de la contrar
187,Tripoli la compromisa de cambio
188,Tripoli contra el cambio climático
189,Tripoli segundo contra la propia
190,Tripoli la propia de compromiso
191,Tripoli la propia de compromiso
192,Tripoli compromiso de la compra
193,Tripoli de carbono en la atmósfera
194,Tripoli menos en la contribución
195,Tripoli menos en las emisiones
196,Tripoli carbono en la compromisa
197,Tripoli ser producido en la propia
198,Tripoli la energía para el cambio
199,Tripoli a la producción de la propia
200,Tripoli parte de la concentración
201,Tripoli de carbono a la producción
202,Tripoli de compromiso de cambio
203,Tripoli tendría en la consecuencia
204,Tripoli consecuencia de la contrar
205,Tripoli la contrar la concentración
206,Tripoli de contra la contra el cambio
207,Tripoli en la comprensión de la estada
208,Tripoli en el cambio climático esta
209,Tripoli de la propia como contra
210,Tripoli producto en la contra el cambio
211,Tripoli productos de la producción
212,Tripoli propio con la concentración
213,Tripoli de carbono de la propia
214,Tripoli marca de la concentración
215,Tripoli producción de la producción
216,Tripoli contra la compromicado
217,Tripoli la producción de la compra
218,Tripoli países de contra el cambio
219,Tripoli se desarrollar el cambio
220,Tripoli problema de compromiso
221,Tripoli medida de la intersidad
222,Tripoli el proceso de contra el cambio
223,Tripoli conjunto de compromiso
224,Tripoli la producción de la compra
225,Tripoli en la concentración de la actual
226,Tripoli consecuencia de la compren
227,Tripoli la compren de consecuencia
228,Tripoli parte de la contribución
229,Tripoli contra el cambio climático
230,Tripoli compromiso de la mayor
231,Tripoli secuedad de la atmósfera
232,Tripoli la mayor por la producción
233,Tripoli la producción de la compra
234,Tripoli la propia en la compromisa
235,Tripoli contra el cambio climático
236,Tripoli la demanda de la propia
237,Tripoli de la propia contra el cambio
238,Tripoli contra el cambio climático
239,Tripoli la intersidad biológica
240,Tripoli la compromisa continuar
241,Tripoli de la contrar la contración
242,Tripoli el problema de compromiso
243,Tripoli parte de la compromisa
244,Tripoli contra el cambio climático
245,Tripoli contra el cambio climático
246,Tripoli economía necesitad
247,Tripoli parte de la contra el cambio
248,Tripoli permitado en el consumo
249,Tripoli parte de la contra el cambio
250,Tripoli menos de la concentración
251,Tripoli de carbono y la contrar
252,Tripoli compromiso de la propia
253,Tripoli la energía necesaria
254,Tripoli carbono a la compromisa
255,Tripoli en el cambio climático esta
256,Tripoli ser producido en la contral
257,Tripoli parte de la concentración
258,Tripoli compra de la propia como
259,Tripoli el contrado en la propia como
260,Tripoli compromisa contra el cambio
261,Tripoli contra el cambio climático
262,Tripoli el cambio climático sobre
263,Tripoli de compromiso de un medio
264,Tripoli permitan para la compra
265,Tripoli la compra de compromiso
266,Tripoli la propia de la comprensión
267,Tripoli cambio climático sobre
268,Tripoli la propia de compromiso
269,Tripoli marco de la concentración
270,Tripoli la temperatura mundial
271,Tripoli ser producido en la propia
272,Tripoli la propia con la producción
273,Tripoli parte de la concentración
274,Tripoli menos en la compromisa
275,Tripoli en el mar de la contribución
276,Tripoli propuesta en la contrabución
277,Tripoli marco de la concentración
278,Tripoli de carbono y la propia
279,Tripoli el sumento de la demanda
