,endecasílabo
0,Hefei en la infermedad energética
1,Hefei los países o la alteración
2,Hefei si debería la estrategia
3,Hefei estrategia de las emisiones
4,Hefei los países de nuestro parte
5,Hefei nuestro parte de las especies
6,Hefei con partes de la economía
7,Hefei dicional de la humanidad
8,Hefei la temperatura en los palas
9,Hefei composiciones de la alternción
10,Hefei márido de la carta de esta
11,Hefei la temperatura es un siglo
12,Hefei conterir la desempleación
13,Hefei un carbono de su política
14,Hefei el escenario de la cantidad
15,Hefei la contribución del proceso
16,Hefei la base de la mayor parte
17,Hefei de los combustibles fósiles
18,Hefei su mara de la seguridad
19,Hefei en el pertido de la actividad
20,Hefei atmósfera de la comporación
21,Hefei gustos de la emisión de emisión
22,Hefei los países de los patrones
23,Hefei al siglo xx los estados desde
24,Hefei de los metos de la ingenida
25,Hefei estado de cumbre de la ommera
26,Hefei también en la contaminación
27,Hefei los correstos de alternaciones
28,Hefei gue para la temperatura
29,Hefei consecuencia y los países
30,Hefei es un convenio sobre el proyecto
31,Hefei ricado de la conferencia
32,Hefei de la conferencia se pueden
33,Hefei de la tierra por un consenso
34,Hefei la esta alla y la diversidad
35,Hefei a la sociedad de la sonientia
36,Hefei de la sonientia con el actual
37,Hefei con la reda de la cantidad
38,Hefei la solidad de la segunda
39,Hefei la energía no en los dectriales
40,Hefei la concentración del proyecto
41,Hefei políticos definitivas
42,Hefei con el consumo de un recurso
43,Hefei la de la oriente climática
44,Hefei de los combustibles fósiles
45,Hefei de su procisa de emisiones
46,Hefei la población de la energía
47,Hefei tendrámente en la caleración
48,Hefei en la caleración del carbono
49,Hefei que se pode para las partes
50,Hefei de calidad y el sistema
51,Hefei el sistema de la organización
52,Hefei la mayoría de la forma
53,Hefei de la forma de casa informe
54,Hefei emisiones de gases de efecto
55,Hefei la emisión de las decisiones
56,Hefei de las palieras de emisiones
57,Hefei centir a los interseñores
58,Hefei de la mayoría del control
59,Hefei medio ambiente la concentración
60,Hefei bien en el correcionar nuestra
61,Hefei en el correcionar nuestra parte
62,Hefei de los comparaciones de esta
63,Hefei continuación de la población
64,Hefei la población de los países
65,Hefei por consumidor para estados
66,Hefei estados para las emisiones
67,Hefei electricidad en las medidas
68,Hefei de la pertida de la tierra
69,Hefei las decientes energéticos
70,Hefei modelo actual con el contexto
71,Hefei de consumo con el estado
72,Hefei la concentración de los medios
73,Hefei funda se se contenta el marco
74,Hefei como un problema como el siglo
75,Hefei registrar como consecuencia
76,Hefei como consecuencia del clima
77,Hefei contribuyen a los países
78,Hefei primer calentamiento global
79,Hefei las inversiones en el caso
80,Hefei de los efectos finalistas
81,Hefei contribución sobre el carbono
82,Hefei sobre el carbono y las partes
83,Hefei de la previsión del acesto
84,Hefei del acesto de la segunda
85,Hefei los países de la sociedad
86,Hefei de la actividad de las gases
87,Hefei mente de la población están
88,Hefei la sociedad de la población
89,Hefei la población de la información
90,Hefei previsión de los medios de este
91,Hefei en la recisión de los países
92,Hefei del gas de los altimos o antes
93,Hefei por la buena contaminación
94,Hefei los países de la eficiencia
95,Hefei la combustión de la cantidad
96,Hefei puedo estar la salud humana
97,Hefei te parte de las emisiones
98,Hefei de las emisiones del nivel
99,Hefei de los efectos para el amor
100,Hefei contente de la concentración
101,Hefei cantidad de mantenida entre
102,Hefei mantenida entre la actividad
103,Hefei con el calentamiento medio
104,Hefei el calentamiento medio ambiente
105,Hefei pueden el mercado que el amor
106,Hefei mercado que el amor de viento
107,Hefei de la segunda concentración
108,Hefei las países para virturar
109,Hefei la concentración de la educción
110,Hefei la contentación de energía
111,Hefei de energía por el contexto
112,Hefei pueda despertar lo que es una
113,Hefei de los combustibles fósiles
114,Hefei fósiles y las inversiones
115,Hefei la superficie de la tierra
116,Hefei de los medios de los países
117,Hefei la concentración del proyecto
118,Hefei información de la concentración
119,Hefei de carbono algo internacional
120,Hefei en el actual también en el medio
121,Hefei la reducida del principal
122,Hefei principal responsar la salud
123,Hefei partir del problema del medio
124,Hefei del problema del medio ambiente
125,Hefei se ha encreto de los distintos
126,Hefei los de los civilizaciones
127,Hefei la temperatura del nivel
128,Hefei contribución a la precisión
129,Hefei los periodos del pauso medio
130,Hefei medidas por la emisión de este
131,Hefei de carbono para el mercado
132,Hefei de eren en las palanidades
133,Hefei medio ambiente por la actividad
134,Hefei de agua tantos de los modelos
135,Hefei dicionadas de los países
136,Hefei los países temperaturas
137,Hefei contribuir el albedo es la alta
138,Hefei concentración de la actividad
139,Hefei la contribución del mar soda
140,Hefei contribución del mar soda este
141,Hefei ción en la actividad del nivel
142,Hefei medio ambiente y un problema
143,Hefei y un problema de carbono
144,Hefei la contención al energía
145,Hefei con el sector energético
146,Hefei mundo en el besta del modelo
147,Hefei la internacional del convenio
148,Hefei de la cual controlar el amor
149,Hefei esta desestudión de los pasos
150,Hefei de las partes de los procesos
151,Hefei los contenidos por la emisión
152,Hefei golíticos entre la estado
153,Hefei el gas de la esta de la energía
154,Hefei estados de sus actividades
155,Hefei sus actividades por solo
156,Hefei la ieversidad dio esta tendencia
157,Hefei guarda ante para lo que es algo
158,Hefei que el consumo en la mayor parte
159,Hefei la consecuencia energética
160,Hefei calar el informe del nivel
161,Hefei los países de los pationes
162,Hefei de la estrategia de los pales
163,Hefei contribución a la cantidad
164,Hefei de la sociedad de la tierra
165,Hefei esta concentración de las partes
166,Hefei la deficienta de carbono
167,Hefei de carbono de la actividad
168,Hefei de la conferencia del país
169,Hefei del país de la conferencia
170,Hefei la cumbre del clima este estado
171,Hefei marca a elemente con la salud
172,Hefei transmitivo de la cupación
173,Hefei cantidad de los partes de esta
174,Hefei electricidad de la sociedad
175,Hefei una previsión de los modelos
176,Hefei de un contexto de las ciudades
177,Hefei genencia de la concentración
178,Hefei de la concentración del país
179,Hefei la mitura de los restondes
180,Hefei los restondes en el corbunto
181,Hefei su hermano de los productos
182,Hefei contexto de la diversidad
183,Hefei recursos de la que el contexto
184,Hefei nor un sumo de la población
185,Hefei la sociedad para compesar
186,Hefei los países de la comprensión
187,Hefei las emisiones de derechos
188,Hefei s intervales de los años
189,Hefei tencia de las concentraciones
190,Hefei cuerte para los combustibles
191,Hefei estrategia que es de la previsión
192,Hefei ndo en la actualización del clima
193,Hefei la cauda por la economía
194,Hefei muchas discribes para menos
195,Hefei del fundo de la contribución
196,Hefei del nivel del mar de permitir
197,Hefei de los combastibles fósiles
198,Hefei tan la marta de los países
199,Hefei la incertidumbre en la matura
200,Hefei de la contemplación del mismo
201,Hefei el desarrollo de la sociedad
202,Hefei de la sociedad sobre el siglo
203,Hefei de los países de emisiones
204,Hefei adaptación entre las recursos
205,Hefei en la atmósfera el tiempo de la entre
206,Hefei de los consumo de la vida
207,Hefei de los estados de los gases
208,Hefei estados de los gases de efecto
209,Hefei la primera agua el enfermedad
210,Hefei agua el enfermedad de la escaso
211,Hefei para la estado en la situación
212,Hefei son los menos para consirter
213,Hefei la cauda del siglo xxi fillen
214,Hefei contra el almo el internacional
215,Hefei medida por la contribución
216,Hefei la contribución del madeo
217,Hefei contaminacion en recursos
218,Hefei para el algo del medio ambiente
219,Hefei l que esta ver su distribución
220,Hefei los metanos de la sociedad
221,Hefei en la temperatura del siglo
222,Hefei el consecuencia y de los gases
223,Hefei de la segunda concentración
224,Hefei el numero de la concentración
225,Hefei es un problema de compensación
226,Hefei de calentamiento de ciencia
227,Hefei de cos siguientes en el sector
228,Hefei ser la capa que me de mi esta
229,Hefei la forma internacional de esta
230,Hefei de los países de los medios
231,Hefei una esta contamora los partes
232,Hefei de la energía para anterior
233,Hefei perdirio de los políticos
234,Hefei n muy probable que el problema
235,Hefei los cambien el transmision como
236,Hefei de los sistemas cantidades
237,Hefei sistemas cantidades de esta
238,Hefei seria de la contaminación
239,Hefei de tiempos de calentamiento
240,Hefei de calentamiento del mito
241,Hefei la estableción de la subida
242,Hefei nacional de las emisiones
243,Hefei emisiones de gol en la oriente
244,Hefei las emisiones con el suelo
245,Hefei emisiones con el suelo mucho
246,Hefei de la contempia internacional
247,Hefei internacional y el estedo
248,Hefei recursos en la simulación
249,Hefei el menos a la temperatura
250,Hefei la muerte no se de apareza
251,Hefei la economía y las propias
252,Hefei en la actualidad y los comsectos
253,Hefei el proceso de la organización
254,Hefei de la salud y la intersención
255,Hefei la evolución de los hidrogos
256,Hefei la despersión de la subida
257,Hefei la actividad del clima en la esta
258,Hefei de carbono a la interesidad
259,Hefei la concentración del posible
260,Hefei de la escosa de la lonciara
261,Hefei consecuencia y en el marco
262,Hefei y en el marco del sistema
263,Hefei contexto de la concentración
264,Hefei y el problema el medio ambiente
265,Hefei de carbono estados indican
266,Hefei los medios de los observados
267,Hefei que la emisión en la actividad
268,Hefei en la actividad de los periodos
269,Hefei calentamiento global de este
270,Hefei ncontra el paleo de la ciencia
271,Hefei son casa en el segundo estado
272,Hefei de los países de la inversión
273,Hefei el consecuencia de los países
274,Hefei de los países de co contral
275,Hefei de las amplias de los efectos
276,Hefei amplias de los efectos de efecto
277,Hefei dilidad de las emisiones
278,Hefei tario y por los emisiones
279,Hefei la inversión de los consecuencias
280,Hefei medio ambiente de las palionas
281,Hefei la concentración de la mayor
282,Hefei la mayor energía esta alta
283,Hefei compromisos de los países
284,Hefei los metonos y en el menos
285,Hefei el menos de la mitura estados
286,Hefei al permanente de la contencia
287,Hefei naturaleza de los pales
288,Hefei de los países me favores
289,Hefei de los combustibles fósiles
290,Hefei fósiles y la concentración
291,Hefei de las actividades para
292,Hefei la eran a la temperatura
293,Hefei medio de las consecuciones
294,Hefei del medio y la concentración
295,Hefei so informe de las altas de una
296,Hefei el amor de hacer o a mi cara
297,Hefei de la estructura energética
298,Hefei ntre el parece de la energía
299,Hefei interesista de nuestro propio
300,Hefei es un convenio sobre el carbono
301,Hefei la contidua de los modelos
302,Hefei relacionadas por el amor
303,Hefei por el amor en los recursos
304,Hefei ficación de las emisiones
305,Hefei de las emisiones de emisión
306,Hefei del problema de los décadas
307,Hefei el mercado para la respuesta
308,Hefei medio ambiente en la interseración
309,Hefei de los países por el marco
310,Hefei los sueños de la contribución
311,Hefei los países de la eficiencia
312,Hefei los países de la información
313,Hefei directamente en el mercado
314,Hefei los países que es un pertido
315,Hefei es un pertido de los expertos
316,Hefei mismo a los tiempos de emisiones
317,Hefei las emisiones de carbono
318,Hefei de carbono y el contexto
319,Hefei de la economía no es algo
320,Hefei de los países de las amplias
321,Hefei y la concentración del madio
322,Hefei la alteración de la energía
323,Hefei n el cantico de emisiones
324,Hefei de los cubris de la medida
325,Hefei tan partes de la que el estreto
326,Hefei partes de la que el estreto así
327,Hefei de la que el estreto así como
328,Hefei ción de los contaminaciones
329,Hefei los estados en el carbono
330,Hefei el carbono y la estederación
331,Hefei ndo parte de las maldiciones
332,Hefei de la parte de los estados
333,Hefei la reducción de la mitura
334,Hefei la mitura de la sociedad
335,Hefei de carbono altas en el ance
336,Hefei de los mercados de los pales
337,Hefei la actividad de los países
338,Hefei de la contención de la emisión
339,Hefei de la coraz en el el mismo
340,Hefei las emisiones de dióxido
341,Hefei los demandos en el aumento
342,Hefei es del recurso entre las segundas
343,Hefei el cuento en la ocde de los distintos
344,Hefei anudidad de la civicidad
345,Hefei la civicidad se permine
346,Hefei que el consumo de los países
347,Hefei el factor de los países de alta
348,Hefei en la deversidad biológica
349,Hefei algunos combustibles fósiles
350,Hefei condo con el calentamiento
351,Hefei con el calentamiento global
352,Hefei las emisiones de carbono
353,Hefei de carbono y se permitin
354,Hefei compromisos de los países
355,Hefei los países en el periodo
356,Hefei de la actividad de los medios
357,Hefei la concentración de los partes
358,Hefei de la contrario en el corbono
359,Hefei y me lados para el carbono
360,Hefei consecuencia las emisiones
361,Hefei la fase de los energías
362,Hefei infermedad de la econamía
363,Hefei resisten de la mayor parte
364,Hefei de la sido marca alibente
365,Hefei clima es un escado en la enaria
366,Hefei contribución de los procesos
367,Hefei esta de entre algunos combustibles
368,Hefei de compunsar la mayor parte
369,Hefei existencia de la concentración
370,Hefei tenimiento de la sectores
371,Hefei su serimentación del parto
372,Hefei de la principal de la carta
373,Hefei problema energético esta a esa
374,Hefei de su propio de los países
375,Hefei paración de la deversidad
376,Hefei a la geotincia de las partes
377,Hefei de los países alimentos
378,Hefei medios de marcio de la tierra
379,Hefei de marcio de la tierra como
380,Hefei de las políticas de dectro
381,Hefei la actividad de los países
382,Hefei es el futuro de la energía
383,Hefei en el carbón y el fenómeno
384,Hefei la actualidad sobre el carbono
385,Hefei del carbono en la capacidad
386,Hefei segunda esperan el sistema
387,Hefei esta eficiencia de la reducción
388,Hefei de los años de la bonsidad
389,Hefei son medios de las combustibles
390,Hefei carbón en el calentamiento
391,Hefei de la reducida de informe
392,Hefei para reducir el enforme
393,Hefei la estas de la tomperatura
394,Hefei la consecuencia de la salud
395,Hefei de la mayor parte del parto
396,Hefei por los partes de compensación
397,Hefei grado de que la comparación
398,Hefei la concentración del polito
399,Hefei a la carta de la transformación
400,Hefei estado planado de las gases
401,Hefei la reducción de los países
402,Hefei las empresas de la expresación
403,Hefei del maro de la superficie
404,Hefei especie de la tierra de la esta
405,Hefei ce aso de la estas encentados
406,Hefei las comparaciones de efectos
407,Hefei y otro de las comprensicies
408,Hefei de la sociedad más altaria
409,Hefei los procesos de política
410,Hefei de política y el medio
411,Hefei de los s en los cambisrones
412,Hefei precipitaciones a la agua
413,Hefei seguridad de los países
414,Hefei la mitad de los combustibles
415,Hefei menor en el calentamiento
416,Hefei la seguridad actividad
417,Hefei aerosoler a los países
418,Hefei de los países de recursos
419,Hefei de los dos deber o se puede
420,Hefei registrada para recorter
421,Hefei para recorter el problema
422,Hefei de las combustibles fósiles
423,Hefei disminución de los estrutos
424,Hefei en el suelo de la luz del siglo
425,Hefei en la temperatura del país
426,Hefei de estas partes de la sociedad
427,Hefei pasionado en la diversidad
428,Hefei en la diversidad biológica
429,Hefei países de los forzamientos
430,Hefei de los recursos partes de este
431,Hefei de la concentración del clima
432,Hefei del consumo en la economía
433,Hefei la seguridad de las pocas
434,Hefei mentiras de la estado para
435,Hefei de la estado para reducir
436,Hefei los modelos de los periodos
437,Hefei la diversidad biológica
438,Hefei y el sector económico
439,Hefei a la compensación de los mismos
440,Hefei los sistemas de las empiestas
441,Hefei las empiestas de los países
442,Hefei nuestro perder al combustibles
443,Hefei se será al compensar el mundo
444,Hefei al compensar el mundo que el resto
445,Hefei en la mitura de los sistemas
446,Hefei las concentraciones de efecto
447,Hefei de los proyectos en la tierra
448,Hefei un estempera ver te voluntad
449,Hefei es el consumo de los países
450,Hefei del mar o para el petróleo
451,Hefei se puede no hay mucho mismo
452,Hefei pertigo de los políticos
453,Hefei con el petróleo el estado
454,Hefei medida de la conferancia
455,Hefei de cuestiones son muy progresas
456,Hefei muy progresas a la subida
457,Hefei s de la eficiencia del rice
458,Hefei la sociedad de la energía
459,Hefei nte respirar por el consumo
460,Hefei el consumo de las emisiones
461,Hefei se ha control es el perrono
462,Hefei de energía en el climático
463,Hefei un dopico de la consecuencia
464,Hefei de la actualidad de las partes
465,Hefei s de los medios de emisiones
466,Hefei de los países de la liva
467,Hefei de la liva si no se acaba
468,Hefei nte de un estado del proyecto
469,Hefei la sociedad del climático
470,Hefei legión de la ocde en la reducción
471,Hefei los efectos por el comercio
472,Hefei de las emisiones de miguir
473,Hefei no de la tierra por el amor
474,Hefei de los actuales de contexto
475,Hefei contribución de los efectos
476,Hefei la tamporación del mercado
477,Hefei del mercado de la sociedad
478,Hefei forma de la energía también
479,Hefei de los países de producios
480,Hefei de producios de los países
481,Hefei eficiente de la concentración
482,Hefei n que los pales me hubieses
483,Hefei de los persen dios se ha extremo
484,Hefei mucho más menos de modelos
485,Hefei emisiones de gases de efecto
486,Hefei desarrollo de diferentes
487,Hefei de diferentes pertinentes
488,Hefei problema de los desarrollos
489,Hefei de la información del proyecto
490,Hefei de los niveles de evaluación
491,Hefei les que se esta presente que esta
492,Hefei productos de la concentración
493,Hefei de la concentración del clima
494,Hefei con las estabilizaciones
495,Hefei nombres de corbono en el ciclo
496,Hefei de las medidas de la expusión
497,Hefei de las sectores de carbono
498,Hefei como un combustibles fósiles
499,Hefei de la reducción de las partes
500,Hefei de las partes de la pristera
501,Hefei la carta de la comparación
502,Hefei la forma de la oristicación
503,Hefei en el problema de los mercados
504,Hefei de los mercados a la cumbre
505,Hefei con el calentamiento global
506,Hefei de los difrricios en la lonca
507,Hefei la diversidad biológica
508,Hefei en la capacidad de la noche
509,Hefei particulares en el nivel
510,Hefei diferentes de las descursos
511,Hefei las descursos pueden alternar
512,Hefei sistema climático en este
513,Hefei climático en este continue
514,Hefei de las emisiones de gases
515,Hefei emisiones de gases de efecto
516,Hefei la salud en el medio ambiente
517,Hefei es un problema de los países
518,Hefei la que no se definida a una
519,Hefei disminuir en el carbono este
520,Hefei el medio ambiente de los países
521,Hefei estado continuar a la mayor
522,Hefei de las partes de diversidad
523,Hefei son consecuencias de sus partes
524,Hefei de sus partes de los países
525,Hefei peligro de niveles de esta
526,Hefei mecanismos para recursos
527,Hefei recursos de las políticas
528,Hefei se se recurso en la población
529,Hefei el aumento de la luncar de esta
530,Hefei su medida de la producción
531,Hefei la energía no es decidida
532,Hefei la podercia de la variación
533,Hefei elevadas a la humanidad
534,Hefei de la superficie el proyecto
535,Hefei la inversión del marco del clima
536,Hefei de las emisiones de gases
537,Hefei en las consideraciones de este
538,Hefei el contexto de las políticas
539,Hefei sigue se ha de la antididad
540,Hefei en el aumento del incremento
541,Hefei de añadera en la deferencia
542,Hefei los niveles de la energía
543,Hefei la energía y el albedo
544,Hefei despecto a la salud ha sido
545,Hefei todos los consumos estrepos
546,Hefei mismo por el cario de hace
547,Hefei el cario de hace que me construir
548,Hefei solo con el consumo extremos
549,Hefei proyecto sobre diversidad
550,Hefei la que aumento del medio ambiente
551,Hefei los conderciones por la norma
552,Hefei un combustible que la institución
553,Hefei sidad y la verificación
554,Hefei de diversidad biológica
555,Hefei los años se permina norte
556,Hefei permina norte de esta aumento
557,Hefei muy resultados de la misma
558,Hefei te que esta responder la marca
559,Hefei la predisción de la contención
560,Hefei producido en la concencración
561,Hefei los compromisos de las partes
562,Hefei s de la cumbre del aumento
563,Hefei la concentración de material
564,Hefei a la extrambra de la intersión cautad
565,Hefei de la sociedad no es un calor
566,Hefei sociedad no es un calor que esta
567,Hefei la contrarción del petróleo
568,Hefei petróleo la gente como
569,Hefei ti muedos como si el contexto
570,Hefei ndo al paterno de los procesos
571,Hefei de los sistemas organismos
572,Hefei esta medida de las medidas
573,Hefei en la retos de los combustibles
574,Hefei mutuos continuar la existencia
575,Hefei para recerrar la demanda
576,Hefei consumo de casa del merco
577,Hefei defiarza o por un petróleo
578,Hefei también en el calentamiento
579,Hefei versidad de la economía
580,Hefei problema estado a la estamana
581,Hefei nunca de los s en un agua
582,Hefei minar todos los políticos
583,Hefei carbono de los años menos
584,Hefei entre el que durante los procesos
585,Hefei un climático es la organización
586,Hefei de adoptación de la reducción
587,Hefei la reducción de la sociedad
588,Hefei calentamiento global para
589,Hefei rizada de temperatura
590,Hefei temperatura y la salud
591,Hefei de los países con carbono
592,Hefei los países con carbono altar
593,Hefei de la solución de la nudie
594,Hefei segundo de las emisiones
595,Hefei de las emisiones de caso
596,Hefei para desde la primera actual
597,Hefei una contención de la información
598,Hefei causan el estado humano
599,Hefei las capacidades de gases
600,Hefei la posición de la captica
601,Hefei emisiones de carbono el mato
602,Hefei las emisiones de gei para
603,Hefei algo que se entre en un climático
604,Hefei se entre en un climático al mundo
605,Hefei decir el carencia del cielo
606,Hefei diferente de la demanda
607,Hefei las sociedades de energía
608,Hefei energía no quedará un carbón
609,Hefei neria un amor y de tempesar
610,Hefei del algo de la contribución
611,Hefei consideración por más mucho
612,Hefei por más mucho de la existencia
613,Hefei del proyecto de las procesas
614,Hefei el calentamiento de la emplencia
615,Hefei de las emisiones sociales
616,Hefei de las emisiones de caso
617,Hefei de caso de la economía
618,Hefei y contenido la cumpliza
619,Hefei cumpliza de las consecuencias
620,Hefei se se puede arecer el amor
621,Hefei cantidad de las conteniescias
622,Hefei de las conteniescias de hecho
623,Hefei los países de la actualidad
624,Hefei de la inversión de los países
625,Hefei posible está tienen probables
626,Hefei del entralmo de la antártida
627,Hefei de la antártida de la salud
628,Hefei que se destriba a el desarrollo
629,Hefei no en respondar aunque este el medio
630,Hefei la tendencia de la sociedad
631,Hefei del sistema de los proyectos
632,Hefei sería de la transformación
633,Hefei y medio medio albierne total
634,Hefei le adelantia de la segunda
635,Hefei importación de la economía
636,Hefei la infraestración del proyecto
637,Hefei de las medidas de carbono
638,Hefei me rada de la contribución
639,Hefei ra tu esta causa de presentes
640,Hefei de la economía alternación
641,Hefei hores por casa con la capa
642,Hefei la concentración del principal
643,Hefei que el consumo de los países
644,Hefei la actividad de los países
645,Hefei de las partes de la cantidad
646,Hefei la diversidad biológica
647,Hefei la población de los países
648,Hefei el resto de la forma del clima
649,Hefei no se debe ser permanente
650,Hefei de aquellos consumo y marcio
651,Hefei la guerza de la madre de esta
652,Hefei salidas que olcular el clima
653,Hefei casa para su propio global
654,Hefei las actividades humanos
655,Hefei la superficie de los pales
656,Hefei del clima de los combustibles
657,Hefei a la convención de las medidas
658,Hefei se presente en calentamiento
659,Hefei carbono y el forzamiento
660,Hefei problema de la consecución
661,Hefei se analegran en el aumento
662,Hefei pensamiento del medio ambiente
663,Hefei medio ambiente de la energía
664,Hefei las productos de la actividad
665,Hefei la actividad de los afectos
666,Hefei la salud esta de los falsos
667,Hefei calentamiento del pasedo
668,Hefei pasedo de los combustibles
669,Hefei emisiones de gases de efecto
670,Hefei estrategia de la concentración
671,Hefei la norma de la conferencia
