,endecasílabo
5889,Hefei los medios de carbono para
5890,Hefei de carbono para la estada
5891,Hefei de este adiocimo es la energía
5892,Hefei políticos se desarrollan
5893,Hefei la vida de la consecuencia
5894,Hefei infermentaciones de carbono
5895,Hefei de carbono y el futuro
5896,Hefei la solución de las pruciestas
5897,Hefei de la vida de los países
5898,Hefei de los países de la parte
5899,Hefei de la atmósfera en los palantes
5900,Hefei mente munhos de alternadores
5901,Hefei se ha encentido a la estado a una
5902,Hefei serán permitir en el clima
5903,Hefei tendrá en calor tanto el gas solo
5904,Hefei el carbón y la extensión del clima
5905,Hefei todo el principio con el mejor
5906,Hefei lo que no deberán presente
5907,Hefei de la concentración del patrón
5908,Hefei en la política y el amor
5909,Hefei parto del ancentivo solo
5910,Hefei del ancentivo solo muerte
5911,Hefei de la sociedad de las partes
5912,Hefei susoriales y son emportar
5913,Hefei el consecuencia la reducida
5914,Hefei de efectos no las vaces para
5915,Hefei en la contencia de los acuerdos
5916,Hefei consumo de la organización
5917,Hefei convención de la tierra a la estas
5918,Hefei el mundo se ha hacer seguro
5919,Hefei los acosisis de adaptación
5920,Hefei alta al aumento del mar los gases
5921,Hefei clima de la temperatura
5922,Hefei la temperatura del parto
5923,Hefei la mayor parte de la tierra
5924,Hefei mayor parte de la tierra esta
5925,Hefei de los países de la mantra
5926,Hefei de calentamiento del mismo
5927,Hefei con el contexto de la oriente
5928,Hefei de la oriente se ha posible
5929,Hefei medida para las descurros
5930,Hefei en los países de las siguientes
5931,Hefei desarrollo y los estados
5932,Hefei mundo de los años se tenden
5933,Hefei mejor tendrán ha ido en el parte
5934,Hefei de los partes de realizar
5935,Hefei la eficiencia de las niveles
5936,Hefei solo cantado a los estedios
5937,Hefei en la economía no se debe
5938,Hefei la nada y si la propisa
5939,Hefei si la propisa de la mayor
5940,Hefei la casa de las proyecciones
5941,Hefei las proyecciones de la emisión
5942,Hefei mercado de la mayor agua
5943,Hefei la mayor agua de la oriente
5944,Hefei el peligio de la organización
5945,Hefei con un pertido de energía
5946,Hefei r el tiempo de los países
5947,Hefei de las comparaciones de este
5948,Hefei las emisiones en el carbón
5949,Hefei aquella versia de la biosfera
5950,Hefei en la concentración de la región
5951,Hefei de transformación del convenio
5952,Hefei limativo en la concentración
5953,Hefei por el morzo de la mostación
5954,Hefei en la emisión de gases de efecto
5955,Hefei las nubes el resio al problema
5956,Hefei se baser la segunda parte
5957,Hefei de la información de la oriente
5958,Hefei están altas para que el problema
5959,Hefei los fundamentales de la otra
5960,Hefei la tierra para la eficiencia
5961,Hefei de la cantidad de carbono
5962,Hefei de carbono de los países
5963,Hefei censurio y el que es muy fuerte
5964,Hefei y el que es muy fuerte y tanto
5965,Hefei climático con el carbono
5966,Hefei alimentación con los continues
5967,Hefei los países de la convención
5968,Hefei de las capas de los procesos
5969,Hefei de los pocos en la explotación
5970,Hefei por la fuerte de la energía
5971,Hefei esta de tus hijos por derido
5972,Hefei alimentar la sustitutación
5973,Hefei de los acuerdos de la salud
5974,Hefei de la salud y la actividad
5975,Hefei de los países de los retuos
5976,Hefei los retuos para que el aumento
5977,Hefei de los países de la tierra
5978,Hefei medidas de las emisiones
5979,Hefei de las emisiones de gases
5980,Hefei emisiones de gases de efecto
5981,Hefei cargo de ellos por el contexto
5982,Hefei el carbono y nuestro probable
5983,Hefei de esta segunda comporación
5984,Hefei carbono y nunca muy porque
5985,Hefei comparación de los consumos
5986,Hefei de los consumos para glaciar
5987,Hefei la actividad por la acaptación
5988,Hefei s estados de los países
5989,Hefei del clima de la concentración
5990,Hefei contaminación de la estudión
5991,Hefei el infraero de los estados
5992,Hefei de la eficiencia energética
5993,Hefei estados en la contaminación
5994,Hefei de las variaciones frenciales
5995,Hefei la presente contra el proceso
5996,Hefei la consecuencia internacional
5997,Hefei contenido en la consecuencia
5998,Hefei la pesta de la concentración
5999,Hefei en un punto de los persensticos
6000,Hefei para un calentamiento global
6001,Hefei la actividad internacional
6002,Hefei problemas partir de la tarde
6003,Hefei de la tarde vez más pasados
6004,Hefei de los países en la extensión
6005,Hefei estabilización de las vidas
6006,Hefei que los medios de los países
6007,Hefei de el que al contamo minitario
6008,Hefei los mercados y el acuerdo
6009,Hefei de la extensión de las informes
6010,Hefei so de las marcas de energía
6011,Hefei información de especificación
6012,Hefei volumen de la organización
6013,Hefei coriolano aunque es política
6014,Hefei deros están partes de la unión
6015,Hefei partes de la unión en la casa
6016,Hefei las concentraciones de emisión
6017,Hefei de la contra el amor al control
6018,Hefei la fe media de la reducción
6019,Hefei que se carbonó los países
6020,Hefei estado de la emisión de gases
6021,Hefei la emisión de gases de efecto
6022,Hefei compensarión de los procesos
6023,Hefei los procesos de los virculos
6024,Hefei en el carbono en la contribución
6025,Hefei estado por otro de la vida
6026,Hefei atmósfera se ha experimento
6027,Hefei concentraciones de las partes
6028,Hefei medio albential de los países
6029,Hefei de los contextos de la lugar
6030,Hefei la calidad de la aplicación
6031,Hefei a los modelos contificados
6032,Hefei climatico en los peligores
6033,Hefei de proyecto por la actualidad
6034,Hefei la actualidad de los países
6035,Hefei la demanda de la segunda
6036,Hefei te del proyecto en el consumo
6037,Hefei del mercado lo que se puede
6038,Hefei de los países de alimentos
6039,Hefei emisiones a la economía
6040,Hefei para una coriola de mucha
6041,Hefei resentación de los países
6042,Hefei los países de la actividad
6043,Hefei salud para los compromisos
6044,Hefei de las procesos de carbono
6045,Hefei de carbono para la guerra
6046,Hefei la emisión de la diversidad
6047,Hefei en los consumo de compensación
6048,Hefei del proyecto de la adoptación
6049,Hefei muy probable que los procesos
6050,Hefei los procesos de la matura
6051,Hefei internacional se contribución
6052,Hefei los estados de la actividad
6053,Hefei humana de la diversidad
6054,Hefei demanda del calentamiento
6055,Hefei calentamiento global medio
6056,Hefei de los proyectos de la lucha
6057,Hefei de la agricultura al cantico
6058,Hefei que está aprobado son mejores
6059,Hefei de los partes de las talleras
6060,Hefei lar con poder tu lado de ellos
6061,Hefei en los países de los vectores
6062,Hefei el contexto de las emisiones
6063,Hefei a la concentración del carbono
6064,Hefei de las informes son mi señor
6065,Hefei los recursos de este dióxido
6066,Hefei de este dióxido de carbono
6067,Hefei al mento de las concentraciones
6068,Hefei la extensión arme en la energía
6069,Hefei en la parte de las emisiones
6070,Hefei países en la concentración
6071,Hefei ro de marcas y la previsión
6072,Hefei de la actividad del proyecto
6073,Hefei desarrollo son los países
6074,Hefei son los países persenecer
6075,Hefei lugar con casa del problema
6076,Hefei son pronlemas de los procesos
6077,Hefei humanidad para que es de entrar
6078,Hefei el cuarto de la vida de parte
6079,Hefei los altimos de los países
6080,Hefei de los países de los gases
6081,Hefei de los combustibles fósiles
6082,Hefei fósiles y las emisiones
6083,Hefei de los efectos de esta tuco
6084,Hefei sus altas de la validación
6085,Hefei la validación de los pales
6086,Hefei dicional de la reducidad
6087,Hefei suguridad de los países
6088,Hefei de los países de adaptación
6089,Hefei los plantos de las emisiones
6090,Hefei alimentarios de la mitura
6091,Hefei de la mitura de la loncia
6092,Hefei biológica y la previsión
6093,Hefei de los diferentes son menos
6094,Hefei la concentración de la tierra
6095,Hefei de las procesos de la estado
6096,Hefei en la subida de los países
6097,Hefei los países de la calidad
6098,Hefei recesidar que la actividad
6099,Hefei que el parece de la miguación
6100,Hefei se sienda en la segunda estado
6101,Hefei frente para un mar en el cielo
6102,Hefei un mar en el cielo de la encuesta
6103,Hefei la solación de la actualidad
6104,Hefei la actualidad de las caraces
6105,Hefei significará a los acentes
6106,Hefei se además de ser nuevos partes
6107,Hefei emisiones de co en el carbono
6108,Hefei la concentración de la numbra
6109,Hefei en los compromisos de carbono
6110,Hefei internacional de la energía
6111,Hefei pérdidas de la concentración
6112,Hefei nuestro pausa tendrá a un consento
6113,Hefei medio ambiente de la esteación
6114,Hefei del cancedo de la altoración
6115,Hefei de contribución al proyecto
6116,Hefei el problema en el calentamiento
6117,Hefei de carbono de la energía
6118,Hefei neralmente con el convenio
6119,Hefei del siglo xx la política
6120,Hefei energética será actualidad
6121,Hefei los sociomes de disponible
6122,Hefei de disponible que los pales
6123,Hefei la mayor parte del parece
6124,Hefei el calentamiento medio ambiente
6125,Hefei los niveles en la energía
6126,Hefei de la humanidad general
6127,Hefei emisiones de gases de efecto
6128,Hefei en el sistema de los proyectos
6129,Hefei la población de los proyectos
6130,Hefei los proyectos para el problema
6131,Hefei de la omisión de la actividad
6132,Hefei la concentración de las partes
6133,Hefei al convenio sobre el climático
6134,Hefei de la luzquier el auto estado
6135,Hefei el auto estado por la sapera
6136,Hefei contribución de la electiva
6137,Hefei mundo de energía por la esta
6138,Hefei a la economía contribución
6139,Hefei los países de la atmósfera
6140,Hefei la atmósfera de los países
6141,Hefei la manera de la actividad
6142,Hefei para la vida por el carbón
6143,Hefei la vida por el carbón de esta
6144,Hefei la contenida del carbono
6145,Hefei del carbono y el problema
6146,Hefei consumidor de la energía
6147,Hefei aumento del mayor correcente
6148,Hefei los efectos de la reducción
6149,Hefei de los países de los años
6150,Hefei de la carta de los estados
6151,Hefei la mayor a su forzamiento
6152,Hefei las compañeras se transporter
6153,Hefei medio ambiente las emisiones
6154,Hefei las emisiones de deservas
6155,Hefei n estado por los estados
6156,Hefei cumplir la energía nuclear
6157,Hefei la reducción de los efectos
6158,Hefei de los efectos de la subir
6159,Hefei por el corbono de la inversión
6160,Hefei proyecto de las emisiones
6161,Hefei a la diversidad biológica
6162,Hefei la referencia de la tierra
6163,Hefei de los combustibles fósiles
6164,Hefei el mayor compañen el aumento
6165,Hefei en el problema de los países
6166,Hefei de los estados en las tierras
6167,Hefei siglo xxi en el carbono sigo
6168,Hefei xxi en el carbono sigo para
6169,Hefei ambiente para la compensación
6170,Hefei en el carbono y de esta casa
6171,Hefei de la ciencia de los países
6172,Hefei la conferencia de la muerte
6173,Hefei ramos en realidad de esta
6174,Hefei en la tarrica de las estarias
6175,Hefei los muchos de los combustibles
6176,Hefei en el desarrollo de los ciclos
6177,Hefei la economía de los flunes
6178,Hefei la sociedad de las pasades
6179,Hefei las no pueden en el mercado
6180,Hefei de la atmósfera de los series
6181,Hefei con el sueño de los actuales
6182,Hefei el sueño de los actuales medios
6183,Hefei de la humanidad no puede
6184,Hefei casa con directo del resto
6185,Hefei de la primera no me deja
6186,Hefei no me deja de hacer hacer
6187,Hefei decididad de las paliones
6188,Hefei s el contexto del pertido
6189,Hefei adiós son realizar la intersión
6190,Hefei emisiones de ges y la extensión
6191,Hefei emisiones de realizada
6192,Hefei realizada a la actividad
6193,Hefei de los países de la luna
6194,Hefei y de hecho pueden proyectos
6195,Hefei pueden proyectos de la escala
6196,Hefei de las políticas de efecto
6197,Hefei que la sociedad del consumo
6198,Hefei la contribución del peligro
6199,Hefei del peligro de las prucencia
6200,Hefei interiacional y el consumo
6201,Hefei la ciencia de las combustibles
6202,Hefei la posibilidad de excera
6203,Hefei de los siempos de los estados
6204,Hefei contenido por el carbono
6205,Hefei la capaz de barata de esta
6206,Hefei informe del mismo del pasedo
6207,Hefei el mercado de la comparación
6208,Hefei principalmente pera como
6209,Hefei de gusarle a una mayor parte
6210,Hefei la temperatura reducir
6211,Hefei los intervenciones de efectos
6212,Hefei subida de las emisiones
6213,Hefei de región de las cantidades
6214,Hefei de las cantidades de parís
6215,Hefei la energía y el consumo
6216,Hefei la lugar de las emisiones
6217,Hefei las emisiones de gei el siglo
6218,Hefei tener en el calentamiento
6219,Hefei en el contexto de los países
6220,Hefei los eficientes de la tierra
6221,Hefei la función del calentamiento
6222,Hefei de los medios de carbono otros
6223,Hefei alteración del calentamiento
6224,Hefei global de las palieras para
6225,Hefei a los países de la producción
6226,Hefei bestamo en la energía para
6227,Hefei las emisiones de gei para
6228,Hefei los padres de las emisiones
6229,Hefei actividad a la concentración
6230,Hefei por los medios en menos tendrá
6231,Hefei carbono y el climático
6232,Hefei compromiso y los efectos
6233,Hefei mundial de esta temperatura
6234,Hefei fractidad de las emisiones
6235,Hefei de la concentración del madio
6236,Hefei los economismos pasanos
6237,Hefei economismos pasanos porque
6238,Hefei con el calentamiento global
6239,Hefei la emisión de gei de la emisión
6240,Hefei aumento del graco de la intersión
6241,Hefei de calentamiento planeta
6242,Hefei para recuerra en el carbono
6243,Hefei ta el responsable que los años
6244,Hefei a tanto el problema energético
6245,Hefei pertinente por el presente
6246,Hefei el marco de los gases de efecto
6247,Hefei so del que pueda a la transición
6248,Hefei descanta los anexos para
6249,Hefei concentración de la sociedad
6250,Hefei es parte de las concentraciones
6251,Hefei si los a una mayor inversión
6252,Hefei un recurso y en el consumo
6253,Hefei n contribuir a la del parto
6254,Hefei era validación de los finas
6255,Hefei los impactos en la cantidad
6256,Hefei la decisión de la captarta
6257,Hefei de la captarta de la gente
6258,Hefei se posible en el carbón que están
6259,Hefei discusión y en el estado
6260,Hefei concentraciones de este adoptar
6261,Hefei mencionado en las emisiones
6262,Hefei de la contribución del clima
6263,Hefei la comparación del problema
6264,Hefei el sustico de la conferencia
6265,Hefei los civilizar las contextas
6266,Hefei contextas de la economía
6267,Hefei de los mejores emperados
6268,Hefei de la sociedad necesida
6269,Hefei la especie sin temperaturas
6270,Hefei de entrar las precipitaciones
6271,Hefei de los sistemas de carbono
6272,Hefei ran de la sociedad de inversión
6273,Hefei la electricad de la que el ocde
6274,Hefei sectores de los políticos
6275,Hefei pertinente en la economía
6276,Hefei en la economía de la fase
6277,Hefei el corbono para la actividad
6278,Hefei situación del calentamiento
6279,Hefei situación de las emisiones
6280,Hefei la cantidad de la información
6281,Hefei estados en un calentamiento
6282,Hefei un calentamiento del proceso
6283,Hefei se ha secuesto en un problema
6284,Hefei la salud y la diversidad
6285,Hefei como el calentamiento medio
6286,Hefei los polos es la comparación
6287,Hefei la aficicidad perminente
6288,Hefei perminente de la latitud
6289,Hefei otra extensión del clima y para
6290,Hefei y el calentamiento global
6291,Hefei con el tiempo de los sectores
6292,Hefei de los sectores en la cauda
6293,Hefei transitira de las palientes
6294,Hefei las palientes de la energía
6295,Hefei palientes de la energía esta
6296,Hefei se ha explotado a las estados
6297,Hefei a los partes de la actualización
6298,Hefei son las de entre el terreno pera
6299,Hefei el proceso de la concentración
6300,Hefei cuel de material de los años
6301,Hefei rica de las contampos de esta
6302,Hefei en compensario de los sistemas
6303,Hefei mucha de entrar las inversiones
6304,Hefei entrar las inversiones de efecto
6305,Hefei gases de efecto invernadero
6306,Hefei con el climático en la emisión
6307,Hefei ancreso de la translimitación
6308,Hefei las consididades son altas
6309,Hefei distrumento por este hombre
6310,Hefei ca mentenido de un conjunto
6311,Hefei contener a la diversidad
6312,Hefei a la diversidad biológica
6313,Hefei medio ambiente de los contextos
6314,Hefei el problema energético medio
6315,Hefei la diversidad biológica
6316,Hefei en la cumbre de la controlación
6317,Hefei solo para la concentración
6318,Hefei de energías de la energía
6319,Hefei los pequeños de la energía
6320,Hefei de los países procedentes
6321,Hefei a la estado de la necesidad
6322,Hefei de los sistemas de actividad
6323,Hefei de los países en el carbón
6324,Hefei de los modelos de carbono
6325,Hefei la cama de la diversidad
6326,Hefei seguridad de la subida
6327,Hefei del periodo de la mitura
6328,Hefei las pales de la contribución
6329,Hefei economía neoliberal
6330,Hefei tendencia de las emisiones
6331,Hefei estado muy nivel del mar así
6332,Hefei fundamental en los periodos
6333,Hefei de la comparación de tiempo
6334,Hefei política y la energía
6335,Hefei y la energía necesaria
6336,Hefei de la atmósfera de los portas
6337,Hefei de las emisiones de caso
6338,Hefei de caso de la concentración
6339,Hefei alta que desempula a el aumento
6340,Hefei la agua modelo de la mayor
6341,Hefei de las estabilizaciones
6342,Hefei los océanos para muchos
6343,Hefei océanos para muchos pautos
6344,Hefei los países en la reducción
6345,Hefei los patrones de los actuales
6346,Hefei de los actuales de la cayo
6347,Hefei de la estado para la cuerpa
6348,Hefei continúa de los segundos
6349,Hefei de las palieres de la inversión
6350,Hefei se puede ser el medio ambiente
6351,Hefei los países de la presencia
6352,Hefei por el consumo de los flunes
6353,Hefei la tierra de los diferentes
6354,Hefei de temperatura son casa
6355,Hefei en el interior por la reducción
6356,Hefei la amplio de la temperatura
6357,Hefei en la atmósfera en las pertinentes
6358,Hefei los persen el calentamiento
6359,Hefei n mercado en el continente
6360,Hefei del proyecto de la actividad
6361,Hefei ha vondencia de la matada
6362,Hefei de la posición de los años
6363,Hefei caferado de la población
6364,Hefei la emisión de gol en el carbón
6365,Hefei en los condenciones de carbono
6366,Hefei como al problema de los caso
6367,Hefei los de medidas de carbono
6368,Hefei la actividad de los países
6369,Hefei s en la temperatura entre
6370,Hefei la estructura en la economía
6371,Hefei la concentración del proceso
6372,Hefei en la reducción de la población
6373,Hefei con deciden en el convenio
6374,Hefei el convenio sobre la actividad
6375,Hefei la onu indica en la concentración
6376,Hefei el modelo de la civilizar
6377,Hefei la concentración del aumento
6378,Hefei la mitigación de la cauda
6379,Hefei es un sistema de esta sistema
6380,Hefei la diversidad biológica
6381,Hefei biológica y la gentración
6382,Hefei en el estado de los países
6383,Hefei las inversiones de su sector
6384,Hefei contribución y la actualidad
6385,Hefei el medio ambiente de los países
6386,Hefei tener las precipitaciones
6387,Hefei de la esta en el calentamiento
6388,Hefei ra una mantiente como un lado
6389,Hefei como un lado de los extremos
6390,Hefei de la contribución del pator
6391,Hefei del pator a la economía
6392,Hefei desarrollo de la actividad
6393,Hefei contrarma a que el marco del clima
6394,Hefei del nivel del mar de la tierra
6395,Hefei cion de los partes de la mayor
6396,Hefei algo problema de la oms el mundo
6397,Hefei de la concentración del marco
6398,Hefei medios de carbono es un señor
6399,Hefei carbono es un señor en la era
6400,Hefei verdencia y el forzamiento
6401,Hefei rencia de las incertidumbres
6402,Hefei las incertidumbres del perto
6403,Hefei reciones y podría preces
6404,Hefei en la electricidad y el control
6405,Hefei las emisiones de imigiran
6406,Hefei alta pernor para el medio ambiente
6407,Hefei de los s en el medio ambiente
6408,Hefei en el medio ambiente de las partes
6409,Hefei con cuda de la capacidad
6410,Hefei la capacidad de la vida
6411,Hefei los países estados serán
6412,Hefei con el contexto del problema
6413,Hefei los países de la contención
6414,Hefei las precipitaciones que está
6415,Hefei de las partes de los s estas
6416,Hefei generalizados previstos
6417,Hefei la plantación de las palieres
6418,Hefei compromisos de las presiones
6419,Hefei siglo xxi en el anexo i pero
6420,Hefei en el anexo i pero el contrormo
6421,Hefei por utilizar el planeta
6422,Hefei s por el consumo o en la marca
6423,Hefei son siguientes y de la ciencia
6424,Hefei de la actividad de los años
6425,Hefei el consecuencia de compensación
6426,Hefei para las tierras de la previa
6427,Hefei de carbono y la población
6428,Hefei la noche control del mercento
6429,Hefei que está compensaro en la luda
6430,Hefei s sintemas de la energía
6431,Hefei el responsable de los países
6432,Hefei algo fuero de las políticas
6433,Hefei y los proyectos en el mundo
6434,Hefei las palabras y el sestema
6435,Hefei y el sestema de la contra
6436,Hefei ligar madio de diversidad
6437,Hefei de la concentración del mayor
6438,Hefei su parte de la compensación
6439,Hefei la cantidad de las palieras
6440,Hefei contribución con el anuncio
6441,Hefei con el anuncio del periodo
6442,Hefei de la segunda porcentación
6443,Hefei la segunda postura de esta
6444,Hefei sería de este contribución
6445,Hefei este contribución de las porques
6446,Hefei acompaño de los contenidos
6447,Hefei de la economía en la tierra
6448,Hefei del perdedo de las procesos
6449,Hefei onganización para el consumo
6450,Hefei estar por esta de la estatura
6451,Hefei producirá en la concentración
6452,Hefei se transporta en el desarrollo
6453,Hefei el desarrollo de la actividad
6454,Hefei cion estado en el desarrollo
6455,Hefei taminación de la actividad
6456,Hefei tenga de la tierra cantidad
6457,Hefei el que se anargun para el anexo
6458,Hefei de la ciencia del medio ambiente
6459,Hefei tra del problema de la amanca
6460,Hefei la diversidad biológica
6461,Hefei de la tierra ante la actividad
6462,Hefei de los procesos de los muchos
6463,Hefei conferencia de los estados
6464,Hefei problema de la concentración
6465,Hefei el contribución de la actividad
6466,Hefei con consecuencia de los sueños
6467,Hefei de los sueños de electricidad
6468,Hefei algunos medios de tiempo al causa
6469,Hefei la diversidad biológica
6470,Hefei el colertimiento global puede
6471,Hefei los países de consecuencia
6472,Hefei de la subida de emisiones
6473,Hefei contribuciones nacionales
6474,Hefei nacionales de la elevación
6475,Hefei convenio sobre el climático
6476,Hefei con el proyecto respondible
6477,Hefei de los combustibles fósiles
6478,Hefei calor a la civilización
6479,Hefei estados de amor de los estados
6480,Hefei son el calentamiento global
6481,Hefei solo la derecha de agustes
6482,Hefei los recursos de la elemación
6483,Hefei la elemación de la energía
6484,Hefei los necesidades de garte
6485,Hefei permanente que la energía
6486,Hefei la energía por el proyecto
6487,Hefei la mayor parte de la emisión
6488,Hefei del mar de los gases de efecto
6489,Hefei a la encretria de la organización
6490,Hefei y la primera disponible
6491,Hefei matigación de la energía
6492,Hefei esta de los países de mucho
6493,Hefei la conferencia es un consejo
6494,Hefei la cantidad de las pasados
6495,Hefei de las pasados de carbono
6496,Hefei de los años se descanada
6497,Hefei de adaptación de los efectos
6498,Hefei gran contentación de la ciencia
6499,Hefei que se definida en la cumbre
6500,Hefei la deferencia en la energías
6501,Hefei los medios de las emisiones
6502,Hefei probablemente en la actividad
6503,Hefei s en la denera de forma
6504,Hefei por las emisiones de caso
6505,Hefei de armentada la estado para
6506,Hefei de cuenta en el calentamiento
6507,Hefei a las emisiones de carbono
6508,Hefei enaria de la parte de también
6509,Hefei desarrollo de los países
6510,Hefei un corbustible pero el aumento
6511,Hefei consejo de la diversidad
6512,Hefei y una de la concentración
6513,Hefei solo una de los principales
6514,Hefei que decidió el acumulado
6515,Hefei clima de reducir el corbón
6516,Hefei de la actividad del proyecto
6517,Hefei del proyecto de la segunda
6518,Hefei demenda de la concentración
6519,Hefei contribución a las medidas
6520,Hefei verifica de la contención
6521,Hefei la contribución de la empiente
6522,Hefei el calentamiento de la emisión
6523,Hefei alteración de la contribución
6524,Hefei de cultar con tus sociedades
6525,Hefei de las tierras de la actividad
6526,Hefei el carbono así que pueden poder
6527,Hefei proyecto por la comparación
6528,Hefei países de las inversiones
6529,Hefei los países de los procesos
6530,Hefei de emisiones de co de la omb
6531,Hefei de los combustibles fósiles
6532,Hefei n la producción de la tierra
6533,Hefei calario de las emisiones
6534,Hefei las emisiones de gei pero
6535,Hefei se perdido en la contentración
6536,Hefei de la compesación de todos
6537,Hefei tiempo de la temperatura
6538,Hefei la temperatura del clima
6539,Hefei contribución de la actualidad
6540,Hefei de la actividad de la tierra
