,endecasílabo
0,Salvador permitado en la atmósfera
1,Salvador esta mayor política
2,Salvador de carbono a la producción
3,Salvador problema de compromiso
4,Salvador modelos de compromiso
5,Salvador esta mayor producida
6,Salvador contribución de la propia
7,Salvador carbono en la concentración
8,Salvador menos de la consecuencia
9,Salvador parte de la concentración
10,Salvador parte de la concentración
11,Salvador mundial de la concentración
12,Salvador contribución de la compra
13,Salvador el problema de reducir
14,Salvador mayor parte de la salud
15,Salvador estado como la propia
16,Salvador marca de la concentración
17,Salvador mayor en la compromisa
18,Salvador climático como el cambio
19,Salvador como el cambio climático
20,Salvador producto en la compromisa
21,Salvador en la salud de la contrar
22,Salvador marco de la concentración
23,Salvador climático en la atmósfera
24,Salvador el cambio climático está
25,Salvador esta esta mayor producción
26,Salvador marca de la concentración
27,Salvador parte de la contra el cambio
28,Salvador política en la producción
29,Salvador climática y el cambio
30,Salvador al menos de la comprensión
31,Salvador carbono en la compromisa
32,Salvador propia de la concentración
33,Salvador contra el cambio climático
34,Salvador el cambio climático esta
35,Salvador estado en la concentración
36,Salvador contra el cambio climático
37,Salvador menos de la compromisa
38,Salvador la compra de compromiso
39,Salvador marco de la concentración
40,Salvador la comprar en la producción
41,Salvador por el contral de la propia
42,Salvador la contrar con la estrategia
43,Salvador permitado de la propia
44,Salvador de la propia climática
45,Salvador para el cambio climático
46,Salvador contra el cambio climático
47,Salvador estado en la consecuencia
48,Salvador la producción de la compra
49,Salvador permitado de la compra
50,Salvador parte de la compromisa
51,Salvador estado su proporciona
52,Salvador la propia de contra el cambio
53,Salvador producirá a la energía
54,Salvador en las contrabulidades
55,Salvador permitado de la propia
56,Salvador de la propia contra el cambio
57,Salvador menos de la concentración
58,Salvador permitado por la propia
59,Salvador a la contra el combustible
60,Salvador parte de la compromisa
61,Salvador e la mayor actividad
62,Salvador contra el cambio climático
63,Salvador contra el cambio climático
64,Salvador menos precipitaciones
65,Salvador permita de la producción
66,Salvador la capa de compromiso
67,Salvador en la propia compromiso
68,Salvador de contra la compromisa
69,Salvador estado sobre la propia
70,Salvador menos de la compromisa
71,Salvador por el mar en la producción
72,Salvador permita en la compromisa
73,Salvador la producción de la compra
74,Salvador contra el cambio climático
75,Salvador permitado de la estado
76,Salvador producido a la energía
77,Salvador parte de la contra el cambio
78,Salvador de contra la compromisa
79,Salvador la contrar la compromisa
80,Salvador comprensión de la producción
81,Salvador propia con la compromisa
82,Salvador permita en la compromisa
83,Salvador por el cambio climático
84,Salvador problema de la producción
85,Salvador estado en la concentración
86,Salvador parte de la compromisa
87,Salvador la propia de la comprensión
88,Salvador permitado en la producción
89,Salvador seguir en la contribución
90,Salvador la estada de compromiso
91,Salvador parte de la concentración
92,Salvador la propia como el problema
93,Salvador problema con la atmósfera
94,Salvador el contrado de carbono
95,Salvador carbono que la comprensión
96,Salvador la compromisa de deces
97,Salvador deces con la compromisa
98,Salvador se producirá en la propia
99,Salvador esta mayor contra el cambio
100,Salvador manor en la compromisa
101,Salvador estado en la compromisa
102,Salvador el mar y la contra el cambio
103,Salvador modelo de la producción
104,Salvador la energía necesaria
105,Salvador los combustibles fósiles
106,Salvador la propia como el estado
107,Salvador a la capa de la compra
108,Salvador compromiso de carbono
109,Salvador carbono y el problema
110,Salvador la energía contra el cambio
111,Salvador contribución de la compra
112,Salvador se esta mayor producida
113,Salvador compromiso de la capa
114,Salvador producto a las emisiones
115,Salvador la propia de los procesos
116,Salvador estado en la concentración
117,Salvador segundo de la producción
118,Salvador la comprensión de la propia
119,Salvador permitado en la comprensión
120,Salvador en el cambio climático
121,Salvador el cambio climático esta
122,Salvador parte de la concentración
123,Salvador parte de la compromisa
124,Salvador climático en la producción
125,Salvador parte de la compromisa
126,Salvador la producción de la compra
127,Salvador la compra de la producción
128,Salvador menos de la compromisa
129,Salvador una vez más de la contrar
130,Salvador marco de la concentración
131,Salvador menos en la concentración
132,Salvador ser estado a la producción
133,Salvador contra el cambio climático
134,Salvador los procesos de carbono
135,Salvador seguridad establecir
136,Salvador parte de la contribución
137,Salvador parte de la compromisa
138,Salvador a la propia contra el cambio
139,Salvador consecuencia de la contrar
140,Salvador la contrar la compromisa
141,Salvador la compra de la estructura
142,Salvador contra el cambio climático
143,Salvador de la compra de consumo
144,Salvador la compromisa de cambio
145,Salvador por el cambio climático
146,Salvador permitado en el promedio
147,Salvador la estado de la comprensión
148,Salvador estado se desarrollar
149,Salvador se desarrollar la estada
150,Salvador mercado de la energía
151,Salvador estado en la contribución
152,Salvador carbono en la compromisa
153,Salvador menos de la concentración
154,Salvador permitado en la producción
155,Salvador contración de la producción
156,Salvador de todo la contra el cambio
157,Salvador menos de la concentración
158,Salvador estado en la compromisa
159,Salvador contra el cambio climático
160,Salvador la comprensión de la compra
161,Salvador la producción de la compra
162,Salvador parte de la concentración
163,Salvador menos de la concentración
164,Salvador proceso de esta producción
165,Salvador proceso de compromiso
166,Salvador sin embargo se producir
167,Salvador contra el mar en la atmósfera
168,Salvador de compromiso de contra
169,Salvador contra la temperatura
170,Salvador menos de la concentración
171,Salvador carbono que los países
172,Salvador la producción de la mayor
173,Salvador problema de la producción
174,Salvador de compromiso de contra
175,Salvador menos de la contribución
176,Salvador por el cambio climático
177,Salvador climático y la propia
178,Salvador de compromiso de carbón
179,Salvador carbono en la compromisa
180,Salvador permitado de la tierra
181,Salvador emisiones de carbono
182,Salvador carbono por un problema
183,Salvador estado en la contra el cambio
184,Salvador de combustibles fósiles
185,Salvador producto en la concentración
186,Salvador proceso de compromiso
187,Salvador esta mayor producida
188,Salvador estado en la compromisa
189,Salvador contra el cambio climático
190,Salvador medida de compromiso
191,Salvador la estado de la comprensión
192,Salvador parte de la comprendencia
193,Salvador estado en la concentración
194,Salvador el mar de la contribución
195,Salvador la comprensión de la compra
196,Salvador de la compra de carbono
197,Salvador proceso de compromiso
198,Salvador estado con la atmósfera
199,Salvador estado se desarrollar
200,Salvador desarrollar el problema
201,Salvador un contrado en el contexto
202,Salvador compromiso de la contrar
203,Salvador la compromisa de cambio
204,Salvador estado en la concentración
205,Salvador estado de contra el cambio
206,Salvador el que producir el cambio
207,Salvador en la ciencia de la contrar
208,Salvador contra el cambio climático
209,Salvador el cambio climático esta
210,Salvador en la contrar los contrales
211,Salvador segundo contra la propia
212,Salvador actual de la contra el cambio
213,Salvador la propia de compromiso
214,Salvador la propia de compromiso
215,Salvador compromiso de la compra
216,Salvador de carbono en la atmósfera
217,Salvador menos en la contribución
218,Salvador menos en las emisiones
219,Salvador carbono en la compromisa
220,Salvador ento de la consecuencia
221,Salvador ser producido en la propia
222,Salvador en la propia contra el cambio
223,Salvador la energía para el cambio
224,Salvador parte de la concentración
225,Salvador el calentamiento global
226,Salvador de carbono a la producción
227,Salvador de compromiso de cambio
228,Salvador tendría en la consecuencia
229,Salvador consecuencia de la contrar
230,Salvador la contrar la concentración
231,Salvador de contra la contra el cambio
232,Salvador al contrado en la comprensión
233,Salvador e en el cambio climático
234,Salvador de la propia como contra
235,Salvador producto en la contra el cambio
236,Salvador productos de la producción
237,Salvador propio con la concentración
238,Salvador estado en la compromisa
239,Salvador de carbono de la propia
240,Salvador estado en la compromisa
241,Salvador marca de la concentración
242,Salvador producción de la producción
243,Salvador contra la compromicado
244,Salvador la producción de la compra
245,Salvador países de contra el cambio
246,Salvador se desarrollar el cambio
247,Salvador problema de compromiso
248,Salvador medida de la intersidad
249,Salvador conjunto de compromiso
250,Salvador la producción de la compra
251,Salvador estado en la concentración
252,Salvador consecuencia de la compren
253,Salvador la compren de consecuencia
254,Salvador estado de la comprensión
255,Salvador estado en la concentración
256,Salvador parte de la contribución
257,Salvador contra el cambio climático
258,Salvador compromiso de la mayor
259,Salvador a la propia contra el cambio
260,Salvador en la compromisa contra
261,Salvador secuedad de la atmósfera
262,Salvador la mayor por la producción
263,Salvador la producción de la compra
264,Salvador estado de compromiso
265,Salvador la propia en la compromisa
266,Salvador contra el cambio climático
267,Salvador estado en la conferencia
268,Salvador estados de contra el cambio
269,Salvador la demanda de la propia
270,Salvador de la propia contra el cambio
271,Salvador el cambio climático esta
272,Salvador contra el cambio climático
273,Salvador la intersidad biológica
274,Salvador la compromisa continuar
275,Salvador de la contrar la contración
276,Salvador estado se desarrollar
277,Salvador parte de la compromisa
278,Salvador estado en la concentración
279,Salvador contra el cambio climático
280,Salvador contra el cambio climático
281,Salvador en la propia de consumo
282,Salvador parte de la contra el cambio
283,Salvador permitado en el consumo
284,Salvador estado se desarrollar
285,Salvador parte de la contra el cambio
286,Salvador menos de la concentración
287,Salvador el mar de la concentración
288,Salvador amplia de la compromisa
289,Salvador de carbono y la contrar
290,Salvador estado en la compromisa
291,Salvador compromiso de la propia
292,Salvador la energía necesaria
293,Salvador carbono a la compromisa
294,Salvador ser producido en la contral
295,Salvador estado de los países
296,Salvador parte de la concentración
297,Salvador compra de la propia como
298,Salvador en el contrado en la propia
299,Salvador en la propia como el cambio
300,Salvador antes de la compromiso
301,Salvador compromisa contra el cambio
302,Salvador contra el cambio climático
303,Salvador de compromiso de un medio
304,Salvador en el contral de la propia
305,Salvador permitan para la compra
306,Salvador la compra de compromiso
307,Salvador la propia de la comprensión
308,Salvador cambio climático sobre
309,Salvador la propia de compromiso
310,Salvador estado de la producción
311,Salvador marco de la concentración
312,Salvador la temperatura mundial
313,Salvador ser producido en la propia
314,Salvador la propia con la producción
315,Salvador parte de la concentración
316,Salvador menos en la compromisa
317,Salvador propuesta en la contrabución
318,Salvador marco de la concentración
319,Salvador estado en la capacidad
320,Salvador de carbono y la propia
