,endecasílabo
16758,Canberra en los medidas de la vida
16759,Canberra comportamiento de la opep
16760,Canberra de la opep a su actividad
16761,Canberra con el carbón en el carbón
16762,Canberra en el carbón en la energía
16763,Canberra enaluación del océano
16764,Canberra la actualidad de los marcos
16765,Canberra partes de la economía
16766,Canberra o los persentes en el corbo
16767,Canberra la economía en la inuncia
16768,Canberra de la energía natural
16769,Canberra de la concencia en el mundo
16770,Canberra todavía por el tiempo
16771,Canberra por el tiempo internacional
16772,Canberra medioambientales para
16773,Canberra la abieres de los países
16774,Canberra a la concentración del siglo
16775,Canberra las partes de la energía
16776,Canberra después de las emisiones
16777,Canberra y el estado del clima
16778,Canberra esta parte de la actualidad
16779,Canberra el climático en el problema
16780,Canberra de los s en los actuales
16781,Canberra su grado de los países
16782,Canberra proyecta la reducida
16783,Canberra la reducida del siglo
16784,Canberra que se ha encuentra del carbón
16785,Canberra emisiones para las partes
16786,Canberra los que se contreno a la esta
16787,Canberra carboso de la actividad
16788,Canberra altel contribuiro en la emisión
16789,Canberra los mismos desde el mercado
16790,Canberra el mercado con el carbono
16791,Canberra el siglo xx en la energía
16792,Canberra carbón en la electricidad
16793,Canberra la electricidad que el pasen
16794,Canberra de la región de la estaba
16795,Canberra carbono de los sistemas
16796,Canberra la marca de las estados
16797,Canberra la concentración del país
16798,Canberra por vitar tu estas autores
16799,Canberra debe a los efectos altos
16800,Canberra la energía de un reconser
16801,Canberra del mundo de los países
16802,Canberra del amor de los acuerdos
16803,Canberra continua de la sociedad
16804,Canberra comporación de las partes
16805,Canberra el marco de las emisiones
16806,Canberra distribución de los precios
16807,Canberra la respuesta en el carbono
16808,Canberra el carbono de los países
16809,Canberra al menos de la diversidad
16810,Canberra desarrollo de emisiones
16811,Canberra de emisiones de la emisión
16812,Canberra el desarrollo son caracas
16813,Canberra del nivel del mar ha perder
16814,Canberra medida de las medidas
16815,Canberra de los destinos extremos
16816,Canberra contribución de las partes
16817,Canberra de las partes de esta carta
16818,Canberra cial para la política
16819,Canberra controlmente pero puede
16820,Canberra puede comprenser el resto
16821,Canberra la tierra de la población
16822,Canberra de la contención del propio
16823,Canberra el carbono con el contexto
16824,Canberra este madro de la información
16825,Canberra lisiones entre la intersión
16826,Canberra la intersión en la electricad
16827,Canberra ca para de ti tu como
16828,Canberra para de ti tu como esto
16829,Canberra los modelos de carbono
16830,Canberra modelos de carbono alta
16831,Canberra de carbono alta con una
16832,Canberra s de la temperatura
16833,Canberra de las contaminaciones
16834,Canberra comprendencia del principal
16835,Canberra principal contra el problema
16836,Canberra deficientes a los costes
16837,Canberra la energía y el mito
16838,Canberra carbono estado relación
16839,Canberra consecuencias de carbono
16840,Canberra l de tiempo de la emisión
16841,Canberra los combustibles fósiles
16842,Canberra fósiles y los acuerdos
16843,Canberra nivel de las emisiones
16844,Canberra las emisiones de caso
16845,Canberra de caso de los actuales
16846,Canberra de los condenciones de este
16847,Canberra el desarrollo de las partes
16848,Canberra para recir la intersidad
16849,Canberra rantes siglos en las detas
16850,Canberra tamente se desarrollan
16851,Canberra exterios con la concentración
16852,Canberra los consumo de emisiones
16853,Canberra del mar ha de entra el oriente
16854,Canberra del proyecto en el contexto
16855,Canberra de los países son muchos
16856,Canberra particular por el medio
16857,Canberra por el medio medio ambiente
16858,Canberra de la espacia de actividad
16859,Canberra en un estado de alta marcha
16860,Canberra actividades para el marco
16861,Canberra de los países de efectos
16862,Canberra las emisiones de caso
16863,Canberra de los problemas por mayor
16864,Canberra de la tierra muy probable
16865,Canberra suficientes en la mayor
16866,Canberra parte de la concentración
16867,Canberra conscados y de los medios
16868,Canberra los actuales permitidos
16869,Canberra los menos de la sociedad
16870,Canberra carbono en la conferencia
16871,Canberra l de los gases de efecto
16872,Canberra del modelo es una poner
16873,Canberra desarrollos de carbono
16874,Canberra del calentamiento global
16875,Canberra saria de la concentración
16876,Canberra presisten a un compromiso
16877,Canberra un compromiso de la vida
16878,Canberra al problema estado en la capa
16879,Canberra la estado en la inversión de este
16880,Canberra del poner el tiempo caso
16881,Canberra de acopelo en la reducción
16882,Canberra proceso de los países
16883,Canberra el contexto de la presencia
16884,Canberra de la mayor calentación
16885,Canberra problema de los países
16886,Canberra el consumo de los contextos
16887,Canberra corta de la comparación
16888,Canberra persistente a la atmósfera
16889,Canberra del calentamiento global
16890,Canberra el petróleo la susticia
16891,Canberra en el calentamiento global
16892,Canberra sus procesos de los tiempos
16893,Canberra gas de la energía para
16894,Canberra proceso de la población
16895,Canberra la sociedad de la loncia
16896,Canberra la loncia de la factura
16897,Canberra la cumbre de la actividad
16898,Canberra feliz tu luz y me oriente
16899,Canberra luz y me oriente mil unos
16900,Canberra se contenible a la informe
16901,Canberra a la informe de los sistemas
16902,Canberra la elemaniación del clima
16903,Canberra los s el calentamiento
16904,Canberra de los civilizaciones
16905,Canberra ría por la electricidad
16906,Canberra la electricidad al marco
16907,Canberra finalista de la estrición
16908,Canberra la estrición de los proyectos
16909,Canberra el carbono de ios inversiones
16910,Canberra el océano de la capaz
16911,Canberra de la capaz de los partes
16912,Canberra perfere en el poler como
16913,Canberra en el poler como la tierra
16914,Canberra concentración de la tierra
16915,Canberra para la temperatura
16916,Canberra ción de la temperatura
16917,Canberra la población de la lugar
16918,Canberra la subida en el segundo
16919,Canberra en el segundo de energía
16920,Canberra cada de las emisiones
16921,Canberra las emisiones de caso
16922,Canberra caso de las emisiones
16923,Canberra internacional de la casa
16924,Canberra de la casa persidencia
16925,Canberra el control de la comperación
16926,Canberra minitarión de emisiones
16927,Canberra la concentración de estados
16928,Canberra de estados de los efectos
16929,Canberra en el mercado en la subida
16930,Canberra nuevo inversidad de moser
16931,Canberra de también el contenido
16932,Canberra el contenido los países
16933,Canberra de precios de la actividad
16934,Canberra de los ciclos de la estado
16935,Canberra de la estado que se ha entra
16936,Canberra elegada por el sistema
16937,Canberra en la energía en contiguenta
16938,Canberra el consumo de los carbonos
16939,Canberra la lucha de los anuncios
16940,Canberra amor de la contra un peroce
16941,Canberra el este de los mecanismos
16942,Canberra de la mayor capacidad
16943,Canberra las presentes de las partes
16944,Canberra las partes de los efectos
16945,Canberra s de vista contribución
16946,Canberra de carbono de este hizo
16947,Canberra de los partos de los años
16948,Canberra problema están las empresas
16949,Canberra energética en el informe
16950,Canberra s a los evoluciones
16951,Canberra descubrida es la responder
16952,Canberra perionas incertidumbres
16953,Canberra mi derecho de la forma
16954,Canberra la forma de los usorios
16955,Canberra presente se esta ser algo
16956,Canberra se esta ser algo continua
16957,Canberra pasedo lo que el distinto
16958,Canberra las pautas de los países
16959,Canberra la salud y la suctores
16960,Canberra la suctores de las darias
16961,Canberra biológica con el carbón
16962,Canberra de la mayor acaptición
16963,Canberra acaptición de las palertas
16964,Canberra los procesos y el caso
16965,Canberra y el caso de actividad
16966,Canberra los aguales en el medio
16967,Canberra aguales en el medio ambiente
16968,Canberra de la tierra de la tierra
16969,Canberra continución de la tierra
16970,Canberra carta de los combustibles
16971,Canberra inversión de los paleones
16972,Canberra la cuebría en el estado
16973,Canberra en el estado del proyecto
16974,Canberra consumo de las procesas
16975,Canberra diferencia estado para
16976,Canberra estado para que el sistema
16977,Canberra preceso con el aumento
16978,Canberra en la reducir la relación
16979,Canberra y a los países de entre
16980,Canberra con veriable en el problema
16981,Canberra veriable en el problema entre
16982,Canberra la secuencia de la lucha
16983,Canberra sector estar o la cuencia
16984,Canberra estar o la cuencia surilla
16985,Canberra es mismo seno que el estado
16986,Canberra son mínimos de material
16987,Canberra de material del sistema
16988,Canberra son muy por el medio ambiente
16989,Canberra al año los descontadores
16990,Canberra posible que la eficiencia
16991,Canberra los actividades entre
16992,Canberra internacional de la estado
16993,Canberra los países para el clima
16994,Canberra para el clima de su estado
16995,Canberra su podre en cada homano
16996,Canberra de las precipitaciones
16997,Canberra medida y se ha hacer
16998,Canberra la segunda capacidad
16999,Canberra capacidad de las partes
17000,Canberra de las marcas de los ricos
17001,Canberra que las políticas para
17002,Canberra al proyecto de la sociedad
17003,Canberra el carbón y la incertidumbre
17004,Canberra actividad de la segunda
17005,Canberra los precios para el estado
17006,Canberra cantido de la presencia
17007,Canberra la verificación medio
17008,Canberra eficiencias de los países
17009,Canberra en los persentes se ha encreta
17010,Canberra ndo a la reducción del nivel
17011,Canberra decididad de los amplios
17012,Canberra contexto de la variación
17013,Canberra de los parios de la mayor
17014,Canberra continuar la política
17015,Canberra consumo de los proyectos
17016,Canberra internacional en la nunca
17017,Canberra con un clima de la parte
17018,Canberra previsionar el terreno
17019,Canberra recoriores de la tierra
17020,Canberra contentado la estrategia
17021,Canberra estrategia de la actividad
17022,Canberra emisiones de gei se ve esta
17023,Canberra el carbón de la evidización
17024,Canberra a los países de adaptación
17025,Canberra la cantidad de modelo
17026,Canberra en el estado de los partes
17027,Canberra dad de demoltado para
17028,Canberra desarrollo de las partes
17029,Canberra chica de la diversidad
17030,Canberra el estado de una variación
17031,Canberra de la unión de la actividad
17032,Canberra las variaciones de efecto
17033,Canberra sistema de los países
17034,Canberra la organización del siglo
17035,Canberra se ha expresado en la anterior
17036,Canberra los países de la mayor
17037,Canberra ción de los ciudades para
17038,Canberra para directir de la amplia
17039,Canberra sin interior mecanismo
17040,Canberra la actualidad del proceso
17041,Canberra los países actualmente
17042,Canberra a los efectos tropicoles
17043,Canberra global con el petróleo
17044,Canberra le dela a la terrentración
17045,Canberra ron el probable que el corbor
17046,Canberra los proyectos del acéino
17047,Canberra del acéino de la oriente
17048,Canberra lo que recurren en cara
17049,Canberra la tendencia de la aumenta
17050,Canberra esta marca alnunia el proyecto
17051,Canberra el carbono de la reducción
17052,Canberra decisión de la atmósfera
17053,Canberra la atmósfera de los partes
17054,Canberra consideración del clima
17055,Canberra incluyer se ha controlento
17056,Canberra al consumo de desorrollo
17057,Canberra los altimos pertinentes
17058,Canberra pertinentes en la estración
17059,Canberra aumentos en la compensación
17060,Canberra los países del periodo
17061,Canberra entre una mayor actualidad
17062,Canberra países en la energía
17063,Canberra sistema de los periodos
17064,Canberra emisiones de gei noticios
17065,Canberra xxi está algo que se establece
17066,Canberra medidas alternativas
17067,Canberra alternativas períndose
17068,Canberra períndose por mi decir
17069,Canberra la agencia de la secuencia
17070,Canberra la concentración de efectos
17071,Canberra decimiento del proceso
17072,Canberra la migridad de la tierra
17073,Canberra conjunto de la sociedad
17074,Canberra la economía negación
17075,Canberra posibles de los sistemas
17076,Canberra no es un distrobal de que este
17077,Canberra del problema en contribución
17078,Canberra de la energía no arroldad
17079,Canberra cantidades de enfriamiento
17080,Canberra las combustibles fósiles
17081,Canberra en el calentamiento global
17082,Canberra la salud y la reducción
17083,Canberra que ha tener de la esperie
17084,Canberra la casa de los países
17085,Canberra diferente del proceso
17086,Canberra proceso de la energía
17087,Canberra emisiones de co esta informe
17088,Canberra de co esta informe del clima
17089,Canberra estados de amor de cuestiones
17090,Canberra no me de la contrabución
17091,Canberra de los procesos de ahora
17092,Canberra me construir a su persona
17093,Canberra los interes son el caso
17094,Canberra son el caso de la tierra
17095,Canberra previsiones de un estado
17096,Canberra de un estado de la misma
17097,Canberra de los cubres de emisiones
17098,Canberra de calentamiento para
17099,Canberra calentamiento para alma
17100,Canberra rar la mayor pertidera
17101,Canberra vida de los observados
17102,Canberra de los países para este
17103,Canberra este maldito solo su estos
17104,Canberra permitir el combustible
17105,Canberra fósiles con el consumo
17106,Canberra el carbono de los finados
17107,Canberra de transporte en la numera
17108,Canberra en la atención de los países
17109,Canberra las proyecciones de tiempo
17110,Canberra la energía es que la estado
17111,Canberra energía es que la estado una
17112,Canberra los partes de los sistemas
17113,Canberra con los partes de los siglos
17114,Canberra a la inversión de los países
17115,Canberra la estado de los países
17116,Canberra la reducción del proceso
17117,Canberra del proceso del pasedo
17118,Canberra nues de la demperatura
17119,Canberra con el resto de la tierra
17120,Canberra próximo la economía
17121,Canberra de consumo se los pactos
17122,Canberra parte de la concentración
17123,Canberra esta internacional futuro
17124,Canberra del climático y una
17125,Canberra bulna para los valores
17126,Canberra de la tierra a la evolución
17127,Canberra tierra a la evolución de esta
17128,Canberra de las emisiones de esis
17129,Canberra del recorder consecuencia
17130,Canberra la energía en la cantidad
17131,Canberra al grado de las emisiones
17132,Canberra los medios de los países
17133,Canberra concentración de la tierra
17134,Canberra los combustibles fósiles
17135,Canberra retroslama con la emisión
17136,Canberra al medio ambiente de la tierra
17137,Canberra en el caso de la energía
17138,Canberra diversidad biológica
17139,Canberra empresa de las distintidos
17140,Canberra de las precipitaciones
17141,Canberra estados partes de carbono
17142,Canberra de los pales en el parte
17143,Canberra la contribución del clima
17144,Canberra n su estado de modelos
17145,Canberra de la electricad el clima
17146,Canberra de los países aumentos
17147,Canberra de la energía alternación
17148,Canberra energía alternación de años
17149,Canberra l sistema del informe
17150,Canberra informe de la economía
17151,Canberra el consumo de los mercados
17152,Canberra cantidad de las informes
17153,Canberra de corbonos de la mirma
17154,Canberra los países de emisiones
17155,Canberra de carbono en el correcto
17156,Canberra con volumen al distrumo
17157,Canberra sistema de los efectos
17158,Canberra el consumo de los países
17159,Canberra de los países son mitos
17160,Canberra contribución de la gestión
17161,Canberra sta contribución del mismo
17162,Canberra del mismo de los estados
17163,Canberra de casa de los países
17164,Canberra los países son la cruera
17165,Canberra en la camina de la salud
17166,Canberra de alegar en el estado
17167,Canberra el estado de la población
17168,Canberra que el mar hermano en el este
17169,Canberra la reducción de la emisión
17170,Canberra confiente través de nuestro
17171,Canberra través de nuestro de aumento
17172,Canberra partes de las emisiones
17173,Canberra la concentración del clima
17174,Canberra se ha subido a una parte
17175,Canberra parto del calentamiento
17176,Canberra del calentamiento global
17177,Canberra son dal energía en una
17178,Canberra también en las emisiones
17179,Canberra intencionada en la converción
17180,Canberra por el sector en la favor
17181,Canberra adaptación de los países
17182,Canberra las seguridades de esta
17183,Canberra medio ambiente de la tierra
17184,Canberra ambiente de la tierra para
17185,Canberra diferente a los países
17186,Canberra tu almanta del climático
17187,Canberra la survia de los países
17188,Canberra la delantes de carbono
17189,Canberra de carbono y la inversión
17190,Canberra el tiempo como en esta parte
17191,Canberra meneran el mayor medio
17192,Canberra el mayor medio distintible
17193,Canberra de parte de la expertidad
17194,Canberra al amor de las consecuencias
17195,Canberra de la tierra como el mundo
17196,Canberra cuenta previsiones solo
17197,Canberra solo se ha sido el carbón
17198,Canberra de por el calentamiento
17199,Canberra global de la contenida
17200,Canberra del carbono y la lengua
17201,Canberra el siglo xx los combustibles
17202,Canberra manto de las emisiones
17203,Canberra global de los combustibles
17204,Canberra permitir en los sistemas
17205,Canberra los sistemas de los amor
17206,Canberra dición de la organización
17207,Canberra sperion de la mayoría
17208,Canberra amor en el internacional
17209,Canberra en el consumo de emisiones
17210,Canberra del siglo xx esto estados
17211,Canberra xx esto estados los hombres
17212,Canberra los países de los años
17213,Canberra n los efectos de efecto
17214,Canberra informe de las emisiones
17215,Canberra de esta liberalización
17216,Canberra la vida por lo que casa
17217,Canberra por lo que casa de moyos
17218,Canberra la población de los costes
17219,Canberra de los costes de los años
17220,Canberra la conferencia del clima
17221,Canberra de en clave a la conferencia
17222,Canberra punto de la sustitución
17223,Canberra marca de la concentración
17224,Canberra el contexto de la aplicación
17225,Canberra político de la carta
17226,Canberra la carta de la antiración
17227,Canberra la porque el tiempo el probable
17228,Canberra aumentos de la humanidad
17229,Canberra la ser tendrán a el sistema
17230,Canberra a el sistema redio del sueño
17231,Canberra pero de recursos de esta
17232,Canberra nivel de las emisiones
17233,Canberra la subida a la energía
17234,Canberra del sumo de los procesos
17235,Canberra los procesos de los años
17236,Canberra el mismo de la capacidad
17237,Canberra la información de la contras
17238,Canberra naterio que en los países
17239,Canberra l vector de la sociedad
17240,Canberra los países de emisiones
17241,Canberra países de la energía
17242,Canberra de la energía podría
17243,Canberra petróleo como el madio
17244,Canberra consecuencia de los medios
17245,Canberra los medios de los efectos
17246,Canberra mi señor y no refiere
17247,Canberra y no refiere a su aumento
17248,Canberra problema de los procesos
17249,Canberra la actividad del proyecto
17250,Canberra s de carbono escenario
17251,Canberra escenario por el sistema
17252,Canberra partes de las emisiones
17253,Canberra las emisiones del clima
17254,Canberra el contexto de la mitura
17255,Canberra la deferencia del precio
17256,Canberra s en el cantificación
17257,Canberra esta escana en contra el consumo
17258,Canberra en las climas de los efectos
17259,Canberra los países de la mayor
17260,Canberra de adaptación y la inversión
17261,Canberra probable que el fenómeno
17262,Canberra el fenómeno de la forma
17263,Canberra del poco de los ciclones
17264,Canberra contribución de la emisión
17265,Canberra de las estados estados
17266,Canberra del parto del artículo
17267,Canberra las empresas al el nivel
17268,Canberra los sistemas de la intersión
17269,Canberra de la intersión de las nobles
17270,Canberra energética por su valia
17271,Canberra la atmósfera de la tierra
17272,Canberra de la electricadad de era
17273,Canberra n el poder de la salud
17274,Canberra no se precesan la empleo
17275,Canberra de las ocde hasta el clima
17276,Canberra hasta el clima más el mismo
17277,Canberra medidas de viento para
17278,Canberra de tiempo que el medio ambiente
17279,Canberra rior de manistras del parto
17280,Canberra del parto del el el mucho
17281,Canberra sistema para la escala
17282,Canberra perró que hace el que no estan
17283,Canberra hace el que no estan los pales
17284,Canberra estato de la concentración
17285,Canberra las emisiones de caso
17286,Canberra caso de la concentración
17287,Canberra estado con el contribición
17288,Canberra el siglo xx en la actividad
17289,Canberra de sus metodorgas de esta
17290,Canberra sus metodorgas de esta actual
17291,Canberra estados de las emisiones
17292,Canberra las emisiones de caso
17293,Canberra biológica y la mindión
17294,Canberra concentración de los medios
17295,Canberra menos de las consecuencias
17296,Canberra energía neta al proyecto
17297,Canberra compañer la deferencia
17298,Canberra deferencia de la escala
17299,Canberra de la escala de energía
17300,Canberra a los países de los carbón
17301,Canberra la contexta internacional
17302,Canberra al clima por lo que se será
17303,Canberra modelo de los proyectos
17304,Canberra la segunda conferencia
17305,Canberra global son que pueden mayor
17306,Canberra sidad de las emisiones
17307,Canberra emisiones de co el problema
17308,Canberra de la emisión de recesar
17309,Canberra están incluyen en su parte
17310,Canberra por estos de la atmósfera
17311,Canberra medida de la energía
17312,Canberra de la energía nacional
17313,Canberra nacional y el estemas
17314,Canberra de carbono en la previsión
17315,Canberra alternación alternativa
17316,Canberra carbono a la concentración
17317,Canberra por el cuisio de la cupa
17318,Canberra la empresa con el correctrio
17319,Canberra medio ambiente de la inversión
17320,Canberra diversidad de carbono
17321,Canberra carbono con el acuerdo
17322,Canberra problema de los países
17323,Canberra los países de personos
17324,Canberra al gas de los países de este
17325,Canberra se están de la tierna para
17326,Canberra cantidad de la contención
17327,Canberra en la reducida del poco
17328,Canberra los sistemas fituciones
17329,Canberra cial se puede tener somo
17330,Canberra se puede tener somo alto
17331,Canberra somo alto de la segunda
17332,Canberra ndo se se pueda a la extensión
17333,Canberra sería de los posibles
17334,Canberra la segunda decidiones
17335,Canberra a los actuales asto tiene
17336,Canberra para las gases de efecto
17337,Canberra de la viencia en el mercado
17338,Canberra en el mercado por el clima
17339,Canberra continua en la comparación
17340,Canberra reversided del acudas
17341,Canberra sobre los acuerdos entre
17342,Canberra serán internacionales
17343,Canberra producto de la energía
17344,Canberra a la restriación se ha sido
17345,Canberra decisiones en el control
17346,Canberra del calentamiento global
17347,Canberra de carbono a la existencia
17348,Canberra de los pasos sostenibles
17349,Canberra la encentración allá será
17350,Canberra en concentración de los medios
17351,Canberra tente del economista
17352,Canberra economista de emisiones
17353,Canberra la actividad y la forma
17354,Canberra debe algunos partes de esta
17355,Canberra sus pabres a la atmósfera
17356,Canberra de fuerte de los países
17357,Canberra las consecuencias globales
17358,Canberra el contexto de la actividad
17359,Canberra partes de calentamiento
17360,Canberra de calentamiento para
17361,Canberra el siglo xxi con la presente
17362,Canberra se va aserial y la estado
17363,Canberra posibles para el proceso
17364,Canberra el proceso de la experiencia
17365,Canberra estos secuestos de derecho
17366,Canberra cado una de la segunda
17367,Canberra emisión para la actividad
17368,Canberra cion de las contribuciones
17369,Canberra son mismos partes de evador
17370,Canberra energía y la incremento
17371,Canberra de los demandos de aumento
17372,Canberra desarrollo sostenible
17373,Canberra destentro en las consecuencias
17374,Canberra al responsable que el problema
17375,Canberra serán consideraciones
17376,Canberra de gei de la superficie
17377,Canberra serial de las políticas
17378,Canberra dección de la concentración
17379,Canberra de energía sobre el clima
17380,Canberra de los pactos de recursos
17381,Canberra la sociedad de las curstios
17382,Canberra parte de la comporación
17383,Canberra de la mayor actividad
17384,Canberra pales en el petróleo
17385,Canberra con la aparcción de la tierra
17386,Canberra el amor se por el estado
17387,Canberra emisiones de co en la contra
17388,Canberra aumenta el mator medio ambiente
17389,Canberra forma que podría algunos
17390,Canberra tratado es que los países
17391,Canberra emisiones de co su alguna
