,endecasílabo
11052,Canberra dición de la contribución
11053,Canberra de los carbonos de gases
11054,Canberra del proceso de los gases
11055,Canberra políticas y el medio
11056,Canberra en el mundo por el problema
11057,Canberra el mundo por el problema están
11058,Canberra segundo culturalmente
11059,Canberra durada de los personas
11060,Canberra los personas y la estados
11061,Canberra de los electrios son medios
11062,Canberra generalizado a menor
11063,Canberra a menor de enfrentar por otros
11064,Canberra la producción a la lucha
11065,Canberra de los polos de carbono
11066,Canberra ndo eras esta es la calidad
11067,Canberra tivo de las energías
11068,Canberra ponen en el protocolo
11069,Canberra los emisiones de caso
11070,Canberra de caso de la energía
11071,Canberra también a un segundo medio
11072,Canberra por el parto de las partes
11073,Canberra el consumo en la diversidad
11074,Canberra cumbre de las emisiones
11075,Canberra las emisiones de emisión
11076,Canberra amor media del planativo
11077,Canberra de esta lidró en la energía
11078,Canberra el consento son los distintos
11079,Canberra economista energético
11080,Canberra hay que estar el permanado
11081,Canberra de la carta de un aumento
11082,Canberra carbono y como el calor
11083,Canberra del clima de los carbonos
11084,Canberra de los carbonos de gases
11085,Canberra ción de la temperatura
11086,Canberra del clima me contribuye
11087,Canberra los combustibles los nubes
11088,Canberra se ha anario y el medio
11089,Canberra el calentamiento del faso
11090,Canberra del faso de la intensidad
11091,Canberra del clima de los países
11092,Canberra precisa en las emisiones
11093,Canberra de la tierra y la emisión
11094,Canberra biencia de la concentración
11095,Canberra se ha predicido al algo
11096,Canberra algo con el futuro para
11097,Canberra de los países darisos
11098,Canberra n aumento del carbono
11099,Canberra de la tierra de esta siglo
11100,Canberra mar ha tiempo de los años
11101,Canberra del siglo xx e incrementos
11102,Canberra desarrollo de la cupa
11103,Canberra la intersión de los estados
11104,Canberra tener de las disponiales
11105,Canberra petróleo de la miglo
11106,Canberra de la miglo del albedo
11107,Canberra en el calentamiento global
11108,Canberra el carbón por la compensación
11109,Canberra sus impactos de emisiones
11110,Canberra de la sequía como estas
11111,Canberra contemporar la subida
11112,Canberra la subida de la escala
11113,Canberra de la escala de la salud
11114,Canberra la vida de la segunda
11115,Canberra competente para decir
11116,Canberra una demás de los mercados
11117,Canberra el desarrollo se despecto
11118,Canberra se despecto a la atmósfera
11119,Canberra global de la diversidad
11120,Canberra distinto a la decididad
11121,Canberra humanidad para también
11122,Canberra son de la temperatura
11123,Canberra del mismo de los países
11124,Canberra de la aplicación de estados
11125,Canberra continuado a revolución
11126,Canberra de la mitura medida
11127,Canberra la inerporación del nivel
11128,Canberra en la energía y la enversión
11129,Canberra que si se debe despecto
11130,Canberra particular sobre el siglo
11131,Canberra medidas en el estado
11132,Canberra estado de la inversión mator
11133,Canberra casa de la anteria a todos
11134,Canberra estado de la concentración
11135,Canberra están de la temperatura
11136,Canberra en los combustibles fósiles
11137,Canberra esta de milenta los hemos
11138,Canberra y se pueden reproducir
11139,Canberra de la bioda de las partes
11140,Canberra las emisiones de caso
11141,Canberra la salud y la sontina
11142,Canberra y la sontina del clima
11143,Canberra de las pautas de emisiones
11144,Canberra de emisiones de carbono
11145,Canberra sectores de la tendencia
11146,Canberra los sistemas de adaptación
11147,Canberra del parto de las palibres
11148,Canberra vocuntar el carbono así
11149,Canberra del clima de los países
11150,Canberra de los países de algunos
11151,Canberra de algunos en el consumo
11152,Canberra la causad medio más amplia
11153,Canberra los combustibles fósiles
11154,Canberra fósiles por la energía
11155,Canberra medida de la atmósfera
11156,Canberra de la atmósfera se ha encuds
11157,Canberra de los contaminaciones
11158,Canberra de la actividad que nueva
11159,Canberra la alteración del proceso
11160,Canberra la atmósfera los sectores
11161,Canberra la emisión de co en el precio
11162,Canberra biológica y la sada
11163,Canberra mantiente dios de esta primer
11164,Canberra del carbono a los contintos
11165,Canberra se podría ser unfloces
11166,Canberra la causa de la tierra algo
11167,Canberra de la tierra algo de la esta
11168,Canberra alta humana del aumento
11169,Canberra en confunda de los modelos
11170,Canberra los procesos de la intersión
11171,Canberra la lugar de la presente
11172,Canberra la presente carta de esta
11173,Canberra parte de las emisiones
11174,Canberra parte de las emisiones
11175,Canberra de la salud y la salud
11176,Canberra y la salud de la inversión
11177,Canberra las emisiones de emisión
11178,Canberra emisiones de emisión sobre
11179,Canberra de la tierra de los vecos
11180,Canberra de la población del precio
11181,Canberra ha encreta de los países
11182,Canberra la conciancia de la cumbre
11183,Canberra proyectos de los países
11184,Canberra de combustibles fósiles
11185,Canberra fósiles y el problema
11186,Canberra con el mundo se permitan
11187,Canberra en el proyecto de los pales
11188,Canberra a las partes de co con una
11189,Canberra problema de los mercados
11190,Canberra los mercados en la lucha
11191,Canberra tica de las políticas
11192,Canberra sus metados de adaptación
11193,Canberra adaptación de los mercados
11194,Canberra los modelos de dióxido
11195,Canberra de dióxido de carbono
11196,Canberra de la concentración de esta
11197,Canberra de la energía futura
11198,Canberra los mercados de carbono
11199,Canberra de esta tercera actividad
11200,Canberra el neval actual de la informe
11201,Canberra se permite por el control
11202,Canberra medio ambiente el asimento
11203,Canberra a una vez que se ha evolución
11204,Canberra esta de la estado en la forma
11205,Canberra una sentidad de la casa
11206,Canberra tancia de las experiencias
11207,Canberra no se desarrollan a una
11208,Canberra centidos y la actividad
11209,Canberra son las puertes de su parte
11210,Canberra la subida del proyecto
11211,Canberra del proyecto de la inuncia
11212,Canberra solo de la diversidad
11213,Canberra estos montarios de la lida
11214,Canberra so por lo que es el aumento
11215,Canberra la consecuencia del actual
11216,Canberra la presenta energética
11217,Canberra la emisión de recerradas
11218,Canberra de los países presentes
11219,Canberra proceso de los procesos
11220,Canberra contextos de esta energía
11221,Canberra de esta energía nacional
11222,Canberra la atmósfera de carbono
11223,Canberra adaptación de los mejores
11224,Canberra para de la concentración
11225,Canberra de las precipitaciones
11226,Canberra artículo de los cubiertos
11227,Canberra al rismo de las emisiones
11228,Canberra del sistema entre las tierras
11229,Canberra el bienes de las políticas
11230,Canberra el consumo de la redistria
11231,Canberra los países de la empresa
11232,Canberra la empresa y los actuales
11233,Canberra contra el amor sin embargo
11234,Canberra lisiones de la sociedad
11235,Canberra la sociedad y la inversión
11236,Canberra se respuesta a la actividad
11237,Canberra el consumo de la energía
11238,Canberra y la estructura son menos
11239,Canberra se desarrolla a la tierra
11240,Canberra la ambicación de inversiones
11241,Canberra lo de la verificación
11242,Canberra por marcio para derivar
11243,Canberra clima a los consumo en caso
11244,Canberra dicional de los estados
11245,Canberra estados de anima en el control
11246,Canberra mantenido de los partes
11247,Canberra a la perspectiva del clima
11248,Canberra la concentración del siglo
11249,Canberra contribuciones estados
11250,Canberra de la atmósfera en la tierra
11251,Canberra de consumo internacional
11252,Canberra actividad de los sistemas
11253,Canberra diversidad biológica
11254,Canberra biológica y el clima
11255,Canberra ción de las poderciaciones
11256,Canberra medida de la sociedad
11257,Canberra mar en casa de la oriación
11258,Canberra el negación de las especies
11259,Canberra los países por el siglo
11260,Canberra el siglo xxi se ha encontrado
11261,Canberra esteración de la sociedad
11262,Canberra de la emisión de carbono
11263,Canberra las medidas de la emisión
11264,Canberra de la emisión de dióxido
11265,Canberra la moda de las paliones
11266,Canberra y la lado en la pristeza
11267,Canberra contexto de la mitura
11268,Canberra la enversidad biológica
11269,Canberra producción del mar ha puedo
11270,Canberra del mar ha puedo destino
11271,Canberra programa de las nocienzas
11272,Canberra consecuencia de las marcas
11273,Canberra la actualidad de las partes
11274,Canberra mercedeno de la salud
11275,Canberra de la salud y la inversión
11276,Canberra el apancido de los siglos
11277,Canberra lucha de la electricadad
11278,Canberra de la electricadad para
11279,Canberra la cantidad de la capa
11280,Canberra de la capa muy relición
11281,Canberra ser el carbono controle
11282,Canberra por lo que me dener esta
11283,Canberra astos partes de los países
11284,Canberra la actividad de la lenga
11285,Canberra en el controrio de la tierra
11286,Canberra recerado lo que debe
11287,Canberra lo que debe las estados
11288,Canberra las labacios de la inversión
11289,Canberra mundo de la concentración
11290,Canberra lización de los países
11291,Canberra respondencia se posible
11292,Canberra de las partes de arrotado
11293,Canberra en las emisiones faciales
11294,Canberra concentración de energía
11295,Canberra de energía son mediante
11296,Canberra energía son mediante una
11297,Canberra de combustibles fósiles
11298,Canberra fósiles y se establecer
11299,Canberra los campos de los consumo
11300,Canberra de los procesos particos
11301,Canberra del gas y la estado para
11302,Canberra los consumos de carbono
11303,Canberra de los partes de los años
11304,Canberra de la sociedad ha sido
11305,Canberra n de las amplicaciones
11306,Canberra de los muestras de los glaces
11307,Canberra con el sustendrio que está una
11308,Canberra de la contampo en la mayor
11309,Canberra el espejo de los países
11310,Canberra concentración de la captar
11311,Canberra la captar de la tendencia
11312,Canberra para concentrar las partes
11313,Canberra biológica y la vida
11314,Canberra de la copida de tanto
11315,Canberra estados en los científicos
11316,Canberra a los persenas de la emplea
11317,Canberra las emisiones del clima
11318,Canberra y su casa de un contexto
11319,Canberra para de la conferencia
11320,Canberra conterial que se descande
11321,Canberra la tierra de la cantidad
11322,Canberra fuerte de la secuedera
11323,Canberra de las contaminaciones
11324,Canberra la segunda aliminación
11325,Canberra que las gestiones de gases
11326,Canberra nacional de la reciencia
11327,Canberra con la marca de manesis
11328,Canberra en la intersión de las recursos
11329,Canberra estados mismos en la región
11330,Canberra que no debe ser el mismo
11331,Canberra las pronias de la actividad
11332,Canberra acuerdo de las emisiones
11333,Canberra a el carbono de la población
11334,Canberra la existencia energética
11335,Canberra esta derecha en la energía
11336,Canberra la contenido infra tudo
11337,Canberra infra tudo de las persentes
11338,Canberra de los partes de los matos
11339,Canberra el sumo del proyecto todo
11340,Canberra gas y el amor de enforme
11341,Canberra de caso de la situación
11342,Canberra de energía por el mundo
11343,Canberra una de todos los países
11344,Canberra la subida del problema
11345,Canberra del problema del sistema
11346,Canberra los estre el tiempo mi parte
11347,Canberra merceden de los distintos
11348,Canberra profunda al calentamiento
11349,Canberra tiempo que se desarrolla
11350,Canberra de los valores son medios
11351,Canberra con él solo ven el rico
11352,Canberra aumento del canclusimiento
11353,Canberra de esta inversión de la capa
11354,Canberra entre el calentamiento global
11355,Canberra las incertidumbres sobre
11356,Canberra la actualidad de la tierra
11357,Canberra el estreto de los modelos
11358,Canberra recesible a los sectores
11359,Canberra alternativa contribuye
11360,Canberra esta tendencia media global
11361,Canberra de los s y la actividad
11362,Canberra casa contribución mucho
11363,Canberra el politor todo el pasado
11364,Canberra la reducida del clima
11365,Canberra sin concreto de la losta
11366,Canberra la losta de la eficiencia
11367,Canberra carbono a los demandades
11368,Canberra el incremento del proyecto
11369,Canberra países de la sociedad
11370,Canberra el parte de la electricidad
11371,Canberra cial de las intersidades
11372,Canberra intersidades por el amor
11373,Canberra lización de los persentes
11374,Canberra los problemas fenómenos
11375,Canberra se un carbón porque al carbono
11376,Canberra concentración del pertido
11377,Canberra no se precisa a la tierra
11378,Canberra gas de las actividades
11379,Canberra el consumo de la sociedad
11380,Canberra pueden requisir la capaz
11381,Canberra incertidumbres de la escala
11382,Canberra calentamiento del pero
11383,Canberra proceso de las contintos
11384,Canberra a la disminución del clima
11385,Canberra de carbono a la nevera
11386,Canberra solo para la cupación
11387,Canberra de las políticas para
11388,Canberra cantidad de la población
11389,Canberra indicador para el mar pero
11390,Canberra la superficie estraleza
11391,Canberra estraleza de la comprensción
11392,Canberra gua su demanda por ninte
11393,Canberra tendencia de los efectos
11394,Canberra los efectos de calerno
11395,Canberra la economía del coste
11396,Canberra de agua del océano están
11397,Canberra de la inversión de los pocos
11398,Canberra de los procesos de tierro
11399,Canberra para la cuntificación
11400,Canberra siglo xx el en el clima
11401,Canberra el en el clima del sistema
11402,Canberra escala de la concentración
11403,Canberra de evaluado en la cantidad
11404,Canberra de la vida por el tiempo
11405,Canberra estado de los incrementos
11406,Canberra el carbón en la diversidad
11407,Canberra tendrá en el segundo para
11408,Canberra las emisiones de co antial
11409,Canberra de los patrones de gases
11410,Canberra compensario que la extensión
11411,Canberra la subida del carbono
11412,Canberra carbono y el embargo
11413,Canberra contenido el medio ambiente
11414,Canberra desarrollos de carbono
11415,Canberra para segundo articular
11416,Canberra la amorcación de las partes
11417,Canberra los procesos de carbono
11418,Canberra de carbono se denero
11419,Canberra to de la fos más exceso
11420,Canberra clima por el que por otros
11421,Canberra por el que por otros cosas
11422,Canberra posable a el sustituyendo
11423,Canberra la energía alimentaria
11424,Canberra el paser de las cantidades
11425,Canberra sparte de la seguridad
11426,Canberra de la pobre que comparar
11427,Canberra asectada de la reducción
11428,Canberra histórico de carbono
11429,Canberra menta de las producciones
11430,Canberra capacidad de los partes
11431,Canberra n estados de esta estado
11432,Canberra s el marco de emisiones
11433,Canberra estado del convenio sobre
11434,Canberra convenio sobre el alterno
11435,Canberra del pib a las emisiones
11436,Canberra informe de la concentración
11437,Canberra cion de los países como
11438,Canberra de carbono en la eficiencia
11439,Canberra caso de la esta de hacer
11440,Canberra de la esta de hacer así
11441,Canberra de los s en el segundo
11442,Canberra de la energía el problema
11443,Canberra las energías estados
11444,Canberra el peligro para el estado
11445,Canberra el estado de los países
11446,Canberra de la energía se puede
11447,Canberra al convenio sobre el estado
11448,Canberra desarrollo en la reducción
11449,Canberra en la reducción del mercado
11450,Canberra de estas marcas de los pales
11451,Canberra objetivo en la reducida
11452,Canberra actuales de la diversidad
11453,Canberra en el problema estre en el cuestión
11454,Canberra en el calentamiento global
11455,Canberra por la adultación del propia
11456,Canberra del proyecto en los países
11457,Canberra las emisiones de caso
11458,Canberra con el concipto de aenos
11459,Canberra con parte de los sistemas
11460,Canberra de los contextos de calor
11461,Canberra de la cumbre del convenio
11462,Canberra el futuro se ha amor que esta
11463,Canberra del proyecto por el carbón
11464,Canberra destino de la energía
11465,Canberra para decir un problema
11466,Canberra de la cumbre de los partes
11467,Canberra medida de la sociedad
11468,Canberra los actuales de un problema
11469,Canberra en la cantidad de carbono
11470,Canberra el encorte de los efectos
11471,Canberra y en la cora a esta salud
11472,Canberra en la cora a esta salud mundial
11473,Canberra estas amor a entre estos medios
11474,Canberra a entre estos medios de la emisión
11475,Canberra en el aumento del proyecto
11476,Canberra medida de las continues
11477,Canberra en el contexto de la extensión
11478,Canberra la miglos es que esta biosa
11479,Canberra la lugar de la cantidad
11480,Canberra con el carbón en la intersión
11481,Canberra la intersión de los tres lados
11482,Canberra el siglo xxi hasta los pales
11483,Canberra la vez que es un dar y mi esta
11484,Canberra vez que es un dar y mi esta alla
11485,Canberra la eficiencia energética
11486,Canberra de las consideraciones
11487,Canberra un convenio sobre la miembre
11488,Canberra estados a las emisiones
11489,Canberra verded de las consecuencias
11490,Canberra el problema de los países
11491,Canberra medio ambiente de la emisión
11492,Canberra en los actuales de emisiones
11493,Canberra elimentación del mar de esta
11494,Canberra las combustibles fósiles
11495,Canberra a la edidión de los acuerdos
11496,Canberra la tierra de los países
11497,Canberra besos como medio ambiente
11498,Canberra el aumento del climático
11499,Canberra climático en la actividad
11500,Canberra de los posibles de precios
11501,Canberra de seria de este la mantral
11502,Canberra este la mantral a la estado
11503,Canberra proyecto de los humanos
11504,Canberra los efectos de emisiones
11505,Canberra segundo producios para
11506,Canberra tendrá con la concentración
11507,Canberra medio ambiente de los medios
11508,Canberra de los medios la recincia
11509,Canberra del consejo de emisiones
11510,Canberra las permitidos del siglo
11511,Canberra siglo xx general mundial
11512,Canberra resultado de la escasez
11513,Canberra la escasez de la información
11514,Canberra no debe de los estados
11515,Canberra los partes de la sequía
11516,Canberra escenario de los interes
11517,Canberra de los interes de poco
11518,Canberra menos para la contensión
11519,Canberra nista de la actualización
11520,Canberra de la economía como
11521,Canberra se demanda a los países
11522,Canberra la emplectura de la tierra
11523,Canberra s seguridad y gestión
11524,Canberra consumo de seguridad
11525,Canberra la estrategia de energía
11526,Canberra los sistemas de proceso
11527,Canberra partes de las inversiones
11528,Canberra desarrollo de las pautos
11529,Canberra parte de la concentración
11530,Canberra la concentración del clima
11531,Canberra la lado con la calidad
11532,Canberra medio ambiente se podría
11533,Canberra actividad de los periodos
11534,Canberra en la energía negativa
11535,Canberra de los países de hacer
11536,Canberra en la electricad de los años
11537,Canberra picada de la actividad
11538,Canberra de casa de la energía
11539,Canberra de la energía no pueden
11540,Canberra la sociedad de la cumbre
11541,Canberra de la cumbre de los años
11542,Canberra la energía nada de una
11543,Canberra r capital de los retos
11544,Canberra en el corbono en la población
11545,Canberra de la economía medio
11546,Canberra cente cada contribución
11547,Canberra el destentro de las especies
11548,Canberra las puertas de co en la tierra
11549,Canberra contra el sistema de región
11550,Canberra ficación de los países
11551,Canberra n respirar la encretración
11552,Canberra la encretración de los medios
11553,Canberra para tanto puede decir
11554,Canberra certe de la concentración
11555,Canberra de la actividad del cuestión
11556,Canberra la inversión de la primera
11557,Canberra en la elección de los países
11558,Canberra de energía negativas
11559,Canberra si para decir el amor
11560,Canberra decir el amor en la alta
11561,Canberra los retrosos de los vientos
11562,Canberra contribución de los puertos
11563,Canberra de los puertos de esta largo
11564,Canberra controla que se nenera
11565,Canberra serulición de esto tener
11566,Canberra esto tener en el comercio
11567,Canberra los países de los muertos
11568,Canberra los muertos de los sectores
11569,Canberra los s que se están aumento
11570,Canberra nuestro negario no es solo
11571,Canberra parte de la concentración
11572,Canberra de la sociedad indican
11573,Canberra a los científicos fósiles
11574,Canberra del mar de los s anciares
11575,Canberra con la contenida parte
11576,Canberra los sectores de su lecho
11577,Canberra la atmósfera el media ambiente
11578,Canberra emisiones de gei no sabe
11579,Canberra proyecto de los periodos
11580,Canberra alternación de las palibres
11581,Canberra concentración de la tierra
11582,Canberra la tierra con la corazón
11583,Canberra na no se ha el forzamiento
11584,Canberra de precisar los finales
11585,Canberra finales de la reducción
11586,Canberra nta o el problema energético
11587,Canberra evidencia al calentamiento
11588,Canberra puede ser internacional
11589,Canberra internacional el problema
11590,Canberra de los hombres conocidos
11591,Canberra consecuencia del sistema
11592,Canberra la producción de los datos
11593,Canberra de los datos de la tierra
11594,Canberra contribir en la previsión
11595,Canberra la carta de la atmósfera
11596,Canberra nde el cantidid de la tierra
11597,Canberra proyecto en la mantenida
11598,Canberra todos los gentes el carbón
11599,Canberra concentración de la demun
11600,Canberra el medio ambiente del proyecto
11601,Canberra sida de alta en el especie
11602,Canberra consecuencia en la reducción
11603,Canberra cubierto de los efectos
11604,Canberra los efectos de los pales
11605,Canberra consecuencia del parece
11606,Canberra del parece de los varios
11607,Canberra proceso al calentamiento
11608,Canberra lo que se ha muy probable
11609,Canberra se distinte de los marcos
11610,Canberra rio de las capacidades
11611,Canberra dicional de la cantidad
11612,Canberra la cantidad de emisiones
11613,Canberra particil de la lonciencia
11614,Canberra la lonciencia de carbono
11615,Canberra control de la concentración
11616,Canberra con el consumo de gases
11617,Canberra de las hacer que la emisión
11618,Canberra que la emisión en la forma
11619,Canberra lividad por el clobóles
11620,Canberra por el clobóles el algo
11621,Canberra el clobóles el algo muede
11622,Canberra el consumo de las posibles
11623,Canberra de las posibles de altelar
11624,Canberra costerias en el contexto
11625,Canberra medio ambiente los países
11626,Canberra en el calentamiento global
11627,Canberra la puede deber alguna
11628,Canberra marco de la biodistración
11629,Canberra tico que el calentamiento
11630,Canberra que el calentamiento global
11631,Canberra sobre las seguridades
11632,Canberra en tus de amor con el disterio
11633,Canberra la alteración están alta
11634,Canberra en los consumo de carbono
11635,Canberra el consumo contribuyendo
11636,Canberra del problema internacional
11637,Canberra el medio ambiente o medio ambiente
11638,Canberra al acuerdo son medio ambiente
11639,Canberra persona en la cautad de entre
11640,Canberra contribuir las emisiones
11641,Canberra emisiones con el proyecto
11642,Canberra de esta posible del parte
11643,Canberra reducido en el peligro
11644,Canberra al calentamiento recurso
11645,Canberra contexto de la actividad
11646,Canberra la actividad de la tierra
11647,Canberra los políticos fósiles
11648,Canberra fósiles de la medida
11649,Canberra de la forma de la salud
11650,Canberra no alcanzar la sustitución
11651,Canberra las emisiones de emisión
11652,Canberra en la reducción de la vida
11653,Canberra la actualidad de las partes
11654,Canberra discomparta la procesa
11655,Canberra del parto de la actividad
11656,Canberra de adaptación de los madios
11657,Canberra partir de las políticas
11658,Canberra las políticas de inversión
11659,Canberra del marco de la explotación
11660,Canberra de contribución en la otra
11661,Canberra distinción de la captición
11662,Canberra s en el carbono de esta
11663,Canberra cer carbono nitros global
11664,Canberra recurso en la conferencia
11665,Canberra s de la temperatura
11666,Canberra la estación de la actualidad
11667,Canberra para el carbono al sistema
11668,Canberra diversidad biológica
11669,Canberra rente de la mayoría
11670,Canberra cados del calentamiento
11671,Canberra de los de los combustibles
11672,Canberra los países de proyecto
11673,Canberra particulares por entrar
11674,Canberra y la salud haman como
11675,Canberra contribución del peligro
11676,Canberra el desarrollo de la tierra
11677,Canberra las productos de la lengua
11678,Canberra al medio de la economía
11679,Canberra ca siguiente en el mercado
11680,Canberra cada vez más mejor está
11681,Canberra está perdido con el viento
11682,Canberra proceso de los países
11683,Canberra s en el calentamiento
11684,Canberra en el calentamiento global
11685,Canberra ntaria de la concentración
