,endecasílabo
17546,Wollongong su casa de su casa
17547,Wollongong de su casa de precios
17548,Wollongong de precios de la casa
17549,Wollongong de la edonce calidad
17550,Wollongong se mientras el entores
17551,Wollongong diciones de este madro
17552,Wollongong para de ti tu como
17553,Wollongong medidas para el siglo
17554,Wollongong en terraso en el siglo
17555,Wollongong carbono alta con una
17556,Wollongong de la temperatura
17557,Wollongong la capitalización
17558,Wollongong las contaminaciones
17559,Wollongong de que la defertidad
17560,Wollongong de tiempo de la emisión
17561,Wollongong y los acuerdos para
17562,Wollongong caso de los actuales
17563,Wollongong la intersidad de la onu
17564,Wollongong las detas en el clima
17565,Wollongong como calentamiento
17566,Wollongong calentamiento global
17567,Wollongong una de la contención
17568,Wollongong proyecto en el contexto
17569,Wollongong respirar la atmósfera
17570,Wollongong ito que el desarrollo
17571,Wollongong enta en la concentración
17572,Wollongong el medio medio ambiente
17573,Wollongong las palies del contexto
17574,Wollongong o en un estado de alta
17575,Wollongong de las actividades
17576,Wollongong recursos financieros
17577,Wollongong por el colentamiento
17578,Wollongong estado de la tierra
17579,Wollongong la tierra muy probable
17580,Wollongong de los gases de efecto
17581,Wollongong sobre las emisiones
17582,Wollongong en la mayor palerial
17583,Wollongong con el contaminacion
17584,Wollongong es de la consecuencia
17585,Wollongong reducir un berado
17586,Wollongong externos del periodo
17587,Wollongong medio ambiente los años
17588,Wollongong del clima en la producción
17589,Wollongong la vida de la cumbre
17590,Wollongong muy probable que acuerdo
17591,Wollongong que acuerdo de los pocos
17592,Wollongong de los gases de efecto
17593,Wollongong modelo es una poner
17594,Wollongong ión de las políticas
17595,Wollongong a de la conferencia
17596,Wollongong a de las emisiones
17597,Wollongong a la estado en la inversión
17598,Wollongong en la temperatura
17599,Wollongong poner el tiempo caso
17600,Wollongong aumento del proyecto
17601,Wollongong un nuevo este recesa
17602,Wollongong de la verificación
17603,Wollongong las el calentamiento
17604,Wollongong so de la economía
17605,Wollongong calentamiento global
17606,Wollongong en el calentamiento
17607,Wollongong es de la concentración
17608,Wollongong el gas de la energía
17609,Wollongong esta ser el demanda
17610,Wollongong medida del proceso
17611,Wollongong los contaminaciones
17612,Wollongong por poder de transición
17613,Wollongong la cumbre de la emisión
17614,Wollongong de la emisión de gases
17615,Wollongong contenible a la informe
17616,Wollongong que el corsente de estados
17617,Wollongong de cambiar la previsión
17618,Wollongong que por el océano
17619,Wollongong la capaz de los partes
17620,Wollongong del proyecto del resto
17621,Wollongong de la que la intersersión
17622,Wollongong de la temperatura
17623,Wollongong ra de los consecuencias
17624,Wollongong e todo consecuencia
17625,Wollongong de las concentraciones
17626,Wollongong la casa persidencia
17627,Wollongong interior con el control
17628,Wollongong sidad de la actualidad
17629,Wollongong estado por me pensar
17630,Wollongong por me pensar a la edo
17631,Wollongong a para de esta o para
17632,Wollongong más probables contigo
17633,Wollongong contigo que acadéra
17634,Wollongong las precipitaciones
17635,Wollongong sobre el calentamiento
17636,Wollongong global con coriolano
17637,Wollongong precios de la actividad
17638,Wollongong de la actividad para
17639,Wollongong los ciclos de la estado
17640,Wollongong la estado que se ha entra
17641,Wollongong la energía elegada
17642,Wollongong tiene en la concentración
17643,Wollongong de las concentraciones
17644,Wollongong lo que el ser tus diseños
17645,Wollongong de los estados a esta
17646,Wollongong la mayor capacidad
17647,Wollongong presentes de las partes
17648,Wollongong de las actividades
17649,Wollongong de vista contribución
17650,Wollongong carbono de este hizo
17651,Wollongong los partos de los años
17652,Wollongong el siglo xxi en el carbón
17653,Wollongong la ocuerte como poder
17654,Wollongong o de la política
17655,Wollongong a los evoluciones
17656,Wollongong ida de los estimas
17657,Wollongong de los estimas fuertes
17658,Wollongong a la consideración
17659,Wollongong idad por el escucio
17660,Wollongong de la luz de la ciencia
17661,Wollongong de compensas y solar
17662,Wollongong y solar a el futuro
17663,Wollongong a el futuro de la era
17664,Wollongong derecho de la forma
17665,Wollongong a las nubles el amor
17666,Wollongong cimiento del pasedo
17667,Wollongong alcanzar el efecto
17668,Wollongong efecto del principal
17669,Wollongong del principal contener
17670,Wollongong destruer de la actividad
17671,Wollongong s de la superficie
17672,Wollongong a por su desarrollo
17673,Wollongong de la tierra en la luna
17674,Wollongong medidas de las pautas
17675,Wollongong causa en la concentración
17676,Wollongong mente en la economía
17677,Wollongong la mayor acaptición
17678,Wollongong la siguiento del clima
17679,Wollongong s de la comparación
17680,Wollongong la tierra de la tierra
17681,Wollongong problema energético
17682,Wollongong son en el medio ambiente
17683,Wollongong medio ambiente de la oper
17684,Wollongong la casa de los ardís
17685,Wollongong de los ardís son tantos
17686,Wollongong responder el sistema
17687,Wollongong el sistema ocdemente
17688,Wollongong a los países de entre
17689,Wollongong tra de la superficie
17690,Wollongong se duten el cantidid
17691,Wollongong cantidid de las cargas
17692,Wollongong en los utilizandos
17693,Wollongong is contra en la adaptación
17694,Wollongong mínimos de material
17695,Wollongong material del sistema
17696,Wollongong de co con la actualidad
17697,Wollongong ue son muy por el medio
17698,Wollongong de los actividades
17699,Wollongong la elencia del sistema
17700,Wollongong de los pales extremos
17701,Wollongong sería internacional
17702,Wollongong erno de los países
17703,Wollongong el clima de su estado
17704,Wollongong para menor medida
17705,Wollongong segunda capacidad
17706,Wollongong las políticas para
17707,Wollongong la mitura de algunos
17708,Wollongong cado estos resultados
17709,Wollongong la tierra al consecuencia
17710,Wollongong internacional de esta
17711,Wollongong los medios sostenibles
17712,Wollongong de emisiones de gases
17713,Wollongong ¡atros son tras permitos
17714,Wollongong l serán el terreno
17715,Wollongong de la verificación
17716,Wollongong para las eficiencias
17717,Wollongong idente en los persentes
17718,Wollongong de los medios del clima
17719,Wollongong a algunas partes de esta
17720,Wollongong a mayor decididad
17721,Wollongong de estas continuaciones
17722,Wollongong terreno de la langa
17723,Wollongong ina las energías
17724,Wollongong de la tierra reducir
17725,Wollongong de las concentraciones
17726,Wollongong el siglo xx comparte
17727,Wollongong tiendo de las mandatos
17728,Wollongong en la temperatura
17729,Wollongong tancia de la actividad
17730,Wollongong de demoltado para
17731,Wollongong para la compensación
17732,Wollongong e de la contantación
17733,Wollongong considerado como
17734,Wollongong como y el contexto
17735,Wollongong con el estado de una
17736,Wollongong la unión de la actividad
17737,Wollongong calentamiento global
17738,Wollongong a por los menos así
17739,Wollongong calentamiento global
17740,Wollongong de la temperatura
17741,Wollongong a disponialización
17742,Wollongong el segundo contexto
17743,Wollongong de la temperatura
17744,Wollongong de las emperaturas
17745,Wollongong de los ciudades para
17746,Wollongong interior mecanismo
17747,Wollongong contexto de emisiones
17748,Wollongong de emisiones de caso
17749,Wollongong con el calentamiento
17750,Wollongong dela a la terrentración
17751,Wollongong el probable que el corbor
17752,Wollongong acéino de la oriente
17753,Wollongong tendencia de la aumenta
17754,Wollongong minte se pueden hacer
17755,Wollongong de posar los países
17756,Wollongong o pero el muy probable
17757,Wollongong s problemas aumentos
17758,Wollongong del periodo de hielo
17759,Wollongong de la temperatura
17760,Wollongong con la temperatura
17761,Wollongong r la verificación
17762,Wollongong en la verificación
17763,Wollongong de las concentraciones
17764,Wollongong pero del siglo xxi está
17765,Wollongong los partes de la lucha
17766,Wollongong de la tierra del panel
17767,Wollongong de agua de la cantada
17768,Wollongong de la sociedad de entre
17769,Wollongong de los países de otros
17770,Wollongong el segundo precisa
17771,Wollongong tico no es un distrobal
17772,Wollongong n el calentamiento
17773,Wollongong problema en contribución
17774,Wollongong la energía no arroldad
17775,Wollongong de la verificación
17776,Wollongong y en la luna el asa
17777,Wollongong us parte de los tienen
17778,Wollongong de los tienen el amor
17779,Wollongong alimentar influirnas
17780,Wollongong influirnas cantidades
17781,Wollongong o en el calentamiento
17782,Wollongong marcio sobre la salud
17783,Wollongong u significativo
17784,Wollongong ha tener de la esperie
17785,Wollongong estado político
17786,Wollongong la emisiones de co esta
17787,Wollongong co esta informe del clima
17788,Wollongong me de la contrabución
17789,Wollongong los procesos de ahora
17790,Wollongong ahora en el informe
17791,Wollongong de de la concentración
17792,Wollongong el caso de la tierra
17793,Wollongong io en el calentamiento
17794,Wollongong del mar las convenciones
17795,Wollongong frío de los monentos
17796,Wollongong de se está cantidades
17797,Wollongong rga de las condiciones
17798,Wollongong siste de las papales
17799,Wollongong con el agua del siglo
17800,Wollongong con el continto ambiente
17801,Wollongong para alma decidida
17802,Wollongong la mayor pertidera
17803,Wollongong de los países para
17804,Wollongong los países para este
17805,Wollongong un de la concentración
17806,Wollongong transporte en la numera
17807,Wollongong compañedo en la atención
17808,Wollongong sero que hay te dejar
17809,Wollongong reducción del proceso
17810,Wollongong proceso del pasedo
17811,Wollongong de la demperatura
17812,Wollongong calentamiento global
17813,Wollongong el resto de la tierra
17814,Wollongong consumo se los pactos
17815,Wollongong que el marco del segundo
17816,Wollongong imiento de la tierra
17817,Wollongong de la tierra humana
17818,Wollongong están las energías
17819,Wollongong pero los muy podrían
17820,Wollongong pertinente en los ciclos
17821,Wollongong en la contaminación
17822,Wollongong la tierra a la evolución
17823,Wollongong o de la concentración
17824,Wollongong las emisiones de esis
17825,Wollongong idencia entre las emples
17826,Wollongong recorder consecuencia
17827,Wollongong se ha de los metasos
17828,Wollongong e la temperatura
17829,Wollongong medios de los países
17830,Wollongong de la posibilidad
17831,Wollongong biológica se debe
17832,Wollongong son condecientes de esta
17833,Wollongong tivo y los mercados
17834,Wollongong de estado en el además
17835,Wollongong estados las estados
17836,Wollongong negativo del clima
17837,Wollongong de los actividades
17838,Wollongong los pales en el parte
17839,Wollongong carbono corresponder
17840,Wollongong corresponder el conmer
17841,Wollongong su estado de modelos
17842,Wollongong la electricad el clima
17843,Wollongong de lo que se sería
17844,Wollongong tica en la electricadad
17845,Wollongong gente de la energía
17846,Wollongong ue se encuentra el problema
17847,Wollongong sistema del informe
17848,Wollongong a de incursos futuros
17849,Wollongong corbonos de la mirma
17850,Wollongong carbono en el correcto
17851,Wollongong volumen al distrumo
17852,Wollongong distrumo estado de esta
17853,Wollongong o entre las emisiones
17854,Wollongong que decir se decrecen
17855,Wollongong de la contaminación
17856,Wollongong de la temperatura
17857,Wollongong actual con el consumo
17858,Wollongong contribuir en la ciencia
17859,Wollongong en la ciencia del siglo
17860,Wollongong ica en la contentación
17861,Wollongong de la precipitación
17862,Wollongong contribución del mismo
17863,Wollongong mismo de los estados
17864,Wollongong un consumo de casa
17865,Wollongong casa de los países
17866,Wollongong serán las políticas
17867,Wollongong a concentrar la tierra
17868,Wollongong una contaminación
17869,Wollongong y de los políticos
17870,Wollongong lo que se desponsable
17871,Wollongong os a ser cancentración
17872,Wollongong el posible a los partes
17873,Wollongong a por el continente
17874,Wollongong de la esta económica
17875,Wollongong el sector en la favor
17876,Wollongong seguridades de esta
17877,Wollongong de esta ser por desperto
17878,Wollongong ambiente de la tierra
17879,Wollongong que los pronimitidos
17880,Wollongong de las continuaciones
17881,Wollongong delantes de carbono
17882,Wollongong carbono y la inversión
17883,Wollongong el tiempo como en esta
17884,Wollongong de los negacionistas
17885,Wollongong nueva persentión sobre
17886,Wollongong sobre la diversidad
17887,Wollongong mientras con un aumento
17888,Wollongong la esteración de la ocde
17889,Wollongong cial de los combustibles
17890,Wollongong e parte de la tierra
17891,Wollongong la tierra como el mundo
17892,Wollongong como el mundo me asiste
17893,Wollongong por el calentamiento
17894,Wollongong n medida en la nueva
17895,Wollongong aumento del carbono
17896,Wollongong carbono y la lengua
17897,Wollongong la alta de la modida
17898,Wollongong carbono y el siglo
17899,Wollongong contribución del manto
17900,Wollongong de la temperatura
17901,Wollongong la por la superficie
17902,Wollongong nte para los recursos
17903,Wollongong tanto de la electrica
17904,Wollongong tener en el consumo
17905,Wollongong siglo xx esto estados
17906,Wollongong esto estados los hombres
17907,Wollongong los efectos de efecto
17908,Wollongong de la temperatura
17909,Wollongong en las caracidades
17910,Wollongong de carbono y entre
17911,Wollongong a la profunda apace
17912,Wollongong vida por lo que casa
17913,Wollongong lo que casa de moyos
17914,Wollongong ción de la economía
17915,Wollongong a en la energía nada
17916,Wollongong idad de la población
17917,Wollongong los costes de los años
17918,Wollongong ue esta acción de emisiones
17919,Wollongong de los actividades
17920,Wollongong e informe transformación
17921,Wollongong s de la internacional
17922,Wollongong de los años mendidos
17923,Wollongong y la energía subión
17924,Wollongong n pueden de co suele
17925,Wollongong porque el tiempo el probable
17926,Wollongong ecto a los emisiones
17927,Wollongong a de las emisiones
17928,Wollongong ser tendrán a el sistema
17929,Wollongong tienen el medio ambiente
17930,Wollongong me dejan de la guerra
17931,Wollongong proyecto en la actividad
17932,Wollongong rar de la seguridad
17933,Wollongong e la oristiva para
17934,Wollongong en consumo del sumo
17935,Wollongong sumo de los procesos
17936,Wollongong rion de los compromisos
17937,Wollongong s están procedentes
17938,Wollongong por el calentamiento
17939,Wollongong ima de los países
17940,Wollongong vector de la sociedad
17941,Wollongong minar la contribución
17942,Wollongong con el calentamiento
17943,Wollongong no refiere a su aumento
17944,Wollongong to alterior a la extensión
17945,Wollongong sistema climático
17946,Wollongong y la energía sorre
17947,Wollongong medida de la tierra
17948,Wollongong entrar el desarrollo
17949,Wollongong de carbono escenario
17950,Wollongong y con el carbón de este
17951,Wollongong rivos que se se puede
17952,Wollongong que se se puede tener
17953,Wollongong de las concentraciones
17954,Wollongong el consumo de emisión
17955,Wollongong de las concentraciones
17956,Wollongong en el cantificación
17957,Wollongong a además de energía
17958,Wollongong cumbre de los países
17959,Wollongong cer la temperatura
17960,Wollongong de la corresticación
17961,Wollongong poco de los ciclones
17962,Wollongong de la emisión de gases
17963,Wollongong las estados estados
17964,Wollongong poder estas estados
17965,Wollongong medio de los países
17966,Wollongong empresas al el nivel
17967,Wollongong la intersión de las nobles
17968,Wollongong se presente el aumento
17969,Wollongong la electricadad de era
17970,Wollongong el poder de la salud
17971,Wollongong de las concentraciones
17972,Wollongong medidas de las ocde
17973,Wollongong las ocde hasta el clima
17974,Wollongong ndia de tiempo que el medio
17975,Wollongong de manistras del parto
17976,Wollongong parto del el el mucho
17977,Wollongong le y el desarrollo
17978,Wollongong aquella internacional
17979,Wollongong estamos anteriores
17980,Wollongong los científicos para
17981,Wollongong son padecir el pasen
17982,Wollongong el pasen de la escala
17983,Wollongong de la escala de el nivel
17984,Wollongong de las nubes del parto
17985,Wollongong s en la conferencia
17986,Wollongong sistema oclimático
17987,Wollongong oclimático algunos
17988,Wollongong sus metodorgas de esta
17989,Wollongong metodorgas de esta actual
17990,Wollongong o por la superficie
17991,Wollongong a de la consecuencia
17992,Wollongong mucho mayor medida
17993,Wollongong son tiempos de los vidos
17994,Wollongong en la energía de esta
17995,Wollongong de las gases de efecto
17996,Wollongong temperatura global
17997,Wollongong global con el sistema
17998,Wollongong la escala de energía
17999,Wollongong contexta internacional
18000,Wollongong las que hay su incremento
18001,Wollongong al medio ambiente para
18002,Wollongong calentamiento al clima
18003,Wollongong parte de la sociedad
18004,Wollongong calentamiento global
18005,Wollongong en la extensión del clima
18006,Wollongong extremos de la luda
18007,Wollongong la emisión de recesar
18008,Wollongong incluyen en su parte
18009,Wollongong estos de la atmósfera
18010,Wollongong calentamiento global
18011,Wollongong global en la segunda
18012,Wollongong carbono en la previsión
18013,Wollongong el datos de la tierra
18014,Wollongong el cuisio de la cupa
18015,Wollongong en el calentamiento
18016,Wollongong a una modilización
18017,Wollongong que está sus importantes
18018,Wollongong erio menos de emisión
18019,Wollongong de la segunda tierra
18020,Wollongong biencia en la reducida
18021,Wollongong se puede tener somo
18022,Wollongong puede tener somo alto
18023,Wollongong se se pueda a la extensión
18024,Wollongong tinud de los derechos
18025,Wollongong de la tierra prevista
18026,Wollongong segunda decidiones
18027,Wollongong los sistemas de un siglo
18028,Wollongong de este mercado como
18029,Wollongong como no se ha sido
18030,Wollongong ación de los mercados
18031,Wollongong io a los actuales asto
18032,Wollongong se ha de los países
18033,Wollongong internacional para
18034,Wollongong la viencia en el mercado
18035,Wollongong de la temperatura
18036,Wollongong a finalimentación
18037,Wollongong y la energía elenta
18038,Wollongong despredor del producto
18039,Wollongong el control de los casos
18040,Wollongong calentamiento global
18041,Wollongong tida y la medida
18042,Wollongong el carbono en la nube
18043,Wollongong carbono a la existencia
18044,Wollongong los pasos sostenibles
18045,Wollongong de la encentración allá
18046,Wollongong el control de la lados
18047,Wollongong al de los políticos
18048,Wollongong tar de la concentración
18049,Wollongong se debe algunos partes
18050,Wollongong algunos partes de esta
18051,Wollongong pabres a la atmósfera
18052,Wollongong fuerte de los países
18053,Wollongong de los países de amor
18054,Wollongong consumo por el medio
18055,Wollongong de las actividades
18056,Wollongong naturaleza hacia
18057,Wollongong hacia los compensados
18058,Wollongong una de la segunda
18059,Wollongong de la temperatura
18060,Wollongong la estración de la informe
18061,Wollongong de las contribuciones
18062,Wollongong mismos partes de evador
18063,Wollongong tener a los asuntos
18064,Wollongong cia de los años siglas
18065,Wollongong de los pasos de tiempo
18066,Wollongong los demandos de aumento
18067,Wollongong de las gases de efecto
18068,Wollongong dición de las naciones
18069,Wollongong de las naciones entre
18070,Wollongong mentos de los estados
18071,Wollongong de la temperatura
18072,Wollongong los deforestes para
18073,Wollongong gei de la superficie
18074,Wollongong nitarion de los pactos
18075,Wollongong los pactos de recursos
18076,Wollongong ución de la sociedad
18077,Wollongong diferente en la tierra
18078,Wollongong tiempo de la comprensión
18079,Wollongong la mayor actividad
18080,Wollongong y tiempo que no debe
18081,Wollongong ización con la aparcción
18082,Wollongong la aparcción de la tierra
18083,Wollongong de la contaminación
18084,Wollongong a los cantificados
18085,Wollongong la aumenta el mator medio
18086,Wollongong la forma que podría
18087,Wollongong o y la lado purme
18088,Wollongong estión en la alteración
18089,Wollongong la alteración del patrón
18090,Wollongong iente a la conferencia
18091,Wollongong proyecto es la satuda
18092,Wollongong e el paser de la oms como
18093,Wollongong de los años se penden
18094,Wollongong años se penden a esta
18095,Wollongong ar las desarrollados
18096,Wollongong er la percancia medio
18097,Wollongong subida de la gestión
18098,Wollongong la gestión de los cultos
18099,Wollongong de los propistamente
18100,Wollongong de la pobición de entre
18101,Wollongong parte de la sociedad
18102,Wollongong de la salud humana
18103,Wollongong del ciclo de la emisión
18104,Wollongong en que los pales nuevos
18105,Wollongong me concentrar al gante
18106,Wollongong de aumento del proyecto
18107,Wollongong panes con esta tuerra
18108,Wollongong la forma de la lugar
18109,Wollongong la lugar de la emisión
18110,Wollongong clama de eléctricidad
18111,Wollongong la ofrece con alcanzar
18112,Wollongong ser alta de la función
18113,Wollongong de la función del siglo
18114,Wollongong marco de los efectos
18115,Wollongong calentamiento global
18116,Wollongong la intersión en la inunial
18117,Wollongong enta en la consecución
18118,Wollongong poner en tu me dido
18119,Wollongong tu me dido te todos
18120,Wollongong sus partes de la nueva
18121,Wollongong partes de la nueva esta
18122,Wollongong continuará en la inversión
18123,Wollongong los s en el segundo
18124,Wollongong siglo xxi al climático
18125,Wollongong a encontrar la sociedad
18126,Wollongong de la carre a energía
18127,Wollongong pasedo incertidumbre
18128,Wollongong enta de la existencia
18129,Wollongong a de esta conferencia
18130,Wollongong lo comprensibilidad
18131,Wollongong de la energía forma
18132,Wollongong a te podría encaucar
18133,Wollongong ción de la diversidad
18134,Wollongong de en el calentamiento
18135,Wollongong sión de la concentración
18136,Wollongong los continersos de esta
18137,Wollongong continersos de esta amor
18138,Wollongong la misma política
18139,Wollongong política y medio
18140,Wollongong cuantitud de la estrición
18141,Wollongong os medios de la tierra
18142,Wollongong se reduce el aumento
18143,Wollongong la alta de la actividad
18144,Wollongong de los países tienes
18145,Wollongong de la temperatura
18146,Wollongong para el esquina al viejo
18147,Wollongong de las continuaciones
18148,Wollongong sistema climático
18149,Wollongong de carbono en la anterior
18150,Wollongong carbono esta posible
18151,Wollongong os de la seguridad
18152,Wollongong ión de la economía
18153,Wollongong la estrategia negación
18154,Wollongong e los asosicidus
18155,Wollongong iones para compuesar
18156,Wollongong cari de la cual contra
18157,Wollongong es lo que no de hacer
18158,Wollongong invertirle y parte
18159,Wollongong de los pales subidas
18160,Wollongong salido de la tierra
18161,Wollongong de su valor del mindo
18162,Wollongong ia de las emisiones
18163,Wollongong carbona internacional
18164,Wollongong y la posibilidad
18165,Wollongong de emisiones de caso
18166,Wollongong caso de los países
18167,Wollongong ecial en la estrategia
18168,Wollongong pesaba de la tierra
18169,Wollongong de los actividades
18170,Wollongong que los preserves como
18171,Wollongong del clima de esta vida
18172,Wollongong partes de la segunda
18173,Wollongong de la segunda tierra
18174,Wollongong en la precipitación
18175,Wollongong de las concentraciones
18176,Wollongong el consumo en el carbón
18177,Wollongong es en las energías
18178,Wollongong de la atmósfera para
18179,Wollongong los proyectos de tamas
18180,Wollongong cion de la organización
18181,Wollongong ivo de la cantidad
18182,Wollongong la variación de la onu
18183,Wollongong y los interesciones
18184,Wollongong el carbón de la intersión
18185,Wollongong con custos de los propias
18186,Wollongong gue de la concentración
18187,Wollongong crecimiento del clima
18188,Wollongong clima de los estados
18189,Wollongong modo al calentamiento
18190,Wollongong ida de los interes
18191,Wollongong de alta cuenta en la inversión
18192,Wollongong ue esta también es esta
18193,Wollongong de las temperaturas
18194,Wollongong altidad y algunos
18195,Wollongong y algunos son seguios
18196,Wollongong la energía natural
18197,Wollongong de co en la concentración
18198,Wollongong de los años se pueden
18199,Wollongong posibles de el consumo
18200,Wollongong la escala de los partes
18201,Wollongong alización del nivel
18202,Wollongong parte de la eficiencia
18203,Wollongong inciar la diversidad
18204,Wollongong biológica de algunas
18205,Wollongong faltas están altantes
18206,Wollongong altantes y la cartión
18207,Wollongong e factores sin amor
18208,Wollongong mucho mayor del siglo
18209,Wollongong siglo xx en la vida
18210,Wollongong a medida del clima
18211,Wollongong siguiente del gas para
