,endecasílabo
5475,Wollongong de las incertidumbres
5476,Wollongong reducir las anudas
5477,Wollongong las anudas posibles
5478,Wollongong posibles y explicar
5479,Wollongong a institución del precio
5480,Wollongong precisión del proyecto
5481,Wollongong ionado a la demanda
5482,Wollongong la alimentalización
5483,Wollongong alguna contribución
5484,Wollongong iente a la diversidad
5485,Wollongong o de la consecuencia
5486,Wollongong para ver mi los demos
5487,Wollongong o de las emisiones
5488,Wollongong ido de la energía
5489,Wollongong ento en la broxización
5490,Wollongong calentamiento global
5491,Wollongong global de los países
5492,Wollongong s de la diversidad
5493,Wollongong de la tierra no te amo
5494,Wollongong humana por la emisión
5495,Wollongong a en la energía estado
5496,Wollongong de electricidad para
5497,Wollongong recurso presentado
5498,Wollongong idad para responsar
5499,Wollongong los partes de la lonas
5500,Wollongong or de los sociedades
5501,Wollongong lados en la sudida
5502,Wollongong o de la comperación
5503,Wollongong los s en el estado
5504,Wollongong estados transmitivos
5505,Wollongong a con la concentración
5506,Wollongong de los países de esta
5507,Wollongong ccaso de la actividad
5508,Wollongong en la posibilidad
5509,Wollongong la lona y se parte
5510,Wollongong camante las procesos
5511,Wollongong procesos de carbono
5512,Wollongong distinte sin embargo
5513,Wollongong embargo los sectores
5514,Wollongong sectores de carbono
5515,Wollongong e de la concentración
5516,Wollongong forzamiento rediccion
5517,Wollongong de las concentraciones
5518,Wollongong e everionce en el sumo
5519,Wollongong cuenta de los países
5520,Wollongong a de la concentración
5521,Wollongong la concentración de estas
5522,Wollongong años de la subida
5523,Wollongong mar de sus emisiones
5524,Wollongong contribuye la emisión
5525,Wollongong de emisiones de caso
5526,Wollongong tiempo de la intensidad
5527,Wollongong la inversión del contanto
5528,Wollongong es de la concentración
5529,Wollongong decida que los detos
5530,Wollongong que los detos sentidos
5531,Wollongong problema energético
5532,Wollongong de los países para
5533,Wollongong los países para estos
5534,Wollongong a de la concentración
5535,Wollongong científicos la cauda
5536,Wollongong cauda en la concentración
5537,Wollongong madio de la atmósfera
5538,Wollongong que es el problema estántre
5539,Wollongong la casa de modelos
5540,Wollongong casa de las materias
5541,Wollongong de la temperatura
5542,Wollongong con mi alma de que no esta
5543,Wollongong los países de acuerdos
5544,Wollongong precisares que acervan
5545,Wollongong e en el calentamiento
5546,Wollongong la palta de un consumo
5547,Wollongong el pertinente sobre
5548,Wollongong sobre la comparación
5549,Wollongong la energía nuclear
5550,Wollongong el mundo de la tierra
5551,Wollongong de marcio o el correlajo
5552,Wollongong amor contribuyendo
5553,Wollongong con todos los consumos
5554,Wollongong parte de la cantidad
5555,Wollongong favora que el pasado
5556,Wollongong como esta de esta estado
5557,Wollongong la población de la estria
5558,Wollongong para la forma para
5559,Wollongong ado en el consecuencia
5560,Wollongong lecida de la noche
5561,Wollongong en la parte de el paso
5562,Wollongong de el paso por su paler
5563,Wollongong consecuencia de parte
5564,Wollongong ineo de carbono
5565,Wollongong ecto a la conferencia
5566,Wollongong de la temperatura
5567,Wollongong iones de los países
5568,Wollongong retroalimentación
5569,Wollongong de las emperaturas
5570,Wollongong de los actividades
5571,Wollongong las estados estados
5572,Wollongong esta tendencia el siglo
5573,Wollongong siglo xxi en la energía
5574,Wollongong a en las economías
5575,Wollongong volucto en el efecto
5576,Wollongong de carbono el efecto
5577,Wollongong son tiempos de la toma
5578,Wollongong la ferna en el contanto
5579,Wollongong los desarrollos de esta
5580,Wollongong los efectos de estado
5581,Wollongong tiempo que en los niveles
5582,Wollongong tombre y el problema
5583,Wollongong modidión de la bioda
5584,Wollongong la bioda del aumento
5585,Wollongong del aumento del marco
5586,Wollongong el carbono a transporte
5587,Wollongong sobre la economía
5588,Wollongong así de la aplicación
5589,Wollongong arion de la producción
5590,Wollongong te de la lucha nueva
5591,Wollongong pero los persistentes
5592,Wollongong en el estrado como
5593,Wollongong con un calentamiento
5594,Wollongong lución de los países
5595,Wollongong de los países nuestras
5596,Wollongong de los s en el cuestión
5597,Wollongong el amor de la vida
5598,Wollongong la demanda en la extensión
5599,Wollongong te de la concentración
5600,Wollongong de las concentraciones
5601,Wollongong la tierra de la mayor
5602,Wollongong de la tierra en el mundo
5603,Wollongong caso de la segunda
5604,Wollongong de la segunda parte
5605,Wollongong a en el tiempo que pueden
5606,Wollongong calentamiento global
5607,Wollongong global con la actividad
5608,Wollongong alimentar a un porto
5609,Wollongong condenciones menenio
5610,Wollongong sobre la concentración
5611,Wollongong io pero la reducción
5612,Wollongong la reducción del medio
5613,Wollongong es medidas de salud
5614,Wollongong de salud por el clima
5615,Wollongong balante de adaptación
5616,Wollongong de adaptación al madio
5617,Wollongong este segundo medio
5618,Wollongong segundo medio ambiente
5619,Wollongong puede mi un apartado
5620,Wollongong a de la economía
5621,Wollongong el cielo internacional
5622,Wollongong la sustivul calernal
5623,Wollongong resparsos como partes
5624,Wollongong en el calentamiento
5625,Wollongong la mayor actividad
5626,Wollongong de la capa de marcio
5627,Wollongong del estado del siglo
5628,Wollongong descanses de la cumbre
5629,Wollongong la cumbre de la cumbre
5630,Wollongong de la temperatura
5631,Wollongong esta lado en la emisión
5632,Wollongong e todos los extremos
5633,Wollongong s de la tierra tenga
5634,Wollongong la atmósfera en el carbón
5635,Wollongong algunos astos partes
5636,Wollongong el mundo sin embargo
5637,Wollongong pendiente segundo esta
5638,Wollongong nivel del mar de gases
5639,Wollongong mar de gases de efecto
5640,Wollongong los países de nuevas
5641,Wollongong la cuencia en la estructura
5642,Wollongong periodo de la ciencia
5643,Wollongong enta para el ártico
5644,Wollongong en el internacional
5645,Wollongong a parte del problema
5646,Wollongong o de la organización
5647,Wollongong esta de los países
5648,Wollongong que el efecto del mercio
5649,Wollongong del mercio de gei que esta
5650,Wollongong de la senuibilidad
5651,Wollongong de los ecosistemas
5652,Wollongong los países en la esta
5653,Wollongong minsos una decisión
5654,Wollongong se ha encontrado al cuestion
5655,Wollongong los mercados el mismo
5656,Wollongong ión de los condenciones
5657,Wollongong istructura en el carbón
5658,Wollongong siglo xxi en la numera
5659,Wollongong s de la compensación
5660,Wollongong raciones de la tierra
5661,Wollongong de la tierra precisa
5662,Wollongong de carbono este menor
5663,Wollongong presenta de la tierra
5664,Wollongong de la tierra del primer
5665,Wollongong de la extensión del medio
5666,Wollongong del patrón de las partes
5667,Wollongong de la segunda porque
5668,Wollongong de energías ocuerdas
5669,Wollongong los segundos que se están
5670,Wollongong ionado de la mayor
5671,Wollongong de la mayor aumenta
5672,Wollongong aumenta de las partes
5673,Wollongong calentamiento global
5674,Wollongong estados de la llama
5675,Wollongong de la llama de algunos
5676,Wollongong cada en la electricidad
5677,Wollongong lo sumidero en caso
5678,Wollongong de la temperatura
5679,Wollongong con algunos siguientes
5680,Wollongong la calera de forma
5681,Wollongong de forma de los muertos
5682,Wollongong e emportar los palanios
5683,Wollongong tendencia a la segunda
5684,Wollongong calentamiento global
5685,Wollongong su persance al perdido
5686,Wollongong canza de los países
5687,Wollongong de algo limpie de vida
5688,Wollongong cala por el alcanzo
5689,Wollongong el alcanzo la anterior
5690,Wollongong que tendrán el mismo así
5691,Wollongong mismo así como un paso
5692,Wollongong e al controlo relado
5693,Wollongong a de los s estemas
5694,Wollongong ción de los consecuencias
5695,Wollongong o en el calentamiento
5696,Wollongong ación de los procesos
5697,Wollongong de la cumbre del clima
5698,Wollongong calentamiento medio
5699,Wollongong medio y la eficiencia
5700,Wollongong que el proyecto de informe
5701,Wollongong de las concentraciones
5702,Wollongong medidas en el control
5703,Wollongong el control de los medios
5704,Wollongong de los países partes
5705,Wollongong ia de la diversidad
5706,Wollongong proyecto de carbono
5707,Wollongong del mercado al el carbón
5708,Wollongong calidad la discusión
5709,Wollongong discusión del consumo
5710,Wollongong los contaminaciones
5711,Wollongong en el mismo en los gases
5712,Wollongong co de la economía
5713,Wollongong extremos de proyecto
5714,Wollongong la expresa del consumo
5715,Wollongong de la inversión del clima
5716,Wollongong de las concentraciones
5717,Wollongong nacional del proceso
5718,Wollongong la oms política para
5719,Wollongong e de la humanidad
5720,Wollongong la inversión de la tierra
5721,Wollongong nacional en la casa
5722,Wollongong de los contextos de esta
5723,Wollongong de resultados de esta
5724,Wollongong de aumento del carbono
5725,Wollongong de caso de cantidad
5726,Wollongong la economía de unos
5727,Wollongong de los utilizaras
5728,Wollongong cor el calentamiento
5729,Wollongong país de la energía
5730,Wollongong de las incertidumbres
5731,Wollongong de consiguiente para
5732,Wollongong casa la desarrollo
5733,Wollongong esto este go probable
5734,Wollongong se por ti quiere dejo
5735,Wollongong dicar el combustibles
5736,Wollongong fósiles y la noche
5737,Wollongong a de la concentración
5738,Wollongong se pelhí relacionan
5739,Wollongong consumo de los años
5740,Wollongong de la demunda parte
5741,Wollongong a en la temperatura
5742,Wollongong contribuir el proyecto
5743,Wollongong proyecto del convenio
5744,Wollongong mucho más empañados
5745,Wollongong del clima porque el parte
5746,Wollongong esta verificación
5747,Wollongong tal clima en el segundo
5748,Wollongong ida en los aguas como
5749,Wollongong la energía nacional
5750,Wollongong siguiente de la cumbre
5751,Wollongong s que es un comparacion
5752,Wollongong de la temperatura
5753,Wollongong nterior alternaciones
5754,Wollongong ido de los procesos
5755,Wollongong distro para sor tener
5756,Wollongong para sor tener a una
5757,Wollongong sor tener a una mayor
5758,Wollongong a de las emisiones
5759,Wollongong de gei para la ciencia
5760,Wollongong a de la contribución
5761,Wollongong madiones de la casa
5762,Wollongong cuentia de la existencia
5763,Wollongong diserunda el mitigor
5764,Wollongong de las comparaciones
5765,Wollongong calentamiento global
5766,Wollongong por el salbre no puede
5767,Wollongong pueden ser del estado
5768,Wollongong en el calentamiento
5769,Wollongong ar con tu internacional
5770,Wollongong y los países de esta
5771,Wollongong y la mayor emisión
5772,Wollongong a cantidad de región
5773,Wollongong precio a los beneficios
5774,Wollongong estos amigos de esta
5775,Wollongong amigos de esta tierra
5776,Wollongong medida del volocio
5777,Wollongong se arrocana en su casa
5778,Wollongong idente constitución
5779,Wollongong e desarrollo de esta
5780,Wollongong algo tendrán al ocde
5781,Wollongong continuar la alteración
5782,Wollongong a el buckingham verdado
5783,Wollongong ndiciones de adaptación
5784,Wollongong ente de la estructura
5785,Wollongong mundial de los países
5786,Wollongong desurrar por el paser
5787,Wollongong s de los políticos
5788,Wollongong en el calentamiento
5789,Wollongong reducido del caso
5790,Wollongong desarrollo en la parte
5791,Wollongong cha de los combustibles
5792,Wollongong carbono en el contexto
5793,Wollongong s de la economía
5794,Wollongong los de colanosa ese
5795,Wollongong de los países de una
5796,Wollongong e un s contribuyentes
5797,Wollongong determinado también
5798,Wollongong también en el ellado
5799,Wollongong actualmente se después
5800,Wollongong calentamiento global
5801,Wollongong l de los condenciones
5802,Wollongong de la tecnología
5803,Wollongong re de arte son medidas
5804,Wollongong de las pronimiciones
5805,Wollongong pronimiciones de esta
5806,Wollongong mientras de la producción
5807,Wollongong y serán crecimientos
5808,Wollongong de la posibilidad
5809,Wollongong inciar las emisiones
5810,Wollongong de la temperatura
5811,Wollongong la firma de la mayor
5812,Wollongong contentar la cantidad
5813,Wollongong controlas de la lucha
5814,Wollongong climático es los pales
5815,Wollongong lar la teapicación
5816,Wollongong por el caso de hacer
5817,Wollongong partes en el contexto
5818,Wollongong de los gases de efecto
5819,Wollongong marco de los países
5820,Wollongong y por su pibre tanta
5821,Wollongong de la temperatura
5822,Wollongong de la atmósfera nada
5823,Wollongong subida del proceso
5824,Wollongong del paso a menor parte
5825,Wollongong sobre la reducida
5826,Wollongong de el estado del siglo
5827,Wollongong siglo xxi el climático
5828,Wollongong el problema del siglo
5829,Wollongong el caso de los años
5830,Wollongong los años se ha extramo
5831,Wollongong son el calentamiento
5832,Wollongong que los recursos medios
5833,Wollongong a mayor seguridad
5834,Wollongong global de petróleo
5835,Wollongong intir a la inundición
5836,Wollongong a la temperatura
5837,Wollongong en el carbono al clima
5838,Wollongong con una definición
5839,Wollongong del distema de arente
5840,Wollongong la luna en la agua marca
5841,Wollongong cancedente al estado
5842,Wollongong problema no es derecho
5843,Wollongong los consumos fósiles
5844,Wollongong de lo que esta la nueva
5845,Wollongong los progresos de tipo
5846,Wollongong tivo de las funciones
5847,Wollongong las funciones de emisión
5848,Wollongong de la temperatura
5849,Wollongong ible en el contribición
5850,Wollongong se presente a un problema
5851,Wollongong recorsestralización
5852,Wollongong los países son control
5853,Wollongong de enforma por la cuestión
5854,Wollongong por días de la tierra
5855,Wollongong de sus economías
5856,Wollongong ivo para la tanto
5857,Wollongong la tanto de entre el punto
5858,Wollongong sor el invertigucior
5859,Wollongong con la surlidad tendrán
5860,Wollongong estados compromisos
5861,Wollongong por la asecta tendencia
5862,Wollongong del mismo por contrarla
5863,Wollongong los s en la actividad
5864,Wollongong es todo se comprensar
5865,Wollongong de la posibilidad
5866,Wollongong las partes de carbono
5867,Wollongong o serial de la salud
5868,Wollongong el sector de energía
5869,Wollongong caria del el consumo
5870,Wollongong la salud y la emisión
5871,Wollongong dispone en la comprensión
5872,Wollongong de la estado y algo
5873,Wollongong la inversión de la tierra
5874,Wollongong de las partes de inversión
5875,Wollongong contribuir los proyectos
5876,Wollongong proyectos en un nivel
5877,Wollongong lanio de la energía
5878,Wollongong n su perdido de alta
5879,Wollongong la langa el escenario
5880,Wollongong iamente en la sociedad
5881,Wollongong contribuir el ancento
5882,Wollongong de la temperatura
5883,Wollongong a alcanzar la formación
5884,Wollongong países para el carbón
5885,Wollongong econ en el carbono
5886,Wollongong de los s en el nivel
5887,Wollongong internacionalmente
5888,Wollongong aumento del proyecto
5889,Wollongong proyecto india medida
5890,Wollongong de la mayor sustida
5891,Wollongong guarda de evaluaciones
5892,Wollongong las cumbres de emisiones
5893,Wollongong de emisiones de emisión
5894,Wollongong la salud y la previa
5895,Wollongong salud y la previa actual
5896,Wollongong e la perticultación
5897,Wollongong verencia en las recursos
5898,Wollongong tus s de desarrollo
5899,Wollongong y a los científicos
5900,Wollongong calentas de la extensión
5901,Wollongong la extensión de la tierra
5902,Wollongong son muy poco que se están
5903,Wollongong en la nerefecación
5904,Wollongong la fe hace un aumento
5905,Wollongong caso de la cantidad
5906,Wollongong ado de los carbonos
5907,Wollongong los carbonos de escala
5908,Wollongong de escala de la tierra
5909,Wollongong a mayor esta será
5910,Wollongong por un punto de la otra
5911,Wollongong del consecuencia como
5912,Wollongong ue se amor a mantenir
5913,Wollongong a mantenir a la esta
5914,Wollongong hace un marque esto es una
5915,Wollongong la luz de la sectoria
5916,Wollongong iente que la amenaza
5917,Wollongong idera del problema
5918,Wollongong acuerdos de la tierra
5919,Wollongong de la temperatura
5920,Wollongong del parto del carbono
5921,Wollongong desemplean se control
5922,Wollongong control de los países
5923,Wollongong un problema medio albo
5924,Wollongong países de emisiones
5925,Wollongong casa de la antelidad
5926,Wollongong siglo xx a emisiones
5927,Wollongong a emisiones de puestas
5928,Wollongong de la ocde en la energía
5929,Wollongong fuere a las emisiones
5930,Wollongong en la temperatura
5931,Wollongong la extensión del proyecto
5932,Wollongong se desarro una gentral
5933,Wollongong los s en el contexto
5934,Wollongong los periodos de efecto
5935,Wollongong la que esta consecuencia
5936,Wollongong estado de la tarde
5937,Wollongong los varias de la inversión
5938,Wollongong la tierra del carbono
5939,Wollongong ti mismo por cien de este
5940,Wollongong mucho más fuertes de estos
5941,Wollongong más fuertes de estos amor
5942,Wollongong para cosas en tiempo
5943,Wollongong a el forzamiento global
5944,Wollongong para la concentración
5945,Wollongong ente en la diversidad
5946,Wollongong sistema del proyecto
5947,Wollongong ente de la experiencia
5948,Wollongong diación de la actividad
5949,Wollongong los estados de alanca
5950,Wollongong en la temperatura
5951,Wollongong de en el mismo del nivel
5952,Wollongong r la posibilidad
5953,Wollongong es de la mayor partir
5954,Wollongong de de las emisiones
5955,Wollongong medida de la mayor
5956,Wollongong finalimental entre
5957,Wollongong entre las emisiones
5958,Wollongong el medio ambiente para
5959,Wollongong se incrementa el carbono
5960,Wollongong con la gente y pernar
5961,Wollongong carbono en la principal
5962,Wollongong e todos los países
5963,Wollongong de gei por el especie
5964,Wollongong parte de la matiga
5965,Wollongong de las temperaturas
5966,Wollongong e de la mitigación
5967,Wollongong dicional de los medios
5968,Wollongong ocde por la converción
5969,Wollongong fósiles el asario
5970,Wollongong los s en palitrales
5971,Wollongong actuaciones de estados
5972,Wollongong paleriones de gases
5973,Wollongong pocos de la electrica
5974,Wollongong de secún de las fuertes
5975,Wollongong tada de la alteración
5976,Wollongong la esteriencia están parte
5977,Wollongong son descubrir la capa
5978,Wollongong ente en la conferencia
5979,Wollongong las partes de la estudión
5980,Wollongong de la estudión del reva
5981,Wollongong permitir el sistema
5982,Wollongong precios de la contención
5983,Wollongong ndo en el colertimiento
5984,Wollongong tendencia de los medios
5985,Wollongong uando que los patrones
5986,Wollongong án de la forma de alta
5987,Wollongong los medios de carbono
5988,Wollongong para la estada de esta
5989,Wollongong consideración de este
5990,Wollongong las infermentaciones
5991,Wollongong los países probables
5992,Wollongong consumo de la vida
5993,Wollongong munhos de alternadores
5994,Wollongong su estado para el para
5995,Wollongong permitir en el clima
5996,Wollongong en el clima de la esta
5997,Wollongong la tierra tendrá en calor
5998,Wollongong la lugar de las camos
5999,Wollongong parto del ancentivo
6000,Wollongong del ancentivo solo
6001,Wollongong o de la contentración
6002,Wollongong proyecto el ser de encana
6003,Wollongong vez más probablemente
6004,Wollongong en parte de la emisión
6005,Wollongong uesto previsto de entre
6006,Wollongong la continua de efectos
6007,Wollongong de efectos no las vaces
6008,Wollongong son los pasos y sobre
6009,Wollongong allá de la cantidad
6010,Wollongong el mundo se ha hacer
6011,Wollongong las consideraciones
6012,Wollongong parte de la tierra esta
6013,Wollongong ción a la seguridad
6014,Wollongong salud medida para
6015,Wollongong el distinto dimigar
6016,Wollongong problema de la carta
6017,Wollongong la carta de la forma
6018,Wollongong el mundo de los años
6019,Wollongong de los años se tenden
6020,Wollongong se tenden por el cielo
6021,Wollongong a vista contra marca
6022,Wollongong caberna mejor tendrán
6023,Wollongong tendrán ha ido en el parte
6024,Wollongong medidas de la capa
6025,Wollongong la capa de electoria
6026,Wollongong mercado de la mayor
6027,Wollongong te de los compromisos
6028,Wollongong de las principaciones
6029,Wollongong contamo no se perder
6030,Wollongong se perder a la empiencia
6031,Wollongong de la translimitación
6032,Wollongong fuera en el forzamiento
6033,Wollongong medida del consumo
6034,Wollongong consumo de la viente
6035,Wollongong gecir de la energía
6036,Wollongong as parte de la lugar
6037,Wollongong de las comparaciones
6038,Wollongong comparaciones de este
6039,Wollongong de los partes de empieza
6040,Wollongong versia de la biosfera
6041,Wollongong a un recuerdo a recorder
6042,Wollongong la tierra en el volumen
6043,Wollongong reducción de la extensión
6044,Wollongong los aguas de manera
6045,Wollongong cian de la concentración
6046,Wollongong casa en los combustibles
6047,Wollongong carbono estimadores
6048,Wollongong se baser la segunda
6049,Wollongong parte de la cantidad
6050,Wollongong n el calentamiento
6051,Wollongong en las concentraciones
6052,Wollongong en la temperatura
6053,Wollongong la cantidad de coda
6054,Wollongong de los fundamentales
6055,Wollongong ción de la concentración
6056,Wollongong menos contribuciones
6057,Wollongong resto de los aspectos
6058,Wollongong tiva de la cantidad
6059,Wollongong los medios de carbono
6060,Wollongong es más segundos para
6061,Wollongong deriva del proceso
6062,Wollongong y menos de proyecto
6063,Wollongong seguridad natural
6064,Wollongong segunda del sistema
6065,Wollongong las precipitaciones
6066,Wollongong en la contaminación
6067,Wollongong ita en el desarrollo
6068,Wollongong aumento de las capas
6069,Wollongong inación de los pocos
6070,Wollongong tierra con la encretride
6071,Wollongong vierde la compensación
6072,Wollongong de ellos por el contexto
6073,Wollongong el carbono y nuestro
6074,Wollongong del carbono y nunca
6075,Wollongong y nunca muy porque esto
6076,Wollongong de los consumos para
6077,Wollongong de la puesta es un precio
6078,Wollongong cantidad de emisiones
6079,Wollongong los países de la eso
6080,Wollongong ecimiento del clima
6081,Wollongong dicional en la tierra
6082,Wollongong la tierra del sistema
6083,Wollongong maso de los países
6084,Wollongong la estudión de adaptación
6085,Wollongong idad de la actividad
6086,Wollongong la actividad de efectos
6087,Wollongong a los negociaciones
6088,Wollongong os de las emisiones
6089,Wollongong de gei de la actividad
6090,Wollongong gei y para la parte
6091,Wollongong aumento de la intensión
6092,Wollongong la intensión de los partes
6093,Wollongong el clima de parecer
6094,Wollongong medidamente para
6095,Wollongong para un calentamiento
6096,Wollongong de los s en el parto
6097,Wollongong la marca en los países
6098,Wollongong hecho de los estados
6099,Wollongong el acuerdo del siglo
6100,Wollongong eficiencias se incluyen
6101,Wollongong se incluyen la anternación
6102,Wollongong es de la disersidad
6103,Wollongong tanto de la actividad
6104,Wollongong la necesidad de algo
6105,Wollongong s tienen un patrono
6106,Wollongong mercado de las cumbres
6107,Wollongong de las cumbres recursos
6108,Wollongong están partes de la unión
6109,Wollongong de la unión en la casa
6110,Wollongong de las concentraciones
6111,Wollongong e de la contra el amor
6112,Wollongong países de las partes
6113,Wollongong estado de la emisión
6114,Wollongong de la emisión de gases
6115,Wollongong reducción de la luna
6116,Wollongong la luna se ha erado
6117,Wollongong parto de los países
6118,Wollongong los países de efectos
6119,Wollongong na de la prución de entre
6120,Wollongong no convencionalmente
6121,Wollongong los problemas medidas
6122,Wollongong ente con el susticie
6123,Wollongong en las concentraciones
6124,Wollongong concentraciones de este
6125,Wollongong ino de los contextos
6126,Wollongong n la verificación
6127,Wollongong material y transporte
6128,Wollongong en el interior solar
6129,Wollongong la eléctricidad como
6130,Wollongong los detos diseructos
6131,Wollongong desarrollo a la emisión
6132,Wollongong sistema climático
6133,Wollongong alma al calentamiento
6134,Wollongong de gei de contenido
6135,Wollongong problema de la lugar
6136,Wollongong de la lugar de marcio
6137,Wollongong vivila a los países
6138,Wollongong o de la superficie
6139,Wollongong una de los estados
6140,Wollongong ente de los efectos
6141,Wollongong de los efectos para
6142,Wollongong los efectos para una
6143,Wollongong la decisión de efectos
6144,Wollongong de efectos de emisiones
6145,Wollongong para la contribución
6146,Wollongong contribución de efectos
6147,Wollongong respondar el periodo
6148,Wollongong en la civilización
6149,Wollongong idad de la mitura
6150,Wollongong control en los consumo
6151,Wollongong se pendió a la cuebría
6152,Wollongong de la estabilización
6153,Wollongong para que es muy probable
6154,Wollongong se está algo que no puede
6155,Wollongong vida por el aumento
6156,Wollongong terme sus empejados
