,endecasílabo
11569,Wollongong de estados de energía
11570,Wollongong de la temperatura
11571,Wollongong la energía nacional
11572,Wollongong intervalionarionad
11573,Wollongong de la cuantificación
11574,Wollongong o son muchos estados
11575,Wollongong verdad a la sutfera
11576,Wollongong a la sutfera para
11577,Wollongong idad de la sociedad
11578,Wollongong muede de las productos
11579,Wollongong ica a la humanidad
11580,Wollongong usión de los países
11581,Wollongong iones de los países
11582,Wollongong todos los océanos
11583,Wollongong con el clima en la vida
11584,Wollongong ente en el medio ambiente
11585,Wollongong de la temperatura
11586,Wollongong s en la concentración
11587,Wollongong a de la soberación
11588,Wollongong tencia de la comprensión
11589,Wollongong la vez más veriaría
11590,Wollongong de la estructura de este
11591,Wollongong con las concentraciones
11592,Wollongong los medios releriones
11593,Wollongong o de la tierra porque
11594,Wollongong y un calentamiento
11595,Wollongong ti pero no es a abuele
11596,Wollongong las recursos de efecto
11597,Wollongong igual como se ponen
11598,Wollongong como se ponen porque
11599,Wollongong ponen porque esta seras
11600,Wollongong des de la concentración
11601,Wollongong la tierra se ha sido
11602,Wollongong de asos actividades
11603,Wollongong emisiones de gases
11604,Wollongong n de la humanidad
11605,Wollongong ribuir al carbón de estar
11606,Wollongong la subera medida
11607,Wollongong medida del procudio
11608,Wollongong procudio del proyecto
11609,Wollongong de las expertas de este
11610,Wollongong sería fuera para
11611,Wollongong fuera para descensar
11612,Wollongong descensar el estado
11613,Wollongong a la lugar de marcio
11614,Wollongong medio medio vel nicel
11615,Wollongong vel nicel del problema
11616,Wollongong calentamiento global
11617,Wollongong de las actividades
11618,Wollongong s generalizadas
11619,Wollongong a la mayor estado
11620,Wollongong la mayor estado algo
11621,Wollongong la energía ha sido
11622,Wollongong aumento del conflicto
11623,Wollongong del conflicto del medio
11624,Wollongong para el mar has decidión
11625,Wollongong el consumo de gases
11626,Wollongong son mismos de la emisión
11627,Wollongong de la emisión de esistes
11628,Wollongong un planto de la informe
11629,Wollongong vica a la capacidad
11630,Wollongong esperar la información
11631,Wollongong contribución del clima
11632,Wollongong de calor del periodo
11633,Wollongong al que la concentración
11634,Wollongong la cantidad de tiempo
11635,Wollongong de las partes de efecto
11636,Wollongong de las concentraciones
11637,Wollongong mundial del climático
11638,Wollongong inción de la energía
11639,Wollongong de los países como
11640,Wollongong se ha amor del modelo
11641,Wollongong la reducir la salud
11642,Wollongong que se destenuan contor
11643,Wollongong de energía no es una
11644,Wollongong la perscisión estados
11645,Wollongong umentar que los gases
11646,Wollongong desarrollan la tierra
11647,Wollongong la tierra de los medios
11648,Wollongong de la entre el forzamiento
11649,Wollongong posible que el efecto
11650,Wollongong contexto de las cubies
11651,Wollongong de las cubies los partes
11652,Wollongong contribuir las procesos
11653,Wollongong de este energía porque
11654,Wollongong el mundo de la succión
11655,Wollongong de la succión del clima
11656,Wollongong carbono a los países
11657,Wollongong de la empresa al proyecto
11658,Wollongong identica es un alta
11659,Wollongong se persena el aumento
11660,Wollongong s en los combustibles
11661,Wollongong fósiles buscando a ello
11662,Wollongong sivo en la necesidad
11663,Wollongong problema en las medidas
11664,Wollongong aumento del madeo
11665,Wollongong con recomencidades
11666,Wollongong como la recuctura
11667,Wollongong ento de la subida
11668,Wollongong carbono es algo alcanzar
11669,Wollongong contribución del calor
11670,Wollongong sanor en el carbono
11671,Wollongong el carbono y nuestro
11672,Wollongong de los corresponderán
11673,Wollongong a la estema tus formas
11674,Wollongong os o pertinente así
11675,Wollongong en la tierra con una
11676,Wollongong de los s en el carbón
11677,Wollongong estás de la actividad
11678,Wollongong tratado de los años
11679,Wollongong por de los importantes
11680,Wollongong del clima de la parte
11681,Wollongong salud y al consejo
11682,Wollongong se reducir la presión
11683,Wollongong es de la concentración
11684,Wollongong proceso de los gases
11685,Wollongong y de la concentración
11686,Wollongong de carbono en los nubes
11687,Wollongong en el calentamiento
11688,Wollongong de la afecta incernacion
11689,Wollongong a las marcas proyectas
11690,Wollongong ios de algo más destiundo
11691,Wollongong en el propio destituir
11692,Wollongong en el corbo en la casa
11693,Wollongong corbo en la casa de esta
11694,Wollongong idad de la actividad
11695,Wollongong e de su mantitución
11696,Wollongong el cumbre de medidas
11697,Wollongong los electrios son medios
11698,Wollongong a un poco de la vida
11699,Wollongong e tanto de la emisión
11700,Wollongong sentida a la producción
11701,Wollongong principal establecir
11702,Wollongong tida en la contribución
11703,Wollongong s de un buen esto que amor
11704,Wollongong gas de los pides de agua
11705,Wollongong los polos de carbono
11706,Wollongong que en la temperatura
11707,Wollongong interior con el curbo
11708,Wollongong limación de los posos
11709,Wollongong los posos sin embargo
11710,Wollongong caso de la sociedad
11711,Wollongong emisiones de caso
11712,Wollongong caso de la energía
11713,Wollongong interescimaciones
11714,Wollongong a de las cantidades
11715,Wollongong a soy por el consumo
11716,Wollongong on allá diferente
11717,Wollongong diferente hay que estar
11718,Wollongong que estar el permanado
11719,Wollongong nuclear de la carta
11720,Wollongong la carta de un aumento
11721,Wollongong alizar el proceso
11722,Wollongong er de la organización
11723,Wollongong dicional del carbono
11724,Wollongong las consideraciones
11725,Wollongong la presente del clima
11726,Wollongong clima de los carbonos
11727,Wollongong los carbonos de gases
11728,Wollongong de la temperatura
11729,Wollongong a contribución mundial
11730,Wollongong mundial de la reducción
11731,Wollongong ado de la respuesta
11732,Wollongong de la respuesta también
11733,Wollongong clima me contribuye
11734,Wollongong combustibles los nubes
11735,Wollongong ha anario y el medio
11736,Wollongong por el calentamiento
11737,Wollongong faso de la intensidad
11738,Wollongong clima de los países
11739,Wollongong rio de las deficientes
11740,Wollongong del piso de la tierra
11741,Wollongong la tierra y la emisión
11742,Wollongong parte de los países
11743,Wollongong iante de la subida
11744,Wollongong los países darisos
11745,Wollongong darisos en la carte
11746,Wollongong la carte de emisiones
11747,Wollongong aumento del carbono
11748,Wollongong la tierra de esta siglo
11749,Wollongong de este tie en la europea
11750,Wollongong el aumento del siglo
11751,Wollongong siglo xx e incrementos
11752,Wollongong idad de la secuencia
11753,Wollongong se demanda en el medio
11754,Wollongong la miglo del albedo
11755,Wollongong e esta de nuestro poder
11756,Wollongong caso mas disponible
11757,Wollongong en el calentamiento
11758,Wollongong de la ocde con el marco
11759,Wollongong la estructura en el medio
11760,Wollongong impactos de emisiones
11761,Wollongong de la sequía como
11762,Wollongong la sequía como estas
11763,Wollongong subida de la escala
11764,Wollongong la escala de la salud
11765,Wollongong contenida en la salud
11766,Wollongong ro de la concentración
11767,Wollongong puede contra una demás
11768,Wollongong en el agua el consumo
11769,Wollongong despecto a la atmósfera
11770,Wollongong ir el calentamiento
11771,Wollongong la humanidad para
11772,Wollongong mismo de los países
11773,Wollongong de un posto de la salud
11774,Wollongong de la temperatura
11775,Wollongong la aplicación de estados
11776,Wollongong que la alta comparación
11777,Wollongong ente en la diversidad
11778,Wollongong como la economía
11779,Wollongong e en el carbón estado
11780,Wollongong de los años modelos
11781,Wollongong n de la capacidad
11782,Wollongong la mitura medida
11783,Wollongong ue con la estrategia esta
11784,Wollongong idera al crecimiento
11785,Wollongong e contribuir los partes
11786,Wollongong los partes de emisiones
11787,Wollongong de emisiones de caso
11788,Wollongong agua y el problema
11789,Wollongong si se debe despecto
11790,Wollongong ente del clima parte
11791,Wollongong ra alera que incremento
11792,Wollongong estado por el clima
11793,Wollongong sos partes de su pora
11794,Wollongong mis de estas de los mercos
11795,Wollongong e una vitalización
11796,Wollongong encia en los combustibles
11797,Wollongong combustible fósiles
11798,Wollongong son medios de los medios
11799,Wollongong entivo y se pueden
11800,Wollongong la bioda de las partes
11801,Wollongong dición de la sociedad
11802,Wollongong las pautas de emisiones
11803,Wollongong de las tamperaturas
11804,Wollongong s de la comperación
11805,Wollongong parto de las palibres
11806,Wollongong vocuntar el carbono
11807,Wollongong carbono así son la esta
11808,Wollongong la estado de la virta
11809,Wollongong de carbono al contexto
11810,Wollongong muy podría del clima
11811,Wollongong clima de los países
11812,Wollongong a de las políticas
11813,Wollongong final de la subida
11814,Wollongong ectencia de la lugar
11815,Wollongong de la lugar los muestras
11816,Wollongong a de los pertinentes
11817,Wollongong de las concentraciones
11818,Wollongong del problema del patrón
11819,Wollongong los países de algunos
11820,Wollongong ocupental para estas
11821,Wollongong verificar la causad
11822,Wollongong causad medio más amplia
11823,Wollongong de las pronimicadas
11824,Wollongong la solicificación
11825,Wollongong combustibles fósiles
11826,Wollongong la atmósfera se ha encuds
11827,Wollongong co de la diversidad
11828,Wollongong e en las concentraciones
11829,Wollongong problema en la energía
11830,Wollongong la energía en el siglo
11831,Wollongong en el calentamiento
11832,Wollongong de la emisión de inversión
11833,Wollongong ra mantiente dios de esta
11834,Wollongong dios de esta primer parte
11835,Wollongong carbono a los contintos
11836,Wollongong ra la cuerpa general
11837,Wollongong de emisiones de gases
11838,Wollongong la causa de la tierra
11839,Wollongong causa de la tierra algo
11840,Wollongong la tierra algo de la esta
11841,Wollongong aumento de las partes
11842,Wollongong son menimizaciones
11843,Wollongong o es el control de la orma
11844,Wollongong n el calentamiento
11845,Wollongong la energía nuclear
11846,Wollongong pator de la actividad
11847,Wollongong la salud y la salud
11848,Wollongong la salud de la inversión
11849,Wollongong la tierra de los vecos
11850,Wollongong alo contribuyente
11851,Wollongong la población del precio
11852,Wollongong en la temperatura
11853,Wollongong ralo de la conciancia
11854,Wollongong combustibles fósiles
11855,Wollongong el mundo de la emisión
11856,Wollongong de la emisión de gases
11857,Wollongong del gruado es un consumo
11858,Wollongong ential de los sistemas
11859,Wollongong idad de los estados
11860,Wollongong contaminacion mayor
11861,Wollongong a respecto a las partes
11862,Wollongong la inversión de carbono
11863,Wollongong cambia de la actividad
11864,Wollongong la concentración de esta
11865,Wollongong y por el escenario
11866,Wollongong nivel de la energía
11867,Wollongong con un coternamiento
11868,Wollongong e informe de los mundos
11869,Wollongong mercados de carbono
11870,Wollongong de los intervaránes
11871,Wollongong para la contribución
11872,Wollongong lo que esta alcanza la alta
11873,Wollongong con el medio habría
11874,Wollongong para esta de la mayor
11875,Wollongong sentidad de la casa
11876,Wollongong aumento del programa
11877,Wollongong se desarrollan a una
11878,Wollongong calentamiento global
11879,Wollongong ir global son las puertes
11880,Wollongong las puertes de su parte
11881,Wollongong proyecto de la inuncia
11882,Wollongong contra la diversidad
11883,Wollongong en la temperatura
11884,Wollongong por lo que es el aumento
11885,Wollongong de la temperatura
11886,Wollongong dificultades para
11887,Wollongong del actual son modelos
11888,Wollongong presenta energética
11889,Wollongong la agua de la actualidad
11890,Wollongong problema de consumo
11891,Wollongong marcio de los medidas
11892,Wollongong los países presentes
11893,Wollongong de los gases de efecto
11894,Wollongong para encipitucionas
11895,Wollongong e de las políticas
11896,Wollongong acusar de adaptación
11897,Wollongong de la tierra nacional
11898,Wollongong ente de la segunda
11899,Wollongong las precipitaciones
11900,Wollongong dición de la subida
11901,Wollongong nidera muerte al rismo
11902,Wollongong tra como se ha sido
11903,Wollongong imiento del sistema
11904,Wollongong sistema entre las tierras
11905,Wollongong que la energía para
11906,Wollongong recido en la atmósfera
11907,Wollongong desarrollados de acción
11908,Wollongong e de la concentración
11909,Wollongong biológica y la otra
11910,Wollongong menos de los transportes
11911,Wollongong medios de la matada
11912,Wollongong nte estados intersectos
11913,Wollongong cial de las cantidades
11914,Wollongong de las actividades
11915,Wollongong border con tu señor!
11916,Wollongong con tu señor! tengo
11917,Wollongong de la verificación
11918,Wollongong por la temperatura
11919,Wollongong la mayor elementa
11920,Wollongong ión de la forma parte
11921,Wollongong e a la temperatura
11922,Wollongong para derivar a una
11923,Wollongong derivar a una mayor
11924,Wollongong pertido en la energía
11925,Wollongong de la temperatura
11926,Wollongong ente de los países
11927,Wollongong en el calentamiento
11928,Wollongong medidas reelezas
11929,Wollongong e para la subida
11930,Wollongong la subida del siglo
11931,Wollongong de las incertidumbres
11932,Wollongong consumo internacional
11933,Wollongong la estrategia del uso
11934,Wollongong gual de la seguridad
11935,Wollongong medidas de actividad
11936,Wollongong carbono de la poiertia
11937,Wollongong de la poiertia de tiempo
11938,Wollongong de las poderciaciones
11939,Wollongong nivel del mar en casa
11940,Wollongong en casa de la oriación
11941,Wollongong del futuro en la intersión
11942,Wollongong es de la organización
11943,Wollongong de alta en la actualización
11944,Wollongong países por el siglo
11945,Wollongong nte de la concentración
11946,Wollongong de la temperatura
11947,Wollongong la emisión de carbono
11948,Wollongong cambiar en las medidas
11949,Wollongong la de los diferentes
11950,Wollongong de la temperatura
11951,Wollongong la lado en la pristeza
11952,Wollongong consumo de carbono
11953,Wollongong la inversión de los pasos
11954,Wollongong a se estaban del pargo
11955,Wollongong carbón de la población
11956,Wollongong la salud y la inversión
11957,Wollongong umbra de la sociedad
11958,Wollongong ante de la cantidad
11959,Wollongong lización de la casa
11960,Wollongong e la determinación
11961,Wollongong en las concentraciones
11962,Wollongong lo que me dener esta
11963,Wollongong disponible astos partes
11964,Wollongong calentamiento global
11965,Wollongong de consumo precisar
11966,Wollongong e se contaminante
11967,Wollongong e de la comparación
11968,Wollongong que debe las estados
11969,Wollongong n esta de ser parte
11970,Wollongong labacios de la inversión
11971,Wollongong de los países partes
11972,Wollongong con el colaborado
11973,Wollongong de la energía se esta
11974,Wollongong e las estados así
11975,Wollongong ida de los procesos
11976,Wollongong gas y la estado para
11977,Wollongong u probable que es mayor
11978,Wollongong con respuesta a los hombres
11979,Wollongong e mantenir los puchos
11980,Wollongong del clima en los países
11981,Wollongong para la mayoría
11982,Wollongong de los dos desarrollos
11983,Wollongong obre posible este una
11984,Wollongong los partes de los años
11985,Wollongong la sociedad ha sido
11986,Wollongong de las amplicaciones
11987,Wollongong los muestras de los glaces
11988,Wollongong con el sustendrio que está
11989,Wollongong el sustendrio que está una
11990,Wollongong la contampo en la mayor
11991,Wollongong las partes de carbono
11992,Wollongong la copida de tanto
11993,Wollongong ivo para recorder
11994,Wollongong su casa de un contexto
11995,Wollongong calentamiento global
11996,Wollongong de lo que la actividad
11997,Wollongong e la temperatura
11998,Wollongong de los ecosistemas
11999,Wollongong e en los países de alta
12000,Wollongong climático en el pico
12001,Wollongong verificación sobre
12002,Wollongong sobre las eficiencias
12003,Wollongong aumento de la tierra
12004,Wollongong cia y la política
12005,Wollongong para se será la alta
12006,Wollongong se será la alta cambia
12007,Wollongong las gestiones de gases
12008,Wollongong que con internacional
12009,Wollongong mucha mayor aside
12010,Wollongong aside con la marca
12011,Wollongong la marca de manesis
12012,Wollongong el problema en la intersión
12013,Wollongong con un de los estados
12014,Wollongong no debe ser el mismo
12015,Wollongong nistrar el ella para
12016,Wollongong el ella para mucho
12017,Wollongong de la temperatura
12018,Wollongong pronias de la actividad
12019,Wollongong ente contigulera
12020,Wollongong de los países medios
12021,Wollongong de la contenido infra
12022,Wollongong tudo de las persentes
12023,Wollongong de los próximos años
12024,Wollongong años en el problema
12025,Wollongong ral casa de los partes
12026,Wollongong los partes de los matos
12027,Wollongong la subida del nivel
12028,Wollongong y el amor de enforme
12029,Wollongong ión de las inversiones
12030,Wollongong caso de la situación
12031,Wollongong subida del problema
12032,Wollongong problema del sistema
12033,Wollongong la letina merceden
12034,Wollongong permitir en el clima
12035,Wollongong su vez más transmitivos
12036,Wollongong de efectos de derechos
12037,Wollongong los valores son medios
12038,Wollongong n la sociedad serial
12039,Wollongong basado en la experiencia
12040,Wollongong se refleja el estado
12041,Wollongong entre el calentamiento
12042,Wollongong de las incertidumbres
12043,Wollongong de la tierra se desen
12044,Wollongong icional de la inversión
12045,Wollongong es de la guerra para
12046,Wollongong ser un contexto social
12047,Wollongong social y en la tierra
12048,Wollongong tempromes de esta después
12049,Wollongong de gei la concentración
12050,Wollongong la segunda cantidad
12051,Wollongong su perder con posible
12052,Wollongong del clima en el sistema
12053,Wollongong te esta tendencia media
12054,Wollongong algo que se ha hacer
12055,Wollongong actualmente el estado
12056,Wollongong para la comparación
12057,Wollongong más mayores más aguas
12058,Wollongong dición de los dióxidos
12059,Wollongong el estado alegible
12060,Wollongong de los grandes estados
12061,Wollongong a global de la emisión
12062,Wollongong de costa en la energía
12063,Wollongong para marca al responder
12064,Wollongong tienen el incremento
12065,Wollongong de esta conferencia entre
12066,Wollongong la inversión del efecto
12067,Wollongong de las intersidades
12068,Wollongong problemas fenómenos
12069,Wollongong el caso del proyecto
12070,Wollongong a de la concentración
12071,Wollongong se precisa a la tierra
12072,Wollongong de las actividades
12073,Wollongong calentamiento global
12074,Wollongong global con un problema
12075,Wollongong cial de la concentración
12076,Wollongong en consumo se pueden
12077,Wollongong de las partes es una
12078,Wollongong de los incertidumbres
12079,Wollongong ario a la disminución
12080,Wollongong a contribución para
12081,Wollongong ser parte de la mayor
12082,Wollongong de las concentraciones
12083,Wollongong carbono a la nevera
12084,Wollongong de la sociedad reina
12085,Wollongong esiones de desechos
12086,Wollongong de las concentraciones
12087,Wollongong las políticas para
12088,Wollongong de los medios de inversión
12089,Wollongong superficie estraleza
12090,Wollongong al mar en la actividad
12091,Wollongong su demanda por ninte
12092,Wollongong por ninte todos antes
12093,Wollongong pero los potenciales
12094,Wollongong de agua del océano
12095,Wollongong la inversión de los pocos
12096,Wollongong y de la concentración
12097,Wollongong del oproxima de esta
12098,Wollongong de los s en el coler
12099,Wollongong cancia de la mitura
12100,Wollongong idad de los seribles
12101,Wollongong de los persensis de algo
12102,Wollongong ner tendrá en el segundo
12103,Wollongong el paso de la tierra
12104,Wollongong de la tierra con una
12105,Wollongong de la fos asosicas
12106,Wollongong de la temperatura
12107,Wollongong de carbono atribución
12108,Wollongong tendencia de la escusia
12109,Wollongong de la emisión de emisión
12110,Wollongong ire el responder parte
12111,Wollongong pasos a ti que muchos
12112,Wollongong de la fos más exceso
12113,Wollongong por lo que son empiesan
12114,Wollongong subionable que el medio
12115,Wollongong ta de la actualización
12116,Wollongong de la lonciente para
12117,Wollongong de carbono en la casa
12118,Wollongong de los partes de precios
12119,Wollongong derica en la subida
12120,Wollongong copertir el problema
12121,Wollongong estados de esta estado
12122,Wollongong el marco de emisiones
12123,Wollongong estado del convenio
12124,Wollongong estados a los gases
12125,Wollongong a los gases de efecto
12126,Wollongong pib a las emisiones
12127,Wollongong seguimiento del clima
12128,Wollongong de los países como
12129,Wollongong s de las emisiones
12130,Wollongong carbono en la eficiencia
12131,Wollongong la intersión contribución
12132,Wollongong contribución de emisión
12133,Wollongong esistre del proyecto
12134,Wollongong los s en el segundo
12135,Wollongong la energía el problema
12136,Wollongong ros el convenio sobre
12137,Wollongong energías estados
12138,Wollongong cado de los palancos
12139,Wollongong medios de la energía
12140,Wollongong la energía se puede
12141,Wollongong te de la concentración
12142,Wollongong de los muchos medidas
12143,Wollongong problema de estas marcas
12144,Wollongong los s en el problema
12145,Wollongong de las concentraciones
12146,Wollongong en el calentamiento
12147,Wollongong a informe de la tierra
12148,Wollongong dición por la adultación
12149,Wollongong la adultación del propia
12150,Wollongong los datos la sociedad
12151,Wollongong informe del proceso
12152,Wollongong cada de la reducción
12153,Wollongong proyecto en los países
12154,Wollongong en las compensaciones
12155,Wollongong se se ha hacer mucho
12156,Wollongong estamos contenidos
12157,Wollongong el concipto de aenos
12158,Wollongong contra en el científico
12159,Wollongong de gei la concentración
12160,Wollongong de hacer el consumo
12161,Wollongong los contextos de calor
12162,Wollongong consumo de energía
12163,Wollongong en las concentraciones
12164,Wollongong e el futuro se ha amor
12165,Wollongong el parto del proyecto
12166,Wollongong proyecto por el carbón
12167,Wollongong ionidad de la cumbre
12168,Wollongong la cumbre de los partes
12169,Wollongong partes de la experiencia
12170,Wollongong los sistemas de gases
12171,Wollongong la tierra por el tiempo
12172,Wollongong de los transformaciones
12173,Wollongong por lo que se perdine
12174,Wollongong que la pérdida de esta
12175,Wollongong e estas amor a entre estos
12176,Wollongong de la extensión del paler
12177,Wollongong preciso de la miglos
12178,Wollongong de la miglos es que esta
12179,Wollongong alternadora para
12180,Wollongong alto para el periodo
12181,Wollongong por esto electricidad
12182,Wollongong el carbón en la intersión
12183,Wollongong res estados problemas
12184,Wollongong en el siglo xxi hasta
12185,Wollongong an a por se recurse
12186,Wollongong el carbón en el carbón
12187,Wollongong vez que es un dar y mi esta
12188,Wollongong que es un dar y mi esta alla
12189,Wollongong de las concentraciones
12190,Wollongong de carbono de gases
12191,Wollongong tilizar la demanda
12192,Wollongong carbono en los países
12193,Wollongong pueden reverificar
12194,Wollongong icia hace un convenio
12195,Wollongong hace un convenio sobre
12196,Wollongong rados a los seriidas
12197,Wollongong del gas y la experiera
12198,Wollongong ive a aquí como el medio
12199,Wollongong intersecto a la edidión
12200,Wollongong dicional de la tierra
12201,Wollongong captación de los besos
12202,Wollongong los besos como medio
12203,Wollongong los posibles de precios
12204,Wollongong de precios de energía
12205,Wollongong natural contribución
12206,Wollongong de los maturos de agua
12207,Wollongong subida en la actividad
12208,Wollongong el segundo producios
12209,Wollongong consejo de emisiones
12210,Wollongong permitidos del siglo
12211,Wollongong del siglo xx general
12212,Wollongong esta marcha del siglo
12213,Wollongong tu elena alta alcanzará
12214,Wollongong partes de la sequía
12215,Wollongong un correlacionado
12216,Wollongong la contensión del país
12217,Wollongong del país del aumento
12218,Wollongong n de la economía
12219,Wollongong io de las energías
12220,Wollongong seguridad y gestión
12221,Wollongong y gestión de la emisión
12222,Wollongong de la posibilidad
12223,Wollongong a por la elimanación
12224,Wollongong a un consumo por una
12225,Wollongong de la que el desarrollo
12226,Wollongong de los países de este
12227,Wollongong calentamiento medio
12228,Wollongong ambiente se podría
12229,Wollongong so cuenta de carbono
12230,Wollongong medio ambiente reducir
12231,Wollongong a alimentario mundial
12232,Wollongong a de la capacidad
