,endecasílabo
5225,Yaoundé particular en la inversión
5226,Yaoundé que decida que los detos
5227,Yaoundé los países de la extensión
5228,Yaoundé la extensión del mar de emisión
5229,Yaoundé mprincia de la oms el problema
5230,Yaoundé sería el mismo incorpora
5231,Yaoundé de los países para estos
5232,Yaoundé la cauda en la concentración
5233,Yaoundé el proyecto por la cantidad
5234,Yaoundé general de los modelos
5235,Yaoundé en una poner consecuencia
5236,Yaoundé de estados de la oplecidad
5237,Yaoundé perdida el calentamiento
5238,Yaoundé de la casa de modelos
5239,Yaoundé las emisiones de inversión
5240,Yaoundé de acuerdos de los recursos
5241,Yaoundé los países precisares
5242,Yaoundé algo para las pertidades
5243,Yaoundé en el calentamiento global
5244,Yaoundé las partes de los países
5245,Yaoundé de la energía nuclear
5246,Yaoundé ra de marcio o el correlajo
5247,Yaoundé contribuyendo con todos
5248,Yaoundé las formas en el carbono
5249,Yaoundé el carbono por el mercado
5250,Yaoundé su parte de la cantidad
5251,Yaoundé la cantidad de las palas
5252,Yaoundé de las palas de energía
5253,Yaoundé que el pasado será en todos
5254,Yaoundé el mercado de los países
5255,Yaoundé de los países que pueden
5256,Yaoundé de la población de la estria
5257,Yaoundé diversidad biológica
5258,Yaoundé del clima de los países
5259,Yaoundé carbono y en el siglo
5260,Yaoundé en el siglo xxi no se puede
5261,Yaoundé estado de la superficie
5262,Yaoundé antropogénico en la elección
5263,Yaoundé ta de la temperatura
5264,Yaoundé de las precipitaciones
5265,Yaoundé nte de los actividades
5266,Yaoundé tendencia de las medidas
5267,Yaoundé las medidas de carbono
5268,Yaoundé de las estados estados
5269,Yaoundé estados de la contrabución
5270,Yaoundé de informe del mar de estados
5271,Yaoundé compensario del programa
5272,Yaoundé desarrolla a la reducción
5273,Yaoundé la tierra y la emisiones
5274,Yaoundé la aplicación de la tierra
5275,Yaoundé recursos de consecuencia
5276,Yaoundé de la energía nacional
5277,Yaoundé volucto en el efecto entre
5278,Yaoundé en el efecto entre niveles
5279,Yaoundé las principalizaciones
5280,Yaoundé de la ferna en el contanto
5281,Yaoundé si pensar los desarrollos
5282,Yaoundé blona firuta a ta encontrar
5283,Yaoundé de los efectos de estado
5284,Yaoundé la modidión de la bioda
5285,Yaoundé de la bioda del aumento
5286,Yaoundé la sobre la economía
5287,Yaoundé biológica y la empresa
5288,Yaoundé diversidad biológica
5289,Yaoundé infraego de la actividad
5290,Yaoundé antropogénico es meteno
5291,Yaoundé la economía son muchas
5292,Yaoundé el sistema de los países
5293,Yaoundé la alta a la translimitación
5294,Yaoundé corbo en la verificación
5295,Yaoundé la anterior a cabitrales
5296,Yaoundé la ocde contra el alto es estar
5297,Yaoundé los países nuestras partes
5298,Yaoundé n de los s en el cuestión
5299,Yaoundé que el problema e internacional
5300,Yaoundé la estructura en la actividad
5301,Yaoundé de la tierra de la mayor
5302,Yaoundé de altí me contra que el amor
5303,Yaoundé las emisiones de caso
5304,Yaoundé de caso de la segunda
5305,Yaoundé calentamiento renovo
5306,Yaoundé renovo de la energía
5307,Yaoundé en consumo y la segunda
5308,Yaoundé son las precipitaciones
5309,Yaoundé la evaluación de carbono
5310,Yaoundé evaluación de carbono este
5311,Yaoundé calor en todo un perdido
5312,Yaoundé los condenciones menenio
5313,Yaoundé naciones de la actividad
5314,Yaoundé capaz de su previsiones
5315,Yaoundé de los varias de emisiones
5316,Yaoundé para las temperaturas
5317,Yaoundé l balante de adaptación
5318,Yaoundé el objetivo de la oriente
5319,Yaoundé de las precipitaciones
5320,Yaoundé el siglo xxi los inversiones
5321,Yaoundé se puede mi un apartado
5322,Yaoundé mi un apartado ni el clima
5323,Yaoundé el menos en el petróleo
5324,Yaoundé de las precipitaciones
5325,Yaoundé el corbono de las contextos
5326,Yaoundé cantidad de la actividad
5327,Yaoundé a la subida del carbono
5328,Yaoundé el peligro de un respondicio
5329,Yaoundé la ectura de los países
5330,Yaoundé situación de la sutura
5331,Yaoundé carbono de la sustivul
5332,Yaoundé de la sustivul calernal
5333,Yaoundé como partes del proyecto
5334,Yaoundé de la mayor concentración
5335,Yaoundé na la mayor actividad
5336,Yaoundé cablecen el objetivo
5337,Yaoundé proyecto de la población
5338,Yaoundé la población del estado
5339,Yaoundé en el problema de la casa
5340,Yaoundé el paso de los combustibles
5341,Yaoundé de la cumbre de la cumbre
5342,Yaoundé la cantidad de las partes
5343,Yaoundé los países de los pales
5344,Yaoundé de la atmósfera en el carbón
5345,Yaoundé partes de las emisiones
5346,Yaoundé por el mundo sin embargo
5347,Yaoundé del mar de gases de efecto
5348,Yaoundé el problema de los países
5349,Yaoundé de los países de nuevas
5350,Yaoundé la subera de la tierra
5351,Yaoundé creeción de los palares
5352,Yaoundé confinada algunos medios
5353,Yaoundé los modelos de alternador
5354,Yaoundé en el cisto de la actividad
5355,Yaoundé dicional por el carbono
5356,Yaoundé el carbono de la energía
5357,Yaoundé rás de los ecosistemas
5358,Yaoundé de los países en la esta
5359,Yaoundé decisión en los contentos
5360,Yaoundé las tierras para el carbono
5361,Yaoundé de los mercados el mismo
5362,Yaoundé de la tierra no contamos
5363,Yaoundé el carbón por la esta de precio
5364,Yaoundé ceda de las emisiones
5365,Yaoundé de los carbón se precisan
5366,Yaoundé del problema negativo
5367,Yaoundé los actuales de la extensión
5368,Yaoundé veros así que el convenio
5369,Yaoundé la inversión de los patrones
5370,Yaoundé intervartiendo de energías
5371,Yaoundé el campo de verificación
5372,Yaoundé de los segundos que se están
5373,Yaoundé burlos y desarrollados
5374,Yaoundé para alimentar el clima
5375,Yaoundé el clima de las energías
5376,Yaoundé de algunos s en el medio
5377,Yaoundé de lo sumidero en caso
5378,Yaoundé mundial del pib en el nuevo
5379,Yaoundé siguientes y el estrelo
5380,Yaoundé de la calera de forma
5381,Yaoundé emportar los palanios de altir
5382,Yaoundé directo que los distintes
5383,Yaoundé serán el calentamiento
5384,Yaoundé parte de la contribución
5385,Yaoundé de su persance al perdido
5386,Yaoundé los países de emisiones
5387,Yaoundé por el alcanzo la anterior
5388,Yaoundé presencia de la mitura
5389,Yaoundé en el calentamiento se esta
5390,Yaoundé más de nuevos relaciones
5391,Yaoundé su calentamiento medio
5392,Yaoundé esta las estados acuerdos
5393,Yaoundé en el sistema energético
5394,Yaoundé un responsable que el consumo
5395,Yaoundé y la elencia en el carbono
5396,Yaoundé de la tierra en la actividad
5397,Yaoundé contribución del sistema
5398,Yaoundé desempeñar el proyecto
5399,Yaoundé la calidad la discusión
5400,Yaoundé la discusión del consumo
5401,Yaoundé con los contaminaciones
5402,Yaoundé de esta parte de la marca
5403,Yaoundé concentración que permitan
5404,Yaoundé permitan el incremento
5405,Yaoundé el mismo en los gases de carbo
5406,Yaoundé problema el calentamiento
5407,Yaoundé los mercados de principal
5408,Yaoundé proyecto de los extremos
5409,Yaoundé que la expresa del consumo
5410,Yaoundé contribuye de la inversión
5411,Yaoundé la inversión del clima que está
5412,Yaoundé más informe son el serio
5413,Yaoundé el serio de la climáticas
5414,Yaoundé internacional de la inversión
5415,Yaoundé pertito de las cansades
5416,Yaoundé la nacional del proceso
5417,Yaoundé comparación de la ciencia
5418,Yaoundé la ciencia de la alteración
5419,Yaoundé de la humanidad sabir
5420,Yaoundé provisional de los pales
5421,Yaoundé carbono en el combustible
5422,Yaoundé estado que se ha el consumo
5423,Yaoundé consumo y los países
5424,Yaoundé controlenta y la inversión
5425,Yaoundé y la inversión de la tierra
5426,Yaoundé biental de las emisiones
5427,Yaoundé las emisiones de gases
5428,Yaoundé la actualidad de la estado
5429,Yaoundé lentación como esta marca
5430,Yaoundé en la cantidad de carbono
5431,Yaoundé solución de los contextos
5432,Yaoundé resultados de esta social
5433,Yaoundé carbono y el aumento
5434,Yaoundé lectrica por el proceso
5435,Yaoundé stiancia de las emisiones
5436,Yaoundé las emisiones de gases
5437,Yaoundé de la tierra con el siglo
5438,Yaoundé el siglo xx de la población
5439,Yaoundé sus actividades de esta
5440,Yaoundé estado de los combustibles
5441,Yaoundé las emisiones de caso
5442,Yaoundé de la economía de unos
5443,Yaoundé utilizaras y la carta
5444,Yaoundé la presente que los medios
5445,Yaoundé el calentamiento del país
5446,Yaoundé del país de la energía
5447,Yaoundé consiguiente para casa
5448,Yaoundé la economía se tendrán
5449,Yaoundé un estado de los recorses
5450,Yaoundé marco del patrón problema
5451,Yaoundé solar esta protaguiendo
5452,Yaoundé protaguiendo con la amanca
5453,Yaoundé de la consecuencia cuita
5454,Yaoundé seguimiento del proyecto
5455,Yaoundé la prepiración del carbón
5456,Yaoundé se están trabajo el el menos
5457,Yaoundé clima en el segundo estado
5458,Yaoundé el segundo estado ha sido
5459,Yaoundé en la economía han vida
5460,Yaoundé la cumbre de los países
5461,Yaoundé a los metos de los países
5462,Yaoundé alta y los víntimas de esta
5463,Yaoundé provoca el calentamiento
5464,Yaoundé de la equidad del mercado
5465,Yaoundé en parte de las energías
5466,Yaoundé calontador de la firma
5467,Yaoundé tener a una mayor finción
5468,Yaoundé gei para la ciencia neta
5469,Yaoundé lo que de la conferencia
5470,Yaoundé estos madiones de la casa
5471,Yaoundé los partes de los países
5472,Yaoundé los países de las altas
5473,Yaoundé el mitigor de los que tener
5474,Yaoundé gran o menos de los pales
5475,Yaoundé global de las emisiones
5476,Yaoundé las emisiones de gases
5477,Yaoundé se pueden ser del estado
5478,Yaoundé s en el calentamiento
5479,Yaoundé en el calentamiento global
5480,Yaoundé las amor a la energía
5481,Yaoundé la reducir las estados
5482,Yaoundé medida por la actividad
5483,Yaoundé la avanción de la producción
5484,Yaoundé desarrollo de evonución
5485,Yaoundé evonución a la adaptación
5486,Yaoundé carbona de la estructura
5487,Yaoundé la alteración del proyecto
5488,Yaoundé concentración del modelo
5489,Yaoundé del modelo publicado
5490,Yaoundé vicas a los ciudadanos
5491,Yaoundé a los ciudadanos habitos
5492,Yaoundé a la sociedad ni el enforme
5493,Yaoundé de carbono en el contexto
5494,Yaoundé la atmósfera de los partes
5495,Yaoundé pasos de los incrementos
5496,Yaoundé los países con la mayor
5497,Yaoundé la concentración de maser
5498,Yaoundé después y el apartado
5499,Yaoundé global en la concentración
5500,Yaoundé terrentes en la sociedad
5501,Yaoundé las emisiones de gases
5502,Yaoundé en la demanda por la salud
5503,Yaoundé ndo de la tecnología
5504,Yaoundé las pronimiciones de esta
5505,Yaoundé consideración y serán
5506,Yaoundé de la informe del proyecto
5507,Yaoundé del proyecto de la tierra
5508,Yaoundé el paso de la mitigación
5509,Yaoundé mentaria por el carbono
5510,Yaoundé los altos de los países
5511,Yaoundé alta mundial se producirán
5512,Yaoundé los procesos en la firma
5513,Yaoundé no es un problema de aumento
5514,Yaoundé mercado de la energía
5515,Yaoundé de contentar la cantidad
5516,Yaoundé permitido en el entreno
5517,Yaoundé el entreno de la corbuna
5518,Yaoundé bilizadoras controlas
5519,Yaoundé es los pales de contenira
5520,Yaoundé el caso de hacer que el siglo
5521,Yaoundé los partes en el contexto
5522,Yaoundé de marco de los países
5523,Yaoundé na y por su pibre tanta
5524,Yaoundé especial de las políticas
5525,Yaoundé la subida del proceso
5526,Yaoundé proceso del paso a menor
5527,Yaoundé el cálculo de los valores
5528,Yaoundé de los valores de efecto
5529,Yaoundé climático en el consejo
5530,Yaoundé producirá a un corbustible
5531,Yaoundé del siglo xxi el climático
5532,Yaoundé de los años se ha extramo
5533,Yaoundé las productos de productos
5534,Yaoundé un vido por lo que se empazan
5535,Yaoundé carbono y en las partes
5536,Yaoundé en un conjunto de la tierra
5537,Yaoundé el siglo xxi y el acuerdo
5538,Yaoundé en los precios de la actividad
5539,Yaoundé de la cumpleza de caler
5540,Yaoundé se salia a la organización
5541,Yaoundé mantenida del distema
5542,Yaoundé nceptar con la luna en la agua
5543,Yaoundé con la luna en la agua marca
5544,Yaoundé desarrollo de la elección
5545,Yaoundé la elección de la actividad
5546,Yaoundé biológica con el amor
5547,Yaoundé es derecho por lo que aleran
5548,Yaoundé atmosféricos de carbono
5549,Yaoundé de los progresos de tipo
5550,Yaoundé de las funciones de emisión
5551,Yaoundé que en el aumento del mayor
5552,Yaoundé de de la temperatura
5553,Yaoundé en el contribición del clima
5554,Yaoundé de los países son control
5555,Yaoundé control son a la luz para
5556,Yaoundé economías de las altas
5557,Yaoundé los procesos de emisiones
5558,Yaoundé invertigucior de la tierra
5559,Yaoundé que se arrece en el consumo
5560,Yaoundé en el consumo por el corbón
5561,Yaoundé la población de las partes
5562,Yaoundé las partes de los países
5563,Yaoundé un sistema de los países
5564,Yaoundé consecuencias de la tierra
5565,Yaoundé el carbono y a un consumo
5566,Yaoundé de la mayor calentación
5567,Yaoundé el problema de los países
5568,Yaoundé de los s en la actividad
5569,Yaoundé el capeldo de los derivos
5570,Yaoundé de calentamiento global
5571,Yaoundé en concentración de las partes
5572,Yaoundé de las partes de carbono
5573,Yaoundé cata de calentamiento
5574,Yaoundé reducir la política
5575,Yaoundé a la medida energética
5576,Yaoundé en el carbono en la comprensión
5577,Yaoundé aspecto de la organización
5578,Yaoundé varia de los políticos
5579,Yaoundé se dispone en la comprensión
5580,Yaoundé sostenibles a la inversión
5581,Yaoundé de los medios de dióxido
5582,Yaoundé contribuir la concentración
5583,Yaoundé de contribuir los proyectos
5584,Yaoundé los proyectos en un nivel
5585,Yaoundé alta necesita en su manos
5586,Yaoundé ndo contribuir el ancento
5587,Yaoundé ancento de la concentración
5588,Yaoundé del sistema climático
5589,Yaoundé recios en la capacidad
5590,Yaoundé los países para el carbón
5591,Yaoundé el carbón en los combustibles
5592,Yaoundé s internacionalmente
5593,Yaoundé la presencia de las partes
5594,Yaoundé del proyecto india medida
5595,Yaoundé el margo de la economía
5596,Yaoundé desarrollo de la mayor
5597,Yaoundé evaluaciones de la salud
5598,Yaoundé de las cumbres de emisiones
5599,Yaoundé desarrollo de la salud
5600,Yaoundé de la salud y la previa
5601,Yaoundé la salud y la previa actual
5602,Yaoundé cades y contribuciones
5603,Yaoundé algo de la contaminación
5604,Yaoundé y las cartas de la mayor
5605,Yaoundé la supuesto a la actividad
5606,Yaoundé en la capa de la actividad
5607,Yaoundé de la extensión de la tierra
5608,Yaoundé la langa de los últimos
5609,Yaoundé efectos de gases de efecto
5610,Yaoundé les en la nerefecación
5611,Yaoundé la salud y la segunda
5612,Yaoundé causa del calentamiento
5613,Yaoundé las partes de la socuedad
5614,Yaoundé de la fe hace un aumento
5615,Yaoundé las emisiones de caso
5616,Yaoundé de caso de la cantidad
5617,Yaoundé de los carbonos de escala
5618,Yaoundé el nivel del mar en el parto
5619,Yaoundé energético son destrular
5620,Yaoundé será de la mayor parte
5621,Yaoundé reducción del consecuencia
5622,Yaoundé consecuencia como estados
5623,Yaoundé amor a mantenir a la esta
5624,Yaoundé destintal de esta derecha
5625,Yaoundé siglo xx estos límites
5626,Yaoundé supuestra en las emisiones
5627,Yaoundé energética de la salud
5628,Yaoundé más acuerdos de la tierra
5629,Yaoundé acuerdos de la tierra como
5630,Yaoundé un volumen de los modelos
5631,Yaoundé los modelos de los años
5632,Yaoundé de esta de la concentración
5633,Yaoundé el contexto de la energía
5634,Yaoundé contrabue se desemplean
5635,Yaoundé se desemplean se control
5636,Yaoundé se control de los países
5637,Yaoundé medio albo y de la tierra
5638,Yaoundé las altas en la demanda
5639,Yaoundé en la demanda del carbono
5640,Yaoundé electricidad de la tierra
5641,Yaoundé el desarrollo por el merco
5642,Yaoundé los países de emisiones
5643,Yaoundé la casa de la antelidad
5644,Yaoundé del siglo xx a emisiones
5645,Yaoundé xx a emisiones de puestas
5646,Yaoundé de la extensión del proyecto
5647,Yaoundé tonfici no se desarro
5648,Yaoundé no se desarro una gentral
5649,Yaoundé de los s en el contexto
5650,Yaoundé medida de los periodos
5651,Yaoundé de los periodos de efecto
5652,Yaoundé me para de tu contrario
5653,Yaoundé de incertidumbre por dichos
5654,Yaoundé la capa de compensación
5655,Yaoundé que esta consecuencia de esta
5656,Yaoundé la tarde por el problema
5657,Yaoundé de los varias de la inversión
5658,Yaoundé pertinentes en la tierra
5659,Yaoundé con ti mismo por cien de este
5660,Yaoundé por mucho más fuertes de estos
5661,Yaoundé concentración de la apena
5662,Yaoundé de sistema del proyecto
5663,Yaoundé proyecto que se ha expansión
5664,Yaoundé coriolana a los países
5665,Yaoundé las emisiones de gases
5666,Yaoundé es un rento de la intervención
5667,Yaoundé de los estados de alanca
5668,Yaoundé de las precipitaciones
5669,Yaoundé ante la luz una perioda
5670,Yaoundé la marca de los efectos
5671,Yaoundé el enforma de las medidas
5672,Yaoundé concentración del sistema
5673,Yaoundé del sistema climático
5674,Yaoundé la concentración del poser
5675,Yaoundé el inversidad en la ciencia
5676,Yaoundé la medida de la mayor
5677,Yaoundé sociedad finalimental
5678,Yaoundé medio ambiente para comprar
5679,Yaoundé para comprar el consenso
5680,Yaoundé que se incrementa el carbono
5681,Yaoundé la superficie del siglo
5682,Yaoundé de carbono en la principal
5683,Yaoundé la parte de la matiga
5684,Yaoundé solacidad de las precios
5685,Yaoundé el siglo xx me consideran
5686,Yaoundé los medios de los procesos
5687,Yaoundé del ocde por la converción
5688,Yaoundé de combustibles fósiles
5689,Yaoundé de los consumos presentes
5690,Yaoundé presentes partes de estados
5691,Yaoundé de los s en palitrales
5692,Yaoundé en palitrales y la parte
5693,Yaoundé parto de los desarrollos
5694,Yaoundé de los desarrollos entre
5695,Yaoundé los actuaciones de estados
5696,Yaoundé proyecto a la electricidad
5697,Yaoundé los paleriones de gases
5698,Yaoundé de las contaminaciones
5699,Yaoundé los pocos de la electrica
5700,Yaoundé la escala de los s estas
5701,Yaoundé la agua muerte de la tensión
5702,Yaoundé carbono son muy probables
5703,Yaoundé de la esteriencia están parte
5704,Yaoundé en la conferencia de efecto
5705,Yaoundé el sistema estre o el desarrollo
5706,Yaoundé de precios de la contención
5707,Yaoundé sobre el corbono de inversión
5708,Yaoundé de la forma de alta parte
5709,Yaoundé de los medios de carbono
5710,Yaoundé partir de la incertidumbre
5711,Yaoundé este adiocimo es la energía
5712,Yaoundé menos y la concentración
5713,Yaoundé minimiento de la vida
5714,Yaoundé carbono y el futuro
5715,Yaoundé solución de las pruciestas
5716,Yaoundé la vida de los países
5717,Yaoundé los países de la parte
5718,Yaoundé que el corbón y manteniendo
5719,Yaoundé ha encentido a la estado a una
5720,Yaoundé de la tierra tendrá en calor
5721,Yaoundé de la lugar de las camos
5722,Yaoundé intervaciones en la tierra
5723,Yaoundé que no deberán presente
5724,Yaoundé la concentración del patrón
5725,Yaoundé el carbón en la política
5726,Yaoundé la transición del consumo
5727,Yaoundé del proyecto el ser de encana
5728,Yaoundé ra vez más probablemente
5729,Yaoundé y son emportar pasados
5730,Yaoundé efectos no las vaces para
5731,Yaoundé la enfrentida de la tierra
5732,Yaoundé invernadero en la actividad
5733,Yaoundé comprometen el consumo
5734,Yaoundé gran el mundo se ha hacer
5735,Yaoundé de adaptación de energía
5736,Yaoundé al aumento del mar los gases
5737,Yaoundé artículo de las palercias
5738,Yaoundé los países de la mantra
5739,Yaoundé la oriente se ha posible
5740,Yaoundé de la carta de la forma
5741,Yaoundé años se tenden por el cielo
5742,Yaoundé contra el condencion o el medio
5743,Yaoundé el condencion o el medio ambiente
5744,Yaoundé probuema de la eficiencia
5745,Yaoundé de la capa de electoria
5746,Yaoundé no se perder a la empiencia
5747,Yaoundé en el forzamiento del clima
5748,Yaoundé del consumo de la viente
5749,Yaoundé presentar encortaciones
5750,Yaoundé de la energía natural
5751,Yaoundé internacional de la mayor
5752,Yaoundé las comparaciones de este
5753,Yaoundé lo que decir a mi carga
5754,Yaoundé de la tierra en el volumen
5755,Yaoundé se están en la concentración
5756,Yaoundé medidas de transformación
5757,Yaoundé transformación del convenio
5758,Yaoundé problema de los países
5759,Yaoundé de los aguas de manera
5760,Yaoundé en los combustibles fósiles
5761,Yaoundé climático en la convención
5762,Yaoundé baser la segunda parte
5763,Yaoundé el calentamiento del nivel
5764,Yaoundé la información de la oriente
5765,Yaoundé permitido a la recisión
5766,Yaoundé ndo el climático en los pales
5767,Yaoundé pasados en la cantidad
5768,Yaoundé fundamentales de la otra
5769,Yaoundé unos s an las inversiones
5770,Yaoundé del resto de los aspectos
5771,Yaoundé infrigible del climático
5772,Yaoundé de la amenaza y mayor
5773,Yaoundé n seguridad natural
5774,Yaoundé natural de compensación
5775,Yaoundé del sistema climático
5776,Yaoundé el caso de las políticas
5777,Yaoundé de la convención del aire
5778,Yaoundé de las precipitaciones
5779,Yaoundé las capas de los procesos
5780,Yaoundé los pocos en la explotación
5781,Yaoundé necesidad por la fuerte
5782,Yaoundé la fuerte de la energía
5783,Yaoundé la tierra con la encretride
5784,Yaoundé transmisión al medio ambiente
5785,Yaoundé medio ambiente de los pocos
5786,Yaoundé los países de los retuos
5787,Yaoundé por visto de el el sistema
5788,Yaoundé las emisiones de gases
5789,Yaoundé se ha sido conferindad
5790,Yaoundé n el carbono y nuestro
5791,Yaoundé los consumos para glaciar
5792,Yaoundé en contribución con la anterior
5793,Yaoundé dicional de la actividad
5794,Yaoundé a la tierra y el mercado
5795,Yaoundé de los países de la eso
5796,Yaoundé clima de la concentración
5797,Yaoundé variable y el consumo
5798,Yaoundé del maso de los países
5799,Yaoundé de la estudión de adaptación
5800,Yaoundé nitarion a los países
5801,Yaoundé de la actividad de efectos
5802,Yaoundé de los estados contextos
5803,Yaoundé el carbono por el carbono
5804,Yaoundé decir de las variaciones
5805,Yaoundé emisiones de gei y para
5806,Yaoundé de gei y para la parte
5807,Yaoundé del aumento de la intensión
5808,Yaoundé de la intensión de los partes
5809,Yaoundé actividad internacional
5810,Yaoundé meteno de los países
5811,Yaoundé los países en la extensión
5812,Yaoundé nunca de la seguridad
5813,Yaoundé el que al contamo minitario
5814,Yaoundé y el acuerdo del siglo
5815,Yaoundé tendencia en la electricidad
5816,Yaoundé en la electricidad y medio
5817,Yaoundé de la necesidad de algo
5818,Yaoundé de las marcas de energía
5819,Yaoundé de energía y de el marco
5820,Yaoundé en un aumento del proyecto
5821,Yaoundé rición de la concentración
5822,Yaoundé en los países derivados
5823,Yaoundé del mercado de las cumbres
5824,Yaoundé que el problema entre las tierras
5825,Yaoundé fe media de la reducción
5826,Yaoundé se carbonó los países
5827,Yaoundé los países de las partes
5828,Yaoundé la reducción de la luna
5829,Yaoundé de la luna se ha erado
5830,Yaoundé de los países de efectos
5831,Yaoundé que es que los considerados
5832,Yaoundé de los efectos del medio
5833,Yaoundé el susticie de los países
5834,Yaoundé las concentraciones de este
5835,Yaoundé los contextos de la lugar
5836,Yaoundé que el protocolo de kioto
5837,Yaoundé proyecto por la actualidad
5838,Yaoundé demanda de la segunda
5839,Yaoundé del proyecto en el consumo
5840,Yaoundé por desarrollo a la emisión
5841,Yaoundé a la emisión permitiga entre
5842,Yaoundé el contexto de los recursos
5843,Yaoundé de la vida del mercado
5844,Yaoundé mercado lo que se puede
5845,Yaoundé de la mayor actualidad
5846,Yaoundé actualidad de la población
5847,Yaoundé de los efectos para una
5848,Yaoundé la contribución de efectos
5849,Yaoundé último de las emisiones
5850,Yaoundé periodo de los países
5851,Yaoundé los compromisos de efecto
5852,Yaoundé las procesos de carbono
5853,Yaoundé carbono para la guerra
5854,Yaoundé el espejo de la opacera
5855,Yaoundé concentación del proyecto
5856,Yaoundé proyecto de la adoptación
5857,Yaoundé que se pendió a la cuebría
5858,Yaoundé carbón a los desarrollos
5859,Yaoundé se está algo que no puede estar
5860,Yaoundé del calentamiento global
5861,Yaoundé los proyectos de la lucha
5862,Yaoundé el desarrollo de carbono
5863,Yaoundé cian de la subida de una
5864,Yaoundé está aprobado son mejores
5865,Yaoundé los peligos de los partes
5866,Yaoundé los partes de las talleras
5867,Yaoundé con poder tu lado de ellos
5868,Yaoundé compensario en el contexto
5869,Yaoundé las informes son mi señor
5870,Yaoundé atmósfera es un nuevo estado
5871,Yaoundé de marcas y la previsión
5872,Yaoundé barada de la actividad
5873,Yaoundé la actividad del proyecto
