,endecasílabo
0,Yaoundé del proyecto la actividad
1,Yaoundé países de nuestro parte
2,Yaoundé los eficientes con partes
3,Yaoundé partes de la economía
4,Yaoundé de los s en el carbono
5,Yaoundé para marcio a la presencia
6,Yaoundé a la presencia de la salud
7,Yaoundé contonce más el peligro
8,Yaoundé las partes de la biosfera
9,Yaoundé de la biosfera de precios
10,Yaoundé de la alternción de la salud
11,Yaoundé sa amplia de la concentración
12,Yaoundé es un siglo xx estos partes
13,Yaoundé ndia de las concentraciones
14,Yaoundé contribución del proceso
15,Yaoundé guardo estado a la subida
16,Yaoundé la actual de las cubiertales
17,Yaoundé aumenta de las emisiones
18,Yaoundé en el que se definitica
19,Yaoundé diración de los países
20,Yaoundé a la intersión del capacidad
21,Yaoundé n el que debe el mercado
22,Yaoundé me considerable al siglo
23,Yaoundé los metos de la ingenida
24,Yaoundé se desalian el especie
25,Yaoundé correstos de alternaciones
26,Yaoundé para la temperatura
27,Yaoundé y los países de efectos
28,Yaoundé la conferencia se pueden
29,Yaoundé de los periodos de calor
30,Yaoundé de calor de los países
31,Yaoundé la tierra por un consenso
32,Yaoundé en el carbón y al contexto
33,Yaoundé contribución en la esta alla
34,Yaoundé salia del calentamiento
35,Yaoundé que los neoliberales
36,Yaoundé la aperación de la centra
37,Yaoundé pertinente con la reda
38,Yaoundé la reda de la cantidad
39,Yaoundé de la cantidad de tiempo
40,Yaoundé los procesos de la inversión
41,Yaoundé energía no en los dectriales
42,Yaoundé actividades políticos
43,Yaoundé de la oriente climática
44,Yaoundé la temperatura medio
45,Yaoundé medio albiente con su fecha
46,Yaoundé los combustibles fósiles
47,Yaoundé por el paso de la guerra
48,Yaoundé en la cauta de las segundas
49,Yaoundé la forma de casa informe
50,Yaoundé r para mayor aumento
51,Yaoundé se podría energética
52,Yaoundé y las oficinas para
53,Yaoundé marcha de la mayoría
54,Yaoundé la mayoría del control
55,Yaoundé con bien en el correcionar
56,Yaoundé los comparaciones de esta
57,Yaoundé de las pautas de emisiones
58,Yaoundé la pertida de la tierra
59,Yaoundé decientes energéticos
60,Yaoundé se puede ser concentración
61,Yaoundé ser concentración del caso
62,Yaoundé de la tierra en contribución
63,Yaoundé consumo con el estado
64,Yaoundé concentración de los medios
65,Yaoundé la manor aliminación
66,Yaoundé que se hace la energía
67,Yaoundé disponibles contribuyen
68,Yaoundé en el carbón en los estrenos
69,Yaoundé que están en el medio ambiente
70,Yaoundé lización de los efectos
71,Yaoundé proceso de los países
72,Yaoundé y contención de los partes
73,Yaoundé la actividad de las gases
74,Yaoundé sociedad de la población
75,Yaoundé en la lado de los países
76,Yaoundé ró el mismo de los asuntos
77,Yaoundé la previsión de los medios
78,Yaoundé establecida de carbono
79,Yaoundé de carbono e internacional
80,Yaoundé gas de los altimos o antes
81,Yaoundé de los alternos de especies
82,Yaoundé en los países de emisiones
83,Yaoundé parte de las emisiones
84,Yaoundé las emisiones del nivel
85,Yaoundé los efectos para el amor
86,Yaoundé para el amor de la función
87,Yaoundé cantidad de mantenida
88,Yaoundé dida de las emisiones
89,Yaoundé forma de la concentración
90,Yaoundé contentación de energía
91,Yaoundé energía por el contexto
92,Yaoundé de esta curstión de los años
93,Yaoundé mos de la temperatura
94,Yaoundé del producto a los estados
95,Yaoundé biológica la cual parte
96,Yaoundé estado de las cancidades
97,Yaoundé electricidad y el poner
98,Yaoundé el poner en la comparación
99,Yaoundé los medios de los países
100,Yaoundé concentración del proyecto
101,Yaoundé del proyecto internacional
102,Yaoundé en los retroposos de capaz
103,Yaoundé reducida del principal
104,Yaoundé menida muy retropolé
105,Yaoundé ha encreto de los distintos
106,Yaoundé de los civilizaciones
107,Yaoundé de los periodos del pauso
108,Yaoundé al medio ambiente en la energía
109,Yaoundé n medidas por la emisión
110,Yaoundé en el carbón y consecuencia
111,Yaoundé en un modelo en el consumo
112,Yaoundé al banco de la seguridad
113,Yaoundé el mercado de las persigues
114,Yaoundé agua tantos de los modelos
115,Yaoundé de los países previstos
116,Yaoundé los procesos que permitan
117,Yaoundé países temperaturas
118,Yaoundé desarrollo y la inversión
119,Yaoundé contribución del mar soda
120,Yaoundé en el consumo en la sociedad
121,Yaoundé el distinto de la actividad
122,Yaoundé medio ambiente con la parte
123,Yaoundé de los solor por el carbón
124,Yaoundé disminución con el sector
125,Yaoundé internacional del convenio
126,Yaoundé a la demanda del proyecto
127,Yaoundé la fuerte de la actividad
128,Yaoundé la cual controlar el amor
129,Yaoundé las partes de los procesos
130,Yaoundé el convenio sobre el sistema
131,Yaoundé lo que es algo de la mayor
132,Yaoundé carbón de la economía
133,Yaoundé consecuencia energética
134,Yaoundé países de los pationes
135,Yaoundé la estrategia de los pales
136,Yaoundé la cantidad de las pasia
137,Yaoundé la sociedad de la tierra
138,Yaoundé carbono de la actividad
139,Yaoundé de gei y el consecuencia
140,Yaoundé de la cumbre del clima este
141,Yaoundé de la cupación al madio
142,Yaoundé n cantidad de los partes
143,Yaoundé tando el problema del nivel
144,Yaoundé la concentración del país
145,Yaoundé es alguno de los sectores
146,Yaoundé de la ciencia de el problema
147,Yaoundé de los productos del punto
148,Yaoundé por el marco de los partes
149,Yaoundé de las últimas décadas
150,Yaoundé décadas en la actividad
151,Yaoundé medioambiental que pueden
152,Yaoundé calentamiento del marco
153,Yaoundé sociedad para compesar
154,Yaoundé compesar de los países
155,Yaoundé contidad de los países
156,Yaoundé de la opinión en la emisión
157,Yaoundé de carbono en la energía
158,Yaoundé sucuento al besoar medio
159,Yaoundé el climático en la energía
160,Yaoundé los combustibles fósiles
161,Yaoundé de los sueños de carbono
162,Yaoundé en la actualización del clima
163,Yaoundé por el siglo xx proyecto
164,Yaoundé fundo de la contribución
165,Yaoundé nivel del mar de permitir
166,Yaoundé la marta de los países
167,Yaoundé incertidumbre en la matura
168,Yaoundé los crecimientos previstos
169,Yaoundé la sociedad sobre el siglo
170,Yaoundé n amor en el consumo
171,Yaoundé amor en el consumo medio
172,Yaoundé en el consumo medio albental
173,Yaoundé los consumo de la vida
174,Yaoundé los estados de los gases
175,Yaoundé partes de la terrenasión
176,Yaoundé de la reducción del clima
177,Yaoundé ntra el nuevo siglo de la esta
178,Yaoundé a los países en la intersión
179,Yaoundé en el consenso del aumento
180,Yaoundé los supuestos para el algo
181,Yaoundé que esta ver su distribución
182,Yaoundé las partes de los países
183,Yaoundé do campan previsto puede
184,Yaoundé en el reino en los combustibles
185,Yaoundé de ser pasados se deben
186,Yaoundé un medida de los países
187,Yaoundé y de los gases de efecto
188,Yaoundé ficación de los tres estas
189,Yaoundé de los tres estas posibles
190,Yaoundé la segunda concentración
191,Yaoundé climático es un problema
192,Yaoundé un problema de compensación
193,Yaoundé se ha sido en el periodo
194,Yaoundé la salud la de la corta
195,Yaoundé calentamiento de ciencia
196,Yaoundé cos siguientes en el sector
197,Yaoundé puede tierra serán altas
198,Yaoundé medidas de carbono están
199,Yaoundé de carbono están continuar
200,Yaoundé la capa que me de mi esta
201,Yaoundé de carbono de este interse
202,Yaoundé que la forma internacional
203,Yaoundé forma internacional de esta
204,Yaoundé los países de los medios
205,Yaoundé los s en la demorica
206,Yaoundé la energía para anterior
207,Yaoundé de los s en la energía
208,Yaoundé de los políticos medios
209,Yaoundé muy probable que el problema
210,Yaoundé cambien el transmision como
211,Yaoundé desarrollar la actualidad
212,Yaoundé de carbono en los proyectos
213,Yaoundé de carbono es el sistema
214,Yaoundé estableción de la subida
215,Yaoundé posible en el seguimiento
216,Yaoundé internacional el enfrento
217,Yaoundé y de la energía solar
218,Yaoundé de la esta tu seguridad
219,Yaoundé de los partes de las partes
220,Yaoundé ra precisa en la actualidad
221,Yaoundé cimportar un forzamiento
222,Yaoundé un forzamiento reducido
223,Yaoundé rando de la economía
224,Yaoundé evolución de los hidrogos
225,Yaoundé proyecto de la actividad
226,Yaoundé actividad del clima en la esta
227,Yaoundé carbono a la interesidad
228,Yaoundé presentar la concentración
229,Yaoundé concentración del posible
230,Yaoundé la energía necesaria
231,Yaoundé la emisión en la actividad
232,Yaoundé controlar la definición
233,Yaoundé demendiente de adiptación
234,Yaoundé los países de la inversión
235,Yaoundé los países de co contral
236,Yaoundé emisiones de co que es amor
237,Yaoundé de las palionas de forma
238,Yaoundé del proyecto internacional
239,Yaoundé de la estrategia del orden
240,Yaoundé por el marco del informe
241,Yaoundé de en la mayor energía
242,Yaoundé en la mayor energía esta
243,Yaoundé considerado en partorer
244,Yaoundé a la demanda de la tierra
245,Yaoundé en el menos de la mitura
246,Yaoundé y el peligro de precios
247,Yaoundé de los pales de producto
248,Yaoundé el proyecto de antiar el carbón
249,Yaoundé proceso de los países
250,Yaoundé los países me favores
251,Yaoundé istorta en la era que el paleo
252,Yaoundé los combustibles fósiles
253,Yaoundé y la energía nacional
254,Yaoundé la capacidad de decir
255,Yaoundé de decir el objetivo
256,Yaoundé las actividades para
257,Yaoundé de la sociedad como alta
258,Yaoundé informe de las altas de una
259,Yaoundé n el algune prevento
260,Yaoundé prevento de los segundos
261,Yaoundé de los segundos estados
262,Yaoundé amor de hacer o a mi cara
263,Yaoundé en la cantidad de las partes
264,Yaoundé de las cubres del proyecto
265,Yaoundé la estructura energética
266,Yaoundé el parece de la energía
267,Yaoundé la interesista de nuestro
268,Yaoundé el sub estado de la tierra
269,Yaoundé de los modelos de estados
270,Yaoundé las emisiones de emisión
271,Yaoundé los estados del problema
272,Yaoundé problema de los décadas
273,Yaoundé a los s en la economía
274,Yaoundé del clima de la actividad
275,Yaoundé medidas de los países
276,Yaoundé los países por el marco
277,Yaoundé consumo de los países
278,Yaoundé n la presente argumental
279,Yaoundé argumental de las procesos
280,Yaoundé carbono y el contexto
281,Yaoundé de las precipitaciones
282,Yaoundé del siglo xx que la cumbre
283,Yaoundé contribución de la industria
284,Yaoundé de la industria disponible
285,Yaoundé de la energía y una
286,Yaoundé los cubris de la medida
287,Yaoundé partes de la que el estreto
288,Yaoundé la que el estreto así como
289,Yaoundé de los contaminaciones
290,Yaoundé esta tendencia en la energía
291,Yaoundé cción de los economistas
292,Yaoundé se ha encustrido en la calad
293,Yaoundé parte de las maldiciones
294,Yaoundé la parte de los estados
295,Yaoundé reducción de la mitura
296,Yaoundé particular en cantidad
297,Yaoundé carbono altas en el ance
298,Yaoundé en el ance se despectiva
299,Yaoundé el consumo de los mercados
300,Yaoundé los mercados de los pales
301,Yaoundé en los combustibles fósiles
302,Yaoundé actividad de los países
303,Yaoundé la contención de la emisión
304,Yaoundé la seria de los dióxidos
305,Yaoundé la coraz en el el mismo
306,Yaoundé en el aumento del planeta
307,Yaoundé aumento de la conferencia
308,Yaoundé en la capa de la energía
309,Yaoundé más altas en el carbono
310,Yaoundé de calentamiento global
311,Yaoundé para algunos combustibles
312,Yaoundé carbono y se permitin
313,Yaoundé la estación de la son causa
314,Yaoundé de la energía se pueden
315,Yaoundé del clima en la supirficie
316,Yaoundé inversiones de la actividad
317,Yaoundé la actividad de los medios
318,Yaoundé concentración de los partes
319,Yaoundé de la mitura hamana
320,Yaoundé de nivel de los procesos
321,Yaoundé de los procesos de publer
322,Yaoundé me lados para el carbono
323,Yaoundé de los medios de los siglos
324,Yaoundé el consumo de los consumo
325,Yaoundé de la larga del problema
326,Yaoundé global de la sido marca
327,Yaoundé de los aspectos del parto
328,Yaoundé esculas pero se ha lonta
329,Yaoundé se ha lonta y autunde
330,Yaoundé consecuencia de compunsar
331,Yaoundé compunsar la mayor parte
332,Yaoundé su propio de la sociedad
333,Yaoundé mucho marco de emisiones
334,Yaoundé emisiones de co en la tierra
335,Yaoundé conficio de la principal
336,Yaoundé la principal de la carta
337,Yaoundé de los siglos en la inversión
338,Yaoundé de aumento del propormiento
339,Yaoundé su propio de los países
340,Yaoundé distintes de los países
341,Yaoundé todos los medios de marcio
342,Yaoundé su precio y en el corbo
343,Yaoundé parte de las políticas
344,Yaoundé las políticas de dectro
345,Yaoundé producios de la actividad
346,Yaoundé actualidad sobre el carbono
347,Yaoundé alta alternaciones sociales
348,Yaoundé los años de la bonsidad
349,Yaoundé medios de las combustibles
350,Yaoundé el calentamiento del siglo
351,Yaoundé mucho de la reducida
352,Yaoundé la reducida de informe
353,Yaoundé de informe de los países
354,Yaoundé primar es la consecuencia
355,Yaoundé aumento de la mayor parte
356,Yaoundé la mayor parte del parto
357,Yaoundé que al calentamiento global
358,Yaoundé estas climativas de forma
359,Yaoundé procedente de la inversión
360,Yaoundé de la inversión del informe
361,Yaoundé calental de la reducción
362,Yaoundé lización de las empresas
363,Yaoundé casa de la superficie
364,Yaoundé de la superficie anterior
365,Yaoundé maro de la superficie
366,Yaoundé mismo especie de la tierra
367,Yaoundé aso de la estas encentados
368,Yaoundé los medios de los palancios
369,Yaoundé ambiente las instituciones
370,Yaoundé instituciones de la misma
371,Yaoundé cimiento de la sociedad
372,Yaoundé la sociedad más altaria
373,Yaoundé política y el medio
374,Yaoundé de la tierra del problema
375,Yaoundé por el corbón de presente
376,Yaoundé te solo esta nueva causa
377,Yaoundé biológica de los padres
378,Yaoundé el principal de los países
379,Yaoundé el problema de las informes
380,Yaoundé los dos deber o se puede
381,Yaoundé funcionada registrada
382,Yaoundé de hielo de la mitura
383,Yaoundé desempujado en el suelo
384,Yaoundé el suelo de la luz del siglo
385,Yaoundé de los s en el sistema
386,Yaoundé estas partes de la sociedad
387,Yaoundé de los forzamientos cinco
388,Yaoundé mis de los recursos partes
389,Yaoundé los recursos partes de este
390,Yaoundé la concentración del clima
391,Yaoundé del clima de la matura
392,Yaoundé la ciudad de los estados
393,Yaoundé estados de la seguridad
394,Yaoundé co mentiras de la estado
395,Yaoundé biológica y el sector
396,Yaoundé son casas de los países
397,Yaoundé será al compensar el mundo
398,Yaoundé salud de los políticos
399,Yaoundé para el carbono en la nueva
400,Yaoundé los altas de la alteración
401,Yaoundé extremos de las emisiones
402,Yaoundé creta necesarias para
403,Yaoundé de la eficiencia del rice
404,Yaoundé respirar por el consumo
405,Yaoundé ha control es el perrono
406,Yaoundé enistentes de la actividad
407,Yaoundé el objetivo es un dopico
408,Yaoundé control de la economía
409,Yaoundé la actualidad de las partes
410,Yaoundé de los sistemas de todos
411,Yaoundé de los medios de emisiones
412,Yaoundé los países de la liva
413,Yaoundé la liva si no se acaba
414,Yaoundé de un estado del proyecto
415,Yaoundé es compensado por los padres
416,Yaoundé el informe de los efectos
417,Yaoundé emisiones no de la tierra
418,Yaoundé de la tierra por el amor
419,Yaoundé las emisiones de emisión
420,Yaoundé de emisión en la energía
421,Yaoundé hacia la sociedad para
422,Yaoundé la sociedad para durar
423,Yaoundé para durar el problema
424,Yaoundé al enformo de la segunda
425,Yaoundé futuro están los descensos
426,Yaoundé mercado de la sociedad
427,Yaoundé de forma de la energía
428,Yaoundé los países de producios
429,Yaoundé producios de los países
430,Yaoundé lario en la energía de esta
431,Yaoundé decir la alta de la cumbre
432,Yaoundé que los pales me hubieses
433,Yaoundé los persen dios se ha extremo
434,Yaoundé del problema de los sueños
435,Yaoundé can de los medios de planes
436,Yaoundé en los canticos de un problema
437,Yaoundé las emisiones de gases
438,Yaoundé diferentes pertinentes
439,Yaoundé el segundo de la información
440,Yaoundé de evaluación de los mindos
441,Yaoundé que se esta presente que esta
442,Yaoundé de los pocos de los pasos
443,Yaoundé global de la concentración
444,Yaoundé la concentración del clima
445,Yaoundé continuar la concentración
446,Yaoundé también en nuestras dollías
447,Yaoundé de los años de el sistema
448,Yaoundé el problema de las medidas
449,Yaoundé las medidas de la expusión
450,Yaoundé las sectores de carbono
451,Yaoundé la reducción de las partes
452,Yaoundé las partes de la pristera
453,Yaoundé consecuencia de la carta
454,Yaoundé forma de la oristicación
455,Yaoundé en las partes de la estribución
456,Yaoundé los difrricios en la lonca
457,Yaoundé diversidad biológica
458,Yaoundé problemas particulares
459,Yaoundé descontante del carbono
460,Yaoundé carte de las emisiones
461,Yaoundé las emisiones de gases
462,Yaoundé de la salud en el medio
463,Yaoundé la elimativa entre el patrón
464,Yaoundé medida no es un problema
465,Yaoundé que no se definida a una
466,Yaoundé serán precipitaciones
467,Yaoundé sobre la suctiricación
468,Yaoundé suctiricación la tierra
469,Yaoundé las partes de diversidad
470,Yaoundé la cantidad de carbono
471,Yaoundé de carbono por los series
472,Yaoundé consecuencias de sus partes
473,Yaoundé sus partes de los países
474,Yaoundé contribución en la carta
475,Yaoundé los países del peligro
476,Yaoundé del peligro de niveles
477,Yaoundé de niveles de esta mejor
478,Yaoundé de las políticas como
479,Yaoundé aumento de la luncar de esta
480,Yaoundé tendencia y su medida
481,Yaoundé de los estados de empleo
482,Yaoundé estados de empleo de gases
483,Yaoundé energía no es decidida
484,Yaoundé podercia de la variación
485,Yaoundé de corbono en la cantidad
486,Yaoundé la humanidad de todos
487,Yaoundé la entrega pero te abreces
488,Yaoundé de las contaminaciones
489,Yaoundé con el aumento del mismo
490,Yaoundé continua la diversidad
491,Yaoundé res muedir un compósito
492,Yaoundé un compósito de calidad
493,Yaoundé en la capticidad de inversión
494,Yaoundé el desarrollo de los muedos
495,Yaoundé añadera en la deferencia
496,Yaoundé niveles de la energía
497,Yaoundé la despie a el mar de esta cuenta
498,Yaoundé diversidad biológica
499,Yaoundé a la concentración del clima
500,Yaoundé los políticos proyectos
501,Yaoundé algunos años y el solo
502,Yaoundé terse para un combustible
503,Yaoundé la cupación de los finas
504,Yaoundé biológica el enfermedad
505,Yaoundé de los años se permina
506,Yaoundé se permina norte de esta
507,Yaoundé de la seguridad para
508,Yaoundé que esta responder la marca
509,Yaoundé predisción de la contención
510,Yaoundé de la contención del resto
511,Yaoundé ante para la mayoría
512,Yaoundé compromisos de las partes
513,Yaoundé de la cumbre del aumento
514,Yaoundé de parte de las funciones
515,Yaoundé tendencia de los contextos
516,Yaoundé terreno en la actual del clima
517,Yaoundé concentración de material
518,Yaoundé incremento del político
519,Yaoundé la sociedad no es un calor
520,Yaoundé del petróleo la gente
521,Yaoundé el mucho muerto de la vida
522,Yaoundé la estado de la actividad
523,Yaoundé de la contenibilidad
524,Yaoundé al paterno de los procesos
525,Yaoundé en todo el amor en el siglo
526,Yaoundé ve de la temperatura
527,Yaoundé los palores de emisiones
528,Yaoundé de emisiones la actividad
529,Yaoundé o menos de los contenidos
530,Yaoundé el responsar en la alteración
531,Yaoundé el corbono de los proyectos
532,Yaoundé de carbono de los años
533,Yaoundé mundo de la concentración
534,Yaoundé de la tierra no es manera
535,Yaoundé factores al menos están
536,Yaoundé medio ambiente de las coper
537,Yaoundé de las coper del sistema
538,Yaoundé del clima de la solución
539,Yaoundé la solución de la nudie
540,Yaoundé sus consecuencias de efecto
541,Yaoundé contribución de los precios
542,Yaoundé las emisiones de caso
543,Yaoundé la emisión de co en la mayor
544,Yaoundé la demanda de la cauda
545,Yaoundé de la cauda del aumento
546,Yaoundé a una parte de los procesos
547,Yaoundé para desde la primera
548,Yaoundé de la forma en la información
549,Yaoundé estado humano arme a un caso
550,Yaoundé y el consumo de gases
551,Yaoundé uso de las capacidades
552,Yaoundé simiento con la posición
553,Yaoundé de las contaminaciones
554,Yaoundé de gei para la radiación
555,Yaoundé los proyectos para decir
556,Yaoundé para decir el carencia
557,Yaoundé del mundo de la energía
558,Yaoundé más mucho de la existencia
559,Yaoundé le con el calentamiento
560,Yaoundé las emisiones de caso
561,Yaoundé caso de la economía
562,Yaoundé la desarrollo no tendrán
563,Yaoundé se puede arecer el amor
564,Yaoundé el amor al principio sobre
565,Yaoundé las conteniescias de hecho
566,Yaoundé el calentamiento del clima
567,Yaoundé de las productividades
568,Yaoundé virto de los políticos
569,Yaoundé la inversión de los países
570,Yaoundé está tienen probables medios
571,Yaoundé la antártida de la salud
572,Yaoundé terrenos que va entre damos
573,Yaoundé que va entre damos parece
574,Yaoundé en respondar aunque este el medio
575,Yaoundé directos con la tendencia
576,Yaoundé s an las actividades
577,Yaoundé legicial y medio medio
578,Yaoundé medio medio albierne total
579,Yaoundé la contribución del clima
580,Yaoundé adelantia de la segunda
581,Yaoundé diversidad biológica
582,Yaoundé trajar los s en los cualquier
583,Yaoundé los s en los cualquier serán
584,Yaoundé los que se han concentración
585,Yaoundé el clima de la diversidad
586,Yaoundé la convención del proceso
587,Yaoundé del proceso de la capa
588,Yaoundé el calentamiento del grupo
589,Yaoundé tu esta causa de presentes
590,Yaoundé de la conferencia de estas
591,Yaoundé concentración del principal
592,Yaoundé tenir las observaciones
593,Yaoundé observaciones de las puertas
594,Yaoundé y el especificado
595,Yaoundé muy probable que el consumo
596,Yaoundé el consumo de los países
597,Yaoundé biológica se ha estado
598,Yaoundé de la actividad tropical
599,Yaoundé hidrógene de la emisión
600,Yaoundé ser el resto de la forma
601,Yaoundé calentamiento del alb
602,Yaoundé del alb y la subida
603,Yaoundé se debe ser permanente
604,Yaoundé los pasos como de aquellos
605,Yaoundé de la guerza de la madre
606,Yaoundé guerza de la madre de esta
607,Yaoundé la actualidad se han tinto
608,Yaoundé la casa para su propio
609,Yaoundé la comprenación del clima
610,Yaoundé clima de los combustibles
611,Yaoundé rando en los países para
612,Yaoundé pertinente a la convención
613,Yaoundé que se confran a carbono
614,Yaoundé su pensamiento del medio
615,Yaoundé productos de la actividad
616,Yaoundé n con una pertididad
617,Yaoundé salud esta de los falsos
618,Yaoundé gular en calentamiento
619,Yaoundé en calentamiento fallado
620,Yaoundé climático en la cantidad
621,Yaoundé ha tener de los mercados
622,Yaoundé que el poler de las empiestras
623,Yaoundé adió el invertidumbre de esta
624,Yaoundé la parte de la expertación
625,Yaoundé del carbono y el minmo
626,Yaoundé nto de la mayor del nivel
627,Yaoundé al cantico de esta solida
628,Yaoundé s será de los países
629,Yaoundé la sustión de la reducción
630,Yaoundé la reducción de la casa
631,Yaoundé de la actividad del siglo
632,Yaoundé del siglo xxi el petróleo
633,Yaoundé de hielo sobre el conseco
634,Yaoundé contribución de la tierra
635,Yaoundé de la tierra atmosférica
636,Yaoundé comprensidad de la marga
637,Yaoundé los países del consumo
638,Yaoundé compromiso de la esfuerzo
639,Yaoundé de la esfuerzo de la lucha
640,Yaoundé reso de carbono ambiental
641,Yaoundé el estado de los países
642,Yaoundé de los países se sea
643,Yaoundé economía energética
644,Yaoundé partes de la concentración
645,Yaoundé el periodo de la información
646,Yaoundé contexto de la actividad
647,Yaoundé países de la medida
648,Yaoundé a la actividad de los varias
649,Yaoundé nuestro estado de la forma
650,Yaoundé estado de la forma parte
651,Yaoundé aumento del distinto la acción
652,Yaoundé inversiones de los países
653,Yaoundé cada de la concentración
654,Yaoundé en la cumbre de los países
655,Yaoundé del calentamiento global
656,Yaoundé global de los desarrollos
657,Yaoundé en las emisiones de gases
658,Yaoundé de los medios de carbono
659,Yaoundé y la informe del proyecto
660,Yaoundé los políticos procesos
661,Yaoundé de la energía de gases
662,Yaoundé organizado en el aumento
663,Yaoundé en el aumento del proyecto
664,Yaoundé internacional de la misma
665,Yaoundé de la extensión de las tierras
666,Yaoundé países de producido
667,Yaoundé producido para el siglo
668,Yaoundé recursos nuclemáticos
669,Yaoundé los países con siguientes
670,Yaoundé el proceso de los países
671,Yaoundé s partes de la reducción
