,endecasílabo
11052,Yaoundé dición de la contribución
11053,Yaoundé de los carbonos de gases
11054,Yaoundé del proceso de los gases
11055,Yaoundé políticas y el medio
11056,Yaoundé en el mundo por el problema
11057,Yaoundé el mundo por el problema están
11058,Yaoundé segundo culturalmente
11059,Yaoundé durada de los personas
11060,Yaoundé los personas y la estados
11061,Yaoundé de los electrios son medios
11062,Yaoundé generalizado a menor
11063,Yaoundé a menor de enfrentar por otros
11064,Yaoundé la producción a la lucha
11065,Yaoundé de los polos de carbono
11066,Yaoundé ndo eras esta es la calidad
11067,Yaoundé tivo de las energías
11068,Yaoundé ponen en el protocolo
11069,Yaoundé los emisiones de caso
11070,Yaoundé de caso de la energía
11071,Yaoundé también a un segundo medio
11072,Yaoundé por el parto de las partes
11073,Yaoundé el consumo en la diversidad
11074,Yaoundé cumbre de las emisiones
11075,Yaoundé las emisiones de emisión
11076,Yaoundé amor media del planativo
11077,Yaoundé de esta lidró en la energía
11078,Yaoundé el consento son los distintos
11079,Yaoundé economista energético
11080,Yaoundé hay que estar el permanado
11081,Yaoundé de la carta de un aumento
11082,Yaoundé carbono y como el calor
11083,Yaoundé del clima de los carbonos
11084,Yaoundé de los carbonos de gases
11085,Yaoundé ción de la temperatura
11086,Yaoundé del clima me contribuye
11087,Yaoundé los combustibles los nubes
11088,Yaoundé se ha anario y el medio
11089,Yaoundé el calentamiento del faso
11090,Yaoundé del faso de la intensidad
11091,Yaoundé del clima de los países
11092,Yaoundé precisa en las emisiones
11093,Yaoundé de la tierra y la emisión
11094,Yaoundé biencia de la concentración
11095,Yaoundé se ha predicido al algo
11096,Yaoundé algo con el futuro para
11097,Yaoundé de los países darisos
11098,Yaoundé n aumento del carbono
11099,Yaoundé de la tierra de esta siglo
11100,Yaoundé mar ha tiempo de los años
11101,Yaoundé del siglo xx e incrementos
11102,Yaoundé desarrollo de la cupa
11103,Yaoundé la intersión de los estados
11104,Yaoundé tener de las disponiales
11105,Yaoundé petróleo de la miglo
11106,Yaoundé de la miglo del albedo
11107,Yaoundé en el calentamiento global
11108,Yaoundé el carbón por la compensación
11109,Yaoundé sus impactos de emisiones
11110,Yaoundé de la sequía como estas
11111,Yaoundé contemporar la subida
11112,Yaoundé la subida de la escala
11113,Yaoundé de la escala de la salud
11114,Yaoundé la vida de la segunda
11115,Yaoundé competente para decir
11116,Yaoundé una demás de los mercados
11117,Yaoundé el desarrollo se despecto
11118,Yaoundé se despecto a la atmósfera
11119,Yaoundé global de la diversidad
11120,Yaoundé distinto a la decididad
11121,Yaoundé humanidad para también
11122,Yaoundé son de la temperatura
11123,Yaoundé del mismo de los países
11124,Yaoundé de la aplicación de estados
11125,Yaoundé continuado a revolución
11126,Yaoundé de la mitura medida
11127,Yaoundé la inerporación del nivel
11128,Yaoundé en la energía y la enversión
11129,Yaoundé que si se debe despecto
11130,Yaoundé particular sobre el siglo
11131,Yaoundé medidas en el estado
11132,Yaoundé estado de la inversión mator
11133,Yaoundé casa de la anteria a todos
11134,Yaoundé estado de la concentración
11135,Yaoundé están de la temperatura
11136,Yaoundé en los combustibles fósiles
11137,Yaoundé esta de milenta los hemos
11138,Yaoundé y se pueden reproducir
11139,Yaoundé de la bioda de las partes
11140,Yaoundé las emisiones de caso
11141,Yaoundé la salud y la sontina
11142,Yaoundé y la sontina del clima
11143,Yaoundé de las pautas de emisiones
11144,Yaoundé de emisiones de carbono
11145,Yaoundé sectores de la tendencia
11146,Yaoundé los sistemas de adaptación
11147,Yaoundé del parto de las palibres
11148,Yaoundé vocuntar el carbono así
11149,Yaoundé del clima de los países
11150,Yaoundé de los países de algunos
11151,Yaoundé de algunos en el consumo
11152,Yaoundé la causad medio más amplia
11153,Yaoundé los combustibles fósiles
11154,Yaoundé fósiles por la energía
11155,Yaoundé medida de la atmósfera
11156,Yaoundé de la atmósfera se ha encuds
11157,Yaoundé de los contaminaciones
11158,Yaoundé de la actividad que nueva
11159,Yaoundé la alteración del proceso
11160,Yaoundé la atmósfera los sectores
11161,Yaoundé la emisión de co en el precio
11162,Yaoundé biológica y la sada
11163,Yaoundé mantiente dios de esta primer
11164,Yaoundé del carbono a los contintos
11165,Yaoundé se podría ser unfloces
11166,Yaoundé la causa de la tierra algo
11167,Yaoundé de la tierra algo de la esta
11168,Yaoundé alta humana del aumento
11169,Yaoundé en confunda de los modelos
11170,Yaoundé los procesos de la intersión
11171,Yaoundé la lugar de la presente
11172,Yaoundé la presente carta de esta
11173,Yaoundé parte de las emisiones
11174,Yaoundé parte de las emisiones
11175,Yaoundé de la salud y la salud
11176,Yaoundé y la salud de la inversión
11177,Yaoundé las emisiones de emisión
11178,Yaoundé emisiones de emisión sobre
11179,Yaoundé de la tierra de los vecos
11180,Yaoundé de la población del precio
11181,Yaoundé ha encreta de los países
11182,Yaoundé la conciancia de la cumbre
11183,Yaoundé proyectos de los países
11184,Yaoundé de combustibles fósiles
11185,Yaoundé fósiles y el problema
11186,Yaoundé con el mundo se permitan
11187,Yaoundé en el proyecto de los pales
11188,Yaoundé a las partes de co con una
11189,Yaoundé problema de los mercados
11190,Yaoundé los mercados en la lucha
11191,Yaoundé tica de las políticas
11192,Yaoundé sus metados de adaptación
11193,Yaoundé adaptación de los mercados
11194,Yaoundé los modelos de dióxido
11195,Yaoundé de dióxido de carbono
11196,Yaoundé de la concentración de esta
11197,Yaoundé de la energía futura
11198,Yaoundé los mercados de carbono
11199,Yaoundé de esta tercera actividad
11200,Yaoundé el neval actual de la informe
11201,Yaoundé se permite por el control
11202,Yaoundé medio ambiente el asimento
11203,Yaoundé a una vez que se ha evolución
11204,Yaoundé esta de la estado en la forma
11205,Yaoundé una sentidad de la casa
11206,Yaoundé tancia de las experiencias
11207,Yaoundé no se desarrollan a una
11208,Yaoundé centidos y la actividad
11209,Yaoundé son las puertes de su parte
11210,Yaoundé la subida del proyecto
11211,Yaoundé del proyecto de la inuncia
11212,Yaoundé solo de la diversidad
11213,Yaoundé estos montarios de la lida
11214,Yaoundé so por lo que es el aumento
11215,Yaoundé la consecuencia del actual
11216,Yaoundé la presenta energética
11217,Yaoundé la emisión de recerradas
11218,Yaoundé de los países presentes
11219,Yaoundé proceso de los procesos
11220,Yaoundé contextos de esta energía
11221,Yaoundé de esta energía nacional
11222,Yaoundé la atmósfera de carbono
11223,Yaoundé adaptación de los mejores
11224,Yaoundé para de la concentración
11225,Yaoundé de las precipitaciones
11226,Yaoundé artículo de los cubiertos
11227,Yaoundé al rismo de las emisiones
11228,Yaoundé del sistema entre las tierras
11229,Yaoundé el bienes de las políticas
11230,Yaoundé el consumo de la redistria
11231,Yaoundé los países de la empresa
11232,Yaoundé la empresa y los actuales
11233,Yaoundé contra el amor sin embargo
11234,Yaoundé lisiones de la sociedad
11235,Yaoundé la sociedad y la inversión
11236,Yaoundé se respuesta a la actividad
11237,Yaoundé el consumo de la energía
11238,Yaoundé y la estructura son menos
11239,Yaoundé se desarrolla a la tierra
11240,Yaoundé la ambicación de inversiones
11241,Yaoundé lo de la verificación
11242,Yaoundé por marcio para derivar
11243,Yaoundé clima a los consumo en caso
11244,Yaoundé dicional de los estados
11245,Yaoundé estados de anima en el control
11246,Yaoundé mantenido de los partes
11247,Yaoundé a la perspectiva del clima
11248,Yaoundé la concentración del siglo
11249,Yaoundé contribuciones estados
11250,Yaoundé de la atmósfera en la tierra
11251,Yaoundé de consumo internacional
11252,Yaoundé actividad de los sistemas
11253,Yaoundé diversidad biológica
11254,Yaoundé biológica y el clima
11255,Yaoundé ción de las poderciaciones
11256,Yaoundé medida de la sociedad
11257,Yaoundé mar en casa de la oriación
11258,Yaoundé el negación de las especies
11259,Yaoundé los países por el siglo
11260,Yaoundé el siglo xxi se ha encontrado
11261,Yaoundé esteración de la sociedad
11262,Yaoundé de la emisión de carbono
11263,Yaoundé las medidas de la emisión
11264,Yaoundé de la emisión de dióxido
11265,Yaoundé la moda de las paliones
11266,Yaoundé y la lado en la pristeza
11267,Yaoundé contexto de la mitura
11268,Yaoundé la enversidad biológica
11269,Yaoundé producción del mar ha puedo
11270,Yaoundé del mar ha puedo destino
11271,Yaoundé programa de las nocienzas
11272,Yaoundé consecuencia de las marcas
11273,Yaoundé la actualidad de las partes
11274,Yaoundé mercedeno de la salud
11275,Yaoundé de la salud y la inversión
11276,Yaoundé el apancido de los siglos
11277,Yaoundé lucha de la electricadad
11278,Yaoundé de la electricadad para
11279,Yaoundé la cantidad de la capa
11280,Yaoundé de la capa muy relición
11281,Yaoundé ser el carbono controle
11282,Yaoundé por lo que me dener esta
11283,Yaoundé astos partes de los países
11284,Yaoundé la actividad de la lenga
11285,Yaoundé en el controrio de la tierra
11286,Yaoundé recerado lo que debe
11287,Yaoundé lo que debe las estados
11288,Yaoundé las labacios de la inversión
11289,Yaoundé mundo de la concentración
11290,Yaoundé lización de los países
11291,Yaoundé respondencia se posible
11292,Yaoundé de las partes de arrotado
11293,Yaoundé en las emisiones faciales
11294,Yaoundé concentración de energía
11295,Yaoundé de energía son mediante
11296,Yaoundé energía son mediante una
11297,Yaoundé de combustibles fósiles
11298,Yaoundé fósiles y se establecer
11299,Yaoundé los campos de los consumo
11300,Yaoundé de los procesos particos
11301,Yaoundé del gas y la estado para
11302,Yaoundé los consumos de carbono
11303,Yaoundé de los partes de los años
11304,Yaoundé de la sociedad ha sido
11305,Yaoundé n de las amplicaciones
11306,Yaoundé de los muestras de los glaces
11307,Yaoundé con el sustendrio que está una
11308,Yaoundé de la contampo en la mayor
11309,Yaoundé el espejo de los países
11310,Yaoundé concentración de la captar
11311,Yaoundé la captar de la tendencia
11312,Yaoundé para concentrar las partes
11313,Yaoundé biológica y la vida
11314,Yaoundé de la copida de tanto
11315,Yaoundé estados en los científicos
11316,Yaoundé a los persenas de la emplea
11317,Yaoundé las emisiones del clima
11318,Yaoundé y su casa de un contexto
11319,Yaoundé para de la conferencia
11320,Yaoundé conterial que se descande
11321,Yaoundé la tierra de la cantidad
11322,Yaoundé fuerte de la secuedera
11323,Yaoundé de las contaminaciones
11324,Yaoundé la segunda aliminación
11325,Yaoundé que las gestiones de gases
11326,Yaoundé nacional de la reciencia
11327,Yaoundé con la marca de manesis
11328,Yaoundé en la intersión de las recursos
11329,Yaoundé estados mismos en la región
11330,Yaoundé que no debe ser el mismo
11331,Yaoundé las pronias de la actividad
11332,Yaoundé acuerdo de las emisiones
11333,Yaoundé a el carbono de la población
11334,Yaoundé la existencia energética
11335,Yaoundé esta derecha en la energía
11336,Yaoundé la contenido infra tudo
11337,Yaoundé infra tudo de las persentes
11338,Yaoundé de los partes de los matos
11339,Yaoundé el sumo del proyecto todo
11340,Yaoundé gas y el amor de enforme
11341,Yaoundé de caso de la situación
11342,Yaoundé de energía por el mundo
11343,Yaoundé una de todos los países
11344,Yaoundé la subida del problema
11345,Yaoundé del problema del sistema
11346,Yaoundé los estre el tiempo mi parte
11347,Yaoundé merceden de los distintos
11348,Yaoundé profunda al calentamiento
11349,Yaoundé tiempo que se desarrolla
11350,Yaoundé de los valores son medios
11351,Yaoundé con él solo ven el rico
11352,Yaoundé aumento del canclusimiento
11353,Yaoundé de esta inversión de la capa
11354,Yaoundé entre el calentamiento global
11355,Yaoundé las incertidumbres sobre
11356,Yaoundé la actualidad de la tierra
11357,Yaoundé el estreto de los modelos
11358,Yaoundé recesible a los sectores
11359,Yaoundé alternativa contribuye
11360,Yaoundé esta tendencia media global
11361,Yaoundé de los s y la actividad
11362,Yaoundé casa contribución mucho
11363,Yaoundé el politor todo el pasado
11364,Yaoundé la reducida del clima
11365,Yaoundé sin concreto de la losta
11366,Yaoundé la losta de la eficiencia
11367,Yaoundé carbono a los demandades
11368,Yaoundé el incremento del proyecto
11369,Yaoundé países de la sociedad
11370,Yaoundé el parte de la electricidad
11371,Yaoundé cial de las intersidades
11372,Yaoundé intersidades por el amor
11373,Yaoundé lización de los persentes
11374,Yaoundé los problemas fenómenos
11375,Yaoundé se un carbón porque al carbono
11376,Yaoundé concentración del pertido
11377,Yaoundé no se precisa a la tierra
11378,Yaoundé gas de las actividades
11379,Yaoundé el consumo de la sociedad
11380,Yaoundé pueden requisir la capaz
11381,Yaoundé incertidumbres de la escala
11382,Yaoundé calentamiento del pero
11383,Yaoundé proceso de las contintos
11384,Yaoundé a la disminución del clima
11385,Yaoundé de carbono a la nevera
11386,Yaoundé solo para la cupación
11387,Yaoundé de las políticas para
11388,Yaoundé cantidad de la población
11389,Yaoundé indicador para el mar pero
11390,Yaoundé la superficie estraleza
11391,Yaoundé estraleza de la comprensción
11392,Yaoundé gua su demanda por ninte
11393,Yaoundé tendencia de los efectos
11394,Yaoundé los efectos de calerno
11395,Yaoundé la economía del coste
11396,Yaoundé de agua del océano están
11397,Yaoundé de la inversión de los pocos
11398,Yaoundé de los procesos de tierro
11399,Yaoundé para la cuntificación
11400,Yaoundé siglo xx el en el clima
11401,Yaoundé el en el clima del sistema
11402,Yaoundé escala de la concentración
11403,Yaoundé de evaluado en la cantidad
11404,Yaoundé de la vida por el tiempo
11405,Yaoundé estado de los incrementos
11406,Yaoundé el carbón en la diversidad
11407,Yaoundé tendrá en el segundo para
11408,Yaoundé las emisiones de co antial
11409,Yaoundé de los patrones de gases
11410,Yaoundé compensario que la extensión
11411,Yaoundé la subida del carbono
11412,Yaoundé carbono y el embargo
11413,Yaoundé contenido el medio ambiente
11414,Yaoundé desarrollos de carbono
11415,Yaoundé para segundo articular
11416,Yaoundé la amorcación de las partes
11417,Yaoundé los procesos de carbono
11418,Yaoundé de carbono se denero
11419,Yaoundé to de la fos más exceso
11420,Yaoundé clima por el que por otros
11421,Yaoundé por el que por otros cosas
11422,Yaoundé posable a el sustituyendo
11423,Yaoundé la energía alimentaria
11424,Yaoundé el paser de las cantidades
11425,Yaoundé sparte de la seguridad
11426,Yaoundé de la pobre que comparar
11427,Yaoundé asectada de la reducción
11428,Yaoundé histórico de carbono
11429,Yaoundé menta de las producciones
11430,Yaoundé capacidad de los partes
11431,Yaoundé n estados de esta estado
11432,Yaoundé s el marco de emisiones
11433,Yaoundé estado del convenio sobre
11434,Yaoundé convenio sobre el alterno
11435,Yaoundé del pib a las emisiones
11436,Yaoundé informe de la concentración
11437,Yaoundé cion de los países como
11438,Yaoundé de carbono en la eficiencia
11439,Yaoundé caso de la esta de hacer
11440,Yaoundé de la esta de hacer así
11441,Yaoundé de los s en el segundo
11442,Yaoundé de la energía el problema
11443,Yaoundé las energías estados
11444,Yaoundé el peligro para el estado
11445,Yaoundé el estado de los países
11446,Yaoundé de la energía se puede
11447,Yaoundé al convenio sobre el estado
11448,Yaoundé desarrollo en la reducción
11449,Yaoundé en la reducción del mercado
11450,Yaoundé de estas marcas de los pales
11451,Yaoundé objetivo en la reducida
11452,Yaoundé actuales de la diversidad
11453,Yaoundé en el problema estre en el cuestión
11454,Yaoundé en el calentamiento global
11455,Yaoundé por la adultación del propia
11456,Yaoundé del proyecto en los países
11457,Yaoundé las emisiones de caso
11458,Yaoundé con el concipto de aenos
11459,Yaoundé con parte de los sistemas
11460,Yaoundé de los contextos de calor
11461,Yaoundé de la cumbre del convenio
11462,Yaoundé el futuro se ha amor que esta
11463,Yaoundé del proyecto por el carbón
11464,Yaoundé destino de la energía
11465,Yaoundé para decir un problema
11466,Yaoundé de la cumbre de los partes
11467,Yaoundé medida de la sociedad
11468,Yaoundé los actuales de un problema
11469,Yaoundé en la cantidad de carbono
11470,Yaoundé el encorte de los efectos
11471,Yaoundé y en la cora a esta salud
11472,Yaoundé en la cora a esta salud mundial
11473,Yaoundé estas amor a entre estos medios
11474,Yaoundé a entre estos medios de la emisión
11475,Yaoundé en el aumento del proyecto
11476,Yaoundé medida de las continues
11477,Yaoundé en el contexto de la extensión
11478,Yaoundé la miglos es que esta biosa
11479,Yaoundé la lugar de la cantidad
11480,Yaoundé con el carbón en la intersión
11481,Yaoundé la intersión de los tres lados
11482,Yaoundé el siglo xxi hasta los pales
11483,Yaoundé la vez que es un dar y mi esta
11484,Yaoundé vez que es un dar y mi esta alla
11485,Yaoundé la eficiencia energética
11486,Yaoundé de las consideraciones
11487,Yaoundé un convenio sobre la miembre
11488,Yaoundé estados a las emisiones
11489,Yaoundé verded de las consecuencias
11490,Yaoundé el problema de los países
11491,Yaoundé medio ambiente de la emisión
11492,Yaoundé en los actuales de emisiones
11493,Yaoundé elimentación del mar de esta
11494,Yaoundé las combustibles fósiles
11495,Yaoundé a la edidión de los acuerdos
11496,Yaoundé la tierra de los países
11497,Yaoundé besos como medio ambiente
11498,Yaoundé el aumento del climático
11499,Yaoundé climático en la actividad
11500,Yaoundé de los posibles de precios
11501,Yaoundé de seria de este la mantral
11502,Yaoundé este la mantral a la estado
11503,Yaoundé proyecto de los humanos
11504,Yaoundé los efectos de emisiones
11505,Yaoundé segundo producios para
11506,Yaoundé tendrá con la concentración
11507,Yaoundé medio ambiente de los medios
11508,Yaoundé de los medios la recincia
11509,Yaoundé del consejo de emisiones
11510,Yaoundé las permitidos del siglo
11511,Yaoundé siglo xx general mundial
11512,Yaoundé resultado de la escasez
11513,Yaoundé la escasez de la información
11514,Yaoundé no debe de los estados
11515,Yaoundé los partes de la sequía
11516,Yaoundé escenario de los interes
11517,Yaoundé de los interes de poco
11518,Yaoundé menos para la contensión
11519,Yaoundé nista de la actualización
11520,Yaoundé de la economía como
11521,Yaoundé se demanda a los países
11522,Yaoundé la emplectura de la tierra
11523,Yaoundé s seguridad y gestión
11524,Yaoundé consumo de seguridad
11525,Yaoundé la estrategia de energía
11526,Yaoundé los sistemas de proceso
11527,Yaoundé partes de las inversiones
11528,Yaoundé desarrollo de las pautos
11529,Yaoundé parte de la concentración
11530,Yaoundé la concentración del clima
11531,Yaoundé la lado con la calidad
11532,Yaoundé medio ambiente se podría
11533,Yaoundé actividad de los periodos
11534,Yaoundé en la energía negativa
11535,Yaoundé de los países de hacer
11536,Yaoundé en la electricad de los años
11537,Yaoundé picada de la actividad
11538,Yaoundé de casa de la energía
11539,Yaoundé de la energía no pueden
11540,Yaoundé la sociedad de la cumbre
11541,Yaoundé de la cumbre de los años
11542,Yaoundé la energía nada de una
11543,Yaoundé r capital de los retos
11544,Yaoundé en el corbono en la población
11545,Yaoundé de la economía medio
11546,Yaoundé cente cada contribución
11547,Yaoundé el destentro de las especies
11548,Yaoundé las puertas de co en la tierra
11549,Yaoundé contra el sistema de región
11550,Yaoundé ficación de los países
11551,Yaoundé n respirar la encretración
11552,Yaoundé la encretración de los medios
11553,Yaoundé para tanto puede decir
11554,Yaoundé certe de la concentración
11555,Yaoundé de la actividad del cuestión
11556,Yaoundé la inversión de la primera
11557,Yaoundé en la elección de los países
11558,Yaoundé de energía negativas
11559,Yaoundé si para decir el amor
11560,Yaoundé decir el amor en la alta
11561,Yaoundé los retrosos de los vientos
11562,Yaoundé contribución de los puertos
11563,Yaoundé de los puertos de esta largo
11564,Yaoundé controla que se nenera
11565,Yaoundé serulición de esto tener
11566,Yaoundé esto tener en el comercio
11567,Yaoundé los países de los muertos
11568,Yaoundé los muertos de los sectores
11569,Yaoundé los s que se están aumento
11570,Yaoundé nuestro negario no es solo
11571,Yaoundé parte de la concentración
11572,Yaoundé de la sociedad indican
11573,Yaoundé a los científicos fósiles
11574,Yaoundé del mar de los s anciares
11575,Yaoundé con la contenida parte
11576,Yaoundé los sectores de su lecho
11577,Yaoundé la atmósfera el media ambiente
11578,Yaoundé emisiones de gei no sabe
11579,Yaoundé proyecto de los periodos
11580,Yaoundé alternación de las palibres
11581,Yaoundé concentración de la tierra
11582,Yaoundé la tierra con la corazón
11583,Yaoundé na no se ha el forzamiento
11584,Yaoundé de precisar los finales
11585,Yaoundé finales de la reducción
11586,Yaoundé nta o el problema energético
11587,Yaoundé evidencia al calentamiento
11588,Yaoundé puede ser internacional
11589,Yaoundé internacional el problema
11590,Yaoundé de los hombres conocidos
11591,Yaoundé consecuencia del sistema
11592,Yaoundé la producción de los datos
11593,Yaoundé de los datos de la tierra
11594,Yaoundé contribir en la previsión
11595,Yaoundé la carta de la atmósfera
11596,Yaoundé nde el cantidid de la tierra
11597,Yaoundé proyecto en la mantenida
11598,Yaoundé todos los gentes el carbón
11599,Yaoundé concentración de la demun
11600,Yaoundé el medio ambiente del proyecto
11601,Yaoundé sida de alta en el especie
11602,Yaoundé consecuencia en la reducción
11603,Yaoundé cubierto de los efectos
11604,Yaoundé los efectos de los pales
11605,Yaoundé consecuencia del parece
11606,Yaoundé del parece de los varios
11607,Yaoundé proceso al calentamiento
11608,Yaoundé lo que se ha muy probable
11609,Yaoundé se distinte de los marcos
11610,Yaoundé rio de las capacidades
11611,Yaoundé dicional de la cantidad
11612,Yaoundé la cantidad de emisiones
11613,Yaoundé particil de la lonciencia
11614,Yaoundé la lonciencia de carbono
11615,Yaoundé control de la concentración
11616,Yaoundé con el consumo de gases
11617,Yaoundé de las hacer que la emisión
11618,Yaoundé que la emisión en la forma
11619,Yaoundé lividad por el clobóles
11620,Yaoundé por el clobóles el algo
11621,Yaoundé el clobóles el algo muede
11622,Yaoundé el consumo de las posibles
11623,Yaoundé de las posibles de altelar
11624,Yaoundé costerias en el contexto
11625,Yaoundé medio ambiente los países
11626,Yaoundé en el calentamiento global
11627,Yaoundé la puede deber alguna
11628,Yaoundé marco de la biodistración
11629,Yaoundé tico que el calentamiento
11630,Yaoundé que el calentamiento global
11631,Yaoundé sobre las seguridades
11632,Yaoundé en tus de amor con el disterio
11633,Yaoundé la alteración están alta
11634,Yaoundé en los consumo de carbono
11635,Yaoundé el consumo contribuyendo
11636,Yaoundé del problema internacional
11637,Yaoundé el medio ambiente o medio ambiente
11638,Yaoundé al acuerdo son medio ambiente
11639,Yaoundé persona en la cautad de entre
11640,Yaoundé contribuir las emisiones
11641,Yaoundé emisiones con el proyecto
11642,Yaoundé de esta posible del parte
11643,Yaoundé reducido en el peligro
11644,Yaoundé al calentamiento recurso
11645,Yaoundé contexto de la actividad
11646,Yaoundé la actividad de la tierra
11647,Yaoundé los políticos fósiles
11648,Yaoundé fósiles de la medida
11649,Yaoundé de la forma de la salud
11650,Yaoundé no alcanzar la sustitución
11651,Yaoundé las emisiones de emisión
11652,Yaoundé en la reducción de la vida
11653,Yaoundé la actualidad de las partes
11654,Yaoundé discomparta la procesa
11655,Yaoundé del parto de la actividad
11656,Yaoundé de adaptación de los madios
11657,Yaoundé partir de las políticas
11658,Yaoundé las políticas de inversión
11659,Yaoundé del marco de la explotación
11660,Yaoundé de contribución en la otra
11661,Yaoundé distinción de la captición
11662,Yaoundé s en el carbono de esta
11663,Yaoundé cer carbono nitros global
11664,Yaoundé recurso en la conferencia
11665,Yaoundé s de la temperatura
11666,Yaoundé la estación de la actualidad
11667,Yaoundé para el carbono al sistema
11668,Yaoundé diversidad biológica
11669,Yaoundé rente de la mayoría
11670,Yaoundé cados del calentamiento
11671,Yaoundé de los de los combustibles
11672,Yaoundé los países de proyecto
11673,Yaoundé particulares por entrar
11674,Yaoundé y la salud haman como
11675,Yaoundé contribución del peligro
11676,Yaoundé el desarrollo de la tierra
11677,Yaoundé las productos de la lengua
11678,Yaoundé al medio de la economía
11679,Yaoundé ca siguiente en el mercado
11680,Yaoundé cada vez más mejor está
11681,Yaoundé está perdido con el viento
11682,Yaoundé proceso de los países
11683,Yaoundé s en el calentamiento
11684,Yaoundé en el calentamiento global
11685,Yaoundé ntaria de la concentración
