,endecasílabo
0,Mamoudzou del proyecto la actividad
1,Mamoudzou países de nuestro parte
2,Mamoudzou los eficientes con partes
3,Mamoudzou partes de la economía
4,Mamoudzou de los s en el carbono
5,Mamoudzou para marcio a la presencia
6,Mamoudzou a la presencia de la salud
7,Mamoudzou contonce más el peligro
8,Mamoudzou las partes de la biosfera
9,Mamoudzou de la biosfera de precios
10,Mamoudzou de la alternción de la salud
11,Mamoudzou sa amplia de la concentración
12,Mamoudzou es un siglo xx estos partes
13,Mamoudzou ndia de las concentraciones
14,Mamoudzou contribución del proceso
15,Mamoudzou guardo estado a la subida
16,Mamoudzou la actual de las cubiertales
17,Mamoudzou aumenta de las emisiones
18,Mamoudzou en el que se definitica
19,Mamoudzou diración de los países
20,Mamoudzou a la intersión del capacidad
21,Mamoudzou n el que debe el mercado
22,Mamoudzou me considerable al siglo
23,Mamoudzou los metos de la ingenida
24,Mamoudzou se desalian el especie
25,Mamoudzou correstos de alternaciones
26,Mamoudzou para la temperatura
27,Mamoudzou y los países de efectos
28,Mamoudzou la conferencia se pueden
29,Mamoudzou de los periodos de calor
30,Mamoudzou de calor de los países
31,Mamoudzou la tierra por un consenso
32,Mamoudzou en el carbón y al contexto
33,Mamoudzou contribución en la esta alla
34,Mamoudzou salia del calentamiento
35,Mamoudzou que los neoliberales
36,Mamoudzou la aperación de la centra
37,Mamoudzou pertinente con la reda
38,Mamoudzou la reda de la cantidad
39,Mamoudzou de la cantidad de tiempo
40,Mamoudzou los procesos de la inversión
41,Mamoudzou energía no en los dectriales
42,Mamoudzou actividades políticos
43,Mamoudzou de la oriente climática
44,Mamoudzou la temperatura medio
45,Mamoudzou medio albiente con su fecha
46,Mamoudzou los combustibles fósiles
47,Mamoudzou por el paso de la guerra
48,Mamoudzou en la cauta de las segundas
49,Mamoudzou la forma de casa informe
50,Mamoudzou r para mayor aumento
51,Mamoudzou se podría energética
52,Mamoudzou y las oficinas para
53,Mamoudzou marcha de la mayoría
54,Mamoudzou la mayoría del control
55,Mamoudzou con bien en el correcionar
56,Mamoudzou los comparaciones de esta
57,Mamoudzou de las pautas de emisiones
58,Mamoudzou la pertida de la tierra
59,Mamoudzou decientes energéticos
60,Mamoudzou se puede ser concentración
61,Mamoudzou ser concentración del caso
62,Mamoudzou de la tierra en contribución
63,Mamoudzou consumo con el estado
64,Mamoudzou concentración de los medios
65,Mamoudzou la manor aliminación
66,Mamoudzou que se hace la energía
67,Mamoudzou disponibles contribuyen
68,Mamoudzou en el carbón en los estrenos
69,Mamoudzou que están en el medio ambiente
70,Mamoudzou lización de los efectos
71,Mamoudzou proceso de los países
72,Mamoudzou y contención de los partes
73,Mamoudzou la actividad de las gases
74,Mamoudzou sociedad de la población
75,Mamoudzou en la lado de los países
76,Mamoudzou ró el mismo de los asuntos
77,Mamoudzou la previsión de los medios
78,Mamoudzou establecida de carbono
79,Mamoudzou de carbono e internacional
80,Mamoudzou gas de los altimos o antes
81,Mamoudzou de los alternos de especies
82,Mamoudzou en los países de emisiones
83,Mamoudzou parte de las emisiones
84,Mamoudzou las emisiones del nivel
85,Mamoudzou los efectos para el amor
86,Mamoudzou para el amor de la función
87,Mamoudzou cantidad de mantenida
88,Mamoudzou dida de las emisiones
89,Mamoudzou forma de la concentración
90,Mamoudzou contentación de energía
91,Mamoudzou energía por el contexto
92,Mamoudzou de esta curstión de los años
93,Mamoudzou mos de la temperatura
94,Mamoudzou del producto a los estados
95,Mamoudzou biológica la cual parte
96,Mamoudzou estado de las cancidades
97,Mamoudzou electricidad y el poner
98,Mamoudzou el poner en la comparación
99,Mamoudzou los medios de los países
100,Mamoudzou concentración del proyecto
101,Mamoudzou del proyecto internacional
102,Mamoudzou en los retroposos de capaz
103,Mamoudzou reducida del principal
104,Mamoudzou menida muy retropolé
105,Mamoudzou ha encreto de los distintos
106,Mamoudzou de los civilizaciones
107,Mamoudzou de los periodos del pauso
108,Mamoudzou al medio ambiente en la energía
109,Mamoudzou n medidas por la emisión
110,Mamoudzou en el carbón y consecuencia
111,Mamoudzou en un modelo en el consumo
112,Mamoudzou al banco de la seguridad
113,Mamoudzou el mercado de las persigues
114,Mamoudzou agua tantos de los modelos
115,Mamoudzou de los países previstos
116,Mamoudzou los procesos que permitan
117,Mamoudzou países temperaturas
118,Mamoudzou desarrollo y la inversión
119,Mamoudzou contribución del mar soda
120,Mamoudzou en el consumo en la sociedad
121,Mamoudzou el distinto de la actividad
122,Mamoudzou medio ambiente con la parte
123,Mamoudzou de los solor por el carbón
124,Mamoudzou disminución con el sector
125,Mamoudzou internacional del convenio
126,Mamoudzou a la demanda del proyecto
127,Mamoudzou la fuerte de la actividad
128,Mamoudzou la cual controlar el amor
129,Mamoudzou las partes de los procesos
130,Mamoudzou el convenio sobre el sistema
131,Mamoudzou lo que es algo de la mayor
132,Mamoudzou carbón de la economía
133,Mamoudzou consecuencia energética
134,Mamoudzou países de los pationes
135,Mamoudzou la estrategia de los pales
136,Mamoudzou la cantidad de las pasia
137,Mamoudzou la sociedad de la tierra
138,Mamoudzou carbono de la actividad
139,Mamoudzou de gei y el consecuencia
140,Mamoudzou de la cumbre del clima este
141,Mamoudzou de la cupación al madio
142,Mamoudzou n cantidad de los partes
143,Mamoudzou tando el problema del nivel
144,Mamoudzou la concentración del país
145,Mamoudzou es alguno de los sectores
146,Mamoudzou de la ciencia de el problema
147,Mamoudzou de los productos del punto
148,Mamoudzou por el marco de los partes
149,Mamoudzou de las últimas décadas
150,Mamoudzou décadas en la actividad
151,Mamoudzou medioambiental que pueden
152,Mamoudzou calentamiento del marco
153,Mamoudzou sociedad para compesar
154,Mamoudzou compesar de los países
155,Mamoudzou contidad de los países
156,Mamoudzou de la opinión en la emisión
157,Mamoudzou de carbono en la energía
158,Mamoudzou sucuento al besoar medio
159,Mamoudzou el climático en la energía
160,Mamoudzou los combustibles fósiles
161,Mamoudzou de los sueños de carbono
162,Mamoudzou en la actualización del clima
163,Mamoudzou por el siglo xx proyecto
164,Mamoudzou fundo de la contribución
165,Mamoudzou nivel del mar de permitir
166,Mamoudzou la marta de los países
167,Mamoudzou incertidumbre en la matura
168,Mamoudzou los crecimientos previstos
169,Mamoudzou la sociedad sobre el siglo
170,Mamoudzou n amor en el consumo
171,Mamoudzou amor en el consumo medio
172,Mamoudzou en el consumo medio albental
173,Mamoudzou los consumo de la vida
174,Mamoudzou los estados de los gases
175,Mamoudzou partes de la terrenasión
176,Mamoudzou de la reducción del clima
177,Mamoudzou ntra el nuevo siglo de la esta
178,Mamoudzou a los países en la intersión
179,Mamoudzou en el consenso del aumento
180,Mamoudzou los supuestos para el algo
181,Mamoudzou que esta ver su distribución
182,Mamoudzou las partes de los países
183,Mamoudzou do campan previsto puede
184,Mamoudzou en el reino en los combustibles
185,Mamoudzou de ser pasados se deben
186,Mamoudzou un medida de los países
187,Mamoudzou y de los gases de efecto
188,Mamoudzou ficación de los tres estas
189,Mamoudzou de los tres estas posibles
190,Mamoudzou la segunda concentración
191,Mamoudzou climático es un problema
192,Mamoudzou un problema de compensación
193,Mamoudzou se ha sido en el periodo
194,Mamoudzou la salud la de la corta
195,Mamoudzou calentamiento de ciencia
196,Mamoudzou cos siguientes en el sector
197,Mamoudzou puede tierra serán altas
198,Mamoudzou medidas de carbono están
199,Mamoudzou de carbono están continuar
200,Mamoudzou la capa que me de mi esta
201,Mamoudzou de carbono de este interse
202,Mamoudzou que la forma internacional
203,Mamoudzou forma internacional de esta
204,Mamoudzou los países de los medios
205,Mamoudzou los s en la demorica
206,Mamoudzou la energía para anterior
207,Mamoudzou de los s en la energía
208,Mamoudzou de los políticos medios
209,Mamoudzou muy probable que el problema
210,Mamoudzou cambien el transmision como
211,Mamoudzou desarrollar la actualidad
212,Mamoudzou de carbono en los proyectos
213,Mamoudzou de carbono es el sistema
214,Mamoudzou estableción de la subida
215,Mamoudzou posible en el seguimiento
216,Mamoudzou internacional el enfrento
217,Mamoudzou y de la energía solar
218,Mamoudzou de la esta tu seguridad
219,Mamoudzou de los partes de las partes
220,Mamoudzou ra precisa en la actualidad
221,Mamoudzou cimportar un forzamiento
222,Mamoudzou un forzamiento reducido
223,Mamoudzou rando de la economía
224,Mamoudzou evolución de los hidrogos
225,Mamoudzou proyecto de la actividad
226,Mamoudzou actividad del clima en la esta
227,Mamoudzou carbono a la interesidad
228,Mamoudzou presentar la concentración
229,Mamoudzou concentración del posible
230,Mamoudzou la energía necesaria
231,Mamoudzou la emisión en la actividad
232,Mamoudzou controlar la definición
233,Mamoudzou demendiente de adiptación
234,Mamoudzou los países de la inversión
235,Mamoudzou los países de co contral
236,Mamoudzou emisiones de co que es amor
237,Mamoudzou de las palionas de forma
238,Mamoudzou del proyecto internacional
239,Mamoudzou de la estrategia del orden
240,Mamoudzou por el marco del informe
241,Mamoudzou de en la mayor energía
242,Mamoudzou en la mayor energía esta
243,Mamoudzou considerado en partorer
244,Mamoudzou a la demanda de la tierra
245,Mamoudzou en el menos de la mitura
246,Mamoudzou y el peligro de precios
247,Mamoudzou de los pales de producto
248,Mamoudzou el proyecto de antiar el carbón
249,Mamoudzou proceso de los países
250,Mamoudzou los países me favores
251,Mamoudzou istorta en la era que el paleo
252,Mamoudzou los combustibles fósiles
253,Mamoudzou y la energía nacional
254,Mamoudzou la capacidad de decir
255,Mamoudzou de decir el objetivo
256,Mamoudzou las actividades para
257,Mamoudzou de la sociedad como alta
258,Mamoudzou informe de las altas de una
259,Mamoudzou n el algune prevento
260,Mamoudzou prevento de los segundos
261,Mamoudzou de los segundos estados
262,Mamoudzou amor de hacer o a mi cara
263,Mamoudzou en la cantidad de las partes
264,Mamoudzou de las cubres del proyecto
265,Mamoudzou la estructura energética
266,Mamoudzou el parece de la energía
267,Mamoudzou la interesista de nuestro
268,Mamoudzou el sub estado de la tierra
269,Mamoudzou de los modelos de estados
270,Mamoudzou las emisiones de emisión
271,Mamoudzou los estados del problema
272,Mamoudzou problema de los décadas
273,Mamoudzou a los s en la economía
274,Mamoudzou del clima de la actividad
275,Mamoudzou medidas de los países
276,Mamoudzou los países por el marco
277,Mamoudzou consumo de los países
278,Mamoudzou n la presente argumental
279,Mamoudzou argumental de las procesos
280,Mamoudzou carbono y el contexto
281,Mamoudzou de las precipitaciones
282,Mamoudzou del siglo xx que la cumbre
283,Mamoudzou contribución de la industria
284,Mamoudzou de la industria disponible
285,Mamoudzou de la energía y una
286,Mamoudzou los cubris de la medida
287,Mamoudzou partes de la que el estreto
288,Mamoudzou la que el estreto así como
289,Mamoudzou de los contaminaciones
290,Mamoudzou esta tendencia en la energía
291,Mamoudzou cción de los economistas
292,Mamoudzou se ha encustrido en la calad
293,Mamoudzou parte de las maldiciones
294,Mamoudzou la parte de los estados
295,Mamoudzou reducción de la mitura
296,Mamoudzou particular en cantidad
297,Mamoudzou carbono altas en el ance
298,Mamoudzou en el ance se despectiva
299,Mamoudzou el consumo de los mercados
300,Mamoudzou los mercados de los pales
301,Mamoudzou en los combustibles fósiles
302,Mamoudzou actividad de los países
303,Mamoudzou la contención de la emisión
304,Mamoudzou la seria de los dióxidos
305,Mamoudzou la coraz en el el mismo
306,Mamoudzou en el aumento del planeta
307,Mamoudzou aumento de la conferencia
308,Mamoudzou en la capa de la energía
309,Mamoudzou más altas en el carbono
310,Mamoudzou de calentamiento global
311,Mamoudzou para algunos combustibles
312,Mamoudzou carbono y se permitin
313,Mamoudzou la estación de la son causa
314,Mamoudzou de la energía se pueden
315,Mamoudzou del clima en la supirficie
316,Mamoudzou inversiones de la actividad
317,Mamoudzou la actividad de los medios
318,Mamoudzou concentración de los partes
319,Mamoudzou de la mitura hamana
320,Mamoudzou de nivel de los procesos
321,Mamoudzou de los procesos de publer
322,Mamoudzou me lados para el carbono
323,Mamoudzou de los medios de los siglos
324,Mamoudzou el consumo de los consumo
325,Mamoudzou de la larga del problema
326,Mamoudzou global de la sido marca
327,Mamoudzou de los aspectos del parto
328,Mamoudzou esculas pero se ha lonta
329,Mamoudzou se ha lonta y autunde
330,Mamoudzou consecuencia de compunsar
331,Mamoudzou compunsar la mayor parte
332,Mamoudzou su propio de la sociedad
333,Mamoudzou mucho marco de emisiones
334,Mamoudzou emisiones de co en la tierra
335,Mamoudzou conficio de la principal
336,Mamoudzou la principal de la carta
337,Mamoudzou de los siglos en la inversión
338,Mamoudzou de aumento del propormiento
339,Mamoudzou su propio de los países
340,Mamoudzou distintes de los países
341,Mamoudzou todos los medios de marcio
342,Mamoudzou su precio y en el corbo
343,Mamoudzou parte de las políticas
344,Mamoudzou las políticas de dectro
345,Mamoudzou producios de la actividad
346,Mamoudzou actualidad sobre el carbono
347,Mamoudzou alta alternaciones sociales
348,Mamoudzou los años de la bonsidad
349,Mamoudzou medios de las combustibles
350,Mamoudzou el calentamiento del siglo
351,Mamoudzou mucho de la reducida
352,Mamoudzou la reducida de informe
353,Mamoudzou de informe de los países
354,Mamoudzou primar es la consecuencia
355,Mamoudzou aumento de la mayor parte
356,Mamoudzou la mayor parte del parto
357,Mamoudzou que al calentamiento global
358,Mamoudzou estas climativas de forma
359,Mamoudzou procedente de la inversión
360,Mamoudzou de la inversión del informe
361,Mamoudzou calental de la reducción
362,Mamoudzou lización de las empresas
363,Mamoudzou casa de la superficie
364,Mamoudzou de la superficie anterior
365,Mamoudzou maro de la superficie
366,Mamoudzou mismo especie de la tierra
367,Mamoudzou aso de la estas encentados
368,Mamoudzou los medios de los palancios
369,Mamoudzou ambiente las instituciones
370,Mamoudzou instituciones de la misma
371,Mamoudzou cimiento de la sociedad
372,Mamoudzou la sociedad más altaria
373,Mamoudzou política y el medio
374,Mamoudzou de la tierra del problema
375,Mamoudzou por el corbón de presente
376,Mamoudzou te solo esta nueva causa
377,Mamoudzou biológica de los padres
378,Mamoudzou el principal de los países
379,Mamoudzou el problema de las informes
380,Mamoudzou los dos deber o se puede
381,Mamoudzou funcionada registrada
382,Mamoudzou de hielo de la mitura
383,Mamoudzou desempujado en el suelo
384,Mamoudzou el suelo de la luz del siglo
385,Mamoudzou de los s en el sistema
386,Mamoudzou estas partes de la sociedad
387,Mamoudzou de los forzamientos cinco
388,Mamoudzou mis de los recursos partes
389,Mamoudzou los recursos partes de este
390,Mamoudzou la concentración del clima
391,Mamoudzou del clima de la matura
392,Mamoudzou la ciudad de los estados
393,Mamoudzou estados de la seguridad
394,Mamoudzou co mentiras de la estado
395,Mamoudzou biológica y el sector
396,Mamoudzou son casas de los países
397,Mamoudzou será al compensar el mundo
398,Mamoudzou salud de los políticos
399,Mamoudzou para el carbono en la nueva
400,Mamoudzou los altas de la alteración
401,Mamoudzou extremos de las emisiones
402,Mamoudzou creta necesarias para
403,Mamoudzou de la eficiencia del rice
404,Mamoudzou respirar por el consumo
405,Mamoudzou ha control es el perrono
406,Mamoudzou enistentes de la actividad
407,Mamoudzou el objetivo es un dopico
408,Mamoudzou control de la economía
409,Mamoudzou la actualidad de las partes
410,Mamoudzou de los sistemas de todos
411,Mamoudzou de los medios de emisiones
412,Mamoudzou los países de la liva
413,Mamoudzou la liva si no se acaba
414,Mamoudzou de un estado del proyecto
415,Mamoudzou es compensado por los padres
416,Mamoudzou el informe de los efectos
417,Mamoudzou emisiones no de la tierra
418,Mamoudzou de la tierra por el amor
419,Mamoudzou las emisiones de emisión
420,Mamoudzou de emisión en la energía
421,Mamoudzou hacia la sociedad para
422,Mamoudzou la sociedad para durar
423,Mamoudzou para durar el problema
424,Mamoudzou al enformo de la segunda
425,Mamoudzou futuro están los descensos
426,Mamoudzou mercado de la sociedad
427,Mamoudzou de forma de la energía
428,Mamoudzou los países de producios
429,Mamoudzou producios de los países
430,Mamoudzou lario en la energía de esta
431,Mamoudzou decir la alta de la cumbre
432,Mamoudzou que los pales me hubieses
433,Mamoudzou los persen dios se ha extremo
434,Mamoudzou del problema de los sueños
435,Mamoudzou can de los medios de planes
436,Mamoudzou en los canticos de un problema
437,Mamoudzou las emisiones de gases
438,Mamoudzou diferentes pertinentes
439,Mamoudzou el segundo de la información
440,Mamoudzou de evaluación de los mindos
441,Mamoudzou que se esta presente que esta
442,Mamoudzou de los pocos de los pasos
443,Mamoudzou global de la concentración
444,Mamoudzou la concentración del clima
445,Mamoudzou continuar la concentración
446,Mamoudzou también en nuestras dollías
447,Mamoudzou de los años de el sistema
448,Mamoudzou el problema de las medidas
449,Mamoudzou las medidas de la expusión
450,Mamoudzou las sectores de carbono
451,Mamoudzou la reducción de las partes
452,Mamoudzou las partes de la pristera
453,Mamoudzou consecuencia de la carta
454,Mamoudzou forma de la oristicación
455,Mamoudzou en las partes de la estribución
456,Mamoudzou los difrricios en la lonca
457,Mamoudzou diversidad biológica
458,Mamoudzou problemas particulares
459,Mamoudzou descontante del carbono
460,Mamoudzou carte de las emisiones
461,Mamoudzou las emisiones de gases
462,Mamoudzou de la salud en el medio
463,Mamoudzou la elimativa entre el patrón
464,Mamoudzou medida no es un problema
465,Mamoudzou que no se definida a una
466,Mamoudzou serán precipitaciones
467,Mamoudzou sobre la suctiricación
468,Mamoudzou suctiricación la tierra
469,Mamoudzou las partes de diversidad
470,Mamoudzou la cantidad de carbono
471,Mamoudzou de carbono por los series
472,Mamoudzou consecuencias de sus partes
473,Mamoudzou sus partes de los países
474,Mamoudzou contribución en la carta
475,Mamoudzou los países del peligro
476,Mamoudzou del peligro de niveles
477,Mamoudzou de niveles de esta mejor
478,Mamoudzou de las políticas como
479,Mamoudzou aumento de la luncar de esta
480,Mamoudzou tendencia y su medida
481,Mamoudzou de los estados de empleo
482,Mamoudzou estados de empleo de gases
483,Mamoudzou energía no es decidida
484,Mamoudzou podercia de la variación
485,Mamoudzou de corbono en la cantidad
486,Mamoudzou la humanidad de todos
487,Mamoudzou la entrega pero te abreces
488,Mamoudzou de las contaminaciones
489,Mamoudzou con el aumento del mismo
490,Mamoudzou continua la diversidad
491,Mamoudzou res muedir un compósito
492,Mamoudzou un compósito de calidad
493,Mamoudzou en la capticidad de inversión
494,Mamoudzou el desarrollo de los muedos
495,Mamoudzou añadera en la deferencia
496,Mamoudzou niveles de la energía
497,Mamoudzou la despie a el mar de esta cuenta
498,Mamoudzou diversidad biológica
499,Mamoudzou a la concentración del clima
500,Mamoudzou los políticos proyectos
501,Mamoudzou algunos años y el solo
502,Mamoudzou terse para un combustible
503,Mamoudzou la cupación de los finas
504,Mamoudzou biológica el enfermedad
505,Mamoudzou de los años se permina
506,Mamoudzou se permina norte de esta
507,Mamoudzou de la seguridad para
508,Mamoudzou que esta responder la marca
509,Mamoudzou predisción de la contención
510,Mamoudzou de la contención del resto
511,Mamoudzou ante para la mayoría
512,Mamoudzou compromisos de las partes
513,Mamoudzou de la cumbre del aumento
514,Mamoudzou de parte de las funciones
515,Mamoudzou tendencia de los contextos
516,Mamoudzou terreno en la actual del clima
517,Mamoudzou concentración de material
518,Mamoudzou incremento del político
519,Mamoudzou la sociedad no es un calor
520,Mamoudzou del petróleo la gente
521,Mamoudzou el mucho muerto de la vida
522,Mamoudzou la estado de la actividad
523,Mamoudzou de la contenibilidad
524,Mamoudzou al paterno de los procesos
525,Mamoudzou en todo el amor en el siglo
526,Mamoudzou ve de la temperatura
527,Mamoudzou los palores de emisiones
528,Mamoudzou de emisiones la actividad
529,Mamoudzou o menos de los contenidos
530,Mamoudzou el responsar en la alteración
531,Mamoudzou el corbono de los proyectos
532,Mamoudzou de carbono de los años
533,Mamoudzou mundo de la concentración
534,Mamoudzou de la tierra no es manera
535,Mamoudzou factores al menos están
536,Mamoudzou medio ambiente de las coper
537,Mamoudzou de las coper del sistema
538,Mamoudzou del clima de la solución
539,Mamoudzou la solución de la nudie
540,Mamoudzou sus consecuencias de efecto
541,Mamoudzou contribución de los precios
542,Mamoudzou las emisiones de caso
543,Mamoudzou la emisión de co en la mayor
544,Mamoudzou la demanda de la cauda
545,Mamoudzou de la cauda del aumento
546,Mamoudzou a una parte de los procesos
547,Mamoudzou para desde la primera
548,Mamoudzou de la forma en la información
549,Mamoudzou estado humano arme a un caso
550,Mamoudzou y el consumo de gases
551,Mamoudzou uso de las capacidades
552,Mamoudzou simiento con la posición
553,Mamoudzou de las contaminaciones
554,Mamoudzou de gei para la radiación
555,Mamoudzou los proyectos para decir
556,Mamoudzou para decir el carencia
557,Mamoudzou del mundo de la energía
558,Mamoudzou más mucho de la existencia
559,Mamoudzou le con el calentamiento
560,Mamoudzou las emisiones de caso
561,Mamoudzou caso de la economía
562,Mamoudzou la desarrollo no tendrán
563,Mamoudzou se puede arecer el amor
564,Mamoudzou el amor al principio sobre
565,Mamoudzou las conteniescias de hecho
566,Mamoudzou el calentamiento del clima
567,Mamoudzou de las productividades
568,Mamoudzou virto de los políticos
569,Mamoudzou la inversión de los países
570,Mamoudzou está tienen probables medios
571,Mamoudzou la antártida de la salud
572,Mamoudzou terrenos que va entre damos
573,Mamoudzou que va entre damos parece
574,Mamoudzou en respondar aunque este el medio
575,Mamoudzou directos con la tendencia
576,Mamoudzou s an las actividades
577,Mamoudzou legicial y medio medio
578,Mamoudzou medio medio albierne total
579,Mamoudzou la contribución del clima
580,Mamoudzou adelantia de la segunda
581,Mamoudzou diversidad biológica
582,Mamoudzou trajar los s en los cualquier
583,Mamoudzou los s en los cualquier serán
584,Mamoudzou los que se han concentración
585,Mamoudzou el clima de la diversidad
586,Mamoudzou la convención del proceso
587,Mamoudzou del proceso de la capa
588,Mamoudzou el calentamiento del grupo
589,Mamoudzou tu esta causa de presentes
590,Mamoudzou de la conferencia de estas
591,Mamoudzou concentración del principal
592,Mamoudzou tenir las observaciones
593,Mamoudzou observaciones de las puertas
594,Mamoudzou y el especificado
595,Mamoudzou muy probable que el consumo
596,Mamoudzou el consumo de los países
597,Mamoudzou biológica se ha estado
598,Mamoudzou de la actividad tropical
599,Mamoudzou hidrógene de la emisión
600,Mamoudzou ser el resto de la forma
601,Mamoudzou calentamiento del alb
602,Mamoudzou del alb y la subida
603,Mamoudzou se debe ser permanente
604,Mamoudzou los pasos como de aquellos
605,Mamoudzou de la guerza de la madre
606,Mamoudzou guerza de la madre de esta
607,Mamoudzou la actualidad se han tinto
608,Mamoudzou la casa para su propio
609,Mamoudzou la comprenación del clima
610,Mamoudzou clima de los combustibles
611,Mamoudzou rando en los países para
612,Mamoudzou pertinente a la convención
613,Mamoudzou que se confran a carbono
614,Mamoudzou su pensamiento del medio
615,Mamoudzou productos de la actividad
616,Mamoudzou n con una pertididad
617,Mamoudzou salud esta de los falsos
618,Mamoudzou gular en calentamiento
619,Mamoudzou en calentamiento fallado
620,Mamoudzou climático en la cantidad
621,Mamoudzou ha tener de los mercados
622,Mamoudzou que el poler de las empiestras
623,Mamoudzou adió el invertidumbre de esta
624,Mamoudzou la parte de la expertación
625,Mamoudzou del carbono y el minmo
626,Mamoudzou nto de la mayor del nivel
627,Mamoudzou al cantico de esta solida
628,Mamoudzou s será de los países
629,Mamoudzou la sustión de la reducción
630,Mamoudzou la reducción de la casa
631,Mamoudzou de la actividad del siglo
632,Mamoudzou del siglo xxi el petróleo
633,Mamoudzou de hielo sobre el conseco
634,Mamoudzou contribución de la tierra
635,Mamoudzou de la tierra atmosférica
636,Mamoudzou comprensidad de la marga
637,Mamoudzou los países del consumo
638,Mamoudzou compromiso de la esfuerzo
639,Mamoudzou de la esfuerzo de la lucha
640,Mamoudzou reso de carbono ambiental
641,Mamoudzou el estado de los países
642,Mamoudzou de los países se sea
643,Mamoudzou economía energética
644,Mamoudzou partes de la concentración
645,Mamoudzou el periodo de la información
646,Mamoudzou contexto de la actividad
647,Mamoudzou países de la medida
648,Mamoudzou a la actividad de los varias
649,Mamoudzou nuestro estado de la forma
650,Mamoudzou estado de la forma parte
651,Mamoudzou aumento del distinto la acción
652,Mamoudzou inversiones de los países
653,Mamoudzou cada de la concentración
654,Mamoudzou en la cumbre de los países
